user_id,first_name,last_name,email,country_code,region_state,timezone,signup_date,acquisition_channel,marketing_campaign,device_os,app_version_at_signup,company_size,job_role,is_student,age,referred_by_user_id,consent_marketing,created_at,updated_at
U002358,Emma,Lee,emma.lee@proton.me,AU,WA,,2023-05-26 0:00,Outbound,WINTER25,Windows,1.0.9,11-50,Founder,0,unknown,,FALSE,2023-05-26 18:10,2023-11-05 18:10
U000707,Kofi,King,kofi.king@gmail.com,BR,WA,Europe/London,2023-12-27 0:00,Outbound,N/A,iOS,2.1.0,1000+,Finance,1,61,,yes,2023-12-27 10:59,2024-03-23 10:59
U000881,Nora,Wilson,nora.wilson@nexloom.io,AU,ON,,2023-11-01 0:00,Webinar,RETARGET1,iOS,2.0.0,1000+,Product,1,31,,FALSE,2023-11-01 1:49,2024-03-27 1:49
U001753,Jin,Thomas,jin.thomas@outlook.com,IN,,Asia/Tokyo,2023-02-04 0:00,Social,BF2024,iOS,1.2.1,201-500,Engineering,1,28,,FALSE,2023-02-04 1:35,2023-02-19 1:35
U002324,Chen,Walker,chen.walker@yahoo.com,MX,SP,America/New_York,2023-12-20 0:00,Social,BF2024,iOS,2.0.1,201-500,Sales,0,36,,TRUE,2023-12-20 20:29,2024-04-29 20:29
U001334,Noah,White, noah.white@proton.me ,SG,WA,America/Los_Angeles,2025-11-03 0:00,Referral,BF2024,Linux,2.1.0,11-50,Sales,0,28,,no,2025-11-03 18:38,2025-12-18 18:38
U000208,Mia,Allen,mia.allen@nexloom.io,FR,-,Asia/Tokyo,2024-06-21 0:00,Partner,SPRING24,Unknown,1.3.0,unknown,Support,1,32,,TRUE,2024-06-21 21:47,2024-09-30 21:47
U001911,Zoe,Clark,zoe.clark@company.com,AU,,,2023-12-17 0:00,Content,BF2024,Unknown,1.1.2,11-50,Marketing,0,18,,yes,2023-12-17 17:15,2024-03-06 17:15
U002557,Emma,Lopez,emma.lopez@proton.me,GB,,America/New_York,2024-04-09 0:00,Outbound,Q3_PROMO,macOS,1.3.0,1000+,Product,0,34,,TRUE,2024-04-09 6:37,2024-07-23 6:37
U001507,Omar,Lopez,omar.lopez@proton.me,za,BER,Europe/Berlin,2024-05-08 0:00,Referral,n/a,macOS,1.1.0,10-Jan,Founder,0,62,U000268,1,2024-05-08 1:35,2024-09-25 1:35
U000650,Ben,Taylor,ben.taylor@icloud.com,BR,CA,America/New_York,2024-03-28 0:00,Partner,BF2024,Linux,1.1.0,201-500,Engineering,1,40,,,2024-03-28 2:46,2024-05-16 2:46
U002130,Liam,Patel,liam.patel@icloud.com,ZA,CA,Asia/Kolkata,2024-02-21,Partner,Q3_PROMO,Windows,1.3.0,10-Jan,Support,1,19,,0,2024-02-21 11:03,2024-07-26
U000099,Chen,MARTIN,chen.martin@nexloom.io,SE,SP,,2023-03-09 0:00,Referral,WINTER25,Android,2.0.1,10-Jan,Founder,1,60,U000134,no,2023-03-09 22:39,2023-08-29 22:39
U001951,Noah,White,noah.white@outlook.com,MX,MH,Europe/London,2023-06-26 0:00,Outbound,BF2024,iOS,1.2.1,51-200,Ops,0,32,,0,2023-06-26 19:53,2023-09-19 19:53
U001542,Fatima,Lee,fatima.lee@gmail.com,SG,,America/New_York,2023-07-18 0:00,Partner,SUMMER24,Android,1.1.0,201-500,HR,0,38,,FALSE,2023-07-18 16:51,2023-10-02 16:51
U002566,Sophia,Patel,sophia.patel@outlook.com,US,CA,Europe/Berlin,2023-12-11 0:00,Partner,SPRING24,macOS,2.0.0,11-50,Finance,0,39,,yes,2023-12-11 2:24,2024-04-10 2:24
U001346,Chen,Young,chen.young@outlook.com,IN,TX,,2024-02-20 0:00,Paid Search,SUMMER24,Unknown,2.0.1,10-Jan,Product,yes,21,,FALSE,2024-02-20 2:26,2024-07-08
U000060,Elena,Allen, elena.allen@nexloom.io ,MX,BC,America/Los_Angeles,2023-07-02,Partner,BF2024,Android,2.0.0,11-50,Engineering,0,38,,,2023-07-02 7:30,2023-07-18 7:30
U000487,Priya,Smith,priya.smith@company.com,DE,NY,,2023-04-20 0:00,Webinar,N/A,iOS,2.0.0,501-1000,Marketing,0,56,,0,2023-04-20 0:56,2023-10-07 0:56
U002076,Jin,White,jin.white@outlook.com,JP,LND,Europe/London,2024-11-16,Content,BF2024,Linux,1.2.0,11-50,Product,0,27,,no,2024-11-16 4:42,2024-12-19 4:42
U000509,Kofi,Patel,kofi.patel@icloud.com,CA,TX,Asia/Tokyo,2025-03-28,Content,SPRING24,iOS,2.0.0,unknown,Ops,0,42,,1,2025-03-28 19:24,2025-04-15 19:24
U000486,Mia,Nguyen,mia.nguyen@proton.me,SE,,,2024-12-23 0:00,Partner,N/A,macOS,2.0.0,201-500,Support,0,20,,FALSE,2024-12-23 18:29,2025-04-30 18:29
U001225,Amir,White,amir.white@icloud.com,us,NSW,UTC,2024-02-17 0:00,Social,AI-LAUNCH,Windows,2.0.0,201-500,Marketing,0,62,,TRUE,2024-02-17 9:48,2024-07-02 9:48
U000517,Fatima,Taylor,fatima.taylor@proton.me,MX,LND,Asia/Kolkata,2024-01-26 0:00,Outbound,Q3_PROMO,Android,v1.1.2,1000+,Marketing,0,33,,yes,2024-01-26 22:38,2024-05-20 22:38
U002260,Hana,Moore,hana.moore@icloud.com,GB,MH,UTC,2024-02-25 0:00,Paid Search,Q3_PROMO,iOS,1.3.0,501-1000,Engineering,0,55,,FALSE,2024-02-25 10:33,2024-06-20 10:33
U002561,Ivy,Johnson,ivy.johnson@gmail.com,fr,MH,Asia/Tokyo,2024-09-09 0:00,Paid Search,N/A,Windows,1.3.0,unknown,Engineering,1,23,,TRUE,2024-09-09 5:01,0000-00-00 00:00:00
U000103,Sara,Davis,sara.davis@outlook.com,SG,CA,,12/22/2023,Referral,GROWTHLAB,Unknown,1.1.0,501-1000,Finance,0,45,,FALSE,2023-12-22 22:52,2024-01-05 22:52
U000508,Ben,Lewis,ben.lewisyahoo.com,DE,NY,UTC,2024-10-01 0:00,Referral,n/a,Android,1.0.9,51-200,Sales,0,59,U000421,FALSE,2024-10-01 22:06,2024-10-30 22:06
U000279,Omar,Garcia,omar.garcia@yahoo.com,DE,CA,UTC,2024-07-12,Outbound,SPRING24,macOS,1.2.1,10-Jan,Product,0,37,,0,2024-07-12 11:57,2024-09-22 11:57
U002221,Liam,Allen,liam.allen@icloud.com,IN,unknown,America/Los_Angeles,2024-07-13 0:00,Referral,n/a,Unknown,1.3.0,unknown,Product,1,55,U000201,Y,2024-07-13 5:55,2024-08-06
U002142,Nora,Lopez,nora.lopez@proton.me,FR,LND,America/Los_Angeles,2024-04-18 0:00,Referral,RETARGET1,Android,1.1.2,1000+,Marketing,0,35,U000162,FALSE,2024-04-18 16:52,2024-07-21 16:52
U000682,Ethan,Anderson,ethan.anderson@proton.me,NL,unknown,,2023-11-18 0:00,Paid Search,AI-LAUNCH,Windows,1.0.9,501-1000,Sales,0,53,,FALSE,2023-11-18 5:55,2024-03-31 5:55
U001468,Zoe,Martinez,zoe.martinezproton.me,IN,NSW,,2024-02-10 0:00,Webinar,WINTER25,Windows,1.2.0,51-200,HR,FALSE,35,,,2024-02-10 0:50,2024-07-05
U002066,Emma,Martin,emma.martin@company.com,MX,LND,Europe/Berlin,2024-09-03 0:00,Paid Search,BF2024,Linux,1.2.1,1000+,Finance,1,28,,,2024-09-03 7:05,2024-09-05 7:05
U001454,Sara,Davis,sara.davis@company.com,GB,CA,,2024-05-03 0:00,Content,BF2024,iOS,1.3.0,1000+,Founder,0,59,,yes,2024-05-03 3:44,2024-09-10 3:44
U000762,Fatima,Perez,fatima.perez@icloud.com,CA,WA,Asia/Kolkata,2023-12-21 0:00,Webinar,AI-LAUNCH,macOS,1.0.9,201-500,HR,0,37,,TRUE,2023-12-21 4:26,2024-03-18 4:26
U002307,Ethan,White,ethan.white@nexloom.io,NL,,,24-06-2023,Referral,N/A,Android,2.0.1,501-1000,HR,0,22,,N,2023-06-24 9:19,2023-11-10 9:19
U001555,Leo,Johnson,leo.johnson@yahoo.com,SG,RJ,Asia/Kolkata,2023-10-30 0:00,Organic Search,n/a,Linux,1.1.2,10-Jan,Engineering,1,52,,N,2023-10-30 13:39,0000-00-00 00:00:00
U000906,Amir,Smith,amir.smith@proton.me,ZA,NSW,UTC,2024-12-12 0:00,Social,BF2024,iOS,2.0.1,201-500,Finance,0,18,,TRUE,2024-12-12 6:13,2025-04-06 6:13
U001001,Sophia,Scott,sophia.scott@icloud.com,CA,MH,,2023-09-29 0:00,Organic Search,WINTER25,macOS,2.0.0,201-500,Sales,0,59,,TRUE,2023-09-29 17:35,2023-12-09 17:35
U000905,Sara,Allen,sara.allen@yahoo.com,ZA,TX,America/Los_Angeles,2024-02-18 0:00,Organic Search,WINTER25,Windows,1.3.0,201-500,Sales,1,19,,N,2024-02-18 18:42,2024-04-06 18:42
U000717,Jin,Wilson,jin.wilson@yahoo.com,NL,BER,UTC,2024-10-08 0:00,Outbound,GROWTHLAB,Windows,2.0.0,11-50,Founder,0,54,,no,2024-10-08 2:53,2024-10-13 2:53
U001675,Hana,Thompson,hana.thompson@outlook.com,MX,RJ,America/New_York,2024-09-06 0:00,Content,RETARGET1,iOS,2.1.0,11-50,Ops,0,25,,N,2024-09-06 10:09,2024-11-24 10:09
U001586,Nora,Martinez,nora.martinez@gmail.com,IN,SP,,2023-08-18 0:00,Content,RETARGET1,iOS,2.0.1,51-200,Marketing,0,31,,1,2023-08-18 10:59,2023-11-02 10:59
U001241,jin,Anderson,jin.anderson@yahoo.com,AU,-,Asia/Tokyo,2024-11-13 0:00,Social,AI-LAUNCH,Linux,1.0.9,unknown,Product,0,39,,Y,2024-11-13 4:24,0000-00-00 00:00:00
U001377,Noah,Clark,noah.clark@nexloom.io,ZA,-,America/Los_Angeles,2024-03-01 0:00,webinar,RETARGET1,macOS,1.1.2,11-50,Finance,0,50,,N,2024-03-01 18:08,2024-06-03 18:08
U001900,Omar,Robinson,omar.robinson@nexloom.io,CA,MH,Asia/Kolkata,2024-09-02 0:00,Content,SUMMER24,Android,1.2.1,11-50,Marketing,1,32,,1,2024-09-02 20:16,2024-12-05 20:16
U002567,Ethan,Nguyen,ETHAN.NGUYEN@GMAIL.COM,ZA,TX,Europe/Berlin,2023-11-02,Social,SUMMER24,iOS,2.0.0,1000+,Support,0,62,,TRUE,2023-11-02 6:11,0000-00-00 00:00:00
U000631,Chen,Lopez,chen.lopez@company.com,IN,-,UTC,2024-07-19 0:00,Partner,GROWTHLAB,Linux,2.0.1,501-1000,Product,1,19,,FALSE,2024-07-19 22:47,2024-12-20
U001349,Liam,Anderson,liam.anderson@icloud.com,fr,WA,,2025-09-04 0:00,Outbound,Q3_PROMO,Unknown,1.1.2,11-50,HR,1,32,,N,2025-09-04 6:37,2025-10-13
U000140,Diego,Brown,diego.brown@nexloom.io,US,RJ,America/New_York,2023-08-23 0:00,Social,,iOS,1.2.1,501-1000,HR,0,40,,Y,2023-08-23 1:11,2023-10-26 1:11
U000125,Mateo,Perez,mateo.perez@gmail.com,de,BC,UTC,2023-10-30 0:00,Outbound,BF2024,Linux,1.3.0,501-1000,Finance,0,33,,,2023-10-30 20:55,2024-04-24 20:55
U001191,Ravi,Clark,ravi.clark@gmail.com,US,,America/New_York,2023-05-27 0:00,Paid Search,BF2024,macOS,1.2.1,51-200,HR,0,26,,Y,2023-05-27 20:43,2023-07-19 20:43
U001414,Amir,Lewis,amir.lewis@yahoo.com,SG,MH,Asia/Tokyo,2023-05-11 0:00,Content,SUMMER24,macOS,2.0.0,1000+,Sales,0,23,,TRUE,2023-05-11 7:23,2023-07-29 7:23
U002222,Mateo,Lewis,mateo.lewis@company.com,SG,WA,Europe/London,2024-04-18 0:00,Partner,N/A,Linux,1.2.1,11-50,HR,0,26,,TRUE,2024-04-18 19:52,2024-09-10
U000365,Diego,Anderson,diego.anderson@outlook.com,BR,TX,Europe/London,03/07/2025,Webinar,AI-LAUNCH,iOS,2.1.0,10-Jan,Marketing,0,33,,0,2025-03-07 8:05,03-29-2025 08:05
U000056,Yuki,Johnson,yuki.johnson@gmail.com,SG,unknown,America/New_York,2023-10-13 0:00,Content,RETARGET1,Windows,1.2.0,1000+,Product,0,42,,N,2023-10-13 0:56,2024-01-19 0:56
U001071,Hana,Smith,hana.smith@yahoo.com,SE,,America/New_York,2023-12-12 0:00,Partner,BF2024,iOS,2.0.1,201-500,Product,0,29,,1,2023-12-12 9:02,2024-02-17 9:02
U000165,Sophia,Garcia,sophia.garcia@company.com,BR,unknown,America/Los_Angeles,2023-06-28 0:00,Webinar,SPRING24,Android,1.1.2,201-500,Marketing,0,58,,N,2023-06-28 9:12,2023-12-23 9:12
U000205,Fatima,Brown,fatima.brown@gmail.com,GB,NSW,America/Los_Angeles,2024-05-21 0:00,Content,AI-LAUNCH,macOS,1.2.0,unknown,Founder,0,25,,0,2024-05-21 0:38,2024-07-28 0:38
U000056,Zoe,Nguyen,zoe.nguyen@icloud.com,ZA,,Europe/Berlin,2025-01-25 0:00,Content,GROWTHLAB,macOS,1.0.9,51-200,Ops,0,52,,FALSE,2025-01-25 1:05,2025-07-13 1:05
U000619,Olivia,Brown,olivia.brown@nexloom.io,GB,MH,,2024-09-18 0:00,Webinar,WINTER25,Windows,2.0.0,501-1000,Product,0,43,,TRUE,2024-09-18 1:10,2024-12-12 1:10
 U000526 ,Hana,Robinson,hana.robinson@company.com,FR,NY,UTC,2024-03-13 0:00,Content,GROWTHLAB,Android,1.2.1,10-Jan,Engineering,0,34,,1,2024-03-13 13:15,2024-04-27 13:15
U002252,Emma,Johnson,emma.johnson@yahoo.com,SE,LND,Asia/Tokyo,2025-01-05 0:00,Social,Q3_PROMO,iOS,1.1.2,10-Jan,Marketing,0,N/A,,TRUE,2025-01-05 10:52,2025-06-26 10:52
U001467,Hana,Thomas,hana.thomas@company.com,AU,LND,America/Los_Angeles,2025-07-07 0:00,social,N/A,Android,1.2.1,10-Jan,HR,0,43,,FALSE,2025-07-07 0:39,2025-07-20 0:39
U000327,Diego,Brown,diego.brown@yahoo.com,DE,,,2024-04-25 0:00,Referral,Q3_PROMO,iOS,1.2.0,11-50,Product,0,41,U000109,Y,2024-04-25 17:51,2024-07-29 17:51
U002357,Emma,Smith,emma.smith@yahoo.com,SE,ON,America/New_York,2024-12-25 0:00,social,SUMMER24,Linux,v1.1.0,10-Jan,Engineering,0,unknown,,Y,2024-12-25 2:24,2025-01-16 2:24
U000948,Ravi,WALKER,ravi.walker@nexloom.io,NL,CA,America/Los_Angeles,2024-12-22 0:00,Social,WINTER25,iOS,2.0.0,11-50,Engineering,TRUE,33,,no,2024-12-22 3:55,2025-03-26 3:55
U001434,Nora,Jackson,nora.jackson@gmail.com,DE,TX,Asia/Kolkata,2024-06-23 0:00,Partner,RETARGET1,Unknown,2.1.0,11-50,Founder,1,52,,TRUE,2024-06-23 12:12,2024-10-13 12:12
U000471,Elena,Lee,elena.lee@nexloom.io,SE,SP,Asia/Tokyo,2023-02-04,Content,Q3_PROMO,macOS,2.0.0,51-200,Product,0,43,,FALSE,2023-02-04 14:31,2023-03-17 14:31
U001644,Nora,Martinez,nora.martinez@proton.me,JP,MH,UTC,2024-05-30,Webinar,Q3_PROMO,Unknown,2.1.0,unknown,Sales,0,51,,TRUE,2024-05-30 7:40,2024-06-08 7:40
U001328,Sara,Wright,sara.wrightproton.me,CA,BC,Europe/London,2024-09-06 0:00,Content,BF2024,Linux,2.0.1,501-1000,Product,0,30,,TRUE,2024-09-06 10:01,2025-02-21 10:01
U002326,Emma,Wilson,emma.wilson@gmail.com,ca,RJ,America/New_York,2025-04-12 0:00,Content,SUMMER24,Windows,1.2.0,11-50,Founder,0,43,,1,2025-04-12 5:26,2025-09-22 5:26
U000254,Jin,Scott,jin.scott@outlook.com,BR,,Asia/Tokyo,2023-12-24 0:00,Webinar,AI-LAUNCH,Android,1.2.1,51-200,Marketing,1,unknown,,0,2023-12-24 4:43,2024-06-08 4:43
U002010,Amir,Anderson,amir.anderson@gmail.com,MX,MH,Asia/Kolkata,2024-03-22 0:00,Organic Search,RETARGET1,Windows,1.1.0,501-1000,Product,0,20,,TRUE,2024-03-22 1:11,2024-09-04 1:11
U000423,Jin,Harris,jin.harris@outlook.com,AU,,Asia/Kolkata,2023-06-29 0:00,Partner,GROWTHLAB,Android,1.2.1,1000+,Engineering,1,62,,TRUE,2023-06-29 0:42,2023-08-30 0:42
U002551,Yuki,Walker,yuki.walker@outlook.com,SG,TX,,2024-01-11 0:00,Organic Search,n/a,Android,1.2.1,501-1000,Ops,0,36,,N,2024-01-11 0:37,2024-05-06 0:37
U001201,Liam,Jackson,liam.jackson@icloud.com,fr,,America/New_York,2024-08-15 0:00,Referral,n/a,iOS,1.2.1,10-Jan,Finance,0,60,U000180,FALSE,2024-08-15 15:00,2024-09-23 15:00
U000665,Priya,Walker,priya.walker@gmail.com,DE,,UTC,07/12/2023,Organic Search,RETARGET1,Unknown,1.1.0,1000+,Ops,0,45,,0,2023-07-12 16:04,2023-12-24 16:04
U002539,Diego,Wilson,diego.wilson@outlook.com,GB,BC,America/New_York,2024-08-12 0:00,Referral,SUMMER24,Unknown,1.1.2,501-1000,Finance,0,20,U000002,FALSE,2024-08-12 21:40,2024-09-01 21:40
U001726,Yuki,Scott,yuki.scott@outlook.com,GB,BER,UTC,2023-05-19 0:00,Webinar,RETARGET1,Unknown,1.2.1,1000+,Sales,1,62,,TRUE,2023-05-19 23:19,2023-05-30 23:19
U001503,amir,Patel,amir.patel@nexloom.io,SG,WA,Europe/Berlin,2023-03-10 0:00,Webinar,WINTER25,iOS,1.1.0,201-500,Marketing,1,55,,yes,2023-03-10 23:00,2023-03-13 23:00
U001791,Hana,Patel,hana.patel@proton.me,MX,CA,Europe/London,2023-08-30 0:00,Partner,SPRING24,Windows,2.0.0,51-200,Finance,0,51,,,2023-08-30 21:29,2024-02-06 21:29
U000106,Hana,Lopez,hana.lopez@outlook.com,MX,SP,UTC,2023-11-13 0:00,Paid Search,AI-LAUNCH,Android,1.2.0,501-1000,Sales,0,61,,FALSE,2023-11-13 12:47,2024-03-23 12:47
U001154,Ben,Perez,ben.perez@outlook.com,JP,WA,Asia/Tokyo,2024-06-30 0:00,organic search,BF2024,iOS,1.0.9,1000+,Marketing,1,60,,Y,2024-06-30 22:18,2024-12-03 22:18
U000516,Lucas,Thompson,lucas.thompson@proton.me,NL,,Asia/Tokyo,2023-03-12 0:00,Paid Search,Q3_PROMO,iOS,1.1.0,10-Jan,Sales,0,39,,no,2023-03-12 16:05,2023-03-12 16:05
U000006,Leo,Wilson,leo.wilson@nexloom.io,MX,BC,UTC,2023-09-05 0:00,Paid Search,AI-LAUNCH,macOS,1.1.2,201-500,Sales,0,21,,TRUE,2023-09-05 18:58,2024-02-21 18:58
U000872,Zoe,Perez,zoe.perez@proton.me,U.K.,ON,America/New_York,2023-11-27 0:00,Content,SUMMER24,iOS,2.0.0,201-500,Marketing,1,53,  U000120,TRUE,2023-11-27 17:11,2024-03-12 17:11
U000190,Jin,Wright,jin.wright@company.com,SG,,Europe/Berlin,2025-03-28 0:00,Outbound,N/A,Android,v2.1.0,201-500,Marketing,0,,,,2025-03-28 21:47,09-10-2025 21:47
U002419,Sara,Davis,sara.davis@nexloom.io,CA,LND,,2023-03-22,Webinar,N/A,Unknown,1.2.0,501-1000,Sales,0,25,,FALSE,2023-03-22 4:28,2023-08-08 4:28
U000054,Nora,Scott,nora.scott@icloud.com,DE,BER,America/New_York,2024-12-15 0:00,Referral,n/a,Linux,1.3.0,unknown,Founder,1,,U000282,no,2024-12-15 18:41,2025-04-23 18:41
U002092,Lucas,Clark,lucas.clark@company.com,US,BC,America/Los_Angeles,2025-02-30,Webinar,BF2024,macOS,1.1.2,201-500,Engineering,1,33,,Y,2025-05-14 9:32,2025-07-11 9:32
U001409,Yuki,Jackson,yuki.jackson@yahoo.com,AU,,Europe/London,2024-05-11,Organic Search,RETARGET1,macOS,1.1.0,1000+,Founder,0,20,,N,2024-05-11 17:28,2024-06-07 17:28
U001332,Olivia,Clark,olivia.clark@gmail.com,DE,TX,Asia/Kolkata,2024-07-22 0:00,Content,N/A,iOS,1.2.1,201-500,HR,0,37,,0,2024-07-22 13:26,2024-10-06 13:26
U002087,Omar,Martin,omar.martin@company.com,CA,unknown,Europe/London,2023-07-16 0:00,Content,Q3_PROMO,Linux,2.0.1,11-50,Engineering,yes,41,,,2023-07-16 13:24,2023-07-16 13:24
U000151,Liam,Thomas,LIAM.THOMAS@YAHOO.COM,FR,,,2025-01-03 0:00,Paid Search,BF2024,Linux,2.0.0,1000+,Finance,0,42,,FALSE,2025-01-03 14:14,2025-02-11 14:14
U000273,Amir,Nguyen,amir.nguyen@company.com,DE,-,,2024-11-12 0:00,Webinar,AI-LAUNCH,macOS,2.0.0,1000+,Engineering,no,54,,1,2024-11-12 2:49,2025-02-10 2:49
U001817,Omar,Robinson,omar.robinson@outlook.com,SE,ON,,2023-12-11 0:00,Paid Search,SUMMER24,Android,1.2.0,201-500,Ops,1,34,,1,2023-12-11 9:32,2023-12-13 9:32
U001839,Emma,Robinson,emma.robinson@nexloom.io,AU,WA,America/New_York,2025-02-06,Outbound,RETARGET1,Linux,1.3.0,501-1000,HR,1,63,,FALSE,2025-02-06 7:05,2025-03-15 7:05
U001834,Diego,Davis,diego.davis@proton.me,SE,-,America/Los_Angeles,2024-08-09 0:00,Organic Search,n/a,Unknown,1.1.2,1000+,Sales,0,18,,yes,2024-08-09 8:12,2025-01-17 8:12
U000328,Sophia,Wilson,sophia.wilson@outlook.com,SG,TX,Asia/Kolkata,2024-05-24 0:00,Paid Search,GROWTHLAB,Unknown,1.2.0,10-Jan,Finance,0,39,,no,2024-05-24 15:14,2024-10-16 15:14
U002428,Liam,Perez,liam.perez@yahoo.com,SG,SP,UTC,2025-04-15 0:00,Outbound,GROWTHLAB,macOS,2.0.1,unknown,Finance,1,50,,TRUE,2025-04-15 22:34,2025-07-25 22:34
U000232,Diego,Wright,diego.wright@gmail.com,GB,WA,,2024-03-30 0:00,Paid Search,Q3_PROMO,Windows,1.2.1,501-1000,Ops,1,46,,N,2024-03-30 3:36,07-19-2024 03:36
U001280,Amir,Lee,amir.lee@gmail.com,CA,BC,Europe/Berlin,2024-03-28 0:00,Partner,SPRING24,Android,2.0.0,51-200,Finance,0,33,,no,2024-03-28 10:00,2024-05-28 10:00
U001539,Emma,Lewis,emma.lewis@gmail.com,FR,MH,,2023-09-26 0:00,Paid Search,BF2024,Windows,2.0.0,10-Jan,Founder,0,43,,,2023-09-26 15:51,2024-01-16 15:51
U000256,Jin,Brown,jin.brown@gmail.com,US,ON,America/Los_Angeles,04/26/2024,Referral,Q3_PROMO,Linux,1.2.1,unknown,Product,0,25,U000370,N,2024-04-26 17:10,2024-06-06
U001351,Mateo,Patel,mateo.patel@proton.me,DE,RJ,Europe/Berlin,2024-11-12 0:00,Outbound,RETARGET1,iOS,2.0.1,10-Jan,Sales,0,25,,1,2024-11-12 15:50,2025-01-06 15:50
U001751,Ben,Wright,ben.wright@icloud.com,NL,-,Europe/London,2024-04-15 0:00,Social,AI-LAUNCH,Android,2.1.0,11-50,Sales,0,N/A,,FALSE,2024-04-16 0:00,2024-10-12 0:00
U000167,Ivy,Garcia,ivy.garcia@outlook.com,AU,ON,Europe/Berlin,2023-09-19 0:00,Content,SUMMER24,macOS,1.3.0,51-200,Marketing,0,25,,yes,2023-09-19 17:53,2023-10-15 17:53
 U001921 ,Mia,Martin,mia.martin@proton.me,JP,,Europe/Berlin,2024-07-09 0:00,Paid Search,AI-LAUNCH,macOS,1.2.1,201-500,HR,0,48,,FALSE,2024-07-09 4:02,2024-11-04
U000681,Ravi,Clark,ravi.clark@proton.me,DE,NY,America/New_York,27-09-2024,Referral,WINTER25,Windows,1.0.9,11-50,Product,0,60,U000377,1,2024-09-27 0:49,2025-02-17 0:49
U001330,Fatima,Lewis,fatima.lewis@nexloom.io,FR,,Europe/London,28-03-2024,Referral,n/a,iOS,1.1.2,501-1000,Finance,0,36,U000475,FALSE,2024-03-28 5:36,2024-04-08 5:36
U000706,Emma,Moore,emma.moore@yahoo.com,MX,LND,America/Los_Angeles,2025-09-19 0:00,Partner,GROWTHLAB,Unknown,1.0.9,11-50,Product,0,,,yes,2025-09-19 3:55,2025-12-27 3:55
U000065,Yuki,Taylor,yuki.taylor@nexloom.io,ZA,BER,Asia/Tokyo,2023-12-03 0:00,Referral,n/a,macOS,2.0.1,51-200,Support,0,54,U000494,,2023-12-03 18:37,2024-01-18 18:37
U001096,Ethan,Perez,ethan.perez@gmail.com,BR,SP,Asia/Kolkata,2023-09-22,Organic Search,n/a,Windows,1.2.1,201-500,Marketing,,41,,TRUE,2023-09-22 12:09,2023-12-13 12:09
U001117,Sara,Moore,sara.moore@gmail.com,SE,SP,UTC,2023-06-30 0:00,Outbound,WINTER25,Linux,2.0.0,unknown,HR,0,50,,TRUE,2023-06-30 8:54,2023-07-14 8:54
U000059,Ava,Davis,ava.davis@outlook.com,BR,NSW,Asia/Tokyo,2023-04-20 0:00,Partner,SUMMER24,Linux,1.3.0,201-500,Ops,0,37,,no,2023-04-20 10:55,2023-06-11 10:55
U001389,Ava,King,ava.king@gmail.com,SE,CA,,2025-06-04 0:00,Paid Search,SUMMER24,iOS,2.0.0,10-Jan,HR,0,40,,0,2025-06-04 7:15,2025-10-03 7:15
U000227,Amir,Taylor,amir.taylor@yahoo.com,BR,-,Asia/Kolkata,2025-06-18 0:00,Paid Search,SPRING24,Unknown,1.3.0,201-500,Finance,0,42,,N,2025-06-18 19:18,2025-07-29 19:18
U001499,Chen,Jackson,chen.jackson@gmail.com,ZA,SP,Asia/Kolkata,2024-01-27 0:00,Referral,n/a,Android,1.2.1,501-1000,Ops,0,32,U00000X,Y,2024-01-27 3:56,2024-03-03 3:56
 U000555 ,priya,Johnson,priya.johnson@icloud.com,FR,,Asia/Kolkata,2024-11-22 0:00,Content,SPRING24,Windows,1.1.0,501-1000,Engineering,1,45,,Y,2024-11-22 17:32,2025-05-13 17:32
U002111,Elena,Wright,elena.wright@proton.me,JP,ON,Asia/Kolkata,03-45-2024,Partner,SUMMER24,macOS,2.0.1,51-200,Founder,0,52,,FALSE,2023-08-22 15:17,2023-11-27 15:17
U002407,Diego,Walker,diego.walker@outlook.com,FR,MH,UTC,2024-01-19 0:00,Organic Search,n/a,Windows,1.2.0,10-Jan,Ops,0,64,,TRUE,2024-01-19 2:09,2024-02-10 2:09
U001883,Omar,Brown,omar.brown@icloud.com,CA,TX,Europe/London,2024-06-06,Social,SPRING24,Linux,2.0.1,unknown,HR,0,37,,TRUE,2024-06-06 0:49,2024-09-12 0:49
U001012,Sofia,Jackson,sofia.jackson@gmail.com,IN,MH,Asia/Kolkata,2025-09-04 0:00,Social,AI-LAUNCH,iOS,1.3.0,51-200,Marketing,0,46,,N,2025-09-04 14:18,2026-02-18 14:18
U000733,Nora,Taylor,nora.taylor@nexloom.io,SE,WA,,2024-06-22 0:00,referral,Q3_PROMO,Unknown,2.1.0,501-1000,Marketing,0,,U000447,FALSE,2024-06-22 14:34,2024-11-06 14:34
U001459,Elena,DAVIS,elena.davis@outlook.com,CA,BER,UTC,2023-10-21 0:00,Webinar,WINTER25,Windows,1.0.9,10-Jan,Marketing,0,49,,FALSE,2023-10-21 20:56,
U002246,Ben,Scott,ben.scott@proton.me,CA,NY,,2024-04-08 0:00,Paid Search,GROWTHLAB,iOS,2.0.1,51-200,Sales,0,31,,yes,2024-04-08 6:41,2024-06-21 6:41
U001246,Amir,Thompson,amir.thompson@yahoo.com,US,CA,Europe/Berlin,2024-06-01 0:00,Organic Search,SPRING24,iOS,1.2.0,unknown,HR,TRUE,N/A,,FALSE,2024-06-01 0:31,2024-09-19 0:31
U000369,Olivia,Taylor,olivia.taylorcompany.com,GB,MH,,2023-10-07 0:00,Partner,null,macOS,1.2.1,10-Jan,Ops,0,28,,1,2023-10-07 5:27,2024-02-08 5:27
U000233,omar,Patel,omar.patel@icloud.com,CA,BER,Asia/Kolkata,2024-05-06 0:00,Partner,AI-LAUNCH,Android,2.0.0,unknown,Founder,0,32,,FALSE,2024-05-06 3:57,2024-09-29 3:57
U000888,Fatima,Brown,fatima.brown@nexloom.io,SE,NSW,,2023-11-06 0:00,Organic Search,N/A,macOS,1.0.9,10-Jan,Finance,0,37,,yes,2023-11-06 17:29,2024-03-26 17:29
U001847,Leo,Nguyen,leo.nguyen@yahoo.com,IN,,,2023-08-03 0:00,Social,AI-LAUNCH,macOS,1.1.0,unknown,Support,1,54,,FALSE,2023-08-03 6:58,2023-12-18 6:58
U000230,Emma,King,emma.king@icloud.com,DE,LND,,2024-06-03 0:00,Partner,WINTER25,Windows,1.0.9,unknown,Product,0,24,,TRUE,2024-06-03 11:30,2024-11-04 11:30
U002084,Lucas,Jackson,lucas.jackson@icloud.com,US,WA,,2025-01-04 0:00,Organic Search,N/A,Android,1.1.2,201-500,Finance,0,59,,FALSE,2025-01-04 13:26,2025-02-09 13:26
U001392,Emma,Anderson,emma.anderson@proton.me,CA,WA,Asia/Tokyo,2023-06-05 0:00,Social,WINTER25,Linux,1.0.9,201-500,Support,0,36,,N,2023-06-05 14:35,2023-09-17 14:35
U001385,Emma,Scott,emma.scott@proton.me,US,BER,Europe/London,2024-06-17 0:00,Paid Search,SPRING24,Linux,1.1.0,51-200,Founder,0,54,,TRUE,2024-06-17 6:11,2024-07-19 6:11
U001087,Sofia,Martin,sofia.martin@company.com,GB,NSW,UTC,2024-05-25 0:00,Referral,n/a,Unknown,2.0.0,11-50,Engineering,0,45,,TRUE,2024-05-25 23:57,2024-08-19 23:57
U001198,Sofia,Davis,sofia.davis@outlook.com,de,,America/New_York,2025-05-31 0:00,Organic Search,N/A,Unknown,1.2.1,11-50,Ops,0,51,,N,2025-05-31 6:44,2025-07-31 6:44
U000022,Priya,Jackson,priya.jackson@proton.me,BR,BER,Europe/London,2023-08-21 0:00,Partner,RETARGET1,iOS,2.0.1,201-500,Engineering,0,58,,1,2023-08-21 15:45,2023-09-20 15:45
U001696,Chen,Patel,chen.patel@icloud.com,JP,NSW,UTC,29-05-2023,Social,GROWTHLAB,Windows,2.1.0,201-500,Marketing,0,18,,,2023-05-29 23:59,2023-06-14 23:59
U001472,Priya,Harris,priya.harris@outlook.com,CA,BC,Europe/Berlin,2024-08-03 0:00,Webinar,SPRING24,Android,1.2.1,1000+,Ops,1,27,,TRUE,2024-08-03 18:59,2024-09-26 18:59
U000063,Ben,Lewis,ben.lewis@company.com,SG,NSW,America/New_York,2024-05-31 0:00,Social,SPRING24,Android,1.1.2,51-200,Founder,0,64,,Y,2024-05-31 7:17,2024-06-17 7:17
U000377,Mia,Patel,mia.patel@gmail.com,NL,CA,,10/21/2024,Content,SPRING24,Windows,1.1.0,51-200,Ops,1,25,,TRUE,2024-10-21 8:00,2025-02-14 8:00
U001314,Elena,Smith,elena.smith@proton.me,NL,-,Europe/Berlin,2024-09-27 0:00,Partner,N/A,Linux,1.2.0,51-200,Engineering,FALSE,61,,FALSE,2024-09-28 0:00,2025-01-22 0:00
U002122,Yuki,PATEL,yuki.patel@nexloom.io,AU,,,2024-03-31 0:00,Social,WINTER25,Windows,1.0.9,1000+,Marketing,0,22,,,2024-03-31 22:36,2024-06-20 22:36
U000480,Ethan,Lopez,ethan.lopez@gmail.com,JP,LND,Asia/Kolkata,2024-04-09 0:00,Outbound,WINTER25,Linux,1.0.9,501-1000,Sales,0,44,,no,2024-04-09 20:42,2024-08-04 20:42
U002005,Anya,Lee,anya.lee@proton.me,au,RJ,America/Los_Angeles,2023-11-27 0:00,Referral,Q3_PROMO,iOS,1.2.0,10-Jan,Founder,0,18,U000129,Y,2023-11-27 12:47,0000-00-00 00:00:00
U002394,Emma,Martinez,EMMA.MARTINEZ@OUTLOOK.COM,AU,TX,America/Los_Angeles,2023-08-24 0:00,Paid Search,RETARGET1,Android,1.2.0,51-200,Marketing,0,N/A,,FALSE,2023-08-24 16:20,2023-09-02 16:20
U001166,Sophia,Smith,sophia.smith@outlook.com,MX,SP,Europe/London,2024-09-27,Paid Search,RETARGET1,macOS,1.1.2,51-200,Founder,0,23,,TRUE,09/27/2024 13:00,2024-12-24 13:00
U002083,Elena,Patel,elena.patel@gmail.com,BR,CA,Asia/Tokyo,2024-03-11 0:00,Webinar,SPRING24,macOS,1.0.9,10-Jan,Sales,0,20,,1,2024-03-11 4:07,2024-07-29 4:07
U000939,Zoe,Walker,zoe.walker@gmail.com,AU,RJ,Europe/London,2023-07-30 0:00,Outbound,BF2024,Linux,2.1.0,51-200,Support,1,47,,N,2023-07-30 19:27,2023-11-13 19:27
U001482,Yuki,Wright,YUKI.WRIGHT@GMAIL.COM,IN,MH,America/Los_Angeles,02-08-2023,Partner,BF2024,macOS,1.1.0,501-1000,Marketing,0,42,,FALSE,2023-08-02 19:36,2023-12-25
U001805,Hana,Wright,hana.wright@company.com,US,SP,Asia/Kolkata,2024-01-11 0:00,Webinar,AI-LAUNCH,Android,1.1.2,201-500,HR,1,61,,FALSE,2024-01-11 18:25,2024-04-24 18:25
U001623,Yuki,JOHNSON,yuki.johnson@icloud.com,NL,-,America/New_York,2024-04-29 0:00,Organic Search,AI-LAUNCH,Windows,1.2.0,11-50,Finance,0,42,,,04/29/2024 09:58,2024-05-19
U000152,Olivia,Harris,olivia.harris@nexloom.io,JP,-,Europe/Berlin,2023-11-07 0:00,Webinar,GROWTHLAB,Android,2.0.0,11-50,Finance,0,54,,no,2023-11-07 16:29,2024-05-05 16:29
U000942,Hana,Patel,hana.patelgmail.com,SE,TX,Asia/Tokyo,25-04-2024,Outbound,GROWTHLAB,Linux,2.0.0,unknown,HR,1,49,,0,2024-04-25 19:07,2024-09-17 19:07
U000710,Yuki,Lee,yuki.lee@nexloom.io,IN,BC,Asia/Kolkata,2024-07-01 0:00,Partner,SUMMER24,Windows,1.1.0,10-Jan,Support,0,35,,no,2024-07-01 9:32,
U001297,Yuki,Garcia,yuki.garcia@company.com,FR,BER,UTC,09/14/2023,Content,AI-LAUNCH,iOS,2.0.1,1000+,Support,0,51,,,2023-09-14 7:22,2023-11-13 7:22
U002134,Lucas,Nguyen,lucas.nguyen@yahoo.com,SE,LND,America/New_York,2024-04-11 0:00,Outbound,Q3_PROMO,Unknown,2.0.1,501-1000,Ops,1,46,,FALSE,2024-04-11 21:56,2024-08-19
U000503,Amir,Davis,amir.davis@icloud.com,SG,WA,America/New_York,2023-12-20 0:00,Paid Search,SPRING24,Unknown,1.1.0,501-1000,HR,1,27,,0,2023-12-20 7:08,2024-03-21 7:08
U001625,Ava,Robinson,ava.robinsonyahoo.com,SG,RJ,Europe/Berlin,2023-09-21,Outbound,Q3_PROMO,Android,1.0.9,201-500,Founder,0,27,,Y,2023-09-21 11:00,2023-12-08 11:00
U000115,Jin,Nguyen,jin.nguyen@company.com,US,NSW,Asia/Kolkata,2024-06-05 0:00,Organic Search,n/a,Unknown,1.3.0,10-Jan,Marketing,0,59,,no,2024-06-05 14:06,2024-10-24 14:06
U002423,Olivia,Patel,olivia.patel@proton.me,GB,BC,Asia/Tokyo,2024-08-14 0:00,Outbound,AI-LAUNCH,iOS,1.1.2,201-500,HR,0,54,,FALSE,2024-08-14 9:07,2025-02-07 9:07
U002229,Lucas,White,lucas.white@outlook.com,NL,NY,Asia/Kolkata,2023-12-12 0:00,organic search,N/A,Unknown,1.1.0,501-1000,Founder,1,39,,,2023-12-12 3:51,2024-02-20 3:51
U001486,Sara,Robinson,sara.robinson@company.com,MX,MH,Europe/London,2024-01-20 0:00,Partner,SPRING24,Android,2.0.0,201-500,HR,1,34,,TRUE,2024-01-20 20:15,2024-05-25
U001573,Amir,Martin,amir.martin@proton.me,JP,LND,Europe/Berlin,2024-08-02 0:00,Partner,NA,Windows,1.3.0,201-500,Product,0,40,,TRUE,2024-08-02 19:11,2024-12-10 19:11
U002515,Ethan,Moore,ethan.moore@gmail.com,SG,unknown,,2024-06-01 0:00,Referral,AI-LAUNCH,Linux,1.3.0,11-50,Support,1,62,U000265,FALSE,2024-06-01 16:19,2024-09-01 16:19
U000405,Zoe,Martinez,zoe.martinez@gmail.com,USA,LND,,2023-12-26 0:00,organic search,RETARGET1,Android,1.0.9,1000+,Support,0,49,,N,2023-12-26 11:12,2024-02-09 11:12
U002073,Ravi,Allen,ravi.allen@outlook.com,NL,BER,UTC,2023-10-14 0:00,Content,BF2024,iOS,1.2.0,501-1000,Ops,0,29,,FALSE,2023-10-14 22:45,2024-02-10 22:45
U000484,Noah,Taylor,noah.taylor@yahoo.com,BR,TX,Asia/Tokyo,2024-06-01 0:00,Paid Search,AI-LAUNCH,iOS,v1.0.9,unknown,Ops,0,60,,TRUE,2024-06-01 15:02,2024-06-14 15:02
USR-000151,Kofi,Wilson,kofi.wilson@outlook.com,AU,ON,Europe/London,2024-08-17 0:00,Referral,BF2024,Android,1.1.0,201-500,HR,0,53,U000130,1,2024-08-17 22:36,2025-01-10 22:36
U000155,Diego,Taylor,diego.taylor@proton.me,DE,NSW,Asia/Tokyo,2025-08-23 0:00,Social,GROWTHLAB,Windows,1.1.0,1000+,HR,yes,57,,1,2025-08-23 8:15,2026-02-11 8:15
U000457,Hana,Scott,hana.scott@proton.me,BR,-,America/New_York,2023-02-02 0:00,Outbound,AI-LAUNCH,Linux,1.3.0,201-500,Marketing,1,34,,TRUE,2023-02-02 4:02,2023-06-13 4:02
U001381,Priya,Nguyen,priya.nguyen@gmail.com,BR,unknown,Asia/Kolkata,2023-09-11 0:00,Content,WINTER25,macOS,2.0.1,10-Jan,Product,0,59,,,2023-09-11 7:21,2024-03-06 7:21
U001371,Priya,King,priya.king@icloud.com,AU,CA,America/Los_Angeles,2025-06-11 0:00,Content,SUMMER24,Android,2.1.0,501-1000,Founder,0,27,,FALSE,2025-06-11 1:41,2025-08-31 1:41
U000709,Hana,Wright,hana.wright@nexloom.io,nl,LND,Europe/Berlin,2023-11-16 0:00,Referral,AI-LAUNCH,macOS,1.3.0,201-500,Finance,0,22,U000390,Y,2023-11-16 16:20,
U001757,Mateo,Allen,mateo.allen@yahoo.com,ZA,,Europe/London,2025-04-27 0:00,Partner,SPRING24,Linux,1.2.0,11-50,Product,0,36,,TRUE,2025-04-27 2:53,2025-09-25 2:53
U002144,Ravi,Johnson, ravi.johnson@company.com ,SE,,,2023-12-22,Organic Search,AI-LAUNCH,Linux,1.2.1,11-50,Ops,0,33,,1,2023-12-22 8:10,2024-06-18 8:10
U000835,Ravi,Lewis,ravi.lewis@outlook.com,DE,BER,UTC,2024-03-28 0:00,Organic Search,BF2024,Linux,2.0.0,11-50,Support,1,unknown,,yes,2024-03-28 19:12,2024-09-06 19:12
U002583,Lucas,Thompson,lucas.thompson@proton.me,FR,WA,,2024-03-30 0:00,Organic Search,N/A,iOS,1.2.0,51-200,Sales,0,22,,TRUE,2024-03-30 9:32,2024-08-13 9:32
U001510,Kofi,Wright,kofi.wright@proton.me,SG,MH,UTC,2024-08-20 0:00,Outbound,GROWTHLAB,macOS,1.1.2,11-50,Marketing,1,50,,,2024-08-20 17:22,2024-11-30 17:22
U000122,Fatima,Martinez,fatima.martinez@company.com,fr,,Asia/Kolkata,2024-12-16 0:00,Partner,GROWTHLAB,iOS,1.3.0,501-1000,Ops,0,23,,yes,2024-12-16 21:32,2025-05-21 21:32
U000655,Ava,Garcia,ava.garcia@icloud.com,NL,CA,Asia/Tokyo,2024-02-23 0:00,Outbound,GROWTHLAB,iOS,2.0.0,51-200,Founder,1,21,,FALSE,2024-02-23 22:38,2024-06-04 22:38
U000675,Priya,Davis,priya.davis@company.com,JP,,UTC,2024-02-12 0:00,referral,GROWTHLAB,macOS,1.2.0,501-1000,Marketing,0,28,U000304,N,2024-02-12 2:16,2024-08-04 2:16
U001770,Ava,Moore,ava.moore@gmail.com,FR,NSW,America/Los_Angeles,2024-02-04 0:00,Webinar,N/A,Linux,1.2.0,unknown,Ops,1,44,,no,2024-02-04 6:14,2024-06-15 6:14
U002296,Olivia,Davis,olivia.davis@gmail.com,NL,,UTC,2023-01-23 0:00,Webinar,RETARGET1,Android,v2.0.0,unknown,Support,1,21,,,2023-01-23 3:52,2023-06-03 3:52
U001291,Leo,Moore,leo.moore@gmail.com,GB,RJ,America/Los_Angeles,2024-02-05,Partner,Q3_PROMO,Unknown,1.3.0,unknown,Sales,1,21,,,2024-02-05 13:15,2024-07-14 13:15
U000020,Diego,Lopez,diego.lopez@icloud.com,DE,BC,Asia/Kolkata,2023-12-09 0:00,Partner,SUMMER24,macOS,1.1.2,unknown,Marketing,0,21,,Y,2023-12-09 23:53,2024-03-21 23:53
U002019,Ethan,Lewis,ethan.lewis@icloud.com,,TX,,2023-03-01 0:00,referral,AI-LAUNCH,Windows,2.0.1,unknown,Finance,0,64,,TRUE,2023-03-01 17:21,2023-05-24
U002037,Ava,Perez,ava.perez@company.com,FR,BC,Asia/Tokyo,2023-07-26 0:00,Referral,SPRING24,iOS,1.1.2,51-200,Founder,0,21,,,2023-07-26 22:33,2024-01-03 22:33
U000599,Sara,Harris,sara.harris@outlook.com,ZA,CA,America/New_York,2023-10-04 0:00,organic search,n/a,Unknown,1.1.2,1000+,HR,1,44,,TRUE,2023-10-04 19:27,2024-01-27 19:27
U000688,Mia,Wilson,mia.wilson@nexloom.io,SG,,Europe/London,2023-12-02 0:00,Paid Search,SPRING24,Android,1.2.0,unknown,Support,1,42,,1,2023-12-02 21:40,2024-02-13 21:40
U000181,Lucas,Nguyen,lucas.nguyen@yahoo.com,SE,BC,America/Los_Angeles,2024-01-06 0:00,Outbound,SUMMER24,iOS,1.2.0,51-200,Founder,0,60,,N,2024-01-06 15:57,2024-03-14 15:57
U001548,Mia,Anderson,mia.anderson@proton.me,GB,LND,Europe/London,2024-04-23 0:00,Partner,N/A,iOS,2.0.1,51-200,Founder,0,51,,TRUE,2024-04-23 6:12,2024-08-15 6:12
U002525,Ivy,King,ivy.king@company.com,DE,WA,UTC,2024-09-17 0:00,paid search,AI-LAUNCH,Android,1.2.1,51-200,Founder,0,23,,yes,2024-09-17 1:42,2025-02-13 1:42
U001469,Yuki,Garcia,yuki.garcia@yahoo.com,CA,NSW,,2024-11-16 0:00,Webinar,AI-LAUNCH,iOS,1.1.0,201-500,Support,1,51,,TRUE,2024-11-16 1:39,2025-04-20 1:39
U000541,Chen,Scott,chen.scott@gmail.com,GB,NY,,2025-04-09 0:00,Content,SUMMER24,iOS,1.0.9,501-1000,Product,0,25,,Y,2025-04-09 23:20,2025-07-05 23:20
U001289,Sara,Thomas,sara.thomas@company.com,US,CA,America/Los_Angeles,2023-03-27 0:00,Paid Search,WINTER25,Unknown,1.0.9,1000+,HR,0,31,,FALSE,2023-03-27 11:59,2023-08-24 11:59
U000226,Mia,Thompson,mia.thompson@yahoo.com,CA,RJ,UTC,2023-11-09 0:00,Referral,n/a,macOS,1.2.1,11-50,Support,0,23,U000230,,2023-11-09 16:27,2023-11-14 16:27
U001763,Emma,Smith,emma.smith@company.com,BR,CA,America/Los_Angeles,2023-07-08 0:00,Social,BF2024,Linux,1.1.2,10-Jan,HR,0,52,,yes,2023-07-08 14:38,2023-12-09
U001496,Omar,DAVIS,omar.davis@gmail.com,US,WA,America/New_York,2024-06-23 0:00,Partner,RETARGET1,Android,1.1.2,201-500,HR,1,54,,N,2024-06-23 23:20,2024-11-14 23:20
U000747,Priya,Allen,priya.allen@icloud.com,BR,CA,America/New_York,2024-01-29 0:00,Outbound,AI-LAUNCH,iOS,2.0.1,51-200,Finance,1,28,,1,2024-01-29 3:19,2024-02-26 3:19
U000249,Anya,Allen,anya.allen@proton.me,CA,CA,,2025-05-11 0:00,Content,GROWTHLAB,Android,1.2.1,10-Jan,Marketing,1,55,,yes,2025-05-11 9:09,2025-09-29 9:09
U000186,Sara,Jackson,SARA.JACKSON@NEXLOOM.IO,DE,ON,Asia/Kolkata,2024-06-19 0:00,Referral,BF2024,Unknown,1.1.2,unknown,HR,0,48,,TRUE,2024-06-19 6:12,2024-09-27 6:12
U000801,Kofi,Walker,kofi.walker@company.com,NL,unknown,Asia/Kolkata,2024-07-15 0:00,Paid Search,SPRING24,Android,1.2.1,501-1000,Support,0,38,,1,2024-07-15 5:48,2024-11-01 5:48
U000395,Chen,Lewis,chen.lewis@nexloom.io,IN,SP,,2024-01-06 0:00,Referral,n/a,iOS,1.2.1,201-500,Support,0,19,U000463,FALSE,2024-01-06 20:09,2024-02-10 20:09
U002442,Emma,Allen,emma.allen@proton.me,GB,BC,,2024-04-19,content,WINTER25,iOS,1.2.0,201-500,Product,0,37,,Y,2024-04-19 12:50,2024-09-23 12:50
U000738,Omar,Martin,omar.martin@proton.me,GB,CA,,2024-09-26 0:00,Partner,N/A,Unknown,2.1.0,1000+,Finance,0,46,,0,2024-09-26 17:13,2024-10-12 17:13
U002405,Ava,Walker,ava.walker@nexloom.io,DE,MH,America/New_York,2024-06-28 0:00,Content,RETARGET1,macOS,1.2.0,201-500,Product,0,unknown,,0,2024-06-28 3:46,2024-10-18 3:46
U000769,Lucas,Harris,lucas.harris@icloud.com,ZA,BER,,2024-01-07 0:00,Social,SUMMER24,Windows,1.1.2,51-200,Engineering,1,38,,TRUE,2024-01-07 11:47,2024-01-12 11:47
U001316,Ethan,Thompson,ethan.thompson@yahoo.com,SG,CA,America/Los_Angeles,2024-06-10 0:00,Outbound,Q3_PROMO,Windows,2.0.1,501-1000,Engineering,0,38,,Y,2024-06-10 17:47,2024-09-14 17:47
U000076,Ivy,Lewis,ivy.lewis@proton.me,DE,TX,UTC,2024-07-28 0:00,Partner,Q3_PROMO,Android,1.1.0,201-500,Sales,0,33,,FALSE,2024-07-28 4:04,2024-07-31 4:04
U000189,Priya,Wright,priya.wright@icloud.com,JP,LND,UTC,2024-08-21 0:00,Outbound,WINTER25,Linux,1.2.0,unknown,Founder,0,42,,N,2024-08-21 15:09,2024-12-12 15:09
U002113,Ethan,Patel,ethan.patel@icloud.com,MX,NY,America/New_York,2023-09-28 0:00,Content,GROWTHLAB,Unknown,1.1.0,201-500,Product,1,58,,TRUE,2023-09-28 10:30,2024-01-31 10:30
U002173,Omar,Brown, omar.brown@outlook.com ,SE,SP,Europe/London,2023-09-20 0:00,Outbound,WINTER25,Unknown,2.0.0,1000+,Sales,1,24,,Y,2023-09-20 21:22,2023-09-29 21:22
U000774,Kofi,Nguyen,kofi.nguyen@yahoo.com,USA,BER,America/Los_Angeles,2024-02-05 0:00,Referral,N/A,Android,1.3.0,unknown,Ops,0,48,,N,2024-02-05 5:29,2024-05-21 5:29
U000850,sophia,Martinez,sophia.martinez@icloud.com,SG,RJ,America/Los_Angeles,2024-05-16 0:00,Webinar,WINTER25,Unknown,2.1.0,1000+,Sales,0,62,,FALSE,2024-05-16 11:47,2024-08-16 11:47
U000155,Noah,Wright,noah.wright@company.com,BR,TX,America/Los_Angeles,07/03/2024,Referral,n/a,Windows,2.0.1,10-Jan,Sales,0,52,U000391,FALSE,2024-07-03 0:11,2024-11-08 0:11
U000132,Ethan,Davis,ethan.davis@nexloom.io,ZA,,Europe/Berlin,2023-10-26 0:00,Referral,n/a,macOS,1.2.1,51-200,Support,0,54,U000299,FALSE,2023-10-26 19:40,2023-11-19 19:40
U000172,Hana,Thompson,hana.thompson@proton.me,BR,ON,Asia/Tokyo,02/16/2023,Social,GROWTHLAB,Windows,1.2.1,10-Jan,Marketing,0,47,,TRUE,2023-02-16 21:43,2023-05-18
U001920,Sofia,Patel,sofia.patel@company.com,CA,unknown,Asia/Kolkata,2024-02-13 0:00,Referral,n/a,macOS,1.2.1,201-500,Product,0,30,U000314,0,2024-02-13 19:26,2024-04-30
U000135,Anya,Smith,anya.smith@outlook.com,ZA,-,Europe/London,03/10/2025,Organic Search,,Unknown,2.1.0,501-1000,Founder,0,53,,N,03/10/2025 22:38,2025-07-22
U001653,Diego,White,diego.white@yahoo.com,MX,TX,Asia/Tokyo,2023-11-22 0:00,Organic Search,n/a,Android,1.0.9,1000+,Founder,0,51,,yes,2023-11-22 2:17,2024-03-09 2:17
U000142,Sophia,Thompson,sophia.thompson@icloud.com,jp,NY,Asia/Kolkata,2023-11-15,Outbound,GROWTHLAB,macOS,1.0.9,10-Jan,HR,0,27,,0,2023-11-15 6:05,2023-12-26 6:05
U000734,Ethan,Martin,ethan.martin@company.com,BR,-,Asia/Kolkata,2024-04-09 0:00,Social,BF2024,Android,1.3.0,1000+,HR,1,50,,no,2024-04-09 9:56,2024-08-21 9:56
U001983,Nora,Johnson, nora.johnson@yahoo.com ,in,CA,UTC,2024-03-08 0:00,Partner,SUMMER24,Unknown,2.0.1,1000+,Support,no,39,,FALSE,2024-03-08 15:33,2024-06-05 15:33
U000198,ravi,Garcia,ravi.garcia@gmail.com,se,BER,Europe/London,2024-12-18 0:00,Webinar,N/A,macOS,1.1.0,1000+,Finance,0,58,,no,2024-12-18 15:39,2025-04-29 15:39
U000439,Kofi,Scott,kofi.scott@outlook.com,IN,CA,Europe/London,2024-07-15,Paid Search,GROWTHLAB,Unknown,1.2.1,501-1000,Founder,0,N/A,,TRUE,2024-07-15 1:09,2024-12-16 1:09
U000940,Mia,Jackson,mia.jackson@icloud.com,DE,LND,UTC,2024-05-06 0:00,Referral,WINTER25,macOS,1.1.2,10-Jan,Marketing,1,56,,N,2024-05-06 1:02,2024-10-23 1:02
U002297,Mateo,Lopez,mateo.lopez@nexloom.io,JP,TX,Europe/Berlin,2023-10-24 0:00,Social,GROWTHLAB,iOS,1.0.9,51-200,Founder,1,62,,0,2023-10-24 15:00,2023-11-03 15:00
U002468,Mateo,Scott,mateo.scott@company.com,DE,unknown,UTC,2023-04-09 0:00,Organic Search,SPRING24,iOS,2.0.0,11-50,Ops,0,20,,TRUE,2023-04-09 6:15,2023-09-22 6:15
U000491,Diego,Wright,diego.wright@outlook.com,GB,unknown,UTC,2024-03-06,Partner,RETARGET1,Unknown,1.3.0,10-Jan,Product,0,49,,TRUE,2024-03-06 11:52,2024-03-08 11:52
U002168,Liam,Davis,liam.davis@proton.me,MX,BC,UTC,2023-08-08 0:00,Webinar,N/A,iOS,2.0.1,unknown,Founder,0,40,,1,2023-08-08 20:12,2023-12-11 20:12
U002367,Emma,Patel,emma.patel@proton.me,MX,WA,UTC,2023-08-04 0:00,Social,GROWTHLAB,macOS,2.1.0,51-200,Sales,yes,24,,1,2023-08-04 14:32,2023-08-09 14:32
U002453,Leo,Harris,leo.harris@company.com,MX,ON,,2024-04-27 0:00,Referral,GROWTHLAB,Android,1.0.9,51-200,Finance,1,21,,N,2024-04-27 16:24,2024-07-20 16:24
U002013,Olivia,Martin,olivia.martin@company.com,SE,NY,,2024-12-31 0:00,Referral,SPRING24,Linux,1.2.1,501-1000,HR,0,58,u000239,Y,12/31/2024 07:27,2025-04-14 7:27
U000676,Nora,Anderson,nora.anderson@outlook.com,SE,ON,,2025-08-04,Partner,RETARGET1,Unknown,1.3.0,1000+,Product,1,38,,0,2025-08-04 6:30,2025-08-05 6:30
U000898,Ethan,Brown,ethan.brown@proton.me,IN,NSW,,2024-12-17 0:00,Outbound,Q3_PROMO,iOS,1.1.2,1000+,Founder,0,46,,FALSE,2024-12-17 19:30,2025-05-01 19:30
U000723,Fatima,White,fatima.white@yahoo.com,DE,-,Europe/Berlin,2023-05-26 0:00,Partner,SPRING24,Linux,1.1.2,51-200,Product,0,35,,Y,2023-05-26 7:22,2023-06-17 7:22
U000970,Priya,Brown,priya.brown@gmail.com,MX,SP,UTC,2024-03-17,Referral,SPRING24,iOS,1.0.9,10-Jan,Ops,0,58,,Y,2024-03-17 23:33,2024-04-12 23:33
U001859,Ethan,Harris,ethan.harris@gmail.com,NL,,,2024-10-18 0:00,Content,SUMMER24,Android,1.1.2,51-200,Support,0,18,,1,2024-10-18 12:10,2024-11-21 12:10
U001447,Omar,Wright,omar.wright@gmail.com,MX,NY,,2024-07-07 0:00,Referral,n/a,iOS,1.1.0,201-500,Product,0,46,U000398,yes,2024-07-07 6:21,2024-09-21 6:21
U000890,Ethan,Martin,ETHAN.MARTIN@YAHOO.COM,NL,ON,Europe/Berlin,2023-11-09 0:00,Social,RETARGET1,iOS,v2.0.0,51-200,Engineering,0,45,,N,2023-11-09 12:25,2024-04-07 12:25
U001081,Leo,Smith,leo.smith@yahoo.com,SE,RJ,UTC,2024-09-03,Organic Search,BF2024,Unknown,2.1.0,11-50,Sales,FALSE,,,Y,2024-09-03 10:39,2024-12-15
U001759,Emma,Wright, emma.wright@outlook.com ,AU,ON,America/New_York,2023-07-21 0:00,Paid Search,AI-LAUNCH,macOS,1.1.0,1000+,Sales,0,40,,TRUE,2023-07-21 1:36,10-18-2023 01:36
U001785,Olivia,Smith,olivia.smith@icloud.com,se,,UTC,2024-06-18 0:00,Social,BF2024,macOS,2.0.0,501-1000,Engineering,0,60,,1,2024-06-18 13:09,2024-09-01 13:09
u001284,Omar,Scott,omar.scott@yahoo.com,br,BC,Asia/Tokyo,2023-01-29 0:00,Content,SPRING24,Linux,2.0.1,1000+,Ops,0,62,,,01/29/2023 00:31,2023-05-23 0:31
U000267,Noah,Nguyen,noah.nguyen@gmail.com,US,BER,UTC,2024-07-09 0:00,Organic Search,n/a,Android,1.3.0,1000+,Sales,0,30,,1,2024-07-09 19:46,2024-08-04 19:46
U002530,Zoe,Perez,zoe.perez@icloud.com,AU,,Europe/Berlin,2025-11-14 0:00,Social,Q3_PROMO,Unknown,1.2.1,501-1000,HR,1,53,,no,2025-11-14 12:35,2026-01-19 12:35
U000660,Kofi,Johnson,kofi.johnson@yahoo.com,US,,America/New_York,2024-05-03 0:00,Content,SPRING24,iOS,1.1.2,unknown,Founder,0,18,,TRUE,2024-05-03 15:09,2024-05-14 15:09
U001855,Ava,Perez,ava.perez@company.com,BR,,UTC,2025-01-20 0:00,Content,RETARGET1,Unknown,2.0.0,11-50,Marketing,0,unknown,,FALSE,2025-01-20 20:55,2025-05-07
U000019,Liam,MARTINEZ,liam.martinez@nexloom.io,CA,unknown,Asia/Kolkata,2024-02-23 0:00,Referral,Q3_PROMO,Windows,1.2.0,501-1000,Sales,0,46,U000392,Y,2024-02-23 7:05,2024-08-01 7:05
U000867,Jin,Lopez,jin.lopez@gmail.com,MX,BC,UTC,2023-09-04 0:00,Webinar,GROWTHLAB,Windows,1.0.9,unknown,Finance,1,37,,0,2023-09-04 23:11,2023-11-28 23:11
U000412,Omar,Taylor,omar.taylor@outlook.com,US,,UTC,2025-03-29 0:00,Paid Search,SUMMER24,macOS,v2.0.1,1000+,Engineering,0,38,,N,2025-03-29 13:17,2025-06-27 13:17
U000920,Sara,SCOTT,sara.scott@icloud.com,NL,SP,Europe/London,2023-08-21,Content,WINTER25,Linux,2.0.1,11-50,Engineering,0,46,,1,2023-08-21 7:27,2024-02-15
U000634,Ravi,Martinez,ravi.martinez@company.com,AU,,,2024-04-14 0:00,Organic Search,RETARGET1,Unknown,1.1.0,11-50,HR,0,30,,yes,2024-04-14 2:32,2024-04-23 2:32
U000561,Priya,Garcia,priya.garcia@yahoo.com,IN,BC,Europe/Berlin,2024-07-13 0:00,Social,N/A,iOS,2.0.0,10-Jan,Product,0,56,,TRUE,2024-07-13 4:53,2024-11-07 4:53
U000346,Chen,Brown,chen.brown@gmail.com,IN,NY,Asia/Tokyo,2024-05-26 0:00,Outbound,N/A,iOS,1.3.0,11-50,Support,0,N/A,,yes,2024-05-26 18:40,2024-11-07 18:40
U001478,Hana,White,hana.white@icloud.com,GB,-,America/New_York,2024-08-18 0:00,Outbound,GROWTHLAB,iOS,1.2.0,501-1000,Ops,0,58,,0,2024-08-18 19:21,2025-02-10 19:21
U001485,Ava,Smith,ava.smith@company.com,FR,RJ,America/New_York,2023-12-28 0:00,Social,WINTER25,iOS,1.2.1,51-200,Founder,0,46,,Y,2023-12-28 2:16,06-13-2024 02:16
U000347,Ethan,Anderson,ethan.anderson@nexloom.io,IN,CA,America/New_York,2024-06-05 0:00,Referral,n/a,Android,1.3.0,unknown,Marketing,1,38,U000225,FALSE,2024-06-05 18:22,2024-07-20 18:22
U002196,Sophia,Brown,sophia.brown@gmail.com,BR,SP,America/New_York,2024-03-02 0:00,Webinar,Q3_PROMO,Android,2.1.0,11-50,Product,0,36,,,2024-03-02 23:10,2024-07-18 23:10
U001808,Noah,Patel,noah.patel@gmail.com,BR,RJ,UTC,2023-09-29 0:00,Paid Search,AI-LAUNCH,Unknown,1.2.1,unknown,Sales,0,56,,FALSE,2023-09-29 18:39,2023-10-28 18:39
U002281,yuki,Thomas,yuki.thomas@gmail.com,CA,BC,,2023-11-16 0:00,Paid Search,N/A,macOS,2.0.1,501-1000,HR,0,34,,,2023-11-16 19:12,2023-11-17 19:12
 U000593 ,Mia,Robinson,mia.robinson@outlook.com,JP,NY,UTC,2023-09-26 0:00,Paid Search,GROWTHLAB,Unknown,2.1.0,11-50,Founder,0,61,,yes,2023-09-26 17:34,2024-03-21 17:34
U000936,Priya,Garcia,priya.garcia@proton.me,US,NY,Europe/Berlin,2023-11-27 0:00,Outbound,SPRING24,macOS,1.1.2,501-1000,HR,1,40,,N,2023-11-27 11:28,2023-12-04 11:28
U000334,Ivy,Taylor,ivy.taylor@nexloom.io,MX,TX,America/New_York,2023-07-28 0:00,Paid Search,GROWTHLAB,iOS,2.1.0,501-1000,HR,0,,,no,2023-07-28 15:59,2023-12-31 15:59
U001159,Anya,Davis,anya.davis@yahoo.com,IN,SP,,2024-11-17 0:00,Paid Search,WINTER25,macOS,1.3.0,1000+,Support,0,unknown,  U000120,TRUE,11/17/2024 16:14,2025-05-09 16:14
U002429,Diego,SCOTT,diego.scott@yahoo.com,SG,CA,Asia/Tokyo,2023-12-22 0:00,Webinar,N/A,Android,1.0.9,11-50,HR,1,19,,N,2023-12-22 21:08,2024-05-17 21:08
U001161,Fatima,Walker,fatima.walker@proton.me,IN,BC,,2024-10-04 0:00,Partner,WINTER25,Linux,2.1.0,501-1000,Product,0,33,,Y,2024-10-04 7:36,2025-03-21 7:36
U000819,Ravi,Martinez,ravi.martinez@nexloom.io,JP,ON,Europe/Berlin,07-05-2023,Social,SUMMER24,Windows,1.3.0,unknown,Finance,1,63,,TRUE,2023-05-07 20:56,2023-07-10 20:56
U002106,Omar,Jackson,omar.jackson@outlook.com,GB,LND,,2023-12-24 0:00,Social,AI-LAUNCH,Linux,1.1.2,10-Jan,Product,0,29,,yes,2023-12-24 23:43,2024-03-27 23:43
U000413,Sofia,Allen,sofia.allen@gmail.com,CA,MH,Europe/Berlin,2025-03-30 0:00,Outbound,Q3_PROMO,Windows,2.0.1,501-1000,Engineering,0,40,,yes,2025-03-30 16:23,2025-05-25 16:23
U002190,Diego,Walker,diego.walker@yahoo.com,U.K.,unknown,,06/22/2024,Organic Search,BF2024,Windows,1.1.0,unknown,Engineering,1,59,,1,2024-06-22 17:06,2024-07-27 17:06
U000904,Kofi,Thomas,kofi.thomas@icloud.com,au,unknown,,2024-05-09,Social,RETARGET1,Unknown,1.0.9,10-Jan,Finance,0,32,,TRUE,2024-05-09 9:12,2024-08-29 9:12
U001918,Liam,Brown,liam.brown@proton.me,JP,,America/Los_Angeles,2024-05-15 0:00,Content,WINTER25,Windows,2.0.0,51-200,Engineering,yes,34,,1,2024-05-15 7:35,2024-09-01 7:35
U000510,Ivy,Martinez,ivy.martinez@gmail.com,IN,NSW,Europe/London,2024-07-26 0:00,Social,WINTER25,iOS,1.1.2,unknown,Product,1,19,,,2024-07-26 4:38,2025-01-11 4:38
U002004,Olivia,Thompson,olivia.thompson@proton.me,CA,-,America/New_York,2023-11-13 0:00,Paid Search,RETARGET1,Windows,1.2.0,10-Jan,Ops,0,18,,FALSE,2023-11-13 0:45,01-19-2024 00:45
USR-001298,Chen,Brown,chen.brown@nexloom.io,mx,CA,Europe/Berlin,2023-07-15,Webinar,N/A,macOS,1.0.9,11-50,Marketing,0,41,,,2023-07-15 0:11,12-20-2023 00:11
U000494,Mia,Patel,mia.patel@icloud.com,FR,,Europe/Berlin,2023-10-01 0:00,Organic Search,GROWTHLAB,Windows,1.3.0,201-500,Engineering,0,50,,no,2023-10-01 15:49,2024-03-25 15:49
U000743,Omar,King, omar.king@gmail.com ,IN,ON,America/New_York,2024-08-09 0:00,Outbound,SPRING24,Android,1.1.2,51-200,HR,0,43,,0,2024-08-09 14:28,2024-11-30 14:28
U000357,Amir,King,amir.king@yahoo.com,AU,BC,America/New_York,2023-03-12 0:00,Webinar,BF2024,Windows,2.0.1,10-Jan,Sales,0,42,,FALSE,2023-03-12 1:24,2023-08-28 1:24
U000078,Omar,Wright,omar.wright@gmail.com,IN,RJ,,2023-06-06 0:00,Outbound,RETARGET1,Linux,2.0.1,51-200,Support,1,47,,FALSE,2023-06-06 0:48,0000-00-00 00:00:00
U000722,Chen,Robinson,chen.robinson@proton.me,CA,,America/New_York,2023-09-26 0:00,Partner,WINTER25,iOS,2.0.0,51-200,Support,0,46,,no,2023-09-26 15:45,2024-02-22 15:45
U000359,Ravi,Taylor,ravi.taylor@nexloom.io,US,NSW,Asia/Tokyo,2025-03-04 0:00,webinar,SUMMER24,Linux,2.0.0,1000+,Sales,0,57,,N,2025-03-04 4:55,2025-05-16 4:55
U002416,Sara,Lewis,sara.lewis@company.com,NL,BC,America/Los_Angeles,2025-05-12 0:00,Webinar,GROWTHLAB,iOS,2.0.1,1000+,Sales,0,22,,TRUE,2025-05-12 18:40,2025-07-30 18:40
U002500,Ivy,Martinez,ivy.martinez@nexloom.io,FR,BER,America/New_York,2024-02-11 0:00,Organic Search,Q3_PROMO,Linux,1.3.0,501-1000,Marketing,1,22,,1,2024-02-11 19:10,2024-04-06 19:10
U001141,Yuki,Martin,yuki.martin@proton.me,AU,unknown,Europe/London,2024-10-03 0:00,Referral,n/a,Android,2.0.1,1000+,Product,,48,U000375,1,2024-10-03 17:24,2024-11-26 17:24
U000914,Emma,Davis,emma.davis@outlook.com,FR,MH,,2024-02-12 0:00,partner,GROWTHLAB,Linux,1.1.0,51-200,Ops,0,30,,0,2024-02-12 23:27,2024-03-24 23:27
U000581,Mia,Lopez,mia.lopez@nexloom.io,gb,BC,America/Los_Angeles,2024-03-08 0:00,Social,GROWTHLAB,macOS,1.1.0,unknown,Support,0,23,,yes,2024-03-08 20:59,2024-04-11 20:59
U001163,Olivia,Thompson,olivia.thompson@yahoo.com,GB,SP,UTC,2024-01-03,Webinar,AI-LAUNCH,macOS,2.0.0,1000+,Product,0,42,,TRUE,2024-01-03 20:56,2024-03-19 20:56
U001066,Hana,Jackson,hana.jackson@nexloom.io,,TX,America/Los_Angeles,2024-08-02 0:00,Webinar,WINTER25,macOS,v1.3.0,51-200,Product,1,39,,N,2024-08-02 16:32,2024-12-08 16:32
U001373,Ethan,King,ethan.king@gmail.com,MX,SP,America/Los_Angeles,10/30/2024,Outbound,GROWTHLAB,Unknown,1.3.0,10-Jan,Marketing,0,20,,1,2024-10-30 5:59,2025-01-09 5:59
U002223,Sophia,Wright,sophia.wright@company.com,IN,CA,America/New_York,,Referral,RETARGET1,Windows,1.1.0,unknown,Founder,FALSE,47,,yes,2023-07-06 8:03,2023-12-30 8:03
U002314,Diego,Moore,diego.moore@gmail.com,DE,LND,America/New_York,2024-07-12 0:00,Content,Q3_PROMO,Linux,2.0.0,501-1000,Product,0,31,,FALSE,2024-07-12 15:44,2024-11-04 15:44
U000373,Jin,Anderson,jin.anderson@yahoo.com,IN,ON,,2023-07-03 0:00,Social,SUMMER24,Linux,1.0.9,51-200,Product,0,64,,FALSE,2023-07-03 3:08,2023-10-03 3:08
U000496,Sophia,Robinson,sophia.robinson@outlook.com,CA,LND,America/Los_Angeles,2024-01-13 0:00,Social,BF2024,Unknown,1.1.2,1000+,Product,1,20,,1,2024-01-13 16:59,2024-04-13 16:59
U000399,Lucas,Patel,lucas.patel@nexloom.io,AU,-,America/New_York,2024-08-11,Organic Search,GROWTHLAB,Android,2.0.0,51-200,Engineering,1,28,,0,2024-08-11 14:45,2024-09-19 14:45
U000394,Jin,Brown,jin.brown@nexloom.io,US,BC,America/New_York,2024-08-27 0:00,Webinar,Q3_PROMO,macOS,1.3.0,51-200,Ops,1,47,,FALSE,2024-08-27 9:48,2024-12-22 9:48
U000915,Diego,Martinez,diego.martinez@nexloom.io,SG,SP,Asia/Kolkata,2024-04-24 0:00,Webinar,AI-LAUNCH,macOS,1.2.1,201-500,Finance,0,57,,yes,2024-04-24 19:28,2024-09-05 19:28
U000662,Jin,Thompson,jin.thompson@gmail.com,in,BC,Europe/Berlin,2025-08-28 0:00,Social,WINTER25,macOS,1.2.0,501-1000,HR,0,40,,FALSE,2025-08-28 9:32,2025-09-02 9:32
U001205,Chen,Scott,chen.scott@gmail.com,US,-,Europe/Berlin,2024-03-23 0:00,Outbound,WINTER25,macOS,1.1.2,51-200,Support,0,18,,N,2024-03-23 0:00,2024-04-22 0:00
U002169,Diego,White,diego.white@nexloom.io,ZA,NSW,America/Los_Angeles,2024-06-28 0:00,Outbound,RETARGET1,iOS,1.0.9,11-50,Ops,0,N/A,,1,2024-06-28 0:21,2024-07-18
U001211,Hana,Lee,hana.lee@gmail.com,IN,WA,,2024-02-20 0:00,Webinar,WINTER25,Windows,1.1.2,1000+,Finance,0,18,,,2024-02-20 14:16,2024-06-22 14:16
U000075,Nora,White,nora.white@yahoo.com,SE,,UTC,2024-07-15 0:00,Webinar,SUMMER24,Android,1.1.0,10-Jan,HR,0,26,,0,2024-07-15 20:02,2024-08-01
U001718,Ivy,Walker,ivy.walker@company.com,AU,TX,Europe/London,2024-07-08 0:00,Referral,SPRING24,Android,1.3.0,1000+,Engineering,0,46,U000375,yes,2024-07-08 3:18,2024-09-04
U000472,Olivia,WALKER,olivia.walker@company.com,GB,CA,America/New_York,2025-06-04 0:00,Organic Search,N/A,iOS,2.1.0,1000+,Finance,0,18,,yes,2025-06-04 6:41,2025-06-24 6:41
U000996,Omar,Lopez,omar.lopez@gmail.com,SG,,,2023-06-30 0:00,Outbound,N/A,macOS,2.0.1,1000+,Marketing,1,26,,N,2023-06-30 13:21,2023-11-10 13:21
U001446,Nora,Robinson,nora.robinson@company.com,MX,BER,,2023-09-22 0:00,Partner,AI-LAUNCH,macOS,1.1.2,11-50,Founder,0,34,,,2023-09-22 5:56,2023-10-11 5:56
U000322,Fatima,Thomas,fatima.thomas@nexloom.io,AU,RJ,Asia/Kolkata,2024-07-20 0:00,Content,RETARGET1,Unknown,1.1.0,501-1000,HR,0,31,,1,2024-07-20 21:18,2024-10-18 21:18
U001639,Jin,Wilson,jin.wilson@nexloom.io,FR,CA,,2025-10-06 0:00,Outbound,BF2024,Windows,1.2.1,201-500,Marketing,0,33,,no,2025-10-06 4:03,2025-12-21 4:03
U000304,Anya,Lewis,ANYA.LEWIS@NEXLOOM.IO,MX,unknown,Europe/Berlin,2024-06-07 0:00,Content,BF2024,iOS,1.3.0,1000+,Product,0,35,,FALSE,2024-06-07 13:52,2024-10-28 13:52
U001237,Omar,King,OMAR.KING@NEXLOOM.IO,SG,WA,Europe/Berlin,2024-11-09 0:00,Referral,n/a,macOS,1.2.1,11-50,Product,0,19,U000077,TRUE,2024-11-09 22:36,2025-01-08 22:36
U002477,Omar,Young,omar.young@outlook.com,JP,,,2023-08-12 0:00,Outbound,RETARGET1,Linux,2.0.1,501-1000,Ops,0,60,,yes,2023-08-12 21:09,2023-10-03 21:09
U000339,Ava,Thomas,ava.thomas@outlook.com,BR,RJ,America/New_York,2024-03-16 0:00,Webinar,Q3_PROMO,Unknown,1.0.9,201-500,Support,1,38,,yes,2024-03-16 4:52,2024-05-12 4:52
U000203,Jin,Smith,jin.smith@proton.me,FR,,Asia/Tokyo,09/09/2023,Referral,Q3_PROMO,Android,2.0.1,unknown,Finance,0,32,U000373,no,2023-09-09 15:07,2023-11-19 15:07
U002125,Elena,Garcia,elena.garcia@outlook.com,DE,WA,UTC,2025-08-14 0:00,Organic Search,BF2024,iOS,1.2.1,1000+,Ops,0,26,,N,2025-08-14 12:37,2025-09-04 12:37
U002249,Ethan,Harris,ethan.harris@yahoo.com,CA,RJ,America/Los_Angeles,2024-05-18 0:00,Webinar,,Unknown,2.0.0,1000+,Marketing,1,37,,Y,2024-05-18 12:50,2024-07-17 12:50
U000934,Elena,Patel,elena.patel@outlook.com,BR,SP,Europe/Berlin,2024-04-10 0:00,Partner,WINTER25,Unknown,1.1.2,201-500,Ops,0,19,,,2024-04-10 11:29,2024-06-15 11:29
U002077,Lucas,Jackson,LUCAS.JACKSON@ICLOUD.COM,GB,BC,UTC,2023-11-06 0:00,Referral,WINTER25,Linux,1.0.9,51-200,Product,1,19,,Y,2023-11-06 11:18,2023-12-30 11:18
U001121,Mateo,Garcia,mateo.garcia@icloud.com,GB,RJ,,2024-12-07 0:00,Organic Search,n/a,Linux,1.1.2,11-50,Ops,1,,,no,2024-12-07 23:29,2024-12-20 23:29
U001784,Elena,Lopez,elena.lopez@yahoo.com,JP,CA,Europe/London,2024-06-07 0:00,Webinar,N/A,Linux,1.1.0,501-1000,HR,0,23,,Y,2024-06-07 0:29,2024-10-30 0:29
U002224,Yuki,Nguyen,yuki.nguyen@proton.me,MX,NY,America/New_York,11/08/2023,Webinar,GROWTHLAB,iOS,1.0.9,1000+,Support,0,unknown,,yes,2023-11-08 9:47,2023-11-18
U001729,Chen,Lewis,chen.lewis@company.com,DE,SP,,2024-09-24 0:00,Organic Search,WINTER25,macOS,2.0.0,unknown,Founder,0,19,,no,2024-09-24 16:45,2024-09-27 16:45
U000149,Kofi,Thomas,kofi.thomas@yahoo.com,NL,TX,Asia/Tokyo,2023-05-01 0:00,Organic Search,RETARGET1,Android,1.2.0,501-1000,Marketing,0,42,,FALSE,2023-05-01 18:35,2023-10-25 18:35
U002305,Yuki,Young,yuki.young@gmail.com,BR,BC,America/New_York,2025-02-13 0:00,Social,Q3_PROMO,iOS,1.2.0,201-500,Sales,1,27,,yes,2025-02-13 15:43,2025-07-04
U001946,Zoe,Patel,zoe.patelcompany.com,BR,BC,America/Los_Angeles,2024-04-06 0:00,Paid Search,WINTER25,macOS,1.2.0,unknown,Engineering,0,56,,TRUE,2024-04-06 23:25,2024-07-12 23:25
U002306,Jin,Lee,jin.lee@proton.me,AU,WA,Asia/Kolkata,2024-02-05 0:00,Content,SUMMER24,Windows,1.1.0,1000+,Finance,0,52,,yes,2024-02-05 15:29,2024-07-26 15:29
U000897,Ivy,Martin,ivy.martin@company.com,BR,,,12/10/2023,Outbound,N/A,Android,1.3.0,201-500,Finance,0,47,,N,2023-12-10 11:30,2023-12-27 11:30
U002057,Ben,Martinez,ben.martinez@proton.me,US,BER,Europe/London,03/10/2024,Social,BF2024,macOS,1.3.0,11-50,Marketing,0,59,,,2024-03-10 22:05,2024-09-05 22:05
U001547,Ivy,Walker,ivy.walker@proton.me,JP,-,Asia/Kolkata,18-09-2024,Outbound,RETARGET1,iOS,1.1.0,501-1000,Product,0,46,,N,2024-09-18 19:00,2024-11-06
U001797,Diego,White,diego.white@gmail.com,US,RJ,America/Los_Angeles,2024-07-21 0:00,Referral,SUMMER24,iOS,1.3.0,51-200,Engineering,0,64,,no,2024-07-21 9:04,2024-07-24 9:04
 U001329 ,Emma,Young,emma.young@nexloom.io,ZA,WA,,2024-06-18 0:00,Paid Search,SPRING24,Unknown,1.1.2,11-50,Marketing,0,,,TRUE,2024-06-18 21:23,2024-07-12 21:23
U002311,Mia,Wright,mia.wright@outlook.com,GB,,,2024-04-01 0:00,Outbound,Q3_PROMO,iOS,1.2.1,1000+,Ops,0,31,,yes,2024-04-01 4:50,2024-08-03 4:50
U002053,Priya,Johnson,priya.johnson@proton.me,FR,MH,Europe/London,2023-09-13 0:00,Content,BF2024,macOS,2.1.0,1000+,Support,1,unknown,,TRUE,2023-09-13 0:10,2023-12-12
U000109,Sophia,Moore,sophia.moore@icloud.com,JP,-,Asia/Tokyo,2023-10-30 0:00,Referral,SPRING24,Linux,2.0.1,10-Jan,Support,no,30,U000038,0,2023-10-30 10:50,2024-03-02 10:50
U002023,Sara,Lee,sara.lee@gmail.com,US,,Asia/Kolkata,2025-02-24,Content,N/A,Android,1.3.0,10-Jan,Marketing,1,41,,FALSE,2025-02-24 8:36,2025-04-01 8:36
U001850,Zoe,Patel,zoe.patel@outlook.com,JP,BC,Asia/Tokyo,2024-06-11 0:00,Organic Search,n/a,Windows,2.0.0,unknown,Sales,0,52,,,2024-06-11 5:48,2024-07-05 5:48
U000235,Liam,Scott,liam.scott@nexloom.io,DE,LND,,2023-10-06 0:00,Referral,SPRING24,Unknown,2.0.1,201-500,Engineering,0,36,,,2023-10-06 10:22,2024-01-31 10:22
U001398,Jin,Lee,jin.lee@gmail.com,CA,,Asia/Kolkata,03-45-2024,Referral,WINTER25,Unknown,1.0.9,201-500,Product,0,64,,1,2023-11-13 4:14,2024-05-03 4:14
U000474,Sara,JACKSON,sara.jackson@company.com,CA,,Europe/Berlin,2024-12-10 0:00,Referral,n/a,Unknown,2.0.1,10-Jan,Ops,0,unknown,U000318,FALSE,2024-12-10 6:32,2025-05-01 6:32
U002189,Ava,King,ava.king@company.com,MX,BER,America/New_York,2024-09-05 0:00,Social,AI-LAUNCH,Linux,1.1.0,1000+,Product,0,52,,N,2024-09-05 2:55,2024-10-24 2:55
U002285,Ravi,Lee,ravi.lee@icloud.com,NL,MH,UTC,2023-08-21 0:00,Partner,SUMMER24,macOS,1.1.2,1000+,Product,1,27,,yes,2023-08-21 7:40,2024-02-17 7:40
U000481,Elena,White,elena.white@gmail.com,GB,RJ,,2024-06-02 0:00,Webinar,  BF2024  ,macOS,1.1.2,10-Jan,Marketing,0,62,,N,2024-06-02 2:41,2024-10-21 2:41
U002403,Anya,Davis,anya.davis@yahoo.com,US,RJ,Europe/London,2024-02-12 0:00,Outbound,NA,iOS,2.0.0,unknown,Marketing,0,55,,0,2024-02-12 4:39,2024-08-07 4:39
U001221,Zoe,Harris,zoe.harris@proton.me,ZA,,Europe/Berlin,2025-03-31 0:00,Paid Search,,Android,1.1.2,11-50,Support,1,60,,0,2025-03-31 6:50,2025-08-21 6:50
U001646,Mateo,Martinez,mateo.martinez@nexloom.io,IN,BER,,2024-08-13 0:00,Webinar,N/A,Windows,2.0.1,501-1000,Engineering,0,41,,TRUE,2024-08-13 8:47,2024-10-01 8:47
U001748,Noah,Lee,noah.lee@yahoo.com,SE,RJ,,2023-11-20 0:00,Organic Search,GROWTHLAB,macOS,1.2.0,51-200,Product,0,22,,FALSE,2023-11-20 1:40,2023-11-24 1:40
U000971,Amir,King,amir.king@company.com,ZA,NY,,06/21/2024,Organic Search,N/A,Unknown,2.0.1,501-1000,Engineering,0,47,,yes,2024-06-21 18:11,2024-08-07 18:11
U001935,Leo,Scott,leo.scott@yahoo.com,JP,-,America/Los_Angeles,28-06-2024,Outbound,SUMMER24,macOS,1.3.0,10-Jan,Finance,0,36,,,2024-06-28 23:20,2024-08-07 23:20
U000977,Elena,Lewis,elena.lewis@proton.me,ZA,TX,,2024-05-16,Content,SPRING24,Windows,1.1.2,201-500,Finance,0,39,,yes,2024-05-16 22:42,2024-07-07 22:42
U001230,Noah,Lewis,noah.lewis@yahoo.com,NL,NY,America/Los_Angeles,2024-02-12,Outbound,BF2024,Linux,2.0.0,11-50,Engineering,0,54,,0,2024-02-12 0:40,2024-05-16 0:40
U000204,Yuki,Perez,yuki.perez@yahoo.com,SE,NY,,20-12-2024,Organic Search,,macOS,2.0.1,501-1000,HR,0,55,,TRUE,2024-12-20 13:02,2025-02-23 13:02
U000592,Liam,Garcia,liam.garcia@proton.me,ca,,America/Los_Angeles,2024-06-09 0:00,Social,SPRING24,Unknown,2.1.0,51-200,Sales,0,44,,0,2024-06-09 17:22,2024-08-10 17:22
U001819,Ava,Thompson,ava.thompson@icloud.com,BR,,Asia/Kolkata,2024-05-31 0:00,Social,BF2024,Linux,1.2.0,201-500,Ops,1,28,,TRUE,2024-05-31 4:32,2024-07-21 4:32
U000157,Lucas,Brown,lucas.brown@proton.me,IN,NSW,,2024-06-25 0:00,Referral,GROWTHLAB,Unknown,1.1.0,10-Jan,Product,0,22,,TRUE,2024-06-25 9:05,2024-08-02 9:05
U002048,Elena,Thompson,elena.thompson@nexloom.io,US,SP,Europe/Berlin,2024-07-16 0:00,webinar,WINTER25,iOS,1.1.0,501-1000,Sales,1,53,,1,2024-07-16 20:23,2024-12-02 20:23
U000923,Sophia,Young,sophia.young@company.com,IN,RJ,Asia/Kolkata,2024-12-14 0:00,Paid Search,N/A,iOS,1.1.0,unknown,Support,0,,,TRUE,2024-12-14 6:26,2024-12-22 6:26
U001323,Anya,Perez,anya.perez@company.com,FR,ON,America/Los_Angeles,2024-11-17,Organic Search,SUMMER24,iOS,1.3.0,501-1000,Ops,,23,,Y,2024-11-17 22:46,2025-02-02 22:46
U000590,Hana,King,hana.king@company.com,ZA,CA,America/Los_Angeles,2023-09-01 0:00,Paid Search,RETARGET1,macOS,1.2.0,1000+,Support,0,59,,Y,2023-09-01 9:08,2023-10-15 9:08
U000174,Anya,Lewis,anya.lewis@outlook.com,AU,NSW,UTC,2024-09-05 0:00,Partner,RETARGET1,Android,1.1.2,1000+,Product,0,20,,0,2024-09-05 15:02,2024-10-01 15:02
U001210,Yuki,Moore,yuki.moore@nexloom.io,AU,-,Europe/London,2025-11-09 0:00,Organic Search,WINTER25,Unknown,1.2.0,unknown,HR,1,23,,,2025-11-09 8:48,2026-03-30 8:48
U000380,Olivia,Allen,olivia.allen@nexloom.io,IN,SP,,2023-12-03 0:00,Paid Search,GROWTHLAB,Windows,1.2.1,1000+,Marketing,1,61,,FALSE,2023-12-03 13:24,2024-01-28 13:24
U000988,Fatima,Allen,fatima.allen@icloud.com,JP,,Asia/Tokyo,2024-02-25 0:00,Webinar,N/A,macOS,2.0.1,1000+,Marketing,0,54,,TRUE,2024-02-25 19:14,2024-07-31 19:14
U001338,Emma,Clark,emma.clark@nexloom.io,ZA,-,Europe/Berlin,2024-06-30 0:00,Paid Search,SPRING24,Android,2.1.0,unknown,Support,1,55,,no,2024-06-30 23:39,2024-11-16 23:39
U001588,Lucas,Anderson,lucas.anderson@icloud.com,GB,RJ,Europe/London,2024-02-09 0:00,Referral,n/a,Windows,1.2.1,unknown,Finance,0,34,U000453,0,2024-02-09 19:07,2024-04-05 19:07
U001192,Fatima,Anderson, fatima.anderson@nexloom.io ,US,LND,,2024-05-09 0:00,Content,GROWTHLAB,macOS,1.0.9,11-50,Finance,0,46,,FALSE,2024-05-09 13:37,2024-09-10 13:37
U001712,Mateo,Lopez,mateo.lopez@nexloom.io,AU,RJ,Asia/Tokyo,18-05-2023,Referral,n/a,Android,2.0.1,1000+,Support,0,,U000443,1,2023-05-18 19:27,2023-06-25 19:27
U001967,Hana,Allen,hana.allen@proton.me,ZA,WA,Europe/London,2023-09-28 0:00,Social,GROWTHLAB,Linux,1.1.0,501-1000,Engineering,0,N/A,,Y,2023-09-28 6:27,2023-12-20 6:27
U002536,Liam,Lopez,liam.lopez@proton.me,DE,RJ,,2024-10-11 0:00,Webinar,RETARGET1,Android,v1.2.0,201-500,Support,0,N/A,,0,10/11/2024 14:10,2024-12-01 14:10
U001136,Priya,Young,priya.young@proton.me,JP,BER,,2023-06-09 0:00,Referral,SUMMER24,Android,1.0.9,11-50,Founder,1,46,U000397,,2023-06-09 18:18,2023-11-26 18:18
U001488,Leo,Scott,leo.scott@nexloom.io,ZA,MH,America/Los_Angeles,2024-07-08 0:00,Referral,n/a,Unknown,1.2.0,1000+,Finance,0,64,U000425,yes,2024-07-08 3:51,2024-07-27 3:51
U000237,Hana,Johnson,hana.johnson@gmail.com,MX,ON,America/New_York,12/03/2023,Webinar,RETARGET1,Windows,1.1.2,1000+,Finance,0,54,,0,2023-12-03 18:20,2024-01-19 18:20
U001761,Liam,Martinez,liam.martinez@company.com,MX,BER,Asia/Tokyo,03/06/2024,Webinar,N/A,Windows,1.0.9,501-1000,Sales,0,52,,Y,2024-03-06 11:27,2024-05-03 11:27
U001660,Nora,Perez,nora.perez@icloud.com,DE,NSW,,2024-03-02 0:00,Partner,Q3_PROMO,Android,1.2.1,51-200,Product,0,44,,FALSE,2024-03-02 13:12,2024-06-02 13:12
U000924,Ava,White,ava.white@proton.me,ZA,-,Europe/London,2024-09-13 0:00,Content,N/A,Windows,1.3.0,51-200,Engineering,0,33,,TRUE,2024-09-13 15:54,2024-09-23 15:54
U000950,Liam,Young,liam.young@company.com,BR,unknown,UTC,2024-05-17 0:00,Outbound,BF2024,Android,1.1.0,1000+,Finance,1,50,,TRUE,2024-05-17 0:12,2024-08-08 0:12
U000917,Liam,Lewis,liam.lewis@company.com,GB,TX,Europe/Berlin,2023-12-11 0:00,Organic Search,AI-LAUNCH,Linux,1.2.1,51-200,Engineering,0,18,,no,2023-12-11 4:07,2024-02-21 4:07
U002454,Yuki,Young,yuki.young@proton.me,U.K.,BER,UTC,2024-01-10 0:00,Social,AI-LAUNCH,macOS,1.0.9,11-50,HR,0,50,,no,2024-01-10 14:12,2024-03-16 14:12
U001378,Sophia,Johnson,sophia.johnson@yahoo.com,BR,unknown,Europe/Berlin,2024-04-05 0:00,Referral,Q3_PROMO,macOS,1.3.0,unknown,HR,0,,U000002,FALSE,2024-04-05 22:26,2024-06-08 22:26
U002034,Chen,Patel,chen.patelproton.me,CA,,Europe/Berlin,2025-06-13 0:00,Webinar,SPRING24,Windows,1.3.0,501-1000,HR,0,,,0,2025-06-13 15:08,2025-10-25 15:08
U002374,Ava,Taylor,ava.taylor@gmail.com,ZA,BER,America/New_York,2024-02-22 0:00,Organic Search,WINTER25,Windows,1.2.0,1000+,Founder,0,32,,FALSE,2024-02-22 2:08,2024-04-24 2:08
U001695,Olivia,Taylor,olivia.taylor@gmail.com,SG,TX,Europe/Berlin,2024-01-21 0:00,Webinar,Q3_PROMO,Windows,2.0.0,1000+,HR,0,47,,FALSE,2024-01-21 8:39,2024-06-10 8:39
U001177,Ben,Walker, ben.walker@company.com ,IN,SP,Asia/Tokyo,2024-08-30 0:00,Organic Search,n/a,Android,v2.0.1,1000+,Support,1,25,,,2024-08-30 12:52,2024-10-15 12:52
U001993,Sophia,Young,sophia.young@company.com,DE,CA,Europe/Berlin,2024-05-23 0:00,Paid Search,WINTER25,Unknown,1.1.2,1000+,Founder,1,52,,yes,2024-05-23 0:07,2024-08-15 0:07
U000538,Mateo,Brown,mateo.brown@proton.me,AU,SP,America/New_York,2023-11-12 0:00,Social,GROWTHLAB,macOS,1.2.1,unknown,HR,1,63,,,2023-11-12 1:52,2024-02-06 1:52
U000579,Zoe,Harris,zoe.harris@company.com,SG,CA,UTC,2024-03-25 0:00,Webinar,RETARGET1,Unknown,1.3.0,1000+,Product,0,37,,yes,2024-03-25 0:20,2024-09-11 0:20
U001976,Priya,Davis,priya.davis@icloud.com,DE,SP,America/New_York,03/05/2025,Organic Search,n/a,macOS,2.0.0,10-Jan,Support,0,59,,N,2025-03-05 4:40,2025-05-26 4:40
U000221,Hana,Nguyen,hana.nguyen@nexloom.io,BR,CA,Asia/Kolkata,2024-06-17 0:00,Paid Search,null,Android,1.3.0,unknown,Sales,0,20,,FALSE,2024-06-17 2:49,2024-11-04 2:49
U000210,Ivy,Nguyen,ivy.nguyen@outlook.com,SG,BER,America/New_York,2023-09-09 0:00,Paid Search,N/A,macOS,1.1.0,51-200,Product,0,51,,Y,2023-09-09 2:04,2023-09-17 2:04
U000393,Lucas,Nguyen,lucas.nguyen@yahoo.com,ZA,-,UTC,2024-01-23 0:00,Referral,BF2024,Windows,1.2.0,501-1000,Marketing,0,53,,TRUE,01/23/2024 03:27,2024-03-31 3:27
U002422,Zoe,Harris,zoe.harris@gmail.com,UK,LND,America/New_York,2023-03-05 0:00,Referral,AI-LAUNCH,Unknown,1.2.0,1000+,Product,0,30,,TRUE,2023-03-05 1:28,2023-06-11 1:28
U001594,Sara,Lee,sara.lee@proton.me,au,ON,,2023-07-15 0:00,Webinar,BF2024,iOS,1.1.0,51-200,Engineering,0,61,,0,2023-07-15 1:21,2023-12-27 1:21
U002533,Elena,Lewis,elena.lewis@icloud.com,CA,,America/New_York,2023-12-11 0:00,Outbound,BF2024,Unknown,2.0.0,10-Jan,Founder,0,46,,TRUE,2023-12-11 15:14,2024-04-18 15:14
U002581,Anya,Wright, anya.wright@gmail.com ,ZA,,,2023-08-04 0:00,Social,BF2024,macOS,1.1.2,201-500,Ops,1,24,,no,2023-08-04 9:01,2023-10-16 9:01
U000027,Olivia,Thomas,olivia.thomas@outlook.com,JP,BER,Asia/Kolkata,2024-01-14,Paid Search,RETARGET1,Android,2.1.0,201-500,Founder,1,38,,,2024-01-14 15:08,2024-07-01 15:08
U001889,Noah,Lee,noah.lee@company.com,IN,CA,,2024-07-27 0:00,Paid Search,Q3_PROMO,Windows,1.3.0,51-200,HR,0,unknown,,FALSE,2024-07-27 22:40,2024-12-11 22:40
U000715,Jin,King,jin.kingicloud.com,JP,,,11-01-2024,Webinar,AI-LAUNCH,macOS,2.1.0,1000+,Ops,0,39,,0,2024-01-11 18:31,05-19-2024 18:31
U000441,Nora,Martin,nora.martin@icloud.com,MX,NSW,America/Los_Angeles,2023-06-21 0:00,Paid Search,GROWTHLAB,Linux,1.0.9,11-50,Sales,0,21,,N,2023-06-21 23:24,10-15-2023 23:24
U000431,Kofi,Lee,kofi.lee@company.com,GB,-,Europe/London,2023-08-24 0:00,Partner,RETARGET1,Android,2.0.0,10-Jan,Finance,0,53,,,2023-08-24 5:56,2023-10-18 5:56
U000894,Priya,Perez,priya.perez@yahoo.com,BR,BER,Asia/Kolkata,2024-02-05 0:00,Content,WINTER25,macOS,1.2.1,unknown,Marketing,0,52,,no,2024-02-05 16:24,2024-04-16 16:24
U000110,Diego,Robinson,diego.robinson@icloud.com,NL,LND,Asia/Kolkata,10-06-2023,Webinar,N/A,Android,2.1.0,1000+,Engineering,0,26,,N,2023-06-10 1:03,2023-11-05 1:03
U001987,Sofia,Davis,sofia.davis@proton.me,JP,NSW,UTC,2024-07-27 0:00,Webinar,,macOS,1.3.0,10-Jan,Support,0,25,,no,2024-07-27 7:45,2024-09-27 7:45
U001143,Liam,Lewis,LIAM.LEWIS@NEXLOOM.IO,IN,CA,,2024-06-29 0:00,Partner,N/A,iOS,1.2.0,201-500,Founder,0,38,,FALSE,2024-06-29 3:26,2024-07-17 3:26
U001055,Anya,Thompson,anya.thompson@company.com,SG,ON,Europe/London,2025-11-15 0:00,Referral,n/a,macOS,2.1.0,unknown,Finance,1,18,U000252,no,2025-11-15 4:54,2026-04-03 4:54
U000871,Noah,Robinson,noah.robinson@yahoo.com,MX,MH,America/Los_Angeles,2024-01-24 0:00,Referral,AI-LAUNCH,Android,1.2.1,11-50,Founder,1,49,U000224,FALSE,2024-01-24 19:00,2024-02-03 19:00
U002553,Sofia,Walker,sofia.walker@company.com,GB,SP,America/New_York,2024-09-20 0:00,Social,WINTER25,Linux,1.0.9,1000+,Sales,0,64,,TRUE,2024-09-20 22:08,2025-01-08 22:08
U002369,Ivy,Scott,ivy.scott@outlook.com,BR,BER,Asia/Tokyo,2024-01-08 0:00,Organic Search,n/a,Unknown,2.0.0,501-1000,Ops,0,41,,FALSE,2024-01-08 18:16,2024-03-21 18:16
U001462,Jin,Jackson,jin.jacksonicloud.com,IN,SP,,2024-06-14 0:00,Webinar,RETARGET1,Unknown,2.0.0,501-1000,Ops,0,60,,yes,2024-06-14 1:20,2024-10-10 1:20
U001519,Ivy,Young,ivy.young@icloud.com,DE,CA,America/Los_Angeles,2023-11-09 0:00,Referral,Q3_PROMO,Android,1.2.0,unknown,Product,0,23,U000010,TRUE,2023-11-09 17:41,2023-12-19 17:41
U000217,Yuki,Garcia,yuki.garcia@nexloom.io,US,BER,Europe/Berlin,2023-12-29 0:00,Social,SUMMER24,Linux,1.0.9,501-1000,Marketing,0,32,,yes,2023-12-29 11:37,2024-01-19 11:37
U002119,Hana,Davis,hana.davis@icloud.com,SE,ON,Europe/London,2023-06-19 0:00,Organic Search,GROWTHLAB,Windows,1.2.1,201-500,Support,0,32,,no,2023-06-19 21:01,2023-10-21 21:01
U002574,Sofia,Patel,sofia.patel@outlook.com,CA,ON,America/New_York,2024-03-17 0:00,Webinar,AI-LAUNCH,Android,1.1.0,11-50,Finance,0,53,,1,2024-03-17 1:12,2024-04-29 1:12
U001830,Noah,Robinson,noah.robinson@company.com,JP,,America/Los_Angeles,2023-12-10 0:00,Paid Search,N/A,Unknown,2.1.0,10-Jan,HR,0,40,,FALSE,2023-12-10 23:42,2024-03-06 23:42
U001609,Kofi,Scott,kofi.scott@company.com,AU,LND,Asia/Kolkata,2023-11-03 0:00,Organic Search,n/a,Android,2.0.0,unknown,Support,0,55,,yes,2023-11-03 15:53,2024-03-22 15:53
U001167,Sofia,Allen,sofia.allen@gmail.com,FR,MH,America/Los_Angeles,2024-10-09 0:00,Referral,n/a,Windows,1.2.0,10-Jan,Founder,0,56,U000489,FALSE,2024-10-09 8:03,2025-01-20
U000290,Hana,Walker,hana.walker@yahoo.com,DE,LND,America/New_York,13-05-2024,Organic Search,n/a,Linux,2.0.1,11-50,Marketing,1,37,,0,2024-05-13 15:01,2024-10-26 15:01
U000875,Priya,Moore,priya.moore@gmail.com,DE,,,09-03-2023,Social,BF2024,Linux,1.0.9,1000+,Founder,TRUE,29,,TRUE,2023-03-09 13:51,04-07-2023 13:51
U000736,Elena,Robinson,elena.robinson@outlook.com,IN,CA,Europe/Berlin,2024-11-23 0:00,Outbound,SUMMER24,Windows,1.1.0,unknown,Founder,0,35,,FALSE,2024-11-23 14:58,2025-01-23 14:58
U000283,Emma,Moore,emma.moore@outlook.com,SG,,America/New_York,25-01-2024,Partner,WINTER25,iOS,v1.1.0,201-500,HR,0,43,,yes,2024-01-25 19:15,2024-05-03
U001711,Ravi,Thompson,ravi.thompson@yahoo.com,AU,BER,Europe/Berlin,2023-09-01,Webinar,GROWTHLAB,Unknown,2.0.1,501-1000,Marketing,0,49,,no,2023-09-01 6:27,2023-12-13 6:27
U001123,Emma,ANDERSON,emma.anderson@gmail.com,IN,,,2024-11-07 0:00,Content,N/A,Android,v1.2.0,10-Jan,Marketing,0,33,,yes,2024-11-07 9:25,2025-02-07
U000183,Sara,King, sara.king@gmail.com ,ZA,WA,,2025-01-30 0:00,Outbound,AI-LAUNCH,Android,1.3.0,10-Jan,Finance,1,33,,FALSE,2025-01-30 3:04,2025-03-31 3:04
U000438,Anya,Harris,anya.harris@proton.me,BR,ON,America/New_York,2024-10-01 0:00,Webinar,BF2024,Linux,1.1.2,10-Jan,HR,0,42,,N,2024-10-01 13:25,2025-03-23 13:25
U001833,Olivia,Thomas,olivia.thomas@proton.me,US,WA,Asia/Kolkata,2024-05-09 0:00,Partner,BF2024,Windows,1.3.0,unknown,Finance,0,41,,no,2024-05-09 8:24,2024-10-15 8:24
U001086,Jin,Nguyen,jin.nguyen@icloud.com,BR,SP,Asia/Kolkata,2024-03-12 0:00,Social,WINTER25,iOS,2.0.0,10-Jan,Engineering,0,60,,TRUE,2024-03-12 5:04,2024-05-25 5:04
U000324,Ivy,Moore,ivy.moore@outlook.com,JP,,,2023-12-02 0:00,Content,SPRING24,macOS,1.1.2,201-500,Engineering,0,19,,no,2023-12-02 5:58,2024-03-31 5:58
U002185,Nora,White,nora.white@icloud.com,CA,-,Europe/Berlin,2024-06-15 0:00,Outbound,N/A,Android,1.0.9,201-500,Finance,no,57,,Y,2024-06-15 13:29,0000-00-00 00:00:00
U000326,Ivy,Young,ivy.young@gmail.com,JP,-,Europe/Berlin,2024-08-02 0:00,Referral,N/A,macOS,2.0.1,1000+,Engineering,0,63,U000050,1,2024-08-02 9:23,2025-01-01
U000293,Sofia,White,sofia.white@yahoo.com,SE,NY,Europe/London,2024-10-01 0:00,Webinar,Q3_PROMO,macOS,1.1.2,1000+,Product,1,25,,N,2024-10-01 8:50,2024-12-05
U001391,Ethan,Patel,ethan.patel@company.com,SE,SP,UTC,04-11-2023,Content,BF2024,Unknown,1.1.2,51-200,Marketing,0,44,,no,2023-11-04 11:23,2024-03-24
U001369,Zoe,Jackson,zoe.jackson@nexloom.io,ca,NSW,America/Los_Angeles,2023-09-24 0:00,outbound,BF2024,Windows,1.1.0,1000+,Product,0,31,,Y,2023-09-24 3:52,2024-01-26 3:52
u000944,Sara,Lewis,sara.lewis@company.com,AU,CA,,2024-10-07 0:00,Webinar,N/A,iOS,2.0.1,10-Jan,Sales,1,30,,no,2024-10-07 2:17,2025-02-03 2:17
U001648,Sophia,Moore,sophia.moore@proton.me,DE,RJ,Asia/Tokyo,2024-10-04 0:00,Organic Search,Q3_PROMO,Linux,1.1.2,501-1000,Support,0,37,,TRUE,2024-10-04 17:47,2025-02-03
U001046,Jin,Lopez,JIN.LOPEZ@OUTLOOK.COM,SG,BER,Europe/London,2024-05-26 0:00,Partner,N/A,Linux,1.2.1,201-500,Product,0,54,,no,2024-05-26 10:49,2024-08-13 10:49
U000808,Sara,White,sara.white@outlook.com,BR,NSW,Europe/London,2025-02-01 0:00,Content,SPRING24,Linux,1.1.2,501-1000,Sales,0,46,,yes,02/01/2025 18:16,2025-05-25 18:16
U002152,Chen,Walker,chen.walker@nexloom.io,CA,TX,Europe/Berlin,2023-09-20 0:00,Webinar,Q3_PROMO,macOS,1.2.0,10-Jan,Ops,0,45,,,2023-09-20 20:45,2023-12-18 20:45
U000880,Liam,Walker,liam.walker@proton.me,AU,NY,Asia/Kolkata,2023-10-26 0:00,Content,BF2024,Linux,1.1.0,501-1000,Finance,0,,,TRUE,2023-10-26 12:00,2023-10-26 12:00
U001301,Ben,SCOTT,ben.scott@proton.me,IN,CA,Asia/Tokyo,2023-03-23 0:00,Organic Search,n/a,iOS,1.3.0,11-50,Sales,0,45,,yes,2023-03-23 16:20,2023-04-08 16:20
U000521,Lucas,Smith,lucas.smith@proton.me,BR,MH,Asia/Kolkata,2024-05-15 0:00,Referral,N/A,macOS,1.1.2,501-1000,HR,0,43,U000021,no,2024-05-15 19:34,2024-06-03 19:34
U002345,Elena,Thomas,elena.thomas@proton.me,ZA,,America/Los_Angeles,2025-03-07,Organic Search,n/a,macOS,1.0.9,201-500,Marketing,0,53,,1,2025-03-07 20:32,2025-08-24 20:32
U000057,Anya,Smith,anya.smith@proton.me,SE,ON,,2023-06-26 0:00,Outbound,BF2024,Unknown,1.3.0,unknown,HR,1,37,,FALSE,2023-06-26 5:58,2023-12-03 5:58
U002242,Anya,Martinez,anya.martinez@gmail.com,BR,BER,Europe/Berlin,2023-03-30 0:00,Paid Search,GROWTHLAB,iOS,2.0.1,51-200,Finance,0,28,,1,2023-03-30 16:46,2023-07-30 16:46
U001599,Ivy,Lewis,ivy.lewisgmail.com,USA,MH,UTC,2023-06-22 0:00,Partner,WINTER25,Linux,2.0.1,501-1000,HR,0,63,,TRUE,2023-06-22 6:04,12-11-2023 06:04
U001419,Chen,Allen,chen.allen@company.com,GB,BER,,2024-03-05,Paid Search,WINTER25,macOS,1.0.9,11-50,HR,1,32,,Y,2024-03-05 8:13,2024-08-12 8:13
U001693,Kofi,Lopez,kofi.lopez@nexloom.io,,RJ,,2025-02-30,Webinar,RETARGET1,Windows,1.1.2,10-Jan,Finance,0,19,,TRUE,2024-02-06 19:05,2024-07-25 19:05
U002351,Fatima,Robinson,fatima.robinson@proton.me,SE,SP,Europe/Berlin,2024-06-06 0:00,Referral,N/A,macOS,2.1.0,10-Jan,Founder,0,27,U000300,0,2024-06-06 22:52,2024-07-01 22:52
U001310,Liam,Moore,liam.moore@icloud.com,SG,NSW,America/New_York,2024-09-25 0:00,Content,BF2024,Windows,2.0.1,501-1000,HR,0,62,,yes,2024-09-25 10:39,2025-02-16 10:39
U000647,Chen,Lewis,chen.lewis@icloud.com,SE,SP,,2024-05-15 0:00,Partner,Q3_PROMO,Unknown,2.0.0,501-1000,Marketing,0,24,,FALSE,2024-05-15 21:20,2024-10-02 21:20
U000035,Nora,Davis,nora.davis@nexloom.io,ZA,unknown,Asia/Tokyo,2025-05-18 0:00,Outbound,BF2024,macOS,1.1.0,unknown,Ops,0,,,N,2025-05-18 20:11,2025-06-01 20:11
U000479,Kofi,King,kofi.king@yahoo.com,ZA,NSW,Asia/Tokyo,2025-06-02 0:00,Organic Search,n/a,Windows,2.0.1,201-500,Marketing,0,41,,Y,2025-06-02 14:46,2025-11-20 14:46
U000841,Noah,Clark,noah.clark@icloud.com,BR,MH,Europe/London,2023-02-07 0:00,Referral,RETARGET1,Android,1.1.0,51-200,Support,0,23,U000123,N,2023-02-07 5:06,2023-06-25 5:06
U000784,Emma,Martin,emma.martin@nexloom.io,,,America/New_York,2024-01-09 0:00,Paid Search,RETARGET1,Linux,1.1.2,201-500,HR,1,64,,Y,2024-01-09 19:23,2024-03-26 19:23
U000847,Anya,Taylor,anya.taylor@outlook.com,SG,RJ,Europe/Berlin,2023-06-22 0:00,Webinar,N/A,iOS,2.1.0,unknown,Product,0,64,,,2023-06-22 14:49,2023-08-20 14:49
U002308,Amir,Wright,amir.wright@gmail.com,GB,BER,America/Los_Angeles,2024-05-27 0:00,Partner,GROWTHLAB,Windows,2.1.0,201-500,Sales,0,34,,Y,2024-05-27 2:36,2024-10-15 2:36
U000765,Diego,Patel,diego.patel@nexloom.io,CA,BER,Europe/Berlin,2023-03-27 0:00,Social,SUMMER24,Windows,1.0.9,501-1000,Support,1,57,,0,2023-03-27 19:38,2023-08-11 19:38
U002292,Leo,Brown,LEO.BROWN@COMPANY.COM,GB,TX,Asia/Tokyo,2023-12-03 0:00,Content,N/A,Windows,2.0.1,201-500,Ops,0,51,,no,2023-12-03 23:51,2024-01-24 23:51
U002154,Sofia,Martin,sofia.martin@outlook.com,SE,NY,Europe/Berlin,2024-10-04 0:00,Webinar,Q3_PROMO,Android,2.1.0,unknown,Finance,0,18,,FALSE,10/04/2024 07:52,2025-01-23 7:52
U000764,Mateo,Thompson, mateo.thompson@nexloom.io ,USA,ON,Europe/London,06-08-2024,Content,N/A,Android,2.0.0,11-50,Finance,0,62,,0,2024-08-06 20:27,2024-10-04 20:27
USR-002262,Sofia,King, sofia.king@nexloom.io ,ZA,TX,,2024-05-19 0:00,Referral,RETARGET1,macOS,1.1.2,unknown,Sales,0,58,U000454,Y,2024-05-19 23:04,2024-10-15 23:04
U001041,Nora,Thompson,nora.thompson@icloud.com,DE,NSW,America/New_York,2024-04-17 0:00,Referral,n/a,macOS,1.2.0,1000+,Founder,0,42,U000076,TRUE,2024-04-17 12:23,2024-08-20 12:23
U000010,Lucas,Brown, lucas.brown@nexloom.io ,BR,TX,Asia/Kolkata,2024-07-16 0:00,Webinar,N/A,macOS,1.2.0,11-50,Finance,0,35,,0,2024-07-16 3:56,2024-09-20 3:56
U000063,Hana,Smith,hana.smith@gmail.com,SE,,America/New_York,2024-10-06 0:00,Social,SPRING24,Android,2.0.1,501-1000,Finance,0,29,,Y,2024-10-06 21:38,0000-00-00 00:00:00
U000313,Ethan,Lopez,ethan.lopez@nexloom.io,NL,NSW,Europe/Berlin,2023-03-09 0:00,Paid Search,SUMMER24,macOS,1.2.1,51-200,Finance,1,30,,TRUE,2023-03-09 12:24,2023-06-06 12:24
U000804,Fatima,Young,fatima.young@gmail.com,NL,RJ,Asia/Tokyo,2024-05-22,Referral,n/a,iOS,2.0.0,10-Jan,Sales,0,38,,yes,2024-05-22 1:15,2024-06-01 1:15
U000358,Hana,Jackson,hana.jackson@outlook.com,DE,BC,Europe/London,2024-05-11,Partner,N/A,Android,1.0.9,10-Jan,Sales,0,53,,no,2024-05-11 13:59,2024-09-20 13:59
U000029,Ethan,Martin,ethan.martin@proton.me,MX,LND,Europe/London,2024-10-06 0:00,Paid Search,SUMMER24,Linux,1.2.1,1000+,Marketing,1,19,,0,2024-10-06 5:39,2025-02-07 5:39
U000108,Noah,Thomas,noah.thomas@yahoo.com,CA,MH,Europe/London,2024-08-14 0:00,Content,SUMMER24,Windows,2.0.1,11-50,Marketing,0,N/A,,1,2024-08-14 0:22,2025-01-02 0:22
U002209,Leo,Anderson,leo.anderson@icloud.com,BR,,,2023-12-10 0:00,Referral,n/a,Windows,2.0.0,501-1000,Ops,0,22,U000258,1,2023-12-10 13:04,2024-01-16 13:04
U001585,Diego,Nguyen,diego.nguyen@proton.me,sg,,Asia/Tokyo,2025-09-05 0:00,Paid Search,Q3_PROMO,macOS,1.2.1,201-500,Finance,0,62,,FALSE,2025-09-05 13:46,2025-12-04 13:46
U000274,Zoe,Davis,zoe.davis@proton.me,MX,LND,UTC,01/11/2025,outbound,WINTER25,Linux,1.1.0,11-50,HR,0,46,,FALSE,2025-01-11 23:25,2025-03-30 23:25
U000848,Ravi,King,ravi.king@nexloom.io,SE,LND,,2025-11-07 0:00,Partner,BF2024,Unknown,1.0.9,11-50,Sales,0,20,,TRUE,2025-11-07 21:23,2026-03-24 21:23
U000272,anya,Lopez,anya.lopez@company.com,SE,BER,America/Los_Angeles,2024-09-21 0:00,Content,RETARGET1,Android,2.0.1,10-Jan,HR,0,19,,TRUE,2024-09-21 3:00,2024-11-08 3:00
U000630,Omar,Allen,omar.allen@yahoo.com,IN,unknown,UTC,2023-11-15 0:00,Webinar,SPRING24,Linux,1.2.1,201-500,HR,0,22,,yes,2023-11-15 18:35,04-01-2024 18:35
U000408,Ava,Clark,ava.clark@company.com,FR,NY,Asia/Tokyo,2023-02-01 0:00,Organic Search,GROWTHLAB,macOS,2.0.1,501-1000,HR,0,57,,FALSE,2023-02-01 10:14,2023-07-21 10:14
U001214,Ava,Moore,ava.moore@outlook.com,NL,LND,Asia/Kolkata,2024-09-10 0:00,Paid Search,  BF2024  ,Linux,1.0.9,10-Jan,Founder,1,34,,Y,2024-09-10 17:49,2025-01-15 17:49
U000446,Lucas,Perez,lucas.perez@icloud.com,SE,ON,America/Los_Angeles,03/21/2025,Outbound,Q3_PROMO,iOS,1.1.0,unknown,Finance,0,19,,TRUE,2025-03-21 12:42,2025-08-31 12:42
U001922,Elena,Clark,elena.clark@proton.me,GB,unknown,Europe/London,2023-01-10 0:00,Outbound,N/A,Unknown,2.1.0,51-200,Support,1,58,,1,2023-01-10 21:25,2023-05-31 21:25
U000073,Olivia,Wright,olivia.wright@icloud.com,CA,TX,America/New_York,2023-01-17 0:00,Social,Q3_PROMO,Unknown,1.2.1,unknown,Sales,0,59,,TRUE,2023-01-17 0:16,2023-07-14 0:16
U002137,Mia,Perez,mia.perez@outlook.com,au,NSW,Asia/Tokyo,2023-06-14 0:00,Partner,Q3_PROMO,Windows,1.2.1,51-200,Product,0,18,,FALSE,2023-06-14 20:37,2023-07-18 20:37
U000877,Amir,Wilson,amir.wilson@icloud.com,JP,unknown,Europe/Berlin,20-07-2024,Outbound,N/A,Android,1.1.0,unknown,HR,,61,,TRUE,2024-07-20 11:27,2024-10-06 11:27
U001028,Nora,King,nora.kingicloud.com,BR,unknown,America/New_York,2024-10-20 0:00,Outbound,BF2024,Unknown,1.1.2,1000+,Founder,0,60,,N,2024-10-20 15:47,2024-12-05 15:47
U002488,Hana,Anderson,hana.anderson@company.com,FR,SP,,2024-11-08 0:00,Partner,SPRING24,Windows,2.1.0,11-50,Founder,0,40,,TRUE,2024-11-08 19:24,2025-03-28 19:24
U001912,Ethan,Taylor,ethan.taylor@icloud.com,FR,WA,Asia/Kolkata,2024-11-22 0:00,Referral,n/a,Windows,1.1.2,1000+,Finance,no,30,U000275,FALSE,2024-11-22 22:00,2025-03-08 22:00
U001658,Yuki,Lee,YUKI.LEE@NEXLOOM.IO,BR,SP,Europe/London,2023-12-17 0:00,Referral,BF2024,Android,1.0.9,201-500,Ops,no,22,,1,2023-12-17 4:18,2024-05-23 4:18
U000720,Sophia,Jackson,sophia.jackson@icloud.com,US,,,2024-07-29 0:00,Webinar,SUMMER24,Linux,2.0.1,51-200,Marketing,FALSE,48,,0,2024-07-29 16:04,2024-09-20 16:04
U000826,Chen,Lee,chen.lee@gmail.com,BR,RJ,Europe/Berlin,2025-01-22 0:00,Referral,n/a,Linux,1.0.9,10-Jan,Product,0,25,U000455,FALSE,2025-01-22 21:42,2025-07-08 21:42
U002514,Yuki,Clark,yuki.clarkicloud.com,br,NY,UTC,2024-04-03 0:00,Outbound,BF2024,Android,1.3.0,10-Jan,Product,1,54,,0,2024-04-03 17:30,2024-06-25 17:30
U002540,Anya,Lewis,anya.lewis@yahoo.com,ZA,,Asia/Tokyo,2024-08-22 0:00,Content,Q3_PROMO,Unknown,1.0.9,10-Jan,Founder,0,41,,yes,2024-08-22 8:02,
U000340,Leo,Clark,leo.clark@yahoo.com,SE,ON,America/Los_Angeles,2023-07-07 0:00,Social,Q3_PROMO,Windows,2.0.0,unknown,Sales,1,18,,FALSE,2023-07-07 21:27,2023-12-01 21:27
U001345,Chen,Allen,chen.allen@icloud.com,BR,unknown,America/New_York,2024-08-05 0:00,Content,BF2024,Unknown,2.1.0,51-200,Product,0,23,,FALSE,2024-08-05 3:27,2024-12-18 3:27
U001541,Zoe,Garcia,zoe.garcia@nexloom.io,SG,RJ,,2024-07-16 0:00,webinar,BF2024,Android,2.0.1,11-50,Product,0,38,,TRUE,2024-07-16 13:15,2024-12-22 13:15
U000975,Leo,Brown,leo.brown@proton.me,NL,BC,America/New_York,2023-03-22 0:00,Paid Search,AI-LAUNCH,Linux,1.2.0,51-200,Engineering,0,,,FALSE,2023-03-22 21:05,2023-08-21
U001218,Emma,Martin,emma.martin@proton.me,SE,BER,Asia/Tokyo,2024-06-30,Organic Search,SPRING24,Android,1.2.0,1000+,Engineering,1,54,,no,2024-06-30 15:39,2024-10-29 15:39
U002145,Emma,Smith,emma.smith@nexloom.io,MX,NY,Asia/Kolkata,2024-03-14,Paid Search,AI-LAUNCH,Windows,1.2.1,51-200,Founder,0,62,,Y,2024-03-14 10:41,2024-03-25 10:41
U002273,Emma,Lee,emma.lee@yahoo.com,GB,CA,Asia/Tokyo,2024-03-22 0:00,Social,SPRING24,Linux,v1.1.0,11-50,HR,0,53,,N,2024-03-22 21:53,2024-08-31 21:53
U000318,Emma,Jackson,emma.jackson@nexloom.io,ZA,,Asia/Kolkata,2023-09-19 0:00,Referral,n/a,Unknown,v2.0.1,201-500,Finance,0,37,U000335,N,2023-09-19 11:26,2024-02-02 11:26
U000338,Yuki,Young,yuki.young@outlook.com,IN,MH,UTC,2024-07-13 0:00,Referral,GROWTHLAB,Unknown,1.1.2,11-50,Product,0,31,U000474,N,2024-07-13 0:58,2024-11-10
U002003,Ravi,Smith,ravi.smith@gmail.com,SE,SP,Asia/Tokyo,2024-12-31 0:00,Outbound,RETARGET1,Linux,v1.1.2,10-Jan,Founder,1,27,,FALSE,12/31/2024 16:31,2025-06-14 16:31
U000951,Nora,Thomas,nora.thomas@outlook.com,JP,BER,,18-05-2024,Content,BF2024,Unknown,1.1.2,11-50,Marketing,1,63,,TRUE,2024-05-18 4:11,2024-07-11 4:11
U000602,Fatima,Walker,fatima.walker@yahoo.com,MX,SP,Europe/Berlin,2023-12-01 0:00,Referral,N/A,iOS,1.1.0,501-1000,Support,1,24,U000269,Y,2023-12-01 13:44,2023-12-03
U001443,Mateo,Wilson,mateo.wilson@company.com,AU,CA,,2024-06-26 0:00,Referral,AI-LAUNCH,macOS,2.0.0,51-200,Founder,1,40,U000416,1,2024-06-26 15:28,2024-09-14 15:28
U002167,Noah,Robinson,noah.robinson@nexloom.io,IN,CA,America/New_York,2024-06-05 0:00,Outbound,GROWTHLAB,Unknown,1.0.9,unknown,Engineering,0,34,,0,2024-06-05 7:55,
U001122,Kofi,Taylor,kofi.taylor@yahoo.com,US,RJ,,04/14/2025,Referral,N/A,Windows,2.1.0,unknown,Founder,0,27,U000050,N,2025-04-14 13:46,2025-09-27 13:46
U001085,Amir,Thomas,amir.thomas@company.com,SG,NY,,2025-03-15,Webinar,RETARGET1,Windows,2.0.0,51-200,Support,0,59,,0,2025-03-15 3:05,2025-07-19 3:05
U001597,Liam,Garcia, liam.garcia@nexloom.io ,SG,-,,2023-11-29 0:00,Social,Q3_PROMO,Linux,2.1.0,10-Jan,Marketing,0,N/A,,yes,2023-11-29 0:40,2024-01-09 0:40
U001767,Chen,Harris,CHEN.HARRIS@PROTON.ME,FR,unknown,America/Los_Angeles,2024-08-02 0:00,Partner,SPRING24,Linux,1.1.2,unknown,Founder,0,36,,1,2024-08-02 15:21,2024-10-16 15:21
U001873,Diego,Lewis,diego.lewis@company.com,BR,ON,Asia/Tokyo,2024-04-01 0:00,Partner,Q3_PROMO,iOS,2.0.0,51-200,Sales,0,44,,TRUE,2024-04-01 7:09,2024-09-28 7:09
U001282,Nora,Robinson,nora.robinson@nexloom.io,CA,LND,Europe/London,2024-07-12 0:00,Social,Q3_PROMO,iOS,1.2.0,11-50,Marketing,0,48,,no,2024-07-12 19:20,2024-11-25 19:20
U001099,Olivia,Smith,olivia.smith@proton.me,DE,ON,America/Los_Angeles,2024-08-30 0:00,Referral,RETARGET1,Android,1.2.0,51-200,Product,0,39,U000451,0,2024-08-30 4:05,2024-10-02
U001425,Nora,Walker,nora.walker@icloud.com,ZA,BER,America/Los_Angeles,2025-08-29 0:00,Partner,RETARGET1,Android,v1.0.9,10-Jan,Product,0,48,,N,2025-08-29 2:41,2026-02-23 2:41
U000832,Ava,King,ava.king@icloud.com,JP,BER,Asia/Kolkata,2024-03-05 0:00,Webinar,RETARGET1,Windows,1.1.0,11-50,Marketing,0,,,1,2024-03-05 16:12,2024-06-13 16:12
U000363,Kofi,Johnson,kofi.johnson@yahoo.com,JP,ON,Asia/Kolkata,2024-03-08 0:00,Paid Search,WINTER25,Linux,1.3.0,10-Jan,HR,0,29,,N,2024-03-08 21:38,2024-05-29 21:38
U000879,Yuki,Martinez,yuki.martinez@nexloom.io,CA,RJ,Europe/Berlin,13-03-2023,Partner,RETARGET1,iOS,1.3.0,1000+,Marketing,0,19,,yes,2023-03-13 23:11,2023-07-25 23:11
U001971,Yuki,King,yuki.king@gmail.com,CA,MH,,2023-03-07 0:00,Webinar,SPRING24,iOS,2.0.1,1000+,Ops,1,48,,TRUE,2023-03-07 17:03,2023-05-07 17:03
U002089,Liam,Smith,liam.smith@outlook.com,US,NY,UTC,2024-10-01 0:00,Webinar,GROWTHLAB,iOS,1.2.1,1000+,HR,0,,,Y,2024-10-01 3:40,2024-12-24 3:40
U001103,Hana,Thompson,hana.thompson@company.com,US,WA,America/Los_Angeles,2024-12-01 0:00,Organic Search,n/a,Unknown,1.2.1,unknown,Ops,0,30,,FALSE,2024-12-01 1:58,2025-01-11 1:58
U000622,Ben,Anderson,BEN.ANDERSON@OUTLOOK.COM,SG,unknown,,10/17/2023,Referral,Q3_PROMO,Linux,1.2.1,unknown,Marketing,0,43,,yes,2023-10-17 17:06,2024-02-28 17:06
U001595,Ben,Robinson,ben.robinson@gmail.com,IN,,America/New_York,2024-07-25 0:00,Social,Q3_PROMO,Windows,1.0.9,501-1000,HR,1,23,,0,2024-07-25 3:34,2024-09-17 3:34
U002240,Anya,Jackson,anya.jackson@gmail.com,JP,WA,,2023-11-07 0:00,Partner,GROWTHLAB,Windows,1.1.2,501-1000,Marketing,0,52,,no,2023-11-07 19:38,11-07-2023 19:38
U000164,Emma,Robinson,emma.robinson@proton.me,JP,-,America/Los_Angeles,2023-05-12 0:00,paid search,AI-LAUNCH,iOS,1.1.0,10-Jan,HR,0,42,,Y,2023-05-12 17:43,2023-07-16
U002458,Mia,Robinson,mia.robinson@icloud.com,CA,WA,Europe/Berlin,06/01/2024,Social,AI-LAUNCH,Android,2.0.1,501-1000,Sales,0,48,,Y,2024-06-01 12:18,2024-11-18 12:18
U001311,amir,Scott,amir.scott@outlook.com,US,NSW,,2023-06-15 0:00,Social,Q3_PROMO,Unknown,2.0.1,201-500,Product,1,41,,,2023-06-15 22:29,2023-10-06 22:29
U002364,Priya,Allen,priya.allenicloud.com,GB,ON,America/Los_Angeles,2024-03-22 0:00,Social,SUMMER24,Unknown,1.3.0,51-200,Support,0,,,TRUE,2024-03-22 20:41,06-16-2024 20:41
U000212,Sara,Walker,sara.walker@company.com,GB,RJ,Europe/Berlin,2024-07-06 0:00,Outbound,N/A,Linux,1.1.2,501-1000,Founder,0,45,,FALSE,2024-07-06 23:36,2024-11-02 23:36
U001853,Ethan,Brown,ethan.brown@nexloom.io,BR,LND,Asia/Tokyo,2024-11-06 0:00,Social,BF2024,macOS,1.3.0,10-Jan,Ops,0,25,,no,2024-11-06 11:57,0000-00-00 00:00:00
U002523,Nora,Clark,nora.clark@outlook.com,in,TX,Europe/Berlin,2023-12-14 0:00,Paid Search,SUMMER24,Linux,1.1.2,1000+,Product,0,unknown,,1,2023-12-14 21:58,2024-04-04 21:58
U002431,sofia,Perez,sofia.perez@proton.me,SE,,UTC,2024-05-20 0:00,Organic Search,WINTER25,iOS,1.3.0,51-200,Founder,0,23,,FALSE,2024-05-20 2:30,2024-10-15 2:30
U001802,Sophia,Nguyen,sophia.nguyen@nexloom.io,in,MH,Europe/London,2024-08-02 0:00,Referral,N/A,Windows,1.2.0,11-50,Sales,0,22,U000176,FALSE,2024-08-02 23:36,
U001810,Leo,Scott,leo.scott@gmail.com,FR,TX,Asia/Tokyo,2023-07-08 0:00,Content,N/A,Linux,2.0.1,51-200,Ops,0,18,,no,2023-07-08 19:43,2023-08-20 19:43
U001147,Kofi,Johnson,kofi.johnson@company.com,MX,LND,Europe/London,2024-09-11 0:00,Content,BF2024,Unknown,1.0.9,11-50,Ops,0,56,,no,2024-09-11 16:59,2024-11-23 16:59
U001773,Liam,Davis,liam.davis@nexloom.io,IN,SP,Asia/Tokyo,2024-12-11 0:00,Organic Search,Q3_PROMO,iOS,2.1.0,201-500,Finance,0,22,,yes,2024-12-11 2:13,2025-06-07 2:13
U001796,Sara,Davis, sara.davis@proton.me ,BR,TX,UTC,2023-06-21 0:00,Paid Search,WINTER25,macOS,2.0.1,201-500,Finance,0,33,,Y,2023-06-21 13:07,2023-12-02 13:07
U001860,Mia,Allen,MIA.ALLEN@NEXLOOM.IO,ZA,LND,,2024-07-28 0:00,Partner,SPRING24,iOS,1.0.9,1000+,Support,1,58,,yes,2024-07-28 20:41,2024-09-20 20:41
U001996,Diego,Patel,diego.patel@nexloom.io,GB,LND,Europe/London,2024-06-17 0:00,Partner,Q3_PROMO,Windows,1.1.0,51-200,Support,1,43,,TRUE,2024-06-17 7:06,2024-09-04 7:06
U001497,Fatima,Johnson,fatima.johnson@company.com,SG,unknown,Europe/London,2024-05-28 0:00,Webinar,GROWTHLAB,Unknown,2.0.0,201-500,Finance,1,61,,1,2024-05-28 12:22,2024-09-09 12:22
U001252,Sophia,Davis,sophia.davis@nexloom.io,IN,NY,,03/19/2024,Webinar,NA,iOS,1.0.9,10-Jan,Product,0,21,,FALSE,2024-03-19 6:22,2024-06-19
U001315,Chen,Brown,chen.brown@outlook.com,SG,-,America/Los_Angeles,2024-03-05 0:00,Organic Search,SPRING24,Windows,1.1.2,11-50,Founder,1,43,,N,2024-03-05 8:11,2024-06-04 8:11
U002579,Fatima,Jackson,fatima.jackson@yahoo.com,AU,SP,Asia/Tokyo,2024-01-16 0:00,Organic Search,n/a,Windows,v2.1.0,501-1000,Marketing,1,32,,1,2024-01-16 16:24,04-05-2024 16:24
U002259,Fatima,Allen,fatima.allen@icloud.com,MX,-,Asia/Tokyo,2023-12-24 0:00,Content,SUMMER24,Android,2.0.0,501-1000,Finance,TRUE,19,,,2023-12-24 18:14,2024-05-13 18:14
U001659,Fatima,Allen,fatima.allen@nexloom.io,SE,SP,Asia/Kolkata,02/05/2024,Organic Search,n/a,macOS,1.0.9,10-Jan,Support,1,20,,0,2024-02-05 18:45,2024-03-09 18:45
U001458,Ethan,Smith,ethan.smith@gmail.com,SG,RJ,Europe/Berlin,2024-06-28 0:00,Webinar,N/A,macOS,v1.2.1,501-1000,Engineering,0,50,,1,2024-06-28 6:21,2024-10-18 6:21
U001296,Kofi,Martinez,kofi.martinez@proton.me,SE,BC,UTC,2023-10-10 0:00,Social,AI-LAUNCH,Linux,1.0.9,51-200,Finance,1,29,,yes,2023-10-10 6:08,2024-01-06 6:08
U000432,Olivia,Clark,olivia.clark@yahoo.com,za,RJ,,2024-08-17 0:00,Content,AI-LAUNCH,Unknown,2.0.0,501-1000,Marketing,0,55,,N,2024-08-17 11:45,2024-11-29 11:45
U001643,Yuki,Young,yuki.young@nexloom.io,MX,,Asia/Tokyo,2024-04-08 0:00,Paid Search,SUMMER24,Android,2.1.0,51-200,Sales,1,23,,TRUE,2024-04-08 4:47,2024-06-22 4:47
U001858,Omar,Harris,omar.harris@proton.me,FR,,Asia/Kolkata,2024-03-09 0:00,Referral,SPRING24,Unknown,1.3.0,unknown,Founder,0,53,U000213,FALSE,2024-03-09 3:29,2024-07-25 3:29
U000806,Sophia,Lewis,sophia.lewis@company.com,MX,,America/Los_Angeles,2024-08-02 0:00,Partner,BF2024,Android,2.0.0,11-50,Product,0,61,,TRUE,2024-08-02 22:33,2024-09-07 22:33
U000404,Zoe,Wright,zoe.wright@yahoo.com,IN,SP,America/Los_Angeles,2024-10-04 0:00,Paid Search,WINTER25,Linux,2.1.0,unknown,Ops,0,36,,,2024-10-04 15:49,2025-03-08 15:49
U002100,Mia,Nguyen,mia.nguyen@gmail.com,ZA,NSW,,2024-02-05 0:00,Content,AI-LAUNCH,iOS,2.0.1,201-500,Sales,1,43,,FALSE,2024-02-05 9:30,2024-07-15 9:30
U000908,Olivia,Lewis,olivia.lewis@proton.me,JP,WA,Europe/London,01/07/2024,Content,RETARGET1,Android,2.0.1,51-200,HR,0,62,,TRUE,2024-01-07 4:06,2024-02-28 4:06
U000763,Ethan,Walker,ethan.walker@icloud.com,SE,,Asia/Tokyo,2023-11-12 0:00,Outbound,BF2024,iOS,1.2.1,201-500,Founder,0,28,,yes,2023-11-12 17:41,2024-05-03 17:41
U000146,Sophia,Lee, sophia.lee@company.com ,AU,SP,Europe/London,2023-04-04 0:00,Paid Search,WINTER25,macOS,1.2.0,201-500,Founder,0,unknown,,FALSE,2023-04-04 15:40,
U000869,fatima,Lewis,fatima.lewis@icloud.com,GB,ON,UTC,2024-11-06 0:00,Partner,AI-LAUNCH,macOS,2.0.0,501-1000,Sales,0,41,,TRUE,2024-11-06 2:48,
U001812,Ravi,Patel,ravi.patelgmail.com,ZA,,Europe/London,2024-08-19 0:00,Referral,RETARGET1,Android,1.2.0,1000+,Founder,0,47,,Y,2024-08-19 0:04,2025-02-12 0:04
U000123,Leo,Walker,leo.walker@nexloom.io,BR,,America/New_York,12/24/2023,Paid Search,Q3_PROMO,Unknown,1.2.1,1000+,Engineering,1,28,,FALSE,2023-12-24 18:43,2024-01-06
U002197,Noah,White,noah.white@yahoo.com,AU,ON,Europe/Berlin,2024-03-09 0:00,Referral,n/a,iOS,1.2.1,10-Jan,Ops,0,29,U000073,TRUE,2024-03-09 16:01,2024-04-17 16:01
U001838,Mateo,Moore,mateo.moore@icloud.com,NL,,Asia/Kolkata,2024-01-05 0:00,Social,BF2024,Android,1.2.1,11-50,Finance,0,22,,no,2024-01-05 22:58,04-17-2024 22:58
U001766,Kofi,Martinez, kofi.martinez@proton.me ,za,unknown,,12/28/2023,Paid Search,Q3_PROMO,Unknown,1.3.0,unknown,Founder,0,30,,1,2023-12-28 8:58,2024-01-26 8:58
U000731,Elena,Garcia,elena.garcia@outlook.com,MX,ON,Europe/London,09/12/2023,Social,SUMMER24,Linux,1.2.0,201-500,Product,0,59,,Y,2023-09-12 3:20,10-31-2023 03:20
U000055,Liam,Jackson,liam.jackson@outlook.com,BR,TX,,2024-05-17,Paid Search,SUMMER24,Windows,1.2.0,10-Jan,Finance,0,62,,TRUE,2024-05-17 1:04,2024-07-29 1:04
U001514,Amir,Martin,amir.martin@outlook.com,NL,CA,Europe/London,2023-02-20 0:00,Paid Search,WINTER25,Unknown,2.0.0,201-500,Founder,no,33,,1,2023-02-20 0:19,2023-07-13 0:19
U000746,Fatima,King,fatima.king@outlook.com,BR,LND,Europe/London,2024-12-21 0:00,Referral,N/A,Android,v1.3.0,51-200,Finance,0,62,U000136,0,2024-12-21 23:28,2025-05-06 23:28
U001339,Sophia,Moore,sophia.moore@outlook.com,ZA,CA,Asia/Tokyo,2023-06-04 0:00,Paid Search,BF2024,Unknown,1.1.0,201-500,Marketing,1,46,,TRUE,2023-06-04 11:57,2023-07-14 11:57
U000910,Olivia,Walker,olivia.walker@gmail.com,IN,BER,America/Los_Angeles,2024-01-27 0:00,Organic Search,Q3_PROMO,Linux,1.1.0,501-1000,Sales,1,41,,FALSE,2024-01-27 21:53,2024-05-06 21:53
U002140,Kofi,Clark,kofi.clark@company.com,DE,NSW,Asia/Kolkata,2024-11-03 0:00,Social,RETARGET1,iOS,1.2.0,10-Jan,HR,0,40,,FALSE,2024-11-03 5:54,2024-12-09 5:54
U002534,Sofia,Walker,sofia.walker@gmail.com,CA,LND,UTC,2023-02-10 0:00,Outbound,SUMMER24,Linux,1.2.1,11-50,Finance,0,34,,no,2023-02-10 0:05,2023-05-02 0:05
U000697,Olivia,Clark,olivia.clark@yahoo.com,AU,-,America/New_York,2023-12-07 0:00,Organic Search,n/a,Windows,1.3.0,1000+,Ops,0,unknown,,TRUE,2023-12-07 9:58,2024-03-04 9:58
U000311,Yuki,Harris,yuki.harris@proton.me,SE,WA,America/Los_Angeles,2024-02-27,Social,SPRING24,Unknown,1.1.2,11-50,Marketing,0,44,,yes,2024-02-27 18:34,2024-05-08 18:34
U001961,Sophia,Lopez,sophia.lopez@company.com,GB,CA,Asia/Kolkata,2023-07-31 0:00,Organic Search,SUMMER24,iOS,2.0.1,501-1000,Support,0,60,,0,2023-07-31 17:57,2023-09-06 17:57
U001775,Leo,Clark,leo.clark@proton.me,MX,,Europe/Berlin,2024-09-04,Webinar,AI-LAUNCH,Linux,1.2.1,11-50,Founder,1,55,,TRUE,2024-09-04 5:43,2025-01-31 5:43
U001844,Noah,Brown,noah.brown@outlook.com,GB,RJ,Europe/Berlin,2024-05-25 0:00,Webinar,SPRING24,macOS,1.2.1,11-50,Finance,1,57,,,2024-05-25 21:37,2024-08-08 21:37
 U001582 ,Lucas,Wilson,lucas.wilson@yahoo.com,au,BER,Europe/London,2024-02-02 0:00,Referral,BF2024,Unknown,2.1.0,201-500,Sales,0,44,U000040,FALSE,2024-02-02 4:50,2024-05-10 4:50
U002552,Fatima,Wright,fatima.wright@icloud.com,NL,BC,Asia/Tokyo,2023-07-23 0:00,Organic Search,n/a,macOS,1.2.1,1000+,Ops,0,56,,no,2023-07-23 4:51,2023-09-02 4:51
U002569,sophia,Wilson,sophia.wilsonoutlook.com,ZA,MH,America/New_York,2024-09-16 0:00,Outbound,WINTER25,Android,1.2.1,10-Jan,HR,0,59,,TRUE,2024-09-16 21:47,2025-02-15 21:47
U000533,Zoe,Martinez,zoe.martinez@gmail.com,MX,WA,UTC,2025-11-05 0:00,Webinar,BF2024,Android,2.1.0,51-200,Sales,0,64,,1,2025-11-05 5:41,2026-04-23 5:41
U000515,Diego,Perez,diego.perez@outlook.com,IN,unknown,Europe/London,2023-04-20 0:00,Partner,GROWTHLAB,Linux,1.2.1,11-50,Engineering,0,,,TRUE,2023-04-20 17:42,2023-07-18 17:42
U000258,Ben,Lopez, ben.lopez@outlook.com ,DE,LND,Asia/Tokyo,2024-07-09 0:00,Paid Search,WINTER25,iOS,1.1.0,10-Jan,HR,0,43,,,2024-07-09 17:11,2024-08-03 17:11
U001084,Leo,Lopez,leo.lopez@gmail.com,CA,unknown,,2024-11-25 0:00,Referral,WINTER25,Linux,2.0.1,11-50,Finance,0,38,U000347,Y,2024-11-25 18:54,2025-01-27 18:54
U001061,Jin,Clark,jin.clark@icloud.com,JP,CA,UTC,,Paid Search,SUMMER24,macOS,1.3.0,11-50,HR,0,38,,TRUE,2024-11-19 19:07,2025-03-24 19:07
U001156,Olivia,Allen,olivia.allen@yahoo.com,ZA,-,,2024-08-12 0:00,Paid Search,N/A,Unknown,1.3.0,51-200,Product,0,57,,N,2024-08-12 1:08,2024-10-10 1:08
U002527,Mateo,Davis, mateo.davis@gmail.com ,FR,CA,Asia/Kolkata,2023-10-18 0:00,Partner,N/A,Windows,1.2.0,201-500,Founder,0,32,,TRUE,2023-10-18 13:31,2024-01-29 13:31
USR-000771,Leo,Jackson,leo.jackson@gmail.com,in,LND,Europe/London,2023-07-22 0:00,Paid Search,SPRING24,Windows,1.2.1,201-500,Engineering,0,64,,yes,2023-07-22 9:35,2023-10-30 9:35
U001919,Amir,Martin,amir.martin@outlook.com,BR,BER,Europe/London,2024-02-02 0:00,Content,SUMMER24,Windows,2.0.0,201-500,Finance,0,19,,yes,2024-02-02 21:03,2024-05-25 21:03
U001725,Emma,Young,emma.young@nexloom.io,SG,unknown,America/New_York,07/07/2024,Webinar,SUMMER24,Android,1.2.0,51-200,HR,0,25,,FALSE,2024-07-07 13:57,2024-11-01 13:57
U000464,Omar,Nguyen,omar.nguyen@outlook.com,DE,NY,Asia/Tokyo,2024-05-10 0:00,Content,GROWTHLAB,macOS,2.0.1,201-500,Ops,0,35,,FALSE,2024-05-10 12:06,2024-08-27
U001016,Ben,Lee,ben.lee@company.com,MX,LND,Europe/London,2025-01-31 0:00,Partner,AI-LAUNCH,Windows,1.0.9,51-200,Finance,1,19,,no,2025-01-31 10:31,2025-05-25 10:31
U001144,Kofi,Jackson,kofi.jackson@icloud.com,za,NSW,Europe/Berlin,01-05-2024,Social,SPRING24,macOS,2.0.0,11-50,Ops,0,29,,TRUE,2024-05-01 20:41,2024-09-12 20:41
U001208,Emma,Perez,emma.perez@gmail.com,US,,Asia/Tokyo,2024-03-01 0:00,Paid Search,AI-LAUNCH,Android,1.0.9,unknown,Finance,0,47,,no,2024-03-01 7:40,2024-06-11 7:40
U002216,Sofia,Lewis,sofia.lewis@proton.me,MX,TX,,2023-12-17,Webinar,SPRING24,Linux,1.2.1,10-Jan,HR,1,55,,yes,2023-12-17 21:09,2024-01-22 21:09
U002548,chen,LEWIS,chen.lewis@proton.me,DE,ON,Asia/Tokyo,2024-02-11 0:00,Paid Search,RETARGET1,Unknown,v2.0.0,10-Jan,HR,0,40,,TRUE,2024-02-11 0:59,2024-06-08 0:59
U000335,Mia,Harris,mia.harris@yahoo.com,ZA,SP,,2023-04-21 0:00,Content,null,Windows,1.0.9,201-500,Marketing,0,32,,yes,2023-04-21 19:41,2023-05-30 19:41
U002049,Priya,Perez,priya.perez@nexloom.io,US,ON,,2024-04-19 0:00,Social,WINTER25,iOS,1.2.0,11-50,Finance,0,51,,TRUE,2024-04-19 1:30,2024-08-16 1:30
U000498,Anya,Perez,anya.perez@nexloom.io,GB,,,2023-06-11 0:00,Partner,AI-LAUNCH,Windows,2.1.0,201-500,Founder,0,44,,TRUE,2023-06-11 13:26,2023-09-11 13:26
U000956,Ivy,Garcia,ivy.garcia@company.com,BR,-,,2024-01-29 0:00,Partner,SUMMER24,Unknown,2.1.0,201-500,Founder,0,25,,FALSE,2024-01-29 0:08,2024-03-02 0:08
U002420,Olivia,Robinson,olivia.robinson@nexloom.io,IN,LND,America/New_York,2024-02-01 0:00,Referral,SPRING24,Windows,2.0.1,501-1000,Engineering,0,,U000433,FALSE,2024-02-01 0:29,
U001292,Noah,Patel,NOAH.PATELICLOUD.COM,gb,WA,Asia/Tokyo,2023-08-14 0:00,Webinar,SUMMER24,iOS,1.0.9,201-500,Marketing,1,29,,FALSE,2023-08-14 6:06,2024-01-08 6:06
U001148,Mia,Clark,mia.clark@company.com,ZA,,Asia/Kolkata,2024-06-18 0:00,Webinar,BF2024,iOS,1.2.1,501-1000,Support,0,55,,0,2024-06-18 21:36,
U001664,Olivia,Garcia,olivia.garcia@nexloom.io,SE,WA,Asia/Kolkata,2024-03-27 0:00,Outbound,SPRING24,iOS,v2.1.0,1000+,HR,1,34,,FALSE,2024-03-27 10:30,2024-07-09 10:30
U001022,Priya,Johnson,priya.johnson@gmail.com,GB,MH,Europe/Berlin,2023-12-13 0:00,Social,SPRING24,macOS,v1.1.2,501-1000,Engineering,1,56,,TRUE,2023-12-13 5:44,2024-04-15 5:44
U001745,Noah,Lopez,noah.lopez@company.com,GB,WA,Asia/Kolkata,2024-02-15 0:00,Partner,BF2024,macOS,1.1.2,1000+,Support,0,51,,1,2024-02-15 10:07,2024-03-21 10:07
U001572,Ravi,Lewis,ravi.lewis@company.com,US,BER,Asia/Tokyo,15-09-2023,Webinar,  BF2024  ,Linux,2.0.1,1000+,Ops,0,26,,FALSE,2023-09-15 14:48,2023-12-03 14:48
U001193,Jin,White,jin.white@proton.me,BR,LND,,2024-01-09 0:00,Organic Search,n/a,iOS,1.2.1,11-50,Founder,FALSE,37,,no,2024-01-09 8:02,2024-06-29 8:02
U001253,Amir,Lopez,amir.lopez@nexloom.io,CA,TX,America/New_York,2023-07-29 0:00,Content,AI-LAUNCH,iOS,1.0.9,501-1000,Product,0,43,,N,2023-07-29 14:05,2023-12-02 14:05
U000892,Jin,Walker,jin.walker@proton.me,,-,,2024-10-31 0:00,Organic Search,SPRING24,Windows,v1.2.1,201-500,Engineering,0,39,,0,2024-10-31 13:20,2025-03-22 13:20
U000082,Elena,Lee,elena.lee@outlook.com,IN,BER,America/Los_Angeles,05/30/2024,Webinar,N/A,Linux,1.3.0,11-50,Product,0,56,,1,2024-05-30 18:04,2024-08-29 18:04
U001642,Ben,Davis,ben.davis@company.com,FR,LND,America/New_York,2024-10-18 0:00,Partner,SPRING24,iOS,1.2.1,11-50,Sales,1,23,,TRUE,2024-10-18 1:23,2024-12-12 1:23
U000791,Nora,Martin,nora.martin@yahoo.com,NL,CA,Europe/Berlin,2023-09-02 0:00,Outbound,SUMMER24,Android,1.1.2,11-50,Finance,0,64,,TRUE,2023-09-02 10:54,2023-11-29 10:54
U002266,Olivia,Lee,olivia.lee@proton.me,SG,CA,,2024-06-03 0:00,Outbound,BF2024,macOS,1.3.0,10-Jan,Founder,0,40,,1,2024-06-03 21:27,2024-09-09 21:27
U002485,Sofia,Martinez,SOFIA.MARTINEZ@PROTON.ME,CA,BC,UTC,2024-03-10 0:00,Outbound,SUMMER24,Windows,1.2.0,unknown,Product,0,49,,FALSE,2024-03-10 22:07,2024-05-21 22:07
U001362,Amir,Clark,amir.clark@company.com,us,LND,America/New_York,2023-10-18 0:00,Social,WINTER25,Android,1.2.1,51-200,Finance,0,24,,,2023-10-18 8:16,04-15-2024 08:16
U001804,Priya,Perez,priya.perez@proton.me,JP,BER,Europe/London,2023-12-12 0:00,Referral,Q3_PROMO,Windows,2.0.0,10-Jan,Finance,0,47,U000262,no,2023-12-12 1:05,2024-04-06 1:05
U000529,Priya,Lewis,priya.lewis@gmail.com,IN,BC,,2023-05-10 0:00,Paid Search,SPRING24,Linux,2.0.0,201-500,Finance,1,32,,FALSE,2023-05-10 6:57,2023-07-03 6:57
U000911,Yuki,Clark,yuki.clark@company.com,MX,BER,America/New_York,2024-05-13 0:00,Referral,SUMMER24,macOS,1.2.1,501-1000,Marketing,1,26,U000063,yes,2024-05-13 19:22,2024-10-26 19:22
U001666,Amir,Lewis,amir.lewis@icloud.com,US,RJ,America/New_York,2024-10-27,Social,SPRING24,iOS,2.1.0,501-1000,Founder,1,45,,1,2024-10-27 2:55,2025-03-13 2:55
U000443,Omar,Thomas,omar.thomas@gmail.com,MX,MH,Asia/Kolkata,01/24/2024,Paid Search,WINTER25,Android,2.1.0,501-1000,HR,0,unknown,,FALSE,2024-01-24 21:16,2024-02-23 21:16
U000611,Fatima,Robinson,fatima.robinson@outlook.com,SE,,America/New_York,2023-04-08 0:00,Content,Q3_PROMO,Unknown,2.0.0,51-200,Sales,0,26,,no,2023-04-08 7:22,2023-07-16 7:22
U002565,Zoe,Martinez,zoe.martinez@proton.me,JP,TX,Asia/Tokyo,2024-02-08 0:00,Paid Search,AI-LAUNCH,macOS,1.1.0,11-50,Product,0,47,,FALSE,2024-02-08 2:45,2024-04-01 2:45
U001325,Lucas,Thompson,lucas.thompson@gmail.com,fr,unknown,UTC,2025-07-01 0:00,Organic Search,N/A,Windows,1.2.0,unknown,Ops,0,18,,N,2025-07-01 20:02,2025-09-09 20:02
U001343,Liam,Robinson,liam.robinson@nexloom.io,SE,BC,Asia/Tokyo,11/13/2024,Outbound,WINTER25,Linux,1.3.0,1000+,Ops,0,48,,FALSE,2024-11-13 11:23,2025-03-28
U001427,Ivy,Lopez,ivy.lopez@nexloom.io,SG,ON,Europe/Berlin,2023-01-15 0:00,Webinar,Q3_PROMO,Linux,1.1.0,501-1000,Finance,0,56,,1,2023-01-15 10:33,2023-05-22 10:33
U001888,Chen,Scott,chen.scott@outlook.com,SG,,UTC,2023-11-11 0:00,Content,WINTER25,Android,1.3.0,501-1000,Product,0,,,0,2023-11-11 21:31,2024-01-27 21:31
U000783,Yuki,Davis, yuki.davis@nexloom.io ,MX,NSW,Asia/Kolkata,2023-11-15 0:00,Organic Search,n/a,Android,1.0.9,51-200,Product,1,23,,1,2023-11-15 9:32,2024-01-12 9:32
U001124,Leo,Allen,leo.allen@outlook.com,BR,MH,,2024-09-21 0:00,Partner,RETARGET1,Windows,1.0.9,201-500,Finance,0,52,,1,2024-09-21 19:14,2024-11-19 19:14
U001815,Mia,Martin,mia.martin@proton.me,GB,MH,America/Los_Angeles,2023-06-18 0:00,Webinar,BF2024,Android,1.1.0,unknown,Sales,1,20,,,2023-06-18 17:17,2023-07-12 17:17
U000822,Jin,Brown,jin.brown@outlook.com,IN,-,Europe/London,14-01-2023,Outbound,Q3_PROMO,Unknown,2.0.1,11-50,Finance,0,29,,no,2023-01-14 0:12,2023-05-23 0:12
U001740,Chen,Brown,chen.brown@gmail.com,nl,,Asia/Tokyo,02/14/2024,Webinar,SUMMER24,Android,1.2.1,10-Jan,Founder,0,23,,yes,2024-02-14 17:01,2024-07-04 17:01
U002386,Fatima,Walker,fatima.walker@icloud.com,IN,RJ,UTC,2024-05-09 0:00,Outbound,WINTER25,Unknown,2.0.0,1000+,Finance,0,,,1,2024-05-09 17:17,2024-09-14 17:17
U001517,Ravi,Martinez,ravi.martinez@yahoo.com,CA,SP,,2024-06-12 0:00,Webinar,Q3_PROMO,Android,1.2.0,501-1000,Product,0,26,U00000X,1,2024-06-12 6:08,2024-10-14 6:08
 U000003 ,Chen,Taylor,chen.taylor@company.com,CA,NSW,Asia/Tokyo,30-07-2024,Referral,Q3_PROMO,Windows,2.0.0,501-1000,Product,0,61,U000240,FALSE,2024-07-30 8:59,2024-12-05 8:59
U001673,Nora,Allen,nora.allen@icloud.com,MX,MH,,2024-11-13 0:00,Content,N/A,Android,1.0.9,11-50,Founder,0,36,,yes,2024-11-13 17:50,2024-12-23 17:50
U001106,Diego,White,diego.white@gmail.com,GB,unknown,Asia/Tokyo,2023-09-20 0:00,Social,BF2024,Android,2.0.1,unknown,Product,0,44,,Y,2023-09-20 20:10,2024-03-04 20:10
U000984,Ben,Brown,ben.brown@gmail.com,NL,NY,America/Los_Angeles,06/08/2023,Social,SPRING24,Linux,2.0.0,501-1000,Ops,0,28,,N,2023-06-08 9:12,07-12-2023 09:12
U000354,Priya,Harris,priya.harris@outlook.com,DE,-,Asia/Kolkata,2023-09-11 0:00,Content,SUMMER24,Windows,2.0.1,501-1000,Ops,0,37,,N,2023-09-11 20:03,2024-02-04 20:03
U001869,Hana,Anderson,hana.anderson@gmail.com,GB,ON,America/Los_Angeles,2025-02-30,paid search,SUMMER24,Android,1.3.0,11-50,Marketing,0,37,,N,2023-08-13 17:48,2023-10-27 17:48
U000760,Kofi,Patel,kofi.patel@company.com,DE,RJ,,2024-09-05 0:00,Partner,SUMMER24,Linux,1.3.0,501-1000,Sales,1,18,,yes,2024-09-05 0:21,2024-12-23
U000259,Sara,Nguyen,sara.nguyen@icloud.com,GB,,Europe/Berlin,2024-05-03 0:00,Social,WINTER25,iOS,1.2.1,unknown,Finance,0,63,,FALSE,2024-05-03 3:19,2024-05-06 3:19
U000218,Anya,Johnson,anya.johnson@proton.me,IN,LND,UTC,2024-08-08 0:00,Outbound,N/A,Linux,1.0.9,11-50,HR,0,42,,FALSE,2024-08-08 10:23,2024-08-31 10:23
U002526,Yuki,Martinez,yuki.martinez@company.com,DE,LND,Europe/London,2023-12-01 0:00,Content,SPRING24,Android,2.1.0,1000+,Founder,1,51,,1,2023-12-01 6:24,2024-05-09 6:24
U001479,Sara,Martin,sara.martin@gmail.com,CA,-,Europe/London,2024-09-12 0:00,Paid Search,BF2024,macOS,2.0.0,51-200,Marketing,0,58,,FALSE,2024-09-12 18:32,2025-02-24 18:32
U000505,Liam,Smith,liam.smith@gmail.com,NL,WA,Europe/Berlin,2024-07-02 0:00,Social,WINTER25,macOS,1.1.0,501-1000,Support,1,54,,,2024-07-02 6:46,2024-08-02 6:46
U001173,Fatima,Smith,fatima.smith@icloud.com,DE,RJ,Europe/London,2024-06-04 0:00,Partner,NA,Windows,2.0.1,201-500,Product,FALSE,29,,0,2024-06-04 3:11,2024-09-27 3:11
U000392,Ava,Clark,ava.clark@yahoo.com,se,BER,Asia/Kolkata,2024-02-13 0:00,Social,null,Unknown,2.0.1,10-Jan,Finance,0,40,,0,2024-02-13 17:39,2024-07-15 17:39
U001915,Zoe,Robinson,zoe.robinson@icloud.com,USA,,America/Los_Angeles,2024-03-03 0:00,Organic Search,GROWTHLAB,Android,2.0.0,501-1000,HR,1,40,,yes,2024-03-03 8:34,2024-08-21 8:34
U002413,Ravi,Robinson,ravi.robinson@gmail.com,SE,TX,Europe/Berlin,2024-03-21 0:00,Webinar,N/A,Windows,1.2.0,1000+,HR,1,20,,,2024-03-21 12:25,2024-07-20 12:25
U001439,Sara,White,sara.white@icloud.com,GB,TX,Asia/Kolkata,2023-10-11 0:00,Partner,N/A,Linux,2.0.1,201-500,Sales,0,58,,1,2023-10-11 6:43,2024-03-08 6:43
U001040,Anya,Thomas,anya.thomas@yahoo.com,US,NSW,UTC,2023-12-23 0:00,Outbound,N/A,macOS,2.0.0,10-Jan,Sales,1,23,,0,2023-12-23 14:19,2024-04-01 14:19
U000069,Noah,Clark,noah.clark@outlook.com,FR,MH,Europe/London,2025-02-30,Content,Q3_PROMO,Android,1.1.2,501-1000,Marketing,no,49,,TRUE,2023-06-07 6:39,2023-09-13 6:39
U000161,Mateo,Nguyen,mateo.nguyengmail.com,JP,NY,Europe/London,2024-01-21 0:00,Webinar,Q3_PROMO,Unknown,1.2.1,201-500,Sales,1,57,,yes,2024-01-21 19:02,2024-03-21 19:02
U002171,Olivia,Perez,olivia.perez@proton.me,US,,America/New_York,2024-07-03 0:00,Organic Search,GROWTHLAB,Android,v2.1.0,unknown,HR,0,42,,TRUE,2024-07-03 17:45,2024-08-10 17:45
U002011,Diego,Martinez,diego.martinez@company.com,DE,TX,UTC,03/28/2023,Social,GROWTHLAB,iOS,2.0.1,10-Jan,HR,0,25,,TRUE,2023-03-28 17:41,2023-06-13 17:41
U001943,Mateo,Nguyen,mateo.nguyen@nexloom.io,NL,NY,UTC,2024-09-02 0:00,outbound,BF2024,macOS,v1.2.0,10-Jan,Marketing,0,,,1,2024-09-02 19:29,02-16-2025 19:29
U002065,Liam,Johnson,liam.johnsonproton.me,NL,LND,Europe/Berlin,2023-05-02 0:00,Referral,n/a,Linux,1.2.0,10-Jan,Product,1,48,,no,2023-05-02 0:50,2023-06-07 0:50
U001125,Jin,Harris,jin.harris@proton.me,ZA,NSW,,2024-06-16 0:00,Paid Search,RETARGET1,Linux,1.0.9,51-200,Founder,1,21,,TRUE,2024-06-16 8:58,2024-09-18 8:58
U001271,Jin,Martin,jin.martin@yahoo.com,AU,,Europe/Berlin,2024-07-08 0:00,Content,RETARGET1,iOS,1.2.1,501-1000,Engineering,0,60,,TRUE,2024-07-08 12:52,2024-07-13 12:52
U000876,Sophia,Moore,sophia.moore@company.com,JP,TX,Asia/Tokyo,05-09-2023,Content,AI-LAUNCH,Android,1.2.1,1000+,Product,0,58,,yes,2023-09-05 19:32,2023-12-11 19:32
U002328,Omar,Taylor,omar.taylor@gmail.com,IN,MH,,2023-01-05 0:00,Organic Search,SPRING24,Unknown,1.1.0,51-200,Product,1,unknown,,,2023-01-05 11:45,2023-05-08 11:45
U002433,Elena,Patel,elena.patel@yahoo.com,GB,RJ,Asia/Tokyo,2025-08-13 0:00,organic search,n/a,iOS,1.3.0,51-200,Marketing,0,19,,no,2025-08-13 4:10,2025-08-24 4:10
U001402,Omar,Anderson,omar.anderson@proton.me,IN,-,Asia/Tokyo,2023-09-15 0:00,Partner,AI-LAUNCH,Windows,1.1.2,10-Jan,Sales,1,59,,FALSE,2023-09-15 17:27,2023-11-08 17:27
U001608,Chen,Anderson,chen.anderson@yahoo.com,SG,,UTC,2024-09-14 0:00,Partner,Q3_PROMO,iOS,2.0.1,10-Jan,Engineering,0,52,,N,2024-09-14 17:54,2024-10-07 17:54
U001133,Liam,Allen,liam.allen@nexloom.io,AU,BC,America/New_York,2023-06-16 0:00,Social,GROWTHLAB,Unknown,2.0.1,1000+,Marketing,0,21,,FALSE,06/16/2023 14:09,2023-08-31 14:09
U001102,Yuki,Jackson,yuki.jackson@proton.me,MX,unknown,UTC,01-06-2025,Social,  BF2024  ,Linux,1.1.2,201-500,Finance,1,38,,TRUE,2025-06-01 11:18,2025-06-21 11:18
U000133,Jin,Patel,jin.patel@nexloom.io,US,NY,UTC,2023-08-01 0:00,Paid Search,RETARGET1,iOS,2.1.0,51-200,Founder,1,27,,yes,2023-08-01 5:03,2023-09-03 5:03
U000214,Ravi,Clark,ravi.clark@outlook.com,AU,LND,Europe/Berlin,2023-10-27 0:00,Social,Q3_PROMO,Linux,2.0.0,10-Jan,Engineering,1,26,,no,2023-10-27 1:34,2024-04-01 1:34
U002147,Omar,Robinson,omar.robinson@yahoo.com,DE,TX,UTC,2024-03-08 0:00,Outbound,RETARGET1,Unknown,2.0.1,201-500,Engineering,0,43,,N,2024-03-08 7:37,2024-08-25 7:37
U000864,Omar,Lewis,omar.lewis@proton.me,GB,,UTC,2024-02-28 0:00,Content,Q3_PROMO,Android,2.0.0,unknown,Finance,0,26,,TRUE,2024-02-28 18:43,2024-07-29 18:43
U001917,Sara,Nguyen,sara.nguyen@proton.me,ZA,SP,Asia/Tokyo,2024-12-04 0:00,Outbound,Q3_PROMO,Android,1.2.0,201-500,Engineering,0,33,,Y,2024-12-04 16:48,2025-04-24 16:48
U000060,Fatima,Wilson,fatima.wilson@proton.me,SG,NY,,2025-02-30,Webinar,WINTER25,Unknown,1.3.0,1000+,Founder,0,29,,TRUE,12/29/2023 21:31,2024-02-26 21:31
U002509,Hana,Scott,hana.scott@outlook.com,BR,,America/Los_Angeles,2024-10-23 0:00,Outbound,SPRING24,iOS,1.2.0,1000+,Support,0,64,,TRUE,2024-10-23 12:07,2024-11-03 12:07
U000748,Liam,Robinson,liam.robinsonyahoo.com,IN,,Europe/London,2024-04-19,Webinar,SUMMER24,Linux,1.3.0,1000+,Ops,0,58,  U000120,FALSE,2024-04-19 17:37,2024-07-29 17:37
U000419,Emma,Perez,emma.perez@proton.me,ZA,TX,Asia/Tokyo,2024-06-26 0:00,Partner,Q3_PROMO,Windows,2.1.0,501-1000,Engineering,1,52,,no,2024-06-26 14:35,2024-10-29 14:35
U002096,Emma,Young,emma.young@outlook.com,SG,ON,America/New_York,2024-09-08 0:00,Paid Search,AI-LAUNCH,Android,1.0.9,51-200,Support,0,34,,1,2024-09-08 3:23,2025-01-29 3:23
U001755,Fatima,Thompson,fatima.thompson@company.com,FR,RJ,Europe/Berlin,2025-07-01 0:00,Referral,WINTER25,Windows,1.0.9,unknown,Engineering,0,24,U000021,yes,2025-07-01 19:02,2025-12-05 19:02
U001617,Noah,Moore,noah.moore@proton.me,NL,,Asia/Tokyo,2025-10-18 0:00,Content,N/A,Linux,1.0.9,1000+,Engineering,0,60,,no,2025-10-18 5:42,2025-11-26 5:42
U000825,Mateo,Robinson,mateo.robinson@outlook.com,CA,NSW,Asia/Tokyo,2024-04-16 0:00,Social,N/A,Unknown,2.0.1,1000+,Finance,1,33,,Y,2024-04-16 16:39,2024-07-30
U000430,Emma,Clark,emma.clark@company.com,US,,UTC,2023-07-29 0:00,Organic Search,n/a,Windows,2.0.1,501-1000,Marketing,0,,,N,2023-07-29 23:09,2023-11-22 23:09
U001999,Fatima,Anderson,fatima.anderson@yahoo.com,gb,-,Europe/Berlin,2023-05-11 0:00,Social,null,Unknown,1.2.1,10-Jan,Marketing,1,41,,Y,2023-05-11 2:57,2023-05-21 2:57
U002560,Olivia,Smith,olivia.smith@outlook.com,FR,RJ,Asia/Kolkata,2024-03-29 0:00,Content,N/A,macOS,2.0.0,1000+,Marketing,0,46,,TRUE,2024-03-29 8:19,2024-05-01 8:19
U001652,Jin,NGUYEN,jin.nguyen@company.com,GB,MH,America/New_York,2023-12-16,Outbound,N/A,Windows,2.0.0,51-200,Engineering,0,36,,no,2023-12-16 7:40,2024-04-26 7:40
U000713,Emma,Robinson,emma.robinson@yahoo.com,US,CA,,14-03-2024,Social,RETARGET1,macOS,2.1.0,501-1000,Marketing,0,39,,1,2024-03-14 5:34,2024-08-04 5:34
 U000627 ,Ethan,Thompson,ethan.thompson@company.com,SG,RJ,,2024-03-10 0:00,Content,SPRING24,Linux,1.2.1,1000+,Product,1,23,,Y,2024-03-10 15:59,2024-04-27 15:59
U000781,Leo,Johnson,leo.johnson@yahoo.com,AU,BER,Europe/London,2024-07-08 0:00,Outbound,AI-LAUNCH,Unknown,2.0.0,10-Jan,Product,0,19,,,2024-07-08 1:33,2024-10-05 1:33
U000749,Fatima,Young,fatima.young@proton.me,JP,CA,Europe/Berlin,2024-12-31 0:00,Social,BF2024,Windows,2.0.0,51-200,Product,0,59,,1,12/31/2024 23:18,2025-01-13 23:18
U002213,Mia,Smith,mia.smith@gmail.com,fr,ON,Europe/London,2023-02-19 0:00,Content,Q3_PROMO,iOS,1.2.1,501-1000,Product,1,47,U00000X,1,2023-02-19 20:01,
U000617,Olivia,Lewis,olivia.lewis@icloud.com,GB,unknown,UTC,2023-05-17 0:00,content,RETARGET1,macOS,2.1.0,51-200,Sales,1,43,,Y,05/17/2023 21:13,2023-06-26 21:13
U000074,Amir,Garcia,amir.garcia@proton.me,SG,TX,America/New_York,2024-09-25 0:00,Paid Search,Q3_PROMO,Unknown,1.2.0,11-50,Finance,0,31,,TRUE,2024-09-25 4:46,2024-11-27 4:46
U000475,Ethan,Allen,ethan.allen@gmail.com,IN,CA,America/Los_Angeles,2024-04-11 0:00,Partner,N/A,Linux,1.1.2,11-50,HR,1,37,,N,2024-04-11 9:46,2024-08-20 9:46
U000250,Ethan,Allen,ETHAN.ALLEN@OUTLOOK.COM,JP,NSW,Europe/London,2024-10-28 0:00,Outbound,Q3_PROMO,Linux,1.2.1,10-Jan,Product,0,32,,1,2024-10-28 3:37,2025-04-22 3:37
 U001902 ,Sara,Allen,sara.allen@proton.me,MX,NSW,Europe/London,2023-01-16 0:00,Outbound,RETARGET1,Unknown,1.1.2,11-50,Ops,1,57,,no,2023-01-16 9:41,2023-06-17 9:41
U001956,Emma,Thompson,emma.thompson@nexloom.io,GB,unknown,Asia/Tokyo,2025-02-16 0:00,Content,AI-LAUNCH,Unknown,1.3.0,10-Jan,Engineering,0,48,,TRUE,2025-02-16 13:39,2025-04-03 13:39
U002117,Omar,Jackson,omar.jackson@nexloom.io,CA,WA,America/Los_Angeles,2024-02-28,Social,SPRING24,Android,1.1.2,1000+,Support,1,36,,TRUE,2024-02-28 6:41,2024-03-12 6:41
U000140,Anya,Smith,anya.smith@yahoo.com,AU,unknown,America/New_York,2025-06-12 0:00,Outbound,RETARGET1,Android,1.2.1,10-Jan,Founder,1,47,,no,2025-06-12 14:06,2025-09-02 14:06
U001506,Emma,Thompson,emma.thompson@nexloom.io,MX,-,America/Los_Angeles,2024-02-06 0:00,Referral,n/a,macOS,1.2.1,10-Jan,Founder,0,,,Y,2024-02-06 13:59,2024-08-01 13:59
U000636,Diego,Smith,diego.smith@outlook.com,NL,RJ,Asia/Kolkata,2024-03-02 0:00,Partner,BF2024,Windows,2.0.0,1000+,HR,0,53,,no,2024-03-02 10:14,2024-05-15 10:14
U001668,Jin,Scott,jin.scott@icloud.com,CA,-,America/Los_Angeles,2025-02-11,Content,SUMMER24,macOS,2.0.0,10-Jan,Founder,0,24,,FALSE,2025-02-11 23:41,2025-05-12 23:41
U001285,Liam,Jackson,liam.jackson@gmail.com,FR,MH,Europe/London,2023-12-29 0:00,Social,Q3_PROMO,Windows,1.1.0,unknown,Ops,0,64,,TRUE,2023-12-29 4:43,2024-02-20 4:43
U001206,Lucas,Scott,lucas.scott@outlook.com,IN,ON,America/Los_Angeles,2024-08-23 0:00,Webinar,AI-LAUNCH,Android,1.2.0,201-500,HR,0,41,,no,2024-08-23 22:14,2024-08-24 22:14
U000136,Zoe,Clark,zoe.clark@company.com,ca,LND,,27-12-2023,Content,BF2024,Linux,1.1.0,201-500,Founder,0,29,,yes,2023-12-27 10:24,
U000089,Lucas,Lee,LUCAS.LEE@PROTON.ME,JP,RJ,UTC,2024-12-05 0:00,Content,Q3_PROMO,Linux,1.1.0,501-1000,Engineering,0,52,,1,12/05/2024 04:54,2025-05-12 4:54
U001806,Ben,Johnson,ben.johnson@company.com,JP,NY,America/Los_Angeles,2024-08-26 0:00,Webinar,SUMMER24,Android,2.0.0,10-Jan,Founder,0,47,,FALSE,2024-08-26 7:52,2024-12-17 7:52
U001854,Nora,Johnson,nora.johnson@company.com,NL,,,2024-10-22 0:00,Organic Search,Q3_PROMO,Unknown,1.0.9,10-Jan,Product,1,64,,1,2024-10-22 9:42,2025-03-17 9:42
U001283,Anya,Martinez,anya.martinez@outlook.com,MX,ON,Asia/Kolkata,2024-04-28,Partner,AI-LAUNCH,Android,1.1.2,11-50,Product,1,21,,FALSE,2024-04-28 2:14,2024-07-09 2:14
U002496,Jin,Wilson,jin.wilson@outlook.com,CA,,Europe/Berlin,03/25/2024,Outbound,SUMMER24,macOS,1.2.1,10-Jan,Founder,0,54,,0,2024-03-25 23:07,2024-06-26
U002095,Sophia,Smith,sophia.smith@proton.me,ZA,BC,Europe/London,2023-12-06 0:00,Webinar,SUMMER24,macOS,2.0.1,501-1000,Product,0,59,,,2023-12-06 14:19,2024-01-18 14:19
U001305,Amir,Patel,amir.patel@proton.me,NL,,America/New_York,2024-07-16 0:00,Referral,n/a,Windows,1.1.2,51-200,Ops,0,61,,Y,2024-07-16 10:00,2024-12-15 10:00
U000512,Mia,Wilson,mia.wilson@gmail.com,FR,NY,America/Los_Angeles,2024-02-16 0:00,Webinar,SUMMER24,iOS,2.0.1,51-200,Ops,0,63,,TRUE,2024-02-16 14:51,2024-06-22 14:51
U001576,Kofi,Garcia,kofi.garcia@proton.me,GB,NY,Europe/London,05-07-2023,Paid Search,Q3_PROMO,iOS,2.1.0,11-50,Support,0,53,,FALSE,2023-07-05 12:05,2023-12-17 12:05
U002451,Nora,Lopez,nora.lopez@nexloom.io,NL,RJ,Asia/Tokyo,26-11-2023,Organic Search,RETARGET1,Windows,1.2.0,10-Jan,Support,0,29,,1,11/26/2023 09:24,2024-04-30 9:24
U002463,Olivia,Martin,olivia.martinyahoo.com,SE,MH,Asia/Tokyo,2024-05-30,Partner,WINTER25,macOS,1.3.0,201-500,Ops,0,57,,0,2024-05-30 18:17,2024-10-15 18:17
U001388,Fatima,Martinez,fatima.martinez@yahoo.com,DE,NY,Asia/Tokyo,2023-08-12 0:00,Partner,GROWTHLAB,Android,1.3.0,201-500,Engineering,1,49,,1,2023-08-12 7:40,2023-08-19 7:40
U001074,Mia,Lewis,mia.lewis@gmail.com,AU,ON,,2023-02-19 0:00,Referral,BF2024,Unknown,1.2.0,11-50,Sales,1,44,U000241,yes,2023-02-19 17:17,2023-06-29 17:17
U002054,Ethan,Thomas,ethan.thomas@gmail.com,SE,NY,Europe/London,2025-03-17 0:00,Referral,n/a,iOS,1.2.1,11-50,Marketing,0,20,U000475,FALSE,2025-03-17 5:48,2025-05-09 5:48
U000556,Ravi,Clark,ravi.clark@yahoo.com,US,SP,Europe/Berlin,2024-02-09 0:00,referral,AI-LAUNCH,Android,2.1.0,11-50,Finance,1,30,,1,2024-02-09 5:23,2024-03-10 5:23
U000999,Emma,WALKER,emma.walker@yahoo.com,AU,LND,America/Los_Angeles,2025-03-29 0:00,Paid Search,GROWTHLAB,iOS,v1.2.0,10-Jan,Finance,1,29,,,2025-03-29 12:45,2025-07-07 12:45
U000131,Emma,Walker,emma.walker@icloud.com,IN,,UTC,2024-02-16 0:00,Referral,GROWTHLAB,macOS,2.1.0,51-200,HR,0,41,,0,2024-02-16 8:40,2024-05-18 8:40
U000200,Sofia,Garcia,sofia.garcia@yahoo.com,MX,NY,Asia/Tokyo,2024-08-30 0:00,Referral,n/a,Linux,1.2.1,201-500,Founder,0,64,U000397,1,2024-08-30 10:10,2025-01-23 10:10
U001184,Elena,Brown,elena.brown@nexloom.io,IN,BC,Asia/Kolkata,2025-02-14 0:00,Social,BF2024,Android,v2.1.0,11-50,Marketing,0,46,,no,2025-02-14 5:26,2025-04-14 5:26
U001244,Sofia,Wright,sofia.wright@nexloom.io,FR,CA,Asia/Tokyo,2024-10-21 0:00,Outbound,BF2024,Windows,1.1.0,unknown,Finance,1,59,,FALSE,2024-10-21 5:34,2025-01-31 5:34
U002063,Olivia,Allen,olivia.allen@proton.me,FR,MH,,2024-09-18 0:00,Social,RETARGET1,Linux,1.0.9,11-50,Finance,0,49,,,2024-09-18 16:32,2025-02-06 16:32
U000661,Ethan,Harris,ethan.harris@gmail.com,JP,MH,Europe/London,2024-13-05,Content,RETARGET1,Android,2.0.1,11-50,HR,0,52,,FALSE,2024-01-15 9:20,2024-02-04 9:20
U000196,Chen,Scott,chen.scott@icloud.com,SG,TX,,2024-01-11 0:00,Content,SUMMER24,Unknown,1.3.0,unknown,Marketing,1,36,,TRUE,2024-01-11 16:51,2024-03-28 16:51
U002332,Mia,Smith,mia.smith@yahoo.com,ZA,unknown,America/New_York,15-05-2023,Organic Search,BF2024,Unknown,1.3.0,501-1000,Product,0,49,,no,2023-05-15 21:25,2023-08-21 21:25
U000261,Ava,Garcia,ava.garcia@nexloom.io,ZA,WA,UTC,2024-05-26 0:00,Webinar,AI-LAUNCH,Android,2.1.0,201-500,Engineering,0,29,,,2024-05-26 23:58,2024-09-24 23:58
U002352,Hana,Allen,hana.allen@icloud.com,MX,NY,Europe/Berlin,2025-01-11,Outbound,RETARGET1,iOS,1.1.2,51-200,HR,1,28,,Y,2025-01-11 8:29,2025-03-15 8:29
U000596,Ava,Thomas,ava.thomas@company.com,DE,WA,UTC,2024-03-16 0:00,Outbound,BF2024,Unknown,1.1.2,1000+,Engineering,0,64,,yes,2024-03-16 22:38,2024-05-11 22:38
U000626,Anya,Perez,anya.perez@outlook.com,NL,SP,Europe/London,2024-01-22 0:00,Paid Search,SUMMER24,Linux,v2.0.1,unknown,Ops,1,35,,no,2024-01-22 10:50,2024-02-01 10:50
U001965,Noah,Thomas,noah.thomas@nexloom.io,IN,NY,Europe/Berlin,2024-05-04 0:00,Content,N/A,Android,1.2.0,unknown,Engineering,0,22,,TRUE,2024-05-04 9:22,2024-06-13 9:22
U000098,Amir,Martinez,amir.martinez@proton.me,ZA,unknown,Asia/Kolkata,2024-02-21 0:00,Social,SUMMER24,Windows,1.0.9,1000+,Marketing,0,40,,FALSE,2024-02-21 13:09,2024-08-15 13:09
U001313,Fatima,Garcia,fatima.garcia@outlook.com,DE,,Europe/Berlin,2024-04-21 0:00,Social,WINTER25,iOS,1.3.0,501-1000,Support,0,26,,FALSE,2024-04-21 10:29,2024-08-05 10:29
U000778,Mia,Young,mia.young@company.com,ZA,NY,Europe/London,2024-07-24 0:00,Partner,WINTER25,Windows,1.2.1,11-50,Engineering,0,52,,,2024-07-24 20:37,2024-09-25 20:37
U000177,Diego,Thompson,diego.thompson@gmail.com,FR,-,UTC,2024-07-06 0:00,content,AI-LAUNCH,Android,2.0.1,1000+,Support,0,40,,yes,2024-07-06 7:52,12-13-2024 07:52
U000844,Ivy,Clark,IVY.CLARK@PROTON.ME,FR,CA,America/Los_Angeles,02-05-2025,Partner,N/A,Android,1.2.1,unknown,Founder,1,24,,FALSE,2025-05-02 20:15,2025-05-07 20:15
U000420,Anya,Walker,anya.walker@company.com,fr,LND,,2024-08-12 0:00,Paid Search,SPRING24,Unknown,1.0.9,11-50,Engineering,0,62,,FALSE,2024-08-12 20:38,2024-08-18 20:38
U001493,Ravi,White,ravi.white@company.com,BR,CA,,2023-10-29 0:00,Partner,Q3_PROMO,Windows,1.1.2,11-50,Marketing,0,35,,,2023-10-29 10:44,2024-01-16 10:44
U001433,Anya,Nguyen,anya.nguyen@icloud.com,FR,BC,Asia/Kolkata,2024-03-23 0:00,Webinar,SPRING24,Linux,2.0.1,51-200,Product,0,45,,1,2024-03-23 18:19,2024-08-06 18:19
U002082,Noah,Anderson,noah.anderson@icloud.com,NL,MH,Asia/Kolkata,2023-05-24 0:00,Partner,Q3_PROMO,macOS,v2.0.1,51-200,Founder,0,39,,Y,2023-05-24 13:22,2023-09-04 13:22
U002036,Kofi,Martinez,kofi.martinez@proton.me,MX,TX,Europe/Berlin,2024-01-11 0:00,Paid Search,Q3_PROMO,Android,2.0.0,1000+,Ops,no,N/A,,no,2024-01-11 18:35,05-17-2024 18:35
U000787,Elena,Allen,elena.allen@gmail.com,FR,ON,Europe/Berlin,2024-05-10 0:00,Webinar,BF2024,iOS,2.1.0,10-Jan,Sales,0,21,,no,2024-05-10 23:13,2024-11-01 23:13
U001816,Mateo,Wilson,mateo.wilson@proton.me,NL,-,America/New_York,05/27/2025,Webinar,SUMMER24,Linux,2.0.1,201-500,Marketing,0,42,,1,2025-05-27 5:55,2025-09-08 5:55
U002070,Ethan,Johnson,ethan.johnson@gmail.com,ZA,NSW,,2023-12-31 0:00,Referral,n/a,macOS,1.2.0,201-500,Engineering,0,24,U000240,FALSE,2023-12-31 1:41,2024-05-11 1:41
U000576,Olivia,Martin,olivia.martin@gmail.com,FR,NSW,,2025-03-27 0:00,Organic Search,n/a,iOS,1.1.2,501-1000,HR,0,36,,,2025-03-27 19:44,2025-03-29 19:44
U000595,Fatima,Wright,fatima.wright@nexloom.io,BR,BER,America/New_York,2024-12-17 0:00,Content,RETARGET1,macOS,2.0.0,11-50,Product,1,63,,N,2024-12-17 0:39,2025-01-14 0:39
U000026,Diego,Martinez,diego.martinez@proton.me,BR,NY,,2024-09-03 0:00,Social,RETARGET1,iOS,1.0.9,1000+,Finance,TRUE,18,,1,2024-09-03 8:33,2025-02-23 8:33
U002590,Ethan,Allen, ETHAN.ALLEN@YAHOO.COM ,ZA,,America/New_York,2025-02-30,Social,SUMMER24,iOS,1.1.2,11-50,Support,0,52,,FALSE,2024-07-19 17:05,2024-11-27
U001611,Yuki,Young,yuki.young@nexloom.io,SE,,,2024-11-26 0:00,Outbound,N/A,iOS,2.1.0,1000+,Founder,0,30,,1,2024-11-26 17:50,2025-02-04 17:50
U002497,Kofi,Lewis,kofi.lewis@nexloom.io,NL,BC,Asia/Kolkata,2024-05-06 0:00,Paid Search,Q3_PROMO,Android,1.3.0,10-Jan,Engineering,0,46,,no,2024-05-06 0:10,2024-06-01
U000757,Liam,Smith,liam.smith@nexloom.io,ZA,MH,Europe/London,2024-05-29 0:00,Webinar,N/A,Windows,2.1.0,51-200,Marketing,0,40,,no,05/29/2024 04:30,08-30-2024 04:30
U001550,Zoe,Robinson,zoe.robinson@yahoo.com,BR,-,Europe/Berlin,2024-06-04 0:00,Organic Search,BF2024,iOS,1.3.0,11-50,Marketing,0,49,,yes,2024-06-04 17:11,2024-11-16 17:11
U002184,Priya,Anderson,priya.anderson@icloud.com,JP,MH,UTC,2023-12-16 0:00,Outbound,N/A,iOS,1.1.2,501-1000,HR,1,25,,FALSE,2023-12-16 15:46,2024-05-09 15:46
U001621,Diego,Wright, diego.wright@company.com ,NL,NSW,,03/11/2024,Organic Search,N/A,macOS,1.1.2,501-1000,Ops,0,62,,,2024-03-11 19:08,2024-04-23 19:08
U001031,Chen,Allen,chen.allen@icloud.com,SE,BER,,2023-04-04 0:00,Webinar,BF2024,Android,1.3.0,201-500,HR,yes,53,,FALSE,2023-04-04 4:52,2023-07-03 4:52
U002464,Amir,Taylor,amir.taylor@proton.me,AU,LND,,2024-05-02 0:00,Webinar,Q3_PROMO,iOS,2.0.1,unknown,HR,0,55,,,2024-05-02 23:46,2024-06-07 23:46
U001309,Sofia,Allen,sofia.allen@nexloom.io,SG,NSW,Europe/Berlin,2024-01-06 0:00,Organic Search,WINTER25,macOS,2.1.0,201-500,Marketing,1,39,,yes,2024-01-06 15:45,2024-02-04 15:45
U001958,Ivy,Garcia,ivy.garcia@icloud.com,IN,WA,Asia/Tokyo,2024-02-18 0:00,Partner,NA,Windows,2.1.0,501-1000,Ops,0,32,,TRUE,02/18/2024 19:13,2024-04-20 19:13
U001370,Hana,Patel,hana.patel@nexloom.io,SE,-,America/New_York,2023-11-05 0:00,Webinar,GROWTHLAB,iOS,1.3.0,1000+,Ops,0,47,,FALSE,2023-11-05 14:13,2023-11-22 14:13
u002490,Kofi,Perez,kofi.perez@gmail.com,GB,NY,Europe/London,2024-01-25 0:00,Outbound,SPRING24,iOS,1.2.0,501-1000,Engineering,1,48,,,2024-01-25 22:23,2024-03-10 22:23
U000188,Ben,Wilson,ben.wilson@company.com,BR,NY,America/Los_Angeles,2024-04-25 0:00,Content,BF2024,Unknown,2.0.0,51-200,Engineering,0,53,,0,2024-04-25 20:25,2024-05-06
U001984,Mia,Martinez,mia.martinez@gmail.com,CA,CA,Asia/Kolkata,2024-03-20 0:00,Social,RETARGET1,Windows,1.1.2,201-500,Ops,0,18,,TRUE,2024-03-20 19:55,2024-06-23 19:55
U002257,Sara,Nguyen,sara.nguyen@icloud.com,SG,unknown,America/New_York,2024-04-06 0:00,Paid Search,WINTER25,macOS,1.2.0,501-1000,HR,0,45,,TRUE,2024-04-06 7:41,2024-04-14 7:41
U001248,Mia,Garcia, mia.garcia@gmail.com ,SG,,America/Los_Angeles,2023-03-25 0:00,Referral,RETARGET1,Android,1.0.9,11-50,HR,1,33,U000220,FALSE,2023-03-25 2:32,2023-08-23 2:32
U000455,Ava,Thompson,ava.thompson@icloud.com,IN,RJ,Europe/London,2023-07-23,Partner,N/A,iOS,2.0.0,10-Jan,Product,1,63,,Y,2023-07-23 15:29,2023-08-22 15:29
U002114,Chen,Scott,chen.scottyahoo.com,US,TX,Asia/Tokyo,12/14/2024,Webinar,GROWTHLAB,macOS,2.0.1,11-50,Engineering,0,N/A,,yes,2024-12-14 4:31,2025-01-14 4:31
U000500,Omar,White,omar.white@gmail.com,AU,RJ,America/Los_Angeles,2025-08-26 0:00,Organic Search,n/a,iOS,1.2.0,1000+,Support,0,29,,0,2025-08-26 23:32,2025-10-26 23:32
U000023,Yuki,Young,yuki.young@nexloom.io,ZA,RJ,,2024-05-26 0:00,Content,WINTER25,macOS,1.0.9,11-50,HR,0,23,,TRUE,2024-05-26 5:05,2024-11-08 5:05
U002234,Mia,Davis,MIA.DAVIS@ICLOUD.COM,MX,NY,Europe/London,2024-10-28 0:00,Social,BF2024,Unknown,1.0.9,unknown,Ops,0,54,,N,2024-10-28 5:33,2025-03-15 5:33
U000812,Jin,Wright,JIN.WRIGHT@GMAIL.COM,CA,,,2024-10-15 0:00,Outbound,SPRING24,macOS,2.0.0,501-1000,HR,0,56,,TRUE,10/15/2024 03:07,
U002384,Priya,White,priya.white@yahoo.com,BR,LND,UTC,2024-02-23 0:00,Organic Search,n/a,iOS,2.1.0,501-1000,Finance,0,39,,N,2024-02-23 18:30,2024-06-17 18:30
U001593,Kofi,Anderson,kofi.anderson@proton.me,GB,CA,America/New_York,2023-08-10 0:00,Content,WINTER25,iOS,1.1.0,unknown,Marketing,0,30,,0,2023-08-10 4:29,2024-01-14 4:29
U002543,Nora,Smith,nora.smith@nexloom.io,,,Europe/Berlin,2024-10-22 0:00,Paid Search,SUMMER24,Windows,2.1.0,unknown,HR,0,31,,no,2024-10-22 20:30,2024-11-06 20:30
U001640,Mateo,Thompson,mateo.thompson@icloud.com,U.K.,,Asia/Tokyo,2025-02-04 0:00,Partner,N/A,iOS,1.2.1,1000+,HR,1,56,,FALSE,2025-02-04 2:06,2025-07-09 2:06
U000823,Ethan,Martinez,ethan.martinez@icloud.com,SG,NY,America/Los_Angeles,2024-01-02 0:00,Social,SUMMER24,Unknown,1.1.2,unknown,Ops,0,59,,1,2024-01-02 4:17,2024-04-29 4:17
U000180,Sara,Johnson,sara.johnson@yahoo.com,CA,ON,Asia/Kolkata,2023-11-23 0:00,Webinar,GROWTHLAB,macOS,2.0.0,501-1000,Ops,0,36,,FALSE,2023-11-23 0:11,2024-03-15 0:11
U002432,Olivia,Harris,olivia.harris@gmail.com,JP,WA,,2024-10-05 0:00,Content,AI-LAUNCH,macOS,1.0.9,501-1000,Finance,1,53,,Y,2024-10-05 1:27,2024-10-19 1:27
U000289,Liam,Wilson,LIAM.WILSON@OUTLOOK.COM,SE,NY,Asia/Tokyo,2023-12-06 0:00,Paid Search,SPRING24,macOS,1.0.9,11-50,Ops,1,36,,0,2023-12-06 22:26,2024-01-06 22:26
U000735,Lucas,Anderson,lucas.anderson@outlook.com,CA,CA,America/Los_Angeles,2024-01-16 0:00,Content,RETARGET1,Linux,2.0.0,501-1000,Finance,1,64,,Y,2024-01-16 13:31,2024-03-05 13:31
U001170,Ravi,Young,ravi.young@gmail.com,FR,LND,Europe/London,2023-12-06 0:00,Outbound,SUMMER24,iOS,1.1.2,501-1000,Engineering,0,26,,TRUE,2023-12-06 0:14,2024-03-18 0:14
U001272,Sophia,Harris,sophia.harris@nexloom.io,SG,LND,America/Los_Angeles,2024-11-05,Paid Search,BF2024,macOS,1.1.0,10-Jan,Sales,1,64,,FALSE,2024-11-05 23:07,2025-02-07 23:07
U001134,Diego,Davis,diego.davis@proton.me,FR,SP,,2023-10-24 0:00,Webinar,AI-LAUNCH,Unknown,2.1.0,10-Jan,Support,0,39,,no,2023-10-24 9:41,2023-12-05 9:41
U000646,Zoe,Allen,zoe.allen@nexloom.io,IN,,UTC,2024-12-09 0:00,Organic Search,RETARGET1,macOS,1.3.0,unknown,Founder,0,57,,1,2024-12-09 19:51,2025-06-05 19:51
U000090,Ravi,Young,ravi.young@company.com,SG,-,,2024-03-15 0:00,Referral,RETARGET1,iOS,1.2.1,11-50,Ops,1,44,U000310,0,2024-03-15 4:37,07-27-2024 04:37
U000645,Ethan,Robinson,ethan.robinson@yahoo.com,DE,LND,Asia/Kolkata,2023-08-01 0:00,Referral,GROWTHLAB,iOS,2.0.1,501-1000,Founder,0,45, U000003 ,TRUE,2023-08-01 15:29,2024-01-10 15:29
U001602,Jin,Harris,jin.harris@icloud.com,ZA,ON,Asia/Kolkata,2023-12-28 0:00,Partner,WINTER25,Linux,1.1.2,1000+,Engineering,1,32,,TRUE,2023-12-28 0:41,2024-03-28 0:41
U001870,Ava,Lee,ava.lee@company.com,BR,ON,America/New_York,07/26/2024,Partner,Q3_PROMO,iOS,1.2.1,51-200,Sales,0,19,,TRUE,07/26/2024 22:17,2024-10-21 22:17
U000485,Ravi,Harris,ravi.harris@gmail.com,NL,WA,UTC,2024-05-10 0:00,Referral,GROWTHLAB,Linux,1.2.0,11-50,Support,0,48,,FALSE,2024-05-10 10:36,2024-09-24 10:36
U001574,Ava,Garcia,ava.garciayahoo.com,CA,TX,UTC,2024-11-07 0:00,partner,AI-LAUNCH,Unknown,1.2.1,51-200,Ops,0,28,,FALSE,2024-11-07 11:23,2024-12-31 11:23
U002143,Elena,Anderson, ELENA.ANDERSON@PROTON.ME ,ZA,NSW,America/Los_Angeles,2024-07-17 0:00,Webinar,N/A,Unknown,1.1.2,1000+,Engineering,0,57,,0,2024-07-17 19:48,2024-08-06 19:48
 U000569 ,Elena,Walker,elena.walker@outlook.com,ZA,RJ,America/New_York,2024-12-28 0:00,Content,SUMMER24,Android,1.2.1,201-500,Product,no,46,,,2024-12-28 23:47,2025-02-02 23:47
U002215,Hana,Lee,hana.lee@nexloom.io,NL,,Asia/Tokyo,2024-07-27 0:00,Referral,n/a,Linux,v1.1.0,501-1000,HR,0,unknown,U000142,yes,2024-07-27 12:47,2024-08-31 12:47
U000935,Chen,Davis,chen.davis@gmail.com,CA,,America/New_York,2023-09-18 0:00,Referral,SUMMER24,macOS,1.3.0,1000+,Marketing,0,unknown,,FALSE,2023-09-18 20:51,2023-12-06 20:51
U001421,Liam,Brown,liam.brown@nexloom.io,se,LND,America/Los_Angeles,2023-12-23,Partner,AI-LAUNCH,Windows,2.1.0,10-Jan,Ops,0,33,,N,2023-12-23 9:32,2024-05-17 9:32
U000552,Ivy,Patel, ivy.patel@icloud.com ,MX,RJ,Europe/Berlin,28-10-2024,Referral,SPRING24,Windows,1.0.9,201-500,Finance,FALSE,22,U000400,,2024-10-28 20:38,2025-01-16
U002177,Lucas,Lee,lucas.lee@nexloom.io,NL,TX,,2023-12-02 0:00,Referral,BF2024,iOS,1.2.0,10-Jan,Engineering,1,58,U000439,0,2023-12-02 21:12,2024-05-14 21:12
U001060,Mia,Nguyen,mia.nguyen@outlook.com,FR,BC,America/Los_Angeles,2024-06-01,Organic Search,GROWTHLAB,Android,1.3.0,501-1000,Founder,1,26,,N,2024-06-01 3:52,2024-09-21 3:52
U002016,Hana,Wilson,hana.wilson@gmail.com,AU,NY,Asia/Kolkata,2024-02-13 0:00,webinar,RETARGET1,macOS,1.1.0,501-1000,Engineering,1,30,,FALSE,2024-02-13 16:46,2024-08-11 16:46
U000051,Sara,Young,sara.young@yahoo.com,US,BC,UTC,2024-03-06 0:00,webinar,AI-LAUNCH,Windows,1.2.0,1000+,Product,1,52,,0,2024-03-06 22:47,2024-06-10 22:47
U001270,Zoe,Wright, zoe.wright@company.com ,AU,unknown,,2023-12-09 0:00,Referral,n/a,iOS,2.0.0,10-Jan,Support,0,54,U000394,TRUE,2023-12-09 4:17,2024-03-12 4:17
U002350,Diego,Jackson,diego.jackson@nexloom.io,BR,WA,,2023-01-30 0:00,Partner,WINTER25,macOS,2.1.0,unknown,Finance,1,,,no,2023-01-30 9:11,2023-04-18 9:11
U002381,Jin,Johnson,jin.johnson@company.com,JP,-,Asia/Kolkata,2024-10-01 0:00,Referral,n/a,Unknown,1.0.9,201-500,Founder,0,53,U000245,0,2024-10-01 18:48,2024-12-01 18:48
U000268,Emma,Martin,emma.martinnexloom.io,CA,RJ,,2024-07-13,Social,WINTER25,macOS,1.2.1,1000+,Product,0,39,,Y,2024-07-13 8:41,08-13-2024 08:41
U002250,Noah,Scott,noah.scott@outlook.com,MX,SP,UTC,07/27/2023,Outbound,SPRING24,Android,1.2.0,11-50,Engineering,FALSE,60,,no,2023-07-27 22:21,2023-09-30 22:21
U001848,Lucas,White,lucas.white@gmail.com,MX,ON,Europe/Berlin,2023-10-08 0:00,Referral,BF2024,Unknown,1.1.2,51-200,Engineering,0,44,U000151,FALSE,2023-10-08 6:07,2024-03-04
U001407,Amir,Perez,amir.perez@nexloom.io,GB,unknown,Europe/Berlin,2024-10-20 0:00,Paid Search,SPRING24,Windows,1.3.0,201-500,HR,0,31,,0,2024-10-20 20:14,2025-03-23 20:14
U000640,Mateo,Walker,mateo.walker@outlook.com,SE,MH,America/Los_Angeles,2024-01-26 0:00,Content,N/A,macOS,1.1.2,201-500,Finance,0,23,,TRUE,2024-01-26 6:06,2024-04-20 6:06
U001445,Chen,Wilson,chen.wilson@icloud.com,SG,WA,UTC,2024-11-13,Referral,n/a,macOS,2.1.0,51-200,Product,0,36,U000108,N,2024-11-13 15:25,2025-03-20 15:25
U001053,Noah,Taylor,noah.taylor@company.com,SE,BER,UTC,2025-03-01 0:00,Outbound,GROWTHLAB,macOS,1.3.0,unknown,Sales,yes,,,0,2025-03-01 10:49,2025-07-27 10:49
U001968,Ivy,Scott,ivy.scott@icloud.com,NL,SP,America/New_York,2024-01-18 0:00,Social,RETARGET1,Windows,1.1.2,11-50,Founder,1,45,,TRUE,2024-01-18 7:38,2024-03-07 7:38
U001023,Omar,Allen,omar.allen@outlook.com,JP,,Europe/Berlin,2025-01-30,Social,,Windows,v2.1.0,51-200,Engineering,0,53,,TRUE,2025-01-30 0:41,2025-04-25 0:41
U000530,Mia,Taylor,mia.taylor@proton.me,SE,BER,Asia/Tokyo,2024-11-09 0:00,Partner,Q3_PROMO,macOS,1.2.0,1000+,Marketing,0,61,,TRUE,2024-11-09 23:54,2024-11-14 23:54
U001108,Lucas,Brown, lucas.brown@gmail.com ,JP,SP,,2024-08-15 0:00,Paid Search,WINTER25,Unknown,2.0.1,1000+,Marketing,0,42,,no,2024-08-15 5:22,2025-01-27 5:22
U002279,Ava,Perez,ava.perez@company.com,SG,NSW,Europe/London,2024-06-05 0:00,Paid Search,GROWTHLAB,Android,1.1.2,10-Jan,Finance,0,57,,TRUE,2024-06-05 6:23,2024-08-27 6:23
U001231,Kofi,Jackson,kofi.jackson@proton.me,CA,MH,America/New_York,2024-12-14 0:00,Organic Search,n/a,Android,1.2.0,501-1000,Sales,0,55,,TRUE,2024-12-14 6:53,2025-01-28 6:53
U001386,Ben,Jackson,ben.jackson@proton.me,AU,LND,UTC,2023-12-29,Social,SPRING24,iOS,2.0.0,1000+,Engineering,0,45,,FALSE,2023-12-29 16:32,2024-03-12
U002427,Hana,Clark,hana.clark@company.com,GB,NY,Asia/Tokyo,2023-07-28,Organic Search,GROWTHLAB,Linux,v1.3.0,51-200,Founder,0,58,,N,2023-07-28 9:11,2023-11-12 9:11
U000052,Priya,Scott,priya.scott@outlook.com,BR,,Europe/London,2024-08-27 0:00,Outbound,N/A,Windows,1.1.0,11-50,Founder,0,29,,TRUE,2024-08-27 9:52,2024-09-05
U001105,Sofia,Young,sofia.young@yahoo.com,ZA,-,Europe/Berlin,2025-10-23 0:00,Paid Search,WINTER25,Android,2.0.0,1000+,Ops,0,34,,yes,2025-10-23 3:24,2026-03-09 3:24
U000126,Lucas,Lewis,lucas.lewis@yahoo.com,mx,SP,UTC,2024-02-21 0:00,Outbound,RETARGET1,Android,1.0.9,11-50,Product,0,31,,1,2024-02-21 2:44,2024-03-29 2:44
U001127,Jin,White,jin.white@icloud.com,CA,SP,UTC,2023-06-24 0:00,Organic Search,,Android,1.2.1,10-Jan,Support,0,22,,Y,2023-06-24 23:53,2023-11-30 23:53
U001456,Mia,Martin,mia.martin@yahoo.com,IN,,UTC,2025-02-11 0:00,Webinar,N/A,Unknown,1.0.9,10-Jan,Support,0,50,,TRUE,02/11/2025 18:58,2025-03-30 18:58
U001840,Leo,Moore,leo.moore@outlook.com,BR,,Asia/Tokyo,2023-10-27 0:00,Paid Search,Q3_PROMO,Unknown,2.1.0,11-50,Sales,0,27,,TRUE,2023-10-27 20:50,2024-03-14 20:50
U000424,Liam,Allen,liam.allen@proton.me,FR,CA,America/New_York,2024-03-26 0:00,Outbound,SPRING24,macOS,1.3.0,1000+,Marketing,0,30,,yes,2024-03-26 18:06,08-02-2024 18:06
U000164,Ethan,Nguyen,ethan.nguyen@proton.me,JP,CA,UTC,04/16/2024,Paid Search,SUMMER24,macOS,1.2.0,501-1000,Sales,1,54,,TRUE,2024-04-16 17:12,2024-04-24 17:12
U000319,Lucas,Davis,lucas.davis@yahoo.com,US,NSW,Europe/London,2023-09-05,Webinar,WINTER25,Linux,1.3.0,51-200,Support,0,52,,1,2023-09-05 21:42,2023-09-14 21:42
U002123,Ivy,Clark,ivy.clark@icloud.com,FR,unknown,UTC,2025-05-24 0:00,Social,Q3_PROMO,macOS,2.0.0,501-1000,Finance,0,54,,no,2025-05-24 5:57,2025-09-29 5:57
U001720,Kofi,Johnson,kofi.johnsonproton.me,JP,ON,America/New_York,2023-11-06 0:00,Organic Search,RETARGET1,iOS,2.0.0,unknown,Ops,0,48,,TRUE,2023-11-06 12:15,2024-01-02 12:15
U000580,Sofia,Allen,sofia.allen@outlook.com,US,SP,Asia/Tokyo,2023-11-19 0:00,Referral,N/A,macOS,1.0.9,10-Jan,Product,1,41,,TRUE,2023-11-19 23:18,2023-11-27 23:18
U000635,Lucas,Thomas,lucas.thomas@proton.me,JP,SP,,2023-07-18 0:00,Partner,SUMMER24,Android,1.2.1,10-Jan,Finance,1,26,,FALSE,2023-07-18 17:00,2023-10-19 17:00
U002375,Amir,Lewis,amir.lewis@gmail.com,US,BER,,2024-06-26 0:00,Paid Search,WINTER25,Linux,2.1.0,501-1000,Marketing,0,45,,N,2024-06-26 10:49,2024-07-03 10:49
U002595,Elena,Jackson,elena.jackson@outlook.com,BR,TX,Europe/London,2023-08-24 0:00,Referral,n/a,macOS,1.1.2,1000+,Ops,0,62,U000106,,2023-08-24 6:35,2023-12-17 6:35
U000613,Olivia,King,olivia.king@proton.me,DE,TX,America/New_York,06/02/2024,Outbound,Q3_PROMO,iOS,2.1.0,51-200,Support,0,32,,no,2024-06-02 18:42,2024-11-01 18:42
U000007,Noah,Anderson,noah.anderson@company.com,ZA,BC,UTC,2024-06-10 0:00,Social,WINTER25,Unknown,1.1.2,10-Jan,Founder,1,27,,FALSE,2024-06-10 9:35,2024-12-03 9:35
U000610,Lucas,Perez,lucas.perez@company.com,AU,CA,,2024-07-06 0:00,Content,SPRING24,Android,1.1.2,51-200,Sales,0,61,,yes,2024-07-06 1:56,2024-11-19 1:56
U001783,Priya,Lopez,priya.lopez@gmail.com,NL,TX,,2024-03-09 0:00,Partner,WINTER25,Unknown,1.1.2,1000+,Marketing,,20,,FALSE,2024-03-09 1:20,2024-06-18 1:20
U000694,Ravi,Martin,ravi.martin@company.com,NL,CA,America/Los_Angeles,2023-11-08 0:00,Organic Search,NA,Linux,1.1.0,unknown,Ops,0,28,,,2023-11-08 8:01,2024-04-14 8:01
U000459,Ava,Thompson,ava.thompson@proton.me,FR,unknown,Asia/Kolkata,2023-05-10 0:00,Outbound,,Linux,1.0.9,1000+,Sales,0,28,,,2023-05-10 8:12,2023-06-14 8:12
U002445,Kofi,Smith,kofi.smith@yahoo.com,SG,ON,,2024-02-28 0:00,Paid Search,Q3_PROMO,Android,v1.2.0,501-1000,Ops,0,46,,Y,2024-02-28 22:51,2024-08-25 22:51
U000518,Sara,Anderson,sara.anderson@icloud.com,IN,NY,Europe/London,2024-09-21 0:00,Referral,AI-LAUNCH,Android,1.2.1,10-Jan,Support,1,38,U000135,FALSE,2024-09-21 19:05,2025-02-24 19:05
U000384,Amir,Brown,amir.brown@outlook.com,AU,RJ,,2024-11-23,Organic Search,n/a,Linux,1.0.9,51-200,Finance,0,63,,FALSE,11/23/2024 23:57,2025-03-11 23:57
U000427,Yuki,Patel,yuki.patel@icloud.com,SG,MH,Europe/Berlin,2024-02-28 0:00,Social,Q3_PROMO,Windows,1.2.1,unknown,Engineering,0,24,,FALSE,2024-02-28 13:54,2024-04-17 13:54
U002080,Fatima,Lopez,fatima.lopez@icloud.com,ZA,CA,Asia/Tokyo,08/24/2024,Content,WINTER25,Linux,2.0.0,10-Jan,Marketing,yes,,,yes,2024-08-24 6:30,2025-02-02
U002434,Lucas,Lopez,lucas.lopez@nexloom.io,US,,Asia/Kolkata,2023-12-07 0:00,Social,N/A,Unknown,1.0.9,1000+,HR,0,53,,1,2023-12-07 7:03,2023-12-30 7:03
U001715,Elena,Martin,elena.martin@gmail.com,US,BER,Europe/London,2023-05-13 0:00,Outbound,AI-LAUNCH,Windows,1.1.0,11-50,Marketing,0,25,,Y,2023-05-13 5:23,2023-06-12 5:23
U002334,Lucas,Walker,lucas.walker@proton.me,ZA,CA,,2024-07-03,Webinar,AI-LAUNCH,Android,2.1.0,11-50,Sales,0,43,,Y,2024-07-03 17:15,2024-08-15 17:15
U001705,Anya,Martinez,anya.martinez@yahoo.com,NL,LND,UTC,2024-02-27,Organic Search,n/a,Android,1.3.0,501-1000,Marketing,0,59,,Y,2024-02-27 17:18,2024-07-24 17:18
U001665,Mateo,Thomas,mateo.thomas@icloud.com,JP,TX,Europe/Berlin,2025-10-04 0:00,Webinar,N/A,Android,2.0.0,201-500,Ops,0,54,,1,2025-10-04 9:30,2025-10-07 9:30
U002376,Ravi,Thompson,ravi.thompson@nexloom.io,SG,MH,,2023-11-29 0:00,Partner,SPRING24,iOS,v1.0.9,unknown,Founder,0,64,,0,2023-11-29 8:36,2023-12-04 8:36
USR-001003,Nora,Thomas,nora.thomas@outlook.com,MX,,America/New_York,2024-11-18 0:00,Paid Search,AI-LAUNCH,iOS,2.0.1,201-500,Support,0,33,,,2024-11-18 5:41,2024-12-22 5:41
U000463,Ava,Allen,ava.allen@nexloom.io,DE,CA,,08/08/2024,Organic Search,WINTER25,Linux,2.1.0,11-50,Ops,0,46,,TRUE,2024-08-08 18:26,2024-08-19 18:26
U000320,Lucas,Thomas,lucas.thomas@proton.me,ZA,TX,Asia/Tokyo,14-11-2023,Webinar,SPRING24,iOS,1.0.9,1000+,Engineering,0,50,,N,2023-11-14 8:46,2024-04-29 8:46
U000176,Emma,Jackson,emma.jackson@gmail.com,DE,,Asia/Kolkata,2023-09-20,Social,WINTER25,iOS,2.0.1,51-200,Ops,1,53,,,2023-09-20 16:14,03-11-2024 16:14
U001126,Fatima,Scott,fatima.scott@proton.me,MX,CA,Asia/Tokyo,2024-04-23 0:00,Referral,n/a,Linux,1.1.2,51-200,HR,1,29,,TRUE,2024-04-23 6:26,2024-07-16 6:26
U000558,Mateo,Davis,mateo.davis@proton.me,SE,NSW,UTC,03/17/2023,Paid Search,NA,iOS,2.1.0,10-Jan,Founder,0,48,,FALSE,2023-03-17 20:22,2023-08-14 20:22
U000973,Anya,Walker,anya.walker@gmail.com,IN,BC,UTC,2024-07-30,Content,Q3_PROMO,Windows,1.1.2,51-200,Sales,0,34,,yes,2024-07-30 20:59,2024-12-23 20:59
U001465,Emma,Lewis,emma.lewis@proton.me,SG,,,2025-11-27 0:00,Partner,RETARGET1,iOS,1.0.9,51-200,Engineering,0,27,,TRUE,2025-11-27 2:50,2026-01-29 2:50
U002568,Emma,Brown,emma.brown@outlook.com,FR,,America/Los_Angeles,2023-12-03 0:00,Organic Search,AI-LAUNCH,iOS,1.1.2,201-500,Engineering,1,26,,N,2023-12-03 9:17,2023-12-23 9:17
U001906,Mia,Patel,mia.patel@yahoo.com,SG,BC,Europe/London,2023-10-12 0:00,Organic Search,SUMMER24,iOS,1.2.0,501-1000,Support,no,59,,yes,2023-10-12 9:00,2024-02-14 9:00
U001626,Hana,Martinez,hana.martinez@company.com,DE,CA,,2024-07-05 0:00,Social,N/A,Windows,2.1.0,11-50,Engineering,0,24,,N,2024-07-05 20:19,2024-10-23 20:19
U002591,Zoe,Jackson,zoe.jackson@nexloom.io,AU,SP,America/New_York,2024-10-01 0:00,Social,RETARGET1,macOS,1.2.0,unknown,Engineering,1,,,TRUE,2024-10-01 2:01,2024-10-09 2:01
U001991,Ravi,Clark,ravi.clarkcompany.com,NL,BER,Europe/London,2024-08-20 0:00,Content,WINTER25,Windows,2.0.1,1000+,Ops,0,,,Y,08/20/2024 09:59,
U000571,Ethan,Wilson,ethan.wilson@icloud.com,DE,,America/New_York,2024-04-05 0:00,Social,SPRING24,iOS,2.0.1,unknown,Marketing,0,50,,0,2024-04-05 4:40,2024-08-22 4:40
U000372,Yuki,Patel,yuki.patel@company.com,SE,,America/New_York,2023-02-20 0:00,Content,SUMMER24,Windows,1.2.1,11-50,Support,0,19,,0,2023-02-20 20:16,2023-06-13 20:16
U000344,Anya,Anderson,anya.anderson@company.com,DE,-,UTC,02/24/2024,referral,WINTER25,Windows,1.1.0,501-1000,HR,1,60,,,2024-02-24 9:33,2024-05-04 9:33
U000511,Zoe,Smith,zoe.smith@yahoo.com,IN,,Asia/Tokyo,2024-05-25 0:00,Organic Search,n/a,Unknown,1.0.9,51-200,Founder,0,59,,FALSE,2024-05-25 23:50,2024-11-18 23:50
U001165,Noah,Lewis,noah.lewis@yahoo.com,DE,WA,,2023-09-09 0:00,Partner,SPRING24,Android,2.0.1,unknown,Finance,0,29,,FALSE,2023-09-09 9:31,2024-01-05 9:31
U001567,Priya,Perez,priya.perez@nexloom.io,GB,TX,America/Los_Angeles,23-06-2024,Outbound,RETARGET1,macOS,1.2.0,1000+,Product,1,61,,FALSE,2024-06-23 7:19,2024-09-12 7:19
U002009,Elena,Perez,elena.perez@icloud.com,NL,,Europe/Berlin,05/24/2023,Social,AI-LAUNCH,Windows,1.1.0,1000+,Sales,0,21,,yes,2023-05-24 10:56,2023-08-18 10:56
U002319,Sophia,Harris, sophia.harris@proton.me ,US,WA,Asia/Kolkata,18-02-2024,Organic Search,BF2024,Windows,1.2.1,10-Jan,Finance,,31,,yes,2024-02-18 3:32,2024-05-31 3:32
U002437,Noah,Smith,noah.smith@yahoo.com,DE,NSW,Europe/Berlin,2024-01-30 0:00,Content,N/A,iOS,2.1.0,201-500,HR,1,30,,TRUE,2024-01-30 19:14,
U001176,Jin,Davis, jin.davis@nexloom.io ,U.K.,WA,UTC,2024-04-18 0:00,Webinar,BF2024,Unknown,2.1.0,10-Jan,Sales,0,19,,N,2024-04-18 19:51,09-30-2024 19:51
U000167,Sofia,Nguyen,sofia.nguyen@outlook.com,GB,ON,,26-12-2023,Organic Search,n/a,Android,1.1.2,501-1000,Product,0,44,,0,2023-12-26 0:45,2024-02-23 0:45
U000248,Ben,Wright,ben.wright@icloud.com,CA,NSW,,2025-05-22 0:00,Social,RETARGET1,macOS,2.1.0,10-Jan,Marketing,1,44,,0,2025-05-22 14:18,2025-10-03 14:18
U002380,Sara,Garcia,sara.garcia@outlook.com,FR,NSW,Asia/Tokyo,2024-09-12 0:00,Partner,GROWTHLAB,macOS,2.0.0,unknown,Engineering,1,41,,yes,2024-09-12 15:29,2024-12-10 15:29
U000931,Nora,King,nora.king@yahoo.com,GB,MH,,2023-08-21 0:00,Referral,AI-LAUNCH,Windows,2.0.1,10-Jan,Support,0,unknown,,FALSE,2023-08-21 22:49,12-24-2023 22:49
u002238,Jin,Patel,jin.patel@company.com,SG,NY,America/Los_Angeles,2023-09-29 0:00,Social,Q3_PROMO,Android,2.0.1,201-500,Finance,0,unknown,,TRUE,2023-09-29 14:19,2023-12-22 14:19
U001662,Amir,Johnson,amir.johnson@icloud.com,IN,LND,America/New_York,05-04-2024,Content,AI-LAUNCH,Android,1.1.2,unknown,Ops,1,49,,no,2024-04-05 10:32,06-12-2024 10:32
U001498,Anya,Davis,anya.davis@outlook.com,se,NY,Asia/Tokyo,2024-03-10 0:00,Referral,n/a,Unknown,2.1.0,10-Jan,Sales,0,26,U000258,Y,2024-03-10 19:18,2024-09-05 19:18
U002006,Mateo,Lopez,mateo.lopez@yahoo.com,IN,ON,Europe/London,2024-08-16,Referral,N/A,Android,1.2.1,501-1000,Engineering,1,31,U000456,yes,2024-08-16 6:09,2024-09-16 6:09
U001453,Omar,Perez,omar.perez@icloud.com,GB,RJ,,2024-11-14 0:00,Partner,BF2024,Windows,1.1.0,10-Jan,Ops,0,43,,no,2024-11-14 1:13,2024-11-18 1:13
U001010,Priya,Davis,priya.davis@yahoo.com,au,,UTC,2024-03-23 0:00,Partner,SUMMER24,Unknown,1.2.0,unknown,Ops,0,29,,FALSE,2024-03-23 2:43,2024-08-11 2:43
U000342,Kofi,Garcia,kofi.garcia@yahoo.com,FR,NSW,America/Los_Angeles,2024-03-15 0:00,Referral,n/a,Unknown,1.2.0,11-50,Founder,0,30,,,2024-03-15 4:38,2024-05-30
U002373,Priya,Brown,priya.brown@yahoo.com,CA,SP,America/Los_Angeles,2024-07-07 0:00,Social,SPRING24,Linux,2.0.0,51-200,Founder,0,,,Y,2024-07-07 2:26,2024-10-31 2:26
U001607,Priya,Nguyen,priya.nguyen@outlook.com,IN,,Europe/Berlin,2023-05-28 0:00,Social,RETARGET1,iOS,1.1.0,10-Jan,Support,,52,,no,2023-05-28 11:35,2023-06-07 11:35
U001320,Jin,White,jin.white@gmail.com,DE,,Asia/Kolkata,2023-05-16 0:00,Social,BF2024,Android,1.2.0,unknown,Founder,1,40,,no,2023-05-16 12:13,2023-11-01 12:13
U000337,Sophia,NGUYEN,sophia.nguyen@nexloom.io,br,MH,Europe/Berlin,2024-10-31,Content,SUMMER24,Windows,1.3.0,51-200,Engineering,0,59,,FALSE,2024-10-31 22:05,2025-01-21
U002060,Anya,Young,anya.younggmail.com,MX,MH,,2024-04-20 0:00,Partner,BF2024,Linux,1.1.0,51-200,Product,0,N/A,,,2024-04-20 11:19,2024-09-24 11:19
U002101,Noah,Lewis,noah.lewis@proton.me,JP,-,,2025-01-14,Outbound,SPRING24,Unknown,1.2.1,501-1000,Founder,0,45,,N,2025-01-14 18:25,2025-04-10 18:25
U000852,Priya,Thompson,priya.thompson@company.com,IN,ON,,2024-08-10 0:00,Partner,AI-LAUNCH,Linux,2.0.1,10-Jan,Marketing,0,19,,FALSE,2024-08-10 13:19,2025-01-25 13:19
U001820,Olivia,Walker,olivia.walker@icloud.com,NL,CA,UTC,2024-01-28 0:00,Content,SPRING24,Android,1.2.1,10-Jan,Sales,0,63,,,01/28/2024 04:53,2024-07-03 4:53
U000895,Ravi,Moore,ravi.moore@proton.me,MX,unknown,America/New_York,2024-06-23 0:00,Webinar,WINTER25,iOS,1.2.1,11-50,Support,0,51,,1,2024-06-23 21:02,2024-12-20 21:02
U001931,Ivy,Johnson,ivy.johnson@proton.me,CA,,Europe/Berlin,05/08/2024,Outbound,RETARGET1,macOS,1.0.9,51-200,Finance,1,49,,TRUE,2024-05-08 16:43,2024-08-13 16:43
U000007,Jin,Lee,jin.lee@outlook.com,CA,SP,Asia/Kolkata,2023-05-13 0:00,Partner,SUMMER24,Linux,1.2.0,10-Jan,Engineering,0,60,,FALSE,2023-05-13 15:36,
U000728,Emma,Scott,emma.scott@icloud.com,JP,TX,,2024-09-10 0:00,Referral,Q3_PROMO,Unknown,1.1.0,501-1000,Marketing,TRUE,61,U000073,0,2024-09-10 13:01,2024-10-17
U000040,Mateo,Jackson,mateo.jacksonyahoo.com,ZA,WA,,2024-02-28 0:00,Content,AI-LAUNCH,macOS,1.2.1,11-50,Finance,0,22,,Y,2024-02-28 0:03,2024-08-03 0:03
U000588,Lucas,Moore,lucas.moore@gmail.com,AU,LND,America/New_York,2023-08-10 0:00,Partner,SUMMER24,Unknown,1.2.1,10-Jan,Finance,0,26,,,2023-08-10 6:05,2023-12-06 6:05
U001837,Ivy,Perez,ivy.perez@icloud.com,FR,BER,America/New_York,2023-08-10 0:00,Outbound,WINTER25,iOS,1.2.1,10-Jan,Product,0,34,,N,2023-08-10 7:33,2023-09-18 7:33
U002139,Kofi,White,kofi.white@icloud.com,MX,,America/Los_Angeles,2023-09-30 0:00,Outbound,SUMMER24,Linux,1.3.0,201-500,Finance,0,43,,TRUE,2023-09-30 2:42,2023-11-29 2:42
U002286,Leo,Jackson,leo.jackson@yahoo.com,JP,NSW,Europe/London,11/30/2023,Partner,SUMMER24,Windows,1.1.0,unknown,Engineering,0,22,,FALSE,2023-11-30 2:22,2024-04-20 2:22
U001175,Hana,Smith,hana.smith@icloud.com,DE,BER,,2024-06-05,Referral,  BF2024  ,Linux,1.1.2,1000+,HR,TRUE,34,,N,2024-06-05 22:57,2024-10-21 22:57
U001528,Sara,Nguyen,sara.nguyen@nexloom.io,IN,-,,2023-12-18 0:00,Social,SPRING24,Unknown,2.0.1,51-200,Founder,0,30,,no,2023-12-18 21:17,2024-03-30 21:17
U001722,Kofi,Clark,kofi.clark@gmail.com,JP,BC,,2023-08-03 0:00,partner,AI-LAUNCH,Android,1.2.1,501-1000,Support,0,26,,FALSE,2023-08-03 10:06,2023-09-11 10:06
U002343,Amir,Young,amir.young@company.com,SE,,Europe/Berlin,2023-06-15 0:00,Outbound,AI-LAUNCH,Unknown,2.0.0,unknown,Engineering,0,41,,FALSE,2023-06-15 13:31,2023-08-01 13:31
 U001405 ,Yuki,Taylor,yuki.taylor@proton.me,se,BC,UTC,2024-06-21 0:00,Organic Search,AI-LAUNCH,Windows,1.2.0,501-1000,Support,1,30,,FALSE,2024-06-21 13:12,2024-11-12 13:12
U000870,Yuki,Taylor,yuki.taylor@company.com,AU,unknown,Europe/London,18-03-2025,Webinar,AI-LAUNCH,Unknown,1.3.0,unknown,Sales,0,N/A,,Y,2025-03-18 1:33,2025-05-09 1:33
U002469,Chen,Perez, chen.perez@icloud.com ,MX,NSW,Europe/London,2024-03-16 0:00,Organic Search,n/a,Windows,1.2.0,1000+,Engineering,0,56,,FALSE,2024-03-16 8:52,2024-07-08 8:52
U000093,Elena,White,elena.white@proton.me,SG,RJ,,2024-08-17 0:00,Content,SUMMER24,Windows,1.2.0,1000+,Sales,0,60,,1,2024-08-17 4:22,2024-10-22 4:22
U000624,Sofia,Garcia, sofia.garcia@proton.me ,IN,RJ,,2024-13-05,Webinar,GROWTHLAB,iOS,1.3.0,501-1000,Finance,0,38,,0,2024-03-21 13:11,2024-08-02 13:11
U001704,Diego,Lopez,diego.lopez@company.com,DE,BC,Europe/Berlin,2024-04-01,Social,WINTER25,Android,1.0.9,10-Jan,Support,0,29,,N,04/01/2024 17:47,2024-06-25 17:47
U002538,Ben,Anderson,ben.anderson@outlook.com,JP,unknown,America/Los_Angeles,2023-08-24 0:00,Outbound,null,Windows,2.1.0,501-1000,Ops,0,48,,Y,2023-08-24 6:32,2023-09-27 6:32
U000828,Sara,Lee,sara.lee@outlook.com,CA,ON,,2024-01-10 0:00,Referral,n/a,Android,1.2.1,unknown,Sales,0,N/A,U000164,N,2024-01-10 18:40,2024-02-15 18:40
U000081,Sara,Nguyen,sara.nguyen@yahoo.com,CA,CA,UTC,2024-11-08 0:00,Referral,AI-LAUNCH,iOS,1.1.0,501-1000,Finance,0,49,U000237,N,2024-11-08 5:04,2024-11-16 5:04
U000633,Ivy,King,ivy.king@yahoo.com,AU,SP,Asia/Tokyo,04/03/2024,Paid Search,WINTER25,Unknown,1.1.0,unknown,Sales,0,38,,N,2024-04-03 10:51,07-24-2024 10:51
U000838,Hana,Clark,HANA.CLARK@PROTON.ME,US,ON,America/New_York,2024-01-18 0:00,Content,Q3_PROMO,macOS,1.2.0,201-500,Ops,0,61,,N,2024-01-18 18:06,2024-03-17 18:06
U000768,Mateo,Wilson,mateo.wilson@company.com,AU,RJ,Europe/Berlin,2024-11-22 0:00,Content,RETARGET1,macOS,1.1.2,201-500,Support,0,58,,yes,2024-11-22 1:38,2024-12-24 1:38
U001279,Omar,Lewis,omar.lewis@nexloom.io,BR,WA,America/New_York,2023-08-23 0:00,Paid Search,BF2024,Windows,1.3.0,51-200,Engineering,0,45,,FALSE,2023-08-23 1:17,2024-01-23 1:17
U001267,Leo,Patel,leo.patel@gmail.com,SE,TX,Europe/Berlin,2024-02-03 0:00,Content,AI-LAUNCH,Android,1.1.2,201-500,Sales,0,48,,no,2024-02-03 2:34,2024-06-27 2:34
U001868,Sara,Anderson,sara.anderson@gmail.com,AU,NSW,Asia/Kolkata,09/12/2023,Organic Search,BF2024,Unknown,1.3.0,unknown,Finance,0,37,,TRUE,2023-09-12 19:25,2024-01-14 19:25
U000882,Fatima,Patel,fatima.patel@proton.me,BR,unknown,Asia/Tokyo,2024-06-25 0:00,Partner,GROWTHLAB,macOS,1.0.9,51-200,Support,1,38,,1,2024-06-25 11:44,2024-12-13 11:44
U000156,Omar,Jackson,omar.jackson@company.com,US,BC,Asia/Kolkata,2023-11-08 0:00,Partner,AI-LAUNCH,Windows,1.1.0,11-50,Finance,1,25,,1,2023-11-08 14:34,2024-05-03 14:34
U000008,Noah,WRIGHT,noah.wright@outlook.com,NL,ON,Asia/Kolkata,2024-11-11 0:00,Paid Search,GROWTHLAB,Unknown,1.1.0,11-50,Support,0,24,,1,2024-11-11 16:40,2025-01-14 16:40
U002400,Nora,Smith,nora.smith@company.com,JP,TX,Asia/Kolkata,2024-06-06 0:00,Webinar,SPRING24,Android,2.0.0,51-200,Founder,0,32,,0,2024-06-06 7:11,2024-09-07 7:11
U001429,Ravi,Wright,ravi.wright@nexloom.io,FR,WA,America/New_York,08-06-2024,Outbound,AI-LAUNCH,iOS,2.0.0,201-500,Engineering,0,47,,FALSE,2024-06-08 22:25,2024-06-12 22:25
U001142,Amir,Lopez,amir.lopez@outlook.com,CA,TX,America/Los_Angeles,2024-01-10 0:00,Organic Search,Q3_PROMO,Linux,1.3.0,201-500,Product,1,36,,0,2024-01-10 18:02,2024-03-16 18:02
U000270,Noah,Jackson,noah.jackson@outlook.com,IN,RJ,Asia/Tokyo,2023-12-10,Social,,iOS,2.0.0,51-200,Sales,0,31,,TRUE,2023-12-10 15:53,2024-05-03 15:53
U000046,Yuki,Perez,yuki.perez@gmail.com,GB,,America/Los_Angeles,2024-06-20 0:00,Social,SPRING24,Windows,1.1.0,1000+,Support,1,unknown,,yes,2024-06-20 23:22,2024-10-01 23:22
U001019,Priya,Harris,priya.harris@company.com,IN,,UTC,,Social,AI-LAUNCH,Windows,1.0.9,501-1000,Finance,0,20,,TRUE,2025-01-14 20:10,2025-01-18 20:10
U001709,Elena,Jackson,elena.jackson@outlook.com,JP,WA,Asia/Tokyo,2024-05-28 0:00,Paid Search,WINTER25,macOS,1.2.0,501-1000,Engineering,1,64,,0,2024-05-28 23:19,2024-10-26 23:19
U000753,Ethan,Wilson,ethan.wilson@outlook.com,NL,NY,Asia/Kolkata,2024-06-02 0:00,Webinar,RETARGET1,iOS,1.1.0,51-200,Founder,0,52,,yes,2024-06-02 0:40,2024-08-28 0:40
U000618,Ivy,WHITE,ivy.white@outlook.com,DE,TX,Asia/Tokyo,2023-11-30 0:00,Webinar,AI-LAUNCH,Linux,1.1.2,10-Jan,Ops,0,38,,1,2023-11-30 14:53,2024-04-23 14:53
U000391,Zoe,Jackson,zoe.jackson@outlook.com,BR,-,,2025-09-22 0:00,Content,NA,macOS,2.0.1,501-1000,HR,0,19,,Y,2025-09-22 23:51,2026-03-15 23:51
U000302,Ivy,Smith,ivy.smith@yahoo.com,IN,,Europe/Berlin,2024-04-13 0:00,Outbound,SPRING24,Unknown,1.2.0,unknown,Product,0,46,,Y,2024-04-13 20:50,2024-07-06 20:50
U001027,Yuki,Martin,yuki.martin@nexloom.io,NL,MH,Asia/Tokyo,2024-11-06 0:00,Webinar,WINTER25,Linux,1.0.9,201-500,Ops,0,56,,,2024-11-06 3:12,2024-11-14 3:12
U000829,Amir,JOHNSON,amir.johnson@icloud.com,IN,-,Asia/Tokyo,2024-08-02 0:00,Paid Search,RETARGET1,Unknown,1.1.0,10-Jan,HR,1,40,,Y,2024-08-02 8:37,2024-08-24 8:37
U001475,Kofi,Moore,kofi.moore@yahoo.com,ZA,ON,Asia/Tokyo,2023-12-30,Webinar,GROWTHLAB,Linux,2.1.0,11-50,Marketing,0,55,,TRUE,2023-12-30 20:15,2024-03-09 20:15
U001577,Mateo,Harris, mateo.harris@nexloom.io ,JP,ON,America/New_York,2023-03-05 0:00,Organic Search,GROWTHLAB,Windows,1.2.0,11-50,Support,0,44,,1,2023-03-05 8:26,2023-07-03 8:26
U001641,Leo,Thomas,leo.thomas@company.com,DE,NY,Europe/London,2024-04-18 0:00,Social,SPRING24,macOS,2.0.0,201-500,Founder,1,37,,FALSE,2024-04-18 21:23,09-26-2024 21:23
U001052,Omar,Nguyen,omar.nguyen@outlook.com,SG,MH,Asia/Kolkata,2024-04-12 0:00,Content,BF2024,Linux,2.0.0,201-500,HR,0,62,,FALSE,2024-04-12 11:29,2024-07-21 11:29
U002267,Ivy,King,ivy.king@yahoo.com,SG,,,2024-05-14 0:00,Partner,SUMMER24,iOS,1.2.0,201-500,HR,1,48,,no,2024-05-14 20:35,2024-07-21 20:35
U002387,Sara,Taylor,sara.taylor@icloud.com,SG,NY,Asia/Tokyo,2024-01-23,Social,N/A,Linux,1.3.0,1000+,Marketing,0,42,,Y,2024-01-23 15:16,2024-02-12 15:16
U002573,Olivia,Scott,olivia.scott@icloud.com,GB,,Asia/Tokyo,2023-12-26 0:00,Partner,GROWTHLAB,iOS,1.0.9,51-200,Engineering,1,22,,no,2023-12-26 4:26,2024-02-01 4:26
U002200,Sara,Wilson,sara.wilson@gmail.com,SG,LND,Europe/Berlin,28-01-2024,Paid Search,BF2024,Linux,1.3.0,11-50,Finance,0,unknown,,FALSE,2024-01-28 19:43,2024-06-20 19:43
U001494,Fatima,Clark,fatima.clark@outlook.com,ZA,BC,Europe/Berlin,2023-06-05 0:00,Content,SPRING24,iOS,2.0.1,10-Jan,Founder,1,27,,N,2023-06-05 22:47,2023-08-21 22:47
U001487,Mateo,Jackson, mateo.jackson@yahoo.com ,SE,LND,Europe/Berlin,2024-02-05 0:00,Paid Search,AI-LAUNCH,macOS,2.0.1,unknown,Finance,0,28,,0,2024-02-05 5:55,2024-05-21 5:55
U002287,Zoe,Young,zoe.young@outlook.com,United States,unknown,,2025-06-11,Content,WINTER25,Linux,2.0.0,201-500,Finance,0,64,,yes,2025-06-11 9:05,2025-09-04 9:05
U001979,Ivy,Scott,ivy.scott@yahoo.com,IN,,Asia/Tokyo,2024-11-18 0:00,Social,BF2024,Android,1.0.9,501-1000,Sales,0,32,,FALSE,2024-11-18 6:16,2025-04-12 6:16
U000750,Lucas,BROWN,lucas.brown@gmail.com,AU,NSW,,2024-05-31 0:00,Referral,N/A,Windows,1.1.2,unknown,Product,0,41,U000217,TRUE,2024-05-31 18:36,2024-07-29 18:36
U002505,ava,Brown,ava.brown@company.com,MX,,Asia/Tokyo,2023-10-10 0:00,Partner,SPRING24,Unknown,1.3.0,10-Jan,HR,0,28,,Y,2023-10-10 19:20,2024-01-07 19:20
U000795,sophia,Clark,sophia.clark@company.com,AU,,Europe/Berlin,2023-02-20 0:00,Partner,AI-LAUNCH,Linux,1.1.2,501-1000,Product,yes,44,,FALSE,2023-02-20 23:04,2023-05-09
U000947,Mateo,Smith,mateo.smith@gmail.com,ZA,unknown,America/Los_Angeles,08/18/2023,Social,GROWTHLAB,iOS,1.2.0,201-500,Founder,0,35,,1,2023-08-18 6:51,2023-11-25 6:51
U000573,Omar,Robinson,omar.robinson@gmail.com,AU,NY,Europe/London,2024-02-05 0:00,webinar,RETARGET1,iOS,2.1.0,1000+,Ops,1,42,,Y,2024-02-05 5:02,2024-05-30 5:02
U001415,Leo,Jackson,leo.jackson@company.com,GB,NY,Europe/London,2024-04-13 0:00,Paid Search,SUMMER24,Android,1.2.1,11-50,Engineering,TRUE,35,,1,2024-04-13 11:24,2024-04-16 11:24
U000070,Lucas,Wilson,lucas.wilson@yahoo.com,SE,WA,Europe/Berlin,2025-08-30,Organic Search,n/a,iOS,2.1.0,10-Jan,Ops,1,45,,1,2025-08-30 2:58,2025-12-20 2:58
U000314,Ivy,Thomas,ivy.thomas@icloud.com,NL,BC,,2025-05-07 0:00,Outbound,AI-LAUNCH,macOS,1.2.1,51-200,Product,0,51,,TRUE,2025-05-07 11:00,2025-11-02 11:00
U001698,Sophia,Perez,sophia.perez@proton.me,SE,MH,America/New_York,2023-08-17 0:00,Webinar,N/A,macOS,2.0.1,201-500,HR,,,,TRUE,2023-08-17 11:31,2024-01-19 11:31
U001737,Olivia,White,OLIVIA.WHITE@OUTLOOK.COM,br,BC,Asia/Tokyo,2024-03-03 0:00,Webinar,WINTER25,Android,1.2.1,1000+,HR,0,51,,N,2024-03-03 8:39,2024-04-13 8:39
U002075,Chen,Wright,chen.wright@outlook.com,JP,WA,UTC,2024-11-26 0:00,Webinar,SPRING24,macOS,1.3.0,501-1000,Founder,1,53,,TRUE,2024-11-26 3:54,11-26-2024 03:54
U000565,Mateo,Walker,mateo.walker@outlook.com,au,TX,,2024-01-12 0:00,Partner,RETARGET1,Unknown,1.2.1,unknown,Founder,1,64,,no,2024-01-12 0:37,2024-04-09 0:37
U001583,Yuki,Jackson,yuki.jackson@outlook.com,-,,America/New_York,2024-05-15 0:00,Outbound,WINTER25,iOS,2.0.1,unknown,Marketing,1,59,,,2024-05-15 1:23,2024-10-01 1:23
U002015,Fatima,Lopez,fatima.lopez@proton.me,NL,CA,,2024-04-14 0:00,Webinar,RETARGET1,Linux,2.0.0,51-200,Engineering,TRUE,18,,TRUE,2024-04-14 3:37,2024-04-14
U000978,Anya,Garcia,anya.garcia@gmail.com,NL,SP,,2023-05-01 0:00,Webinar,BF2024,Linux,2.0.1,201-500,Marketing,1,31,,N,2023-05-01 8:17,2023-09-25 8:17
U001989,Yuki,Wright,yuki.wright@yahoo.com,ZA,RJ,,2024-02-26 0:00,Organic Search,null,Android,1.2.1,10-Jan,HR,0,56,,0,2024-02-26 11:32,2024-04-23 11:32
U000490,Nora,White,nora.white@icloud.com,DE,SP,Europe/London,2024-12-09 0:00,Partner,N/A,Linux,1.1.2,51-200,HR,1,41,,TRUE,2024-12-09 19:42,2024-12-12 19:42
U001353,Yuki,Robinson,yuki.robinson@nexloom.io,FR,TX,Asia/Tokyo,2024-02-27 0:00,Referral,SPRING24,Unknown,2.1.0,1000+,Ops,0,22,U000104,N,2024-02-27 2:41,2024-05-28 2:41
U001157,Omar,Lopez,omar.lopez@yahoo.com,SG,ON,UTC,2023-09-07 0:00,Social,GROWTHLAB,macOS,1.3.0,501-1000,Product,0,18,,FALSE,2023-09-07 16:35,2024-03-03 16:35
U002300,Fatima,Patel,fatima.patelproton.me,CA,,Asia/Tokyo,2024-01-05 0:00,Social,RETARGET1,macOS,1.0.9,501-1000,Finance,0,,,0,2024-01-05 1:58,2024-05-08 1:58
U000201,Hana,Lopez,hana.lopez@company.com,GB,,UTC,2024-06-09 0:00,Partner,AI-LAUNCH,Linux,1.2.0,51-200,Ops,0,27,,FALSE,2024-06-09 23:06,2024-10-21 23:06
U001727,Omar,Clark,omar.clark@company.com,SG,RJ,,02-04-2024,Content,AI-LAUNCH,iOS,2.0.0,unknown,Ops,0,18,,,2024-04-02 6:55,2024-09-18 6:55
U000269,Ethan,Nguyen,ethan.nguyen@icloud.com,AU,LND,Asia/Kolkata,2024-01-16 0:00,Outbound,WINTER25,Android,2.0.0,201-500,Sales,0,29,,,2024-01-16 16:39,2024-05-05 16:39
U001368,Priya,Martin,priya.martin@nexloom.io,AU,RJ,,2025-01-04 0:00,Partner,GROWTHLAB,Unknown,1.2.0,unknown,Engineering,0,45,,TRUE,2025-01-04 13:03,2025-04-07 13:03
U001376,Diego,Harris,diego.harris@nexloom.io,NL,SP,Europe/London,2024-11-16,Webinar,,Unknown,2.0.1,201-500,Marketing,0,37,,yes,2024-11-16 7:29,2025-04-20 7:29
U000138,Ben,Brown,ben.brown@company.com,GB,LND,America/New_York,2024-07-13 0:00,Paid Search,N/A,Android,2.0.0,1000+,Support,1,unknown,,TRUE,2024-07-13 7:52,2024-12-12 7:52
U002439,Noah,Thompson,noah.thompson@proton.me,CA,,Asia/Kolkata,2024-04-18 0:00,Outbound,GROWTHLAB,Windows,1.3.0,501-1000,Founder,0,50,,N,2024-04-18 1:47,2024-06-26 1:47
U001713,Omar,Lee,omar.lee@gmail.com,ZA,unknown,Asia/Tokyo,2024-08-30 0:00,Referral,GROWTHLAB,Windows,v2.0.0,11-50,Founder,0,32,U000215,FALSE,2024-08-30 19:28,0000-00-00 00:00:00
U000954,Liam,Smith,liam.smith@proton.me,IN,WA,America/New_York,2025-01-13,Referral,n/a,Windows,2.1.0,11-50,Sales,0,23,U000291,no,2025-01-13 17:07,2025-05-29 17:07
U001491,Diego,Martin,diego.martin@icloud.com,FR,MH,Europe/Berlin,2023-11-05 0:00,Referral,BF2024,macOS,1.1.2,201-500,Engineering,0,42,U000092,FALSE,2023-11-05 2:53,2024-04-06 2:53
U001155,Ivy,Robinson,ivy.robinson@company.com,SG,NY,America/Los_Angeles,2024-05-28 0:00,Organic Search,BF2024,Android,2.1.0,10-Jan,Engineering,1,45,,Y,2024-05-28 17:50,2024-06-15 17:50
U000990,Leo,Garcia,leo.garcia@yahoo.com,JP,LND,Europe/Berlin,2024-09-28 0:00,Partner,GROWTHLAB,Windows,1.1.0,unknown,Finance,0,33,,TRUE,2024-09-28 14:19,2025-03-14 14:19
U000148,Mia,Lewis,mia.lewis@yahoo.com,BR,MH,,2024-03-30 0:00,Partner,GROWTHLAB,Android,1.1.2,unknown,Ops,0,47,,yes,2024-03-30 13:22,2024-05-15 13:22
U000992,Sophia,Wilson,sophia.wilson@nexloom.io,AU,CA,,2024-07-08 0:00,Organic Search,BF2024,Windows,1.2.1,501-1000,HR,0,,,TRUE,2024-07-08 13:09,2024-10-28 13:09
U000243,Nora,Clark,nora.clark@yahoo.com,SE,BER,,2025-01-13,Organic Search,N/A,Windows,2.0.0,11-50,HR,0,39,,FALSE,01/13/2025 13:26,2025-03-09 13:26
U001242,Ravi,Lopez,ravi.lopez@proton.me,SE,ON,Europe/London,2024-08-28 0:00,Organic Search,RETARGET1,Unknown,2.0.0,10-Jan,Founder,0,54,,yes,2024-08-28 4:26,2025-02-17 4:26
U000368,Hana,Lewis,hana.lewis@icloud.com,NL,BC,America/Los_Angeles,2024-12-29 0:00,Webinar,N/A,Android,1.3.0,1000+,Sales,1,55,,0,2024-12-29 13:45,2025-04-26 13:45
U000462,Jin,Clark,jin.clarkoutlook.com,ZA,TX,Europe/Berlin,2024-06-13 0:00,Organic Search,AI-LAUNCH,Unknown,1.0.9,1000+,Support,0,52,,0,2024-06-13 19:57,2024-10-05 19:57
U002172,liam,Perez,liam.perez@yahoo.com,CA,NSW,Europe/Berlin,31-05-2023,Webinar,BF2024,macOS,2.0.1,51-200,Founder,0,55,,TRUE,2023-05-31 20:16,2023-11-17 20:16
U000325,Elena,Brown,elena.brown@proton.me,FR,TX,UTC,2025-04-12 0:00,Partner,WINTER25,Windows,1.0.9,1000+,Finance,0,42,,1,2025-04-12 0:48,2025-08-02 0:48
U002492,Yuki,Lee,yuki.leeproton.me,ZA,RJ,America/Los_Angeles,2023-10-12 0:00,Paid Search,BF2024,Windows,1.3.0,1000+,HR,1,29,,no,2023-10-12 4:48,2024-01-30 4:48
U001067,Elena,Jackson,elena.jackson@icloud.com,,BER,Asia/Kolkata,2023-11-06 0:00,Organic Search,SUMMER24,Windows,1.3.0,1000+,Finance,0,23,,TRUE,2023-11-06 10:38,01-30-2024 10:38
U000773,Kofi,Taylor,kofi.taylor@yahoo.com,JP,NSW,America/Los_Angeles,2023-08-09 0:00,Organic Search,n/a,Linux,1.2.0,10-Jan,Support,0,48,,,2023-08-09 11:31,2023-12-12 11:31
U002047,Ivy,Nguyen,ivy.nguyen@icloud.com,ZA,,Asia/Tokyo,2023-05-28 0:00,Social,BF2024,macOS,1.3.0,10-Jan,Support,1,19,,Y,2023-05-28 0:07,2023-10-15 0:07
U002055,Mia,Garcia, mia.garcia@proton.me ,ZA,NY,,2024-10-25 0:00,Content,null,Unknown,2.0.0,1000+,Marketing,TRUE,47,,yes,2024-10-25 8:00,2024-12-27 8:00
U002586,Anya,Nguyen,anya.nguyen@icloud.com,MX,SP,Europe/Berlin,2024-05-31 0:00,Paid Search,SPRING24,Unknown,1.3.0,201-500,Sales,0,30,,TRUE,2024-05-31 11:36,2024-11-16 11:36
U000976,Jin,Martin, jin.martin@nexloom.io ,IN,NSW,America/Los_Angeles,2023-11-21 0:00,Webinar,SUMMER24,Linux,2.0.0,1000+,Engineering,1,N/A,,yes,2023-11-21 8:24,2024-04-07 8:24
U001988,Anya,Martinez,anya.martinez@yahoo.com,DE,NY,Asia/Kolkata,2024-03-27 0:00,Social,AI-LAUNCH,macOS,1.0.9,unknown,Engineering,0,35,,TRUE,2024-03-27 3:56,2024-04-24 3:56
U002401,Amir,White,amir.white@yahoo.com,US,NSW,UTC,2024-01-06 0:00,Organic Search,n/a,Windows,1.1.0,201-500,Marketing,1,34,,yes,2024-01-06 13:34,2024-05-25 13:34
U000938,Priya,Thomas,priya.thomas@icloud.com,JP,TX,UTC,2025-01-12 0:00,Outbound,SPRING24,iOS,1.2.1,51-200,Sales,0,20,,TRUE,2025-01-12 21:34,2025-03-17 21:34
U000789,Nora,Davis,nora.davis@company.com,ZA,ON,,2024-03-10 0:00,Partner,Q3_PROMO,Linux,1.1.0,1000+,Sales,1,39,,TRUE,2024-03-10 12:59,2024-08-11 12:59
U000066,Ivy,Clark,ivy.clark@proton.me,GB,RJ,,2024-04-19 0:00,Organic Search,WINTER25,Android,2.1.0,unknown,Finance,0,N/A,,Y,04/19/2024 22:05,2024-09-22
U000247,Lucas,Thomas, lucas.thomas@icloud.com ,us,MH,America/New_York,2024-02-21 0:00,Social,BF2024,iOS,1.1.0,51-200,Ops,0,39,,FALSE,2024-02-21 12:20,2024-07-20 12:20
U001064,Anya,Taylor,anya.taylor@company.com,AU,,,02/16/2024,Paid Search,WINTER25,Windows,1.3.0,11-50,Product,0,56,,TRUE,2024-02-16 3:38,2024-05-07 3:38
U000296,Yuki,Wilson,yuki.wilson@proton.me,GB,ON,,2024-04-09 0:00,content,Q3_PROMO,iOS,1.3.0,10-Jan,Finance,0,50,,N,2024-04-09 14:17,2024-06-15 14:17
U001483,Yuki,Taylor,yuki.taylor@company.com,JP,LND,America/New_York,2024-04-20 0:00,Content,N/A,Android,1.2.1,51-200,HR,,56,,no,2024-04-20 19:16,2024-06-21 19:16
U000855,Leo,Jackson,leo.jackson@gmail.com,AU,BC,Asia/Tokyo,2023-10-14,Outbound,N/A,Android,2.1.0,11-50,Founder,0,43,,TRUE,2023-10-14 22:00,2024-03-13 22:00
U002519,Leo,Scott,leo.scott@icloud.com,SG,BER,Asia/Tokyo,2024-07-04 0:00,Webinar,WINTER25,Linux,1.2.0,51-200,Sales,0,38,,Y,2024-07-04 18:32,2024-11-28
U000434,Noah,Taylor,noah.taylor@yahoo.com,SG,ON,America/Los_Angeles,11-07-2023,Social,SPRING24,macOS,2.1.0,501-1000,Ops,0,58,,0,2023-07-11 15:06,2023-12-11 15:06
U000638,Elena,Garcia,elena.garcia@proton.me,nl,,UTC,11/08/2023,Content,Q3_PROMO,macOS,2.0.0,201-500,Engineering,0,44,,FALSE,2023-11-08 13:27,2024-01-08 13:27
U000677,Mateo,Young,mateo.young@proton.me,CA,NY,America/Los_Angeles,2023-07-24 0:00,Outbound,Q3_PROMO,Unknown,2.0.1,201-500,Sales,0,unknown,,yes,2023-07-24 4:48,2023-09-11 4:48
U001146,Hana,Harris,hana.harris@company.com,SG,,America/New_York,2024-11-25 0:00,Partner,AI-LAUNCH,macOS,1.2.1,51-200,Finance,0,57,,yes,2024-11-25 1:28,2025-01-07 1:28
U000893,Nora,Lee,nora.lee@yahoo.com,US,NY,Europe/Berlin,2024-10-08 0:00,Partner,AI-LAUNCH,iOS,1.2.0,11-50,Finance,0,21,,N,2024-10-08 20:03,10-18-2024 20:03
U001529,Mateo,Harris,mateo.harris@proton.me,BR,RJ,UTC,2024-09-16 0:00,Webinar,SPRING24,Linux,1.3.0,501-1000,Founder,1,37,,1,2024-09-16 10:31,2024-10-07 10:31
U000278,Omar,Garcia,omar.garcia@company.com,IN,RJ,Asia/Tokyo,2024-06-13 0:00,Partner,SUMMER24,iOS,v2.1.0,201-500,Founder,1,34,,,2024-06-13 23:57,2024-09-08 23:57
U001531,Olivia,Thomas,olivia.thomas@nexloom.io,GB,CA,America/Los_Angeles,21-12-2023,Referral,SPRING24,Android,2.0.0,201-500,Engineering,0,54,U000133,TRUE,2023-12-21 5:43,2024-04-06 5:43
U000758,Mia,Smith,mia.smith@outlook.com,AU,-,,2024-04-14 0:00,Paid Search,AI-LAUNCH,Unknown,1.3.0,201-500,Sales,1,52,,yes,2024-04-14 8:35,2024-05-24 8:35
U000966,Lucas,Johnson,lucas.johnson@proton.me,SE,unknown,,2024-01-14 0:00,Webinar,GROWTHLAB,Unknown,1.2.1,201-500,Ops,0,21,,TRUE,2024-01-14 19:10,
U000965,Sara,Garcia,sara.garcia@outlook.com,DE,ON,America/New_York,2023-12-07 0:00,Partner,SPRING24,Android,1.0.9,11-50,Ops,1,29,,TRUE,2023-12-07 22:54,2024-01-24 22:54
U000478,Olivia,Patel,OLIVIA.PATEL@GMAIL.COM,us,,America/New_York,2024-04-25 0:00,Content,WINTER25,Windows,1.0.9,501-1000,Founder,0,63,,TRUE,2024-04-25 2:06,2024-06-24 2:06
U000127,Ethan,Taylor,ethan.taylor@nexloom.io,AU,-,Asia/Kolkata,2024-09-27,partner,WINTER25,iOS,v1.3.0,1000+,Product,0,34,,FALSE,2024-09-27 3:51,2024-11-26 3:51
U001263,Priya,Anderson,priya.anderson@gmail.com,FR,,Asia/Kolkata,2023-12-20,Paid Search,SUMMER24,Android,1.0.9,1000+,Support,0,56,,TRUE,2023-12-20 20:04,2024-01-28 20:04
U001505,Hana,Wright,hana.wright@outlook.com,MX,WA,Asia/Kolkata,2024-01-28,Referral,N/A,Unknown,1.2.0,10-Jan,Marketing,1,62,U00000X,Y,2024-01-28 2:53,2024-02-19 2:53
U002466,Jin,Martinez,jin.martinez@company.com,ZA,,Asia/Kolkata,2023-10-11 0:00,Outbound,N/A,Windows,1.2.1,501-1000,Support,0,60,,1,2023-10-11 11:14,2024-02-21 11:14
U000460,Elena,Patel,elena.patel@gmail.com,de,BER,America/New_York,2023-07-31,Outbound,BF2024,Linux,1.1.0,501-1000,Support,0,38,,0,2023-07-31 17:07,2023-08-09 17:07
U001461,Ben,Taylor,ben.taylor@company.com,US,ON,UTC,2024-02-04 0:00,Organic Search,RETARGET1,Unknown,1.1.0,1000+,Product,1,32,,0,2024-02-04 18:32,2024-02-22 18:32
U000839,Kofi,Lewis,kofi.lewis@yahoo.com,fr,NSW,Europe/Berlin,2024-05-08,Partner,SUMMER24,iOS,1.0.9,unknown,Founder,0,53,,yes,2024-05-08 5:53,2024-09-09 5:53
U000799,Chen,Young,chen.young@yahoo.com,BR,unknown,America/Los_Angeles,2024-07-09 0:00,Outbound,N/A,Unknown,1.1.0,201-500,Product,0,51,,FALSE,2024-07-09 6:52,0000-00-00 00:00:00
U001171,Zoe,Allen, zoe.allen@proton.me ,IN,-,Europe/London,2024-05-27,Referral,Q3_PROMO,Unknown,1.2.1,1000+,Finance,0,45,,TRUE,2024-05-27 18:58,09-28-2024 18:58
U000305,Leo,Wilson,leo.wilson@yahoo.com,FR,BER,America/New_York,2024-07-26 0:00,Outbound,N/A,Unknown,v1.1.0,11-50,Sales,0,55,,TRUE,2024-07-26 2:00,2024-11-29 2:00
U001841,Sofia,Smith,sofia.smith@gmail.com,MX,NSW,UTC,2024-01-23 0:00,Partner,BF2024,Android,1.1.2,11-50,Sales,1,42,,Y,2024-01-23 19:13,2024-02-28
u002475,Liam,Thompson,liam.thompson@yahoo.com,AU,TX,Asia/Tokyo,2024-04-14 0:00,Webinar,N/A,macOS,v2.1.0,201-500,Support,1,32,,N,2024-04-14 11:32,2024-04-16 11:32
U000225,Ben,Robinson,ben.robinson@yahoo.com,GB,LND,,2023-11-23 0:00,Paid Search,GROWTHLAB,Android,1.2.1,11-50,HR,0,33,,TRUE,2023-11-23 20:45,2024-02-28 20:45
U001792,Ben,Harris,ben.harris@yahoo.com,IN,NSW,,2024-08-02 0:00,Referral,SUMMER24,Unknown,1.0.9,unknown,Ops,0,44,U000489,TRUE,2024-08-02 15:26,2025-01-20 15:26
U001622,Anya,Smith,anya.smith@nexloom.io,sg,ON,Asia/Kolkata,2023-05-16 0:00,Webinar,null,Windows,1.2.0,501-1000,Support,0,30,,TRUE,2023-05-16 7:37,2023-09-03 7:37
U000583,Lucas,Anderson,lucas.anderson@nexloom.io,CA,BER,America/Los_Angeles,2024-03-25 0:00,Social,,iOS,1.2.0,11-50,Engineering,0,37,,no,2024-03-25 20:39,2024-04-26 20:39
U002293,Liam,White,liam.white@nexloom.io,SG,ON,America/Los_Angeles,2023-10-15 0:00,Referral,  BF2024  ,Windows,1.1.0,1000+,Product,0,59,U000475,,2023-10-15 1:04,2023-12-18 1:04
U001397,Amir,Nguyen,amir.nguyen@company.com,MX,WA,Asia/Kolkata,2024-02-23 0:00,Organic Search,n/a,Linux,1.1.0,201-500,Engineering,0,48,U00000X,0,2024-02-23 12:15,2024-05-16 12:15
U000442,Ben,Lee,ben.lee@proton.me,ZA,WA,Asia/Tokyo,2025-08-29 0:00,Partner,Q3_PROMO,Unknown,1.2.1,unknown,Sales,1,52,,,2025-08-29 11:31,2025-12-30 11:31
U002498,Chen,Scott,chen.scott@nexloom.io,AU,NY,,2024-11-10 0:00,Social,Q3_PROMO,Windows,2.0.1,unknown,Support,0,53,,FALSE,2024-11-10 11:24,03-08-2025 11:24
U000282,Nora,Robinson,nora.robinson@icloud.com,NL,WA,Europe/Berlin,2024-01-05,Referral,RETARGET1,Windows,2.0.1,10-Jan,Marketing,0,51,U000103,FALSE,2024-01-05 13:20,2024-01-19 13:20
U000266,Ben,Moore,ben.mooregmail.com,ZA,,Europe/London,2024-08-04 0:00,Social,N/A,Linux,2.0.0,201-500,Sales,0,21,,N,2024-08-04 7:53,2024-08-29 7:53
U001097,Chen,Harris,chen.harris@icloud.com,GB,unknown,America/New_York,2023-10-25 0:00,Webinar,WINTER25,Linux,1.1.2,501-1000,Ops,0,32,,0,2023-10-25 7:23,11-02-2023 07:23
U002188,Elena,Johnson,elena.johnson@nexloom.io,DE,,Asia/Kolkata,2024-08-20 0:00,Paid Search,SUMMER24,Android,1.2.1,501-1000,Sales,0,N/A,,yes,2024-08-20 12:03,2024-11-25 12:03
U002265,Yuki,Martinez,yuki.martinez@gmail.com,AU,unknown,Europe/Berlin,2024-05-22 0:00,Organic Search,Q3_PROMO,Linux,1.2.1,201-500,HR,0,23,,yes,2024-05-22 18:37,2024-10-25 18:37
U002017,Jin,Robinson,jin.robinson@proton.me,CA,ON,America/Los_Angeles,2024-01-10 0:00,Outbound,Q3_PROMO,Android,1.1.2,51-200,Founder,0,50,,TRUE,2024-01-10 10:51,2024-02-17 10:51
U000353,Hana,Clark,hana.clark@outlook.com,AU,BER,Asia/Tokyo,2024-06-18 0:00,Social,WINTER25,Linux,2.0.0,10-Jan,Founder,0,39,,TRUE,2024-06-18 16:23,2024-12-03 16:23
U000159,chen,Wilson,chen.wilson@proton.me,BR,unknown,,2023-11-05 0:00,Webinar,SPRING24,Windows,1.3.0,10-Jan,Finance,0,31,,TRUE,2023-11-05 0:39,2024-03-04 0:39
U001365,Nora,Moore,nora.moore@icloud.com,GB,TX,,2024-07-31 0:00,Organic Search,n/a,macOS,1.1.2,unknown,Finance,0,39,,yes,2024-07-31 9:53,2024-12-23 9:53
U000025,Sara,Lewis,sara.lewis@nexloom.io,US,TX,UTC,2024-03-07 0:00,Outbound,N/A,macOS,1.2.0,501-1000,Marketing,1,29,,Y,2024-03-07 15:41,2024-05-11 15:41
U002175,Omar,Allen,omar.allen@nexloom.io,US,NSW,Asia/Kolkata,2023-10-29 0:00,Paid Search,Q3_PROMO,Linux,2.0.1,11-50,Ops,1,64,,TRUE,2023-10-29 17:00,2023-11-18 17:00
U001697,Ivy,Taylor,ivy.taylor@nexloom.io,MX,SP,America/New_York,2023-03-10 0:00,Social,SPRING24,Android,1.2.1,11-50,Finance,0,29,,1,2023-03-10 17:56,2023-08-11 17:56
U001537,Sara,Moore,SARA.MOORE@NEXLOOM.IO,ZA,unknown,Asia/Tokyo,2023-09-25 0:00,Webinar,Q3_PROMO,iOS,2.1.0,unknown,Sales,0,23,,N,2023-09-25 23:48,2023-09-26 23:48
U002045,Ivy,Scott,ivy.scott@gmail.com,AU,MH,Asia/Tokyo,2024-11-05 0:00,Organic Search,N/A,iOS,1.2.1,201-500,Finance,1,25,,Y,2024-11-05 9:11,2025-03-07 9:11
U000861,mia,Anderson,mia.anderson@company.com,JP,,America/New_York,2024-08-27 0:00,Content,Q3_PROMO,iOS,1.3.0,501-1000,Founder,0,19,,Y,2024-08-27 5:34,2024-09-18 5:34
U000678,Emma,Walker,emma.walker@yahoo.com,CA,MH,America/Los_Angeles,2024-02-06 0:00,Webinar,AI-LAUNCH,Unknown,2.0.0,201-500,Finance,0,44,,Y,2024-02-06 9:04,2024-02-10
U000298,Kofi,Patel,kofi.patel@outlook.com,MX,NSW,Asia/Tokyo,2023-10-21 0:00,Content,RETARGET1,iOS,1.1.2,10-Jan,Sales,0,51,,FALSE,2023-10-21 5:46,2024-01-02 5:46
U001424,Nora,Nguyen,nora.nguyen@gmail.com,US,NSW,America/Los_Angeles,2023-08-29 0:00,Social,BF2024,Unknown,2.0.0,501-1000,Product,0,N/A,,no,2023-08-29 13:37,2024-01-02 13:37
U002335,Nora,Scott,nora.scottproton.me,GB,NSW,Asia/Tokyo,2023-07-26 0:00,Outbound,SUMMER24,iOS,1.1.0,unknown,Engineering,0,42,,Y,2023-07-26 19:55,2023-12-23 19:55
U002510,Fatima,Brown, fatima.brown@icloud.com ,SG,WA,Europe/London,2024-12-12,Content,BF2024,macOS,1.1.0,10-Jan,Finance,0,27,,1,2024-12-12 12:04,2025-05-16 12:04
U002116,Noah,Anderson,noah.andersoncompany.com,GB,NSW,Asia/Tokyo,2023-09-01 0:00,Partner,RETARGET1,macOS,2.0.1,1000+,Support,1,40,,Y,2023-09-01 11:27,2024-02-17
U001212,Anya,Allen,anya.allen@company.com,ZA,-,,2024-03-04 0:00,Social,BF2024,iOS,1.1.2,51-200,Ops,0,42,,FALSE,2024-03-04 7:39,2024-04-14 7:39
U000119,Noah,Taylor,noah.taylor@icloud.com,GB,LND,Europe/Berlin,2024-12-12 0:00,Outbound,Q3_PROMO,Unknown,1.2.0,11-50,Sales,1,34,,FALSE,2024-12-12 2:40,
U001901,Sara,Nguyen,sara.nguyen@company.com,FR,,,2024-04-25 0:00,Partner,AI-LAUNCH,macOS,1.1.2,1000+,Founder,0,62,,TRUE,2024-04-25 1:59,2024-08-27 1:59
U001794,Olivia,Scott,olivia.scott@gmail.com,MX,LND,America/New_York,2024-06-30 0:00,Social,N/A,Android,1.1.2,501-1000,Engineering,0,42,,Y,2024-06-30 13:01,2024-09-07 13:01
U000253,Ben,Wright,ben.wright@icloud.com,CA,NY,Europe/London,2024-10-27 0:00,Partner,AI-LAUNCH,iOS,1.3.0,51-200,Engineering,0,23,,TRUE,2024-10-27 23:27,2025-01-12 23:27
U000542,Kofi,Lee,kofi.lee@company.com,JP,WA,America/Los_Angeles,2024-05-21 0:00,Webinar,Q3_PROMO,iOS,2.0.1,1000+,HR,TRUE,51,,TRUE,2024-05-21 22:36,2024-10-29 22:36
U000798,Noah,Jackson,NOAH.JACKSON@COMPANY.COM,DE,BER,Asia/Tokyo,2024-04-30 0:00,Paid Search,WINTER25,Linux,2.0.0,unknown,Support,1,29,,0,2024-04-30 1:32,2024-07-22 1:32
U001801,Nora,Nguyen, nora.nguyen@yahoo.com ,DE,WA,Asia/Kolkata,2025-04-17 0:00,Social,GROWTHLAB,Windows,1.1.2,201-500,Marketing,0,46,,FALSE,2025-04-17 17:49,2025-08-23 17:49
U000260,Lucas,Thompson,lucas.thompson@company.com,BR,,UTC,2023-07-07 0:00,Outbound,WINTER25,macOS,1.1.0,201-500,Product,0,36,,Y,2023-07-07 12:45,2023-07-28 12:45
U001782,Mateo,Perez,mateo.perez@company.com,CA,unknown,America/Los_Angeles,2024-12-24 0:00,Content,N/A,macOS,2.0.0,201-500,Finance,no,40,,0,2024-12-24 22:15,2025-05-11 22:15
U000987,Elena,Garcia,elena.garcia@nexloom.io,FR,unknown,Asia/Tokyo,2024-07-04 0:00,Partner,N/A,macOS,1.3.0,51-200,Sales,0,unknown,,TRUE,2024-07-04 11:00,2024-10-29 11:00
USR-000952,Noah,Thomas,noah.thomas@nexloom.io,BR,unknown,UTC,2024-06-22 0:00,Paid Search,RETARGET1,Linux,1.2.0,10-Jan,Finance,0,41,,yes,2024-06-22 12:42,2024-10-21 12:42
U000925,Jin,Lee,jin.lee@nexloom.io,FR,-,Europe/Berlin,2024-02-20 0:00,Webinar,N/A,Windows,1.1.0,201-500,HR,0,33,,FALSE,02/20/2024 00:33,2024-07-05 0:33
U000955,Leo,Scott,leo.scott@company.com,FR,LND,,2024-02-17 0:00,Partner,GROWTHLAB,Windows,1.2.0,201-500,Finance,0,33,,Y,2024-02-17 22:18,2024-07-02 22:18
U000991,Mia,Clark,mia.clark@gmail.com,NL,RJ,Asia/Tokyo,2024-09-13 0:00,Webinar,WINTER25,Android,1.2.0,51-200,Ops,0,37,,1,2024-09-13 20:56,2024-12-06 20:56
U002363,Fatima,Martin,fatima.martin@company.com,FR,unknown,Europe/London,2023-12-11 0:00,Paid Search,Q3_PROMO,Windows,1.0.9,1000+,Engineering,0,56,,Y,2023-12-11 1:05,2024-02-23
U001710,Sophia,Taylor,sophia.taylor@company.com,US,MH,Europe/London,2024-06-13 0:00,Webinar,WINTER25,iOS,1.2.1,501-1000,Support,0,18,,FALSE,2024-06-13 23:45,2024-10-24 23:45
U002103,Nora,White,nora.white@nexloom.io,GB,BC,Europe/London,2023-09-06 0:00,Partner,SUMMER24,Windows,2.1.0,51-200,Finance,0,19,,Y,2023-09-06 6:32,2023-12-03 6:32
U001360,Anya,Lewis,anya.lewis@proton.me,BR,,America/New_York,2024-05-14 0:00,Content,WINTER25,Windows,2.0.1,1000+,HR,0,42,,N,2024-05-14 13:30,2024-09-23 13:30
U000229,Sara,Thompson,sara.thompson@nexloom.io,AU,MH,UTC,2024-12-11 0:00,Outbound,SPRING24,Android,1.0.9,unknown,Finance,0,59,,TRUE,2024-12-11 3:45,2025-04-05 3:45
U000381,Sofia,Young,sofia.young@yahoo.com,NL,MH,America/New_York,2023-07-30 0:00,Content,RETARGET1,Linux,1.1.0,11-50,Product,0,19,,FALSE,2023-07-30 14:24,10-29-2023 14:24
U000148,Mia,Lewis,mia.lewis@yahoo.com,BR,MH,,2024-03-30 0:00,Partner,GROWTHLAB,Android,1.1.2,unknown,Ops,0,47,,yes,2024-03-30 13:22,2024-05-15 13:22
U002108,Ivy,Allen,ivy.allen@yahoo.com,U.K.,BC,UTC,2024-12-31 0:00,Referral,WINTER25,Android,2.1.0,10-Jan,Ops,0,45,U000450,TRUE,2024-12-31 23:08,2025-03-19 23:08
U000094,sofia,Anderson,sofia.anderson@company.com,BR,LND,Asia/Tokyo,2024-04-28 0:00,Organic Search,WINTER25,Unknown,2.0.0,201-500,Product,1,26,,,2024-04-28 6:09,2024-05-18 6:09
U000702,Priya,King,priya.king@nexloom.io,US,LND,Europe/Berlin,2023-05-02 0:00,Outbound,SUMMER24,iOS,1.2.1,201-500,Marketing,0,45,,TRUE,2023-05-02 23:21,2023-07-17 23:21
U001741,Jin,Martinez,jin.martinez@proton.me,SE,unknown,Europe/Berlin,2024-10-05,Webinar,GROWTHLAB,iOS,1.2.0,501-1000,Finance,0,43,,,2024-10-05 3:17,2024-11-02 3:17
U000072,Leo,Martin,leo.martin@company.com,CA,SP,Asia/Kolkata,2023-10-09 0:00,social,AI-LAUNCH,Android,1.2.0,unknown,Sales,0,35,,0,2023-10-09 1:39,2023-10-20 1:39
U000608,Priya,Martinez,priya.martinez@gmail.com,NL,RJ,,2024-01-19 0:00,Paid Search,BF2024,Android,1.1.2,1000+,Product,1,50,,no,2024-01-19 15:10,2024-06-03 15:10
U001558,Zoe,Robinson,zoe.robinson@gmail.com,MX,LND,America/Los_Angeles,2024-02-13 0:00,Webinar,GROWTHLAB,macOS,1.1.2,201-500,HR,1,57,,FALSE,2024-02-13 12:54,2024-02-18 12:54
U002576,Nora,Taylor,nora.taylor@outlook.com,IN,BER,Asia/Tokyo,2024-06-08 0:00,Referral,n/a,Android,1.2.0,1000+,Support,0,N/A,U000404,,2024-06-08 4:30,2024-09-28 4:30
U000323,Jin,Patel,jin.patel@gmail.com,DE,WA,Asia/Tokyo,2024-06-19 0:00,Content,GROWTHLAB,macOS,2.0.0,51-200,HR,0,58,,no,2024-06-19 15:20,2024-07-29 15:20
U000896,Elena,Young,elena.young@yahoo.com,SE,ON,Europe/Berlin,2023-10-14 0:00,Content,SUMMER24,Linux,1.1.0,10-Jan,Founder,1,26,,N,2023-10-14 16:44,2023-11-18 16:44
U000901,Ben,Davis,ben.davis@nexloom.io,ZA,BC,Europe/Berlin,2023-10-16 0:00,Organic Search,Q3_PROMO,Windows,1.1.2,201-500,HR,0,20,,FALSE,2023-10-16 4:58,2023-12-19 4:58
U001518,Ethan,Nguyen,ethan.nguyen@nexloom.io,NL,unknown,,2024-12-19 0:00,Partner,GROWTHLAB,Android,2.0.1,unknown,Ops,1,47,,FALSE,2024-12-19 10:16,2025-03-29 10:16
U001075,Chen,Lopez,chen.lopez@company.com,IN,,UTC,2025-09-04 0:00,Webinar,Q3_PROMO,Unknown,2.0.0,51-200,Product,0,32,,yes,2025-09-04 7:02,2025-10-01 7:02
U002104,Ivy,Robinson,ivy.robinson@yahoo.com,GB,MH,UTC,2024-07-09 0:00,Outbound,SUMMER24,macOS,1.2.1,201-500,Support,0,40,,FALSE,2024-07-09 1:14,07-31-2024 01:14
U000982,Leo,Allen,leo.allen@yahoo.com,ca,NY,America/New_York,2024-08-24,Referral,RETARGET1,macOS,2.0.1,201-500,Marketing,0,31,U000349,1,2024-08-24 20:09,12-01-2024 20:09
U001730,Liam,Perez,liam.perez@nexloom.io,SG,NY,Europe/Berlin,2024-05-26 0:00,Content,Q3_PROMO,Linux,2.1.0,51-200,Finance,0,22,,TRUE,2024-05-26 7:16,2024-10-15 7:16
U001058,Sofia,Brown,sofia.brown@yahoo.com,GB,SP,America/Los_Angeles,08-02-2024,Webinar,BF2024,iOS,1.0.9,11-50,Engineering,0,18,,1,2024-02-08 21:53,2024-07-01 21:53
U002457,elena,Walker,elena.walker@yahoo.com,AU,LND,,2024-02-29 0:00,Outbound,RETARGET1,Linux,1.1.0,501-1000,HR,0,27,,N,2024-02-29 13:09,2024-03-06
U001563,Chen,Lewis,chen.lewis@nexloom.io,AU,ON,,2024-08-30 0:00,Organic Search,SPRING24,Linux,1.1.0,201-500,Marketing,1,27,,1,2024-08-30 10:32,2024-11-06 10:32
U000537,Amir,Martin,amir.martin@proton.me,FR,MH,Asia/Tokyo,2024-10-25 0:00,Social,Q3_PROMO,macOS,2.1.0,10-Jan,Ops,0,26,,0,2024-10-25 8:30,2025-02-02 8:30
U001303,Omar,Martinez,omar.martinez@outlook.com,IN,WA,,2023-05-02 0:00,Webinar,RETARGET1,iOS,1.1.2,10-Jan,Marketing,0,26,,FALSE,2023-05-02 7:56,2023-07-06 7:56
U002236,Hana,Davis,hana.davis@proton.me,BR,WA,Asia/Kolkata,2024-05-15 0:00,Content,GROWTHLAB,Android,2.0.0,1000+,Marketing,0,35,,TRUE,2024-05-15 14:47,2024-10-16
U001129,Ivy,Perez,IVY.PEREZ@NEXLOOM.IO,FR,BER,Europe/Berlin,24-01-2024,content,BF2024,Windows,2.1.0,501-1000,Ops,no,unknown,,N,2024-01-24 7:10,2024-03-25 7:10
U001306,Ivy,JACKSON,ivy.jackson@icloud.com,IN,TX,Europe/London,2024-11-16 0:00,Partner,BF2024,Windows,2.0.1,unknown,Sales,0,48,,yes,2024-11-16 8:10,2024-12-05 8:10
U002499,Ava,Thomas,ava.thomas@gmail.com,BR,TX,Asia/Kolkata,26-07-2025,Outbound,GROWTHLAB,Android,2.0.0,11-50,Finance,0,32,,TRUE,2025-07-26 16:06,2025-11-12 16:06
U000143,Amir,Anderson,amir.anderson@company.com,ZA,MH,UTC,2024-03-27 0:00,Referral,AI-LAUNCH,Linux,2.0.0,10-Jan,Engineering,0,48,U000357,Y,2024-03-27 20:58,2024-08-18 20:58
U002342,Mateo,Anderson,mateo.anderson@company.com,IN,TX,,2023-06-02 0:00,Social,N/A,Linux,1.1.0,unknown,Ops,0,40,,1,2023-06-02 17:56,2023-11-26
U000690,Mateo,Davis,mateo.davis@proton.me,AU,,,2023-09-30 0:00,Webinar,WINTER25,Android,1.0.9,501-1000,Support,no,28,,FALSE,2023-09-30 20:22,2024-03-24 20:22
U001039,Liam,Perez,liam.perez@nexloom.io,FR,BER,America/New_York,2023-05-24 0:00,Partner,N/A,Linux,2.0.0,501-1000,Product,1,24,,FALSE,2023-05-24 21:43,2023-06-12 21:43
U002460,Lucas,Patel,lucas.patel@gmail.com,GB,,,2024-02-08 0:00,Referral,Q3_PROMO,iOS,v1.2.1,11-50,Support,0,,U000269,TRUE,2024-02-08 22:04,2024-05-30 22:04
U000036,Liam,Johnson,liam.johnson@yahoo.com,DE,,America/Los_Angeles,09-05-2025,Referral,n/a,Android,1.2.1,501-1000,Finance,0,49,,0,2025-05-09 10:36,2025-07-28 10:36
U002535,Yuki,Clark,yuki.clark@nexloom.io,BR,-,Europe/Berlin,2024-08-02 0:00,Social,SPRING24,Windows,1.1.0,51-200,Product,0,58,,TRUE,2024-08-02 9:01,2024-09-25 9:01
U001680,Zoe,KING,zoe.king@proton.me,SG,BER,,2024-07-08,Content,BF2024,Android,1.0.9,10-Jan,Sales,0,43,,,2024-07-08 17:27,2024-11-01 17:27
U002339,Nora,Brown,nora.brown@icloud.com,mx,MH,UTC,2023-08-02 0:00,Partner,AI-LAUNCH,Unknown,2.0.1,201-500,Ops,0,47,,,2023-08-02 23:32,2023-11-07 23:32
U000673,Liam,Davis,liam.davis@yahoo.com,nl,LND,Asia/Tokyo,2023-06-15 0:00,Organic Search,n/a,Windows,1.3.0,501-1000,HR,0,61,,FALSE,2023-06-15 15:38,2023-09-04 15:38
U001768,Ava,Johnson,ava.johnson@proton.me,GB,NY,,2024-03-17 0:00,Paid Search,AI-LAUNCH,macOS,v1.1.0,unknown,Marketing,,29,,N,2024-03-17 16:48,2024-06-05 16:48
U002522,Mia,Moore,mia.moore@icloud.com,SG,-,,2023-08-16 0:00,Organic Search,Q3_PROMO,macOS,1.3.0,10-Jan,HR,0,,  U000120,N,2023-08-16 6:54,2023-09-20 6:54
U001952,Priya,Young, priya.young@company.com ,BR,NSW,,2023-10-25,Organic Search,n/a,iOS,2.0.1,unknown,Support,0,23,,TRUE,2023-10-25 20:58,2024-01-16 20:58
U002491,Noah,Lee,noah.lee@gmail.com,SE,unknown,Europe/London,2023-12-06 0:00,Webinar,AI-LAUNCH,Windows,1.3.0,10-Jan,Support,0,40,,FALSE,2023-12-06 8:52,2024-01-27 8:52
U001790,Ava,Garcia,ava.garcia@yahoo.com,GB,MH,Europe/London,2024-04-07 0:00,partner,N/A,macOS,1.2.0,unknown,Marketing,1,32,,TRUE,2024-04-07 4:49,2024-05-26 4:49
U000144,Mateo,Jackson, mateo.jackson@icloud.com ,US,,Asia/Kolkata,2023-07-02 0:00,Social,Q3_PROMO,Windows,1.2.1,10-Jan,Engineering,0,23,,TRUE,2023-07-02 13:15,2023-10-13 13:15
USR-000160,Ravi,Thompson,ravi.thompson@gmail.com,SE,LND,America/Los_Angeles,2024-07-28,Partner,SUMMER24,Unknown,2.0.0,1000+,Founder,1,38,,Y,07/28/2024 14:10,2024-09-09 14:10
U002435,Mateo,Walker,mateo.walker@company.com,SE,,America/New_York,02-05-2025,organic search,SPRING24,macOS,1.2.0,11-50,Sales,1,57,,Y,2025-05-02 20:55,2025-05-04 20:55
U001544,Diego,Garcia,diego.garcia@icloud.com,ZA,NY,Asia/Tokyo,2023-11-18 0:00,Referral,N/A,macOS,1.1.0,10-Jan,Sales,0,50,,,2023-11-18 4:41,2023-12-08 4:41
U000759,Ethan,Davis, ethan.davis@nexloom.io ,us,BC,America/Los_Angeles,2024-12-13 0:00,Paid Search,Q3_PROMO,iOS,1.3.0,11-50,Product,1,61,,FALSE,2024-12-13 9:24,2025-04-27 9:24
U000958,Ava,Wilson,ava.wilson@gmail.com,JP,NSW,Asia/Tokyo,2023-04-23 0:00,Organic Search,RETARGET1,iOS,2.1.0,unknown,HR,0,49,,TRUE,2023-04-23 17:35,2023-05-06 17:35
U001082,Mia,Young,mia.young@proton.me,IN,ON,Europe/Berlin,06/27/2023,Content,SUMMER24,macOS,1.2.0,10-Jan,Support,0,53,,FALSE,2023-06-27 23:35,2023-10-19 23:35
U000985,Hana,Thompson,hana.thompson@company.com,NL,BER,America/Los_Angeles,2024-07-28 0:00,Outbound,WINTER25,Unknown,2.0.1,11-50,Ops,1,55,,0,2024-07-28 7:07,11-04-2024 07:07
U002506,Ravi,THOMPSON,ravi.thompson@gmail.com,US,-,Europe/London,2023-07-21,Outbound,GROWTHLAB,macOS,1.1.2,1000+,Support,1,unknown,,yes,2023-07-21 4:02,2023-10-05
U001714,Diego,Nguyen,diego.nguyen@outlook.com,U.K.,RJ,America/Los_Angeles,2025-02-30,Outbound,SPRING24,Android,1.2.1,11-50,Sales,0,38,,yes,2024-03-08 22:27,2024-04-09 22:27
U000050,Fatima,Moore,fatima.moore@outlook.com,JP,BC,,2023-09-28 0:00,Paid Search,Q3_PROMO,Linux,1.3.0,201-500,Founder,0,38,,no,2023-09-28 23:39,2023-12-04 23:39
U000814,Anya,Davis,anya.davis@proton.me,ZA,unknown,UTC,2025-01-23 0:00,Partner,BF2024,Linux,1.2.0,unknown,Finance,0,,,no,2025-01-23 10:55,2025-04-20 10:55
U001885,Sophia,Nguyen,sophia.nguyen@gmail.com,AU,unknown,Europe/London,2023-09-08 0:00,Organic Search,RETARGET1,Android,1.3.0,unknown,Founder,FALSE,29,,TRUE,2023-09-08 5:16,2023-09-08 5:16
U001135,Ravi,Patel,ravi.patel@proton.me,se,,Asia/Kolkata,2024-07-02 0:00,Webinar,SUMMER24,Windows,2.1.0,10-Jan,Ops,0,63,,TRUE,2024-07-02 3:59,2024-12-02 3:59
U001676,Kofi,Lewis,kofi.lewis@gmail.com,JP,CA,Asia/Kolkata,2023-12-17 0:00,Referral,N/A,Unknown,2.1.0,11-50,Ops,0,58,U000135,0,2023-12-17 20:44,2024-05-09 20:44
U002420,Olivia,Robinson,olivia.robinson@nexloom.io,IN,LND,America/New_York,2024-02-01 0:00,Referral,SPRING24,Windows,2.0.1,501-1000,Engineering,0,,U000433,FALSE,2024-02-01 0:29,
U000878,Fatima,Moore,fatima.moore@yahoo.com,MX,LND,UTC,2024-06-18 0:00,Social,WINTER25,iOS,2.1.0,201-500,Support,1,62,,1,2024-06-18 16:49,2024-12-03 16:49
 U002165 ,Emma,Martin,emma.martin@gmail.com,DE,BC,UTC,14-03-2024,Paid Search,N/A,Android,1.1.2,201-500,Product,0,44,,FALSE,2024-03-14 11:06,2024-08-06 11:06
U001760,Hana,Harris,hana.harris@gmail.com,ZA,unknown,Asia/Tokyo,2024-04-22 0:00,Outbound,AI-LAUNCH,macOS,1.3.0,10-Jan,Engineering,1,50,,TRUE,2024-04-22 20:06,08-24-2024 20:06
U000586,noah,King,noah.king@outlook.com,DE,,UTC,2023-11-07 0:00,Paid Search,SPRING24,Unknown,2.0.0,unknown,Ops,0,26,,TRUE,2023-11-07 12:19,2024-02-25 12:19
U002230,Sofia,Lewis,sofia.lewis@proton.me,SE,LND,Asia/Kolkata,2023-12-14 0:00,Webinar,RETARGET1,Android,2.1.0,10-Jan,Finance,,26,,,2023-12-14 6:33,2023-12-23 6:33
U001515,Sophia,Smith,sophia.smith@nexloom.io,US,CA,Asia/Kolkata,2023-10-07 0:00,Partner,AI-LAUNCH,macOS,2.0.1,10-Jan,Marketing,0,N/A,,no,2023-10-07 21:02,2024-02-22 21:02
U001481,Ivy,Wilson,ivy.wilson@yahoo.com,GB,TX,,2024-09-27 0:00,Social,AI-LAUNCH,Linux,2.1.0,501-1000,Ops,0,38,,Y,2024-09-27 1:23,2025-03-10 1:23
U001893,Fatima,Perez,fatima.perez@yahoo.com,SE,WA,Europe/Berlin,2024-09-13 0:00,Organic Search,n/a,macOS,2.0.1,1000+,Product,0,33,,1,2024-09-13 11:13,2025-03-05 11:13
U000615,Mateo,Young,mateo.young@gmail.com,JP,,Asia/Kolkata,2024-11-19 0:00,Outbound,RETARGET1,macOS,1.3.0,501-1000,Support,0,63,,0,2024-11-19 19:55,2024-12-02 19:55
U000224,Elena,Scott,elena.scott@nexloom.io,FR,unknown,UTC,2024-01-21 0:00,Referral,n/a,Unknown,1.3.0,10-Jan,HR,0,56,,no,2024-01-21 21:02,2024-02-21 21:02
U000477,Emma,Martinez,emma.martinez@nexloom.io,US,BER,Europe/Berlin,2023-06-06 0:00,Content,RETARGET1,macOS,1.2.0,1000+,Sales,0,28,,Y,2023-06-06 1:01,2023-09-14 1:01
U000375,Hana,Lee,hana.lee@nexloom.io,SG,MH,,2023-06-02 0:00,Social,GROWTHLAB,macOS,1.2.1,51-200,Support,0,25,,TRUE,2023-06-02 3:50,2023-06-12 3:50
U001932,Priya,Nguyen,priya.nguyen@outlook.com,US,-,,2024-04-28 0:00,Content,RETARGET1,iOS,1.2.0,51-200,Product,0,33,,1,2024-04-28 15:46,2024-05-24 15:46
U000930,Omar,Thompson,omar.thompson@company.com,FR,NSW,Europe/London,2023-11-18 0:00,Paid Search,Q3_PROMO,Unknown,2.0.1,10-Jan,HR,1,47,,TRUE,2023-11-18 7:28,2024-05-08 7:28
U001769,Ivy,Anderson,ivy.anderson@nexloom.io,JP,BER,Asia/Tokyo,2024-01-25 0:00,Partner,AI-LAUNCH,Windows,1.1.0,unknown,Ops,1,23,U00000X,yes,2024-01-25 14:30,2024-02-22 14:30
U001886,Priya,Jackson,priya.jackson@gmail.com,NL,TX,America/Los_Angeles,2024-03-09 0:00,Webinar,SPRING24,Windows,1.1.0,501-1000,Finance,0,20,,no,2024-03-09 4:42,07-01-2024 04:42
U001963,Nora,Wright,nora.wright@yahoo.com,JP,MH,Europe/London,2024-10-16,Webinar,WINTER25,Unknown,1.1.0,11-50,HR,0,49,,TRUE,2024-10-16 16:00,12-09-2024 16:00
U001836,Hana,Thompson,hana.thompson@outlook.com,UK,MH,Asia/Tokyo,2024-06-17 0:00,outbound,AI-LAUNCH,iOS,2.1.0,501-1000,Ops,1,26,,FALSE,2024-06-17 14:48,2024-10-06 14:48
U002214,Mia,Clark,mia.clark@yahoo.com,FR,TX,America/Los_Angeles,05/08/2025,Referral,Q3_PROMO,Unknown,2.1.0,51-200,Ops,0,25,U000448,no,2025-05-08 9:33,2025-09-02 9:33
U002430,Sophia,Anderson,sophia.anderson@company.com,ZA,LND,,2024-12-06 0:00,Organic Search,n/a,macOS,2.0.0,51-200,Product,0,53,,N,2024-12-06 13:35,2025-04-23 13:35
U002318,Anya,Nguyen,anya.nguyen@gmail.com,JP,MH,,2024-02-04 0:00,Organic Search,BF2024,Windows,1.1.0,1000+,Founder,1,54,,0,2024-02-04 0:16,04-15-2024 00:16
U002112,Ava,Garcia,ava.garcia@company.com,SE,LND,Asia/Tokyo,2023-10-11 0:00,Social,Q3_PROMO,Android,2.1.0,1000+,Product,0,43,,yes,2023-10-11 1:28,2024-01-07 1:28
U002166,Zoe,Anderson,zoe.anderson@company.com,JP,RJ,Europe/London,2025-07-17 0:00,Partner,SPRING24,Windows,1.0.9,201-500,Finance,0,64,,TRUE,2025-07-17 10:14,2025-11-18 10:14
U000028,Yuki,Wright,yuki.wright@yahoo.com,SG,ON,UTC,2024-04-05 0:00,Outbound,SUMMER24,Windows,1.0.9,201-500,Engineering,0,33,,yes,2024-04-05 5:16,2024-07-20 5:16
U001526,Liam,Jackson,liam.jackson@outlook.com,NL,RJ,UTC,11/18/2023,Paid Search,BF2024,iOS,1.3.0,10-Jan,Marketing,no,57,,0,2023-11-18 17:50,2024-01-28 17:50
U001093,Amir,Garcia,amir.garcia@company.com,JP,-,,2024-05-22 0:00,Social,BF2024,Unknown,1.0.9,501-1000,HR,0,62,,Y,2024-05-22 16:40,2024-07-14 16:40
U000234,Hana,Young,hana.young@icloud.com,JP,NY,Asia/Tokyo,2024-03-25 0:00,Webinar,N/A,iOS,1.2.0,201-500,Marketing,0,27,,1,2024-03-25 21:32,2024-05-19 21:32
U002248,Ben,Taylor,ben.taylor@icloud.com,GB,WA,Europe/London,2024-10-09 0:00,Partner,WINTER25,Unknown,1.2.0,10-Jan,Finance,0,48,,N,2024-10-09 7:39,2024-11-29 7:39
U002064,Hana,Johnson,hana.johnson@nexloom.io,GB,MH,Asia/Tokyo,2024-03-08 0:00,Organic Search,RETARGET1,macOS,1.3.0,10-Jan,HR,0,38,,N,2024-03-08 8:48,2024-04-06 8:48
U001543,Ava,Nguyen,ava.nguyen@proton.me,USA,TX,America/New_York,2024-05-01,Referral,SUMMER24,iOS,2.0.0,10-Jan,Finance,0,41,U000448,,2024-05-01 11:23,2024-06-08 11:23
U000775,Fatima,Anderson,fatima.anderson@gmail.com,US,MH,UTC,2024-09-11,Paid Search,GROWTHLAB,Linux,2.0.1,201-500,Sales,0,26,,FALSE,2024-09-11 9:37,2024-11-13 9:37
U001185,Noah,King,noah.king@outlook.com,BR,unknown,,2023-07-13 0:00,Referral,SPRING24,Android,1.1.2,51-200,Finance,1,31,U000229,N,2023-07-13 4:26,2023-11-05 4:26
U000465,Fatima,Robinson,fatima.robinson@proton.me,SE,BER,Asia/Kolkata,2025-05-05 0:00,Content,Q3_PROMO,Windows,2.0.0,51-200,Finance,0,52,,Y,05/05/2025 05:13,2025-09-25 5:13
U002398,Anya,Taylor,anya.taylor@yahoo.com,SG,,Asia/Tokyo,2023-03-09 0:00,Social,GROWTHLAB,iOS,v1.2.0,501-1000,Marketing,0,46,,TRUE,2023-03-09 7:15,03-24-2023 07:15
U000080,Priya,Thomas,priya.thomas@nexloom.io,CA,NY,Asia/Kolkata,2023-07-28 0:00,Outbound,SPRING24,iOS,1.1.2,11-50,HR,0,50,,1,2023-07-28 18:46,2023-09-29 18:46
U002424,Nora,Scott,nora.scott@proton.me,SE,BER,America/New_York,2024-03-08 0:00,Paid Search,Q3_PROMO,macOS,1.2.1,51-200,Marketing,1,36,,,2024-03-08 17:40,2024-05-23 17:40
U001112,Mia,Lee,mia.lee@yahoo.com,AU,LND,America/New_York,2023-10-27,Social,SPRING24,Windows,1.1.2,201-500,Marketing,0,47,,,2023-10-27 12:01,2023-12-16 12:01
U001449,Olivia,Taylor,olivia.taylor@company.com,MX,SP,America/Los_Angeles,2025-03-14 0:00,Paid Search,WINTER25,Android,1.2.1,201-500,Product,0,59,,N,2025-03-14 22:35,2025-05-14 22:35
U001981,Ivy,Perez, ivy.perezgmail.com ,JP,-,Asia/Kolkata,2023-09-29 0:00,Social,BF2024,Unknown,2.0.1,51-200,HR,0,26,,TRUE,2023-09-29 18:37,2024-03-23 18:37
U001803,Noah,Young,noah.young@nexloom.io,US,LND,,2024-01-13 0:00,Social,RETARGET1,Unknown,1.1.2,51-200,HR,0,26,,yes,2024-01-13 19:31,2024-02-02 19:31
U000607,Priya,Thompson,priya.thompson@company.com,de,NSW,Asia/Kolkata,2023-10-15 0:00,Social,NA,Linux,1.1.0,unknown,Engineering,0,46,,Y,2023-10-15 22:04,02-17-2024 22:04
U001937,Diego,Nguyen,diego.nguyen@yahoo.com,AU,unknown,,2023-11-26 0:00,Content,WINTER25,Unknown,2.0.1,51-200,Support,0,32,,yes,2023-11-26 3:45,2023-12-16 3:45
U000724,Fatima,Brown,fatima.brown@company.com,US,,UTC,2024-08-04 0:00,Outbound,,Unknown,1.2.0,201-500,Sales,0,23,,1,2024-08-04 6:56,
U002331,Hana,Walker,hana.walker@yahoo.com,BR,MH,Asia/Kolkata,2023-11-18 0:00,Webinar,N/A,Android,1.2.1,unknown,Ops,0,53,,FALSE,2023-11-18 0:44,2024-03-28 0:44
U000101,Ravi,Smith,ravi.smith@nexloom.io,JP,WA,America/Los_Angeles,2023-03-23 0:00,Social,WINTER25,Unknown,v1.2.0,unknown,Support,0,62,,TRUE,2023-03-23 6:41,2023-05-10 6:41
U002211,Ivy,Lopez,ivy.lopez@proton.me,IN,BER,,2024-08-13,Paid Search,GROWTHLAB,iOS,1.2.1,201-500,Support,0,55,,1,2024-08-13 16:10,2024-11-30 16:10
U001717,Chen,Jackson,chen.jackson@yahoo.com,au,MH,America/New_York,2023-05-12 0:00,Organic Search,n/a,macOS,1.1.0,1000+,Ops,0,23,,TRUE,2023-05-12 4:40,2023-05-19 4:40
U002225,Lucas,Martinez,lucas.martinez@outlook.com,JP,BC,Asia/Tokyo,2023-02-05 0:00,content,GROWTHLAB,macOS,1.2.1,201-500,Marketing,0,45,,Y,2023-02-05 4:28,2023-02-20 4:28
U000130,Lucas,Harris,lucas.harris@nexloom.io,SE,TX,UTC,2024-03-27,Paid Search,WINTER25,macOS,1.3.0,unknown,Support,1,49,,no,2024-03-27 12:06,2024-04-20 12:06
U000493,Elena,Perez,elena.perez@proton.me,GB,ON,,2023-12-01 0:00,Content,RETARGET1,Windows,v1.2.0,11-50,Finance,1,18,,0,2023-12-01 23:43,2024-05-01 23:43
U000745,Sofia,Clark,sofia.clark@gmail.com,AU,,Europe/Berlin,2023-11-02 0:00,Content,N/A,macOS,2.0.0,501-1000,Marketing,0,29,,yes,2023-11-02 17:17,2024-03-14 17:17
U000637,Sara,Martin,sara.martin@company.com,USA,-,UTC,2024-04-14 0:00,Referral,n/a,Android,2.1.0,10-Jan,Sales,0,35,U000428,TRUE,2024-04-14 9:49,2024-04-20 9:49
U000786,Yuki,Davis,yuki.davis@company.com,ZA,ON,,2025-01-03 0:00,Webinar,SPRING24,iOS,v1.3.0,10-Jan,Sales,1,34,,FALSE,2025-01-03 12:21,2025-03-26 12:21
U001262,Anya,Anderson,anya.anderson@proton.me,ZA,-,Asia/Kolkata,2024-09-12 0:00,Partner,SUMMER24,macOS,1.2.0,10-Jan,Support,1,34,,FALSE,2024-09-12 21:01,2024-12-01 21:01
U000461,Sophia,Jackson,sophia.jackson@yahoo.com,JP,NSW,Europe/Berlin,2023-07-30 0:00,Content,SUMMER24,macOS,1.2.0,10-Jan,Ops,0,54,,FALSE,2023-07-30 17:35,2024-01-17 17:35
U001614,Nora,Lewis,nora.lewis@nexloom.io,SE,ON,America/Los_Angeles,2023-12-28 0:00,Webinar,BF2024,Android,2.1.0,11-50,Finance,0,,,TRUE,2023-12-28 12:38,2024-04-14 12:38
U000543,Nora,Lopez,nora.lopez@company.com,SE,,,2023-10-30 0:00,Referral,GROWTHLAB,Windows,1.1.0,11-50,Founder,0,,U000112,FALSE,2023-10-30 2:43,
U000813,Liam,Garcia,liam.garcia@company.com,SE,SP,Europe/Berlin,2023-08-06 0:00,Referral,n/a,macOS,2.0.1,201-500,Support,0,61,U000320,Y,2023-08-06 5:42,2023-11-02 5:42
U000507,Mateo,Young,mateo.young@gmail.com,AU,BC,America/New_York,2025-01-07 0:00,Webinar,AI-LAUNCH,Windows,1.3.0,unknown,Founder,1,53,,yes,2025-01-07 8:48,2025-04-20 8:48
U000899,Noah,Harris,noah.harris@company.com,NL,LND,Europe/Berlin,2023-02-06 0:00,Webinar,SUMMER24,macOS,1.1.2,1000+,Product,0,26,,no,2023-02-06 2:38,2023-06-11
U000333,Leo,Scott,leo.scott@company.com,FR,CA,Europe/London,2023-02-10 0:00,Referral,Q3_PROMO,Linux,1.1.0,unknown,Support,yes,62,U000168,FALSE,2023-02-10 15:13,2023-04-05 15:13
U000284,Leo,Wright,LEO.WRIGHT@ICLOUD.COM,MX,ON,Asia/Kolkata,2023-07-03 0:00,Social,GROWTHLAB,Windows,1.1.2,51-200,HR,0,63,,N,2023-07-03 16:06,2023-12-05 16:06
U001197,Elena,Wilson,elena.wilson@nexloom.io,CA,BC,,2025-06-20 0:00,Content,Q3_PROMO,Linux,v1.0.9,1000+,Marketing,1,34,,TRUE,2025-06-20 13:09,2025-09-10
U002079,Ethan,Smith,ethan.smith@icloud.com,SG,ON,America/Los_Angeles,2025-08-19 0:00,Partner,RETARGET1,iOS,1.1.2,51-200,HR,1,35,,0,2025-08-19 0:25,2026-01-31 0:25
U001669,Ivy,Anderson,ivy.anderson@gmail.com,ZA,BC,America/New_York,2023-07-28 0:00,Outbound,SUMMER24,macOS,2.0.0,201-500,Sales,0,18,,0,2023-07-28 12:22,2023-10-19 12:22
U000187,Sophia,Martinez,sophia.martinez@icloud.com,JP,BER,Europe/Berlin,2024-09-27 0:00,Social,Q3_PROMO,Windows,1.0.9,201-500,Ops,0,25,,FALSE,2024-09-27 14:43,2024-11-18 14:43
U000454,Emma,Taylor, emma.taylor@proton.me ,JP,LND,UTC,2024-12-31 0:00,Social,GROWTHLAB,macOS,1.2.0,1000+,Sales,0,36,,,2024-12-31 10:17,2025-05-13 10:17
U001222,Anya,Wilson,anya.wilson@outlook.com,BR,CA,Asia/Tokyo,2023-08-31,Partner,RETARGET1,macOS,2.1.0,10-Jan,Finance,0,60,,0,2023-08-31 20:02,2023-12-13 20:02
U001898,Priya,Lopez,priya.lopez@proton.me,NL,MH,America/New_York,2023-10-01 0:00,Partner,Q3_PROMO,Unknown,2.1.0,51-200,Founder,0,53,,yes,2023-10-01 4:41,2024-02-06
U000499,Yuki,Walker,yuki.walker@outlook.com,DE,ON,Asia/Kolkata,2025-06-24 0:00,Webinar,BF2024,macOS,2.0.0,unknown,Engineering,0,36,,FALSE,2025-06-24 18:56,2025-12-19 18:56
U002158,Noah,Smith,noah.smith@proton.me,SE,MH,Europe/London,2024-01-10 0:00,Referral,BF2024,Android,1.3.0,11-50,Founder,1,42,U000136,1,2024-01-10 17:18,2024-06-15 17:18
U001182,Emma,Harris,emma.harris@gmail.com,GB,-,,2024-01-07 0:00,Content,GROWTHLAB,macOS,1.2.0,201-500,Marketing,1,58,,FALSE,2024-01-07 23:29,05-14-2024 23:29
U001245,Ben,King,ben.king@outlook.com,BR,WA,America/New_York,2024-08-17 0:00,Organic Search,n/a,iOS,2.1.0,51-200,Finance,0,26,,no,2024-08-17 2:22,2024-08-30 2:22
U002495,Ethan,Nguyen,ethan.nguyen@company.com,SG,CA,UTC,2024-04-03 0:00,Paid Search,RETARGET1,Windows,2.1.0,501-1000,Support,0,61,  U000120,0,04/03/2024 23:35,2024-08-04 23:35
U002102,Diego,Garcia,DIEGO.GARCIA@OUTLOOK.COM,SG,SP,UTC,2024-04-14 0:00,Paid Search,WINTER25,macOS,1.2.1,10-Jan,Support,0,22,,no,2024-04-14 16:31,2024-10-04 16:31
U001828,Ben,Perez,ben.perez@company.com,NL,RJ,UTC,2025-05-29 0:00,Webinar,N/A,macOS,2.0.0,unknown,Ops,0,21,,TRUE,2025-05-29 4:59,2025-11-04 4:59
U000064,Priya,Lee,priya.lee@proton.me,JP,,Europe/London,2024-01-15 0:00,Content,SPRING24,Android,1.1.0,501-1000,Sales,FALSE,61,,TRUE,2024-01-15 10:13,2024-05-17 10:13
U001627,Fatima,Wilson,fatima.wilson@yahoo.com,SE,WA,UTC,2023-10-11 0:00,Partner,Q3_PROMO,Linux,1.1.0,1000+,Engineering,0,60,,TRUE,2023-10-11 9:43,2024-01-26 9:43
U001606,Zoe,King,zoe.king@outlook.com,FR,CA,,2024-04-07 0:00,Content,N/A,macOS,v1.0.9,10-Jan,HR,1,50,,no,2024-04-07 19:50,2024-07-12 19:50
U000553,Leo,Nguyen,LEO.NGUYEN@OUTLOOK.COM,GB,CA,Asia/Kolkata,2024-04-24 0:00,Content,SPRING24,Android,1.1.0,201-500,Marketing,1,25,,0,2024-04-24 16:55,2024-05-22 16:55
U001109,Sofia,Lopez,sofia.lopez@company.com,ZA,-,,2024-07-09 0:00,Social,SPRING24,Android,2.0.0,201-500,HR,1,48,,N,2024-07-09 2:12,2024-12-06 2:12
U000670,Ava,Lopez,ava.lopez@company.com,GB,unknown,,2023-12-05 0:00,Outbound,SPRING24,macOS,1.2.0,501-1000,Marketing,0,36,,N,2023-12-05 22:01,2024-01-13 22:01
U000312,Hana,Lee,hana.lee@gmail.com,SG,RJ,America/New_York,2023-06-12 0:00,Referral,n/a,iOS,1.2.0,1000+,Product,0,35,U000210,0,2023-06-12 3:05,2023-07-28 3:05
U001304,Sophia,Wilson,SOPHIA.WILSON@OUTLOOK.COM,NL,unknown,America/New_York,2024-04-18 0:00,Partner,N/A,Unknown,1.2.0,1000+,Support,1,22,,Y,2024-04-18 6:40,2024-07-16 6:40
U001178,Noah,Thompson,noah.thompson@icloud.com,FR,unknown,UTC,2023-07-18 0:00,Outbound,AI-LAUNCH,iOS,1.2.0,201-500,Finance,1,27,,no,2023-07-18 21:24,
U000785,Jin,Lee,jin.lee@proton.me,JP,WA,,2023-09-26 0:00,Content,GROWTHLAB,Windows,v1.2.1,11-50,Support,1,N/A,,Y,2023-09-26 3:27,2024-01-26 3:27
U002556,Ava,White,ava.white@outlook.com,CA,BC,Europe/Berlin,2025-04-12 0:00,Webinar,SPRING24,Unknown,1.2.1,10-Jan,Sales,0,29,,1,2025-04-12 1:08,2025-04-16 1:08
U001207,Amir,Nguyen,amir.nguyen@nexloom.io,DE,ON,Europe/Berlin,2024-07-02 0:00,Content,SPRING24,macOS,2.1.0,11-50,Engineering,0,49,,TRUE,2024-07-02 3:56,2024-07-11 3:56
U002074,Omar,Nguyen,omar.nguyen@proton.me,AU,unknown,,2024-11-24 0:00,Social,N/A,Unknown,1.1.2,201-500,Support,1,20,,1,2024-11-24 14:59,2025-02-19 14:59
U002353,Elena,Harris,elena.harris@yahoo.com,SG,-,UTC,2024-05-25 0:00,Social,Q3_PROMO,Linux,1.3.0,1000+,HR,0,43,,TRUE,2024-05-25 2:36,2024-06-21 2:36
U000120,Chen,King,chen.king@company.com,DE,unknown,Asia/Tokyo,04/17/2024,Referral,SPRING24,Linux,1.0.9,unknown,Marketing,0,25,U000202,TRUE,2024-04-17 19:49,2024-05-12 19:49
U002354,Emma,Martin,emma.martin@nexloom.io,DE,SP,Europe/London,2024-11-19 0:00,paid search,N/A,Unknown,1.1.2,201-500,Product,0,34,,Y,2024-11-19 18:29,2025-01-19 18:29
U000352,Priya,Smith,priya.smith@icloud.com,mx,LND,Asia/Tokyo,2024-11-01 0:00,Outbound,SPRING24,Linux,1.3.0,11-50,Sales,0,29,,FALSE,2024-11-01 6:03,2025-03-10 6:03
U002097,Amir,Walker,amir.walker@proton.me,GB,NY,UTC,2024-05-07 0:00,Social,SPRING24,Windows,1.2.1,11-50,Engineering,0,37,,FALSE,2024-05-07 16:22,2024-05-07 16:22
U000406,Omar,Lopez,omar.lopez@icloud.com,NL,BER,America/New_York,2024-12-16 0:00,Outbound,RETARGET1,Unknown,2.1.0,10-Jan,Marketing,0,18,,1,2024-12-16 18:14,2025-04-14 18:14
U000053,Olivia,King,olivia.king@yahoo.com,GB,,America/New_York,2025-03-02,Referral,SPRING24,Linux,1.2.0,201-500,Finance,0,23,U000439,TRUE,2025-03-02 15:14,2025-05-09 15:14
U000382,Chen,Smith,CHEN.SMITH@ICLOUD.COM,US,NY,,2024-07-09 0:00,Content,GROWTHLAB,Android,1.3.0,1000+,Ops,0,42,,FALSE,2024-07-09 3:12,2024-11-02 3:12
U002542,Zoe,White,zoe.white@icloud.com,IN,,Europe/Berlin,2024-08-20 0:00,Webinar,BF2024,Unknown,1.0.9,51-200,Marketing,1,32,,FALSE,2024-08-20 6:12,2024-11-16 6:12
U001758,Nora,Clark,nora.clark@gmail.com,SG,unknown,,2024-03-23 0:00,Paid Search,BF2024,Windows,v1.1.2,201-500,HR,0,62,,TRUE,2024-03-23 7:59,
U001026,Sophia,Taylor,sophia.taylor@proton.me,ZA,LND,Asia/Tokyo,2024-03-16 0:00,Social,BF2024,iOS,v1.1.2,501-1000,Sales,1,18,,FALSE,2024-03-16 22:18,2024-07-31 22:18
U000539,Sophia,Thomas,sophia.thomas@nexloom.io,NL,BER,,2024-03-04 0:00,Webinar,AI-LAUNCH,iOS,2.0.1,51-200,Sales,0,39,,no,2024-03-04 2:20,2024-08-27 2:20
U001535,Chen,Thomas,chen.thomas@outlook.com,FR,ON,America/New_York,2024-02-14 0:00,Paid Search,N/A,Linux,1.2.1,51-200,Engineering,0,38,,TRUE,02/14/2024 21:33,2024-06-08 21:33
U000664,Yuki,Wilson,yuki.wilson@proton.me,US,RJ,Asia/Tokyo,2023-11-05 0:00,Social,SUMMER24,macOS,1.1.2,201-500,Support,0,22,,Y,2023-11-05 7:44,2023-11-05 7:44
U000513,Liam,Martinez,LIAM.MARTINEZ@NEXLOOM.IO,FR,RJ,Europe/London,2025-02-15 0:00,Paid Search,SUMMER24,Linux,2.0.0,201-500,Ops,0,25,,Y,2025-02-15 0:16,2025-04-01 0:16
U001947,Ethan,Clark,ethan.clark@proton.me,US,BC,Europe/London,2024-02-28 0:00,Organic Search,SPRING24,macOS,2.1.0,unknown,Marketing,1,53,,FALSE,2024-02-28 23:37,2024-03-08 23:37
U001656,Sophia,Smith,sophia.smith@outlook.com,IN,RJ,Europe/Berlin,24-02-2025,Paid Search,SUMMER24,macOS,2.0.0,501-1000,Marketing,1,40,,yes,2025-02-24 12:16,2025-04-16 12:16
U001955,Liam,King,liam.king@nexloom.io,USA,BER,Europe/Berlin,11/18/2025,Content,RETARGET1,Unknown,2.0.1,51-200,Product,0,20,,yes,2025-11-18 12:03,2026-03-27 12:03
U002001,Zoe,Lewis,zoe.lewis@gmail.com,ca,RJ,Europe/Berlin,2023-11-21 0:00,Social,SPRING24,Windows,1.0.9,501-1000,Engineering,0,,,0,2023-11-21 21:57,2024-01-11 21:57
U001532,Sofia,Nguyen,sofia.nguyen@proton.me,BR,LND,,2024-05-23 0:00,Referral,RETARGET1,Windows,v1.1.0,10-Jan,HR,1,41,U000417,0,2024-05-23 15:50,2024-09-01 15:50
U001736,Anya,Robinson,anya.robinson@company.com,NL,BER,Europe/London,2024-12-04 0:00,Paid Search,RETARGET1,Linux,1.3.0,10-Jan,Engineering,0,51,,FALSE,2024-12-04 11:48,2025-04-18 11:48
U002020,Zoe,Wilson, zoe.wilson@nexloom.io ,ZA,NY,UTC,06/21/2024,Webinar,BF2024,iOS,2.1.0,11-50,Support,0,31,,N,2024-06-21 2:14,2024-11-04 2:14
U001880,Fatima,Harris,fatima.harris@nexloom.io,CA,-,Europe/Berlin,2024-04-30 0:00,Webinar,Q3_PROMO,Android,1.3.0,201-500,Finance,0,N/A,,1,2024-04-30 3:34,2024-08-25 3:34
U000370,Ivy,Martin,ivy.martin@gmail.com,DE,RJ,UTC,2023-05-30 0:00,Organic Search,Q3_PROMO,iOS,1.1.2,201-500,Engineering,0,46,,FALSE,2023-05-30 16:15,2023-08-09 16:15
U002594,Sofia,Martin, sofia.martin@yahoo.com ,GB,CA,Asia/Tokyo,2024-04-08,Webinar,GROWTHLAB,iOS,1.3.0,201-500,Ops,0,,,N,2024-04-08 15:05,2024-04-20 15:05
U001281,Omar,King,omar.king@icloud.com,JP,-,Europe/London,05/28/2024,Outbound,Q3_PROMO,Windows,2.0.0,201-500,Marketing,0,46,,FALSE,2024-05-28 6:18,2024-09-24 6:18
U001113,Zoe,Perez,zoe.perez@icloud.com,AU,-,,2023-10-27 0:00,Outbound,AI-LAUNCH,Linux,2.0.0,501-1000,Ops,0,34,,,2023-10-27 5:38,2024-03-27 5:38
U001509,Omar,Johnson,omar.johnson@gmail.com,US,WA,UTC,05/22/2024,Referral,RETARGET1,macOS,1.0.9,11-50,Engineering,1,50,U000077,Y,2024-05-22 10:55,2024-10-06 10:55
U001949,Ethan,Taylor,ethan.taylor@proton.me,CA,CA,America/New_York,2023-12-30,Webinar,,Linux,1.1.0,51-200,Product,0,31,,0,2023-12-30 23:40,2024-05-14 23:40
U000718,Sara,Scott,sara.scott@yahoo.com,NL,,Europe/Berlin,2025-05-16 0:00,Content,WINTER25,macOS,2.0.0,11-50,Product,1,,,1,2025-05-16 20:24,2025-08-20 20:24
U002476,Elena,Anderson,elena.anderson@proton.me,DE,-,Europe/London,2024-11-15 0:00,Content,SUMMER24,Linux,1.1.0,1000+,Sales,0,19,  U000120,FALSE,2024-11-15 11:27,2025-01-12 11:27
U002176,Sophia,Garcia,sophia.garcia@nexloom.io,us,NSW,UTC,10/14/2024,Social,RETARGET1,Linux,2.0.1,51-200,Product,1,31,,yes,10/14/2024 15:19,2024-12-04 15:19
U002411,Kofi,Moore,kofi.moore@gmail.com,US,,America/New_York,2024-07-04 0:00,Organic Search,RETARGET1,Linux,2.0.1,201-500,Founder,no,38,,no,2024-07-04 6:44,2024-07-27 6:44
U000672,Noah,Lewis,noah.lewis@outlook.com,DE,ON,Asia/Kolkata,2024-12-17 0:00,Content,NA,Android,1.2.1,unknown,Product,0,30,,Y,2024-12-17 22:17,2024-12-17 22:17
U001997,Olivia,Jackson,olivia.jackson@yahoo.com,NL,NY,Europe/London,2025-04-17 0:00,Outbound,GROWTHLAB,Unknown,2.0.1,201-500,Ops,1,31,,FALSE,2025-04-17 8:57,2025-04-19 8:57
U000642,Diego,Lee,diego.lee@nexloom.io,NL,WA,America/Los_Angeles,2023-12-27 0:00,Organic Search,n/a,Windows,v1.1.0,201-500,Ops,0,28,,yes,2023-12-27 21:32,2024-05-09 21:32
U000129,Ravi,White,ravi.white@nexloom.io,DE,TX,,2023-01-21 0:00,Webinar,SPRING24,Linux,2.0.0,10-Jan,HR,1,38,,,2023-01-21 13:59,2023-07-04 13:59
U000862,Kofi,Johnson,kofi.johnson@company.com,US,RJ,America/Los_Angeles,03/05/2024,Webinar,AI-LAUNCH,Linux,1.2.0,501-1000,HR,0,35,,,2024-03-05 11:20,2024-07-11
U000047,Jin,Thomas,jin.thomas@proton.me,FR,SP,Asia/Tokyo,2023-12-21 0:00,Webinar,BF2024,Windows,1.2.1,unknown,Finance,1,28,,FALSE,2023-12-21 0:47,2024-01-13 0:47
U001348,Ravi,Brown,ravi.brown@yahoo.com,IN,ON,Asia/Tokyo,2024-01-23 0:00,Social,GROWTHLAB,Windows,2.0.0,10-Jan,Engineering,0,19,,1,2024-01-23 5:21,2024-07-21 5:21
U000532,Sophia,Lopez,sophia.lopez@yahoo.com,FR,-,Europe/London,2025-11-29 0:00,Content,SPRING24,Unknown,1.2.1,501-1000,Product,0,35,,Y,2025-11-29 21:07,2026-03-10 21:07
U001256,Priya,Young,priya.young@nexloom.io,jp,TX,UTC,2024-02-22 0:00,Outbound,RETARGET1,Linux,1.0.9,unknown,Support,0,63,,N,2024-02-22 4:30,2024-06-11 4:30
U000534,Zoe,Taylor, zoe.taylor@company.com ,MX,NY,Asia/Tokyo,2024-04-25 0:00,Outbound,N/A,macOS,v1.0.9,501-1000,Founder,yes,60,,yes,2024-04-25 8:56,2024-05-22 8:56
U000450,Chen,Scott,chen.scott@yahoo.com,CA,MH,Asia/Kolkata,2023-06-19 0:00,Organic Search,n/a,macOS,1.1.2,51-200,Sales,1,38,,,2023-06-19 5:30,2023-09-27 5:30
U000817,Elena,Perez,elena.perez@nexloom.io,ZA,-,,2024-05-14 0:00,Outbound,GROWTHLAB,iOS,2.0.0,501-1000,Sales,0,24,,1,2024-05-14 15:38,2024-06-29 15:38
U002156,Ethan,Garcia,ETHAN.GARCIA@GMAIL.COM,AU,BER,Asia/Kolkata,2023-11-07,Content,AI-LAUNCH,Android,1.0.9,unknown,Founder,0,48,,1,2023-11-07 1:38,2023-12-17 1:38
U000092,Lucas,White,lucas.white@nexloom.io,DE,RJ,,2024-07-19 0:00,Social,WINTER25,Android,1.2.1,unknown,Finance,0,18,,N,2024-07-19 9:26,2024-12-29 9:26
U001738,Kofi,Lopez,kofi.lopez@icloud.com,NL,BER,Europe/Berlin,2023-10-06 0:00,Partner,SPRING24,Linux,2.0.0,501-1000,Product,0,41,,N,2023-10-06 14:27,2023-10-08 14:27
U000658,Kofi,Harris, kofi.harris@yahoo.com ,IN,CA,Asia/Kolkata,2024-01-18 0:00,Social,WINTER25,Windows,2.0.1,10-Jan,Marketing,0,22,,FALSE,2024-01-18 20:55,2024-04-12 20:55
U001908,Anya,Walker,anya.walker@nexloom.io,ZA,unknown,,2024-01-21 0:00,Outbound,BF2024,Linux,1.1.0,201-500,Ops,1,25,,1,2024-01-21 21:53,2024-03-28 21:53
U000606,Liam,Davis,liam.davis@company.com,DE,BER,Asia/Tokyo,2024-03-09 0:00,Paid Search,RETARGET1,Windows,2.0.1,501-1000,Finance,1,unknown,,FALSE,2024-03-09 20:45,2024-03-27 20:45
U000152,Ethan,Thompson,ethan.thompson@gmail.com,AU,ON,Asia/Tokyo,2024-05-29 0:00,Outbound,SPRING24,iOS,1.2.1,11-50,Ops,0,46,,1,2024-05-29 11:24,2024-08-01 11:24
U002559,sophia,Taylor,sophia.taylor@nexloom.io,US,,America/New_York,2023-06-10 0:00,Organic Search,Q3_PROMO,Windows,1.3.0,unknown,Founder,0,N/A,,TRUE,2023-06-10 21:46,2023-11-15 21:46
U000371,Ethan,Allen,ethan.allen@nexloom.io,FR,NY,,2023-07-11,Referral,n/a,Linux,1.2.1,unknown,Support,1,41,U000200,FALSE,2023-07-11 21:11,2023-11-11 21:11
U001823,Sara,Wilson,sara.wilson@nexloom.io,SE,NY,Europe/London,2024-05-26 0:00,Referral,RETARGET1,iOS,1.2.0,10-Jan,Engineering,0,21,U000149,TRUE,2024-05-26 20:21,2024-10-31 20:21
U000215,Mateo,Davis,mateo.davis@icloud.com,CA,NSW,UTC,18-07-2024,Social,WINTER25,macOS,1.3.0,501-1000,Ops,0,48,,N,2024-07-18 6:55,2024-11-10 6:55
U002025,Liam,Nguyen,liam.nguyen@yahoo.com,US,unknown,UTC,02/17/2024,Paid Search,WINTER25,Android,1.1.0,10-Jan,Support,0,61,,yes,2024-02-17 22:24,2024-06-14
U001312,Yuki,King,yuki.kingcompany.com,AU,NY,Europe/London,2024-12-15,Organic Search,N/A,Unknown,1.1.0,501-1000,Marketing,1,26,,0,2024-12-15 12:08,2024-12-26 12:08
U000091,Lucas,THOMAS,lucas.thomas@nexloom.io,sg,CA,UTC,2023-08-01 0:00,Webinar,Q3_PROMO,Android,2.1.0,11-50,Support,0,36,,TRUE,08/01/2023 23:07,2023-09-22 23:07
U001925,Fatima,Nguyen,FATIMA.NGUYEN@PROTON.ME,GB,CA,America/Los_Angeles,2024-09-09 0:00,Webinar,,iOS,2.1.0,10-Jan,Ops,0,29,,N,2024-09-09 3:42,
USR-002014,Kofi,King,KOFI.KING@COMPANY.COM,nl,unknown,America/New_York,2023-08-20 0:00,Paid Search,AI-LAUNCH,Unknown,2.0.0,201-500,Product,0,48,,TRUE,2023-08-20 16:41,2023-11-30 16:41
U000853,Noah,Moore,noah.moore@icloud.com,US,MH,,2023-10-17 0:00,content,SUMMER24,Unknown,1.0.9,11-50,Marketing,0,37,,no,2023-10-17 12:23,2024-03-26 12:23
U001275,Sophia,Harris,sophia.harris@company.com,US,BC,Asia/Kolkata,2024-03-19 0:00,Organic Search,n/a,Unknown,1.0.9,11-50,HR,0,,,N,2024-03-19 18:24,2024-03-23 18:24
U002449,Lucas,Davis, lucas.davis@company.com ,US,TX,Asia/Tokyo,2023-05-12 0:00,Paid Search,N/A,macOS,2.0.0,51-200,Marketing,0,43,,Y,2023-05-12 0:05,2023-08-29 0:05
U002446,Nora,Thomas,nora.thomas@yahoo.com,,BER,,2023-12-15 0:00,Content,SPRING24,macOS,2.0.1,51-200,Product,0,22,,TRUE,2023-12-15 6:14,04-24-2024 06:14
U000331,Amir,Anderson,amir.anderson@nexloom.io,JP,-,UTC,2024-01-15 0:00,social,Q3_PROMO,Android,1.1.2,501-1000,Marketing,0,51,,1,2024-01-15 10:27,2024-04-09 10:27
U001354,Leo,Wright,leo.wright@icloud.com,CA,TX,America/Los_Angeles,2024-07-26,Webinar,null,Unknown,1.1.2,unknown,HR,0,20,,TRUE,07/26/2024 16:39,09-21-2024 16:39
U001832,Liam,Wilson,liam.wilson@icloud.com,SG,-,Asia/Tokyo,2024-05-19 0:00,Partner,BF2024,Unknown,1.2.1,51-200,Sales,0,36,,TRUE,2024-05-19 23:30,2024-07-05 23:30
U001172,Elena,Garcia,elena.garcia@icloud.com,SG,ON,America/Los_Angeles,2025-07-28 0:00,Outbound,N/A,iOS,v1.3.0,51-200,Product,0,21,,,2025-07-28 8:40,2025-08-31 8:40
U000310,Ava,King,ava.king@company.com,IN,MH,Asia/Tokyo,2023-11-27,Partner,SUMMER24,Unknown,v1.0.9,51-200,Founder,1,18,,FALSE,2023-11-27 22:05,2024-02-05 22:05
U001069,Ivy,Taylor,ivy.taylor@icloud.com,nl,BC,Asia/Tokyo,2024-01-14 0:00,Paid Search,RETARGET1,Unknown,2.1.0,501-1000,Finance,0,58,,FALSE,2024-01-14 19:46,2024-05-21 19:46
U000061,Priya,Perez,priya.perezproton.me,de,NSW,UTC,2024-02-01 0:00,Content,Q3_PROMO,Windows,v2.1.0,11-50,Founder,0,40,,FALSE,2024-02-01 23:20,2024-02-21 23:20
U002052,Priya,Brown,priya.brown@nexloom.io,CA,ON,,2024-03-21 0:00,Referral,n/a,Windows,1.2.0,11-50,Engineering,0,61,U000254,FALSE,2024-03-21 9:19,2024-05-24 9:19
U001474,Fatima,Scott,fatima.scott@nexloom.io,CA,MH,Europe/Berlin,2024-02-09 0:00,Paid Search,SUMMER24,iOS,1.0.9,201-500,Marketing,1,19,,N,02/09/2024 16:14,2024-03-22 16:14
U001260,Lucas,Taylor,LUCAS.TAYLOR@PROTON.ME,DE,RJ,Europe/Berlin,2024-05-09 0:00,Paid Search,Q3_PROMO,Android,1.3.0,11-50,Founder,1,22,,TRUE,2024-05-09 9:56,2024-11-05 9:56
U001534,Lucas,Perez,lucas.perez@icloud.com,JP,MH,UTC,2023-11-28 0:00,Partner,WINTER25,macOS,1.1.2,201-500,Product,1,51,,FALSE,2023-11-28 4:49,2023-12-14 4:49
U000348,Zoe,Garcia,zoe.garcia@proton.me,SE,BER,Europe/Berlin,2023-04-20 0:00,Organic Search,N/A,Windows,1.2.0,1000+,Support,0,49,,FALSE,2023-04-20 0:42,2023-09-23 0:42
U002600,Yuki,Martin,yuki.martin@yahoo.com,US,,,2023-08-15 0:00,Organic Search,N/A,Linux,1.0.9,501-1000,Product,0,20,,N,2023-08-15 23:38,2023-10-12 23:38
U000058,Mia,Walker,mia.walker@yahoo.com,NL,SP,America/New_York,2023-10-07 0:00,Paid Search,GROWTHLAB,Android,2.1.0,201-500,Sales,0,31,,yes,2023-10-07 22:59,2024-03-09 22:59
U002370,Priya,White,priya.white@gmail.com,FR,BC,Europe/London,2024-07-28 0:00,Webinar,RETARGET1,Unknown,2.1.0,201-500,Ops,0,37,,TRUE,2024-07-28 7:31,2024-11-30 7:31
U001891,Zoe,Wilson,zoe.wilson@gmail.com,JP,ON,UTC,2023-07-09 0:00,Referral,n/a,Windows,1.3.0,201-500,Marketing,1,N/A,U000126,,2023-07-09 12:50,2023-09-04 12:50
U001843,Chen,White,chen.white@outlook.com,MX,CA,Europe/Berlin,2024-02-27 0:00,Webinar,BF2024,iOS,1.2.0,201-500,Finance,0,47,,yes,2024-02-27 4:49,2024-07-18 4:49
U002330,Lucas,Allen,lucas.allen@nexloom.io,ZA,RJ,America/Los_Angeles,2023-05-01 0:00,Referral,GROWTHLAB,Unknown,2.0.1,11-50,Product,0,60,U000452,1,2023-05-01 23:20,2023-06-01 23:20
U000332,Sara,Young, sara.young@outlook.com ,NL,unknown,Asia/Kolkata,2024-08-15 0:00,Outbound,RETARGET1,Windows,1.3.0,201-500,HR,1,31,,FALSE,2024-08-15 1:34,2025-01-30 1:34
U000805,Emma,Walker,emma.walker@outlook.com,JP,ON,,19-02-2024,Webinar,SPRING24,iOS,1.0.9,201-500,Engineering,1,28,,N,2024-02-19 9:40,2024-06-05 9:40
U000336,Jin,Anderson,jin.anderson@outlook.com,DE,LND,UTC,2023-04-11 0:00,Social,SPRING24,Android,1.1.0,201-500,Product,0,,,TRUE,2023-04-11 3:10,2023-05-25 3:10
U000197,Fatima,Moore,fatima.moore@gmail.com,DE,WA,America/New_York,2024-07-26 0:00,Paid Search,GROWTHLAB,macOS,2.1.0,10-Jan,Product,0,47,,Y,2024-07-26 5:42,2025-01-03 5:42
U002138,Elena,Lewis,elena.lewis@company.com,IN,RJ,,2024-07-30 0:00,Referral,N/A,iOS,2.1.0,201-500,HR,0,41,U000084,yes,2024-07-30 19:43,0000-00-00 00:00:00
u000124,Amir,Wilson,amir.wilson@outlook.com,MX,BC,,2023-07-22 0:00,social,N/A,Android,2.1.0,501-1000,Ops,1,62,,N,2023-07-22 11:51,2023-11-22 11:51
U001375,Liam,Clark,liam.clark@nexloom.io,CA,,Asia/Tokyo,2023-11-12 0:00,Social,AI-LAUNCH,Android,1.1.2,51-200,HR,0,21,,no,2023-11-12 7:18,2024-03-04 7:18
U000744,Liam,Martin,liam.martin@gmail.com,DE,BC,,2024-03-30 0:00,Partner,N/A,macOS,1.0.9,11-50,Product,0,37,,N,2024-03-30 10:42,2024-07-30 10:42
U000621,Chen,Clark,chen.clark@proton.me,ZA,,UTC,2023-09-28 0:00,Outbound,GROWTHLAB,Linux,1.3.0,10-Jan,Support,1,27,,1,2023-09-28 3:27,2023-10-31 3:27
U001266,Nora,Wilson,nora.wilson@company.com,US,NSW,,2023-06-04 0:00,Webinar,BF2024,iOS,1.2.1,11-50,Support,0,27,,TRUE,2023-06-04 21:09,2023-10-24 21:09
U000752,Ava,Anderson,ava.anderson@gmail.com,SE,,,2025-03-03 0:00,Social,BF2024,Android,2.1.0,unknown,Founder,0,,,yes,2025-03-03 11:04,2025-08-17 11:04
U001690,Kofi,Scott,kofi.scott@icloud.com,SE,BER,,2024-08-20 0:00,Social,N/A,Unknown,2.0.1,10-Jan,Support,1,41,,yes,2024-08-20 12:44,2024-10-28 12:44
U001598,Priya,Lopez,priya.lopez@gmail.com,BR,CA,Asia/Kolkata,2023-06-14 0:00,Partner,Q3_PROMO,macOS,1.1.2,501-1000,Founder,0,unknown,,FALSE,2023-06-14 3:49,2023-07-06 3:49
U002441,Amir,Robinson,amir.robinson@gmail.com,DE,WA,UTC,04/25/2024,Partner,BF2024,Linux,1.2.1,unknown,Marketing,0,26,,FALSE,2024-04-25 14:22,2024-05-17 14:22
U002320,Ravi,Jackson,ravi.jackson@company.com,JP,NSW,Europe/Berlin,2024-02-13 0:00,Partner,SUMMER24,Windows,1.0.9,201-500,Engineering,0,39,,no,2024-02-13 22:05,2024-05-30 22:05
U000448,Priya,Young,priya.young@nexloom.io,GB,NSW,,2024-08-12 0:00,Paid Search,RETARGET1,Windows,2.0.0,10-Jan,Founder,1,44,,TRUE,2024-08-12 13:47,2024-12-22 13:47
U001754,Ava,Lee,ava.lee@yahoo.com,JP,BER,,2023-11-08 0:00,Outbound,SPRING24,Android,v1.2.1,201-500,Ops,TRUE,45,,,2023-11-08 21:30,2024-04-09 21:30
U000011,Chen,Davis,chen.davis@company.com,SE,MH,UTC,2023-02-26 0:00,Partner,N/A,Unknown,1.3.0,1000+,Engineering,0,50,,0,2023-02-26 23:07,0000-00-00 00:00:00
U001592,Jin,Brown,jin.brown@gmail.com,IN,TX,,2025-09-27 0:00,Webinar,BF2024,iOS,1.1.0,51-200,Engineering,0,44,,FALSE,2025-09-27 19:32,2025-11-05 19:32
U002379,Chen,King,chen.king@proton.me,FR,WA,Europe/Berlin,2024-03-02 0:00,Social,RETARGET1,Unknown,1.1.2,201-500,Ops,0,20,,FALSE,2024-03-02 19:12,2024-03-30 19:12
U001926,Hana,Clark,hana.clark@company.com,JP,,America/New_York,2023-07-02 0:00,referral,AI-LAUNCH,macOS,1.0.9,11-50,Sales,0,31,U000264,FALSE,2023-07-02 8:42,2023-12-15 8:42
U000171,Fatima,Nguyen,fatima.nguyen@yahoo.com,DE,unknown,Europe/Berlin,2024-06-28 0:00,Referral,n/a,Linux,2.0.1,501-1000,Support,0,53,U000424,TRUE,2024-06-28 4:14,2024-12-12 4:14
USR-000909,Hana,Smith,hana.smith@gmail.com,DE,-,Asia/Kolkata,2023-11-19 0:00,Content,WINTER25,Linux,1.1.0,1000+,Engineering,0,64,,no,2023-11-19 20:57,2024-04-26 20:57
U000275,Nora,Jackson,nora.jackson@company.com,IN,MH,Europe/Berlin,2024-04-03 0:00,Content,GROWTHLAB,Android,1.2.1,10-Jan,Finance,0,30,,,2024-04-03 1:42,2024-09-15 1:42
U000949,Elena,Perez,elena.perez@outlook.com,au,NSW,,2024-11-19,Outbound,AI-LAUNCH,macOS,2.0.0,11-50,Marketing,0,45,,yes,2024-11-19 1:29,2025-03-08
U000668,Mia,MOORE,mia.moore@proton.me,FR,-,UTC,2023-09-09 0:00,Referral,n/a,macOS,2.0.1,201-500,HR,0,57,,1,2023-09-09 19:43,2023-11-21 19:43
U000767,Diego,Scott,diego.scott@company.com,BR,,America/Los_Angeles,2024-08-18 0:00,Paid Search,SUMMER24,iOS,1.2.1,11-50,Sales,0,32,,1,08/18/2024 23:30,2024-11-14 23:30
U001565,Ivy,Allen,ivy.allen@yahoo.com,BR,BC,UTC,2024-10-01,Content,GROWTHLAB,Windows,v2.0.1,1000+,Founder,no,62,,TRUE,2024-10-01 20:01,2025-02-04 20:01
U001992,Liam,Thompson,liam.thompson@outlook.com,DE,SP,,2023-09-07,Outbound,N/A,macOS,1.0.9,unknown,Product,no,45,,TRUE,2023-09-07 13:52,2023-11-23 13:52
U000280,Amir,Wilson,amir.wilson@gmail.com,SG,ON,UTC,2024-09-10 0:00,Organic Search,RETARGET1,macOS,2.0.0,51-200,Marketing,1,34,,no,2024-09-10 6:15,2024-12-15 6:15
U001236,Liam,Harris,liam.harris@proton.me,BR,,,2024-01-21 0:00,Referral,n/a,Windows,1.2.1,1000+,Engineering,0,20,U000032,FALSE,2024-01-21 22:55,2024-02-13 22:55
U002597,Anya,Smith,anya.smith@company.com,FR,,America/New_York,2023-11-27 0:00,Partner,SUMMER24,Android,1.1.2,10-Jan,Founder,0,40,,TRUE,2023-11-27 2:11,2024-05-06 2:11
U000400,Ivy,King,ivy.king@outlook.com,GB,CA,,08/13/2024,Organic Search,n/a,Windows,v1.1.2,201-500,Engineering,1,21,,TRUE,2024-08-13 12:31,2025-02-02 12:31
U001035,Anya,Moore,anya.moore@gmail.com,CA,RJ,Asia/Tokyo,2023-06-10 0:00,Paid Search,N/A,macOS,1.1.0,unknown,Ops,0,36,,0,2023-06-10 11:52,2023-11-27 11:52
U001195,Zoe,Young,zoe.young@gmail.com,US,WA,Europe/Berlin,2023-04-21 0:00,Organic Search,SPRING24,Linux,2.0.1,10-Jan,Ops,0,19,,Y,2023-04-21 11:00,2023-07-30 11:00
U002160,Ravi,Clark,ravi.clarknexloom.io,IN,NSW,Europe/London,08/09/2024,Organic Search,n/a,iOS,1.0.9,11-50,Founder,1,26,,TRUE,2024-08-09 2:47,2024-08-18 2:47
U002412,Priya,LEE,priya.lee@outlook.com,BR,LND,America/New_York,2023-08-22 0:00,Webinar,GROWTHLAB,Linux,2.1.0,10-Jan,Finance,1,29,,1,2023-08-22 11:16,2023-10-22 11:16
U001910,Olivia,Scott,olivia.scott@nexloom.io,AU,MH,Asia/Tokyo,2023-08-29 0:00,Webinar,WINTER25,Unknown,1.2.0,201-500,Founder,1,40,,1,2023-08-29 7:09,2024-01-04 7:09
U000943,Jin,Allen,jin.allen@outlook.com,AU,CA,America/Los_Angeles,06/14/2024,Organic Search,RETARGET1,macOS,2.0.1,51-200,Product,1,44,,Y,2024-06-14 0:56,2024-11-04 0:56
U002237,Hana,Thompson,hana.thompson@nexloom.io,AU,ON,,2024-12-11 0:00,Social,BF2024,iOS,2.0.0,10-Jan,Finance,0,39,,FALSE,2024-12-11 17:23,2024-12-22 17:23
U000600,Olivia,King,olivia.king@nexloom.io,AU,ON,America/New_York,2023-04-12 0:00,Organic Search,GROWTHLAB,iOS,1.0.9,unknown,Finance,0,50,,0,2023-04-12 13:39,2023-07-26 13:39
U001800,Ava,Harris, ava.harris@company.com ,IN,TX,UTC,2023-02-04 0:00,Outbound,SUMMER24,iOS,2.0.0,51-200,Engineering,1,41,,TRUE,2023-02-04 9:22,2023-03-21 9:22
U001463,Leo,Walker,leo.walker@company.com,IN,RJ,Europe/London,2023-07-18 0:00,Social,WINTER25,macOS,2.1.0,51-200,Support,0,18,,FALSE,2023-07-18 0:06,2023-12-28 0:06
U001530,Zoe,Brown,zoe.brown@proton.me,CA,NSW,UTC,2024-04-17 0:00,Referral,WINTER25,Windows,1.0.9,unknown,Engineering,0,64,U000131,TRUE,2024-04-17 5:29,2024-06-17 5:29
U001568,Sofia,Smith,sofia.smith@yahoo.com,GB,MH,America/New_York,2023-07-05 0:00,paid search,RETARGET1,Windows,1.2.1,unknown,Support,1,63,,N,2023-07-05 15:26,2023-09-16 15:26
U000039,Lucas,Smith,lucas.smith@icloud.com,NL,unknown,Asia/Tokyo,2024-07-02 0:00,Outbound,AI-LAUNCH,iOS,2.0.1,11-50,Finance,0,32,,TRUE,2024-07-02 7:39,2024-07-09 7:39
U002121,Kofi,Harris,kofi.harris@icloud.com,nl,NSW,America/New_York,2024-09-16 0:00,Referral,AI-LAUNCH,Unknown,1.2.1,10-Jan,Founder,TRUE,31,U000166,TRUE,2024-09-16 18:32,2024-12-10 18:32
U000199,Mia,Moore,MIA.MOORE@GMAIL.COM,GB,NSW,,2024-12-05 0:00,Outbound,SUMMER24,Unknown,2.1.0,1000+,HR,0,18,,Y,2024-12-05 21:06,2025-05-20 21:06
U002133,Sara,Anderson,sara.anderson@proton.me,jp,,Europe/Berlin,2024-04-28 0:00,Social,SPRING24,Windows,1.3.0,11-50,Ops,0,18,,N,2024-04-28 11:13,2024-05-01 11:13
U002120,Emma,Moore,emma.moore@outlook.com,ZA,CA,UTC,2024-11-29 0:00,Paid Search,SUMMER24,Linux,1.1.2,11-50,Product,0,38,,yes,2024-11-29 4:13,2025-03-23 4:13
U001145,Omar,Anderson,omar.anderson@outlook.com,JP,RJ,,2023-11-24 0:00,Content,AI-LAUNCH,iOS,1.3.0,10-Jan,Founder,1,50,,Y,2023-11-24 14:18,2024-02-22 14:18
U000788,Emma,Martin,emma.martin@icloud.com,AU,CA,UTC,2024-02-07 0:00,Social,N/A,Windows,1.1.2,10-Jan,Founder,1,26,,FALSE,2024-02-07 13:07,2024-02-23 13:07
U000433,Fatima,Thompson,fatima.thompson@company.com,AU,BER,America/Los_Angeles,2024-05-28 0:00,Referral,BF2024,Linux,1.2.1,unknown,Marketing,0,,U000021,TRUE,2024-05-28 1:52,2024-06-26 1:52
U001224,Mia,Johnson, mia.johnson@nexloom.io ,BR,RJ,Asia/Tokyo,2025-03-12,Webinar,RETARGET1,Unknown,1.3.0,1000+,Marketing,1,39,,N,2025-03-12 9:09,
U001825,Sofia,White,sofia.white@gmail.com,IN,LND,America/New_York,2024-06-10 0:00,Partner,N/A,iOS,2.0.1,11-50,Ops,0,55,,Y,2024-06-10 19:53,2024-09-03 19:53
U001871,Anya,White,anya.white@outlook.com,DE,NY,America/New_York,2024-09-27 0:00,Outbound,NA,macOS,2.0.0,10-Jan,Engineering,0,40,,yes,2024-09-27 14:16,2025-03-07 14:16
U001685,Mateo,Wilson,mateo.wilson@yahoo.com,JP,NY,Europe/Berlin,2023-08-14 0:00,Social,null,Linux,1.2.1,201-500,Founder,,46,,FALSE,2023-08-14 6:09,2024-01-22 6:09
U001324,Emma,Scott,emma.scott@nexloom.io,SE,LND,Asia/Kolkata,2023-10-24 0:00,Organic Search,WINTER25,Windows,1.0.9,51-200,Ops,0,unknown,,N,2023-10-24 10:13,2023-12-04
U002146,olivia,Martin,olivia.martin@gmail.com,FR,CA,America/New_York,09/30/2024,Webinar,SUMMER24,iOS,1.0.9,10-Jan,Founder,1,unknown,,TRUE,2024-09-30 9:16,2025-02-26 9:16
U001765,Liam,NGUYEN,liam.nguyen@outlook.com,SE,BER,America/Los_Angeles,08/30/2023,Webinar,AI-LAUNCH,Linux,2.0.1,unknown,Ops,1,54,,Y,2023-08-30 16:06,2023-10-05 16:06
U000837,Ben,Johnson,ben.johnson@nexloom.io,JP,,,2025-01-13 0:00,Paid Search,N/A,Unknown,1.2.1,51-200,Support,1,,,FALSE,2025-01-13 7:54,2025-05-20 7:54
U001877,Noah,Taylor, noah.taylor@yahoo.com ,MX,SP,,2024-05-13 0:00,Organic Search,BF2024,Android,1.2.1,unknown,Sales,0,63,,FALSE,2024-05-13 20:30,2024-05-20 20:30
U001063,Diego,Garcia,diego.garcia@proton.me,-,unknown,Europe/London,2024-08-22 0:00,Outbound,AI-LAUNCH,Android,2.0.1,201-500,Ops,0,31,,1,2024-08-22 18:52,2024-12-17 18:52
USR-000476,Sophia,Allen,sophia.allen@yahoo.com,JP,unknown,,2025-10-09 0:00,Organic Search,SPRING24,Unknown,1.3.0,501-1000,Engineering,1,52,,no,2025-10-09 14:31,2026-03-08 14:31
U001293,Liam,Wright, liam.wright@company.com ,BR,MH,Europe/London,2024-05-02,Webinar,RETARGET1,Linux,1.3.0,501-1000,Sales,0,49,,no,2024-05-02 13:22,2024-10-25 13:22
U000663,Yuki,Garcia,yuki.garcia@nexloom.io,MX,ON,Asia/Tokyo,2024-05-21 0:00,Organic Search,N/A,Android,2.0.0,201-500,Product,0,32,,TRUE,2024-05-21 18:08,2024-08-20
U000220,Sofia,Martin,SOFIA.MARTIN@PROTON.ME,SG,BC,America/New_York,2024-10-25,Outbound,SUMMER24,macOS,2.0.0,501-1000,Finance,0,42,,,2024-10-25 5:23,2025-01-03 5:23
U000192,Omar,Patel,omar.patel@nexloom.io,IN,SP,,2024-12-18 0:00,Content,AI-LAUNCH,iOS,1.1.2,201-500,Engineering,0,50,,N,2024-12-18 17:54,2025-01-08 17:54
U000345,Ethan,Thompson,ethan.thompson@proton.me,NL,BER,Asia/Tokyo,2024-02-06 0:00,Content,GROWTHLAB,Unknown,2.0.0,10-Jan,Engineering,0,25,,Y,02/06/2024 11:51,2024-07-20 11:51
U002537,Zoe,Garcia,zoe.garcia@proton.me,ZA,unknown,Europe/London,04-08-2024,Partner,SUMMER24,Windows,2.0.0,201-500,Marketing,1,40,,FALSE,2024-08-04 12:54,2024-10-21 12:54
U000780,Ivy,Johnson,ivy.johnson@yahoo.com,IN,SP,,2024-06-09 0:00,Webinar,GROWTHLAB,Windows,1.2.0,unknown,HR,0,35,,TRUE,2024-06-09 1:51,10-03-2024 01:51
U000238,Sara,Patel,sara.patel@nexloom.io,GB,NSW,America/Los_Angeles,2023-03-07 0:00,Paid Search,GROWTHLAB,iOS,1.1.0,501-1000,Sales,1,23,,FALSE,2023-03-07 22:27,2023-03-07 22:27
U002244,Olivia,Thompson,olivia.thompson@nexloom.io,SG,CA,,2025-10-27 0:00,Outbound,N/A,macOS,2.1.0,501-1000,Engineering,1,,,Y,2025-10-27 4:04,2026-04-24 4:04
U000182,Olivia,Robinson,olivia.robinson@icloud.com,ZA,WA,Europe/London,07/25/2023,partner,SUMMER24,iOS,1.1.2,501-1000,Sales,0,33,,FALSE,2023-07-25 10:35,2023-11-20 10:35
U000411,Sophia,Martin,sophia.martin@yahoo.com,IN,WA,UTC,2023-12-25 0:00,Social,Q3_PROMO,Linux,2.0.0,51-200,Support,1,57,,1,2023-12-25 8:38,2024-06-18 8:38
U000834,liam,Johnson,liam.johnson@proton.me,US,,Asia/Tokyo,2023-09-22 0:00,Organic Search,RETARGET1,macOS,1.2.0,51-200,Sales,0,,,no,2023-09-22 6:34,2024-02-28 6:34
U001553,Yuki,Patel,yuki.patel@nexloom.io,AU,unknown,,2024-09-28,Referral,SPRING24,Unknown,1.1.0,201-500,Ops,0,34,U000353,,2024-09-28 2:57,2024-10-22 2:57
U001070,Emma,Wilson,emma.wilson@gmail.com,JP,BER,America/New_York,2023-12-07 0:00,Organic Search,n/a,iOS,1.2.1,201-500,Marketing,0,46,,TRUE,2023-12-07 15:26,2024-03-17 15:26
U002164,Olivia,WILSON,olivia.wilson@icloud.com,GB,BER,Asia/Kolkata,2024-10-18 0:00,Referral,GROWTHLAB,Unknown,2.0.1,501-1000,Finance,0,57,U000168,yes,10/18/2024 08:08,2024-11-25 8:08
U001276,Zoe,Thompson, zoe.thompson@icloud.com ,FR,TX,UTC,2023-07-16 0:00,Webinar,RETARGET1,Unknown,1.2.0,501-1000,Engineering,0,33,,,2023-07-16 2:28,2023-11-22 2:28
U000130,Sara,Allen,sara.allen@proton.me,DE,,Asia/Tokyo,2024-04-03 0:00,Organic Search,SPRING24,Android,1.1.0,1000+,Product,0,53,,TRUE,2024-04-03 7:22,2024-08-13 7:22
U002161,Ethan,Lewis,ethan.lewis@outlook.com,ZA,ON,,2024-06-14 0:00,Webinar,RETARGET1,Unknown,1.2.1,51-200,Engineering,0,60,,yes,2024-06-14 14:21,2024-11-11 14:21
U000545,Ethan,Robinson,ethan.robinson@proton.me,ZA,SP,,2024-05-28 0:00,organic search,n/a,macOS,1.2.1,201-500,Sales,0,22,,yes,2024-05-28 11:54,2024-10-05 11:54
U002012,Leo,Anderson,leo.anderson@company.com,ZA,BC,Europe/London,2023-05-20 0:00,Partner,SUMMER24,Android,1.1.0,11-50,HR,1,39,,Y,2023-05-20 22:11,2023-06-09 22:11
U001496,Omar,DAVIS,omar.davis@gmail.com,US,WA,America/New_York,2024-06-23 0:00,Partner,RETARGET1,Android,1.1.2,201-500,HR,1,54,,N,2024-06-23 23:20,2024-11-14 23:20
U001851,Emma,Brown,emma.brown@nexloom.io,GB,WA,UTC,2023-12-06 0:00,Outbound,Q3_PROMO,Unknown,1.2.0,10-Jan,Ops,0,51,,TRUE,2023-12-06 14:44,03-01-2024 14:44
U002000,Mia,Wilson,mia.wilson@company.com,NL,,Europe/Berlin,2023-12-04 0:00,Content,N/A,macOS,2.0.0,51-200,Engineering,1,23,,no,2023-12-04 7:44,2024-05-10 7:44
U001907,Ivy,Harris,ivy.harrisoutlook.com,AU,BC,,2025-04-22 0:00,Outbound,SPRING24,Android,2.0.0,501-1000,Marketing,0,23,,no,2025-04-22 19:23,2025-08-03 19:23
U002456,Jin,Scott,jin.scott@yahoo.com,SE,RJ,America/Los_Angeles,08/20/2023,Partner,GROWTHLAB,Android,1.2.1,201-500,Engineering,0,37,,yes,2023-08-20 8:32,2023-11-13 8:32
U000051,Fatima,Martin,fatima.martin@company.com,DE,NSW,,2025-06-03 0:00,Content,SUMMER24,macOS,1.2.1,1000+,Engineering,0,46,,FALSE,2025-06-03 21:00,2025-10-31 21:00
U002425,Amir,Johnson,amir.johnson@nexloom.io,DE,NSW,America/New_York,2023-12-08 0:00,Social,N/A,macOS,2.0.1,51-200,Sales,1,53,,Y,2023-12-08 21:22,2024-01-07 21:22
U001973,Ivy,Moore,ivy.moore@proton.me,FR,,,11/28/2023,Organic Search,WINTER25,macOS,v1.1.0,201-500,Founder,0,53,,0,2023-11-28 7:19,2024-02-12 7:19
U000563,Hana,Perez,hana.perez@proton.me,GB,,Europe/London,2023-08-18 0:00,Referral,WINTER25,Android,1.0.9,unknown,Finance,0,62,U000434,TRUE,2023-08-18 13:57,2024-01-04 13:57
U001471,Yuki,Scott,yuki.scott@nexloom.io,FR,ON,Asia/Kolkata,2024-05-01 0:00,Partner,N/A,iOS,1.2.0,11-50,Founder,0,64,,0,2024-05-01 23:37,2024-05-08 23:37
U002541,Fatima,Garcia,fatima.garcia@company.com,MX,,America/Los_Angeles,2024-06-18 0:00,organic search,SPRING24,Android,1.1.2,201-500,Finance,0,30,,TRUE,2024-06-18 7:03,2024-10-18 7:03
U002062,Priya,Wright,priya.wright@icloud.com,AU,SP,America/Los_Angeles,2024-04-04 0:00,Social,SUMMER24,Unknown,2.1.0,unknown,Founder,1,49,,FALSE,2024-04-04 16:58,2024-04-11 16:58
U002270,Kofi,Jackson,kofi.jackson@proton.me,JP,WA,Europe/Berlin,04-04-2024,Partner,WINTER25,macOS,v1.3.0,11-50,Finance,0,37,,TRUE,04/04/2024 08:38,2024-06-13 8:38
U001571,Elena,Clark,elena.clark@icloud.com,MX,BER,,2024-05-11 0:00,Organic Search,WINTER25,Linux,v2.0.0,10-Jan,HR,0,32,,0,2024-05-11 18:38,2024-08-15 18:38
U001923,Mateo,White,mateo.white@nexloom.io,SG,,Asia/Tokyo,28-05-2024,Social,SPRING24,Windows,1.1.0,10-Jan,Finance,0,39,,FALSE,2024-05-28 12:37,2024-10-16 12:37
U001590,Lucas,Moore,lucas.moore@yahoo.com,NL,NY,Asia/Tokyo,2024-07-21 0:00,Social,GROWTHLAB,macOS,1.1.0,unknown,Ops,0,57,,FALSE,2024-07-21 23:42,2024-12-27 23:42
U002417,Kofi,Wilson,kofi.wilson@gmail.com,CA,NSW,,2024-01-30 0:00,Social,SUMMER24,Linux,1.3.0,10-Jan,HR,0,20,,FALSE,2024-01-30 18:22,2024-03-03 18:22
U000793,Nora,Lewis,nora.lewis@outlook.com,SG,BC,,2024-04-01 0:00,Partner,Q3_PROMO,Windows,2.0.1,501-1000,Founder,1,23,,FALSE,2024-04-01 6:16,04-01-2024 06:16
USR-001437,Mateo,Thomas,mateo.thomas@proton.me,US,CA,,12/19/2023,Referral,n/a,iOS,1.2.0,1000+,Ops,0,62,U000061,TRUE,2023-12-19 5:12,2024-02-28 5:12
U000112,Nora,Harris,nora.harris@nexloom.io,JP,-,America/Los_Angeles,2023-09-09 0:00,Social,AI-LAUNCH,Android,1.2.0,51-200,HR,0,N/A,,no,2023-09-09 5:07,2023-10-26 5:07
U001401,Liam,Smith,liam.smith@proton.me,GB,BC,Europe/London,09/14/2023,Partner,N/A,Linux,1.2.0,501-1000,HR,0,41,,0,2023-09-14 16:35,2023-12-05 16:35
U001811,Ravi,King,ravi.king@outlook.com,NL,BER,Asia/Kolkata,2024-06-19 0:00,Outbound,BF2024,Windows,1.3.0,10-Jan,Product,1,60,,FALSE,2024-06-19 10:19,2024-06-29 10:19
U002322,Ivy,Nguyen,ivy.nguyen@gmail.com,DE,unknown,Europe/London,2024-07-19 0:00,Webinar,SPRING24,Linux,1.0.9,201-500,Engineering,1,23,,no,2024-07-19 1:36,2025-01-12 1:36
U000790,Lucas,Martinez,lucas.martinez@company.com,SE,NSW,America/Los_Angeles,2025-03-21,Content,GROWTHLAB,Windows,1.1.0,11-50,Sales,0,45,,Y,2025-03-21 16:20,2025-04-11 16:20
U001994,Zoe,Lopez,zoe.lopez@company.com,CA,-,Europe/London,2023-08-17 0:00,Referral,GROWTHLAB,Android,1.2.0,51-200,Finance,1,41,,TRUE,2023-08-17 22:56,2023-11-28
U000777,Nora,Thompson,nora.thompson@icloud.com,ZA,ON,,2023-10-31 0:00,Paid Search,N/A,Android,2.0.0,501-1000,Engineering,1,31,,no,10/31/2023 13:01,2023-12-19 13:01
U001286,Omar,Martin,omar.martin@company.com,br,NY,Europe/Berlin,2024-04-06 0:00,Social,AI-LAUNCH,Windows,1.3.0,201-500,Marketing,1,55,,yes,2024-04-06 13:43,2024-06-22 13:43
U001164,Kofi,Walker,kofi.walker@yahoo.com,USA,SP,,2024-08-06 0:00,Outbound,Q3_PROMO,macOS,2.0.0,unknown,Finance,0,50,,N,2024-08-06 4:35,2024-09-03 4:35
U002337,Leo,Clark,leo.clark@company.com,AU,LND,,2024-03-07 0:00,Partner,AI-LAUNCH,Android,2.0.1,unknown,Ops,0,64,,Y,2024-03-07 17:11,2024-05-23 17:11
U000525,Chen,Anderson,chen.anderson@company.com,IN,SP,America/New_York,2024-10-15 0:00,Referral,n/a,iOS,1.1.2,1000+,Support,0,59,U000194,FALSE,2024-10-15 9:18,2025-03-10 9:18
U001789,Amir,Allen,amir.allen@company.com,SE,,Europe/Berlin,2023-05-26 0:00,Outbound,BF2024,Windows,1.1.0,201-500,Founder,0,,,TRUE,2023-05-26 16:25,2023-08-29 16:25
U000659,Sofia,Harris,sofia.harris@outlook.com,SG,WA,Europe/London,2024-06-11 0:00,Paid Search,SUMMER24,iOS,2.0.1,501-1000,Product,1,47,,FALSE,2024-06-11 8:10,09-22-2024 08:10
U000872,Zoe,Perez,zoe.perez@proton.me,U.K.,ON,America/New_York,2023-11-27 0:00,Content,SUMMER24,iOS,2.0.0,201-500,Marketing,1,53,  U000120,TRUE,2023-11-27 17:11,2024-03-12 17:11
U002558,Zoe,Walker,zoe.walker@icloud.com,ZA,TX,,2023-12-14 0:00,Referral,n/a,Windows,2.0.1,unknown,HR,0,23,U000217,N,2023-12-14 20:52,2024-05-12 20:52
U001942,Ravi,Walker,ravi.walker@yahoo.com,ZA,SP,America/Los_Angeles,2024-01-03 0:00,Content,AI-LAUNCH,macOS,2.0.0,201-500,Support,0,58,,1,2024-01-03 5:27,2024-05-14 5:27
U002243,Lucas,Martin,lucas.martin@gmail.com,IN,RJ,Asia/Tokyo,2024-05-09 0:00,Content,BF2024,iOS,2.0.0,201-500,Engineering,0,52,,FALSE,2024-05-09 2:42,2024-08-01 2:42
U001564,Amir,Nguyen,amir.nguyen@nexloom.io,NL,BER,,2023-11-29 0:00,Referral,GROWTHLAB,Windows,1.1.0,unknown,Engineering,0,36,U000468,Y,2023-11-29 0:57,2024-05-18 0:57
U001196,Kofi,Martin,kofi.martin@nexloom.io,IN,CA,Europe/Berlin,2024-11-17 0:00,Content,AI-LAUNCH,macOS,1.2.0,201-500,Sales,0,33,,TRUE,2024-11-17 10:20,2024-11-23 10:20
u001464,Mia,Thompson,mia.thompson@icloud.com,ZA,TX,America/Los_Angeles,2024-06-18 0:00,Partner,SPRING24,Linux,1.2.0,1000+,Product,0,56,,,2024-06-18 10:27,2024-09-01 10:27
U002486,Jin,Davis,jin.davisicloud.com,DE,BER,America/New_York,2025-07-27 0:00,Paid Search,Q3_PROMO,macOS,2.1.0,10-Jan,Marketing,0,35,,FALSE,2025-07-27 10:36,0000-00-00 00:00:00
U000031,Emma,Young,emma.young@icloud.com,MX,NSW,Asia/Tokyo,2024-05-22 0:00,Webinar,BF2024,Android,2.0.0,10-Jan,HR,0,38,,TRUE,2024-05-22 12:43,2024-06-24 12:43
U000041,Ava,Taylor,ava.taylor@nexloom.io,DE,BC,,2023-08-03 0:00,Organic Search,n/a,Windows,1.3.0,51-200,Founder,0,59,,yes,2023-08-03 10:00,2023-09-23
U001734,Amir,White,amir.white@outlook.com,US,MH,Asia/Tokyo,2024-02-20 0:00,Webinar,Q3_PROMO,Unknown,2.1.0,11-50,Support,0,43,,FALSE,2024-02-20 1:53,2024-06-21
U001470,Ethan,Garcia,ethan.garcia@nexloom.io,CA,BC,Europe/Berlin,2024-09-01 0:00,referral,RETARGET1,macOS,2.1.0,11-50,Product,0,45,,no,2024-09-01 12:25,2024-09-30 12:25
U001691,olivia,Davis,olivia.davisyahoo.com,CA,NSW,Europe/London,2023-09-20,Content,Q3_PROMO,Unknown,2.0.0,unknown,Marketing,0,32,,no,2023-09-20 5:48,2023-12-30 5:48
U001618,Jin,Thompson,jin.thompson@proton.me,MX,unknown,Asia/Kolkata,2024-06-20 0:00,Organic Search,RETARGET1,Linux,1.1.2,201-500,Support,0,,,FALSE,2024-06-20 12:51,2024-10-07 12:51
U001980,Fatima,Perez,fatima.perez@nexloom.io,BR,NSW,America/Los_Angeles,2024-10-18 0:00,Partner,SPRING24,iOS,1.2.1,10-Jan,Ops,0,63,,N,2024-10-18 9:12,2024-12-23 9:12
U000737,Chen,Garcia,chen.garcia@proton.me,DE,ON,,2024-02-03 0:00,Content,Q3_PROMO,Windows,1.3.0,201-500,Support,0,24,,0,2024-02-03 1:27,2024-03-17 1:27
U000993,Ivy,Lopez,ivy.lopez@yahoo.com,GB,RJ,Europe/London,11/27/2023,Webinar,BF2024,Linux,1.2.1,501-1000,HR,0,28,,N,2023-11-27 12:19,2024-04-04 12:19
U000415,Sara,Taylor,sara.taylor@icloud.com,CA,BER,UTC,06/04/2024,Partner,N/A,iOS,1.3.0,11-50,Founder,0,49,,no,2024-06-04 19:17,2024-07-09 19:17
U000980,Jin,Moore,jin.moore@outlook.com,IN,NSW,Asia/Kolkata,2024-05-16 0:00,Social,WINTER25,iOS,1.2.1,unknown,Engineering,0,31,,TRUE,2024-05-16 19:22,2024-08-09 19:22
U001168,Chen,Perez,chen.perez@gmail.com,SG,NY,Asia/Kolkata,2024-04-01 0:00,Partner,BF2024,Windows,2.0.0,201-500,Marketing,0,22,,Y,2024-04-01 22:43,2024-04-20 22:43
U000018,Hana,Moore,hana.moore@icloud.com,DE,MH,America/New_York,2024-04-10 0:00,Partner,N/A,Linux,1.1.2,1000+,Ops,0,64,,FALSE,2024-04-10 1:33,2024-04-23 1:33
USR-001672,Yuki,Smith,yuki.smith@proton.me,SG,,Europe/Berlin,2024-11-24 0:00,Partner,SUMMER24,Android,1.2.0,11-50,Finance,1,62,,FALSE,2024-11-24 6:11,2024-12-15 6:11
U002392,Liam,Lewis,liam.lewis@yahoo.com,IN,unknown,America/New_York,2023-09-14,Outbound,BF2024,iOS,v2.1.0,201-500,Engineering,0,46,,,2023-09-14 17:25,2023-10-23 17:25
U000974,Yuki,Lee,yuki.lee@company.com,BR,-,,2023-10-21,Outbound,GROWTHLAB,Linux,1.2.1,201-500,Ops,FALSE,32,,1,2023-10-21 7:45,2023-10-27 7:45
U002194,Hana,Clark, hana.clark@company.com ,CA,NSW,Europe/Berlin,2024-04-28 0:00,Partner,SPRING24,Windows,1.3.0,501-1000,Engineering,0,34,,1,2024-04-28 2:18,2024-07-23 2:18
U000809,Noah,Brown,noah.brown@proton.me,DE,,Asia/Kolkata,2024-03-04 0:00,Social,Q3_PROMO,iOS,2.0.1,unknown,Finance,0,59,,yes,2024-03-04 15:44,2024-04-28 15:44
U000591,Omar,Moore,omar.moore@gmail.com,NL,RJ,UTC,2023-08-20 0:00,Outbound,RETARGET1,Windows,2.0.0,10-Jan,Founder,0,59,,1,2023-08-20 13:47,2024-01-08 13:47
U000575,Olivia,Martin,olivia.martin@outlook.com,FR,SP,Asia/Tokyo,2024-11-07 0:00,Outbound,SPRING24,Unknown,1.3.0,10-Jan,Ops,0,49,,1,2024-11-07 17:59,2025-01-12 17:59
U001395,Mia,Wright,mia.wright@outlook.com,MX,unknown,Asia/Kolkata,2024-01-04 0:00,Outbound,BF2024,Unknown,1.3.0,1000+,Ops,0,18,,yes,2024-01-04 14:19,2024-01-30 14:19
U000084,Jin,Anderson,jin.andersongmail.com,SE,BC,UTC,2023-05-21 0:00,Social,AI-LAUNCH,Unknown,2.0.0,51-200,Support,0,26,,N,2023-05-21 20:56,2023-08-20 20:56
U000228,Ben,Moore,ben.moore@icloud.com,FR,TX,UTC,2024-02-03 0:00,Referral,RETARGET1,macOS,1.2.1,unknown,Marketing,0,25,U000297,,2024-02-03 5:39,2024-05-22 5:39
U002309,Mateo,Lewis,mateo.lewis@outlook.com,US,NY,,2023-07-26 0:00,Partner,Q3_PROMO,iOS,1.0.9,51-200,Engineering,0,33,,FALSE,2023-07-26 23:16,2024-01-06 23:16
U001383,Nora,Walker,NORA.WALKER@NEXLOOM.IO,JP,unknown,Europe/Berlin,2025-06-02 0:00,Referral,RETARGET1,iOS,1.0.9,51-200,Product,0,50,,0,2025-06-02 10:58,2025-08-01 10:58
U000643,Omar,Davis,omar.davis@outlook.com,DE,SP,America/Los_Angeles,2023-10-18 0:00,Paid Search,SUMMER24,macOS,1.2.0,501-1000,Finance,0,59,,N,2023-10-18 5:14,2023-10-24 5:14
U000792,Mateo,King,mateo.king@yahoo.com,SG,LND,,2024-05-11 0:00,Webinar,RETARGET1,Windows,1.1.0,11-50,Finance,0,18,,,2024-05-11 3:31,2024-06-21 3:31
U001974,Nora,Allen,nora.allen@icloud.com,AU,BC,,2024-04-07 0:00,Referral,BF2024,Linux,2.0.1,51-200,Engineering,1,43,U000009,TRUE,2024-04-07 21:24,2024-06-11
U001187,Sophia,Jackson,sophia.jackson@company.com,AU,NY,Europe/London,2024-07-04 0:00,Content,SPRING24,iOS,1.2.1,11-50,HR,0,49,,FALSE,07/04/2024 18:57,2024-11-20 18:57
U001619,Emma,Scott,emma.scott@icloud.com,ca,-,America/Los_Angeles,2024-04-27 0:00,Organic Search,n/a,Unknown,1.0.9,201-500,Marketing,0,60,,0,2024-04-27 23:11,2024-05-12 23:11
U002304,Hana,White,hana.white@icloud.com,DE,-,,2023-12-10 0:00,Outbound,GROWTHLAB,Linux,1.0.9,11-50,Product,1,53,,FALSE,2023-12-10 22:28,2024-03-31 22:28
U002575,Mateo,Taylor,mateo.taylor@icloud.com,JP,,Europe/London,2023-10-28 0:00,Content,WINTER25,iOS,v1.3.0,201-500,Sales,0,53,,,2023-10-28 6:39,2024-03-21 6:39
U001131,Chen,Perez,chen.perez@outlook.com,BR,unknown,,2024-07-25 0:00,Content,Q3_PROMO,Linux,2.1.0,unknown,Finance,1,43,,N,2024-07-25 13:13,2024-07-27
U002531,Nora,Thomas,nora.thomas@proton.me,US,TX,Asia/Kolkata,2024-06-28 0:00,Organic Search,GROWTHLAB,Windows,1.1.2,10-Jan,Founder,0,52,,TRUE,2024-06-28 6:59,07-14-2024 06:59
U002191,Ravi,Robinson,ravi.robinson@yahoo.com,FR,BER,Europe/Berlin,2023-11-20 0:00,Social,N/A,Windows,1.2.0,201-500,Sales,0,48,,0,2023-11-20 2:28,2023-12-23 2:28
U002383,Mateo,Martinez,mateo.martinez@nexloom.io,DE,CA,Asia/Tokyo,01/16/2025,Partner,BF2024,macOS,v2.0.0,10-Jan,Ops,0,28,,,2025-01-16 10:33,2025-06-27 10:33
U001199,Zoe,Nguyen,zoe.nguyen@proton.me,JP,-,Europe/Berlin,2024-08-10 0:00,Social,SPRING24,iOS,1.1.0,501-1000,Support,0,58,U00000X,N,2024-08-10 14:36,2024-11-12 14:36
U001202,Kofi,Garcia,kofi.garciayahoo.com,US,LND,America/Los_Angeles,2023-03-07 0:00,Partner,AI-LAUNCH,Windows,2.0.1,11-50,Product,0,61,,TRUE,2023-03-07 21:15,2023-04-16 21:15
U001366,Ethan,Martin,ethan.martin@proton.me,GB,LND,UTC,2023-08-13 0:00,Content,N/A,macOS,1.1.0,201-500,Engineering,0,34,,TRUE,2023-08-13 11:23,
U000885,Anya,White,anya.white@yahoo.com,US,SP,Europe/London,2024-09-13 0:00,Social,,Unknown,1.0.9,51-200,Finance,0,63,,,2024-09-13 22:09,2024-09-22 22:09
U002202,Ben,Allen,ben.allen@yahoo.com,IN,,Europe/London,2023-07-22 0:00,Organic Search,n/a,Windows,1.2.0,1000+,Marketing,0,46,,0,07/22/2023 05:08,2023-12-10 5:08
U000721,Hana,Robinson,hana.robinson@yahoo.com,FR,NY,America/Los_Angeles,2025-02-27,Social,SUMMER24,iOS,1.1.2,unknown,Marketing,0,45,,TRUE,2025-02-27 2:41,2025-03-16 2:41
U002239,Sara,Smith,sara.smith@outlook.com,US,BC,America/Los_Angeles,06/13/2023,Content,WINTER25,Linux,1.2.1,201-500,Ops,0,56,,0,2023-06-13 5:57,2023-10-14 5:57
U001772,Ravi,Perez, ravi.perez@proton.me ,AU,ON,UTC,2024-09-02,Content,Q3_PROMO,macOS,1.1.0,51-200,Ops,0,52,,0,2024-09-02 13:58,2024-12-19 13:58
U002284,Yuki,Young,yuki.young@proton.me,US,ON,,2023-04-21 0:00,Outbound,N/A,Windows,2.0.1,501-1000,Support,0,38,,FALSE,2023-04-21 0:22,05-17-2023 00:22
U002372,Nora,Thompson,nora.thompson@outlook.com,JP,,UTC,2024-10-21,Outbound,SUMMER24,Windows,2.0.1,1000+,Engineering,0,48,,1,2024-10-21 1:03,2024-12-13 1:03
U001546,Priya,Allen,priya.allen@icloud.com,AU,unknown,Europe/London,2024-03-20 0:00,Partner,AI-LAUNCH,iOS,v1.2.0,51-200,Founder,0,unknown,,TRUE,2024-03-20 22:44,2024-07-30 22:44
U000410,Fatima,MARTINEZ,fatima.martinez@icloud.com,jp,SP,Europe/London,2023-06-29 0:00,Paid Search,WINTER25,Android,2.1.0,11-50,Founder,1,23,,TRUE,2023-06-29 7:27,2023-07-31 7:27
U000452,Elena,Clark,elena.clark@proton.me,FR,NSW,Asia/Kolkata,2024-04-27 0:00,Social,GROWTHLAB,macOS,v2.1.0,10-Jan,Product,1,19,,FALSE,2024-04-27 3:44,2024-08-22 3:44
U002336,Zoe,Scott,zoe.scott@outlook.com,SE,,Europe/London,2024-01-29 0:00,partner,SUMMER24,Linux,1.2.0,501-1000,Marketing,FALSE,45,,TRUE,2024-01-29 13:00,2024-05-03 13:00
U001116,Anya,Clark,ANYA.CLARKCOMPANY.COM,MX,NY,Asia/Kolkata,2024-05-08 0:00,Content,SUMMER24,Unknown,1.3.0,51-200,Sales,0,52,,yes,2024-05-08 10:20,2024-08-02 10:20
U000285,Zoe,Nguyen,zoe.nguyengmail.com,SG,NY,Asia/Kolkata,05/07/2024,Webinar,N/A,Unknown,1.2.0,11-50,Finance,0,22,,FALSE,2024-05-07 15:04,2024-08-10 15:04
U000887,Elena,Lewis,elena.lewis@gmail.com,FR,ON,Asia/Kolkata,2024-06-15 0:00,Webinar,BF2024,iOS,2.0.1,201-500,Ops,1,55,,0,2024-06-15 18:17,2024-07-25 18:17
U002195,Ivy,Anderson,ivy.anderson@icloud.com,CA,-,Asia/Tokyo,2023-07-23 0:00,Outbound,SPRING24,Windows,1.1.0,11-50,Support,0,57,,TRUE,2023-07-23 15:10,2023-09-28 15:10
U000612,Nora,Wright,nora.wright@icloud.com,US,RJ,Europe/London,2024-09-13 0:00,Paid Search,BF2024,Linux,v1.1.0,10-Jan,Sales,0,27,,TRUE,2024-09-13 12:39,2025-02-05 12:39
U001384,Olivia,Brown,olivia.brown@outlook.com,NL,RJ,America/Los_Angeles,2023-11-19 0:00,Social,BF2024,Windows,1.0.9,10-Jan,Marketing,0,unknown,,yes,2023-11-19 23:39,2024-03-09 23:39
U002078,Liam,Scott,liam.scott@nexloom.io,GB,NY,UTC,2024-03-04 0:00,Social,BF2024,iOS,2.1.0,unknown,Founder,1,46,,N,2024-03-04 8:59,2024-08-22 8:59
U001361,Sara,Lewis,sara.lewis@yahoo.com,NL,BER,Asia/Tokyo,2025-01-09 0:00,Paid Search,SUMMER24,Unknown,1.0.9,unknown,Finance,1,28,,FALSE,2025-01-09 12:05,2025-04-21 12:05
U000184,Sophia,Martinez,sophia.martinez@proton.me,MX,RJ,Asia/Kolkata,23-11-2024,Social,GROWTHLAB,Unknown,1.2.0,unknown,Marketing,0,48,,TRUE,2024-11-23 1:51,2025-05-18 1:51
U001814,Anya,Thomas,anya.thomas@proton.me,AU,-,Europe/London,2023-02-27 0:00,Paid Search,RETARGET1,Windows,2.1.0,201-500,Ops,0,20,,1,2023-02-27 17:32,2023-06-29 17:32
U000118,Lucas,Brown,lucas.brown@proton.me,FR,SP,,30-09-2023,Outbound,GROWTHLAB,Linux,v1.2.1,201-500,Ops,1,,,N,2023-09-30 2:18,2024-01-05 2:18
U002126,Olivia,Martinez,olivia.martinez@outlook.com,ZA,SP,,2024-06-23 0:00,Social,RETARGET1,iOS,1.1.0,unknown,Ops,0,19,,FALSE,2024-06-23 7:54,2024-07-08 7:54
U001473,Mateo,Thomas,mateo.thomasyahoo.com,CA,SP,Europe/London,2024-11-24 0:00,outbound,RETARGET1,iOS,2.0.1,1000+,Product,0,62,,0,2024-11-24 22:37,2025-04-10 22:37
U001094,Ethan,Anderson,ethan.anderson@gmail.com,SG,MH,America/New_York,2024-04-04 0:00,Webinar,N/A,Unknown,1.0.9,51-200,Finance,0,51,,TRUE,2024-04-04 1:08,2024-08-24 1:08
U000385,Noah,Thompson,noah.thompson@outlook.com,FR,CA,America/New_York,01-08-2024,Referral,n/a,macOS,1.1.2,10-Jan,HR,0,50,U000383,no,2024-08-01 4:40,2024-10-21 4:40
U001538,Priya,Wilson,priya.wilson@outlook.com,ZA,TX,Asia/Kolkata,2024-06-30 0:00,Partner,RETARGET1,Android,1.2.0,1000+,Marketing,1,18,,,2024-06-30 1:55,2024-12-01 1:55
U000554,Ethan,Walker,ethan.walker@company.com,GB,CA,Asia/Kolkata,2024-04-28 0:00,Content,SPRING24,macOS,1.2.0,51-200,Engineering,1,64,,1,2024-04-28 0:46,2024-06-20 0:46
U000959,Ben,White,ben.white@gmail.com,AU,SP,Asia/Kolkata,2023-09-13 0:00,Partner,Q3_PROMO,Android,2.0.1,11-50,Ops,0,40,,yes,2023-09-13 10:56,2023-12-01 10:56
U000088,Zoe,Allen,zoe.allen@yahoo.com,BR,unknown,Europe/London,2024-06-07 0:00,Outbound,AI-LAUNCH,Unknown,1.0.9,501-1000,Marketing,0,,,TRUE,2024-06-07 14:51,2024-07-28 14:51
U002046,Omar,Allen,omar.allen@icloud.com,SE,CA,America/New_York,2024-07-24 0:00,Social,N/A,Windows,1.2.1,201-500,Product,FALSE,36,,yes,07/24/2024 21:44,2024-09-05 21:44
U000632,Priya,Lee,priya.lee@icloud.com,MX,-,Europe/London,2024-12-15 0:00,Paid Search,null,Android,1.0.9,10-Jan,Ops,1,32,,Y,2024-12-15 17:27,2025-06-02 17:27
U000703,Lucas,Martin,lucas.martin@gmail.com,JP,BER,,2024-01-04 0:00,Webinar,SPRING24,Linux,2.1.0,11-50,Product,0,35,,N,2024-01-04 11:45,2024-05-30 11:45
U000426,Zoe,Harris,ZOE.HARRIS@COMPANY.COM,US,BC,Europe/Berlin,2024-04-22,Webinar,N/A,Windows,2.0.1,unknown,Finance,0,18,,TRUE,2024-04-22 14:09,2024-05-20 14:09
U001739,Ravi,King,ravi.king@yahoo.com,SG,NY,Asia/Kolkata,2024-01-21 0:00,Paid Search,N/A,Android,1.2.0,unknown,Engineering,0,49,,yes,2024-01-21 23:58,2024-04-09 23:58
U001095,Chen,Allen,chen.allen@nexloom.io,FR,,America/Los_Angeles,11/01/2023,Partner,WINTER25,Windows,1.2.0,10-Jan,Finance,1,26,,no,2023-11-01 20:20,2023-12-24 20:20
U000742,Sara,Lopez,SARA.LOPEZPROTON.ME,IN,RJ,Asia/Tokyo,2023-12-15,Webinar,AI-LAUNCH,Android,2.0.1,unknown,Sales,0,25,,Y,2023-12-15 17:02,2024-02-25 17:02
U000038,Amir,King,amir.king@nexloom.io,mx,MH,,2023-07-07 0:00,Referral,n/a,Unknown,1.1.2,1000+,Sales,0,57,U000023,FALSE,2023-07-07 12:33,2023-12-27 12:33
U001024,Ben,Davis,ben.davis@proton.me,BR,NSW,Asia/Tokyo,2025-06-09 0:00,Partner,AI-LAUNCH,Android,1.1.0,51-200,Product,0,30,,,2025-06-09 11:14,2025-11-28 11:14
U000577,Sofia,Martinez,sofia.martinez@outlook.com,US,NY,Asia/Tokyo,08/28/2023,Organic Search,WINTER25,Windows,1.2.0,10-Jan,Finance,1,46,,N,2023-08-28 19:54,2023-10-17 19:54
U001549,Fatima,Lee,fatima.lee@proton.me,GB,-,Europe/Berlin,2023-04-16 0:00,Referral,n/a,Unknown,1.1.2,10-Jan,Sales,1,61,U000497,no,2023-04-16 1:51,2023-05-18 1:51
U002127,Ethan,Wright,ethan.wright@icloud.com,JP,TX,Asia/Tokyo,2024-06-05 0:00,Partner,RETARGET1,Windows,2.0.0,10-Jan,Product,0,40,,N,2024-06-05 20:59,2024-07-25 20:59
U001189,Hana,Jackson,hana.jackson@company.com,AU,LND,,2024-13-05,Paid Search,WINTER25,Windows,1.3.0,unknown,HR,0,48,,N,2023-12-15 14:43,2024-03-21 14:43
U001998,emma,Walker,emma.walker@nexloom.io,ZA,ON,America/New_York,2023-05-30 0:00,Social,AI-LAUNCH,Windows,1.1.2,201-500,Support,0,56,,Y,2023-05-30 13:56,2023-06-21 13:56
U000451,Leo,White, leo.white@nexloom.io ,JP,SP,Europe/London,2024-08-28 0:00,Paid Search,N/A,Linux,v2.0.1,201-500,Engineering,1,49,,Y,2024-08-28 23:02,2024-09-22 23:02
U001692,Fatima,Scott,fatima.scott@yahoo.com,GB,RJ,UTC,2024-03-30 0:00,Partner,BF2024,iOS,1.2.1,201-500,HR,1,37,,1,2024-03-30 10:33,2024-09-21 10:33
U001845,Nora,Scott,nora.scott@icloud.com,US,BER,America/New_York,2025-03-10 0:00,Outbound,GROWTHLAB,Windows,2.0.1,unknown,HR,1,39,,N,2025-03-10 0:56,2025-04-28 0:56
U002081,Ava,Allen,ava.allen@gmail.com,GB,unknown,,2023-03-13 0:00,Organic Search,n/a,Linux,2.0.1,51-200,Engineering,0,24,,Y,2023-03-13 13:26,2023-04-27 13:26
U000810,Fatima,Martin,fatima.martin@proton.me,CA,TX,UTC,2023-07-25,webinar,Q3_PROMO,macOS,2.0.0,unknown,Marketing,1,43,,1,2023-07-25 16:49,2023-08-13 16:49
 U002344 ,Olivia,Jackson,olivia.jackson@icloud.com,NL,ON,America/Los_Angeles,2024-01-14,Social,RETARGET1,Windows,2.0.0,501-1000,Finance,0,40,,no,2024-01-14 19:37,2024-03-22 19:37
U000741,Anya,Harris,anya.harris@proton.me,SG,RJ,,2024-03-10 0:00,Social,Q3_PROMO,macOS,2.1.0,51-200,HR,0,unknown,,Y,2024-03-10 1:30,2024-04-18 1:30
U001404,Ava,Perez,ava.perez@gmail.com,za,LND,Europe/London,2024-08-02 0:00,Organic Search,n/a,iOS,1.1.0,unknown,Finance,TRUE,26,,no,2024-08-02 7:52,2025-01-09 7:52
U000756,Ivy,Perez,ivy.perez@icloud.com,AU,CA,UTC,2024-09-09 0:00,Paid Search,Q3_PROMO,Linux,1.2.0,201-500,Product,0,63,,Y,2024-09-09 11:44,2025-02-23 11:44
U000889,Ethan,Scott,ethan.scottcompany.com,FR,ON,,2023-07-09 0:00,Partner,N/A,Linux,2.1.0,10-Jan,Founder,1,60,,yes,2023-07-09 16:49,2023-09-16 16:49
U002312,Jin,Harris,jin.harrisnexloom.io,br,NSW,,2024-11-20 0:00,Outbound,WINTER25,iOS,1.3.0,unknown,Product,0,59,,N,2024-11-20 7:39,2024-12-21 7:39
U001795,Noah,Garcia,noah.garcia@proton.me,ZA,CA,America/Los_Angeles,2023-04-13 0:00,Referral,AI-LAUNCH,macOS,1.2.0,unknown,Founder,0,21,U000225,Y,2023-04-13 11:37,2023-09-20 11:37
u001678,Sofia,Clark,sofia.clark@proton.me,de,RJ,Europe/London,2024-02-08 0:00,Webinar,Q3_PROMO,iOS,1.1.0,501-1000,Founder,0,unknown,,TRUE,2024-02-08 19:58,2024-06-28 19:58
U001220,Ivy,Smith,ivy.smith@gmail.com,SG,,,2023-11-28 0:00,Paid Search,SPRING24,Windows,1.0.9,11-50,Ops,1,52,,yes,2023-11-28 6:30,2023-11-30 6:30
U001235,Yuki,Thompson,yuki.thompson@nexloom.io,MX,,America/Los_Angeles,2024-06-14,Social,WINTER25,macOS,1.2.0,10-Jan,Ops,1,43,,Y,2024-06-14 12:38,
U001034,Ava,Taylor,ava.taylor@icloud.com,fr,NY,UTC,2023-08-02 0:00,Content,AI-LAUNCH,Windows,2.0.1,unknown,Marketing,1,N/A,,,2023-08-02 21:40,2023-09-16 21:40
U000941,Ava,Thomas,ava.thomas@gmail.com,MX,,,2023-11-29 0:00,Webinar,RETARGET1,iOS,1.3.0,501-1000,Marketing,0,unknown,,yes,2023-11-29 7:49,2024-05-10 7:49
U001450,Omar,Smith,omar.smith@gmail.com,US,,UTC,2024-07-02 0:00,Referral,SPRING24,Unknown,1.3.0,501-1000,Founder,0,36,U000393,FALSE,2024-07-02 18:18,2024-08-17 18:18
U002544,Olivia,Wright,olivia.wright@icloud.com,JP,NY,Asia/Tokyo,2024-05-25 0:00,Paid Search,RETARGET1,iOS,1.1.0,11-50,Sales,0,41,,,2024-05-25 16:16,2024-09-08 16:16
U001928,Ava,Anderson,ava.anderson@gmail.com,CA,unknown,Europe/Berlin,2024-03-19 0:00,Organic Search,n/a,Unknown,2.0.1,unknown,Support,0,61,,,2024-03-19 22:36,2024-09-01 22:36
U001636,Jin,Anderson,jin.anderson@company.com,GB,CA,America/New_York,2023-11-03 0:00,Outbound,WINTER25,Android,2.0.0,501-1000,Ops,0,N/A,,N,2023-11-03 10:09,2023-11-27 10:09
U001436,Leo,Johnson,leo.johnson@yahoo.com,AU,CA,Asia/Tokyo,2023-03-20 0:00,Referral,N/A,Windows,1.0.9,501-1000,Product,1,51,,yes,2023-03-20 1:52,2023-05-24 1:52
U000189,Mia,Martinez,mia.martinez@outlook.com,GB,MH,Asia/Kolkata,2024-04-12 0:00,Content,Q3_PROMO,iOS,1.0.9,201-500,Support,0,45,,Y,2024-04-12 16:46,2024-05-20 16:46
U000473,Lucas,King,lucas.king@outlook.com,CA,RJ,Europe/London,2023-04-16 0:00,Outbound,BF2024,Android,1.3.0,51-200,Finance,0,47,,0,2023-04-16 23:42,2023-06-14 23:42
U002099,Diego,Davis, diego.davis@company.com ,SG,CA,Asia/Kolkata,2024-09-12 0:00,Webinar,N/A,Windows,2.0.1,51-200,Finance,0,53,,yes,2024-09-12 2:57,2025-02-20 2:57
U001238,Sara,Martin,sara.martin@proton.me,MX,NSW,America/Los_Angeles,15-03-2024,Content,RETARGET1,Linux,2.0.1,51-200,Sales,0,22,,no,2024-03-15 8:23,2024-05-14 8:23
U001601,Chen,Wright,CHEN.WRIGHT@YAHOO.COM,za,BER,Europe/London,2023-10-04 0:00,Content,AI-LAUNCH,Android,1.0.9,1000+,Marketing,0,62,,1,2023-10-04 13:14,2023-12-14 13:14
U001426,Chen,Jackson,chen.jackson@yahoo.com,JP,RJ,America/Los_Angeles,2025-05-16 0:00,Paid Search,SPRING24,Linux,2.0.1,1000+,Sales,1,35,,TRUE,2025-05-16 7:19,2025-05-22 7:19
U002391,Olivia,White,olivia.white@yahoo.com,NL,LND,Asia/Kolkata,2024-01-25 0:00,Referral,Q3_PROMO,Unknown,2.0.1,11-50,Ops,0,48,U000431,no,2024-01-25 22:11,2024-06-18 22:11
U000995,Nora,Thompson,nora.thompson@proton.me,US,ON,,01/17/2024,Content,WINTER25,Unknown,1.2.0,11-50,HR,0,,,TRUE,2024-01-17 22:44,2024-02-05 22:44
U002151,Ava,Brown,ava.brown@icloud.com,SG,CA,Europe/London,2024-01-03 0:00,Webinar,GROWTHLAB,iOS,1.0.9,201-500,Ops,1,40,,FALSE,2024-01-03 14:40,2024-06-27
U001913,Sara,Walker,sara.walker@icloud.com,mx,-,Europe/Berlin,2025-11-03 0:00,Organic Search,n/a,Windows,1.1.0,unknown,Support,1,38,,TRUE,2025-11-03 6:26,2026-03-16
U001708,Lucas,Patel,lucas.patel@yahoo.com,GB,BER,Asia/Kolkata,2023-10-22 0:00,Organic Search,BF2024,Linux,1.1.2,501-1000,Marketing,0,44,,FALSE,2023-10-22 23:38,2024-03-05 23:38
U002397,Noah,Lopez,noah.lopez@proton.me,ZA,NSW,,09/03/2023,Referral,WINTER25,Windows,1.3.0,unknown,Founder,no,,U000458,1,2023-09-03 4:20,2024-01-22 4:20
U000140,Noah,Scott,noah.scott@icloud.com,JP,RJ,,2023-11-01,Paid Search,N/A,Windows,1.3.0,1000+,HR,0,56,,Y,2023-11-01 5:13,2024-02-08 5:13
U000816,Priya,Clark,priya.clark@icloud.com,AU,NY,Europe/London,2024-04-07 0:00,Organic Search,GROWTHLAB,Unknown,2.0.1,11-50,Support,0,,,TRUE,2024-04-07 22:37,2024-05-11
U000926,Ethan,Allen,ethan.allen@yahoo.com,IN,TX,,2023-03-02 0:00,Organic Search,SPRING24,Linux,1.1.2,1000+,Support,0,52,,TRUE,2023-03-02 18:11,2023-06-24 18:11
U000614,Elena,CLARK,elena.clark@company.com,FR,MH,,2023-06-17,Partner,SUMMER24,Android,1.1.2,201-500,Product,0,18,,N,2023-06-17 2:08,09-18-2023 02:08
U001455,Sara,Anderson,sara.anderson@gmail.com,AU,unknown,America/Los_Angeles,2023-03-21 0:00,Outbound,AI-LAUNCH,iOS,1.1.2,11-50,Finance,0,38,,FALSE,2023-03-21 16:37,2023-09-06
U002349,Mateo,Thompson,mateo.thompson@nexloom.io,NL,LND,Asia/Tokyo,2024-05-15 0:00,Outbound,GROWTHLAB,iOS,1.0.9,unknown,HR,0,56,U00000X,1,2024-05-15 19:01,2024-10-09 19:01
U002473,Mia,Smith,MIA.SMITH@NEXLOOM.IO,SE,MH,America/Los_Angeles,2025-01-05 0:00,Outbound,SUMMER24,Linux,1.2.0,unknown,HR,1,48,,Y,2025-01-05 13:14,2025-03-16 13:14
U002155,Noah,Anderson,noah.anderson@company.com,SE,-,,2023-07-11 0:00,Partner,AI-LAUNCH,Unknown,1.1.0,51-200,Engineering,0,20,,TRUE,2023-07-11 23:41,2023-11-17 23:41
U001635,Ethan,Robinson,ethan.robinson@icloud.com,SG,-,Asia/Kolkata,2025-02-04 0:00,Organic Search,,macOS,1.3.0,201-500,Founder,0,52,,FALSE,2025-02-04 16:50,2025-02-13 16:50
U000436,Ethan,Walker,ethan.walker@proton.me,GB,NSW,America/Los_Angeles,2024-07-12 0:00,Social,SUMMER24,macOS,2.0.1,1000+,Founder,0,37,,TRUE,2024-07-12 3:13,2024-10-30 3:13
U001762,Anya,Clark,anya.clark@icloud.com,SE,RJ,,2024-10-20 0:00,Webinar,GROWTHLAB,Unknown,2.0.0,1000+,Finance,0,20,,0,2024-10-20 16:04,2024-10-25 16:04
U001520,Nora,Nguyen,nora.nguyen@yahoo.com,BR,unknown,,2025-02-04 0:00,Outbound,N/A,Unknown,1.3.0,51-200,Support,0,28,,yes,2025-02-04 23:25,2025-06-01 23:25
U000754,Ivy,Allen,ivy.allen@gmail.com,JP,BC,UTC,2024-01-03 0:00,Webinar,N/A,Unknown,1.3.0,201-500,Marketing,FALSE,27,,N,2024-01-03 6:56,2024-05-30
U000535,Anya,Taylor,anya.taylor@nexloom.io,SE,MH,UTC,2024-08-22 0:00,Paid Search,N/A,Windows,2.1.0,501-1000,Sales,0,52,,yes,2024-08-22 4:02,2025-01-04 4:02
U000557,Mateo,Clark,MATEO.CLARK@ICLOUD.COM,US,WA,America/Los_Angeles,2023-08-15 0:00,Paid Search,  BF2024  ,Linux,2.0.0,51-200,Finance,0,33,,TRUE,2023-08-15 4:03,11-26-2023 04:03
U002157,Zoe,Johnson,zoe.johnson@gmail.com,JP,MH,,2023-08-23 0:00,Partner,N/A,Unknown,1.1.2,201-500,Sales,0,N/A,,no,2023-08-23 9:29,2023-10-18
U002187,Sophia,Young,sophia.young@proton.me,SE,MH,Asia/Kolkata,2024-11-16 0:00,Content,SPRING24,Windows,1.1.0,1000+,Support,0,43,,N,2024-11-16 20:29,2025-01-16 20:29
U000422,Ethan,Anderson,ethan.anderson@company.com,SE,RJ,America/Los_Angeles,2024-09-06 0:00,Paid Search,WINTER25,macOS,1.2.0,unknown,Founder,0,57,,Y,2024-09-06 2:04,2024-11-13 2:04
U002035,Omar,Scott,omar.scott@gmail.com,ZA,WA,UTC,2024-05-23 0:00,Partner,BF2024,Linux,1.3.0,10-Jan,Marketing,0,34,,TRUE,2024-05-23 11:35,09-09-2024 11:35
U002577,Diego,Taylor,diego.taylor@outlook.com,GB,BC,Asia/Kolkata,2025-07-17 0:00,Referral,Q3_PROMO,Unknown,1.2.0,10-Jan,Product,0,22,,no,2025-07-17 6:41,2025-11-05 6:41
U000166,Sofia,Smith, sofia.smith@gmail.com ,FR,BER,Asia/Tokyo,2024-10-12 0:00,Organic Search,GROWTHLAB,iOS,1.2.0,1000+,Ops,1,,,0,2024-10-12 15:26,2025-02-13 15:26
U000964,Emma,Young,emma.young@icloud.com,IN,SP,Europe/London,2024-02-01 0:00,Social,SUMMER24,Android,1.0.9,1000+,Sales,1,46,,TRUE,2024-02-01 0:17,2024-06-24 0:17
U001645,Hana,Anderson,hana.anderson@icloud.com,SG,MH,Europe/Berlin,27-06-2023,Webinar,SUMMER24,Windows,1.2.1,unknown,Finance,1,36,,,2023-06-27 23:51,2023-07-19 23:51
U000603,Yuki,Robinson,yuki.robinson@icloud.com,SG,-,Europe/London,2023-09-22 0:00,Outbound,AI-LAUNCH,Windows,1.0.9,unknown,Ops,0,27,,TRUE,2023-09-22 5:27,2024-03-10 5:27
U000141,diego,Robinson,diego.robinson@gmail.com,CA,NY,UTC,2025-05-06 0:00,Referral,SUMMER24,macOS,1.3.0,11-50,Marketing,1,unknown,U000338,1,2025-05-06 4:29,2025-06-26
U002275,Ava,Walker,ava.walker@outlook.com,BR,,,30-03-2025,Social,SPRING24,iOS,1.3.0,11-50,Marketing,0,58,,Y,2025-03-30 11:45,2025-08-21 11:45
U001318,Lucas,Smith,lucas.smith@company.com,United States,TX,America/Los_Angeles,2024-07-30 0:00,Referral,n/a,Android,1.3.0,unknown,Support,1,54,U000028,FALSE,2024-07-30 4:28,2024-12-07 4:28
U001744,Diego,Clark,diego.clark@company.com,ZA,MH,America/Los_Angeles,03-45-2024,Partner,N/A,Unknown,2.1.0,201-500,Support,1,41,,no,2023-02-01 21:27,2023-04-06 21:27
U000104,Ravi,Jackson,ravi.jackson@gmail.com,AU,SP,,04/02/2024,Partner,GROWTHLAB,Unknown,1.2.1,10-Jan,Finance,0,44,,TRUE,2024-04-02 21:10,2024-07-24 21:10
U001500,Chen,Wilson,chen.wilson@proton.me,IN,RJ,Asia/Tokyo,2024-11-08 0:00,Organic Search,RETARGET1,Windows,1.2.1,51-200,Ops,1,19,,0,2024-11-08 22:08,0000-00-00 00:00:00
U001545,Leo,King,leo.king@gmail.com,UK,MH,,2025-05-08 0:00,Outbound,RETARGET1,macOS,1.1.0,11-50,Engineering,1,40,,TRUE,2025-05-08 12:12,10-21-2025 12:12
U000351,Noah,Lee,noah.lee@proton.me,JP,-,Europe/London,2024-03-30 0:00,Referral,SPRING24,Windows,1.3.0,1000+,Finance,0,42,U000485,0,2024-03-30 3:05,2024-05-16 3:05
U001174,Leo,White,leo.white@gmail.com,MX,,Asia/Tokyo,2023-11-20 0:00,Partner,BF2024,Linux,2.0.0,10-Jan,Product,1,55,,,2023-11-20 13:11,2024-01-30 13:11
U000856,Zoe,White,zoe.white@company.com,SG,MH,UTC,10/03/2023,Partner,GROWTHLAB,Windows,2.1.0,11-50,HR,0,44,,,2023-10-03 2:00,2023-11-26 2:00
U000833,Kofi,Robinson,KOFI.ROBINSON@OUTLOOK.COM,BR,,Europe/Berlin,22-08-2023,Organic Search,AI-LAUNCH,Unknown,1.0.9,1000+,Ops,0,30,,TRUE,2023-08-22 20:44,2023-11-01 20:44
U002088,Mateo,Lopez,mateo.lopez@icloud.com,ZA,CA,UTC,2024-06-17 0:00,Organic Search,n/a,iOS,1.1.0,unknown,Founder,0,30,,N,2024-06-17 15:52,2024-07-02 15:52
U002493,Yuki,Jackson,yuki.jackson@proton.me,MX,BER,,08/18/2024,Social,Q3_PROMO,Windows,1.1.2,10-Jan,Ops,0,35,,FALSE,2024-08-18 3:11,2024-11-07 3:11
U002555,Fatima,Young,fatima.young@gmail.com,CA,BER,UTC,2023-06-04 0:00,Organic Search,SPRING24,Unknown,2.0.1,501-1000,Founder,0,33,,FALSE,2023-06-04 4:52,2023-10-13 4:52
U001866,Nora,Clark,nora.clark@gmail.com,United States,TX,America/Los_Angeles,2025-02-25 0:00,Outbound,WINTER25,Linux,1.1.2,1000+,Sales,0,61,,yes,2025-02-25 12:12,2025-03-15 12:12
U002528,chen,Martinez,chen.martinez@proton.me,SE,LND,America/Los_Angeles,2025-04-20 0:00,Content,null,Android,1.0.9,10-Jan,Sales,1,36,,,2025-04-20 12:54,2025-06-27 12:54
U000361,Sofia,Allen,sofia.allen@nexloom.io,FR,ON,UTC,2024-02-01 0:00,Content,GROWTHLAB,Android,1.0.9,201-500,Marketing,yes,,,Y,2024-02-01 4:27,2024-06-04 4:27
U000281,Ivy,Jackson,IVY.JACKSON@GMAIL.COM,CA,,Europe/London,2024-12-08 0:00,Outbound,BF2024,iOS,1.1.2,501-1000,Support,0,,,,2024-12-08 2:53,2024-12-22 2:53
U000330,Ava,Martinez,ava.martinez@nexloom.io,FR,unknown,America/New_York,2023-11-12 0:00,Outbound,RETARGET1,macOS,1.3.0,501-1000,Founder,0,58,,TRUE,2023-11-12 2:14,2024-03-01 2:14
U000121,Diego,Walker,diego.walker@company.com,JP,ON,,2024-09-19 0:00,Partner,AI-LAUNCH,macOS,2.1.0,201-500,Sales,1,,,TRUE,2024-09-19 10:46,2025-01-21 10:46
U002520,Lucas,Johnson,lucas.johnsonproton.me,au,BER,America/New_York,2024-07-24 0:00,Paid Search,SPRING24,Android,1.2.0,51-200,Support,0,21,,FALSE,2024-07-24 5:41,2024-12-12 5:41
U000802,Ben,Young,ben.young@icloud.com,MX,BER,,2023-09-02 0:00,Social,SPRING24,Linux,2.0.0,unknown,HR,0,50,,0,2023-09-02 7:26,2023-11-19 7:26
U000014,Ivy,Moore,ivy.moore@company.com,IN,BER,Asia/Kolkata,2023-10-19 0:00,Paid Search,SUMMER24,iOS,1.2.1,unknown,Finance,1,49,,,2023-10-19 15:57,2023-11-20 15:57
U001477,Olivia,Lopez,olivia.lopezproton.me,SE,NY,America/Los_Angeles,2024-09-19 0:00,Referral,SPRING24,iOS,1.1.0,unknown,Founder,0,42,,Y,2024-09-19 3:44,2024-10-15 3:44
U002276,Ethan,Garcia,ethan.garcia@nexloom.io,SE,BER,Asia/Tokyo,2024-05-18 0:00,Paid Search,Q3_PROMO,Android,2.1.0,10-Jan,Support,0,,,0,2024-05-18 21:20,2024-10-28 21:20
U001671,Sophia,THOMAS,sophia.thomas@outlook.com,JP,ON,Asia/Tokyo,2024-01-28 0:00,Social,AI-LAUNCH,Unknown,1.0.9,51-200,Finance,0,52,,0,2024-01-28 12:49,2024-02-19 12:49
U001018,Olivia,Lee,olivia.leenexloom.io,IN,NY,Europe/Berlin,05/02/2024,Outbound,WINTER25,Windows,1.1.0,11-50,Support,1,61,,FALSE,2024-05-02 3:20,2024-08-09 3:20
U001158,Lucas,Davis,lucas.davis@icloud.com,USA,RJ,Asia/Tokyo,2024-11-27,Social,N/A,Linux,1.2.1,1000+,HR,0,31,,FALSE,2024-11-27 20:48,2025-04-02 20:48
U001319,Emma,Garcia,emma.garcia@proton.me,SE,BC,America/New_York,2023-06-17 0:00,Partner,BF2024,macOS,1.1.2,201-500,Finance,0,45,,TRUE,2023-06-17 19:41,2023-09-13 19:41
U002415,Ethan,Nguyen,ethan.nguyen@gmail.com,US,RJ,America/New_York,2024-03-31,Social,WINTER25,Windows,2.0.0,unknown,Support,0,41,,Y,2024-03-31 4:20,2024-05-11 4:20
U000604,Chen,Scott,chen.scott@proton.me,CA,ON,America/Los_Angeles,2023-06-26,Content,Q3_PROMO,Linux,2.1.0,unknown,Product,0,43,,FALSE,2023-06-26 13:57,2023-07-21 13:57
U001702,Mia,Scott,mia.scott@outlook.com,SG,NY,,2024-02-24 0:00,Outbound,SPRING24,Linux,1.1.2,201-500,Product,1,54,,0,2024-02-24 8:59,07-14-2024 08:59
U002362,Hana,Harris, hana.harris@nexloom.io ,DE,BC,Europe/Berlin,2024-02-18 0:00,Social,SUMMER24,Linux,2.1.0,10-Jan,Founder,0,56,,0,2024-02-18 13:15,2024-03-04 13:15
U000037,Amir,Martinez,amir.martinez@icloud.com,GB,SP,Europe/London,2023-12-17 0:00,Referral,n/a,Unknown,2.0.0,51-200,Founder,0,59,U000363,N,2023-12-17 22:53,04-03-2024 22:53
U002389,Hana,Moore,hana.moore@icloud.com,JP,,Asia/Kolkata,2024-07-14 0:00,Organic Search,AI-LAUNCH,Android,2.1.0,1000+,Engineering,0,48,,FALSE,2024-07-14 12:11,2024-08-18 12:11
U001687,Nora,Smith, nora.smith@gmail.com ,SG,TX,Asia/Tokyo,2025-01-27 0:00,Outbound,RETARGET1,macOS,1.1.2,201-500,Marketing,0,62,,FALSE,2025-01-27 4:30,2025-05-09 4:30
U000497,Liam,Moore,LIAM.MOORE@COMPANY.COM,US,TX,America/Los_Angeles,2024-05-10 0:00,Partner,WINTER25,iOS,2.0.0,10-Jan,Founder,no,26,,N,2024-05-10 2:31,2024-09-07 2:31
U002436,Sofia,Martin,sofia.martin@company.com,SE,unknown,,2024-02-01 0:00,Paid Search,GROWTHLAB,Linux,1.2.1,201-500,Marketing,0,55,,no,2024-02-01 16:01,2024-05-21 16:01
U000257,Diego,Wilson,diego.wilson@proton.me,IN,unknown,,2025-02-22 0:00,Partner,SUMMER24,macOS,2.0.0,1000+,Founder,0,62,,0,02/22/2025 14:28,2025-04-12 14:28
U002069,Olivia,Harris,olivia.harris@icloud.com,NL,BC,,2023-09-12 0:00,Content,SUMMER24,Linux,1.0.9,11-50,Ops,0,22,,FALSE,2023-09-12 12:54,2024-01-14 12:54
U002513,Ethan,Martinez,ethan.martinez@gmail.com,JP,LND,Asia/Tokyo,2024-03-03 0:00,Webinar,SPRING24,iOS,2.0.0,11-50,Marketing,1,47,,Y,2024-03-03 8:10,2024-08-12 8:10
U002030,Chen,Perez,chen.perez@icloud.com,US,NY,,2024-06-16,Organic Search,SUMMER24,macOS,v1.2.0,11-50,HR,0,,,FALSE,2024-06-16 7:27,2024-08-28 7:27
U001359,Amir,Wilson,amir.wilson@yahoo.com,CA,NSW,,2023-11-30 0:00,Partner,N/A,Unknown,2.1.0,10-Jan,Product,0,N/A,,TRUE,2023-11-30 9:34,2024-01-19 9:34
U000030,Chen,Anderson,chen.anderson@gmail.com,MX,CA,America/Los_Angeles,2023-04-22 0:00,Webinar,N/A,Windows,2.0.1,501-1000,Product,0,47,,yes,2023-04-22 2:45,2023-07-13 2:45
U000567,Emma,Thompson,emma.thompson@nexloom.io,SE,unknown,,2024-02-03 0:00,Content,Q3_PROMO,iOS,1.0.9,51-200,Engineering,0,58,,0,2024-02-03 11:37,2024-03-31 11:37
U000032,Amir,White,amir.white@company.com,SG,NSW,America/Los_Angeles,2023-09-17 0:00,Social,GROWTHLAB,iOS,1.2.0,unknown,Founder,0,56,,TRUE,2023-09-17 4:53,2024-02-08 4:53
U001746,Diego,Martinez,diego.martinez@icloud.com,IN,MH,UTC,2024-03-19 0:00,Social,Q3_PROMO,Linux,2.0.1,10-Jan,Product,0,28,,0,2024-03-19 12:02,2024-06-30 12:02
U002341,Ben,Moore,ben.moore@outlook.com,DE,BER,Asia/Tokyo,2024-08-11 0:00,partner,SUMMER24,Unknown,2.0.1,11-50,Finance,0,24,,yes,2024-08-11 18:23,
U002516,Mia,Taylor,mia.taylor@nexloom.io,GB,unknown,Europe/Berlin,2025-02-03 0:00,Social,N/A,Unknown,1.1.2,unknown,Marketing,0,47,,TRUE,2025-02-03 1:16,2025-06-14 1:16
U001065,Ravi,Perez,ravi.perez@nexloom.io,JP,LND,America/Los_Angeles,2024-02-18 0:00,Webinar,AI-LAUNCH,Windows,2.0.0,501-1000,Product,0,51,,,2024-02-18 17:36,2024-03-20 17:36
U000017,Ethan,Allen,ethan.allen@gmail.com,JP,NSW,,2023-12-17 0:00,Paid Search,WINTER25,macOS,2.0.1,unknown,Support,0,35,,TRUE,2023-12-17 8:12,2024-06-10 8:12
U000918,Yuki,Wright,yuki.wright@yahoo.com,MX,WA,Europe/Berlin,2025-03-24 0:00,Content,N/A,Linux,1.1.0,11-50,Ops,1,56,,N,2025-03-24 14:12,2025-06-11 14:12
U000684,Sophia,Clark,SOPHIA.CLARK@NEXLOOM.IO,BR,,Asia/Tokyo,06/24/2024,Outbound,Q3_PROMO,Linux,1.1.0,11-50,Finance,1,48,,N,2024-06-24 13:50,2024-10-26 13:50
U001628,Amir,White, AMIR.WHITE@GMAIL.COM ,DE,CA,America/New_York,2024-04-16 0:00,Content,RETARGET1,macOS,1.2.0,201-500,Finance,0,57,,yes,2024-04-16 10:55,2024-05-27 10:55
U001265,Kofi,Thompson,kofi.thompson@outlook.com,AU,LND,America/Los_Angeles,2023-02-03 0:00,Referral,Q3_PROMO,iOS,2.0.1,201-500,Finance,0,50,U000132,FALSE,2023-02-03 5:36,2023-05-28 5:36
U002183,Emma,Davis,emma.davisoutlook.com,IN,RJ,,2023-03-27 0:00,Webinar,N/A,iOS,1.3.0,unknown,Marketing,1,37,,TRUE,2023-03-27 17:29,2023-08-23 17:29
U001616,Zoe,Scott,zoe.scott@nexloom.io,SG,CA,UTC,2024-06-24 0:00,Outbound,RETARGET1,Windows,1.1.0,10-Jan,Sales,0,27,,no,2024-06-24 14:38,2024-10-08 14:38
U001945,omar,Anderson,omar.anderson@gmail.com,CA,WA,,2024-09-05 0:00,Referral,N/A,macOS,1.3.0,11-50,Sales,0,42,U000201,yes,2024-09-05 23:40,09-27-2024 23:40
U000692,Amir,Davis,amir.davis@company.com,JP,BER,Asia/Tokyo,02/20/2024,Partner,BF2024,Linux,1.3.0,unknown,Engineering,0,27,,Y,2024-02-20 5:41,2024-06-01 5:41
U001217,Hana,Young,hana.young@proton.me,US,NY,,2023-06-18 0:00,webinar,GROWTHLAB,macOS,2.1.0,10-Jan,Marketing,0,45,,no,2023-06-18 4:21,2023-08-22 4:21
U002377,Hana,Perez,hana.perez@nexloom.io,BR,unknown,,2023-12-18 0:00,content,WINTER25,Windows,1.0.9,1000+,Founder,1,41,,FALSE,2023-12-18 2:53,2024-02-03 2:53
U000536,Ben,Lopez,ben.lopez@company.com,US,ON,America/New_York,2025-03-15 0:00,Social,SUMMER24,Android,1.3.0,10-Jan,Finance,1,N/A,,0,2025-03-15 14:31,0000-00-00 00:00:00
U001011,Mateo,Nguyen,mateo.nguyen@yahoo.com,SG,NY,Asia/Tokyo,2023-10-25 0:00,Paid Search,BF2024,macOS,2.1.0,201-500,HR,0,35,,no,2023-10-25 0:26,2024-01-29 0:26
U001344,Jin,Wright,jin.wright@yahoo.com,SE,SP,America/New_York,2024-07-27 0:00,Referral,n/a,Windows,1.0.9,1000+,HR,0,30,,no,2024-07-27 19:12,2024-09-27 19:12
U001274,Sofia,White,sofia.white@nexloom.io,IN,,America/Los_Angeles,2023-04-09 0:00,Content,N/A,Linux,1.1.2,501-1000,Support,1,N/A,,Y,2023-04-09 3:39,2023-04-30 3:39
U001674,Sophia,Walker,sophia.walker@yahoo.com,ZA,ON,Asia/Kolkata,2024-09-18 0:00,Paid Search,SUMMER24,Android,1.2.0,11-50,Sales,0,56,,yes,2024-09-18 8:45,2024-12-19 8:45
U002329,Ben,Jackson,ben.jackson@yahoo.com,SE,TX,America/New_York,2024-06-06 0:00,Partner,RETARGET1,iOS,2.0.1,501-1000,Ops,1,30,,Y,2024-06-06 22:10,2024-08-20 22:10
U002462,Omar,King, omar.kingyahoo.com ,CA,BER,America/Los_Angeles,11/27/2024,Outbound,GROWTHLAB,Linux,2.1.0,51-200,Founder,0,51,,Y,2024-11-27 3:53,2025-03-22
U001287,Sophia,Jackson,sophia.jackson@gmail.com,FR,MH,Asia/Kolkata,06/25/2023,Paid Search,N/A,Android,1.1.0,unknown,Ops,0,58,,TRUE,2023-06-25 8:53,2023-11-02 8:53
U001259,Ava,Allen,ava.allen@yahoo.com,IN,RJ,UTC,2023-05-22 0:00,Social,GROWTHLAB,Android,2.1.0,1000+,Support,1,,,0,2023-05-22 21:47,2023-06-01 21:47
U001051,Noah,Jackson,noah.jackson@gmail.com,FR,SP,,2024-11-20 0:00,Partner,SPRING24,iOS,1.2.0,unknown,HR,1,41,,yes,2024-11-20 19:07,2024-12-13 19:07
U002117,Omar,Jackson,omar.jackson@nexloom.io,CA,WA,America/Los_Angeles,2024-02-28,Social,SPRING24,Android,1.1.2,1000+,Support,1,36,,TRUE,2024-02-28 6:41,2024-03-12 6:41
U002596,Liam,Johnson,liam.johnson@proton.me,JP,NY,,2024-08-27 0:00,Outbound,Q3_PROMO,Linux,1.2.0,1000+,Finance,1,60,,0,2024-08-27 18:06,2024-12-20 18:06
U001719,Chen,Jackson, chen.jackson@nexloom.io ,MX,ON,,2025-08-11 0:00,Webinar,GROWTHLAB,Windows,1.1.2,unknown,Product,1,62,,0,2025-08-11 13:19,2025-12-22 13:19
U001615,Chen,Robinson,chen.robinson@nexloom.io,SE,SP,Europe/Berlin,01/02/2024,Webinar,AI-LAUNCH,Windows,2.0.0,1000+,Finance,0,28,,TRUE,01/02/2024 16:01,2024-06-27 16:01
U001352,Jin,Lopez,jin.lopez@nexloom.io,NL,,Asia/Tokyo,2024-05-07 0:00,Paid Search,BF2024,Windows,1.0.9,10-Jan,Support,1,42,,Y,2024-05-07 7:20,2024-06-10 7:20
U000360,Diego,Wright,diego.wright@yahoo.com,SG,,Europe/London,2024-05-06 0:00,Content,SUMMER24,Android,2.0.1,201-500,HR,0,38,,no,2024-05-06 22:30,2024-10-11 22:30
U000169,Ben,Johnson,ben.johnson@proton.me,FR,WA,,2023-04-11 0:00,Social,RETARGET1,iOS,v1.1.2,1000+,Ops,0,62,,TRUE,2023-04-11 15:13,2023-07-11 15:13
U002472,Lucas,Brown,lucas.brown@company.com,GB,MH,,2025-05-12 0:00,Outbound,WINTER25,iOS,2.1.0,10-Jan,Founder,0,34,,Y,2025-05-12 13:48,2025-05-22 13:48
U001521,Omar,Walker,omar.walker@proton.me,MX,-,,2023-05-16 0:00,Content,AI-LAUNCH,macOS,1.3.0,501-1000,Sales,0,52,,yes,2023-05-16 2:48,2023-06-26 2:48
U001005,Elena,Johnson,elena.johnson@gmail.com,br,ON,America/Los_Angeles,2024-09-18 0:00,Social,BF2024,Unknown,v2.1.0,10-Jan,Ops,1,18,,FALSE,2024-09-18 5:23,2024-09-20 5:23
U002219,Elena,Thomas,elena.thomas@outlook.com,SG,ON,Asia/Kolkata,2024-11-18 0:00,social,SPRING24,iOS,1.3.0,51-200,HR,0,55,,TRUE,2024-11-18 19:05,2025-03-08 19:05
U001489,Emma,Walker,emma.walker@yahoo.com,AU,,Europe/Berlin,2024-02-01 0:00,Organic Search,n/a,Linux,2.0.0,501-1000,Ops,0,42,,N,2024-02-01 18:50,0000-00-00 00:00:00
U000194,Zoe,King,zoe.king@icloud.com,JP,LND,,2024-06-04 0:00,Content,RETARGET1,macOS,1.0.9,unknown,Product,FALSE,19,,N,2024-06-04 2:56,2024-08-20 2:56
U002549,Mateo,Davis,mateo.davis@gmail.com,GB,RJ,Asia/Kolkata,2024-02-11 0:00,Partner,SPRING24,Unknown,1.1.2,501-1000,Product,TRUE,,,N,2024-02-11 20:13,2024-04-20 20:13
U001940,Kofi,Thompson,kofi.thompson@outlook.com,DE,ON,,2023-06-11 0:00,Outbound,Q3_PROMO,Linux,1.2.0,51-200,Marketing,1,40,,TRUE,2023-06-11 16:20,2023-09-20 16:20
U002511,Jin,Allen,jin.allen@company.com,JP,ON,,05/20/2023,Referral,GROWTHLAB,Android,1.0.9,1000+,Product,0,39,U000266,0,2023-05-20 4:23,2023-10-23
U001882,Elena,Martinez,elena.martinez@gmail.com,IN,WA,Europe/Berlin,19-11-2024,Referral,N/A,Linux,1.1.0,51-200,Marketing,1,47,U000339,,2024-11-19 14:47,2025-03-22 14:47
U001452,Fatima,Moore,fatima.moore@company.com,SE,CA,America/Los_Angeles,2024-05-27 0:00,Outbound,SUMMER24,Windows,1.2.1,501-1000,Support,0,19,,FALSE,2024-05-27 16:41,2024-06-20
U000564,Liam,Moore,liam.moore@gmail.com,DE,ON,America/New_York,2023-02-11 0:00,Social,RETARGET1,iOS,1.0.9,201-500,Finance,1,25,,0,2023-02-11 12:10,2023-04-17 12:10
U001954,Amir,Lewis,amir.lewis@yahoo.com,DE,BC,Asia/Tokyo,2024-08-01 0:00,Paid Search,N/A,Windows,2.1.0,51-200,Product,0,21,,0,2024-08-01 3:44,2024-09-24
U000776,Mateo,Lewis,mateo.lewis@icloud.com,SG,ON,Asia/Tokyo,2023-08-30,Content,SUMMER24,Linux,2.0.1,51-200,Engineering,0,28,,TRUE,2023-08-30 1:16,2023-10-02 1:16
 U000184 ,Amir,Scott, amir.scott@yahoo.com ,MX,BER,America/Los_Angeles,2024-02-16 0:00,Partner,AI-LAUNCH,Windows,1.3.0,unknown,Ops,0,22,,N,2024-02-16 8:33,2024-05-14 8:33
U002091,Olivia,Patel,olivia.patel@nexloom.io,IN,LND,America/Los_Angeles,2024-08-27 0:00,Organic Search,WINTER25,macOS,v2.0.0,11-50,Marketing,0,18,,TRUE,2024-08-27 5:12,2025-01-03 5:12
U000674,Ravi,Jackson,ravi.jackson@yahoo.com,US,RJ,,2024-04-10 0:00,Organic Search,SUMMER24,Linux,v1.2.0,10-Jan,Finance,0,24,,,04/10/2024 16:02,2024-07-17 16:02
U000667,Fatima,Walker,fatima.walker@outlook.com,GB,NSW,America/New_York,2023-11-11 0:00,Organic Search,n/a,Linux,2.1.0,201-500,Sales,1,48,,yes,2023-11-11 11:38,2024-01-03 11:38
U000144,Elena,Patel,elena.patel@icloud.com,IN,SP,America/Los_Angeles,2023-12-15 0:00,Partner,SPRING24,Unknown,1.2.1,10-Jan,Support,0,50,,FALSE,2023-12-15 5:59,2024-02-02 5:59
U000656,Kofi,Harris,KOFI.HARRIS@COMPANY.COM,US,NSW,America/Los_Angeles,2023-08-09,Organic Search,RETARGET1,iOS,v1.1.0,10-Jan,Finance,0,29,,no,2023-08-09 14:03,2023-11-21 14:03
U000409,Amir,Robinson,AMIR.ROBINSON@COMPANY.COM,GB,NY,Asia/Kolkata,2024-12-30 0:00,Organic Search,n/a,iOS,1.3.0,11-50,Sales,0,32,,1,2024-12-30 18:44,2025-05-26 18:44
U000387,Ethan,White,ethan.white@yahoo.com,US,ON,,2023-12-03 0:00,Referral,SPRING24,Android,1.3.0,51-200,Ops,0,42,U000275,0,2023-12-03 8:35,2024-05-12 8:35
U001059,Ben,Anderson,ben.anderson@yahoo.com,DE,RJ,Asia/Tokyo,2024-03-19 0:00,Content,SUMMER24,Linux,2.0.1,501-1000,HR,0,37,,yes,2024-03-19 9:00,2024-08-19 9:00
U001716,Ethan,Anderson,ethan.anderson@gmail.com,SE,-,,2025-10-23 0:00,Organic Search,SPRING24,Linux,1.3.0,11-50,Engineering,0,39,,N,2025-10-23 18:26,2025-11-14 18:26
U001970,Sara,Martinez,sara.martinez@yahoo.com,AU,SP,America/New_York,2023-03-11,Social,Q3_PROMO,Android,1.2.1,501-1000,Support,0,53,,Y,2023-03-11 22:42,2023-06-09 22:42
U000845,Elena,Thompson,elena.thompson@outlook.com,SE,MH,,2023-08-29 0:00,Partner,RETARGET1,Linux,1.1.2,1000+,Finance,0,64,,yes,2023-08-29 16:12,2023-11-10 16:12
U000696,Diego,Anderson,diego.anderson@company.com,AU,BC,,2024-05-24 0:00,Partner,RETARGET1,Linux,1.3.0,unknown,Engineering,0,61,,yes,2024-05-24 3:54,2024-11-12 3:54
U000111,Sofia,Walker,sofia.walker@yahoo.com,MX,ON,,12/08/2023,Paid Search,BF2024,Linux,1.1.2,11-50,Ops,TRUE,29,,0,2023-12-08 7:54,2023-12-24 7:54
U001183,Ben,Robinson, ben.robinson@proton.me ,MX,CA,Europe/Berlin,2024-06-04 0:00,Paid Search,WINTER25,Unknown,1.2.1,10-Jan,Product,0,62,,Y,2024-06-04 15:09,2024-11-07 15:09
U001423,Olivia,Thomas,olivia.thomas@nexloom.io,IN,LND,Europe/London,2023-04-13,Organic Search,AI-LAUNCH,iOS,2.0.0,501-1000,Support,0,24,,N,2023-04-13 2:00,2023-05-28 2:00
u000701,Yuki,Martinez,yuki.martinez@nexloom.io,IN,unknown,America/New_York,2024-04-14 0:00,content,N/A,Windows,1.1.2,201-500,Engineering,1,46,,N,2024-04-14 13:40,2024-05-11 13:40
U001904,Omar,Moore,omar.moorenexloom.io,NL,-,Asia/Tokyo,2023-03-31 0:00,Webinar,Q3_PROMO,macOS,1.2.1,1000+,Ops,0,56,,FALSE,2023-03-31 7:35,2023-07-10 7:35
U000761,Anya,Clark,anya.clark@yahoo.com,br,ON,America/Los_Angeles,2023-09-01 0:00,Organic Search,SUMMER24,Android,1.1.2,11-50,HR,0,54,,FALSE,2023-09-01 5:05,01-23-2024 05:05
U000751,Mateo,Lopez,mateo.lopez@company.com,NL,-,America/Los_Angeles,2023-07-29 0:00,Referral,n/a,Windows,1.1.2,10-Jan,HR,0,50,,FALSE,2023-07-29 2:46,2023-11-30 2:46
U000873,Ava,Scott,ava.scott@company.com,ZA,BC,Europe/Berlin,2024-06-10 0:00,Paid Search,SUMMER24,Android,1.0.9,501-1000,HR,1,24,,1,2024-06-10 19:44,2024-10-31 19:44
U002592,Olivia,Wright,olivia.wright@company.com,CA,RJ,,2024-09-16 0:00,Webinar,GROWTHLAB,Unknown,1.2.1,10-Jan,HR,1,33,,no,2024-09-16 6:45,2024-10-04 6:45
U001020,Sofia,Lopez,SOFIA.LOPEZ@COMPANY.COM,BR,LND,,2023-03-28 0:00,Webinar,BF2024,macOS,v1.1.0,10-Jan,Marketing,0,27,,Y,2023-03-28 2:18,2023-09-08 2:18
U002359,Kofi,Allen,kofi.allen@icloud.com,SE,MH,America/Los_Angeles,2024-04-15 0:00,Content,Q3_PROMO,macOS,2.1.0,501-1000,Engineering,0,,,1,2024-04-15 18:26,0000-00-00 00:00:00
U001190,Mia,Lopez,mia.lopez@company.com,JP,CA,UTC,2024-07-16 0:00,Partner,BF2024,Android,2.0.1,51-200,HR,0,43,,no,2024-07-16 17:54,2024-12-02 17:54
U001780,Omar,Clark,omar.clark@outlook.com,IN,TX,,2024-10-17 0:00,Social,GROWTHLAB,Unknown,1.2.1,10-Jan,Ops,1,19,,FALSE,2024-10-17 22:30,2024-11-22 22:30
U001130,Lucas,Johnson,lucas.johnson@gmail.com,IN,-,,2023-11-20 0:00,Outbound,WINTER25,Android,1.1.2,1000+,Marketing,,38,,Y,2023-11-20 16:34,2024-01-08 16:34
U001953,Zoe,Johnson,zoe.johnson@yahoo.com,IN,WA,,2024-05-17 0:00,Organic Search,RETARGET1,macOS,1.3.0,501-1000,HR,0,44,,TRUE,2024-05-17 17:11,2024-10-17 17:11
U000115,Sofia,Martinez,sofia.martinez@icloud.com,ZA,RJ,Asia/Tokyo,2025-05-09 0:00,Outbound,Q3_PROMO,iOS,1.1.0,11-50,Finance,1,27,,no,2025-05-09 7:17,2025-05-11 7:17
U000700,Omar,Clark,omar.clark@gmail.com,,WA,America/Los_Angeles,2024-03-19 0:00,Outbound,WINTER25,macOS,1.0.9,51-200,Marketing,0,34,,yes,2024-03-19 0:56,2024-09-02 0:56
U001250,Anya,Garcia,anya.garcia@icloud.com,US,ON,Asia/Kolkata,2024-05-27 0:00,Webinar,GROWTHLAB,Android,2.0.1,10-Jan,Product,0,18,,TRUE,2024-05-27 7:28,2024-07-14 7:28
U000629,Leo,Davis,leo.davisicloud.com,AU,RJ,Asia/Tokyo,2023-04-03 0:00,Organic Search,n/a,Windows,2.0.1,11-50,Support,1,42,,Y,2023-04-03 5:12,2023-06-02 5:12
U002479,Kofi,Johnson,kofi.johnson@gmail.com,GB,NSW,Asia/Tokyo,08/06/2023,Partner,Q3_PROMO,Linux,1.0.9,51-200,Finance,0,28,,no,2023-08-06 8:03,2023-12-28 8:03
U000585,Mia,Walker,mia.walker@company.com,-,,Europe/London,2024-06-05 0:00,Outbound,SUMMER24,Unknown,1.1.2,11-50,HR,0,23,,no,2024-06-05 12:02,2024-11-21 12:02
U002502,Kofi,Thomas,kofi.thomas@proton.me,NL,unknown,Asia/Kolkata,2024-08-19,Referral,BF2024,Android,1.1.0,51-200,Ops,0,28,U000236,N,2024-08-19 17:54,2025-02-04 17:54
U002562,Hana,Moore,hana.moore@gmail.com,FR,,America/New_York,2024-07-15,Content,Q3_PROMO,Unknown,2.1.0,unknown,Sales,0,42,,no,2024-07-15 23:27,2024-11-09 23:27
U000857,Elena,Anderson,elena.anderson@gmail.com,SG,MH,America/New_York,2023-04-03 0:00,social,GROWTHLAB,Unknown,2.1.0,1000+,Engineering,0,20,,0,2023-04-03 22:34,2023-07-14
U001584,Ravi,Moore,ravi.moore@outlook.com,GB,NY,America/New_York,,Paid Search,WINTER25,Windows,1.2.1,10-Jan,Sales,1,unknown,,FALSE,2024-03-27 20:23,2024-03-30 20:23
U001495,Emma,Harris,emma.harris@company.com,DE,MH,UTC,2024-05-20 0:00,webinar,AI-LAUNCH,Linux,1.1.0,501-1000,Marketing,0,43,,FALSE,2024-05-20 21:45,2024-06-26 21:45
U001944,Chen,White,chen.white@gmail.com,US,SP,,2024-07-16 0:00,Webinar,SPRING24,iOS,1.2.1,501-1000,Sales,,62,,yes,2024-07-16 5:14,2024-10-24
U002186,Sofia,Lee, sofia.lee@icloud.com ,CA,ON,Europe/Berlin,2025-02-27 0:00,Webinar,SPRING24,macOS,v2.0.0,201-500,Engineering,0,31,,FALSE,2025-02-27 5:26,2025-08-08 5:26
U001701,Elena,Moore,elena.moore@nexloom.io,ZA,BER,Asia/Tokyo,2025-05-19,Content,GROWTHLAB,Linux,1.1.0,11-50,HR,0,29,,no,2025-05-19 17:54,2025-09-11 17:54
U001700,Jin,Allen,jin.allen@proton.me,GB,CA,,2024-04-22,Partner,N/A,macOS,1.1.2,10-Jan,Engineering,0,51,,FALSE,2024-04-22 19:27,2024-06-15 19:27
U002233,Amir,Thompson,amir.thompson@gmail.com,United States,LND,America/Los_Angeles,2024-12-26 0:00,Social,WINTER25,Unknown,1.2.1,1000+,Founder,0,18,,no,2024-12-26 2:01,2024-12-28 2:01
U001778,Mia,Allen,mia.allen@company.com,FR,RJ,Europe/Berlin,2024-02-26 0:00,Partner,N/A,Windows,1.2.1,201-500,Ops,0,22,,FALSE,2024-02-26 20:00,2024-04-09 20:00
U002059,Diego,Young,diego.young@company.com,SE,CA,,2024-06-14 0:00,Outbound,SUMMER24,macOS,1.0.9,501-1000,Product,0,52,,FALSE,2024-06-14 14:41,2024-06-17
U000921,Ben,Garcia,ben.garcia@company.com,DE,SP,Europe/London,2024-11-13 0:00,Organic Search,SUMMER24,Linux,1.2.0,201-500,Finance,1,55,,FALSE,2024-11-13 6:30,2025-02-18 6:30
U000190,Emma,Wright,emma.wright@proton.me,BR,CA,,2023-11-08 0:00,Referral,n/a,iOS,v1.1.2,unknown,Support,1,55,,Y,2023-11-08 11:13,2023-11-14 11:13
U002068,Chen,Lee,chen.lee@nexloom.io,CA,NY,America/New_York,2023-11-19 0:00,Partner,SUMMER24,Linux,2.1.0,1000+,HR,0,N/A,,0,2023-11-19 14:11,2024-02-16 14:11
U002408,Hana,King,hana.king@gmail.com,SE,WA,Asia/Kolkata,2023-10-23 0:00,Organic Search,SPRING24,Android,1.2.1,1000+,Marketing,0,31,,TRUE,2023-10-23 6:23,2024-03-17 6:23
U000625,Emma,Garcia,emma.garcia@outlook.com,SE,BER,Asia/Tokyo,2024-05-28 0:00,Outbound,SPRING24,macOS,1.2.0,501-1000,Finance,0,50,,yes,2024-05-28 1:33,2024-11-03 1:33
U000821,Amir,Nguyen,amir.nguyen@yahoo.com,SG,MH,Europe/London,2024-09-16 0:00,Organic Search,Q3_PROMO,Linux,2.0.0,10-Jan,HR,0,42,,no,2024-09-16 1:13,2024-12-09 1:13
U001798,Zoe,Davis,zoe.davis@company.com,DE,SP,Europe/London,2023-06-03 0:00,Content,RETARGET1,iOS,2.1.0,51-200,Support,0,24,,N,2023-06-03 14:05,2023-09-30 14:05
U001269,Kofi,Nguyen,kofi.nguyen@outlook.com,GB,unknown,America/New_York,18-05-2024,Organic Search,n/a,macOS,1.1.2,501-1000,Engineering,0,23,,Y,2024-05-18 22:17,2024-09-04 22:17
U000972,Amir,Harris,amir.harris@icloud.com,GB,RJ,Europe/London,2025-02-24 0:00,Paid Search,SPRING24,Linux,1.2.0,1000+,Engineering,1,26,,yes,02/24/2025 07:31,2025-03-24 7:31
U001787,Nora,Wright,nora.wright@nexloom.io,in,WA,America/Los_Angeles,06-06-2024,Webinar,Q3_PROMO,Linux,v1.2.0,11-50,Engineering,1,,,FALSE,2024-06-06 1:36,2024-11-06 1:36
U000863,Sara,Perez,sara.perez@nexloom.io,GB,BC,Asia/Tokyo,2024-04-10 0:00,Outbound,Q3_PROMO,Unknown,1.0.9,51-200,Ops,0,45,,FALSE,2024-04-10 2:55,2024-09-10 2:55
U001243,Hana,Robinson,hana.robinson@proton.me,IN,LND,UTC,2024-08-24 0:00,Paid Search,RETARGET1,Unknown,1.3.0,51-200,Ops,0,33,,1,2024-08-24 5:19,2024-08-30 5:19
U001924,Kofi,Martin,kofi.martin@proton.me,in,ON,Europe/Berlin,14-01-2024,outbound,BF2024,Windows,2.0.0,1000+,Sales,0,51,,,2024-01-14 17:02,2024-07-01 17:02
U000023,Yuki,Young,yuki.young@nexloom.io,ZA,RJ,,2024-05-26 0:00,Content,WINTER25,macOS,1.0.9,11-50,HR,0,23,,TRUE,2024-05-26 5:05,2024-11-08 5:05
U000544,Mia,Allen,mia.allen@gmail.com,GB,unknown,America/Los_Angeles,2024-06-25 0:00,Content,BF2024,iOS,1.1.0,1000+,HR,0,,,N,2024-06-25 19:38,2024-08-25 19:38
U000830,Sophia,Young,sophia.young@company.com,SE,BC,,2024-03-05 0:00,Organic Search,n/a,Linux,2.0.0,201-500,Finance,0,23,,FALSE,2024-03-05 21:08,2024-03-27 21:08
U001733,Noah,Jackson,noah.jackson@outlook.com,MX,NY,Europe/Berlin,2024-04-11 0:00,Partner,SUMMER24,Unknown,1.3.0,1000+,Product,0,39,,1,2024-04-11 10:58,2024-07-23 10:58
U002288,Zoe,Martinez,zoe.martinezoutlook.com,US,TX,Europe/London,2024-01-01 0:00,Organic Search,n/a,Windows,1.3.0,11-50,HR,1,53,,N,2024-01-01 20:33,2024-03-31 20:33
U000449,Olivia,Taylor,olivia.taylor@outlook.com,JP,unknown,America/New_York,2024-01-25,Webinar,SUMMER24,Linux,1.2.0,201-500,Product,1,63,,N,2024-01-25 6:46,2024-05-17 6:46
U000139,Mateo,Martin,mateo.martin@outlook.com,US,BER,UTC,2024-01-19 0:00,Partner,BF2024,Windows,1.1.2,201-500,Ops,0,47,,,2024-01-19 19:31,2024-06-19 19:31
U000969,Sophia,Martinez,sophia.martinez@proton.me,ZA,TX,UTC,2024-05-01,Webinar,BF2024,Linux,2.1.0,10-Jan,Marketing,1,19,,FALSE,05/01/2024 19:47,2024-05-26 19:47
U001100,Yuki,Johnson,yuki.johnson@nexloom.io,US,TX,,2024-01-11 0:00,Content,GROWTHLAB,Unknown,1.2.1,201-500,HR,0,,,1,2024-01-11 21:42,2024-04-12 21:42
U001587,Yuki,Allen,yuki.allen@company.com,CA,-,,2024-07-08 0:00,Paid Search,WINTER25,Unknown,v1.1.0,10-Jan,Product,0,46,,,2024-07-08 8:31,2024-12-31 8:31
U001591,Kofi,Young, kofi.young@proton.me ,US,CA,Asia/Kolkata,2024-07-07 0:00,Partner,Q3_PROMO,Unknown,2.0.0,1000+,Support,0,25,,TRUE,2024-07-07 23:18,2024-11-25 23:18
U000928,Olivia,Clark,olivia.clark@gmail.com,MX,LND,,2024-04-18 0:00,Webinar,GROWTHLAB,Android,2.0.1,1000+,Ops,0,22,,yes,2024-04-18 19:35,2024-06-14 19:35
U001372,Fatima,Brown,fatima.brown@nexloom.io,US,MH,Asia/Tokyo,2023-09-25 0:00,Content,AI-LAUNCH,Linux,1.2.1,1000+,Marketing,0,21,,FALSE,2023-09-25 19:22,2024-01-17 19:22
U001663,Mateo,Davis,mateo.davis@company.com,GB,ON,America/Los_Angeles,01/21/2025,Paid Search,WINTER25,Windows,1.2.0,1000+,Finance,0,56,,yes,2025-01-21 7:34,2025-06-14 7:34
U000719,Ravi,Robinson,ravi.robinson@gmail.com,BR,SP,America/Los_Angeles,2023-08-06 0:00,Webinar,WINTER25,macOS,2.0.0,201-500,Sales,0,46,,no,2023-08-06 9:02,2023-12-10 9:02
U000246,Mia,Wilson,mia.wilson@company.com,AU,ON,UTC,2025-02-06,Webinar,AI-LAUNCH,Linux,1.1.2,unknown,Marketing,1,25,,TRUE,2025-02-06 1:44,2025-05-14 1:44
U000698,Olivia,Walker,olivia.walker@icloud.com,BR,,America/Los_Angeles,2025-02-30,Partner,RETARGET1,Windows,1.1.2,501-1000,Finance,0,,,FALSE,2024-05-08 9:19,2024-08-20 9:19
U000202,Ivy,Allen,ivy.allen@outlook.com,GB,RJ,Asia/Kolkata,2023-06-20 0:00,Organic Search,BF2024,macOS,2.1.0,10-Jan,Finance,0,25,,TRUE,2023-06-20 0:57,2023-07-26 0:57
U000456,noah,Wright,NOAH.WRIGHT@ICLOUD.COM,US,CA,UTC,2024-03-25 0:00,Referral,n/a,Windows,v1.1.2,1000+,Engineering,0,45,U000032,FALSE,03/25/2024 10:54,2024-05-30 10:54
U001743,Emma,Moore,emma.moore@outlook.com,ZA,WA,Asia/Tokyo,2024-08-23 0:00,Organic Search,GROWTHLAB,Unknown,2.0.1,unknown,Engineering,0,30,,Y,2024-08-23 15:51,2024-12-31 15:51
U002547,Nora,Perez,nora.perez@company.com,FR,ON,Asia/Kolkata,2023-06-11 0:00,Partner,N/A,Android,2.1.0,1000+,Sales,0,59,,FALSE,2023-06-11 14:43,2023-08-25 14:43
U001153,Kofi,Davis,kofi.davis@proton.me,IN,NSW,,2024-07-10 0:00,Referral,WINTER25,macOS,1.2.0,501-1000,Ops,0,38,U000400,0,2024-07-10 7:22,2024-10-16 7:22
U000117,Ravi,Brown,RAVI.BROWN@ICLOUD.COM,SE,,Asia/Tokyo,2024-09-16 0:00,Partner,Q3_PROMO,iOS,1.2.0,11-50,Engineering,0,unknown,,N,2024-09-16 3:04,2025-02-03 3:04
U002465,Ravi,Anderson,ravi.andersonyahoo.com,DE,NSW,America/New_York,2024-05-29 0:00,Organic Search,n/a,Android,2.0.1,unknown,Marketing,0,52,,no,2024-05-29 13:50,2024-07-23 13:50
U001480,amir,Garcia,amir.garcia@nexloom.io,NL,-,Europe/Berlin,2024-02-25 0:00,Social,RETARGET1,Windows,1.1.2,201-500,HR,0,25,,FALSE,02/25/2024 07:26,06-19-2024 07:26
U000851,Kofi,Smith,kofi.smith@proton.me,IN,SP,Europe/London,2023-05-27 0:00,Content,BF2024,Linux,1.3.0,10-Jan,Product,1,51,,1,05/27/2023 13:40,2023-07-27 13:40
U000732,Ava,Davis,ava.davisyahoo.com,NL,NY,Asia/Tokyo,2024-09-25 0:00,Social,BF2024,Unknown,1.2.1,501-1000,Engineering,0,47,,FALSE,2024-09-25 13:57,2025-01-24 13:57
U000219,Amir,Clark,amir.clark@yahoo.com,GB,ON,Europe/Berlin,2024-06-13 0:00,Content,Q3_PROMO,macOS,2.1.0,1000+,Engineering,0,31,,1,2024-06-13 20:03,0000-00-00 00:00:00
U001655,Leo,Thomas,leo.thomas@proton.me,FR,WA,Europe/Berlin,2023-06-25 0:00,Organic Search,BF2024,macOS,2.0.0,501-1000,Finance,0,47,,N,2023-06-25 9:58,2023-09-21 9:58
U000866,Hana,Scott,hana.scottproton.me,AU,BER,America/New_York,2024-04-28 0:00,Referral,Q3_PROMO,Windows,1.1.0,501-1000,Support,0,,,1,2024-04-28 18:22,2024-08-30 18:22
U000107,Ava,Harris,ava.harris@gmail.com,SG,NY,Europe/London,2024-02-12 0:00,Content,AI-LAUNCH,macOS,1.0.9,51-200,Product,0,22,,1,2024-02-12 21:30,05-25-2024 21:30
U001661,Noah,Nguyen,noah.nguyen@proton.me,SG,,Europe/London,2024-05-18 0:00,Organic Search,n/a,Windows,2.0.1,1000+,Engineering,0,55,,,2024-05-18 5:20,2024-05-30 5:20
U002268,Yuki,White,yuki.white@icloud.com,SE,,,2024-07-13 0:00,Referral,GROWTHLAB,Linux,1.1.2,unknown,Support,0,40,,FALSE,2024-07-13 2:17,2024-11-23 2:17
U002365,Diego,Lopez,diego.lopez@gmail.com,CA,BER,,2024-05-06,Partner,BF2024,Android,1.2.0,11-50,Product,0,50,,yes,2024-05-06 11:56,2024-10-20 11:56
U002299,Emma,Wilson,emma.wilson@proton.me,DE,LND,America/New_York,2023-07-19 0:00,Organic Search,Q3_PROMO,macOS,2.0.0,501-1000,Finance,0,30,,FALSE,2023-07-19 4:50,2024-01-15 4:50
U000206,Elena,Garcia,elena.garcia@company.com,IN,NSW,Asia/Kolkata,2023-01-27 0:00,Paid Search,SPRING24,Linux,1.2.1,11-50,Product,0,48,,N,2023-01-27 1:33,2023-03-09 1:33
U002578,Anya,Nguyen,anya.nguyen@outlook.com,MX,BER,Asia/Tokyo,2024-05-20 0:00,Outbound,Q3_PROMO,Windows,1.1.2,501-1000,HR,0,23,,TRUE,2024-05-20 18:42,2024-08-18
U001288,Zoe,Young,zoe.young@icloud.com,IN,MH,Asia/Tokyo,2024-01-12 0:00,Webinar,WINTER25,iOS,2.0.1,501-1000,Finance,0,51,,TRUE,2024-01-12 21:51,2024-05-23 21:51
U000782,Emma,Brown,EMMA.BROWN@COMPANY.COM,US,NSW,,2024-04-19 0:00,Content,WINTER25,Linux,2.0.0,1000+,Founder,0,50,,FALSE,2024-04-19 1:49,08-13-2024 01:49
U001300,Ava,White, ava.white@yahoo.com ,AU,NSW,Europe/London,2024-07-15 0:00,Webinar,Q3_PROMO,iOS,1.3.0,11-50,Ops,0,56,,,2024-07-15 6:19,2024-08-21 6:19
U002182,Yuki,Smith,yuki.smith@company.com,GB,-,America/Los_Angeles,2023-10-19 0:00,Partner,SPRING24,macOS,1.3.0,201-500,Marketing,1,31,,Y,2023-10-19 8:33,2024-01-13 8:33
U000300,Noah,Lewis,noah.lewis@icloud.com,NL,ON,,2023-06-22 0:00,Paid Search,SPRING24,Linux,2.0.0,11-50,Sales,0,48,,TRUE,2023-06-22 7:18,2023-06-22 7:18
U001799,Ivy,Johnson,ivy.johnson@icloud.com,GB,MH,,2023-06-02 0:00,Content,SPRING24,Linux,2.1.0,11-50,Support,0,22,,TRUE,2023-06-02 0:37,2023-11-21 0:37
U002192,Diego,Perez,diego.perez@outlook.com,NL,BER,America/New_York,2025-01-01 0:00,Webinar,AI-LAUNCH,Windows,1.1.0,1000+,HR,0,32,,no,2025-01-01 13:01,2025-06-14 13:01
U001466,Ava,Martinez,ava.martinez@nexloom.io,GB,,America/Los_Angeles,04/25/2023,Organic Search,GROWTHLAB,Unknown,1.0.9,10-Jan,Sales,0,53,,0,2023-04-25 13:08,2023-05-22 13:08
U001021,Ava,Allen,ava.allen@proton.me,AU,BC,Asia/Kolkata,2024-07-10,Organic Search,WINTER25,Linux,1.3.0,1000+,Engineering,1,54,,Y,2024-07-10 17:19,2024-12-28 17:19
U001049,Hana,Lee,hana.lee@icloud.com,GB,RJ,America/New_York,2024-11-15 0:00,Outbound,SUMMER24,Unknown,1.1.2,unknown,Founder,1,20,,yes,2024-11-15 8:44,2025-01-06 8:44
U002414,Ben,Walker,ben.walker@company.com,,ON,America/Los_Angeles,14-03-2023,Content,NA,Windows,2.1.0,unknown,Sales,0,44,,,2023-03-14 1:20,2023-04-03 1:20
U000998,Ravi,Walker,ravi.walker@icloud.com,MX,LND,UTC,2023-08-18 0:00,Content,BF2024,Android,v1.2.0,11-50,Ops,0,34,,Y,2023-08-18 2:40,2023-12-04 2:40
U002494,Fatima,Lee, fatima.lee@proton.me ,DE,,Europe/Berlin,01/31/2024,Referral,n/a,Android,1.1.0,1000+,Sales,0,50,U000125,yes,2024-01-31 3:37,2024-03-10 3:37
U001137,Noah,Smith,noah.smith@outlook.com,MX,-,Europe/Berlin,27-10-2024,Partner,WINTER25,Windows,1.2.1,501-1000,Marketing,0,27,,N,2024-10-27 5:04,2025-02-13 5:04
U001036,Noah,Garcia,noah.garcia@nexloom.io,ZA,,America/Los_Angeles,2024-07-09 0:00,Content,Q3_PROMO,iOS,2.1.0,11-50,Finance,1,38,,TRUE,2024-07-09 20:02,2024-10-31 20:02
U000562,Noah,Garcia,noah.garcia@gmail.com,fr,BC,Europe/London,2023-10-19 0:00,Content,N/A,Unknown,1.2.1,1000+,Product,0,59,,yes,2023-10-19 3:39,2024-03-26 3:39
U002517,Jin,Nguyen,jin.nguyen@icloud.com,MX,NY,,2023-02-22 0:00,outbound,RETARGET1,Unknown,1.1.2,501-1000,Engineering,0,35,,FALSE,2023-02-22 15:05,2023-05-22 15:05
U001781,Olivia,Johnson,olivia.johnson@nexloom.io,JP,MH,Europe/London,2023-04-07 0:00,Referral,BF2024,iOS,1.1.0,unknown,Support,0,35,U000179,Y,2023-04-07 5:35,2023-06-05 5:35
U002316,Kofi,Perez,kofi.perez@yahoo.com,US,NY,America/Los_Angeles,2023-08-13 0:00,Paid Search,BF2024,macOS,1.3.0,11-50,HR,1,38,,TRUE,2023-08-13 1:04,2024-01-06 1:04
U001444,Yuki,Lee,yuki.lee@company.com,US,SP,,2024-02-29 0:00,Paid Search,RETARGET1,macOS,v1.0.9,11-50,Finance,0,43,,no,2024-02-29 10:15,2024-06-07 10:15
U001484,Diego,Harris,diego.harris@icloud.com,US,WA,America/New_York,2023-01-17 0:00,Webinar,GROWTHLAB,Unknown,2.0.0,1000+,Marketing,0,39,,N,2023-01-17 14:17,2023-02-11 14:17
U002180,Leo,Nguyen,leo.nguyen@proton.me,IN,unknown,America/Los_Angeles,2024-04-04 0:00,Webinar,WINTER25,Windows,1.2.0,201-500,Engineering,0,55,,FALSE,2024-04-04 16:10,2024-09-13 16:10
 U001589 ,Omar,Martin,omar.martin@outlook.com,NL,MH,,2024-02-21 0:00,Partner,SPRING24,iOS,1.2.0,501-1000,Founder,0,51,,TRUE,2024-02-21 18:40,2024-03-21 18:40
U001438,Lucas,Scott,lucas.scott@proton.me,GB,RJ,,2024-07-14 0:00,Outbound,GROWTHLAB,Android,2.1.0,501-1000,Product,0,46,,N,2024-07-14 18:44,2024-10-17 18:44
U000007,Mia,Scott,mia.scott@gmail.com,ZA,CA,Asia/Tokyo,2024-09-18,Outbound,WINTER25,Linux,2.0.0,1000+,Support,1,23,,0,2024-09-18 6:59,2025-03-11 6:59
U000301,Nora,Clark,nora.clark@outlook.com,SG,SP,Europe/Berlin,2023-05-02 0:00,content,N/A,iOS,1.1.0,unknown,Support,0,46,,N,2023-05-02 13:35,2023-10-29 13:35
U002317,Sofia,Anderson,sofia.anderson@gmail.com,US,BC,Europe/Berlin,2023-11-29 0:00,Social,GROWTHLAB,Android,1.2.0,unknown,Support,0,25,,1,2023-11-29 11:07,2024-05-26 11:07
U000671,Ivy,Harris,ivy.harris@outlook.com,SE,NSW,Europe/London,2023-09-19 0:00,Organic Search,AI-LAUNCH,macOS,1.0.9,unknown,Product,0,50,,,2023-09-19 7:15,2024-01-05 7:15
U000584,Ben,Perez,ben.perez@nexloom.io,US,BC,,2023-12-31 0:00,Webinar,SPRING24,Unknown,2.0.0,11-50,Sales,1,,,,2023-12-31 18:31,2024-06-18 18:31
U001229,Sofia,Jackson,sofia.jackson@icloud.com,NL,SP,Europe/London,2025-08-13 0:00,Webinar,RETARGET1,macOS,2.0.0,51-200,Founder,0,55,,yes,2025-08-13 8:37,2026-01-14 8:37
U001892,Sofia,Johnson,sofia.johnson@gmail.com,SG,BER,UTC,2024-02-08 0:00,Content,SPRING24,Unknown,1.2.0,10-Jan,Ops,1,62,,FALSE,2024-02-08 11:43,2024-07-18 11:43
U000216,Leo,Lee,leo.lee@company.com,FR,TX,Asia/Tokyo,2023-11-05 0:00,Content,N/A,iOS,1.2.1,11-50,Ops,1,34,,FALSE,2023-11-05 7:46,2023-11-30 7:46
U002508,Olivia,Taylor,olivia.taylor@company.com,DE,TX,Asia/Tokyo,2024-02-27 0:00,Social,AI-LAUNCH,Android,1.1.0,unknown,Support,0,62,,0,2024-02-27 3:56,2024-08-06 3:56
U002056,Noah,Wright,noah.wright@gmail.com,SE,unknown,Asia/Tokyo,06/24/2024,Outbound,SUMMER24,Android,1.2.1,51-200,HR,0,41,,N,2024-06-24 8:41,2024-07-26 8:41
U001581,Ivy,Robinson,ivy.robinson@proton.me,CA,-,,11/01/2023,Referral,n/a,Android,2.0.1,unknown,Engineering,0,34,,TRUE,2023-11-01 7:41,2023-12-28 7:41
U000458,Ivy,Lee,ivy.lee@gmail.com,SG,unknown,America/New_York,03/13/2024,Paid Search,AI-LAUNCH,Unknown,1.0.9,11-50,Founder,0,44,,FALSE,2024-03-13 11:20,2024-04-02 11:20
U001295,Sofia,Wright,sofia.wright@company.com,ZA,TX,America/Los_Angeles,14-09-2024,Webinar,SUMMER24,macOS,2.0.0,1000+,HR,0,36,,1,2024-09-14 14:08,01-09-2025 14:08
U002280,Elena,Nguyen,elena.nguyen@company.com,IN,LND,UTC,2023-06-02,Referral,n/a,iOS,1.2.1,51-200,Support,0,,U000033,FALSE,2023-06-02 6:29,2023-06-19 6:29
U002007,Fatima,Robinson,fatima.robinson@gmail.com,NL,LND,Asia/Tokyo,2024-03-03 0:00,Paid Search,N/A,macOS,1.0.9,201-500,Product,0,42,,TRUE,2024-03-03 21:12,2024-05-02 21:12
U002033,Fatima,Scott,fatima.scott@gmail.com,NL,,,2024-03-11 0:00,Organic Search,,iOS,1.3.0,1000+,Founder,0,18,,Y,2024-03-11 16:24,2024-05-14 16:24
u000685,Ethan,Moore,ethan.moore@yahoo.com,CA,LND,,2025-02-08 0:00,Referral,WINTER25,macOS,1.1.2,unknown,Founder,0,54,U000060,N,2025-02-08 21:52,0000-00-00 00:00:00
U000708,Ravi,Martinez,ravi.martinez@nexloom.io,CA,WA,Europe/Berlin,2024-09-21 0:00,Partner,SUMMER24,Windows,2.1.0,501-1000,Support,0,34,,no,2024-09-21 8:16,2024-09-23 8:16
U002450,Mia,Taylor,mia.taylor@company.com,JP,CA,America/Los_Angeles,2024-01-07 0:00,Partner,BF2024,macOS,1.2.0,unknown,HR,1,33,,0,2024-01-07 10:06,2024-03-06 10:06
U001863,Nora,Perez,nora.perez@gmail.com,FR,MH,,2023-09-23 0:00,Outbound,Q3_PROMO,macOS,2.0.1,10-Jan,Finance,1,43,,TRUE,2023-09-23 21:22,2023-10-04 21:22
U001072,Yuki,Lopez,yuki.lopez@icloud.com,ZA,LND,,2023-11-03 0:00,Partner,WINTER25,iOS,2.1.0,201-500,Marketing,0,56,,FALSE,2023-11-03 5:55,03-03-2024 05:55
U001905,Omar,Robinson,omar.robinson@yahoo.com,CA,TX,,2024-08-07 0:00,Outbound,N/A,Unknown,2.0.0,10-Jan,Ops,0,37,,1,2024-08-07 8:25,2024-11-07 8:25
U000800,Chen,Wright, chen.wright@yahoo.com ,BR,SP,UTC,2025-01-26 0:00,Organic Search,BF2024,Unknown,2.0.1,unknown,Marketing,0,24,,TRUE,2025-01-26 18:27,2025-06-07 18:27
U001630,Mateo,Martin,mateo.martin@nexloom.io,JP,RJ,Asia/Tokyo,2024-03-04 0:00,outbound,Q3_PROMO,Windows,2.0.0,201-500,HR,0,36,,FALSE,2024-03-04 9:05,2024-07-06 9:05
U001149,leo,King,leo.king@outlook.com,SG,ON,America/Los_Angeles,2024-10-26 0:00,Organic Search,n/a,Windows,1.0.9,10-Jan,Founder,0,46,,yes,2024-10-26 2:38,2025-04-02 2:38
U000114,Jin,Scott,jin.scott@yahoo.com,GB,,,2024-09-20,Paid Search,GROWTHLAB,Windows,1.1.0,11-50,Founder,0,unknown,,,2024-09-20 7:49,2025-01-21 7:49
U000568,Kofi,Jackson,kofi.jackson@yahoo.com,IN,SP,Europe/Berlin,03-45-2024,organic search,WINTER25,macOS,2.0.0,201-500,Engineering,1,49,,TRUE,2024-02-26 18:40,2024-02-29 18:40
U002480,Ivy,Smith,ivy.smith@company.com,DE,BER,Asia/Tokyo,2024-09-09 0:00,Outbound,SPRING24,iOS,1.1.0,11-50,Ops,0,40,,yes,2024-09-09 12:27,2025-02-10 12:27
U000504,Mateo,Smith,mateo.smith@gmail.com,SG,,UTC,2024-09-24 0:00,content,N/A,macOS,1.2.0,201-500,Ops,1,54,,N,2024-09-24 22:02,2024-10-05 22:02
U000968,Ben,Lopez,ben.lopez@yahoo.com,IN,BER,Asia/Tokyo,2023-12-12 0:00,Content,GROWTHLAB,Android,1.1.2,51-200,Support,0,,,FALSE,2023-12-12 22:46,2024-02-26 22:46
U001278,Sara,Patel,sara.patelcompany.com,CA,WA,Europe/London,2025-08-29,Content,AI-LAUNCH,Windows,1.0.9,51-200,Founder,0,37,,N,2025-08-29 9:42,2026-02-18 9:42
U001347,Emma,Johnson,emma.johnson@outlook.com,NL,,Europe/Berlin,2024-01-09 0:00,Paid Search,N/A,Unknown,1.0.9,unknown,Engineering,0,64,,1,2024-01-09 17:41,05-10-2024 17:41
U000981,Emma,Wright,emma.wright@company.com,IN,-,Asia/Tokyo,2024-01-03,Referral,RETARGET1,Linux,2.1.0,201-500,Sales,0,31,,N,2024-01-03 4:04,2024-03-09 4:04
U002032,Sara,Harris,sara.harris@company.com,se,WA,America/New_York,2024-04-30 0:00,Partner,N/A,Windows,1.1.0,11-50,Product,,N/A,,TRUE,2024-04-30 17:17,2024-06-07 17:17
U001128,Olivia,Clark, olivia.clark@company.com ,US,SP,,2024-02-11 0:00,Paid Search,WINTER25,iOS,1.1.0,11-50,Support,0,26,,FALSE,2024-02-11 10:09,2024-04-04 10:09
U000193,Liam,Perez,liam.perez@gmail.com,IN,TX,UTC,2024-12-22 0:00,outbound,N/A,Windows,2.1.0,11-50,Marketing,FALSE,20,  U000120,1,2024-12-22 11:39,2025-02-07 11:39
U002148,Amir,Thomas,amir.thomas@yahoo.com,IN,MH,America/Los_Angeles,2024-01-16 0:00,Content,BF2024,iOS,1.2.1,unknown,Support,0,29,,0,2024-01-16 4:06,2024-03-23 4:06
U000447,Noah,Davis,noah.davis@gmail.com,SG,BER,UTC,2025-08-25 0:00,Referral,n/a,Linux,2.1.0,1000+,Ops,1,49,U000198,yes,2025-08-25 0:13,2025-09-27 0:13
 U001417 ,Anya,Perez, anya.perez@outlook.com ,SG,RJ,America/New_York,2023-04-08 0:00,Webinar,AI-LAUNCH,Android,1.1.0,501-1000,Support,0,52,,1,2023-04-08 7:07,2023-08-25 7:07
U000297,Nora,Scott,nora.scott@proton.me,MX,,,2024-08-23 0:00,Social,N/A,Linux,1.1.0,10-Jan,Engineering,0,46,,,2024-08-23 17:23,09-13-2024 17:23
U000317,Omar,Robinson,omar.robinson@nexloom.io,BR,,America/New_York,2024-02-12 0:00,Paid Search,BF2024,macOS,1.2.0,51-200,Founder,0,57,,N,2024-02-12 13:06,2024-07-28 13:06
U000705,Yuki,Smith,yuki.smith@company.com,CA,,America/New_York,2023-05-21 0:00,Content,N/A,iOS,2.1.0,501-1000,Founder,0,18,,yes,2023-05-21 8:18,2023-06-14 8:18
U000772,hana,Scott,hana.scott@proton.me,US,ON,,2024-10-22 0:00,Content,GROWTHLAB,macOS,2.0.0,501-1000,Product,,48,,TRUE,2024-10-22 9:54,2025-02-13 9:54
U000903,Jin,Moore,jin.moore@company.com,DE,SP,America/New_York,09/26/2023,Partner,SPRING24,macOS,v2.0.0,201-500,Founder,0,58,,Y,2023-09-26 10:23,2023-10-13 10:23
U001336,Sophia,Brown,sophia.brown@company.com,SE,BER,America/Los_Angeles,2024-06-14 0:00,Paid Search,AI-LAUNCH,Android,1.2.0,11-50,Sales,1,36,,N,2024-06-14 16:23,2024-10-20 16:23
U001015,Mateo,Moore,mateo.moore@icloud.com,SG,ON,Europe/London,2024-07-14 0:00,Social,RETARGET1,Android,1.1.2,10-Jan,Sales,0,N/A,,Y,2024-07-14 23:57,
U000528,Yuki,Jackson,yuki.jackson@outlook.com,JP,BC,America/Los_Angeles,11/28/2023,Organic Search,Q3_PROMO,Unknown,2.1.0,201-500,Finance,0,19,,TRUE,2023-11-28 5:30,2024-04-14 5:30
U000489,Elena,Harris,elena.harris@icloud.com,JP,RJ,America/Los_Angeles,2025-03-30 0:00,Paid Search,WINTER25,Android,1.2.0,201-500,Founder,no,40,,FALSE,2025-03-30 23:07,2025-09-05 23:07
U001350,Ivy,Jackson,ivy.jackson@proton.me,DE,NY,UTC,2023-04-10 0:00,Webinar,,Linux,1.0.9,unknown,Support,0,32,,,2023-04-10 21:35,2023-05-20 21:35
u001731,Omar,Patel,omar.patel@outlook.com,MX,-,Asia/Kolkata,2023-12-18 0:00,Content,AI-LAUNCH,Windows,1.2.1,unknown,Product,0,38,,N,2023-12-18 1:49,2024-01-30 1:49
U001809,Jin,Clark,jin.clark@nexloom.io,MX,TX,Asia/Kolkata,2023-09-20 0:00,Paid Search,WINTER25,Linux,1.2.0,201-500,Founder,1,44,,1,2023-09-20 7:34,2023-10-07 7:34
U000048,Priya,Johnson,priya.johnson@nexloom.io,FR,NSW,America/New_York,2024-04-08 0:00,Content,SPRING24,macOS,1.3.0,10-Jan,Finance,0,,,TRUE,2024-04-08 4:55,2024-05-28 4:55
U001756,Anya,Nguyen,anya.nguyen@proton.me,JP,,,2024-09-15 0:00,Partner,SUMMER24,Android,1.0.9,201-500,Support,0,53,,TRUE,2024-09-15 16:42,2024-10-09 16:42
U002371,Priya,Martin,priya.martin@yahoo.com,MX,,,2024-06-15 0:00,Content,GROWTHLAB,Android,1.1.0,501-1000,Engineering,0,55,,TRUE,2024-06-15 2:24,2024-11-24 2:24
U000902,Leo,Robinson,LEO.ROBINSON@COMPANY.COM,NL,TX,UTC,2023-03-12 0:00,Content,GROWTHLAB,Android,1.0.9,10-Jan,Engineering,1,23,,yes,2023-03-12 6:24,2023-08-06 6:24
U001552,Ravi,Thompson,ravi.thompson@outlook.com,ZA,RJ,UTC,2024-05-19 0:00,Referral,Q3_PROMO,Windows,1.2.1,201-500,Ops,0,,U000019,FALSE,2024-05-19 10:11,2024-07-24 10:11
U002206,Ivy,Lewis,ivy.lewis@icloud.com,US,ON,America/Los_Angeles,2025-01-19 0:00,Content,BF2024,iOS,1.1.0,10-Jan,Sales,0,54,,FALSE,2025-01-19 5:06,2025-03-03 5:06
U000067,Lucas,Wilson,lucas.wilson@yahoo.com,AU,SP,,2023-08-22 0:00,Referral,N/A,iOS,2.0.0,unknown,Marketing,0,37,,FALSE,2023-08-22 2:17,2023-11-06
U001412,Ivy,Clark,ivy.clark@outlook.com,SG,-,,2023-07-24,Webinar,N/A,macOS,v1.1.0,11-50,HR,1,33,,TRUE,2023-07-24 8:02,2023-11-20 8:02
U000680,Diego,Davis,diego.davis@icloud.com,BR,BC,America/New_York,2024-11-10 0:00,Partner,BF2024,Linux,2.1.0,51-200,Ops,0,56,,1,2024-11-10 17:14,2025-02-23 17:14
U001777,Ava,Allen, ava.allen@outlook.com ,US,CA,,2024-07-04 0:00,Partner,GROWTHLAB,Android,1.2.0,10-Jan,Finance,yes,49,,TRUE,2024-07-04 8:28,2024-09-20
U000616,Amir,King,amir.king@icloud.com,CA,unknown,America/Los_Angeles,2025-01-23 0:00,Social,WINTER25,Unknown,2.1.0,501-1000,Product,0,61,,TRUE,2025-01-23 3:01,2025-06-10 3:01
U001043,Ravi,Perez,ravi.perez@nexloom.io,SE,ON,UTC,2023-12-25 0:00,Referral,n/a,Android,1.1.0,501-1000,Support,0,19,U000014,N,2023-12-25 9:28,2024-01-18 9:28
U001950,Ben,Scott,ben.scott@gmail.com,AU,,Asia/Tokyo,2024-02-24 0:00,webinar,  BF2024  ,Unknown,1.2.0,51-200,Ops,0,62,,N,2024-02-24 20:14,2024-04-12 20:14
U000222,Anya,Taylor,anya.taylor@outlook.com,GB,MH,,2024-05-02,Paid Search,GROWTHLAB,Unknown,1.0.9,unknown,Founder,0,42,,TRUE,2024-05-02 6:53,2024-07-04 6:53
U001331,Ravi,Davis,ravi.davis@proton.me,NL,ON,America/New_York,2024-04-25 0:00,Paid Search,AI-LAUNCH,iOS,1.2.1,201-500,Founder,0,19,,no,2024-04-25 19:55,2024-07-05 19:55
U002455,ava,Harris,ava.harris@proton.me,GB,WA,Asia/Tokyo,2024-05-08 0:00,Outbound,N/A,Android,1.1.2,201-500,Support,0,54,,Y,2024-05-08 9:44,2024-05-21 9:44
U000994,Omar,Wright,omar.wright@nexloom.io,JP,,Asia/Kolkata,13-05-2024,Social,AI-LAUNCH,Unknown,1.2.1,unknown,Finance,0,37,,0,2024-05-13 12:38,2024-06-25 12:38
U002333,Yuki,Clark,yuki.clark@icloud.com,DE,-,,2024-05-20 0:00,Outbound,AI-LAUNCH,iOS,1.0.9,10-Jan,Finance,0,53,,FALSE,05/20/2024 19:37,2024-07-12 19:37
U002474,hana,Martin,hana.martin@icloud.com,GB,RJ,America/Los_Angeles,2024-07-24 0:00,Organic Search,AI-LAUNCH,macOS,1.3.0,201-500,Sales,1,29,,FALSE,2024-07-24 19:37,2024-11-10 19:37
U000350,Liam,Wright,liam.wright@company.com,FR,unknown,Asia/Kolkata,2024-06-01 0:00,Outbound,SPRING24,Android,2.0.0,11-50,Finance,1,60,,no,2024-06-01 13:53,2024-07-07 13:53
U001151,Ravi,Taylor,ravi.taylor@nexloom.io,AU,,Europe/London,2024-07-16 0:00,Social,BF2024,iOS,1.1.2,10-Jan,Ops,0,58,,Y,2024-07-16 1:55,2024-11-15 1:55
U000551,Mateo,Lewis,mateo.lewis@yahoo.com,GB,,Europe/Berlin,2024-04-08 0:00,Webinar,SPRING24,Unknown,2.1.0,1000+,Finance,0,54,,TRUE,2024-04-08 9:53,2024-04-11 9:53
U000418,Noah,Walker,noah.walker@outlook.com,AU,unknown,Asia/Kolkata,2023-12-31 0:00,Social,WINTER25,Linux,2.1.0,11-50,Ops,0,29,,0,2023-12-31 13:51,2024-03-15 13:51
U002212,Hana,Jackson,hana.jackson@icloud.com,MX,,Asia/Kolkata,2024-09-17 0:00,Paid Search,SUMMER24,Unknown,1.2.0,1000+,Engineering,0,27,,yes,2024-09-17 14:51,2025-01-11 14:51
U001042,Ethan,Thomas,ethan.thomas@company.com,SG,RJ,UTC,2024-09-07 0:00,Social,GROWTHLAB,Windows,1.1.2,51-200,Finance,1,29,  U000120,TRUE,2024-09-07 2:49,2024-10-21 2:49
U001682,Lucas,Clark,lucas.clark@company.com,CA,NSW,America/Los_Angeles,2025-06-30 0:00,Partner,RETARGET1,Windows,1.1.0,unknown,HR,0,29,,TRUE,2025-06-30 18:51,2025-07-16 18:51
U000045,Priya,Garcia,priya.garcia@yahoo.com,NL,BC,Europe/London,2023-11-19 0:00,Content,AI-LAUNCH,iOS,1.1.0,1000+,Founder,0,26,,,2023-11-19 5:31,2024-02-09 5:31
U000287,Priya,Anderson,priya.anderson@gmail.com,DE,CA,America/Los_Angeles,2024-03-11 0:00,Referral,n/a,Linux,2.1.0,1000+,Engineering,0,34,U000317,0,2024-03-11 11:15,2024-08-27 11:15
U000589,Amir,Brown,amir.brown@yahoo.com,SE,MH,Europe/London,2023-08-10 0:00,Social,AI-LAUNCH,Android,1.0.9,unknown,Ops,1,29,,TRUE,08/10/2023 02:39,2023-12-15 2:39
U000356,Chen,Lewis,chen.lewis@nexloom.io,SG,CA,UTC,2024-06-09 0:00,Paid Search,SUMMER24,Android,1.2.1,11-50,Ops,0,56,,TRUE,2024-06-09 3:56,2024-07-19 3:56
U000811,Zoe,Taylor,zoe.taylor@company.com,FR,NSW,America/New_York,2025-08-18 0:00,partner,AI-LAUNCH,iOS,1.1.2,51-200,Sales,0,61,,,2025-08-18 8:55,2026-01-07
U001504,Emma,Lopez,emma.lopez@gmail.com,GB,SP,Europe/Berlin,2024-01-06 0:00,Outbound,Q3_PROMO,Android,2.0.1,201-500,Support,0,45,,yes,2024-01-06 14:18,2024-02-27 14:18
U001341,Diego,Smith,diego.smith@company.com,GB,LND,Asia/Kolkata,2023-11-18 0:00,Paid Search,SUMMER24,Android,1.1.0,1000+,Finance,0,62,,no,2023-11-18 11:52,2024-02-23 11:52
U002199,Emma,Walker,emma.walker@nexloom.io,IN,NY,Asia/Kolkata,2024-04-21 0:00,Webinar,GROWTHLAB,Unknown,1.1.0,11-50,Founder,0,49,,TRUE,2024-04-21 23:20,2024-05-04 23:20
U001007,Hana,Lee,hana.lee@yahoo.com,FR,NY,Asia/Kolkata,2024-07-07 0:00,Referral,SUMMER24,iOS,v1.2.1,10-Jan,Product,0,51,,TRUE,2024-07-07 15:56,2024-07-10
U002181,Diego,White,diego.white@outlook.com,NL,RJ,UTC,2023-12-17 0:00,Webinar,GROWTHLAB,Windows,1.0.9,unknown,Finance,0,25,,N,2023-12-17 2:06,2024-01-02
U000794,Omar,Lewis,omar.lewis@outlook.com,AU,MH,,2024-05-24 0:00,Referral,N/A,Unknown,1.0.9,10-Jan,Founder,0,57,U000187,1,2024-05-24 7:09,2024-09-08
U000179,Omar,Perez,omar.perez@yahoo.com,US,RJ,America/Los_Angeles,2025-02-24 0:00,Content,N/A,iOS,v1.3.0,501-1000,Product,1,41,,N,2025-02-24 22:34,2025-04-27 22:34
U002031,Leo,Martinez,leo.martinez@company.com,se,BC,Europe/London,2023-10-08 0:00,Organic Search,n/a,Windows,1.0.9,51-200,Product,,24,,,2023-10-08 18:32,2023-11-05 18:32
U001009,Sofia,Thompson,sofia.thompson@icloud.com,ZA,unknown,UTC,2023-11-13 0:00,referral,n/a,Linux,2.0.1,10-Jan,Sales,1,33,U000379,yes,2023-11-13 17:52,2024-04-08 17:52
U000846,Nora,Patel,nora.patel@proton.me,fr,BER,America/Los_Angeles,2024-02-14 0:00,Paid Search,BF2024,macOS,1.1.2,201-500,Marketing,0,57,,FALSE,2024-02-14 12:40,06-06-2024 12:40
U001554,Kofi,Jackson,kofi.jackson@icloud.com,JP,WA,America/New_York,2024-12-01 0:00,Paid Search,N/A,Windows,1.1.0,unknown,Support,0,60,,yes,2024-12-01 0:58,2025-02-14 0:58
U002301,Zoe,Allen,ZOE.ALLEN@GMAIL.COM,NL,LND,,2024-09-15 0:00,Referral,N/A,Android,2.0.0,11-50,Support,0,42,,N,2024-09-15 9:47,2025-02-21 9:47
U002272,Mia,Lewis,mia.lewis@icloud.com,IN,unknown,Asia/Tokyo,2024-01-30 0:00,Referral,,Unknown,1.0.9,501-1000,Support,0,25,,Y,2024-01-30 21:33,2024-07-08 21:33
U001079,Ben,Smith,ben.smith@company.com,IN,BC,,2023-10-23 0:00,Referral,RETARGET1,iOS,2.0.1,501-1000,Marketing,0,32,U000367,FALSE,2023-10-23 7:04,2023-12-06 7:04
U001508,Priya,Lopez,priya.lopezcompany.com,AU,NY,Asia/Kolkata,2024-04-14 0:00,Content,GROWTHLAB,Unknown,1.2.1,51-200,Engineering,0,47,,1,2024-04-14 13:40,2024-09-24
U002295,Sofia,Jackson,sofia.jackson@icloud.com,ZA,TX,UTC,2023-01-17 0:00,Outbound,WINTER25,Linux,2.0.1,501-1000,Support,0,,,FALSE,2023-01-17 14:40,2023-07-01 14:40
U001227,Hana,Jackson,hana.jackson@company.com,IN,,Asia/Kolkata,2024-02-06 0:00,Social,SPRING24,Android,2.0.0,501-1000,Ops,1,60,,no,2024-02-06 13:49,2024-07-19 13:49
U000582,Zoe,Brown,zoe.brown@yahoo.com,AU,,Asia/Kolkata,2025-07-22 0:00,Organic Search,n/a,Unknown,1.2.0,51-200,Sales,0,26,,yes,2025-07-22 3:30,2025-08-27 3:30
U002356,Yuki,White,yuki.white@outlook.com,FR,CA,Europe/London,2023-08-02 0:00,Webinar,null,Unknown,2.1.0,10-Jan,Finance,1,,,TRUE,2023-08-02 12:15,2023-09-09 12:15
U000252,sara,Scott,sara.scott@gmail.com,SG,SP,,2024-01-30 0:00,Paid Search,AI-LAUNCH,iOS,1.1.0,201-500,Ops,1,37,,TRUE,2024-01-30 1:31,2024-02-25 1:31
U001605,Kofi,Robinson,kofi.robinson@yahoo.com,ZA,MH,America/Los_Angeles,2023-05-30 0:00,Webinar,WINTER25,Linux,1.2.1,unknown,Founder,0,55,,,2023-05-30 0:21,2023-08-13 0:21
U001435,Amir,Lopez,amir.lopez@proton.me,SE,LND,America/Los_Angeles,2023-08-21,Paid Search,N/A,Linux,2.0.0,10-Jan,Ops,0,63,,yes,2023-08-21 23:43,2024-01-14 23:43
U001683,Sara,Clark,sara.clark@nexloom.io,SE,LND,,2024-06-09 0:00,Social,SPRING24,Linux,2.0.0,unknown,Ops,0,,,,2024-06-09 0:20,2024-09-26 0:20
U001380,Mia,Robinson,MIA.ROBINSON@OUTLOOK.COM,SG,CA,UTC,2024-05-14 0:00,Partner,WINTER25,Android,1.2.0,51-200,Marketing,0,55,,no,2024-05-14 9:52,2024-06-28 9:52
U000195,Sophia,Lopez,sophia.lopez@yahoo.com,CA,-,Europe/Berlin,2024-01-05 0:00,Content,WINTER25,Linux,2.1.0,10-Jan,Ops,0,49,,TRUE,2024-01-05 14:14,2024-05-05 14:14
U000519,Olivia,White,olivia.white@nexloom.io,IN,WA,UTC,2025-09-02 0:00,Partner,SPRING24,macOS,1.2.0,201-500,Ops,0,64,,yes,2025-09-02 20:48,2026-02-05 20:48
U001686,Leo,King,leo.king@nexloom.io,US,NY,Europe/London,2024-11-06 0:00,Partner,SPRING24,Android,1.1.0,unknown,Support,0,39,,no,2024-11-06 21:01,2024-11-23
U002459,Ravi,Garcia,ravi.garcia@company.com,BR,WA,,2024-03-23,Outbound,RETARGET1,macOS,1.0.9,501-1000,Engineering,0,51,,0,2024-03-23 0:23,2024-04-04 0:23
 U002447 ,Amir,Robinson,amir.robinson@gmail.com,IN,RJ,,2023-11-19 0:00,Partner,BF2024,Unknown,v1.3.0,1000+,Ops,0,36,,TRUE,2023-11-19 15:24,2024-01-04
U002002,Diego,NGUYEN,diego.nguyen@company.com,MX,LND,Europe/London,2023-11-11 0:00,Content,RETARGET1,Android,1.1.0,51-200,Ops,0,N/A,,1,2023-11-11 17:51,2024-04-09 17:51
U001742,Sofia,Martinez,sofia.martinez@icloud.com,JP,,America/Los_Angeles,2024-07-31 0:00,Referral,WINTER25,Linux,1.0.9,10-Jan,Product,0,55,U000469,TRUE,2024-07-31 8:22,2024-09-07 8:22
u002294,Olivia,King,olivia.king@icloud.com,DE,unknown,America/Los_Angeles,2024-04-06 0:00,Webinar,Q3_PROMO,macOS,2.0.1,501-1000,Founder,1,58,,1,2024-04-06 16:16,2024-05-14 16:16
U000102,Emma,Walker,emma.walker@proton.me,br,SP,,2024-06-06 0:00,Content,WINTER25,macOS,1.1.2,11-50,Engineering,0,60,,,2024-06-06 11:42,2024-08-20 11:42
U000033,Fatima,Walker,fatima.walker@yahoo.com,SE,,America/New_York,2023-05-24 0:00,Outbound,WINTER25,Android,2.0.1,11-50,Founder,FALSE,40,,1,2023-05-24 20:27,2023-06-07
U000946,Diego,Martinez,diego.martinez@proton.me,SG,RJ,,2023-02-01 0:00,Partner,RETARGET1,Unknown,2.0.0,10-Jan,Ops,0,54,,0,2023-02-01 14:54,2023-05-29 14:54
U000687,Ava,Lewis,ava.lewis@yahoo.com,GB,WA,America/New_York,2024-05-04,Webinar,N/A,Windows,1.2.0,unknown,Marketing,1,19,,TRUE,2024-05-04 13:21,2024-10-11
U000726,Liam,Davis,liam.davis@yahoo.com,DE,TX,,2024-10-18 0:00,Referral,RETARGET1,Linux,1.3.0,unknown,Product,0,29,U000382,0,2024-10-18 13:42,2024-11-09 13:42
U002278,Liam,Brown,liam.brown@icloud.com,ZA,BC,,2024-04-01 0:00,Organic Search,n/a,Unknown,2.0.0,11-50,Founder,1,25,,TRUE,2024-04-01 12:24,2024-05-15 12:24
U001827,Nora,Perez,nora.perez@proton.me,mx,RJ,Asia/Kolkata,2023-04-14 0:00,Paid Search,RETARGET1,Unknown,v1.3.0,10-Jan,HR,0,,,,2023-04-14 3:39,2023-05-11 3:39
U000560,Ava,Young,ava.young@outlook.com,MX,RJ,,2024-05-29 0:00,partner,GROWTHLAB,iOS,1.0.9,201-500,Marketing,0,51,,FALSE,2024-05-29 12:14,2024-11-08 12:14
U002261,Mia,Martinez,mia.martinez@company.com,SE,,America/Los_Angeles,2024-08-26 0:00,Content,WINTER25,Android,1.2.1,501-1000,HR,1,54,,1,2024-08-26 2:15,2024-09-22 2:15
U002471,Anya,Garcia,anya.garcia@outlook.com,FR,RJ,,2023-10-30 0:00,Organic Search,Q3_PROMO,Unknown,1.2.1,10-Jan,Finance,0,40,,no,2023-10-30 9:58,2023-11-27 9:58
U001631,Amir,Garcia,amir.garcia@company.com,au,CA,Europe/London,2024-08-14 0:00,Paid Search,AI-LAUNCH,Unknown,2.1.0,10-Jan,Sales,1,64,,TRUE,2024-08-14 5:36,2025-01-31 5:36
U001004,Olivia,Thompson,olivia.thompson@company.com,AU,SP,America/Los_Angeles,2024-07-30 0:00,Outbound,N/A,Android,2.0.0,11-50,Founder,0,39,,TRUE,2024-07-30 13:39,2024-11-20 13:39
U002109,Yuki,Garcia,YUKI.GARCIA@YAHOO.COM,JP,NY,America/Los_Angeles,2023-11-30 0:00,Partner,SPRING24,iOS,1.0.9,11-50,Ops,0,43,,TRUE,2023-11-30 9:33,
U001440,Mateo,Martin,mateo.martin@nexloom.io,IN,MH,UTC,2024-06-26,Content,WINTER25,iOS,1.1.2,51-200,Product,0,48,,TRUE,2024-06-26 13:53,2024-09-18 13:53
U000605,Amir,Wilson,amir.wilson@nexloom.io,GB,LND,Europe/London,2023-08-02 0:00,Partner,WINTER25,iOS,2.0.0,10-Jan,Ops,0,49,,FALSE,2023-08-02 22:38,2023-09-16 22:38
U000309,Olivia,Garcia,OLIVIA.GARCIA@OUTLOOK.COM,US,-,Asia/Tokyo,2024-09-10 0:00,Content,WINTER25,Linux,1.1.0,201-500,Finance,0,63,,1,2024-09-10 5:40,2025-02-19 5:40
U001960,Leo,Lee,leo.lee@company.com,GB,NY,Europe/London,2024-09-03 0:00,Referral,SUMMER24,macOS,2.1.0,11-50,Product,0,N/A,U000061,0,2024-09-03 20:01,2025-02-08 20:01
U002487,Ravi,Lopez,ravi.lopez@nexloom.io,AU,unknown,,2024-03-20 0:00,Organic Search,n/a,Android,1.2.0,10-Jan,Ops,0,64,,TRUE,2024-03-20 9:06,2024-06-21 9:06
u001524,Noah,Scott,noah.scott@yahoo.com,DE,-,Europe/London,2023-07-12 0:00,Partner,RETARGET1,Windows,1.0.9,51-200,Marketing,0,63,,TRUE,2023-07-12 1:36,2023-08-13 1:36
U002153,Zoe,Wilson,zoe.wilson@company.com,AU,unknown,Asia/Kolkata,2024-07-18 0:00,Paid Search,Q3_PROMO,Android,1.2.0,10-Jan,Support,no,63,,FALSE,2024-07-18 8:29,2024-11-16 8:29
U000766,Noah,Thomas,NOAH.THOMAS@OUTLOOK.COM,IN,CA,America/Los_Angeles,05/03/2024,Outbound,WINTER25,macOS,2.0.0,10-Jan,Sales,1,56,,N,2024-05-03 15:28,2024-08-15 15:28
U001969,Omar,Young,omar.young@outlook.com,IN,LND,America/New_York,2024-01-03 0:00,Referral,N/A,Linux,2.0.1,11-50,Engineering,0,50,U000477,FALSE,2024-01-03 0:58,2024-06-10 0:58
U000185,Leo,Taylor,leo.taylor@gmail.com,DE,TX,,2023-11-18 0:00,Partner,RETARGET1,macOS,v2.0.1,unknown,Finance,0,35,,yes,2023-11-18 3:25,2023-12-29 3:25
U000407,Ava,Scott,ava.scott@yahoo.com,CA,,Europe/Berlin,2024-02-01 0:00,Partner,WINTER25,Unknown,v1.3.0,unknown,Finance,0,24,,TRUE,2024-02-01 7:44,2024-07-18 7:44
U000912,Mateo,Walker,mateo.walker@nexloom.io,GB,ON,,11/25/2023,Social,BF2024,Linux,1.1.0,51-200,Ops,0,20,,TRUE,2023-11-25 1:10,2024-01-12 1:10
U001050,Ravi,Garcia,ravi.garcia@proton.me,BR,BC,,2023-02-28 0:00,Organic Search,n/a,Android,1.1.0,201-500,Ops,0,58,,TRUE,2023-02-28 16:25,2023-05-06 16:25
USR-001232,Elena,LEWIS,elena.lewis@proton.me,SE,NY,Europe/London,2023-10-31,Content,BF2024,Unknown,1.0.9,10-Jan,Ops,0,58,,no,2023-10-31 21:32,2024-03-03 21:32
U002303,Ben,Jackson,ben.jackson@yahoo.com,BR,LND,,2024-04-04 0:00,Partner,GROWTHLAB,Linux,2.1.0,201-500,Founder,0,63,,FALSE,04/04/2024 14:13,2024-09-20
U000859,Ivy,Young,ivy.young@icloud.com,SG,BER,Europe/Berlin,2024-04-30 0:00,Partner,Q3_PROMO,Linux,1.3.0,501-1000,Finance,0,27,U00000X,TRUE,2024-04-30 19:12,2024-07-06
U001527,Chen,Wilson,chen.wilson@company.com,DE,NY,,2023-12-05 0:00,Content,BF2024,macOS,2.1.0,51-200,Founder,0,43,,TRUE,2023-12-05 16:37,2024-03-09 16:37
U001529,Mateo,Harris,mateo.harris@proton.me,BR,RJ,UTC,2024-09-16 0:00,Webinar,SPRING24,Linux,1.3.0,501-1000,Founder,1,37,,1,2024-09-16 10:31,2024-10-07 10:31
U001632,Kofi,Robinson,kofi.robinson@nexloom.io,DE,-,,2024-01-10 0:00,Social,GROWTHLAB,iOS,1.1.0,51-200,Product,0,59,,FALSE,2024-01-10 15:42,2024-03-25 15:42
U001633,Jin,Wright,jin.wrighticloud.com,FR,CA,Asia/Tokyo,06/21/2024,Organic Search,WINTER25,Windows,1.1.0,11-50,Founder,0,33,,FALSE,2024-06-21 20:50,2024-06-25 20:50
U001634,Sofia,Davis,sofia.davis@gmail.com,NL,ON,Asia/Tokyo,2024-09-10 0:00,Social,RETARGET1,Unknown,2.0.0,unknown,Support,0,50,,1,2024-09-10 0:20,09-20-2024 00:20
U000666,Noah,Young,noah.young@icloud.com,SG,-,America/New_York,2023-09-02 0:00,Webinar,SPRING24,Android,v2.0.0,11-50,Marketing,no,30,,no,2023-09-02 9:42,2024-02-14 9:42
U001575,Nora,Harris,nora.harris@yahoo.com,BR,MH,UTC,2023-10-22 0:00,Social,GROWTHLAB,Windows,2.0.1,unknown,Marketing,0,25,,FALSE,2023-10-22 14:08,2023-12-15 14:08
U001418,Fatima,Lewis,fatima.lewis@proton.me,JP,SP,America/Los_Angeles,2023-08-03 0:00,Social,Q3_PROMO,macOS,1.1.2,201-500,Founder,0,53,,,2023-08-03 16:28,2023-08-21 16:28
U001603,Mia,Taylor,mia.taylor@gmail.com,CA,unknown,Asia/Kolkata,2023-10-29 0:00,Organic Search,Q3_PROMO,Windows,1.1.2,201-500,Marketing,0,56,,yes,10/29/2023 09:51,2023-12-05 9:51
U000364,Lucas,Davis,lucas.davis@yahoo.com,BR,NY,Europe/London,04/20/2024,Partner,RETARGET1,Android,1.3.0,1000+,Ops,0,39,,Y,2024-04-20 10:19,2024-07-26 10:19
U000495,Kofi,Young,kofi.young@icloud.com,IN,ON,Europe/London,2024-03-10,Webinar,Q3_PROMO,iOS,1.3.0,51-200,Product,0,50,,yes,2024-03-10 20:59,2024-05-24 20:59
U002313,Zoe,Martin,zoe.martin@nexloom.io,JP,BER,America/Los_Angeles,2024-03-25 0:00,Webinar,Q3_PROMO,Android,1.2.0,501-1000,Marketing,0,unknown,,TRUE,2024-03-25 0:15,2024-06-01 0:15
U001393,Ben,Taylor,ben.taylor@proton.me,SE,BER,Asia/Kolkata,2023-09-16 0:00,Content,BF2024,Android,2.0.0,501-1000,HR,0,28,,1,2023-09-16 14:36,2023-11-01 14:36
U000416,Anya,DAVIS, ANYA.DAVIS@OUTLOOK.COM ,JP,-,Asia/Kolkata,2024-03-03 0:00,Webinar,BF2024,macOS,1.1.0,51-200,Founder,1,20,,no,2024-03-03 7:23,2024-06-16 7:23
U001679,Leo,Scott,leo.scott@outlook.com,GB,,Europe/Berlin,2023-09-19,Content,WINTER25,Unknown,1.3.0,1000+,Sales,0,19,,TRUE,2023-09-19 2:55,2024-02-21 2:55
U002438,Diego,Thompson,diego.thompson@company.com,NL,-,America/Los_Angeles,2024-01-06 0:00,Paid Search,GROWTHLAB,Linux,1.1.2,10-Jan,Finance,1,35,,FALSE,2024-01-06 22:57,2024-06-16 22:57
U000062,Ivy,Harris,ivy.harris@nexloom.io,MX,CA,Europe/Berlin,2023-11-27 0:00,Webinar,RETARGET1,Windows,1.2.1,501-1000,Product,1,38,,Y,2023-11-27 19:14,2024-01-27 19:14
U000087,Hana,Johnson,hana.johnson@proton.me,BR,,Europe/London,2024-07-28 0:00,Referral,RETARGET1,Windows,1.2.1,1000+,Support,0,59,,0,2024-07-28 7:43,2024-10-04 7:43
U000009,Priya,Lewis,priya.lewis@proton.me,NL,BER,America/New_York,2024-05-19 0:00,Social,GROWTHLAB,macOS,1.0.9,unknown,Product,0,31,,0,2024-05-19 8:04,2024-06-29 8:04
U002585,Sophia,Lopez,sophia.lopez@icloud.com,MX,ON,America/Los_Angeles,2024-05-11 0:00,Webinar,N/A,Android,1.3.0,11-50,Support,1,43,,N,2024-05-11 7:30,2024-07-17 7:30
U000428,Ben,Smith,ben.smith@icloud.com,MX,NY,,2024-12-06,social,SPRING24,iOS,1.2.0,201-500,Finance,0,N/A,,FALSE,2024-12-06 6:35,2024-12-20 6:35
U002264,Sophia,Brown,sophia.brown@nexloom.io,,-,Europe/London,2024-02-29,Content,RETARGET1,iOS,2.0.1,10-Jan,Ops,0,27,,yes,2024-02-29 4:33,2024-07-24 4:33
U001216,Ravi,Perez,ravi.perez@proton.me,DE,,,2023-10-25 0:00,outbound,RETARGET1,Android,2.0.0,11-50,Marketing,0,43,,0,2023-10-25 15:44,2023-11-20 15:44
U001394,Nora,Wilson,nora.wilson@proton.me,SG,BC,,2024-04-08 0:00,Organic Search,n/a,Unknown,1.2.0,10-Jan,Engineering,0,18,,no,2024-04-08 6:32,2024-07-31 6:32
U001308,Amir,Lewis,amir.lewis@outlook.com,US,ON,Asia/Tokyo,2024-09-15 0:00,Referral,SUMMER24,Android,2.0.0,501-1000,Support,0,34,,N,2024-09-15 7:26,2025-01-23 7:26
U002227,Ravi,Taylor,ravi.taylor@yahoo.com,JP,-,Europe/London,2023-12-15 0:00,Outbound,BF2024,Linux,1.3.0,unknown,Finance,0,59,,1,2023-12-15 6:36,2023-12-31 6:36
u001670,Anya,Wright,anya.wright@nexloom.io,IN,,America/Los_Angeles,03-45-2024,Organic Search,BF2024,macOS,1.1.0,501-1000,Support,0,18,,FALSE,2024-09-27 20:20,2025-02-16 20:20
U002067,Amir,Lee,amir.lee@outlook.com,SG,-,Europe/Berlin,11-10-2023,Partner,AI-LAUNCH,Unknown,1.2.0,10-Jan,Marketing,0,38,,N,2023-10-11 23:57,2024-01-24 23:57
U002443,Ethan,Allen,ethan.allen@icloud.com,NL,,,08/18/2024,Content,WINTER25,Android,1.1.0,51-200,Ops,,20,,N,2024-08-18 3:05,2024-10-01 3:05
U000403,Fatima,Jackson,fatima.jackson@outlook.com,SG,-,Asia/Kolkata,2024-03-31 0:00,Referral,SPRING24,iOS,2.0.0,11-50,Product,1,33,U000449,FALSE,2024-03-31 20:59,2024-07-04 20:59
U000797,Mia,Lewis,mia.lewis@outlook.com,MX,,Europe/London,2025-02-14 0:00,Partner,WINTER25,Unknown,1.2.1,51-200,Product,0,49,,0,2025-02-14 3:57,2025-05-09 3:57
U001457,Mateo,Anderson,mateo.anderson@outlook.com,DE,,Europe/Berlin,2024-07-05 0:00,Referral,GROWTHLAB,Linux,1.1.0,201-500,HR,0,52,U000207,1,2024-07-05 22:47,12-27-2024 22:47
U001239,Ben,Scott,ben.scott@nexloom.io,FR,ON,America/New_York,2025-05-28 0:00,Webinar,WINTER25,macOS,2.1.0,11-50,Support,no,50,,1,2025-05-28 7:36,2025-07-17 7:36
U002217,Omar,Lewis,omar.lewis@nexloom.io,IN,RJ,Europe/Berlin,2024-10-07 0:00,Outbound,BF2024,Linux,v1.3.0,51-200,Engineering,0,51,,0,2024-10-07 8:46,2024-11-21 8:46
U002507,Zoe,Clark,zoe.clark@company.com,IN,NSW,,2024-10-29 0:00,Organic Search,,iOS,1.1.0,201-500,Marketing,0,62,,N,2024-10-29 2:45,2025-04-20 2:45
U000295,Omar,Robinson,omar.robinson@outlook.com,CA,NSW,Europe/Berlin,2023-08-09 0:00,Content,GROWTHLAB,Linux,1.0.9,1000+,Founder,0,38,,Y,2023-08-09 15:33,2023-10-28 15:33
U002093,Jin,Young,jin.young@proton.me,NL,ON,Europe/Berlin,2023-10-13 0:00,Webinar,N/A,Android,2.0.1,10-Jan,Sales,0,29,,FALSE,2023-10-13 16:12,2023-11-05 16:12
U001890,Omar,Martin,omar.martin@icloud.com,CA,ON,Europe/Berlin,2025-10-01 0:00,Paid Search,N/A,Unknown,1.0.9,1000+,Sales,1,33,,,2025-10-01 1:37,2025-10-21 1:37
U002524,Yuki,Martin,yuki.martin@gmail.com,SE,-,UTC,2024-01-16 0:00,Referral,WINTER25,iOS,1.0.9,11-50,Sales,1,28,U000242,Y,2024-01-16 18:23,2024-03-19 18:23
U000211,Liam,Perez,liam.perez@gmail.com,SE,SP,Europe/Berlin,2024-04-22 0:00,Paid Search,WINTER25,Android,1.1.0,1000+,Product,0,51,,FALSE,2024-04-22 19:33,2024-05-24 19:33
U001752,Fatima,Lewis,fatima.lewis@company.com,CA,-,America/New_York,2023-10-21 0:00,Paid Search,WINTER25,macOS,1.2.1,10-Jan,Support,0,18,,yes,2023-10-21 6:57,04-14-2024 06:57
U000108,Yuki,Wright,yuki.wright@proton.me,MX,,America/Los_Angeles,2023-03-07 0:00,Referral,n/a,Windows,v1.0.9,51-200,Marketing,0,60,,,2023-03-07 19:53,2023-03-17 19:53
U002554,ravi,Perez,ravi.perez@yahoo.com,CA,TX,UTC,2025-03-22 0:00,Outbound,WINTER25,Linux,2.0.0,501-1000,Engineering,FALSE,,,yes,2025-03-22 21:26,2025-06-27 21:26
U001367,Anya,Lopez,anya.lopez@proton.me,GB,-,,2024-07-20 0:00,Webinar,BF2024,Linux,1.1.2,11-50,HR,0,50,,1,2024-07-20 2:15,2024-09-11 2:15
U000265,Ben,Moore,ben.moore@gmail.com,CA,-,America/New_York,2024-11-23 0:00,Paid Search,RETARGET1,macOS,1.2.0,501-1000,Finance,0,30,,0,11/23/2024 13:30,2024-11-24 13:30
U000654,Ben,Harris,ben.harris@proton.me,IN,SP,Europe/Berlin,08/07/2024,Outbound,Q3_PROMO,macOS,1.1.0,10-Jan,Engineering,1,23,,0,2024-08-07 14:47,2025-01-23 14:47
U001062,Ethan,Smith,ethan.smith@yahoo.com,ZA,CA,America/Los_Angeles,2025-08-13 0:00,Content,SUMMER24,Linux,2.0.1,201-500,Founder,0,39,,N,2025-08-13 20:30,2025-11-23 20:30
U001355,Sara,Lee,sara.lee@outlook.com,IN,-,America/New_York,2024-03-22 0:00,Partner,AI-LAUNCH,macOS,1.1.0,201-500,HR,1,56,,1,2024-03-22 4:34,2024-08-20 4:34
U002346,Emma,Taylor,emma.taylor@yahoo.com,DE,RJ,,2024-06-23 0:00,Organic Search,N/A,Windows,2.1.0,11-50,Finance,0,27,,0,2024-06-23 6:46,2024-11-15 6:46
U001234,Mia,Martinez,mia.martinez@gmail.com,SE,RJ,Europe/London,22-03-2023,Content,AI-LAUNCH,macOS,1.0.9,1000+,Founder,1,48,,FALSE,2023-03-22 19:11,2023-09-08 19:11
U000488,Olivia,Anderson,olivia.anderson@nexloom.io,US,TX,Europe/London,2023-12-03 0:00,Paid Search,SUMMER24,iOS,1.2.0,51-200,Engineering,1,18,,TRUE,2023-12-03 2:01,2023-12-05 2:01
U000005,Ethan,Johnson,ethan.johnson@gmail.com,US,-,UTC,2023-09-05 0:00,Partner,RETARGET1,macOS,2.1.0,501-1000,Ops,1,N/A,,FALSE,2023-09-05 1:50,2024-02-24 1:50
U002179,Amir,Allen,amir.allen@proton.me,US,BC,Europe/London,2024-07-08,Paid Search,WINTER25,Android,2.0.1,501-1000,Founder,1,57,,TRUE,2024-07-08 11:57,2024-08-15 11:57
U001294,Sara,Thomas,sara.thomas@outlook.com,MX,NSW,,2024-07-05 0:00,Referral,n/a,Windows,1.2.1,201-500,Sales,1,34,U000269,N,2024-07-05 5:46,2024-10-20 5:46
U000683,Anya,Wilson,anya.wilson@gmail.com,IN,,,2023-09-17 0:00,Content,SUMMER24,Unknown,1.0.9,unknown,Engineering,1,26,,FALSE,2023-09-17 23:48,2023-11-21 23:48
U002094,Jin,Patel,jin.patel@nexloom.io,CA,,Europe/London,2024-04-09 0:00,social,SUMMER24,Linux,2.0.0,11-50,Marketing,0,,,0,2024-04-09 20:31,
U001938,Mateo,Harris,mateo.harris@yahoo.com,NL,BER,UTC,10/03/2024,partner,Q3_PROMO,Unknown,2.1.0,201-500,Engineering,0,60,,1,2024-10-03 4:33,2024-10-14 4:33
U002226,Sofia,Davis,sofia.davis@yahoo.com,SE,WA,Europe/Berlin,2024-03-13 0:00,Referral,WINTER25,Windows,1.1.2,501-1000,Marketing,1,33,U000131,FALSE,2024-03-13 3:14,2024-04-17 3:14
U001025,Liam,Walker,liam.walker@company.com,gb,MH,America/Los_Angeles,2025-03-13 0:00,Paid Search,BF2024,Linux,1.2.0,11-50,HR,1,N/A,,1,2025-03-13 20:44,2025-06-05 20:44
U000015,Fatima,Davis,fatima.davis@proton.me,SE,LND,America/Los_Angeles,2023-09-26 0:00,Organic Search,n/a,iOS,1.2.0,unknown,Product,TRUE,33,,Y,2023-09-26 23:52,2023-11-30 23:52
U000572,Lucas,Garcia,lucas.garcia@proton.me,SE,unknown,,09/01/2024,Content,SPRING24,iOS,2.0.0,unknown,HR,0,45,,TRUE,2024-09-01 3:28,2024-09-07 3:28
U002366,Mateo,Lopez,mateo.lopez@nexloom.io,CA,BC,America/Los_Angeles,2023-04-17 0:00,Social,AI-LAUNCH,Linux,1.3.0,11-50,Support,0,55,,TRUE,2023-04-17 5:54,2023-06-27 5:54
U001363,Mia,Allen,mia.allen@nexloom.io,IN,RJ,Europe/Berlin,2024-05-30 0:00,Social,SPRING24,iOS,1.1.2,10-Jan,Finance,0,41,,TRUE,2024-05-30 8:51,2024-06-15 8:51
U000366,Leo,HARRIS,leo.harris@nexloom.io,US,TX,UTC,2024-01-31 0:00,Organic Search,n/a,Windows,2.0.0,11-50,Sales,0,63,,0,2024-01-31 6:21,2024-05-30 6:21
U001983,Nora,Johnson, nora.johnson@yahoo.com ,in,CA,UTC,2024-03-08 0:00,Partner,SUMMER24,Unknown,2.0.1,1000+,Support,no,39,,FALSE,2024-03-08 15:33,2024-06-05 15:33
U000548,Omar,Martinez,omar.martinez@proton.me,FR,NSW,,2024-06-25 0:00,content,SPRING24,Android,1.2.1,unknown,Product,1,29,,yes,2024-06-25 8:05,2024-09-17 8:05
U002038,Leo,Thompson,leo.thompson@proton.me,US,-,UTC,2023-08-31 0:00,Referral,GROWTHLAB,Linux,1.1.2,unknown,Product,0,39,U000210,no,2023-08-31 17:51,2023-10-15 17:51
U001428,Ivy,Johnson,ivy.johnson@icloud.com,CA,,Europe/Berlin,2025-04-03 0:00,Partner,AI-LAUNCH,Windows,1.1.0,1000+,Finance,0,51,,yes,2025-04-03 11:48,2025-08-12 11:48
U001476,Jin,Thompson, jin.thompson@gmail.com ,SG,,America/Los_Angeles,2024-06-23,Referral,N/A,Linux,2.1.0,unknown,Support,1,28,,FALSE,2024-06-23 16:09,2024-12-04
U001667,Ava,Perez,AVA.PEREZ@GMAIL.COM,FR,MH,Europe/London,2023-10-16,Partner,N/A,iOS,1.1.0,201-500,Support,0,26,,TRUE,2023-10-16 11:21,2024-03-13 11:21
U001972,Ben,Smith,ben.smith@nexloom.io,SG,MH,Asia/Kolkata,2024-10-09 0:00,Outbound,AI-LAUNCH,Android,1.0.9,501-1000,HR,0,N/A,,N,2024-10-09 17:26,2025-01-20 17:26
U000520,Anya,Thompson,anya.thompson@yahoo.com,US,RJ,America/Los_Angeles,2023-08-31 0:00,Referral,n/a,Windows,1.0.9,11-50,Marketing,0,21,U000368,yes,2023-08-31 15:47,2023-09-26 15:47
U000884,Leo,Lee,leo.lee@outlook.com,MX,CA,Asia/Kolkata,2023-07-15 0:00,Partner,SPRING24,Linux,1.3.0,201-500,HR,0,62,,1,2023-07-15 15:25,2023-12-03 15:25
U002410,Amir,Robinson,amir.robinson@company.com,SG,unknown,Europe/Berlin,2024-03-06 0:00,Referral,SUMMER24,iOS,2.1.0,1000+,Engineering,0,46,U000469,yes,2024-03-06 15:38,2024-07-09 15:38
U000598,Ava,Clark,ava.clarknexloom.io,JP,-,UTC,2023-09-18 0:00,Referral,WINTER25,Android,2.1.0,10-Jan,Finance,0,28,U000480,,2023-09-18 4:05,2024-01-12 4:05
U000162,Liam,Davis,liam.davis@gmail.com,BR,NY,,2024-06-04,Paid Search,SPRING24,iOS,1.2.0,51-200,Ops,0,24,,TRUE,2024-06-04 2:25,2024-08-03 2:25
U001382,Mateo,Martin,mateo.martin@outlook.com,SE,NSW,,2024-02-02 0:00,Content,SUMMER24,macOS,1.2.1,11-50,HR,0,29,,,2024-02-02 22:32,07-30-2024 22:32
U001562,Sophia,Allen,sophia.allen@outlook.com,ZA,,America/New_York,2023-11-05 0:00,Content,AI-LAUNCH,Windows,1.2.1,201-500,Engineering,0,41,,N,2023-11-05 23:52,2024-04-09 23:52
U000100,Mia,Nguyen,mia.nguyen@nexloom.io,US,unknown,Asia/Tokyo,19-07-2023,Content,SUMMER24,Windows,2.0.1,501-1000,Ops,0,49,,FALSE,2023-07-19 1:13,2023-12-08 1:13
U000113,Sara,Allen,sara.allenproton.me,GB,unknown,,2025-02-09 0:00,Referral,n/a,Linux,2.0.0,1000+,Support,0,31,U000289,yes,2025-02-09 6:12,2025-07-18 6:12
U001029,Ben,Patel,ben.patel@outlook.com,MX,MH,America/New_York,2023-12-25 0:00,Referral,n/a,Linux,2.1.0,51-200,Engineering,yes,19,U000467,0,2023-12-25 7:44,2024-01-09 7:44
U001749,Liam,Young, liam.young@gmail.com ,MX,LND,,2024-08-17 0:00,Organic Search,RETARGET1,Windows,1.0.9,unknown,Ops,0,29,,no,2024-08-17 9:23,2024-12-15
U000042,Kofi,Harris, kofi.harris@outlook.com ,SG,-,Asia/Tokyo,2024-03-26 0:00,Social,SUMMER24,Unknown,2.0.1,201-500,HR,1,49,,no,2024-03-26 6:09,2024-08-12 6:09
U001076,Omar,Wright,OMAR.WRIGHT@ICLOUD.COM,United States,WA,Asia/Tokyo,2024-02-21 0:00,Content,Q3_PROMO,Windows,v1.2.0,unknown,HR,1,22,,1,2024-02-21 12:16,2024-06-24 12:16
U001387,Yuki,Wilson,yuki.wilson@nexloom.io,MX,RJ,Europe/London,2024-08-25,Content,Q3_PROMO,macOS,1.0.9,11-50,Founder,0,21,,FALSE,2024-08-25 1:46,2025-01-15 1:46
U002058,Sophia,Scott,sophia.scott@outlook.com,MX,RJ,Europe/Berlin,2024-02-13 0:00,Organic Search,n/a,Android,2.0.0,10-Jan,Marketing,0,45,,0,2024-02-13 18:45,2024-05-13 18:45
U001104,Yuki,Wright,yuki.wright@nexloom.io,SG,BC,,2025-02-05 0:00,Organic Search,AI-LAUNCH,Android,1.1.2,1000+,Support,0,63,,0,2025-02-05 18:05,0000-00-00 00:00:00
U000004,Ben,Lee,ben.lee@gmail.com,FR,-,,2024-05-17 0:00,Outbound,BF2024,Linux,1.1.0,201-500,Engineering,,26,,TRUE,2024-05-17 23:32,2024-07-07 23:32
U002163,Jin,Moore,jin.moore@proton.me,ZA,WA,Asia/Tokyo,2024-01-13 0:00,Outbound,AI-LAUNCH,Android,1.2.1,1000+,HR,0,19,,yes,2024-01-13 4:05,2024-06-30 4:05
U000691,Zoe,JACKSON,ZOE.JACKSON@OUTLOOK.COM,DE,RJ,America/Los_Angeles,2023-12-28,Partner,SPRING24,Android,v1.2.0,201-500,Marketing,0,35,,FALSE,2023-12-28 11:26,2024-05-19 11:26
U000153,Nora,Wright,nora.wright@yahoo.com,SG,RJ,Asia/Kolkata,2023-08-26 0:00,outbound,SPRING24,Linux,1.0.9,501-1000,Ops,0,44,,1,2023-08-26 8:53,2023-09-10 8:53
U001092,Hana,Walker,hana.walker@proton.me,CA,-,Asia/Kolkata,2024-06-13 0:00,Partner,RETARGET1,Android,2.0.1,11-50,HR,0,32,,TRUE,2024-06-13 8:37,2024-07-30
U002481,Ethan,Taylor,ethan.taylor@company.com,IN,WA,Europe/Berlin,2023-11-30 0:00,Partner,N/A,Android,1.1.0,10-Jan,HR,0,33,,TRUE,2023-11-30 1:40,2023-12-26 1:40
U000147,Omar,Robinson,omar.robinsoncompany.com,AU,WA,Europe/Berlin,2024-05-23 0:00,Outbound,GROWTHLAB,Android,1.1.0,11-50,Support,0,18,,no,2024-05-23 8:21,2024-07-05 8:21
U001776,Ethan,Nguyen,ethan.nguyen@proton.me,MX,WA,,2023-12-23 0:00,Webinar,WINTER25,Android,1.3.0,501-1000,Founder,1,54,,yes,2023-12-23 3:59,2024-05-20 3:59
U001115,Anya,Lewis,anya.lewis@icloud.com,JP,unknown,Europe/Berlin,2024-05-14 0:00,Webinar,N/A,Windows,2.0.1,10-Jan,Marketing,0,63,,yes,2024-05-14 0:11,2024-06-08 0:11
U002090,Sara,Clark,sara.clark@proton.me,USA,SP,America/Los_Angeles,2024-01-28 0:00,Partner,NA,Unknown,1.1.2,10-Jan,Founder,1,30,,Y,2024-01-28 7:51,2024-02-14 7:51
U001219,Ravi,THOMPSON,ravi.thompson@gmail.com,de,WA,UTC,2024-06-16 0:00,Partner,SPRING24,Linux,1.1.2,1000+,Product,0,34,,0,2024-06-16 8:35,2024-09-06 8:35
U001268,Nora,Robinson,nora.robinson@yahoo.com,IN,unknown,America/New_York,2024-03-19 0:00,Referral,n/a,Unknown,1.1.2,501-1000,Finance,,20,U000253,,2024-03-19 20:48,2024-04-24 20:48
U001610,Noah,Wright,noah.wright@proton.me,SG,MH,,04/18/2024,Webinar,SUMMER24,Unknown,1.1.0,501-1000,Marketing,0,24,,FALSE,2024-04-18 18:28,2024-04-25 18:28
U002395,Leo,Davis, leo.davis@nexloom.io ,GB,NSW,,2024-12-09 0:00,Outbound,N/A,Linux,2.0.0,unknown,Sales,1,50,,TRUE,2024-12-09 6:12,2025-04-05 6:12
U001560,Ben,White,ben.white@outlook.com,AU,LND,,2024-12-22 0:00,referral,n/a,Unknown,2.1.0,51-200,Founder,0,54,,TRUE,2024-12-22 23:56,2025-05-16 23:56
U001986,Sofia,Young,sofia.young@nexloom.io,IN,NY,Europe/Berlin,2023-06-15 0:00,Webinar,Q3_PROMO,Windows,2.1.0,1000+,Engineering,1,47,,0,2023-06-15 18:30,2023-06-19 18:30
U000105,Mia,Clark,mia.clark@gmail.com,IN,SP,America/Los_Angeles,2025-01-02 0:00,Outbound,Q3_PROMO,iOS,1.0.9,1000+,Marketing,0,27,,N,2025-01-02 10:50,2025-05-16 10:50
U000858,Jin,Martin,JIN.MARTIN@OUTLOOK.COM,US,TX,Asia/Kolkata,2024-03-15 0:00,Social,WINTER25,Linux,1.1.0,501-1000,Product,0,,,Y,2024-03-15 12:45,2024-03-24 12:45
U000550,Nora,Allen,nora.allen@icloud.com,GB,ON,America/Los_Angeles,2024-08-25,Referral,SPRING24,macOS,1.2.0,1000+,HR,0,47,,1,2024-08-25 23:33,2024-12-29 23:33
U002501,Fatima,Harris,fatima.harris@gmail.com,DE,,Asia/Kolkata,2024-10-05 0:00,Paid Search,Q3_PROMO,Windows,2.1.0,501-1000,Engineering,0,21,,,2024-10-05 16:15,2024-12-26 16:15
U001975,Amir,Jackson,amir.jackson@gmail.com,GB,RJ,Europe/London,2023-12-13 0:00,Partner,BF2024,macOS,1.0.9,10-Jan,Engineering,1,45,,Y,2023-12-13 0:20,2024-01-25 0:20
U000566,Mia,Wilson,mia.wilsonnexloom.io,JP,LND,America/New_York,2024-05-13 0:00,Paid Search,BF2024,Windows,2.1.0,10-Jan,Sales,1,21,,Y,2024-05-13 3:03,2024-07-22
U002256,Mia,Lewis,mia.lewis@yahoo.com,AU,RJ,Europe/London,2024-05-04 0:00,Organic Search,AI-LAUNCH,macOS,2.0.1,11-50,Support,0,28,,FALSE,2024-05-04 2:33,2024-05-23 2:33
U002564,Sophia,Martinez,sophia.martinez@yahoo.com,DE,NY,,2023-06-05 0:00,Organic Search,GROWTHLAB,Linux,1.1.0,unknown,Finance,0,53,,Y,06/05/2023 02:04,2023-07-26
U001807,Chen,Smith,chen.smith@outlook.com,SE,RJ,Europe/Berlin,2024-06-20 0:00,Webinar,BF2024,macOS,2.0.1,unknown,Product,0,30,,FALSE,2024-06-20 20:40,2024-11-20 20:40
U000644,Ethan,Davis,ethan.davis@nexloom.io,GB,ON,America/Los_Angeles,2023-12-30 0:00,Social,BF2024,Linux,1.1.2,11-50,Product,0,42,,FALSE,2023-12-30 7:05,2024-03-04 7:05
U000649,Lucas,Thompson,lucas.thompson@outlook.com,IN,MH,Asia/Tokyo,2024-09-05 0:00,Outbound,WINTER25,iOS,1.2.1,1000+,Marketing,0,62,,,2024-09-05 19:58,2025-02-02 19:58
U000255,Kofi,Lewis,kofi.lewis@nexloom.io,US,unknown,Europe/London,2023-09-16 0:00,Social,GROWTHLAB,macOS,1.1.0,51-200,HR,1,36,,no,2023-09-16 4:42,2023-10-16 4:42
U000961,Yuki,Patel,yuki.patel@outlook.com,NL,,Asia/Tokyo,2023-06-18,Organic Search,RETARGET1,Unknown,1.1.0,1000+,Marketing,1,20,,Y,2023-06-18 8:34,2023-08-05 8:34
U002051,Nora,Robinson, nora.robinson@proton.me ,us,,Europe/Berlin,2024-03-08 0:00,Paid Search,BF2024,macOS,2.0.1,10-Jan,Ops,1,51,,TRUE,2024-03-08 17:13,2024-05-08 17:13
U002086,Nora,Moore,nora.moore@proton.me,NL,BC,Asia/Tokyo,2024-03-28,Social,Q3_PROMO,Linux,2.1.0,501-1000,Finance,1,40,,0,2024-03-28 3:51,2024-06-19 3:51
U000868,Priya,Garcia,priya.garcia@outlook.com,GB,CA,Asia/Tokyo,2023-09-26 0:00,Referral,Q3_PROMO,Windows,1.1.0,1000+,Founder,1,53,,TRUE,2023-09-26 17:26,2024-01-24 17:26
U002338,Jin,Garcia,jin.garcia@outlook.com,DE,TX,Asia/Tokyo,2024-01-22 0:00,Paid Search,BF2024,macOS,2.0.0,51-200,Sales,0,40,,no,2024-01-22 7:31,2024-04-05 7:31
U000725,Hana,Davis,hana.davis@yahoo.com,GB,,Asia/Tokyo,2024-05-05 0:00,Social,N/A,Linux,1.0.9,501-1000,Support,0,28,,0,2024-05-05 21:11,2024-06-19 21:11
U002361,Olivia,Davis,olivia.davis@nexloom.io,JP,SP,,02/03/2023,Referral,n/a,Unknown,2.0.0,1000+,Ops,0,40,U000054,,2023-02-03 18:52,0000-00-00 00:00:00
U000021,Ravi,King,RAVI.KING@YAHOO.COM,ZA,RJ,UTC,2024-05-24 0:00,Referral,WINTER25,iOS,1.1.2,unknown,Ops,0,48,,0,2024-05-24 22:36,2024-09-03 22:36
U001422,Ava,Garcia,ava.garcia@icloud.com,SE,SP,America/New_York,2024-04-01 0:00,Content,AI-LAUNCH,Linux,1.2.0,201-500,Marketing,0,21,,N,2024-04-01 10:55,2024-08-02 10:55
U002027,Emma,Robinson,emma.robinson@gmail.com,US,TX,America/Los_Angeles,2024-07-29 0:00,Organic Search,Q3_PROMO,iOS,1.0.9,501-1000,HR,0,56,,FALSE,2024-07-29 10:39,2025-01-08 10:39
U000727,Amir,Johnson,amir.johnson@proton.me,US,MH,Asia/Tokyo,2023-08-21 0:00,Content,N/A,iOS,1.3.0,201-500,Finance,1,,,1,2023-08-21 13:52,2024-01-25 13:52
U000445,Noah,Smith,noah.smith@nexloom.io,CA,BC,Europe/London,2024-09-23 0:00,Paid Search,Q3_PROMO,Windows,1.2.1,11-50,Founder,0,43,,0,2024-09-23 19:55,2025-01-30 19:55
U000989,Noah,Garcia,noah.garcia@company.com,FR,MH,UTC,2023-11-11 0:00,Social,AI-LAUNCH,macOS,2.0.1,11-50,HR,1,57,,FALSE,2023-11-11 12:05,2023-12-17
U000397,Elena,Lee,elena.lee@yahoo.com,SE,LND,America/New_York,2024-11-03 0:00,Organic Search,Q3_PROMO,Unknown,v2.0.1,1000+,Support,1,27,,Y,2024-11-03 6:38,2025-02-18 6:38
U002245,Ivy,Martin,ivy.martin@nexloom.io,GB,-,Europe/London,2024-10-31 0:00,Organic Search,BF2024,Linux,2.0.1,501-1000,Founder,,50,,1,2024-10-31 7:13,2025-02-19 7:13
U001523,Ava,Davis,ava.davis@gmail.com,JP,WA,Asia/Kolkata,2024-01-12 0:00,Webinar,N/A,Android,2.0.0,1000+,Founder,0,51,,N,2024-01-12 3:24,0000-00-00 00:00:00
U001551,Emma,Anderson,emma.anderson@company.com,JP,RJ,Asia/Kolkata,2025-04-01 0:00,Social,RETARGET1,Windows,1.1.0,1000+,Support,0,45,,yes,2025-04-01 21:51,2025-09-14 21:51
U002589,Olivia,Lewis,olivia.lewis@gmail.com,MX,,Asia/Tokyo,2023-11-08 0:00,Paid Search,RETARGET1,Windows,2.1.0,unknown,Finance,0,21,,,2023-11-08 12:39,2024-04-06 12:39
U000849,Ava,Martinez,ava.martinez@proton.me,NL,MH,Europe/London,2024-03-30 0:00,Organic Search,WINTER25,Android,2.1.0,51-200,HR,0,37,  U000120,FALSE,2024-03-30 5:22,2024-07-19 5:22
U001277,Ava,Smith,ava.smith@nexloom.io,GB,-,Europe/Berlin,2023-11-08 0:00,Social,WINTER25,macOS,2.1.0,201-500,Product,,46,,FALSE,2023-11-08 23:28,2024-01-25 23:28
U002149,Fatima,Lopez,fatima.lopezcompany.com,CA,-,America/Los_Angeles,2024-03-26 0:00,Outbound,BF2024,Windows,1.3.0,1000+,Marketing,0,64,,N,2024-03-26 23:09,2024-05-27 23:09
U002593,Priya,Martinez,priya.martinez@yahoo.com,JP,MH,Europe/London,2024-04-24 0:00,Webinar,RETARGET1,Linux,1.2.0,10-Jan,Finance,1,,,TRUE,2024-04-24 3:02,05-12-2024 03:02
U001114,Olivia,Johnson,olivia.johnsoncompany.com,BR,,Europe/Berlin,2024-04-16 0:00,Referral,n/a,Android,1.0.9,51-200,Ops,0,36,,0,2024-04-16 2:42,2024-04-23 2:42
U000128,Yuki,Garcia,yuki.garcia@company.com,SG,RJ,,11/05/2024,Paid Search,SPRING24,macOS,2.1.0,11-50,Ops,1,38,,FALSE,2024-11-05 4:35,2025-01-08 4:35
U000276,Zoe,Taylor,zoe.taylor@proton.me,DE,MH,Europe/Berlin,2024-03-29,Partner,N/A,Unknown,1.2.1,10-Jan,Marketing,TRUE,,,TRUE,2024-03-29 15:32,2024-05-04 15:32
U001501,Sophia,Robinson,sophia.robinson@proton.me,MX,CA,America/New_York,2024-04-07 0:00,Partner,Q3_PROMO,Linux,2.1.0,1000+,Finance,0,50,,TRUE,2024-04-07 18:05,2024-07-04 18:05
U000288,Ivy,White,ivy.white@icloud.com,GB,CA,Europe/Berlin,2024-04-19,Paid Search,WINTER25,Unknown,1.3.0,51-200,Sales,0,21,,no,2024-04-19 13:12,2024-07-24 13:12
U002321,Sophia,Wright,sophia.wright@company.com,AU,MH,Asia/Tokyo,2025-01-02 0:00,Referral,WINTER25,Linux,1.0.9,unknown,Product,0,38,U000203,N,2025-01-02 2:21,2025-04-27 2:21
U000501,Zoe,Scott,zoe.scott@icloud.com,BR,,,2024-07-10,Outbound,N/A,iOS,1.2.0,501-1000,Ops,0,43,,,2024-07-10 9:34,2024-08-11 9:34
U002385,Kofi,Davis,kofi.davis@gmail.com,US,MH,UTC,2023-12-25 0:00,Webinar,RETARGET1,Unknown,v1.1.2,11-50,Marketing,0,35,,N,2023-12-25 21:02,2024-06-20 21:02
U000796,Lucas,Thompson,lucas.thompsonproton.me,SE,ON,Asia/Kolkata,2024-11-17,Organic Search,N/A,Android,1.2.1,201-500,Marketing,0,55,,FALSE,2024-11-17 22:19,2025-04-22 22:19
U000316,Kofi,Garcia,kofi.garcia@nexloom.io,SG,RJ,America/Los_Angeles,2024-07-09 0:00,Outbound,RETARGET1,macOS,1.2.0,1000+,Sales,1,61,,yes,2024-07-09 16:07,2024-12-27 16:07
U001724,Jin,Wilson,jin.wilson@gmail.com,ZA,,Asia/Kolkata,2023-07-11 0:00,Paid Search,AI-LAUNCH,iOS,1.0.9,1000+,HR,0,63,,FALSE,2023-07-11 21:07,2023-08-17 21:07
U002072,Zoe,Harris,zoe.harris@proton.me,SG,ON,,2024-04-07 0:00,Social,SPRING24,iOS,1.0.9,501-1000,Product,0,38,,,2024-04-07 12:20,2024-10-01 12:20
U000012,Sophia,Lee,sophia.lee@proton.me,SG,BER,,2025-06-04 0:00,Social,AI-LAUNCH,macOS,1.2.1,11-50,Marketing,0,20,,Y,2025-06-04 23:46,0000-00-00 00:00:00
U000891,Ben,Walker,ben.walker@outlook.com,AU,MH,Asia/Tokyo,2024-07-24 0:00,Social,AI-LAUNCH,macOS,1.2.1,1000+,Product,0,39,,0,2024-07-24 12:24,2024-11-12 12:24
U001813,Yuki,Young,yuki.young@gmail.com,SG,RJ,,2023-11-23 0:00,Outbound,Q3_PROMO,macOS,1.2.1,201-500,Finance,1,61,,yes,2023-11-23 6:09,2024-02-11 6:09
U000071,Elena,Davis,elena.davis@nexloom.io,DE,ON,Europe/London,2024-08-25 0:00,Outbound,RETARGET1,Linux,1.1.0,unknown,Finance,0,35,,FALSE,2024-08-25 4:51,2025-01-19 4:51
U001107,Liam,Thomas,liam.thomas@nexloom.io,US,SP,Europe/London,2024-02-05 0:00,Paid Search,AI-LAUNCH,iOS,1.2.1,10-Jan,Founder,0,47,,0,2024-02-05 18:45,2024-04-13 18:45
U000175,Mia,Clark,mia.clarkcompany.com,DE,BC,,2024-06-11 0:00,Referral,GROWTHLAB,Linux,1.1.0,501-1000,Sales,1,36,U000297,TRUE,2024-06-11 12:30,2024-12-06 12:30
U000679,Diego,Thomas,diego.thomas@outlook.com,GB,BER,UTC,2025-06-02 0:00,Organic Search,n/a,Windows,v2.0.1,1000+,Support,0,60,,TRUE,2025-06-02 11:13,2025-06-11 11:13
U002201,Nora,Patel,nora.patel@gmail.com,IN,TX,Europe/Berlin,2025-07-06 0:00,Referral,SUMMER24,Windows,1.1.0,201-500,Support,0,48,,FALSE,2025-07-06 12:50,2025-11-21 12:50
U000170,Omar,Nguyen,omar.nguyen@yahoo.com,MX,MH,,2024-05-13 0:00,Social,SUMMER24,Android,1.3.0,10-Jan,Support,0,40,,no,2024-05-13 9:51,2024-06-23 9:51
U000440,Yuki,Anderson,yuki.anderson@nexloom.io,SG,,,2023-06-16 0:00,Webinar,SPRING24,Android,1.1.0,11-50,Sales,0,46,,FALSE,2023-06-16 12:59,2023-07-05 12:59
U001829,Chen,Robinson,chen.robinson@company.com,CA,,America/Los_Angeles,2024-09-12 0:00,Organic Search,null,iOS,1.1.2,11-50,Product,0,57,,TRUE,2024-09-12 12:21,2024-12-13 12:21
U001681,Fatima,Perez,fatima.perez@company.com,IN,RJ,,09-01-2024,Webinar,RETARGET1,Windows,1.0.9,51-200,Engineering,0,,,no,2024-01-09 3:01,2024-05-10 3:01
U001209,Ravi,Thompson,ravi.thompson@nexloom.io,AU,SP,Europe/Berlin,2023-11-28 0:00,Outbound,GROWTHLAB,Android,1.3.0,unknown,Product,0,36,,FALSE,2023-11-28 15:48,2023-12-06
U002399,Emma,Brown,emma.brown@proton.me,CA,,Europe/London,2024-06-11 0:00,Paid Search,WINTER25,macOS,1.2.1,1000+,Support,yes,34,,TRUE,2024-06-11 18:36,2024-09-18 18:36
U001045,Olivia,Garcia,olivia.garcia@company.com,GB,BC,America/New_York,2024-12-03 0:00,Webinar,WINTER25,macOS,2.0.1,51-200,Ops,0,21,,N,2024-12-03 9:37,2025-04-16 9:37
u002440,Yuki,Davis,yuki.davis@outlook.com,JP,ON,Asia/Kolkata,2023-09-03 0:00,Partner,N/A,Android,1.2.1,501-1000,HR,FALSE,25,,FALSE,2023-09-03 23:16,2023-12-18 23:16
U002042,Ethan,Walker,ethan.walker@proton.me,FR,LND,,2024-04-28 0:00,Webinar,BF2024,Windows,1.2.1,501-1000,Sales,0,22,,TRUE,2024-04-28 2:59,2024-07-08 2:59
U001432,Yuki,Walker,yuki.walker@yahoo.com,MX,-,America/New_York,2024-04-05 0:00,Partner,SUMMER24,Linux,2.0.0,1000+,Sales,0,46,,yes,2024-04-05 19:28,2024-10-02 19:28
U001203,Sofia,Lee,sofia.lee@company.com,NL,RJ,,2023-03-02 0:00,partner,BF2024,Linux,1.2.1,10-Jan,HR,0,52,,no,2023-03-02 23:10,2023-07-24 23:10
U001200,Ivy,Jackson,ivy.jackson@icloud.com,CA,,Europe/London,2023-08-12,Referral,GROWTHLAB,iOS,1.2.0,51-200,Support,1,39,,no,2023-08-12 17:26,2023-09-02 17:26
U001162,Amir,Anderson,amir.anderson@gmail.com,GB,NY,,2023-08-10 0:00,Partner,RETARGET1,iOS,1.2.1,11-50,Finance,0,31,,FALSE,2023-08-10 20:13,2024-01-23 20:13
U000559,Fatima,Nguyen,fatima.nguyen@icloud.com,FR,LND,Asia/Tokyo,2024-08-13 0:00,Outbound,Q3_PROMO,macOS,1.2.1,1000+,Product,0,41,,FALSE,2024-08-13 20:23,2024-10-16 20:23
U000770,Diego,Martin,diego.martin@nexloom.io,IN,,Europe/Berlin,30-09-2024,Referral,null,Windows,2.0.0,1000+,Founder,0,63,U000437,0,2024-09-30 2:29,2024-12-19
U001831,Ivy,Martin,ivy.martin@proton.me,SG,ON,UTC,2025-07-22 0:00,Paid Search,SUMMER24,Windows,1.0.9,501-1000,Engineering,0,48,,yes,2025-07-22 21:33,2025-11-13
U001881,Amir,Young,AMIR.YOUNG@OUTLOOK.COM,FR,unknown,UTC,2024-07-05 0:00,Content,WINTER25,Windows,1.2.0,unknown,Support,0,47,,TRUE,2024-07-05 18:45,
U000024,Olivia,Martin,olivia.martin@gmail.com,CA,,America/New_York,2024-01-20 0:00,Webinar,SPRING24,Android,1.1.2,unknown,Support,0,57,,0,2024-01-20 16:39,2024-06-06
u002129,Omar,Harris,omar.harris@proton.me,CA,MH,,2024-11-28 0:00,Organic Search,n/a,macOS,1.3.0,501-1000,Engineering,1,43,,TRUE,2024-11-28 9:13,2025-01-12 9:13
U001856,Ivy,Brown,ivy.brown@gmail.com,CA,LND,Europe/London,2023-11-15 0:00,Organic Search,WINTER25,Windows,1.1.0,unknown,Ops,1,,,1,2023-11-15 19:58,2024-04-20 19:58
U001302,Priya,Martinez,priya.martinez@proton.me,IN,,UTC,2025-02-23,Social,AI-LAUNCH,Android,2.0.0,51-200,HR,TRUE,56,,Y,2025-02-23 6:44,2025-05-30 6:44
U000913,Zoe,Wright,zoe.wright@nexloom.io,-,MH,Europe/London,2024-05-31 0:00,Outbound,BF2024,Linux,1.2.1,10-Jan,Product,0,19,,yes,2024-05-31 19:57,2024-07-08 19:57
U000467,Emma,Wilson, emma.wilson@outlook.com ,GB,NSW,Asia/Kolkata,2023-12-06 0:00,Outbound,N/A,Windows,2.0.0,unknown,Product,1,41,,yes,2023-12-06 6:35,06-01-2024 06:35
U000840,Zoe,Moore,zoe.moore@yahoo.com,NL,TX,,2024-06-04 0:00,Social,SUMMER24,iOS,1.1.2,10-Jan,Engineering,0,,,FALSE,2024-06-04 19:58,2024-07-21 19:58
U001516,Yuki,Thompson,yuki.thompson@outlook.com,SG,NY,Europe/Berlin,01/23/2023,Partner,AI-LAUNCH,Android,1.1.2,201-500,Ops,0,30,,no,2023-01-23 2:18,2023-06-18 2:18
U001327,Kofi,Martin,kofi.martin@outlook.com,MX,-,,2023-09-26 0:00,Content,BF2024,iOS,2.1.0,51-200,Engineering,1,64,,yes,2023-09-26 23:14,2023-10-18 23:14
U000417,Mia,Johnson, mia.johnson@icloud.com ,DE,unknown,Europe/Berlin,2023-12-10 0:00,Partner,SPRING24,macOS,1.2.0,51-200,Ops,0,60,,Y,2023-12-10 10:13,2024-06-02 10:13
U002085,Olivia,Thompson,olivia.thompson@company.com,US,ON,UTC,2024-04-17 0:00,Content,BF2024,Windows,2.1.0,10-Jan,Product,0,unknown,,no,2024-04-17 10:08,08-15-2024 10:08
U000367,Sophia,LEWIS,sophia.lewis@gmail.com,FR,CA,Asia/Kolkata,2025-05-02,Content,RETARGET1,Linux,1.2.1,51-200,HR,1,51,,1,2025-05-02 11:44,2025-05-17 11:44
U000095,Kofi,Walker,kofi.walker@gmail.com,IN,CA,Europe/Berlin,2024-08-24 0:00,Paid Search,GROWTHLAB,iOS,1.0.9,unknown,Founder,1,19,,FALSE,2024-08-24 5:42,2024-09-09 5:42
U002571,Fatima,Robinson,fatima.robinson@nexloom.io,SG,BC,America/New_York,2024-02-10 0:00,Outbound,GROWTHLAB,Unknown,2.0.0,1000+,Ops,0,49,,0,2024-02-10 12:19,2024-04-19 12:19
U002271,Mateo,Patel,mateo.patel@icloud.com,SG,unknown,America/New_York,2023-07-15 0:00,Paid Search,SUMMER24,macOS,v1.3.0,51-200,Finance,0,35,,TRUE,2023-07-15 12:14,2023-12-17 12:14
U002028,Hana,Robinson,hana.robinson@icloud.com,SE,NY,UTC,2025-07-29 0:00,Webinar,GROWTHLAB,iOS,1.2.0,unknown,Ops,1,52,,FALSE,2025-07-29 21:43,2025-09-14 21:43
U001002,Mateo,Thomas,mateo.thomas@outlook.com,CA,SP,America/Los_Angeles,04/19/2024,Outbound,N/A,Unknown,2.0.1,51-200,Finance,0,24,,FALSE,2024-04-19 15:31,2024-09-08 15:31
U002135,Jin,Perez,jin.perez@gmail.com,SE,unknown,Europe/Berlin,2024-07-22 0:00,Referral,n/a,Windows,2.0.0,unknown,HR,0,45,U000499,FALSE,07/22/2024 22:29,2024-12-11 22:29
U002115,Anya,Scott,anya.scott@proton.me,ZA,MH,Asia/Tokyo,2024-06-16 0:00,Outbound,BF2024,iOS,1.0.9,unknown,Finance,FALSE,56,,yes,2024-06-16 12:38,2024-10-25 12:38
U002008,Sara,Wright,sara.wright@icloud.com,GB,BER,Europe/Berlin,2024-08-28 0:00,Partner,BF2024,iOS,1.0.9,unknown,Founder,0,37,,no,2024-08-28 6:00,12-27-2024 06:00
U000820,Ravi,Jackson,ravi.jackson@icloud.com,SE,TX,Europe/Berlin,2024-01-03 0:00,Content,Q3_PROMO,Android,1.3.0,unknown,Engineering,0,26,,no,2024-01-03 1:37,2024-04-13 1:37
U001865,Ben,Anderson,ben.anderson@company.com,US,CA,,2025-08-17 0:00,Organic Search,n/a,Linux,2.0.0,1000+,Engineering,0,45,,TRUE,2025-08-17 16:55,2025-09-26 16:55
U001649,Mateo,Smith,mateo.smith@company.com,DE,WA,Europe/Berlin,2024-08-31 0:00,Content,BF2024,iOS,2.0.0,51-200,Finance,0,54,,FALSE,2024-08-31 2:31,2025-02-07 2:31
U000321,Diego,Young,diego.young@gmail.com,IN,NSW,,2024-04-22 0:00,Referral,RETARGET1,Android,1.1.2,10-Jan,Finance,1,35,,Y,2024-04-22 7:32,2024-05-08 7:32
U001088,Ben,Wilson,ben.wilson@gmail.com,SE,MH,UTC,14-09-2023,Social,RETARGET1,Unknown,1.2.0,1000+,Engineering,1,59,,FALSE,2023-09-14 20:25,2024-03-07
U002136,Omar,Martin, OMAR.MARTIN@NEXLOOM.IO ,GB,NY,Europe/London,2024-12-09 0:00,Referral,n/a,Linux,1.2.0,51-200,Engineering,0,unknown,U000267,1,2024-12-09 22:09,2025-01-15 22:09
U001732,Amir,Walker,amir.walker@nexloom.io,MX,TX,Asia/Kolkata,2024-05-31 0:00,Paid Search,N/A,Android,1.2.0,10-Jan,HR,1,43,,0,2024-05-31 21:50,2024-09-10 21:50
U002406,Ravi,Jackson,ravi.jackson@proton.me,JP,,Europe/Berlin,2024-05-21,Content,BF2024,macOS,2.0.0,11-50,HR,1,46,,TRUE,2024-05-21 7:11,2024-11-08 7:11
U000932,Noah,Lee,noah.lee@proton.me,GB,unknown,,2024-10-12 0:00,Webinar,SPRING24,Linux,2.1.0,10-Jan,Engineering,0,25,,TRUE,2024-10-12 10:01,12-08-2024 10:01
U001140,Amir,Martin,amir.martin@proton.me,in,BC,America/Los_Angeles,2024-05-14 0:00,social,BF2024,Linux,2.1.0,51-200,HR,0,38,,1,2024-05-14 18:04,2024-06-25 18:04
U001290,Sara,Brown,sara.brown@company.com,SG,BC,Europe/London,2023-06-13,Referral,n/a,Unknown,1.2.1,1000+,Marketing,1,19,U000158,TRUE,2023-06-13 19:29,2023-09-24
U000653,Elena,Lewis,elena.lewis@gmail.com,US,ON,,2024-05-11 0:00,Webinar,SPRING24,Linux,2.1.0,10-Jan,Support,0,25,,yes,2024-05-11 20:44,2024-07-04 20:44
U000374,Ravi,Nguyen,ravi.nguyen@nexloom.io,ZA,ON,,2024-07-01,Paid Search,SPRING24,Unknown,v1.2.0,10-Jan,Sales,1,27,,0,2024-07-01 16:48,2024-07-07 16:48
U001299,Ravi,Brown,ravi.brown@proton.me,GB,LND,Europe/London,06/06/2024,Outbound,N/A,Android,2.0.0,11-50,Sales,,43,,1,2024-06-06 17:34,2024-06-27 17:34
U001579,Ethan,Martin,ethan.martin@nexloom.io,SE,NY,Asia/Tokyo,2024-05-22,Partner,WINTER25,Windows,1.2.1,10-Jan,Ops,0,59,,no,2024-05-22 18:24,2024-08-30 18:24
U001826,Ivy,Perez,ivy.perez@company.com,US,ON,America/Los_Angeles,2024-04-13 0:00,Paid Search,Q3_PROMO,iOS,1.2.1,unknown,Engineering,0,58,,FALSE,2024-04-13 12:36,2024-06-17 12:36
U000049,Ben,White,ben.white@company.com,DE,CA,,2024-04-21 0:00,Webinar,RETARGET1,Windows,1.3.0,10-Jan,Finance,0,N/A,,1,04/21/2024 19:55,2024-08-21 19:55
U001852,Noah,Lopez,NOAH.LOPEZ@OUTLOOK.COM,CA,NSW,America/New_York,2024-09-26 0:00,Paid Search,SUMMER24,iOS,1.3.0,11-50,Product,0,61,,TRUE,2024-09-26 13:54,2024-12-20 13:54
U001948,Yuki,Taylor,yuki.taylor@company.com,IN,LND,,08/28/2023,Webinar,GROWTHLAB,Linux,2.0.1,unknown,Product,0,50,,TRUE,2023-08-29 0:00,2023-12-15 0:00
U002255,Olivia,Thompson,olivia.thompson@icloud.com,FR,ON,,2024-11-25 0:00,Content,SUMMER24,Unknown,1.1.0,11-50,Sales,no,56,,FALSE,2024-11-25 17:30,2025-01-14 17:30
U000601,Noah,Garcia,noah.garcia@company.com,ZA,,UTC,2023-09-16 0:00,Referral,SPRING24,Linux,2.0.0,501-1000,Marketing,0,42,U000493,FALSE,2023-09-16 11:46,2023-12-21 11:46
U000043,Ben,Thomas,ben.thomas@yahoo.com,US,TX,Europe/Berlin,2023-03-29 0:00,Social,GROWTHLAB,Unknown,v1.1.2,11-50,Ops,0,26,,N,2023-03-29 12:39,2023-07-02 12:39
U000174,Olivia,Allen,olivia.allen@proton.me,FR,WA,America/New_York,2023-10-29 0:00,Organic Search,n/a,Unknown,1.2.0,11-50,Marketing,0,45,,TRUE,2023-10-29 17:31,2024-03-28 17:31
U001132,Mateo,Thompson,mateo.thompson@gmail.com,MX,unknown,,2024-03-27,Paid Search,SUMMER24,Windows,2.0.1,11-50,Support,0,60,,TRUE,2024-03-27 7:14,06-02-2024 07:14
U001896,Anya,Thomas,anya.thomas@outlook.com,US,CA,Asia/Tokyo,2024-13-05,Paid Search,WINTER25,iOS,1.1.2,51-200,Finance,0,29,,FALSE,07/31/2024 09:10,2025-01-07 9:10
U001258,Kofi,Harris,kofi.harris@icloud.com,FR,CA,America/Los_Angeles,2024-03-24 0:00,Webinar,RETARGET1,macOS,1.1.0,11-50,Support,1,63,,TRUE,2024-03-24 5:21,2024-05-14 5:21
U001410,Amir,Robinson,amir.robinson@gmail.com,fr,,Asia/Kolkata,2024-11-13 0:00,Partner,RETARGET1,iOS,1.1.2,1000+,Finance,1,N/A,,FALSE,11/13/2024 09:06,2025-05-08 9:06
U000549,Emma,YOUNG,emma.young@gmail.com,SE,-,,2024-04-08 0:00,partner,RETARGET1,Linux,2.1.0,10-Jan,Founder,0,31,,N,2024-04-08 16:12,2024-08-01
U000398,Lucas,Robinson,lucas.robinson@proton.me,GB,SP,,2024-02-22 0:00,Organic Search,WINTER25,Unknown,1.3.0,51-200,Founder,0,58,,TRUE,2024-02-22 8:22,2024-04-19 8:22
U002470,Olivia,Thompson,olivia.thompson@icloud.com,BR,LND,America/New_York,04/19/2024,Content,GROWTHLAB,Windows,2.0.1,51-200,Product,1,35,,TRUE,2024-04-19 2:36,2024-10-09 2:36
U002390,Mateo,Patel,mateo.patel@outlook.com,MX,SP,America/Los_Angeles,2024-07-04 0:00,Referral,NA,Android,2.0.1,11-50,Support,1,20,U000434,1,2024-07-04 1:31,2024-07-09 1:31
U001111,Chen,King,chen.king@company.com,CA,BER,America/Los_Angeles,2024-09-26 0:00,Organic Search,RETARGET1,iOS,1.1.0,1000+,Marketing,0,30,,0,2024-09-26 5:15,2024-11-20 5:15
U002018,Zoe,Allen,zoe.allen@nexloom.io,BR,LND,Asia/Tokyo,2024-12-22 0:00,Outbound,RETARGET1,iOS,1.0.9,unknown,Engineering,1,50,,FALSE,2024-12-22 9:27,2025-05-08 9:27
U001878,Sofia,Wilson,sofia.wilson@yahoo.com,ZA,,Europe/London,04/02/2024,Paid Search,WINTER25,macOS,1.1.2,11-50,Sales,0,33,,FALSE,2024-04-02 15:10,2024-07-13 15:10
U001186,Chen,King,chen.king@yahoo.com,CA,RJ,UTC,2025-02-25 0:00,Outbound,BF2024,Android,2.0.0,11-50,Sales,0,,,FALSE,2025-02-25 16:55,2025-07-09 16:55
U001083,Priya,Nguyen,PRIYA.NGUYEN@YAHOO.COM,SE,,Europe/Berlin,2024-02-16 0:00,Webinar,BF2024,macOS,2.0.0,51-200,HR,0,48,,0,2024-02-16 17:59,2024-05-22 17:59
U002041,Mateo,PATEL,mateo.patel@nexloom.io,NL,-,Asia/Kolkata,2024-10-26 0:00,Paid Search,WINTER25,Linux,2.0.0,unknown,Sales,1,35,,N,2024-10-26 2:11,
USR-000483,Jin,Thompson,jin.thompson@outlook.com,,ON,Asia/Kolkata,2024-03-06 0:00,Paid Search,AI-LAUNCH,macOS,1.3.0,10-Jan,Ops,1,31,,yes,2024-03-06 9:33,2024-03-07 9:33
U002277,Emma,Walker,emma.walker@outlook.com,SG,MH,Asia/Kolkata,2024-08-06 0:00,Content,SUMMER24,iOS,2.0.1,11-50,Engineering,0,51,,0,2024-08-06 6:47,2024-09-18
U001379,Fatima,Lee,fatima.lee@nexloom.io,DE,LND,Europe/Berlin,2024-01-16 0:00,Partner,SUMMER24,Linux,1.2.0,unknown,Sales,1,33,,no,2024-01-16 17:49,2024-06-12 17:49
U000693,Nora,Thomas,nora.thomas@proton.me,FR,MH,Asia/Tokyo,2024-04-01 0:00,Organic Search,RETARGET1,Windows,1.1.0,51-200,Engineering,0,48,,0,2024-04-01 14:15,2024-05-05 14:15
U001390,Sophia,Anderson,sophia.anderson@nexloom.io,JP,BER,Europe/London,2024-03-05 0:00,Paid Search,null,Android,1.2.1,unknown,Support,1,34,,FALSE,2024-03-05 22:59,2024-04-08 22:59
U000303,Liam,Lee,liam.lee@outlook.com,MX,CA,,2024-04-18 0:00,Outbound,Q3_PROMO,iOS,2.0.0,1000+,Sales,0,20,,FALSE,2024-04-18 21:33,2024-10-11 21:33
USR-002584,Olivia,Johnson,olivia.johnson@icloud.com,DE,WA,,2024-03-03 0:00,Outbound,BF2024,Linux,2.0.0,11-50,Engineering,1,58,,N,2024-03-03 21:41,2024-06-24 21:41
U001914,Amir,Robinson, amir.robinson@gmail.com ,FR,-,Europe/London,2024-01-21 0:00,Social,RETARGET1,Linux,2.1.0,51-200,Marketing,0,46,,N,2024-01-21 23:06,2024-04-02 23:06
U000609,Sophia,Robinson,sophia.robinson@outlook.com,AU,-,America/Los_Angeles,2024-03-30 0:00,Outbound,SPRING24,Linux,1.0.9,unknown,Finance,0,20,,Y,2024-03-30 18:27,2024-09-23 18:27
U001793,Omar,Lee,omar.lee@gmail.com,SE,ON,UTC,2024-04-04 0:00,Social,BF2024,iOS,1.1.2,201-500,Product,0,48,,yes,2024-04-04 1:40,2024-05-23
U000013,Nora,Jackson,nora.jackson@gmail.com,GB,-,,2024-10-10 0:00,Social,WINTER25,Unknown,2.1.0,501-1000,Ops,1,,,1,2024-10-10 8:09,2024-12-19 8:09
U002599,Ravi,Smith,ravi.smith@yahoo.com,SG,BER,America/Los_Angeles,2023-12-05 0:00,Partner,WINTER25,Android,1.2.1,unknown,HR,0,unknown,,Y,2023-12-05 2:06,2024-03-09 2:06
U002208,Ivy,Patel,ivy.patel@nexloom.io,nl,WA,,2024-11-03 0:00,Webinar,SUMMER24,Windows,2.1.0,11-50,Ops,1,34,,1,2024-11-03 20:44,2025-03-22 20:44
U000874,Anya,Wilson,anya.wilson@proton.me,US,RJ,Asia/Kolkata,2024-02-11 0:00,Partner,SUMMER24,Linux,1.1.0,201-500,HR,0,41,,TRUE,2024-02-11 13:59,2024-03-31 13:59
U001706,Lucas,Moore,lucas.moore@proton.me,US,MH,Europe/Berlin,2023-07-17 0:00,Paid Search,N/A,Windows,1.1.0,1000+,Sales,1,30,,FALSE,2023-07-17 21:14,2023-11-02 21:14
U000648,Emma,Taylor,emma.taylor@icloud.com,SG,unknown,America/New_York,2024-06-29 0:00,Organic Search,n/a,Unknown,2.1.0,201-500,Founder,no,62,,TRUE,2024-06-29 23:35,2024-08-10 23:35
U000072,Ethan,Nguyen,ethan.nguyen@gmail.com,NL,NY,Europe/Berlin,2023-09-30 0:00,Social,N/A,Windows,v1.2.0,1000+,Engineering,1,34,,yes,2023-09-30 19:31,03-09-2024 19:31
U000251,Kofi,Taylor,kofi.taylor@outlook.com,GB,BC,UTC,2023-12-11,Referral,n/a,macOS,2.0.1,51-200,Product,yes,28,,N,2023-12-11 8:22,2024-04-05 8:22
U000628,Emma,Clark,emma.clark@company.com,SG,NSW,America/New_York,2024-08-08 0:00,Paid Search,GROWTHLAB,Unknown,1.1.2,51-200,Founder,0,62,,Y,2024-08-08 1:03,2025-01-19 1:03
U001596,Priya,Harris,priya.harris@icloud.com,IN,NY,UTC,05/07/2024,Outbound,N/A,Linux,1.3.0,501-1000,Founder,0,56,,Y,05/07/2024 18:43,2024-09-05 18:43
U000263,Chen,Taylor,chen.taylornexloom.io,CA,,Asia/Kolkata,2023-08-21 0:00,Referral,N/A,Unknown,1.3.0,11-50,Ops,0,25,U000460,no,2023-08-21 21:48,2024-01-16 21:48
U001038,Emma,Brown,emma.brown@yahoo.com,DE,WA,,2024-07-26,outbound,BF2024,iOS,2.1.0,unknown,Engineering,1,43,,Y,07/26/2024 20:13,2024-12-28 20:13
U001647,Ben,Young,ben.young@gmail.com,US,MH,Europe/London,2023-08-09 0:00,Referral,N/A,Android,2.1.0,11-50,Founder,0,50,U000153,FALSE,2023-08-09 21:32,2023-09-16 21:32
U002204,Olivia,Scott,olivia.scott@outlook.com,JP,RJ,UTC,2023-04-14 0:00,Organic Search,AI-LAUNCH,Linux,2.0.0,10-Jan,Engineering,1,49,,1,2023-04-14 15:53,2023-09-29 15:53
U000803,Emma,Wright,emma.wright@icloud.com,SG,CA,Europe/Berlin,2024-05-06 0:00,Partner,SUMMER24,macOS,1.2.0,1000+,Founder,0,36,,FALSE,2024-05-06 1:28,2024-06-22 1:28
U001977,Priya,Young,priya.young@icloud.com,DE,CA,Europe/London,2023-11-19,Paid Search,GROWTHLAB,iOS,2.0.1,11-50,Ops,0,27,,yes,2023-11-19 23:20,2024-01-30 23:20
U000096,Hana,WALKER,hana.walker@outlook.com,US,NY,America/New_York,2024-03-26,Referral,BF2024,macOS,1.1.0,201-500,Support,0,56,U000334,N,2024-03-26 15:09,2024-07-01 15:09
U001333,Ethan,White,ethan.white@gmail.com,BR,NSW,America/New_York,2023-10-30,Partner,WINTER25,macOS,2.0.1,51-200,Support,1,28,,TRUE,2023-10-30 17:59,2024-04-20 17:59
U002418,Mateo,Perez,mateo.perez@nexloom.io,DE,CA,Asia/Tokyo,2023-04-08 0:00,Partner,N/A,Android,2.1.0,51-200,Ops,0,40,,1,2023-04-08 8:23,2023-08-14 8:23
U000651,Emma,Lopez,emma.lopez@gmail.com,CA,CA,Asia/Kolkata,2023-06-24 0:00,Content,WINTER25,Windows,1.1.0,501-1000,Engineering,0,43,,Y,2023-06-24 10:38,2023-12-08 10:38
U001604,Mia,Lopez,mia.lopez@proton.me,US,,UTC,2024-01-14 0:00,Partner,AI-LAUNCH,Linux,2.0.1,11-50,Ops,0,48,,Y,2024-01-14 6:00,2024-03-19 6:00
U001600,Sara,Wright,sara.wright@nexloom.io,IN,,UTC,2024-12-14 0:00,Paid Search,AI-LAUNCH,Windows,1.2.1,11-50,Founder,0,52,,yes,2024-12-14 17:07,2025-06-03 17:07
U000150,Mia,Lopez,mia.lopez@proton.me,SE,MH,UTC,2023-12-01 0:00,Paid Search,AI-LAUNCH,macOS,1.0.9,1000+,Marketing,0,52,,Y,2023-12-01 23:11,2024-02-16 23:11
U000085,Kofi,Thompson,kofi.thompson@gmail.com,JP,SP,,2023-12-20 0:00,Webinar,Q3_PROMO,Windows,1.2.0,51-200,Marketing,0,63,,TRUE,2023-12-20 0:02,2024-01-01 0:02
U001959,Olivia,Smith,olivia.smith@yahoo.com,BR,BER,America/Los_Angeles,06/06/2024,Content,SPRING24,iOS,1.0.9,501-1000,Sales,1,58,,TRUE,2024-06-06 18:40,07-23-2024 18:40
U000755,Chen,Robinson,chen.robinson@yahoo.com,ZA,LND,UTC,2023-08-20 0:00,Referral,SUMMER24,Linux,2.0.1,201-500,HR,0,20,,TRUE,2023-08-20 15:09,2023-09-06 15:09
U002587,Anya,Brown,anya.brown@nexloom.io,DE,TX,,2023-06-03 0:00,webinar,WINTER25,Android,2.0.0,201-500,Sales,0,33,,N,2023-06-03 9:30,2023-07-16 9:30
U001000,Jin,Robinson,JIN.ROBINSON@OUTLOOK.COM,DE,SP,UTC,2024-03-01,Webinar,RETARGET1,Android,1.2.0,51-200,Marketing,1,N/A,,FALSE,2024-03-01 18:26,2024-03-01 18:26
U001413,ethan,Johnson,ethan.johnson@gmail.com,IN,TX,UTC,2023-11-26 0:00,Outbound,WINTER25,Windows,1.2.0,11-50,Engineering,0,40,,no,2023-11-26 4:48,2024-03-10 4:48
U001017,Olivia,Walker,olivia.walker@icloud.com,ZA,CA,Europe/London,2023-09-25 0:00,Social,SUMMER24,Unknown,1.2.0,201-500,Product,1,31,,0,2023-09-25 15:56,2024-03-13 15:56
U001431,Ravi,Davis, ravi.davis@gmail.com ,BR,SP,America/Los_Angeles,2024-03-06 0:00,Social,GROWTHLAB,Unknown,1.0.9,51-200,Product,0,45,,TRUE,2024-03-06 20:24,2024-03-17 20:24
U000652,Liam,Robinson,liam.robinson@gmail.com,GB,SP,Europe/Berlin,2024-04-16 0:00,Partner,RETARGET1,Unknown,1.3.0,51-200,Marketing,0,31,,FALSE,2024-04-16 20:11,2024-05-11 20:11
U000587,Hana,Walker,hana.walker@outlook.com,ZA,-,America/Los_Angeles,2023-06-09 0:00,partner,SUMMER24,Unknown,1.0.9,10-Jan,Founder,1,47,,0,2023-06-09 1:52,2023-10-08 1:52
U001703,Omar,White,omar.white@nexloom.io,SE,,,2023-12-21 0:00,Organic Search,n/a,iOS,2.1.0,51-200,Support,0,33,,Y,2023-12-21 7:26,2024-02-25 7:26
U001512,Zoe,Clark,zoe.clark@gmail.com,SG,SP,,2024-07-22 0:00,Content,SUMMER24,iOS,2.1.0,501-1000,Ops,0,23,,FALSE,2024-07-22 20:07,2024-07-31 20:07
U002347,Jin,Wright,jin.wright@proton.me,ZA,NY,Europe/London,2024-06-29 0:00,Partner,RETARGET1,iOS,1.2.0,11-50,Product,1,41,,Y,2024-06-29 5:43,2024-11-12 5:43
U001927,Ava,Allen,ava.allen@icloud.com,SE,BER,Asia/Tokyo,2024-05-12 0:00,Content,SUMMER24,iOS,1.3.0,11-50,Support,1,64,,N,05/12/2024 02:30,2024-09-18 2:30
U000740,Lucas,Walker,lucas.walker@yahoo.com,NL,SP,Asia/Kolkata,2024-01-26 0:00,Social,BF2024,Android,2.0.1,10-Jan,Product,0,25,,yes,2024-01-26 2:26,2024-07-12 2:26
U001180,Emma,Walker,emma.walker@proton.me,IN,WA,Asia/Kolkata,2024-04-18 0:00,Paid Search,SPRING24,Unknown,v2.1.0,51-200,Sales,1,20,,no,2024-04-18 14:47,2024-04-20 14:47
U001638,Lucas,Brown,lucas.brownoutlook.com,ZA,LND,America/Los_Angeles,2023-09-01 0:00,Social,WINTER25,Linux,2.0.1,10-Jan,Sales,0,27,,yes,2023-09-01 15:10,2023-12-29 15:10
U001322,Fatima,Johnson, fatima.johnson@nexloom.io ,JP,,Europe/London,2023-09-08 0:00,Organic Search,Q3_PROMO,Linux,1.0.9,unknown,Support,0,62,,yes,2023-09-08 15:50,2023-11-14 15:50
U000574,Mateo,NGUYEN,mateo.nguyen@nexloom.io,NL,NY,UTC,2024-05-30 0:00,Webinar,SUMMER24,iOS,1.1.2,501-1000,Finance,0,56,,N,2024-05-30 20:11,2024-11-19 20:11
U000379,Omar,Wright,omar.wright@company.com,SG,,America/New_York,2024-09-25 0:00,Content,N/A,iOS,1.2.1,1000+,Ops,0,41,,Y,2024-09-25 18:24,2025-03-18 18:24
U001342,Elena,Brown,elena.browncompany.com,DE,RJ,Asia/Tokyo,2024-03-10 0:00,Paid Search,GROWTHLAB,Linux,1.0.9,501-1000,Sales,0,51,,no,2024-03-10 15:18,2024-06-13 15:18
U000570,Ravi,Harris,ravi.harris@yahoo.com,ZA,CA,Asia/Kolkata,2024-01-10 0:00,Organic Search,GROWTHLAB,iOS,2.1.0,501-1000,Engineering,1,19,,FALSE,2024-01-10 7:48,2024-01-21 7:48
U000277,Chen,Johnson, chen.johnson@proton.me ,US,RJ,,2024-09-12 0:00,Partner,GROWTHLAB,macOS,v1.1.0,unknown,HR,0,49,,1,2024-09-12 11:23,2025-01-22 11:23
U000068,Nora,Brown,nora.brown@yahoo.com,AU,WA,,2024-09-15 0:00,Referral,SUMMER24,macOS,2.0.1,11-50,Support,0,54,,TRUE,2024-09-15 21:48,2024-12-04 21:48
U002241,Ben,Wright,ben.wright@icloud.com,CA,BC,,2024-09-09 0:00,Paid Search,AI-LAUNCH,Windows,1.1.0,201-500,Sales,0,40,,no,2024-09-09 12:38,2025-02-24 12:38
U000979,Chen,Perez,chen.perez@outlook.com,FR,BER,Europe/Berlin,2024-03-27 0:00,Organic Search,GROWTHLAB,Android,2.0.0,11-50,Ops,1,39,,1,2024-03-27 14:28,2024-05-15 14:28
U000027,Noah,Scott,noah.scott@company.com,SE,ON,Europe/Berlin,2023-10-10 0:00,Outbound,Q3_PROMO,Android,1.2.1,51-200,Engineering,0,22,,N,2023-10-10 13:28,2023-10-13 13:28
U001139,Ivy,Taylor,ivy.taylor@company.com,CA,NY,America/Los_Angeles,2024-03-19 0:00,Content,AI-LAUNCH,Android,1.1.0,51-200,Product,1,40,,,2024-03-19 8:22,2024-06-06 8:22
U001835,Mateo,King,mateo.king@company.com,BR,CA,Europe/Berlin,2024-09-22 0:00,Content,RETARGET1,macOS,1.3.0,501-1000,HR,0,45,,FALSE,2024-09-22 6:32,2025-02-07 6:32
U002484,Noah,Allen, noah.allen@nexloom.io ,NL,-,UTC,2023-08-29 0:00,Social,SUMMER24,Android,1.1.0,201-500,Engineering,0,21,,N,2023-08-29 21:27,2023-10-29 21:27
U002131,Chen,Anderson,chen.anderson@gmail.com,IN,MH,America/New_York,2023-09-10 0:00,Webinar,Q3_PROMO,Android,1.1.0,10-Jan,Marketing,0,28,,Y,2023-09-10 7:12,2023-09-24 7:12
U000546,Kofi,Allen,kofi.allen@proton.me,SG,MH,Europe/Berlin,2024-01-16 0:00,Content,SUMMER24,Android,1.1.2,unknown,Engineering,0,42,,,2024-01-16 16:05,05-19-2024 16:05
u001374,Ravi,Harris,ravi.harris@outlook.com,CA,BC,America/New_York,2024-03-25 0:00,Webinar,SUMMER24,Windows,2.0.1,201-500,Support,1,59,,TRUE,2024-03-25 2:45,2024-06-20 2:45
U001240,Ava,Walker,ava.walker@yahoo.com,ZA,unknown,America/Los_Angeles,2023-09-29 0:00,Organic Search,n/a,iOS,1.1.2,11-50,Support,0,42,,no,2023-09-29 23:48,2024-03-11 23:48
U002253,Elena,Thomas,elena.thomas@yahoo.com,UK,,Asia/Tokyo,2024-06-24 0:00,Content,GROWTHLAB,macOS,1.2.1,10-Jan,HR,0,47,,TRUE,2024-06-24 16:29,2024-07-05 16:29
U001822,Diego,THOMAS,diego.thomas@yahoo.com,AU,,,2023-08-03 0:00,Organic Search,SPRING24,Windows,1.0.9,51-200,Engineering,0,51,,Y,2023-08-03 9:19,2023-08-28 9:19
U001995,Liam,Nguyen,liam.nguyen@icloud.com,GB,CA,Europe/Berlin,2024-08-11 0:00,Partner,WINTER25,Unknown,2.1.0,unknown,Product,0,27,,TRUE,2024-08-11 17:49,2025-01-05 17:49
U001204,Ravi,Thomas,ravi.thomas@icloud.com,DE,LND,Europe/London,2023-12-28 0:00,Paid Search,WINTER25,iOS,2.0.0,51-200,Finance,0,18,,yes,2023-12-28 11:12,2024-01-10 11:12
U000594,Sara,Lopez,sara.lopez@yahoo.com,US,TX,UTC,2024-01-09,Content,AI-LAUNCH,Android,2.0.1,201-500,Sales,1,21,,TRUE,2024-01-09 19:48,2024-06-05 19:48
U001118,Anya,Lee,anya.lee@outlook.com,DE,NY,,2024-11-23 0:00,Organic Search,n/a,Windows,1.1.0,1000+,HR,0,49,,TRUE,2024-11-23 8:57,2025-01-31 8:57
U000514,Nora,White,nora.white@nexloom.io,IN,NSW,America/New_York,2024-11-11 0:00,Content,BF2024,iOS,v1.2.1,51-200,Sales,0,63,,1,2024-11-11 8:16,2025-05-10 8:16
U000029,Omar,Thomas,omar.thomas@yahoo.com,DE,LND,America/New_York,2024-05-14 0:00,Webinar,AI-LAUNCH,Unknown,1.0.9,51-200,Sales,1,N/A,,no,2024-05-14 20:20,2024-05-14 20:20
U000388,Ravi,Anderson,ravi.anderson@yahoo.com,SG,MH,Europe/Berlin,2023-09-23 0:00,Referral,n/a,Unknown,2.1.0,501-1000,Founder,1,25,U000105,FALSE,2023-09-23 12:47,2023-11-24 12:47
U001356,Anya,Lee,anya.lee@nexloom.io,NL,MH,,2024-11-19 0:00,Social,RETARGET1,iOS,2.1.0,201-500,Support,1,53,,0,11/19/2024 10:25,2025-02-12 10:25
U001317,Sophia,Scott,sophia.scott@yahoo.com,ZA,RJ,,2024-13-05,Paid Search,Q3_PROMO,Linux,2.0.0,501-1000,Marketing,1,53,,0,04/11/2024 21:39,2024-10-07 21:39
U000531,Ben,Perez,ben.perez@yahoo.com,SE,MH,Asia/Tokyo,23-09-2024,Webinar,SUMMER24,Linux,1.1.0,501-1000,Finance,1,52,,N,2024-09-23 5:08,2025-03-21 5:08
U002282,Priya,Brown,priya.brown@gmail.com,SE,RJ,Europe/Berlin,2024-01-18 0:00,Paid Search,SUMMER24,macOS,1.3.0,201-500,Product,0,,,1,2024-01-18 16:30,2024-02-07 16:30
U002132,Diego,Scott,diego.scott@outlook.com,IN,BC,Asia/Kolkata,2023-02-05 0:00,Paid Search,SPRING24,macOS,2.1.0,51-200,HR,0,46,,no,2023-02-05 19:13,2023-06-15 19:13
U001629,Mateo,Scott,MATEO.SCOTT@OUTLOOK.COM,FR,LND,Europe/Berlin,2023-07-06 0:00,Partner,Q3_PROMO,macOS,1.3.0,1000+,HR,0,33,,FALSE,2023-07-06 4:33,2023-09-06 4:33
U001929,Leo,Garcia,LEO.GARCIA@ICLOUD.COM,,,Asia/Tokyo,2024-06-09 0:00,Webinar,N/A,Windows,1.0.9,501-1000,Sales,0,18,,,2024-06-09 12:06,2024-11-11 12:06
U000986,Fatima,Johnson,fatima.johnson@nexloom.io,AU,,Europe/Berlin,2024-03-26,Paid Search,Q3_PROMO,Linux,2.0.0,201-500,Finance,0,57,,0,03/26/2024 02:47,2024-05-08 2:47
U000547,Mia,Lee,mia.lee@gmail.com,NL,NY,Asia/Tokyo,07/25/2023,Organic Search,WINTER25,macOS,1.3.0,unknown,Support,0,34,,FALSE,2023-07-25 18:39,
U001120,Omar,Scott,omar.scott@outlook.com,IN,TX,,,Social,RETARGET1,Android,1.1.0,10-Jan,Ops,0,18,,0,2023-08-11 16:09,2023-12-30 16:09
U000213,Ethan,Scott,ethan.scott@gmail.com,AU,WA,Europe/London,2024-06-14 0:00,Social,SUMMER24,macOS,1.0.9,10-Jan,HR,0,53,,1,2024-06-14 6:47,2024-08-03 6:47
U000429,Anya,Davis,anya.davis@gmail.com,FR,NY,America/New_York,2024-01-12 0:00,Referral,SUMMER24,Android,2.0.0,11-50,Sales,0,36,,FALSE,2024-01-12 11:41,2024-03-28 11:41
U002291,Ethan,Perez,ethan.perez@company.com,JP,,Europe/London,2024-05-24 0:00,Content,BF2024,macOS,1.3.0,unknown,Ops,0,28,,0,2024-05-24 17:07,2024-07-04 17:07
U000016,Ben,Taylor,ben.taylor@proton.me,ZA,SP,America/Los_Angeles,2023-09-27 0:00,Outbound,AI-LAUNCH,Linux,1.0.9,201-500,HR,0,50,,,2023-09-27 5:13,2024-01-16 5:13
U000865,Amir,Smith,amir.smith@outlook.com,GB,SP,,2024-02-07 0:00,Referral,n/a,macOS,1.3.0,unknown,Product,0,51,U000424,Y,2024-02-07 1:55,05-03-2024 01:55
U002050,Sophia,Harris,sophia.harris@yahoo.com,MX,NSW,Asia/Tokyo,2023-06-17 0:00,Partner,SUMMER24,iOS,2.1.0,1000+,Founder,0,24,,yes,2023-06-17 18:37,2023-10-29
U001612,Jin,Nguyen,jin.nguyen@company.com,JP,-,UTC,2024-06-14 0:00,Organic Search,N/A,Unknown,1.0.9,unknown,Sales,1,N/A,,FALSE,2024-06-14 20:33,2024-10-19 20:33
U002220,Olivia,Scott,olivia.scott@nexloom.io,BR,WA,Asia/Kolkata,2023-07-24 0:00,Partner,Q3_PROMO,macOS,2.1.0,51-200,HR,0,23,,TRUE,2023-07-24 0:28,2024-01-13
U002504,Liam,Garcia,liam.garcia@icloud.com,US,NSW,Europe/Berlin,2025-04-15 0:00,Content,BF2024,Android,2.1.0,501-1000,Ops,0,N/A,,Y,2025-04-15 0:04,2025-09-09 0:04
U000425,Anya,Garcia,anya.garcia@proton.me,fr,NSW,Asia/Tokyo,2023-05-12 0:00,Paid Search,RETARGET1,macOS,1.2.0,unknown,HR,1,51,,FALSE,2023-05-12 20:28,2023-09-05 20:28
U000466,Chen,Young,chen.young@nexloom.io,MX,TX,UTC,2024-01-25,Content,Q3_PROMO,Android,2.0.1,unknown,Founder,0,56,,TRUE,2024-01-25 7:19,2024-02-22 7:19
U002205,Ava,Smith,AVA.SMITH@GMAIL.COM,MX,unknown,Europe/Berlin,2024-08-04 0:00,Organic Search,Q3_PROMO,iOS,2.0.0,11-50,Product,1,54,,Y,2024-08-04 10:24,2024-08-15 10:24
U000168,Leo,Lopez,leo.lopez@yahoo.com,DE,BC,Europe/London,2023-09-30,Outbound,SPRING24,iOS,2.0.1,501-1000,Marketing,0,29,,TRUE,2023-09-30 4:19,2024-01-20 4:19
U000421,Olivia,White,olivia.white@icloud.com,SE,CA,America/Los_Angeles,09/07/2024,Outbound,GROWTHLAB,Windows,1.3.0,10-Jan,Founder,0,47,,Y,2024-09-07 8:23,2024-12-12 8:23
U000730,Nora,Taylor,nora.taylor@gmail.com,GB,SP,America/Los_Angeles,09/11/2023,Outbound,SPRING24,iOS,1.2.1,51-200,Ops,0,62,,Y,2023-09-11 21:39,2024-01-17 21:39
U001513,Ravi,Jackson,ravi.jackson@proton.me,NL,NSW,Europe/London,2025-04-14 0:00,Paid Search,WINTER25,Android,1.1.2,10-Jan,HR,1,28,,yes,2025-04-14 5:09,2025-04-27 5:09
U002026,Olivia,Clark,olivia.clark@company.com,GB,NSW,,2023-11-20 0:00,Partner,GROWTHLAB,Unknown,1.3.0,10-Jan,Engineering,0,50,,TRUE,2023-11-20 15:37,2023-12-09 15:37
U000271,Jin,Clark,jin.clark@gmail.com,IN,BC,Asia/Tokyo,2024-09-21 0:00,Partner,SPRING24,Android,1.0.9,201-500,Engineering,0,46,,Y,2024-09-21 0:09,2025-01-17 0:09
U002444,Anya,Harris,anya.harris@company.com,AU,SP,UTC,2024-10-11 0:00,Outbound,  BF2024  ,Windows,2.0.0,11-50,Finance,0,54,,yes,2024-10-11 23:23,2025-01-30 23:23
U002550,Amir,Brown,amir.brown@company.com,MX,LND,,2023-05-25 0:00,Social,GROWTHLAB,Windows,1.1.0,201-500,Support,0,49,,1,2023-05-25 14:01,2023-11-02 14:01
U000468,Kofi,Lee,kofi.lee@outlook.com,MX,WA,Europe/Berlin,2024-11-13 0:00,Paid Search,SUMMER24,Linux,1.1.2,10-Jan,Ops,0,44,,0,2024-11-13 21:02,2025-05-01 21:02
U001864,Sara,Clark,sara.clark@proton.me,mx,WA,America/New_York,2024-04-20 0:00,Webinar,SPRING24,Windows,1.2.0,201-500,Product,0,55,,yes,2024-04-20 23:01,08-12-2024 23:01
U001223,Chen,Anderson,chen.anderson@icloud.com,JP,BC,,2024-02-24 0:00,Organic Search,n/a,Linux,1.1.0,501-1000,Engineering,0,58,,1,2024-02-24 1:27,2024-03-06 1:27
U002388,Amir,Perez,amir.perez@gmail.com,ZA,unknown,Europe/London,2024-05-19 0:00,Content,SPRING24,Windows,v1.1.2,201-500,HR,0,38,,TRUE,2024-05-19 0:55,2024-08-16 0:55
 U001846 ,Liam,Davis,liam.davis@nexloom.io,SG,NSW,Europe/Berlin,2023-11-07 0:00,Partner,SUMMER24,macOS,1.1.2,51-200,Founder,0,47,,N,2023-11-07 13:23,2023-12-12 13:23
U000916,Anya,Brown,anya.brown@gmail.com,BR,LND,Europe/Berlin,25-02-2024,Paid Search,N/A,Unknown,1.1.0,51-200,Support,0,30,,,2024-02-25 20:23,2024-03-13 20:23
U000077,Lucas,Robinson,LUCAS.ROBINSON@GMAIL.COM,DE,CA,America/Los_Angeles,2024-08-24 0:00,Organic Search,WINTER25,Android,1.1.2,51-200,Engineering,0,32,,TRUE,2024-08-24 1:12,2025-01-12 1:12
U001821,Priya,Nguyen,priya.nguyen@gmail.com,ZA,SP,Asia/Kolkata,2023-10-14 0:00,Partner,SUMMER24,Unknown,1.1.2,11-50,Ops,0,19,,FALSE,2023-10-14 9:21,2024-01-21 9:21
U001874,Ben,Thomas,ben.thomas@icloud.com,za,ON,Europe/London,2025-02-30,Outbound,RETARGET1,Linux,2.0.1,1000+,Product,1,,,FALSE,2024-10-17 5:19,2025-03-28 5:19
U000639,Liam,Nguyen,liam.nguyen@outlook.com,IN,WA,Asia/Kolkata,11/26/2023,Paid Search,AI-LAUNCH,Android,1.1.0,1000+,Support,0,43,,1,2023-11-26 8:22,2024-02-23 8:22
U001990,Diego,White,diego.white@nexloom.io,ZA,SP,Europe/London,2024-07-28 0:00,Content,Q3_PROMO,Android,1.1.0,unknown,Sales,0,44,,yes,2024-07-28 18:34,2024-11-26 18:34
U002325,Hana,Thomas,hana.thomas@gmail.com,JP,BC,UTC,2024-10-02 0:00,Paid Search,AI-LAUNCH,iOS,2.1.0,11-50,HR,0,unknown,,0,2024-10-02 10:57,03-07-2025 10:57
U001774,Mia,Thompson,mia.thompson@proton.me,US,ON,,2025-04-13 0:00,Organic Search,,macOS,2.0.0,unknown,Support,0,56,,no,2025-04-13 9:53,2025-07-06 9:53
U001014,Priya,Thompson,priya.thompson@outlook.com,GB,CA,Europe/Berlin,2023-04-09 0:00,Paid Search,N/A,iOS,2.0.1,1000+,Marketing,0,30,,TRUE,2023-04-09 12:53,2023-05-07 12:53
U002141,Diego,Anderson,diego.andersoncompany.com,CA,,America/Los_Angeles,2024-09-28 0:00,Webinar,SUMMER24,Windows,1.3.0,501-1000,Product,0,37,,no,2024-09-28 4:55,11-08-2024 04:55
U002298,Ravi,Wright,ravi.wright@icloud.com,JP,MH,America/New_York,2023-04-03 0:00,Referral,  BF2024  ,Android,1.3.0,1000+,HR,0,48,U000373,1,2023-04-03 10:10,2023-07-18
U001862,Emma,Perez,emma.perez@icloud.com,FR,BER,Europe/Berlin,2024-06-17 0:00,Paid Search,SUMMER24,macOS,1.2.0,10-Jan,HR,1,53,,FALSE,2024-06-17 17:53,2024-07-02 17:53
U002159,Sara,Johnson,sara.johnson@gmail.com,BR,ON,Europe/Berlin,2024-03-04 0:00,Referral,n/a,Windows,1.1.0,10-Jan,Ops,0,44,,TRUE,2024-03-04 15:51,05-24-2024 15:51
U000236,Jin,Thompson,jin.thompson@gmail.com,IN,,Europe/London,2024-07-24 0:00,Paid Search,AI-LAUNCH,Android,1.1.2,10-Jan,Founder,0,55,,N,2024-07-24 20:20,2024-09-06 20:20
U001857,Mia,Allen,mia.allen@yahoo.com,FR,unknown,Europe/Berlin,2024-08-13 0:00,Paid Search,WINTER25,iOS,1.2.0,10-Jan,Founder,0,58,,1,2024-08-13 14:51,2024-12-09 14:51
U002382,Kofi,Martinez,kofi.martinez@icloud.com,SG,SP,America/New_York,2024-11-02 0:00,Organic Search,SPRING24,Unknown,1.1.0,501-1000,Sales,1,40,,TRUE,2024-11-02 7:40,2025-04-10 7:40
U001879,Diego,Thomas,diego.thomas@nexloom.io,SG,NSW,Europe/Berlin,2023-12-13 0:00,Referral,n/a,Android,1.2.0,201-500,Support,1,26,USR-000483,1,2023-12-13 13:10,2024-05-10 13:10
U000308,Sophia,Martinez,sophia.martinez@company.com,DE,BC,Asia/Kolkata,2023-12-27 0:00,Outbound,GROWTHLAB,Unknown,1.2.0,11-50,Engineering,1,35,,Y,2023-12-27 20:12,2024-05-29 20:12
U001824,Jin,Lopez,jin.lopez@yahoo.com,IN,BER,UTC,2024-08-26 0:00,Content,AI-LAUNCH,Linux,1.1.2,unknown,Engineering,0,55,,no,2024-08-26 17:20,12-25-2024 17:20
U001403,Sofia,Lee,sofia.lee@outlook.com,ZA,MH,UTC,2023-04-03,Partner,N/A,iOS,1.1.2,51-200,Engineering,0,30,,,2023-04-03 18:10,2023-08-27 18:10
U000962,Olivia,Brown, olivia.brown@icloud.com ,US,SP,,05/20/2024,Webinar,SUMMER24,macOS,1.3.0,501-1000,Product,0,52,,FALSE,2024-05-20 6:25,
U001620,Lucas,Garcia,lucas.garcia@nexloom.io,JP,BC,Asia/Kolkata,2024-07-29 0:00,Webinar,BF2024,Linux,2.0.1,51-200,Finance,0,29,,FALSE,2024-07-29 17:37,2024-10-16 17:37
U001688,Jin,Johnson,jin.johnson@gmail.com,SG,RJ,Asia/Tokyo,2024-03-22 0:00,Content,RETARGET1,Windows,1.2.1,201-500,Marketing,1,29,,,2024-03-22 19:14,2024-05-20 19:14
U001872,Ava,PATEL, ava.pateloutlook.com ,ZA,NY,,20-10-2023,Webinar,SPRING24,Android,2.0.0,501-1000,HR,0,36,,no,2023-10-20 5:32,2023-11-06 5:32
U002482,Olivia,Clark,olivia.clark@proton.me,SG,TX,Europe/London,2024-11-23 0:00,Organic Search,GROWTHLAB,Windows,2.1.0,201-500,Sales,0,unknown,,1,2024-11-23 1:05,2024-12-26 1:05
U002022,Leo,Brown,leo.brown@outlook.com,DE,LND,America/New_York,2024-04-28 0:00,Webinar,N/A,Linux,2.0.1,11-50,Sales,0,39,,no,2024-04-28 13:19,2024-09-28
U002171,Olivia,Perez,olivia.perez@proton.me,US,,America/New_York,2024-07-03 0:00,Organic Search,GROWTHLAB,Android,v2.1.0,unknown,HR,0,42,,TRUE,2024-07-03 17:45,2024-08-10 17:45
U001056,Ivy,Lee,ivy.lee@icloud.com,DE,NY,,01/12/2024,Webinar,Q3_PROMO,macOS,v1.1.0,10-Jan,Founder,0,64,,no,2024-01-12 10:47,2024-04-24 10:47
U001448,Hana,Young,hana.young@nexloom.io,BR,LND,America/New_York,2024-10-15,Referral,n/a,iOS,2.0.0,51-200,Finance,0,41,,TRUE,2024-10-15 18:56,2025-04-06 18:56
U000190,Ava,Smith,ava.smith@proton.me,US,unknown,America/Los_Angeles,03/04/2023,Organic Search,RETARGET1,macOS,1.2.1,51-200,Sales,1,62,,N,2023-03-04 14:51,2023-07-25 14:51
U002421,Priya,Martin,priya.martin@company.com,GB,BC,Europe/Berlin,2023-09-08 0:00,Paid Search,BF2024,Linux,1.2.0,201-500,Sales,0,41,,FALSE,2023-09-08 17:18,2023-12-05
U001966,Nora,Wilson,nora.wilson@outlook.com,SE,BC,,2024-05-12 0:00,Paid Search,AI-LAUNCH,Linux,1.1.0,1000+,Product,0,54,,yes,2024-05-12 11:14,2024-10-21 11:14
U001152,Emma,Patel,emma.patel@proton.me,BR,unknown,Asia/Kolkata,2024-10-14,Partner,AI-LAUNCH,iOS,2.0.0,501-1000,Finance,0,53,,Y,2024-10-14 20:39,2025-02-21 20:39
U001876,Lucas,Lewis,lucas.lewis@icloud.com,NL,WA,,2024-04-19 0:00,Partner,GROWTHLAB,Unknown,2.1.0,10-Jan,Engineering,0,54,,1,2024-04-19 16:55,2024-04-21 16:55
U002467,Yuki,Lewis,yuki.lewis@company.com,DE,TX,Europe/Berlin,2024-02-04 0:00,Content,BF2024,Linux,1.2.1,10-Jan,Sales,0,38,,TRUE,2024-02-04 8:00,2024-02-10 8:00
U002310,Sofia,Wright,sofia.wright@company.com,US,,Europe/Berlin,2024-01-09 0:00,Organic Search,AI-LAUNCH,iOS,1.0.9,10-Jan,Support,1,45,,TRUE,2024-01-09 10:56,2024-04-11 10:56
U000704,Yuki,Wilson, yuki.wilson@company.com ,NL,TX,,2023-08-16 0:00,Organic Search,AI-LAUNCH,Linux,1.1.2,10-Jan,Founder,1,19,,FALSE,2023-08-16 16:23,2023-11-09 16:23
U002150,Fatima,King,fatima.kingyahoo.com,gb,TX,,06-10-2024,Referral,WINTER25,iOS,1.3.0,51-200,Marketing,0,,,yes,2024-10-06 3:50,2024-10-20 3:50
U001842,Ivy,Brown,ivy.brown@icloud.com,BR,unknown,Europe/London,2024-02-23 0:00,Social,Q3_PROMO,macOS,1.0.9,1000+,Finance,0,27,,0,2024-02-23 18:46,2024-05-05
U002269,Yuki,Johnson,yuki.johnson@yahoo.com,fr,NSW,America/New_York,2023-11-05 0:00,Paid Search,RETARGET1,Windows,1.1.2,11-50,Support,0,24,,FALSE,2023-11-05 10:27,2024-01-31
USR-000669,Priya,Scott,priya.scott@company.com,ZA,LND,Asia/Kolkata,2023-09-30 0:00,Webinar,SUMMER24,macOS,1.2.0,1000+,Product,0,55,,N,2023-09-30 22:25,2024-01-03 22:25
U000933,Omar,Wright,omar.wright@company.com,AU,,Europe/London,2025-08-15 0:00,Partner,GROWTHLAB,Android,2.0.1,1000+,Founder,1,34,,1,2025-08-15 6:32,2025-08-30 6:32
U002118,Nora,Taylor,nora.taylor@proton.me,CA,,America/Los_Angeles,2024-05-26 0:00,Organic Search,n/a,Linux,v1.0.9,1000+,Finance,0,38,,1,2024-05-26 8:46,2024-11-11 8:46
U002348,Ravi,Johnson,ravi.johnson@nexloom.io,NL,LND,,2024-01-18 0:00,Referral,SPRING24,Windows,1.0.9,10-Jan,Founder,0,39,U000356,yes,2024-01-18 13:29,2024-04-18 13:29
U000173,Mia,Perez,mia.perez@company.com,DE,BC,America/New_York,2024-04-04 0:00,Social,AI-LAUNCH,iOS,v1.1.2,51-200,Ops,0,39,,FALSE,2024-04-04 17:56,2024-08-18 17:56
U002360,Emma,Taylor,emma.taylor@proton.me,SG,NY,Asia/Kolkata,2023-08-23 0:00,Content,Q3_PROMO,iOS,1.3.0,unknown,Engineering,0,57,,TRUE,08/23/2023 08:20,2023-12-22 8:20
U002198,Leo,King,leo.king@company.com,FR,BER,America/Los_Angeles,2024-11-09 0:00,Paid Search,SPRING24,Unknown,1.1.2,unknown,Marketing,0,37,,Y,2024-11-09 4:47,2024-12-01 4:47
U001261,Lucas,Young,lucas.young@company.com,SG,RJ,America/Los_Angeles,2023-11-25 0:00,Organic Search,n/a,Linux,2.1.0,1000+,Ops,TRUE,27,,yes,2023-11-25 20:18,2024-02-24 20:18
U000482,Emma,Jackson,emma.jackson@proton.me,GB,NSW,Europe/London,2024-07-09 0:00,Referral,n/a,Unknown,2.1.0,501-1000,Finance,1,45,U000048,TRUE,2024-07-09 9:01,2024-10-10 9:01
U001867,Anya,Wilson,anya.wilson@yahoo.com,JP,BC,Europe/London,2023-04-16 0:00,Paid Search,Q3_PROMO,iOS,1.1.2,201-500,Sales,TRUE,62,,,2023-04-16 15:58,2023-05-14 15:58
U000386,Elena,Nguyen,elena.nguyen@outlook.com,SE,,America/Los_Angeles,2024-09-16,Organic Search,n/a,Unknown,1.3.0,unknown,Support,0,21,,0,2024-09-16 12:45,2024-12-25 12:45
U002588,Priya,Robinson,priya.robinson@nexloom.io,IN,LND,,2024-07-01 0:00,Content,SUMMER24,Android,1.0.9,501-1000,HR,0,53,,FALSE,2024-07-01 17:03,2024-11-05 17:03
USR-002258,Nora,White,nora.white@company.com,IN,BC,,2024-02-23,Outbound,AI-LAUNCH,Android,1.2.0,501-1000,Finance,1,unknown,,TRUE,2024-02-23 7:53,2024-06-12 7:53
U000341,Mia,Martinez,mia.martinez@company.com,SG,WA,America/New_York,2024-03-24 0:00,Outbound,AI-LAUNCH,Android,1.0.9,11-50,Engineering,1,47,,no,2024-03-24 2:49,2024-07-31 2:49
U001637,Priya,Martinez,priya.martinez@proton.me,ZA,SP,Europe/London,07-02-2024,Webinar,WINTER25,Android,1.1.0,51-200,Product,0,23,,TRUE,2024-02-07 0:52,2024-06-09 0:52
U002461,Emma,Lopez,emma.lopez@company.com,US,NSW,UTC,2025-10-15 0:00,Outbound,GROWTHLAB,iOS,1.2.1,10-Jan,Engineering,0,,,1,10/15/2025 16:00,2026-04-04
U000024,Yuki,Thomas,yuki.thomas@nexloom.io,SG,LND,America/New_York,2025-03-10 0:00,Referral,WINTER25,Linux,1.0.9,1000+,Product,no,50,U000273,FALSE,2025-03-10 4:45,2025-07-29 4:45
U001933,Sofia,Lee, sofia.lee@company.com ,SG,RJ,UTC,28-04-2024,Organic Search,Q3_PROMO,iOS,1.1.0,501-1000,HR,0,41,,1,2024-04-28 4:37,05-28-2024 04:37
U000522,Ivy,Young,ivy.young@icloud.com,CA,RJ,Europe/London,2024-01-28 0:00,Webinar,RETARGET1,Unknown,1.2.0,51-200,Engineering,0,62,,Y,2024-01-28 4:51,2024-06-02 4:51
U001861,Chen,Johnson,chen.johnson@gmail.com,BR,NSW,Asia/Tokyo,2024-08-27 0:00,Organic Search,GROWTHLAB,macOS,2.1.0,1000+,HR,0,30,,yes,2024-08-27 17:18,2024-11-02 17:18
U001964,Olivia,Harris,olivia.harris@gmail.com,NL,SP,America/New_York,2024-01-29,Outbound,null,Windows,2.1.0,201-500,Product,0,33,,N,2024-01-29 7:56,2024-02-22 7:56
U001657,Hana,Thompson,HANA.THOMPSON@PROTON.ME,SG,NSW,,2024-04-25 0:00,Social,SPRING24,Unknown,2.1.0,1000+,Finance,1,54,,FALSE,2024-04-25 16:39,2024-06-02 16:39
U001613,Emma,Perez,emma.perez@nexloom.io,AU,NSW,America/Los_Angeles,04/14/2024,Organic Search,WINTER25,Windows,1.1.0,51-200,Finance,1,36,,,2024-04-14 20:04,2024-05-09 20:04
U000390,Yuki,Robinson,yuki.robinson@company.com,JP,CA,Europe/London,2024-09-19 0:00,Social,BF2024,Linux,1.3.0,11-50,Finance,1,52,,FALSE,2024-09-19 8:24,2025-01-01 8:24
U000008,Sofia,Lee,sofia.lee@gmail.com,FR,BC,America/New_York,06/30/2024,Content,SUMMER24,Windows,v2.1.0,501-1000,Engineering,0,53,,1,2024-06-30 16:04,2024-08-19 16:04
U001254,Mateo,Moore,MATEO.MOORE@PROTON.ME,SG,SP,America/Los_Angeles,07-08-2023,Webinar,N/A,macOS,1.1.0,201-500,HR,1,29,,no,2023-08-07 19:54,2023-08-22 19:54
U000036,Zoe,Jackson,zoe.jackson@yahoo.com,BR,TX,,2024-09-20 0:00,Partner,N/A,Linux,1.1.2,201-500,Engineering,0,63,,N,2024-09-20 5:25,2024-12-22 5:25
U000623,Nora,Smith,nora.smith@proton.me,NL,SP,,2024-01-22 0:00,Content,RETARGET1,Linux,2.1.0,51-200,Finance,0,,,,2024-01-22 23:09,06-08-2024 23:09
U000315,Priya,Brown,priya.brownnexloom.io,JP,WA,UTC,2024-10-13 0:00,Webinar,BF2024,iOS,1.3.0,201-500,Support,0,32,,,2024-10-13 10:15,2025-03-14 10:15
U001032,Ben,Wilson,ben.wilsonicloud.com,FR,ON,,2024-05-16 0:00,Paid Search,RETARGET1,Windows,2.0.0,unknown,Ops,0,40,,TRUE,2024-05-16 23:30,2024-09-12 23:30
U001138,Ava,Smith,ava.smith@yahoo.com,JP,-,Asia/Kolkata,26-03-2024,Outbound,BF2024,Windows,2.0.1,unknown,Support,0,26,,N,2024-03-26 6:10,2024-04-28 6:10
U001335,Nora,Thomas,nora.thomas@nexloom.io,NL,LND,Europe/Berlin,2025-06-26 0:00,organic search,n/a,Unknown,2.1.0,11-50,Product,0,34,,N,2025-06-26 10:32,2025-08-15 10:32
U002393,Anya,King,anya.king@icloud.com,GB,,,2024-02-23 0:00,Partner,AI-LAUNCH,macOS,1.1.2,10-Jan,Engineering,0,49,,0,2024-02-23 9:01,2024-07-31 9:01
U001326,Elena,Thomas,elena.thomas@yahoo.com,BR,BC,,2024-01-04,Referral,Q3_PROMO,Windows,1.3.0,51-200,Product,0,19,U000345,,2024-01-04 12:05,01-23-2024 12:05
U002228,Zoe,Martin,zoe.martin@gmail.com,FR,SP,America/Los_Angeles,2024-05-17 0:00,Paid Search,BF2024,Windows,2.0.0,11-50,Product,0,20,  U000120,FALSE,2024-05-17 5:48,2024-08-28 5:48
U001557,Diego,Taylor,diego.taylor@outlook.com,DE,,Europe/London,2024-05-24 0:00,Content,AI-LAUNCH,Linux,2.1.0,1000+,HR,0,24,,Y,2024-05-24 1:31,2024-06-06 1:31
U000716,Sophia,Thomas,sophia.thomas@yahoo.com,fr,MH,America/Los_Angeles,2025-02-09 0:00,Outbound,N/A,Windows,1.3.0,201-500,Sales,0,39,,TRUE,2025-02-09 2:27,2025-06-09 2:27
U002582,Kofi,Perez,kofi.perezproton.me,DE,LND,,2024-12-07,Organic Search,N/A,Android,1.1.0,1000+,Support,0,62,,TRUE,2024-12-07 13:27,2024-12-17 13:27
U000009,Elena,Lopez,elena.lopez@gmail.com,DE,TX,,2023-01-28 0:00,Outbound,RETARGET1,Android,1.0.9,201-500,Marketing,1,28,,FALSE,2023-01-28 18:03,2023-07-02 18:03
U002110,Ivy,Jackson,ivy.jackson@nexloom.io,CA,BC,America/Los_Angeles,2025-08-10 0:00,Paid Search,RETARGET1,Linux,2.0.1,10-Jan,Sales,0,24,,yes,2025-08-10 3:54,2025-08-31
U000453,Kofi,Scott,kofi.scott@icloud.com,CA,-,America/New_York,2024-02-19 0:00,Partner,SPRING24,macOS,1.0.9,201-500,Engineering,1,61,,Y,2024-02-19 7:04,2024-03-30 7:04
U001677,Ivy,Walker,ivy.walker@icloud.com,MX,CA,UTC,2023-06-16 0:00,Paid Search,RETARGET1,Unknown,1.1.2,201-500,Engineering,1,41,,no,2023-06-16 12:33,2023-10-25 12:33
U001536,Amir,Moore,amir.moore@yahoo.com,US,BC,Europe/London,08/03/2023,Content,N/A,iOS,1.3.0,1000+,Founder,0,27,,Y,2023-08-03 10:59,2023-10-10 10:59
U001213,Liam,Clark,liam.clark@proton.me,SE,,America/New_York,2023-09-11 0:00,Content,BF2024,Windows,1.2.1,201-500,Marketing,0,63,,FALSE,2023-09-11 21:28,2023-11-08 21:28
U000163,Jin,Davis,jin.davis@proton.me,US,SP,Europe/London,2024-06-05,Webinar,Q3_PROMO,macOS,2.0.1,1000+,HR,0,30,,TRUE,2024-06-05 15:53,2024-09-30 15:53
U001169,Ben,Allen,ben.allen@nexloom.io,CA,NSW,Europe/Berlin,2023-01-19,Content,SUMMER24,macOS,1.0.9,201-500,Sales,0,48,,FALSE,2023-01-19 18:51,2023-04-05 18:51
U000729,Olivia,Clark,olivia.clark@nexloom.io,FR,SP,,2023-10-11 0:00,Webinar,SPRING24,macOS,v1.1.2,1000+,Ops,0,53,,TRUE,2023-10-11 3:00,2023-12-25 3:00
U001556,Hana,Allen,HANA.ALLEN@ICLOUD.COM,DE,-,UTC,2023-10-19 0:00,Content,RETARGET1,Unknown,2.1.0,unknown,HR,0,52,,Y,2023-10-19 17:41,2024-04-13 17:41
U001396,Olivia,Anderson,OLIVIA.ANDERSON@GMAIL.COM,FR,unknown,America/Los_Angeles,2024-10-06 0:00,Referral,n/a,Linux,2.0.0,10-Jan,Finance,0,60,U000281,N,2024-10-06 8:22,2025-02-09 8:22
U002302,Ethan,Nguyen,ethan.nguyen@icloud.com,in,WA,America/Los_Angeles,2024-05-04 0:00,Webinar,BF2024,Android,1.1.2,10-Jan,Support,0,57,,TRUE,2024-05-04 21:36,2024-07-04 21:36
U001400,Sophia,Clark,sophia.clark@icloud.com,GB,NSW,Europe/Berlin,2024-07-15 0:00,Paid Search,SPRING24,Linux,2.0.1,51-200,Product,0,23,,FALSE,2024-07-15 3:02,2025-01-10 3:02
U000097,Diego,Garcia,diego.garcia@proton.me,CA,NY,,2024-04-09 0:00,Webinar,BF2024,iOS,2.1.0,51-200,Finance,0,28,,yes,2024-04-09 3:02,2024-05-07 3:02
U000245,Ivy,Robinson,ivy.robinson@company.com,BR,WA,America/New_York,13-02-2023,Organic Search,SUMMER24,Unknown,1.1.2,unknown,Finance,0,26,,TRUE,2023-02-13 1:46,0000-00-00 00:00:00
U002426,Ethan,Lee,ethan.lee@company.com,JP,,Asia/Tokyo,2024-12-22 0:00,Content,SUMMER24,Windows,1.2.0,201-500,Finance,0,39,,TRUE,2024-12-22 18:59,2025-04-15 18:59
U002162,Liam,Martin,liam.martin@nexloom.io,ZA,LND,America/Los_Angeles,2024-05-29 0:00,Social,null,iOS,2.1.0,1000+,Ops,0,38,,FALSE,2024-05-29 17:15,2024-06-24 17:15
U000527,Zoe,Lopez,zoe.lopez@nexloom.io,JP,CA,Asia/Kolkata,02/15/2024,Outbound,Q3_PROMO,macOS,2.0.0,11-50,Engineering,1,29,,FALSE,2024-02-15 8:38,2024-06-30 8:38
U001779,Liam,Smith,liam.smith@nexloom.io,GB,-,Europe/London,2023-11-16 0:00,Outbound,BF2024,macOS,2.0.1,1000+,Sales,0,42,,Y,2023-11-16 5:22,2024-03-03 5:22
U001451,Fatima,Smith,fatima.smith@icloud.com,FR,MH,Asia/Tokyo,2024-03-27 0:00,Paid Search,Q3_PROMO,macOS,1.1.0,11-50,HR,0,27,,TRUE,2024-03-27 2:04,2024-09-19 2:04
U001110,Emma,Taylor,emma.taylor@yahoo.com,US,CA,Europe/London,2023-09-03 0:00,Partner,SPRING24,Windows,1.0.9,11-50,Sales,0,,,FALSE,2023-09-03 5:59,
U000137,Lucas,Wright, lucas.wright@proton.me ,MX,ON,UTC,2024-04-07 0:00,Social,SUMMER24,Windows,2.0.0,1000+,Sales,0,33,,1,2024-04-07 18:28,2024-09-29 18:28
U001441,Nora,Garcia,nora.garcia@icloud.com,US,CA,Asia/Tokyo,04-06-2025,Content,GROWTHLAB,Windows,1.2.1,201-500,Product,0,49,,Y,2025-06-04 23:28,2025-08-28 23:28
U002061,Omar,Scott,omar.scott@gmail.com,ZA,RJ,,2023-05-19 0:00,Partner,AI-LAUNCH,Unknown,2.0.0,10-Jan,Ops,1,39,,FALSE,2023-05-19 9:51,2023-06-03 9:51
U001875,Liam,Harris,liam.harris@company.com,US,ON,Europe/Berlin,2024-07-30 0:00,Organic Search,SPRING24,Linux,2.0.1,1000+,Ops,0,30,,no,2024-07-30 10:05,2024-09-05 10:05
U001909,Liam,Robinson,liam.robinson@company.com,SG,NSW,America/Los_Angeles,2023-12-30 0:00,Outbound,WINTER25,Linux,1.2.1,501-1000,Ops,0,30,,yes,2023-12-30 12:50,2024-05-17 12:50
U001188,Ravi,Young, ravi.young@yahoo.com ,AU,WA,,2023-05-28 0:00,Referral,SUMMER24,Windows,2.1.0,10-Jan,Product,0,unknown,U000164,TRUE,2023-05-28 23:09,2023-06-17 23:09
U001416,Yuki,Harris,yuki.harris@proton.me,GB,-,UTC,2025-02-23 0:00,Organic Search,Q3_PROMO,iOS,1.3.0,11-50,Finance,0,44,,yes,2025-02-23 17:32,06-07-2025 17:32
U002478,Olivia,Young,olivia.young@outlook.com,ZA,LND,America/New_York,2024-09-06 0:00,Outbound,AI-LAUNCH,macOS,1.0.9,51-200,Engineering,0,47,,1,2024-09-06 12:23,09-12-2024 12:23
U001786,Yuki,Martin,yuki.martin@yahoo.com,us,LND,America/New_York,2024-12-15 0:00,Partner,Q3_PROMO,Windows,1.0.9,501-1000,Founder,0,60,,FALSE,2024-12-15 0:43,2025-03-18 0:43
U000506,Jin,Martin,jin.martin@nexloom.io,JP,MH,Asia/Tokyo,2023-09-10 0:00,Partner,BF2024,macOS,2.0.1,501-1000,Sales,1,18,,yes,2023-09-10 4:24,2023-11-07 4:24
U002039,Lucas,Brown,lucas.brown@yahoo.com,FR,-,UTC,2023-10-28 0:00,Webinar,Q3_PROMO,Windows,1.3.0,10-Jan,HR,0,22,,TRUE,2023-10-28 4:40,2024-01-28 4:40
U001307,Ivy,Jackson,ivy.jackson@outlook.com,GB,NSW,,07/19/2024,Organic Search,SUMMER24,Unknown,2.0.1,1000+,Founder,0,62,,1,2024-07-19 3:59,2024-12-21 3:59
U000294,Emma,Lee,emma.lee@gmail.com,ZA,CA,Europe/London,01/17/2024,Content,RETARGET1,iOS,1.3.0,201-500,HR,0,36,,0,2024-01-17 20:10,2024-01-23 20:10
U000207,Elena,Anderson,elena.anderson@icloud.com,NL,CA,Europe/London,2023-07-12 0:00,Social,N/A,Linux,1.3.0,1000+,Product,0,18,,,2023-07-12 22:09,12-25-2023 22:09
U000807,Zoe,Patel,ZOE.PATEL@PROTON.ME,br,NY,,2025-02-19 0:00,Social,AI-LAUNCH,Windows,1.2.0,11-50,Support,0,57,,,2025-02-19 18:48,2025-08-04 18:48
U001257,Jin,Young,jin.young@proton.me,CA,unknown,Asia/Kolkata,2023-10-10 0:00,Content,GROWTHLAB,Android,1.2.1,501-1000,Sales,1,60,,0,2023-10-10 10:02,2024-02-29 10:02
U002289,Noah,Allen,noah.allen@yahoo.com,FR,SP,America/Los_Angeles,2024-03-20 0:00,Outbound,GROWTHLAB,iOS,2.1.0,501-1000,Sales,1,55,,,2024-03-20 20:59,2024-08-16 20:59
U001982,Mateo,Thomas,mateo.thomas@outlook.com,CA,NSW,,2024-09-15 0:00,Partner,BF2024,Android,2.0.0,10-Jan,Finance,1,57,,FALSE,2024-09-15 11:05,2025-01-16 11:05
U000714,Ivy,Young,ivy.young@yahoo.com,FR,NY,Asia/Tokyo,2024-02-13 0:00,Webinar,SUMMER24,iOS,v2.0.1,501-1000,Founder,1,18,,1,2024-02-13 20:50,2024-07-27 20:50
U001916,Sophia,Harris,sophia.harris@nexloom.io,ZA,,America/Los_Angeles,2024-07-24 0:00,Webinar,AI-LAUNCH,iOS,1.3.0,11-50,Finance,0,55,,TRUE,07/24/2024 04:56,
U002128,Anya,Scott,anya.scott@company.com,IN,MH,,2023-09-13 0:00,Organic Search,BF2024,Windows,1.3.0,501-1000,Support,0,57,,yes,2023-09-13 15:56,2024-01-27
U000883,Liam,Martin,liam.martin@gmail.com,CA,MH,America/New_York,2024-13-05,partner,SUMMER24,macOS,1.1.0,201-500,Ops,0,41,,FALSE,2023-02-24 16:42,2023-07-22 16:42
U001936,Amir,Lee,amir.lee@gmail.com,FR,SP,Asia/Kolkata,2024-09-17 0:00,Paid Search,SPRING24,Linux,1.1.0,51-200,Founder,0,42,,FALSE,2024-09-17 14:02,2024-10-02 14:02
U000401,Yuki,Johnson,yuki.johnson@nexloom.io,ZA,WA,,2023-07-14 0:00,Outbound,GROWTHLAB,Linux,1.2.1,201-500,Support,1,59,,Y,2023-07-14 16:08,2023-11-06 16:08
U000158,Priya,Wilson,priya.wilson@gmail.com,CA,SP,America/New_York,2024-08-18 0:00,Social,N/A,Android,1.0.9,1000+,Engineering,yes,52,,yes,2024-08-18 22:33,2024-10-05 22:33
U001533,Kofi,Martin,kofi.martin@icloud.com,United States,LND,America/New_York,2024-07-20 0:00,Outbound,GROWTHLAB,iOS,1.1.0,51-200,Product,0,53,,TRUE,2024-07-20 20:25,2024-11-24 20:25
U000492,Mia,Clark,mia.clark@yahoo.com,DE,,,2024-05-29 0:00,Paid Search,SPRING24,Unknown,2.0.0,10-Jan,HR,1,18,,1,2024-05-29 7:30,07-02-2024 07:30
U000292,Zoe,Jackson,zoe.jackson@icloud.com,DE,NSW,America/Los_Angeles,2023-04-04 0:00,Organic Search,BF2024,Linux,2.0.0,51-200,HR,0,60,,FALSE,2023-04-04 0:35,2023-07-25
U001884,Ivy,Patel,ivy.patel@gmail.com,SG,CA,,2024-08-17 0:00,Outbound,,Windows,1.0.9,11-50,Engineering,1,34,,,2024-08-17 13:16,2024-11-22 13:16
U001364,Zoe,Smith,zoe.smithgmail.com,gb,WA,,2024-06-04 0:00,Organic Search,SUMMER24,Linux,1.1.0,1000+,Marketing,,23,,Y,2024-06-04 16:18,
U001735,Ben,Anderson,ben.anderson@nexloom.io,SG,TX,America/Los_Angeles,2023-08-12 0:00,Content,AI-LAUNCH,iOS,2.0.0,201-500,Product,0,61,,N,08/12/2023 07:46,2023-11-22 7:46
U000057,Ethan,Jackson,ETHAN.JACKSON@OUTLOOK.COM,CA,LND,,12/25/2024,Referral,Q3_PROMO,iOS,1.3.0,201-500,Engineering,0,63,U000368,N,2024-12-25 6:32,03-23-2025 06:32
U001181,Amir,TAYLOR,amir.taylor@nexloom.io,IN,NSW,Europe/Berlin,2025-05-08 0:00,Content,SPRING24,Linux,2.0.1,unknown,Finance,1,23,,FALSE,2025-05-08 6:52,09-18-2025 06:52
U001411,Noah,Jackson,noah.jackson@company.com,AU,WA,,2023-10-14 0:00,Content,GROWTHLAB,Unknown,1.1.2,unknown,Finance,1,19,,N,10/14/2023 04:11,2023-12-19 4:11
U000180,Jin,Moore, jin.moore@yahoo.com ,BR,SP,Europe/London,2023-08-19 0:00,Content,SUMMER24,Windows,2.0.1,1000+,Sales,0,49,,Y,2023-08-19 2:34,2024-01-03 2:34
USR-000922,Lucas,Brown,lucas.brown@icloud.com,SE,LND,Asia/Tokyo,2024-03-22,Social,BF2024,Windows,2.0.0,501-1000,Marketing,0,59,,FALSE,2024-03-22 22:22,2024-03-22 22:22
U001689,Chen,Clark,chen.clark@yahoo.com,BR,RJ,America/New_York,2024-05-21 0:00,Referral,N/A,Android,1.3.0,11-50,HR,0,25,,N,2024-05-21 14:43,2024-09-19 14:43
U000079,Ethan,Moore,ethan.moore@proton.me,DE,NY,UTC,2024-01-16 0:00,Content,N/A,Unknown,1.1.0,501-1000,Marketing,0,22,,N,2024-01-16 23:55,2024-04-08 23:55
U002545,Yuki,Clark,yuki.clark@nexloom.io,DE,,,2023-06-26 0:00,Social,AI-LAUNCH,Linux,1.2.1,51-200,Support,1,35,,yes,2023-06-26 17:03,2023-08-15 17:03
U001117,Sara,Moore,sara.moore@gmail.com,SE,SP,UTC,2023-06-30 0:00,Outbound,WINTER25,Linux,2.0.0,unknown,HR,0,50,,TRUE,2023-06-30 8:54,2023-07-14 8:54
U000695,Ben,Allen,ben.allen@outlook.com,AU,ON,America/Los_Angeles,2023-07-27 0:00,Referral,n/a,Linux,2.1.0,51-200,Engineering,0,59,U000020,TRUE,2023-07-27 4:56,2023-12-15 4:56
U002368,Liam,Lopez,liam.lopez@nexloom.io,JP,,,2024-04-27 0:00,Webinar,SPRING24,macOS,2.1.0,501-1000,Sales,1,unknown,,no,2024-04-27 14:00,2024-04-28 14:00
U002247,Amir,Patel,amir.patel@outlook.com,AU,NY,America/New_York,2023-05-22 0:00,Referral,WINTER25,macOS,2.0.1,11-50,Support,0,25,,TRUE,2023-05-22 5:21,2023-10-19 5:21
U000818,Ben,Lee,ben.lee@yahoo.com,MX,WA,Europe/London,03-45-2024,Outbound,RETARGET1,iOS,2.0.1,10-Jan,Sales,0,18,,Y,2024-02-06 20:33,2024-05-27 20:33
U000712,Sara,Brown,sara.brown@outlook.com,SG,CA,Europe/Berlin,2024-05-16 0:00,Referral,Q3_PROMO,Linux,2.0.0,10-Jan,Founder,1,56,U000129,1,2024-05-16 22:59,2024-06-30 22:59
U000524,Mia,Taylor,mia.taylor@proton.me,JP,ON,America/Los_Angeles,2024-10-18 0:00,Outbound,Q3_PROMO,Android,2.0.1,11-50,Marketing,0,54,,,2024-10-18 0:56,2025-04-03 0:56
U001047,Elena,Nguyen,elena.nguyen@yahoo.com,AU,SP,,2023-11-02 0:00,Organic Search,BF2024,Unknown,1.2.1,51-200,Marketing,0,25,,TRUE,2023-11-02 15:43,2023-12-26 15:43
U002580,Mia,Martin,mia.martin@company.com,DE,NY,Europe/Berlin,2024-06-12 0:00,Organic Search,n/a,Unknown,1.2.1,1000+,Marketing,1,27,,no,2024-06-12 4:41,2024-11-08 4:41
U000134,Sophia,Martin,sophia.martin@proton.me,NL,LND,Asia/Tokyo,2024-01-04,Outbound,SUMMER24,Linux,1.1.0,201-500,Finance,0,40,,0,2024-01-04 11:56,2024-06-09 11:56
U000815,Lucas,Martinez,lucas.martinez@yahoo.com,ZA,BC,Asia/Kolkata,2024-11-15 0:00,Referral,RETARGET1,Android,1.2.1,501-1000,Founder,0,31,U000014,0,2024-11-15 3:58,2024-12-08 3:58
U001771,Anya,Clark,anya.clark@outlook.com,ZA,MH,Europe/Berlin,03/08/2024,Content,GROWTHLAB,Windows,1.0.9,1000+,Sales,0,39,,yes,2024-03-08 13:26,2024-08-07 13:26
U001566,Chen,Harris,chen.harris@outlook.com,BR,RJ,Asia/Kolkata,2024-02-19 0:00,Social,AI-LAUNCH,macOS,2.1.0,10-Jan,Support,,19,,,2024-02-19 11:24,2024-08-05 11:24
U000900,Ben,Lopez,ben.lopez@yahoo.com,US,LND,America/Los_Angeles,2023-06-22,Paid Search,Q3_PROMO,Linux,2.0.0,10-Jan,Support,1,38,,1,2023-06-22 12:30,
u002203,Ava,Wilson,ava.wilson@nexloom.io,MX,RJ,,2024-02-19 0:00,Webinar,BF2024,Android,2.0.1,1000+,Sales,0,63,,Y,2024-02-19 13:48,2024-07-01 13:48
U001030,Yuki,Allen,yuki.allen@company.com,USA,,Asia/Kolkata,2024-10-06 0:00,Outbound,SPRING24,iOS,2.0.0,11-50,Engineering,0,64,,TRUE,2024-10-06 5:30,2024-11-20 5:30
U002327,Leo,Robinson,leo.robinson@yahoo.com,CA,WA,Asia/Tokyo,2024-09-30 0:00,Webinar,AI-LAUNCH,macOS,2.1.0,11-50,Marketing,1,,,FALSE,2024-09-30 21:41,2025-02-12 21:41
U001340,Ethan,Young,ethan.young@gmail.com,JP,,UTC,2023-03-21 0:00,Content,N/A,Unknown,1.2.1,11-50,Ops,1,34,,yes,2023-03-21 13:18,2023-04-08 13:18
U000116,Omar,Patel,omar.patel@icloud.com,CA,-,UTC,11/17/2024,Social,GROWTHLAB,Unknown,1.0.9,1000+,Product,0,27,,FALSE,2024-11-17 2:43,2025-04-21
U001233,Sophia,Wilson,sophia.wilson@icloud.com,SG,BER,Asia/Tokyo,2023-10-19 0:00,Webinar,SPRING24,iOS,1.1.2,1000+,Engineering,0,61,,FALSE,2023-10-19 8:59,2024-04-04 8:59
U000597,Chen,Scott,chen.scott@icloud.com,CA,LND,America/Los_Angeles,2024-06-23,Webinar,SPRING24,Windows,1.1.2,51-200,Product,0,21,,no,2024-06-23 2:14,2024-10-17 2:14
U002024,Ben,Allen,ben.allen@yahoo.com,SE,ON,America/New_York,2023-05-03 0:00,Paid Search,WINTER25,iOS,2.1.0,51-200,Engineering,1,50,,yes,2023-05-03 7:45,2023-09-16 7:45
U001930,Priya,Lopez,priya.lopez@company.com,DE,CA,Europe/Berlin,2023-05-23 0:00,Organic Search,BF2024,Windows,1.0.9,51-200,Marketing,0,42,,TRUE,2023-05-23 16:44,2023-11-03 16:44
U001358,Omar,Brown,omar.brown@nexloom.io,ZA,BER,America/New_York,02/18/2024,Partner,AI-LAUNCH,iOS,1.1.2,501-1000,Ops,0,25,,FALSE,2024-02-18 16:44,2024-04-18 16:44
U000209,Anya,Nguyen,anya.nguyen@outlook.com,MX,,UTC,2023-01-15 0:00,Paid Search,GROWTHLAB,Unknown,v2.1.0,10-Jan,Finance,0,38,,1,2023-01-15 7:39,0000-00-00 00:00:00
U001033,Yuki,Scott,yuki.scott@gmail.com,CA,TX,UTC,2023-10-31 0:00,Webinar,SUMMER24,macOS,2.0.1,1000+,HR,0,33,,N,2023-10-31 9:18,2024-03-02 9:18
U001247,Anya,Garcia,anya.garcia@proton.me,SE,LND,Asia/Tokyo,2023-08-13 0:00,Organic Search,n/a,Unknown,v2.0.0,1000+,Ops,0,34,,Y,2023-08-13 11:06,2023-08-15 11:06
U000469,Sofia,King,sofia.king@gmail.com,SE,TX,,2023-10-27 0:00,Referral,n/a,Android,1.3.0,1000+,Product,0,25,USR-000476,FALSE,2023-10-27 18:57,2024-02-05 18:57
U000540,Priya,Nguyen,priya.nguyen@company.com,US,BER,,08/11/2023,Referral,N/A,Windows,2.0.1,1000+,Sales,0,64,U000210,no,2023-08-11 3:39,2023-11-10 3:39
U001540,Ava,Nguyen,ava.nguyen@yahoo.com,IN,WA,Asia/Kolkata,2024-04-10 0:00,Outbound,Q3_PROMO,macOS,1.1.0,10-Jan,HR,1,30,,Y,2024-04-10 23:54,2024-06-05 23:54
U000836,Lucas,Lee,lucas.lee@proton.me,IN,NSW,Asia/Tokyo,2024-02-17 0:00,Referral,SPRING24,iOS,1.3.0,201-500,Finance,0,25,,no,2024-02-17 2:42,2024-05-21 2:42
U001941,Amir,Nguyen,amir.nguyen@proton.me,SE,CA,America/New_York,2023-05-13 0:00,Organic Search,AI-LAUNCH,macOS,1.2.1,501-1000,Finance,0,57,,TRUE,2023-05-13 18:21,2023-07-25 18:21
U000240,Ravi,Lee,ravi.lee@yahoo.com,SE,TX,Asia/Tokyo,2023-09-22 0:00,Partner,AI-LAUNCH,Linux,1.1.0,201-500,Engineering,0,58,,0,2023-09-22 7:35,2023-12-27 7:35
U001578,Jin,Wright,jin.wright@icloud.com,MX,RJ,America/New_York,2024-06-09 0:00,Outbound,Q3_PROMO,Unknown,1.2.0,201-500,Finance,FALSE,26,,N,2024-06-09 15:17,2024-08-19 15:17
U000689,Hana,Wright,hana.wright@proton.me,NL,,,2024-08-23 0:00,Partner,N/A,iOS,1.3.0,51-200,Engineering,0,42,,no,2024-08-23 9:08,2024-12-30 9:08
U000242,Sara,King,sara.king@gmail.com,CA,ON,,2025-04-09 0:00,Partner,AI-LAUNCH,Windows,1.1.0,501-1000,Ops,0,45,,yes,2025-04-09 21:02,2025-05-27 21:02
U000264,Chen,Johnson,CHEN.JOHNSON@COMPANY.COM,MX,BC,,2024-04-07 0:00,Webinar,WINTER25,iOS,1.3.0,201-500,Founder,0,25,,,04/07/2024 22:30,2024-09-30 22:30
U001939,Fatima,Lewis,fatima.lewis@yahoo.com,SG,TX,Asia/Kolkata,2024-03-28 0:00,Outbound,N/A,Unknown,1.1.0,11-50,Engineering,0,60,,TRUE,2024-03-28 11:40,2024-09-19 11:40
U001962,Jin,Jackson,JIN.JACKSON@NEXLOOM.IO,SE,RJ,UTC,2024-02-12 0:00,Paid Search,SPRING24,Linux,1.0.9,10-Jan,Sales,0,41,,yes,2024-02-12 12:32,2024-07-19 12:32
u002251,Nora,Allen,nora.allen@company.com,MX,CA,America/New_York,2023-07-03 0:00,Social,WINTER25,Android,1.2.1,501-1000,Marketing,no,36,,no,07/03/2023 01:38,2023-08-19 1:38
U002232,Fatima,Moore,fatima.moore@proton.me,SE,,Asia/Tokyo,2023-04-25 0:00,Social,GROWTHLAB,macOS,1.1.2,51-200,Product,0,36,,,2023-04-25 21:19,2023-09-13 21:19
U001345,Chen,Allen,chen.allen@icloud.com,BR,unknown,America/New_York,2024-08-05 0:00,Content,BF2024,Unknown,2.1.0,51-200,Product,0,23,,FALSE,2024-08-05 3:27,2024-12-18 3:27
U000178,Amir,White,amir.white@yahoo.com,SE,NY,UTC,2024-01-31 0:00,Outbound,WINTER25,iOS,2.1.0,unknown,Founder,0,,,FALSE,2024-01-31 19:00,2024-07-17 19:00
U000937,Hana,Martinez,hana.martinez@nexloom.io,GB,,Asia/Kolkata,2025-02-30,Webinar,WINTER25,iOS,1.2.1,51-200,Sales,0,37,,TRUE,2023-02-20 13:19,2023-05-07 13:19
U000307,Olivia,Lopez,olivia.lopez@yahoo.com,FR,,Europe/London,06-04-2024,Webinar,BF2024,Unknown,1.1.2,1000+,Ops,0,38,,TRUE,04/06/2024 06:48,2024-09-30 6:48
U001013,Ivy,Martin,ivy.martin@outlook.com,FR,LND,,2025-03-13 0:00,Content,WINTER25,Unknown,1.3.0,201-500,Founder,0,56,,FALSE,2025-03-13 6:03,2025-07-15 6:03
U001226,Ava,White, ava.white@gmail.com ,NL,ON,Europe/London,06/07/2024,Webinar,RETARGET1,Unknown,1.1.0,unknown,Support,1,20,,FALSE,2024-06-07 19:14,2024-10-07 19:14
U000083,Ethan,Thompson,ethan.thompson@nexloom.io,ZA,MH,Europe/London,01/01/2024,Social,N/A,Windows,1.3.0,501-1000,Marketing,1,49,,yes,2024-01-01 20:32,2024-02-26
U001166,Sophia,Smith,sophia.smith@outlook.com,MX,SP,Europe/London,2024-09-27,Paid Search,RETARGET1,macOS,1.1.2,51-200,Founder,0,23,,TRUE,09/27/2024 13:00,2024-12-24 13:00
U002207,Fatima,Johnson,fatima.johnson@icloud.com,NL,SP,Europe/Berlin,2023-12-02 0:00,Social,N/A,Linux,1.0.9,11-50,Finance,0,35,,FALSE,2023-12-02 14:18,2024-02-15 14:18
U000086,Sara,Walker,sara.walker@icloud.com,US,CA,UTC,2023-12-29 0:00,Organic Search,n/a,macOS,1.1.0,10-Jan,HR,0,63,,N,2023-12-29 6:29,2024-04-11 6:29
U001728,Ivy,Taylor,ivy.taylor@icloud.com,AU,unknown,UTC,2025-11-05 0:00,Paid Search,WINTER25,Android,2.0.1,unknown,Sales,0,41,,FALSE,2025-11-05 16:01,2026-04-14 16:01
U000154,Elena,Martinez,elena.martinez@company.com,US,ON,,2024-03-23 0:00,Referral,WINTER25,Unknown,1.2.0,10-Jan,HR,0,27,U000410,,2024-03-23 11:46,2024-04-05 11:46
U001179,Ethan,Perez,ethan.perez@gmail.com,DE,MH,,2024-08-17 0:00,Social,WINTER25,Android,2.1.0,10-Jan,Engineering,0,,,,2024-08-17 7:48,2024-11-13 7:48
U001430,Mia,Thomas,mia.thomas@icloud.com,CA,,,2024-11-13 0:00,Partner,BF2024,Linux,2.1.0,501-1000,Product,0,22,,FALSE,2024-11-13 20:34,2025-05-02 20:34
U001934,Elena,Wilson, elena.wilson@icloud.com ,NL,NSW,Asia/Kolkata,2024-05-20 0:00,Paid Search,SUMMER24,macOS,1.3.0,11-50,Finance,1,27,,,2024-05-20 16:45,2024-11-04 16:45
U002174,Elena,Johnson,elena.johnson@icloud.com,DE,NSW,Europe/Berlin,2024-10-31 0:00,Partner,BF2024,macOS,1.2.1,1000+,Support,0,55,,TRUE,2024-10-31 14:20,2025-01-14 14:20
U000523,Omar,Anderson,omar.anderson@icloud.com,ZA,-,,2025-06-04 0:00,Paid Search,GROWTHLAB,macOS,1.2.1,201-500,Product,0,50,,Y,2025-06-04 12:46,2025-11-08 12:46
U001442,Ben,Robinson,ben.robinson@yahoo.com,SE,LND,America/New_York,07/03/2023,Social,AI-LAUNCH,macOS,1.1.2,11-50,Ops,0,23,,no,2023-07-03 9:29,12-03-2023 09:29
U001750,Mia,White,mia.white@outlook.com,IN,CA,Europe/London,2023-08-18 0:00,Partner,RETARGET1,Windows,1.2.1,unknown,Ops,0,32,,Y,2023-08-18 6:53,2023-09-17 6:53
U001406,Fatima,Anderson,fatima.anderson@outlook.com,BR,,,2024-03-16 0:00,Content,SPRING24,macOS,1.3.0,10-Jan,Sales,0,57,,Y,2024-03-16 16:54,2024-08-08 16:54
U000824,Lucas,Smith,lucas.smith@nexloom.io,DE,TX,Asia/Tokyo,2024-02-06 0:00,Partner,WINTER25,Android,1.0.9,10-Jan,Finance,0,53,,Y,2024-02-06 18:00,2024-05-16 18:00
U000071,Mia,Wilson,mia.wilson@outlook.com,AU,RJ,Europe/London,07/27/2023,Outbound,N/A,Unknown,1.2.1,1000+,Ops,0,27,,TRUE,2023-07-27 7:46,2024-01-02 7:46
U000620,Liam,Garcia,liam.garcia@proton.me,BR,,Europe/Berlin,2024-08-09 0:00,Referral,SUMMER24,Linux,1.0.9,11-50,Product,0,33,,no,2024-08-09 8:57,2024-11-22 8:57
U001008,Fatima,Martinez,fatima.martinez@proton.me,DE,SP,UTC,10/25/2024,Content,BF2024,Unknown,1.0.9,51-200,Engineering,1,24,,yes,2024-10-25 3:43,2024-12-15 3:43
U000711,Omar,Nguyen,omar.nguyen@company.com,JP,ON,Asia/Kolkata,2024-08-17 0:00,Social,BF2024,Linux,1.1.0,201-500,Product,0,37,,0,2024-08-17 13:09,2024-09-05 13:09
U001818,Mateo,Johnson,mateo.johnson@gmail.com,ZA,ON,Asia/Tokyo,2024-08-23 0:00,Social,GROWTHLAB,Linux,1.1.2,201-500,Founder,0,64,,Y,2024-08-23 16:46,2025-02-09 16:46
U000739,Emma,Moore,emma.moore@company.com,SE,CA,Asia/Tokyo,2024-02-27 0:00,Social,WINTER25,Android,2.0.0,unknown,HR,0,48,,0,2024-02-27 10:26,2024-04-23 10:26
U001502,Ivy,Allen,ivy.allen@nexloom.io,BR,BER,,2024-03-18 0:00,Outbound,Q3_PROMO,Windows,1.3.0,1000+,Support,0,46,,yes,2024-03-18 19:59,2024-04-12 19:59
U002402,Elena,Anderson,elena.anderson@company.com,JP,CA,America/New_York,2023-06-03 0:00,Paid Search,RETARGET1,Unknown,1.1.0,1000+,Engineering,0,18,,0,2023-06-03 10:10,2023-08-11 10:10
U001054,Diego,Thompson,diego.thompson@yahoo.com,FR,,,2024-09-12 0:00,Webinar,SPRING24,macOS,1.2.0,1000+,Engineering,1,26,,Y,2024-09-12 18:36,2025-01-27 18:36
U001460,Sara,Brown,sara.brown@icloud.com,DE,-,Europe/London,2024-06-18 0:00,Partner,Q3_PROMO,Unknown,2.1.0,10-Jan,Marketing,0,unknown,,1,2024-06-18 2:34,2024-10-28 2:34
U000967,Anya,Johnson,anya.johnson@yahoo.com,SG,BER,Asia/Kolkata,2024-07-22 0:00,Referral,SUMMER24,macOS,1.2.0,51-200,Ops,1,49,,,2024-07-22 23:16,2024-09-29 23:16
U000524,Mia,Taylor,mia.taylor@proton.me,JP,ON,America/Los_Angeles,2024-10-18 0:00,Outbound,Q3_PROMO,Android,2.0.1,11-50,Marketing,0,54,,,2024-10-18 0:56,2025-04-03 0:56
U000907,Emma,Perez,emma.perez@proton.me,US,unknown,America/Los_Angeles,2024-09-27 0:00,Partner,SUMMER24,Linux,v1.1.0,unknown,Product,0,59,,TRUE,2024-09-27 0:49,2024-12-24 0:49
U002546,Noah,Harris,noah.harris@outlook.com,ZA,NSW,America/Los_Angeles,2024-03-22,Organic Search,Q3_PROMO,iOS,1.0.9,11-50,Sales,0,61,,yes,2024-03-22 22:53,2024-05-02 22:53
U001723,Fatima,Johnson,fatima.johnson@yahoo.com,MX,SP,Europe/London,2023-12-16 0:00,Outbound,AI-LAUNCH,macOS,2.1.0,11-50,Founder,0,18,,0,2023-12-16 9:38,2024-03-22 9:38
U000286,Leo,Clark,leo.clark@company.com,MX,BC,,2023-04-02 0:00,Paid Search,AI-LAUNCH,macOS,1.0.9,201-500,Founder,0,39,,yes,2023-04-02 19:04,2023-05-07 19:04
U000779,Emma,Allen,emma.allen@yahoo.com,ZA,LND,America/New_York,2024-07-23 0:00,Referral,RETARGET1,Linux,1.2.0,51-200,Engineering,0,23,U000497,no,2024-07-23 0:19,2024-10-18 0:19
U000376,Amir,THOMAS,amir.thomas@proton.me,ZA,,Europe/London,2023-12-25 0:00,Outbound,SPRING24,macOS,v1.3.0,1000+,Finance,0,47,,yes,2023-12-25 2:39,05-30-2024 02:39
U000842,Sophia,Smith,sophia.smith@outlook.com,BR,NSW,America/New_York,2024-06-21 0:00,Organic Search,N/A,Unknown,1.1.0,unknown,Ops,0,61,,TRUE,2024-06-21 13:41,2024-08-25 13:41
U000299,Yuki,Wright,yuki.wright@gmail.com,US,WA,America/New_York,2024-05-30 0:00,Social,BF2024,Linux,2.0.0,501-1000,Marketing,0,36,,yes,2024-05-30 22:49,2024-06-28 22:49
U000827,Chen,Clark,chen.clark@company.com,JP,WA,Asia/Kolkata,2024-01-09 0:00,Paid Search,N/A,Unknown,1.2.0,201-500,Marketing,0,46,,no,2024-01-09 21:18,2024-04-06 21:18
U001273,Ethan,Smith, ethan.smith@company.com ,FR,-,Asia/Kolkata,2024-08-30 0:00,Content,,Windows,1.2.1,11-50,Finance,0,40,,FALSE,2024-08-30 19:36,2024-11-23 19:36
U000306,Elena,Martin,elena.martin@yahoo.com,BR,unknown,America/New_York,2025-07-01 0:00,Organic Search,AI-LAUNCH,macOS,1.0.9,1000+,Engineering,1,30,,TRUE,2025-07-01 18:40,2025-10-16 18:40
U001044,Ivy,Allen,ivy.allen@icloud.com,SG,NY,Asia/Kolkata,2024-06-01 0:00,Webinar,RETARGET1,Unknown,1.1.2,1000+,Engineering,0,60,,TRUE,2024-06-01 13:27,2024-06-05 13:27
U000044,Ben,Perez,ben.perez@gmail.com,JP,SP,Asia/Tokyo,2025-01-04 0:00,Webinar,BF2024,Windows,2.0.1,1000+,Ops,0,61,,FALSE,2025-01-04 23:54,2025-06-16 23:54
U002170,Yuki,Young,yuki.young@company.com,GB,CA,Europe/Berlin,2023-12-29 0:00,Content,SUMMER24,iOS,2.1.0,501-1000,Sales,0,63,,Y,2023-12-29 21:21,2024-03-22 21:21
U000058,Nora,Robinson,nora.robinson@outlook.com,IN,MH,Europe/London,2025-05-10 0:00,Partner,WINTER25,macOS,1.3.0,501-1000,Founder,1,18,,FALSE,2025-05-10 3:05,07-04-2025 03:05
U001570,Omar,Smith,omar.smith@nexloom.io,US,NSW,UTC,2024-03-04 0:00,Outbound,WINTER25,Unknown,1.1.2,51-200,Engineering,FALSE,29,,0,2024-03-04 14:50,2024-04-02 14:50
U001068,Liam,Scott,liam.scott@icloud.com,AU,BC,Asia/Kolkata,2023-07-22 0:00,Paid Search,BF2024,Android,1.2.0,201-500,Support,0,26,,0,2023-07-22 7:32,2023-09-20 7:32
U001650,Zoe,Smith,zoe.smith@yahoo.com,AU,CA,Europe/Berlin,2024-07-16 0:00,Partner,N/A,macOS,1.3.0,501-1000,Support,0,46,,FALSE,2024-07-16 22:18,2024-09-08 22:18
U001580,Zoe,Taylor,zoe.taylor@proton.me,US,-,Europe/Berlin,2024-04-21 0:00,Referral,GROWTHLAB,Windows,1.2.0,11-50,Support,0,35,,0,2024-04-21 3:35,2024-07-13 3:35
U000591,Omar,Moore,omar.moore@gmail.com,NL,RJ,UTC,2023-08-20 0:00,Outbound,RETARGET1,Windows,2.0.0,10-Jan,Founder,0,59,,1,2023-08-20 13:47,2024-01-08 13:47
U002503,Emma,Martinez,emma.martinez@icloud.com,IN,MH,,2024-05-05 0:00,Referral,RETARGET1,Windows,1.1.2,1000+,HR,0,63,U000297,FALSE,2024-05-05 2:24,2024-10-22 2:24
U001957,Chen,Smith,chen.smith@yahoo.com,ZA,,Asia/Tokyo,2024-06-09 0:00,Outbound,RETARGET1,Android,1.0.9,10-Jan,HR,0,57,,TRUE,06/09/2024 02:24,2024-07-03 2:24
U001624,Elena,Scott,elena.scott@yahoo.com,ZA,NY,,2025-04-20 0:00,Outbound,AI-LAUNCH,macOS,1.1.0,1000+,Founder,1,32,,FALSE,2025-04-20 6:07,2025-09-02 6:07
U000657,Anya,Patel,anya.patel@gmail.com,AU,NSW,America/New_York,2023-12-04 0:00,Referral,NA,Android,1.3.0,51-200,Support,0,18,,TRUE,2023-12-04 3:28,2024-06-01 3:28
U001251,Sara,Brown,sara.brown@gmail.com,JP,WA,America/New_York,2024-09-11,Organic Search,Q3_PROMO,Android,1.0.9,501-1000,Finance,0,unknown,,TRUE,2024-09-11 0:55,2025-02-03 0:55
U002340,Yuki,Moore,yuki.moore@nexloom.io,JP,ON,,02/17/2024,Content,GROWTHLAB,Android,2.1.0,1000+,Founder,0,54,,FALSE,2024-02-17 3:39,2024-06-20 3:39
U000699,Sofia,Wilson,sofia.wilson@nexloom.io,US,BER,,2023-09-03 0:00,Partner,BF2024,Windows,1.1.0,11-50,Marketing,0,24,,N,2023-09-03 6:43,2024-02-25 6:43
U000034,Zoe,Perez,zoe.perez@icloud.com,FR,,America/Los_Angeles,2025-03-25 0:00,Paid Search,,iOS,2.0.0,1000+,Finance,0,25,,0,2025-03-25 14:54,2025-04-21 14:54
U000686,Yuki,Martin,yuki.martin@proton.me,ZA,unknown,America/New_York,2024-04-26 0:00,Partner,GROWTHLAB,Unknown,2.1.0,10-Jan,Engineering,TRUE,25,,,2024-04-26 20:08,2024-07-25 20:08
U000001,Elena,King,elena.king@gmail.com,DE,unknown,,2024-01-25 0:00,Social,AI-LAUNCH,Windows,1.3.0,501-1000,Support,0,64,,FALSE,2024-01-25 12:20,2024-06-20 12:20
U001160,Ivy,Wright,ivy.wright@nexloom.io,BR,unknown,Asia/Tokyo,03/18/2023,Paid Search,N/A,macOS,1.1.2,unknown,Sales,0,44,,TRUE,2023-03-18 4:37,2023-08-27 4:37
U001490,Fatima,Martin,fatima.martin@company.com,GB,TX,Asia/Kolkata,2024-03-03 0:00,Organic Search,n/a,Unknown,1.2.0,unknown,Engineering,0,54,,1,2024-03-03 13:15,2024-07-29 13:15
U002570,Mateo,Moore,mateo.moore@yahoo.com,SE,BC,America/Los_Angeles,2025-02-08,Paid Search,SPRING24,macOS,1.1.0,201-500,HR,0,43,,yes,2025-02-08 17:54,2025-05-18 17:54
USR-002274,Diego,Lee,diego.lee@gmail.com,SG,WA,,2024-06-15 0:00,Paid Search,SUMMER24,Android,2.0.0,1000+,HR,0,39,,1,2024-06-15 21:02,2024-06-20
U001215,Olivia,Patel,olivia.patel@nexloom.io,JP,,Europe/London,2024-07-07,Referral,n/a,Unknown,1.2.1,1000+,Marketing,0,24,U000013,no,2024-07-07 9:02,2024-11-18 9:02
U001764,Nora,Patel,nora.patel@company.com,DE,NSW,Asia/Kolkata,2024-03-23 0:00,Referral,SUMMER24,macOS,1.3.0,10-Jan,Sales,1,30,U000494,FALSE,2024-03-23 5:26,2024-07-19 5:26
U000023,Sophia,Scott,sophia.scott@yahoo.com,DE,-,Asia/Tokyo,2023-12-09 0:00,Social,GROWTHLAB,Windows,1.2.1,unknown,Ops,1,46,,0,2023-12-09 23:48,2024-02-08 23:48
U000244,leo,Anderson,LEO.ANDERSON@COMPANY.COM,U.K.,NSW,Europe/Berlin,2024-01-22 0:00,Webinar,BF2024,Linux,1.1.2,201-500,Product,1,unknown,,yes,2024-01-22 3:42,2024-05-13 3:42
U002315,Fatima,Garcia,fatima.garcia@yahoo.com,SG,NY,Asia/Tokyo,2025-10-08 0:00,Content,AI-LAUNCH,Windows,1.2.0,51-200,Support,1,36,,1,2025-10-08 12:16,2026-02-26 12:16
U000886,Jin,Taylor,JIN.TAYLOR@COMPANY.COM,BR,ON,Asia/Tokyo,2023-09-23 0:00,Social,RETARGET1,Windows,1.1.2,11-50,Marketing,0,25,,FALSE,2023-09-23 2:40,2024-03-11 2:40
U002529,Sophia,Clark,sophia.clark@outlook.com,SE,WA,Europe/London,2023-01-26 0:00,Paid Search,GROWTHLAB,macOS,2.0.0,11-50,Marketing,1,25,,TRUE,2023-01-26 16:07,2023-07-12 16:07
U000945,Hana,Lee,hana.lee@icloud.com,UK,,Europe/London,2023-10-15 0:00,Organic Search,n/a,Android,1.1.2,201-500,Finance,0,61,,yes,2023-10-15 23:32,2023-11-18
U001073,Elena,Brown,elena.brown@proton.me,GB,RJ,Asia/Tokyo,2023-04-14 0:00,Organic Search,n/a,Android,1.1.2,11-50,Founder,0,25,,FALSE,2023-04-14 21:27,2023-07-15 21:27
U002071,Elena,Thompson,elena.thompson@yahoo.com,MX,BC,America/Los_Angeles,2024-08-14 0:00,Content,RETARGET1,Linux,1.2.1,51-200,Marketing,1,40,,TRUE,2024-08-14 13:40,2024-11-16 13:40
U001420,Leo,Taylor,leo.taylor@proton.me,US,unknown,Asia/Kolkata,02/18/2025,Referral,Q3_PROMO,Android,1.3.0,unknown,Founder,0,39,U000131,FALSE,2025-02-18 0:47,2025-05-26 0:47
U002512,Lucas,White,lucas.white@company.com,SE,NY,Asia/Kolkata,2024-11-30 0:00,Outbound,WINTER25,macOS,2.0.1,10-Jan,Sales,0,40,,no,2024-11-30 18:15,2025-04-01 18:15
U001357,Sara,Martinez,SARA.MARTINEZ@OUTLOOK.COM,JP,,UTC,2024-12-23 0:00,Webinar,WINTER25,iOS,1.3.0,1000+,Product,0,46,,TRUE,2024-12-23 11:33,
U001492,Ravi,Young,ravi.young@yahoo.com,IN,NY,America/New_York,2024-01-24 0:00,Outbound,Q3_PROMO,Unknown,1.1.0,10-Jan,Ops,1,22,,TRUE,2024-01-24 1:38,2024-04-17 1:38
U000854,Ben,Walker,ben.walker@icloud.com,ca,LND,Europe/Berlin,2024-12-19 0:00,Webinar,BF2024,Android,2.0.0,unknown,Support,0,49,,no,2024-12-19 11:06,2025-01-21 11:06
U001978,Leo,Robinson,leo.robinson@company.com,CA,SP,Europe/London,2024-02-22 0:00,Paid Search,AI-LAUNCH,Linux,1.0.9,unknown,HR,0,58,,FALSE,2024-02-22 12:26,2024-07-18 12:26
U002518,Ben,Perez,ben.perez@proton.me,ZA,,,17-03-2024,Referral,n/a,Windows,v2.1.0,501-1000,Ops,0,40,U000314,,2024-03-17 23:01,2024-04-30 23:01
U001747,Lucas,Thomas,lucas.thomas@proton.me,BR,ON,Asia/Tokyo,2023-02-22 0:00,Paid Search,WINTER25,Windows,1.3.0,51-200,Ops,0,32,,yes,2023-02-22 2:26,2023-08-14 2:26
U000983,Olivia,Young,olivia.young@nexloom.io,NL,BC,Asia/Tokyo,2023-07-18 0:00,Paid Search,SUMMER24,iOS,2.0.1,501-1000,Product,0,24,,TRUE,2023-07-18 1:47,2023-09-03 1:47
U002029,Mia,Nguyen,mia.nguyen@nexloom.io,MX,TX,Europe/London,2023-11-18 0:00,Referral,n/a,Android,1.0.9,51-200,Sales,yes,29,U000164,0,2023-11-18 23:45,2024-01-27 23:45
U002040,Sophia,Smith,sophia.smith@yahoo.com,CA,RJ,Asia/Kolkata,2023-11-14 0:00,Partner,AI-LAUNCH,iOS,1.2.0,1000+,Founder,0,unknown,,no,2023-11-14 20:36,2023-12-10 20:36
U002210,Amir,Smith,amir.smith@outlook.com,IN,WA,Asia/Kolkata,2025-01-07 0:00,Partner,SUMMER24,Android,2.1.0,10-Jan,Marketing,0,44,,0,2025-01-07 11:42,2025-03-29 11:42
U001399,Olivia,Young,olivia.young@proton.me,ZA,BER,Asia/Tokyo,2024-05-27 0:00,Paid Search,RETARGET1,macOS,2.0.0,51-200,Product,0,47,,FALSE,2024-05-27 8:52,2024-10-24 8:52
U001895,Ivy,Perez,ivy.perez@yahoo.com,SE,ON,America/New_York,2024-04-25,Partner,GROWTHLAB,Linux,2.0.1,201-500,Sales,0,59,,no,2024-04-25 20:56,2024-10-15 20:56
U001089,Elena,Walker,ELENA.WALKER@YAHOO.COM,SG,-,Europe/Berlin,2025-09-27 0:00,Outbound,RETARGET1,Android,v1.2.0,1000+,Sales,0,59,,,2025-09-27 5:19,2025-12-28 5:19
U000929,Nora,Moore,nora.moore@yahoo.com,BR,WA,Asia/Tokyo,2024-06-05 0:00,Organic Search,GROWTHLAB,Android,2.0.0,1000+,Product,1,58,,yes,2024-06-05 18:24,2024-11-15 18:24
U000860,Nora,Perez,nora.perez@company.com,US,SP,,2023-05-25 0:00,Referral,SUMMER24,Unknown,1.0.9,201-500,HR,0,45,U000036,N,2023-05-25 18:30,2023-06-14 18:30
U001694,Ava,Walker,ava.walker@yahoo.com,GB,SP,America/Los_Angeles,2023-08-27 0:00,Content,WINTER25,Linux,1.3.0,501-1000,Finance,0,23,,TRUE,2023-08-27 9:56,2024-02-19 9:56
U001228,Ava,Lopez,ava.lopez@nexloom.io,FR,,America/New_York,2023-11-29 0:00,Partner,WINTER25,Linux,1.3.0,unknown,Engineering,0,55,,FALSE,2023-11-29 19:14,2024-02-08 19:14
U001849,Omar,Martinez,omar.martinez@gmail.com,AU,-,America/Los_Angeles,2024-12-05 0:00,Social,Q3_PROMO,Windows,1.0.9,501-1000,Marketing,0,41,,no,2024-12-05 0:04,2025-01-26 0:04
U001707,Fatima,Robinson,fatima.robinson@yahoo.com,AU,ON,America/Los_Angeles,2024-06-08 0:00,Organic Search,SPRING24,Linux,1.3.0,501-1000,Founder,0,44,,0,2024-06-08 13:23,2024-10-16 13:23
U000997,Chen,Wright,chen.wright@company.com,NL,LND,Asia/Tokyo,2025-01-17 0:00,Paid Search,N/A,iOS,1.3.0,201-500,Engineering,0,32,,,2025-01-17 5:04,2025-04-22 5:04
U000145,Fatima,Jackson,fatima.jackson@nexloom.io,MX,NSW,America/Los_Angeles,2023-12-05 0:00,Social,GROWTHLAB,macOS,1.3.0,unknown,HR,0,27,,0,2023-12-05 20:18,2024-01-03 20:18
U002563,Fatima,Thomas,fatima.thomas@proton.me,DE,,America/New_York,2023-04-29 0:00,Content,GROWTHLAB,iOS,2.0.1,201-500,HR,0,28,,1,2023-04-29 13:07,2023-09-27 13:07
U001249,Yuki,Jackson,yuki.jackson@icloud.com,NL,LND,Asia/Kolkata,2025-01-23 0:00,Webinar,RETARGET1,iOS,1.2.1,unknown,HR,0,58,,0,2025-01-23 18:10,2025-05-13 18:10
U001522,Mia,Brown,mia.brown@icloud.com,AU,WA,Europe/London,2025-02-19 0:00,Outbound,RETARGET1,Unknown,1.1.2,11-50,Founder,0,19,,0,2025-02-19 2:22,2025-07-07 2:22
U002355,Hana,Clark,hana.clark@company.com,JP,WA,Europe/Berlin,2024-07-25 0:00,Content,Q3_PROMO,Android,1.2.1,1000+,Engineering,0,29,,Y,2024-07-25 22:44,2024-12-26 22:44
U002218,Fatima,Clark,FATIMA.CLARK@YAHOO.COM,IN,BER,,2023-12-03,Organic Search,n/a,Unknown,1.1.2,501-1000,Marketing,FALSE,50,,0,2023-12-03 21:57,2024-05-11 21:57
U001684,Ravi,Lewis,ravi.lewis@icloud.com,BR,RJ,Asia/Tokyo,2024-10-01 0:00,Partner,N/A,Android,1.2.0,unknown,Support,0,24,,TRUE,2024-10-01 10:01,2025-02-19 10:01
U000355,Jin,Moore,jin.moore@icloud.com,SG,CA,America/Los_Angeles,2023-06-01,Organic Search,WINTER25,Unknown,1.3.0,11-50,Ops,1,54,,,2023-06-01 11:17,2023-07-16 11:17
U002483,Ava,LEWIS,ava.lewis@gmail.com,DE,LND,Europe/London,2025-03-13 0:00,Outbound,GROWTHLAB,Android,1.2.1,51-200,Founder,0,30,,TRUE,2025-03-13 1:54,2025-03-20 1:54
U000414,Hana,Lee,hana.lee@company.com,SE,-,,2024-05-05,Organic Search,n/a,macOS,2.1.0,501-1000,Founder,1,58,,TRUE,2024-05-05 18:54,08-20-2024 18:54
U000963,Ivy,Harris,ivy.harris@proton.me,FR,MH,UTC,2023-11-10 0:00,Referral,GROWTHLAB,Unknown,1.0.9,1000+,Sales,1,29,U000141,0,2023-11-10 2:13,2024-02-03 2:13
U000231,Fatima,Young,fatima.younggmail.com,ZA,LND,America/Los_Angeles,10-09-2024,Organic Search,n/a,macOS,1.3.0,1000+,Ops,0,60,,N,2024-09-10 1:33,2024-12-02 1:33
U001525,Amir,Clark,amir.clark@nexloom.io,-,,,22-03-2024,Social,GROWTHLAB,iOS,v2.0.0,201-500,Marketing,1,57,,N,2024-03-22 2:44,07-04-2024 02:44
U000241,Amir,Perez,amir.perez@company.com,SE,,Asia/Kolkata,2025-03-04 0:00,Content,WINTER25,iOS,1.0.9,1000+,Marketing,1,27,,TRUE,2025-03-04 14:16,2025-08-31 14:16
U002448,Chen,Martinez,chen.martinez@proton.me,NL,,Asia/Tokyo,2023-10-06 0:00,Social,SPRING24,Unknown,2.1.0,51-200,Sales,1,45,,no,2023-10-06 0:02,2024-03-08 0:02
U001651,Lucas,Lewis,lucas.lewis@company.com,ZA,RJ,,2023-04-02 0:00,Webinar,BF2024,macOS,1.0.9,51-200,Support,0,43,,no,2023-04-02 12:03,2023-06-26 12:03
U002254,Emma,Thomas,emma.thomas@outlook.com,GB,SP,Asia/Kolkata,2024-10-07 0:00,Organic Search,Q3_PROMO,Android,v2.0.1,201-500,Support,1,35,,yes,2024-10-07 15:29,2025-02-22 15:29
U001006,Kofi,Martinez,kofi.martinez@yahoo.com,br,-,America/Los_Angeles,2024-06-18 0:00,Paid Search,N/A,iOS,2.0.1,unknown,Sales,0,49,,0,2024-06-18 20:22,2024-06-19 20:22
U000291,Zoe,Martin, zoe.martin@gmail.com ,AU,LND,America/Los_Angeles,2023-03-21 0:00,Paid Search,RETARGET1,iOS,1.0.9,unknown,HR,0,,,0,2023-03-21 1:56,2023-04-17 1:56
U000002,Mia,Thomas,mia.thomas@company.com,SG,SP,UTC,03/30/2025,Partner,Q3_PROMO,iOS,2.1.0,51-200,Product,1,20,,1,2025-03-30 19:21,2025-06-18 19:21
U001985,Elena,Wright,ELENA.WRIGHT@GMAIL.COM,GB,,,2023-08-15 0:00,Referral,WINTER25,macOS,1.2.0,10-Jan,Finance,1,56,U000064,FALSE,2023-08-15 4:24,2024-01-28 4:24
U000329,Lucas,Perez,lucas.perez@company.com,CA,TX,Europe/Berlin,2024-02-17 0:00,Outbound,SPRING24,macOS,2.0.1,501-1000,Product,0,N/A,,yes,2024-02-17 16:37,2024-05-03 16:37
U002572,Anya,Johnson,anya.johnson@company.com,ZA,,America/Los_Angeles,2024-12-31 0:00,Organic Search,AI-LAUNCH,iOS,1.2.1,unknown,Sales,0,23,,yes,2024-12-31 0:47,2025-01-16 0:47
U000927,Ava,Martinez,ava.martinez@outlook.com,NL,MH,America/New_York,2023-11-25 0:00,Organic Search,SPRING24,Windows,1.0.9,201-500,Product,0,18,,FALSE,2023-11-25 4:32,2023-12-07 4:32
U002452,Lucas,Patel,lucas.patel@gmail.com,AU,LND,America/New_York,2025-02-30,Organic Search,N/A,Android,1.0.9,201-500,Founder,0,52,,TRUE,2025-05-21 5:57,2025-10-18 5:57
USR-001561,Yuki,Garcia,YUKI.GARCIA@YAHOO.COM,br,TX,America/New_York,2024-01-13 0:00,Webinar,RETARGET1,Unknown,2.1.0,10-Jan,Ops,0,56,,FALSE,2024-01-13 10:39,2024-06-20 10:39
U000262,Elena,Thomas,elena.thomas@nexloom.io,za,unknown,UTC,2025-09-19 0:00,Content,RETARGET1,macOS,1.1.0,51-200,Finance,0,37,,no,2025-09-19 14:37,2025-12-15 14:37
U000389,Zoe,Johnson,zoe.johnson@gmail.com,BR,,UTC,2024-08-10 0:00,Outbound,GROWTHLAB,macOS,1.2.1,201-500,Ops,0,48,,0,2024-08-10 2:23,2024-10-20 2:23
U002193,Sophia,Garcia,sophia.garcia@yahoo.com,DE,LND,UTC,2024-06-25 0:00,Paid Search,SUMMER24,iOS,1.0.9,11-50,Ops,1,22,,,2024-06-25 19:11,2024-08-05 19:11
U002489,Lucas,Young,lucas.young@nexloom.io,SG,,,2024-05-12 0:00,Partner,Q3_PROMO,Linux,2.1.0,51-200,Finance,0,48,,TRUE,2024-05-12 14:25,2024-09-18 14:25
U000843,Anya,Walker,anya.walker@company.com,ZA,NY,,2023-09-23 0:00,Social,Q3_PROMO,Unknown,2.0.1,501-1000,Ops,0,18,,no,2023-09-23 3:14,2023-11-02 3:14
U000641,Olivia,Brown, olivia.brown@yahoo.com ,BR,RJ,America/New_York,2023-02-25 0:00,Organic Search,RETARGET1,Unknown,1.1.0,201-500,Support,1,27,,FALSE,2023-02-25 10:48,
U002235,Chen,White,chen.white@yahoo.com,US,NY,UTC,2024-06-23 0:00,Webinar,Q3_PROMO,Linux,2.1.0,1000+,HR,0,54,,,2024-06-23 7:37,2024-07-01 7:37
U000109,Diego,Taylor,diego.taylor@company.com,IN,WA,Europe/Berlin,01/30/2024,Referral,RETARGET1,Unknown,1.1.2,10-Jan,Founder,no,45,U000473,0,2024-01-30 2:13,02-14-2024 02:13
U002404,Chen,Nguyen,chen.nguyen@outlook.com,US,MH,Asia/Tokyo,2023-12-21 0:00,Outbound,RETARGET1,iOS,2.0.0,11-50,Marketing,0,51,,Y,2023-12-21 12:46,2024-05-04 12:46
u002294,Olivia,King,olivia.king@icloud.com,DE,unknown,America/Los_Angeles,2024-04-06 0:00,Webinar,Q3_PROMO,macOS,2.0.1,501-1000,Founder,1,58,,1,2024-04-06 16:16,2024-05-14 16:16
U000435,Priya,Young,priya.young@gmail.com,BR,BER,America/New_York,2023-06-20 0:00,Referral,AI-LAUNCH,Android,2.1.0,11-50,Sales,1,47,U000135,TRUE,2023-06-20 13:41,2023-07-17 13:41
U002231,Zoe,Wilson,zoe.wilson@company.com,JP,NY,,2024-08-06 0:00,Content,AI-LAUNCH,Unknown,2.1.0,1000+,Engineering,0,64,,no,2024-08-06 6:52,2025-01-13
 U002043 ,Yuki,Jackson,yuki.jackson@proton.me,US,NY,America/New_York,09-04-2024,Webinar,RETARGET1,Windows,1.3.0,10-Jan,Founder,0,18,,no,2024-04-09 2:07,2024-05-09 2:07
U002107,Liam,Thomas,liam.thomas@proton.me,CA,WA,Europe/London,2024-11-02 0:00,Paid Search,GROWTHLAB,Android,1.0.9,501-1000,Founder,0,63,,no,2024-11-02 1:06,2024-11-29 1:06
U000444,Fatima,Thompson,FATIMA.THOMPSON@OUTLOOK.COM,AU,LND,UTC,2024-01-22 0:00,Outbound,WINTER25,iOS,1.2.0,1000+,Marketing,0,57,,yes,2024-01-22 10:49,2024-02-02
U002409,Anya,Taylor,anya.taylor@gmail.com,DE,TX,Asia/Kolkata,2025-09-06 0:00,Organic Search,BF2024,Linux,2.0.0,201-500,Ops,0,21,,TRUE,2025-09-06 7:58,2025-09-08 7:58
U000960,Kofi,Thompson,kofi.thompson@icloud.com,NL,BC,,2024-08-03 0:00,Organic Search,n/a,macOS,v1.2.1,11-50,Sales,0,45,,Y,2024-08-03 9:49,2024-11-25 9:49
U002098,Kofi,Thompson,kofi.thompson@gmail.com,CA,,UTC,2024-06-05 0:00,Partner,GROWTHLAB,Linux,1.1.0,1000+,Finance,1,43,,FALSE,2024-06-05 23:52,2024-06-05 23:52
U001337,Chen,Moore,chen.moore@yahoo.com,CA,LND,America/New_York,2023-10-10 0:00,Referral,WINTER25,iOS,1.3.0,501-1000,Engineering,0,27,U000020,FALSE,2023-10-10 13:50,2024-01-09 13:50
U001511,Kofi,Martinez,kofi.martinez@company.com,GB,SP,,09/23/2024,Paid Search,RETARGET1,Linux,2.0.1,unknown,Support,1,29,,FALSE,2024-09-23 17:34,2024-12-25 17:34
U000396,Leo,Garcia,leo.garcia@proton.me,SG,-,America/New_York,2025-02-11,Paid Search,N/A,Android,2.0.0,51-200,HR,0,20,,0,2025-02-11 19:10,2025-04-21 19:10
U002178,Lucas,Scott,lucas.scott@gmail.com,GB,TX,Asia/Kolkata,2024-06-10,Partner,Q3_PROMO,iOS,1.2.1,1000+,Finance,0,31,,,2024-06-10 2:40,2024-07-04 2:40
U002263,Omar,Jackson,omar.jackson@proton.me,ZA,SP,America/Los_Angeles,2024-12-12 0:00,Organic Search,n/a,Linux,2.0.0,1000+,Ops,0,44,,0,2024-12-12 14:58,2025-02-14 14:58
U002323,Mateo,Perez,mateo.perez@proton.me,mx,SP,America/Los_Angeles,2024-05-22 0:00,Partner,GROWTHLAB,Unknown,1.1.0,501-1000,Finance,0,48,,1,2024-05-22 16:58,2024-07-07 16:58
U001037,Sophia,Martinez,sophia.martinez@nexloom.io,sg,,America/New_York,2024-01-06 0:00,Webinar,SUMMER24,Windows,1.2.0,201-500,Engineering,0,35,,0,2024-01-06 4:49,2024-02-07 4:49
U002283,Mateo,Nguyen,mateo.nguyen@gmail.com,JP,RJ,UTC,2024-03-15 0:00,Paid Search,RETARGET1,Unknown,2.1.0,201-500,Ops,1,53,,1,2024-03-15 22:46,2024-04-19 22:46
U000831,Yuki,Smith,yuki.smith@yahoo.com,IN,LND,Europe/Berlin,2023-10-27 0:00,Social,Q3_PROMO,Linux,1.1.0,unknown,Product,1,22,,0,2023-10-27 5:10,2023-12-25 5:10
U000953,Sara,Garcia,sara.garcia@yahoo.com,GB,RJ,Asia/Kolkata,2023-09-21,Outbound,GROWTHLAB,Linux,1.1.2,501-1000,Ops,1,47,,1,2023-09-21 23:53,2024-02-09 23:53
U002521,Nora,Lewis,nora.lewis@company.com,IN,SP,America/New_York,07/07/2024,Content,BF2024,Unknown,1.0.9,51-200,HR,0,,,yes,2024-07-07 19:41,2024-10-07 19:41
u000239,Hana,White,hana.white@yahoo.com,US,,America/New_York,2024-06-11 0:00,Outbound,BF2024,Linux,2.1.0,51-200,Support,1,64,,no,2024-06-11 8:40,2024-12-01 8:40
U000957,Jin,Garcia,jin.garcianexloom.io,GB,NSW,UTC,2024-04-07 0:00,Social,AI-LAUNCH,Unknown,1.2.1,1000+,Finance,1,37,,TRUE,2024-04-07 8:02,2024-09-08 8:02
U002396,Leo,Perez,leo.perez@outlook.com,FR,BER,Europe/Berlin,2024-01-09 0:00,Organic Search,BF2024,Unknown,2.0.0,11-50,Marketing,0,39,,Y,2024-01-09 5:35,2024-04-04 5:35
U001654,Priya,Brown,priya.brown@gmail.com,FR,,,2024-01-17 0:00,Webinar,RETARGET1,Windows,1.3.0,51-200,Engineering,0,19,,Y,2024-01-17 23:09,2024-05-21 23:09
U002290,Ravi,Perez,ravi.perez@gmail.com,BR,MH,,2023-10-07 0:00,Outbound,Q3_PROMO,macOS,1.3.0,unknown,Support,0,unknown,,0,10/07/2023 20:11,2023-11-19 20:11
U001321,Chen,Moore,chen.moore@company.com,sg,-,Asia/Tokyo,2023-11-12 0:00,Social,SUMMER24,Windows,1.2.1,201-500,Support,0,57,,TRUE,2023-11-12 0:13,2024-05-07 0:13
U000437,Elena,Martin,elena.martin@icloud.com,ZA,-,,2023-06-04 0:00,Webinar,GROWTHLAB,Windows,v1.2.0,201-500,Marketing,0,,,FALSE,2023-06-04 3:55,2023-10-13 3:55
U001559,Olivia,King,olivia.king@nexloom.io,AU,MH,UTC,2024-10-16,Partner,WINTER25,Windows,2.1.0,501-1000,Founder,0,47,,FALSE,2024-10-16 11:31,2025-01-01 11:31
 U000578 ,Elena,Jackson, elena.jackson@proton.me ,AU,BER,Europe/Berlin,2025-02-03 0:00,Content,N/A,macOS,1.3.0,501-1000,Founder,0,24,,TRUE,2025-02-03 5:27,2025-06-29 5:27
U001150,Kofi,Nguyen,kofi.nguyen@gmail.com,BR,MH,America/New_York,2024-11-12 0:00,Social,SUMMER24,Android,1.3.0,11-50,Marketing,FALSE,48,,TRUE,2024-11-12 5:11,2025-01-12 5:11
U000919,Emma,Davis,emma.davis@gmail.com,FR,,,2024-08-19 0:00,Referral,n/a,Unknown,1.0.9,1000+,Support,0,29,U000076,FALSE,2024-08-19 8:38,2024-09-28 8:38
U001788,Leo,Allen,leo.allen@icloud.com,AU,BER,Europe/London,2024-05-25 0:00,Outbound,N/A,Linux,1.2.1,11-50,Finance,0,,,yes,2024-05-25 11:48,2024-05-28 11:48
U002105,Leo,Martinez,leo.martinez@yahoo.com,GB,CA,,2024-09-08 0:00,Referral,Q3_PROMO,macOS,2.0.0,10-Jan,Product,0,47,U000010,FALSE,2024-09-08 14:38,2025-01-30 14:38
U000502,Noah,Allen,noah.allen@company.com,SE,ON,Europe/Berlin,2024-04-16 0:00,Content,RETARGET1,macOS,1.1.0,11-50,Product,0,35,,0,2024-04-16 9:45,2024-04-29 9:45
U000349,Zoe,Robinson,zoe.robinson@company.com,DE,-,,2024-01-25 0:00,Partner,N/A,Windows,1.1.2,unknown,Sales,1,24,,0,2024-01-25 18:54,2024-03-22 18:54
U000383,Omar,Garcia,omar.garcia@yahoo.com,BR,unknown,Asia/Kolkata,06/02/2024,Outbound,SUMMER24,Linux,1.0.9,10-Jan,Founder,0,29,,TRUE,2024-06-02 14:33,2024-06-30 14:33
