event_id,user_id,event_type,page_url,event_timestamp,device_type,browser,os,session_duration_seconds,error_flag,created_at
E006527,U002391,doc_edit,,08/12/2024 16:15,desktop,,macOS,,FALSE,2024-08-12 16:15
E000158,U001823,integration_connect,,2023-04-26,tablet,,,unknown,,2023-04-26 16:27
E005519,U002207,ai_search,,04/23/2025 20:30,mobile,Firefox,Android,unknown,,2025-04-23 20:30
E006074,U000237,comment,,,tablet,Edge,macOS,,TRUE,2025-06-05 6:16
E001340,U001804,doc_create,,06/13/2024 13:16,mobile,Brave,macOS,,0,2024-06-13 13:16
E008218,U000363,doc_create,,08/21/2024 20:48,desktop,Brave,Windows,unknown,FALSE,2024-08-21 20:48
E006564,U000210,export,,2023-09-13 16:15,mobile,Chrome,,1514,TRUE,2023-09-13 16:15
E004265,U001094,integration_connect,,04/23/2025 05:27,DESKTOP,Edge,macOS,,,2025-04-23 5:27
E003741,U000008,login,/docs,,mobile,Safari,Android,unknown,1,2023-09-23 22:46
E007885,U002499,page_view,/admin,02/27/2023 14:57,DESKTOP,Chrome,macOS,unknown,TRUE,2023-02-27 14:57
E008772,U001702,ai_search,,02/13/2023 21:57,mobile,Brave,macOS,383,,2023-02-13 21:57
E008001,U001807,comment,,2023-04-17 4:39,mobile,Edge,,543,1,2023-04-17 4:39
E001585,U002154,page_view,/pricing,03/01/2025 21:12,desktop,Brave,Windows,1298,TRUE,2025-03-01 21:12
E002778,U001880,logout,/help,2024-05-11,,Safari,Android,,FALSE,2024-05-11 6:49
E006506,U000784,doc_edit,,,desktop,Safari,Linux,unknown,TRUE,2025-01-21 0:04
E005694,U002159,share,,2024-12-22 15:20,,Chrome,macOS,unknown,FALSE,2024-12-22 15:20
E000204,U002031,search,,2024-03-17 6:57,tablet,Brave,Linux,1769,1,2024-03-17 6:57
E008712,U002081,page_view,/onboarding,,tablet,Edge,Android,,TRUE,2025-01-17 11:38
E003496,U000983,ai_search,,2024-03-15,DESKTOP,,macOS,162,,2024-03-15 22:49
E001859,U000666,SHARE,,07/25/2024 17:35,tablet,Edge,,,1,2024-07-25 17:35
E004940,u001222,login,/billing,2023-12-23,desktop,,,,FALSE,2023-12-23 11:56
E005740,U000522,integration_error,,03/22/2025 10:54,,Firefox,Windows,,TRUE,2025-03-22 10:54
E002939,U000063,SHARE,,12/12/2024 21:08,,Brave,Windows,unknown,,2024-12-12 21:08
E005444,U000811,comment,,,DESKTOP,,Windows,,,2023-11-19 4:14
E007832,u000778,comment,,2024-09-14 8:55,tablet,,Linux,,FALSE,2024-09-14 8:55
E004099, U002514 ,page_view,/dashboard,08/25/2024 06:54,tablet,,Linux,,TRUE,2024-08-25 6:54
E005806,U000597,COMMENT,,03/09/2024 19:48,desktop,,iOS,,,2024-03-09 19:48
E007708,U001246,doc_create,,10/29/2023 13:31,mobile,Brave,Linux,unknown,,2023-10-29 13:31
E004042,U000230,comment,,02/08/2025 14:18,desktop,,,,FALSE,2025-02-08 14:18
e005315,U002575,LOGOUT,/pricing,,,Chrome,,,TRUE,2023-11-03 3:52
E002944,U001926,share,,2025-01-30 23:42,,Chrome,iOS,,TRUE,2025-01-30 23:42
E002477,U000034,share,,01/13/2023 09:33,mobile,Chrome,Linux,,FALSE,2023-01-13 9:33
E004649,U001305,ai_search,,05/05/2025 04:10,DESKTOP,Firefox,macOS,130,,2025-05-05 4:10
E004116,U000500,search,,2024-07-28,tablet,Firefox,Android,1558,,2024-07-28 19:13
E006615,U000818,doc_delete,,2025-04-04 8:08,tablet,,macOS,,TRUE,2025-04-04 8:08
E008496,U000530,ai_search,,10/10/2024 01:41,desktop,Firefox,iOS,83,FALSE,2024-10-10 1:41
E001690,U000706,AI_SEARCH,,11/19/2023 03:48,mobile,Safari,,unknown,TRUE,2023-11-19 3:48
E006320,U001927,integration_error,,,mobile,Firefox,Windows,unknown,1,2024-05-12 3:22
E004928,U000230,doc_create,,07/04/2023 12:03,DESKTOP,Chrome,,unknown,FALSE,2023-07-04 12:03
E002863,U001126,export,,2023-06-16 0:24,,Firefox,Windows,unknown,TRUE,2023-06-16 0:24
E005483,U000974,page_view,/search,0000-00-00 00:00:00,tablet,Chrome,macOS,unknown,1,2023-10-20 16:16
E003241,U001384,doc_create,,01/01/2023 02:47,DESKTOP,Firefox,Android,,FALSE,2023-01-01 2:47
E001741,U002580,EXPORT,,2024-03-02 15:54,,Firefox,,,FALSE,2024-03-02 15:54
E006830,U001070,share,,2024-06-26 15:55,desktop,Chrome,Windows,,TRUE,2024-06-26 15:55
E006164,U000384,doc_create,,2023-09-06 16:49,DESKTOP,Firefox,,455,TRUE,2023-09-06 16:49
E007168,U002080,export,,,DESKTOP,Chrome,macOS,1259,,2023-07-07 12:16
E006836,U000769,doc_edit,,12/07/2024 04:06,,Chrome,iOS,unknown,,2024-12-07 4:06
E002594,U001261,search,,2025-06-06,desktop,,Windows,49,1,2025-06-06 1:17
E007379, U002414 ,doc_create,,2024-03-15,,Safari,Linux,unknown,TRUE,2024-03-15 22:22
E006383,U002145,export,,04/09/2023 06:28,,Brave,,,,2023-04-09 6:28
E000707,U001972,integration_connect,,08/11/2023 15:39,,Chrome,,1596,0,2023-08-11 15:39
E007602,U001310,doc_delete,,01/15/2025 10:41,desktop,Safari,Linux,unknown,0,2025-01-15 10:41
E007638,U000436,ai_search,,2025-03-17 17:33,tablet,Brave,,,TRUE,2025-03-17 17:33
E001724,U001018,doc_delete,,2024-02-17,,Chrome,Windows,,0,2024-02-17 5:28
E004772,U002586,comment,,11/26/2023 04:30,,Chrome,Android,109,TRUE,2023-11-26 4:30
E000190,U001182,login,/help,2023-02-21 16:47,desktop,Safari,,1556,,2023-02-21 16:47
E005130,U001532,share,,02/16/2025 17:41,mobile,Safari,Android,,TRUE,2025-02-16 17:41
E008294,U001166,integration_connect,,2023-03-14 6:30,,Edge,,93,TRUE,2023-03-14 6:30
E000882,U000349,logout,/billing,03/25/2024 06:43,desktop,,Windows,,,2024-03-25 6:43
E002949,U002388,doc_create,,01/14/2025 08:50,mobile,Brave,iOS,unknown,TRUE,2025-01-14 8:50
E004969,U002411,logout,/docs,03/14/2023 00:27,,Chrome,macOS,626,1,2023-03-14 0:27
E005144,U000723,integration_error,,2024-01-31,DESKTOP,Edge,Linux,,0,2024-01-31 21:52
E008191,U000455,comment,,2023-02-09,,,macOS,,1,2023-02-09 8:09
E004760,USR-001351,integration_error,,04/25/2024 19:38,tablet,,,70,1,2024-04-25 19:38
E007322,U000180,DOC_EDIT,,2025-02-22,,Brave,,unknown,FALSE,2025-02-22 15:58
E005555,USR-001571,integration_connect,,09/18/2023 06:30,,Brave,Linux,unknown,FALSE,2023-09-18 6:30
E002386,U002147,doc_delete,,01/26/2023 19:36,,Firefox,,unknown,,2023-01-26 19:36
e005361,U001808,doc_edit,,2024-10-28,,Edge,Android,,FALSE,2024-10-28 3:17
E000649, U001606 ,page_view,/admin,2025-03-14 5:01,,Brave,macOS,,,2025-03-14 5:01
E008690,U002069,ai_search,,2023-05-30 9:26,tablet,Safari,Android,unknown,TRUE,2023-05-30 9:26
E006327,USR-000669,share,,05/15/2024 05:51,,,,unknown,,2024-05-15 5:51
 E008127,U002533,share,,09/10/2023 22:37,,Brave,iOS,1433,FALSE,2023-09-10 22:37
E005755,U000439,integration_error,,2023-10-06 14:00,desktop,Brave,,,TRUE,2023-10-06 14:00
E008577,U000045,search,,03/27/2025 06:39,DESKTOP,Brave,iOS,unknown,TRUE,2025-03-27 6:39
E007846, U000387 ,integration_error,,2025-02-12 14:08,,,macOS,,1,2025-02-12 14:08
E003725, U000365 ,login,/pricing,2024-02-28,desktop,,macOS,879,TRUE,2024-02-28 15:30
E000206,U000986,login,/integrations,04/04/2024 17:58,,Chrome,Linux,1745,FALSE,2024-04-04 17:58
E001700,USR-001799,export,,,,Safari,Windows,,TRUE,2023-09-16 4:31
E003621,U001150,comment,,01/12/2025 18:31,mobile,Chrome,Android,unknown,1,2025-01-12 18:31
E005243,u001005,logout,/dashboard,2023-01-03 23:11,,Edge,Linux,,FALSE,2023-01-03 23:11
E007217,U000511,export,,2023-12-02,mobile,,Linux,,FALSE,2023-12-02 1:51
E006595,U001908,doc_delete,,05/21/2024 04:36,,Edge,,unknown,0,2024-05-21 4:36
E007062,U002143,logout,/help,03/04/2023 04:24,mobile,Edge,iOS,,0,2023-03-04 4:24
E006472,U000519,integration_connect,,2023-05-03,tablet,,Android,894,FALSE,2023-05-03 22:11
E001697,U000748,doc_delete,,02/06/2025 10:08,desktop,Firefox,,,FALSE,2025-02-06 10:08
E008089,U002488,share,,02/07/2023 21:06,desktop,Chrome,,unknown,FALSE,2023-02-07 21:06
E008442,u002228,doc_edit,,2025-05-20 11:14,mobile,Chrome,Windows,,FALSE,2025-05-20 11:14
E006980,u002490,export,,01/21/2023 03:25,tablet,Edge,macOS,unknown,,2023-01-21 3:25
E002454,U001733,search,,2023-02-19,tablet,Firefox,Windows,1456,FALSE,2023-02-19 2:49
E005892,U000676,doc_create,,02/24/2024 05:22,tablet,Edge,,607,TRUE,2024-02-24 5:22
E003885,U001208,doc_delete,,12/15/2023 12:12,,Brave,Windows,,,2023-12-15 12:12
E002191,u001567,share,,11/19/2024 14:30,DESKTOP,Chrome,macOS,,,2024-11-19 14:30
e002951,U000968,integration_error,,0000-00-00 00:00:00,,Edge,Linux,unknown,TRUE,2024-01-14 17:20
E003248,u000575,ai_search,,04/02/2023 00:54,,Brave,,,,2023-04-02 0:54
E007658,U001940,doc_edit,,01/08/2025 07:27,mobile,Chrome,,unknown,,2025-01-08 7:27
E007124,U000524,login,/admin,2025-01-25,mobile,Safari,,unknown,FALSE,2025-01-25 19:32
E006535,U000425,login,/onboarding,01/18/2024 22:24,desktop,Safari,,483,TRUE,2024-01-18 22:24
E004554,U001868,login,/admin,2023-11-18,,Firefox,Android,1699,1,2023-11-18 14:53
E005273, U002035 ,logout,/admin,2024-07-01 20:40,DESKTOP,,,475,FALSE,2024-07-01 20:40
E006383,U002050,search,,05/17/2024 15:33,tablet,Firefox,Android,,1,2024-05-17 15:33
E004708,U001339,share,,10/24/2023 10:47,,Brave,Windows,,TRUE,2023-10-24 10:47
E001265,U001577,integration_error,,2025-05-22 13:07,mobile,Safari,Android,,TRUE,2025-05-22 13:07
E006304,U001759,doc_create,,2023-05-10 6:15,mobile,Edge,iOS,unknown,0,2023-05-10 6:15
E006777,U002489,share,,09/18/2023 06:57,,,Linux,1222,FALSE,2023-09-18 6:57
E001059,U001095,integration_connect,,2023-09-07,mobile,,,unknown,,2023-09-07 2:57
E000035,U000212,integration_connect,,05/11/2023 18:53,desktop,,,,TRUE,2023-05-11 18:53
E002815,U001282,comment,,01/03/2025 18:02,,Edge,iOS,,FALSE,2025-01-03 18:02
E001762,U000116,page_view,/search,04/02/2024 05:48,DESKTOP,Chrome,iOS,,0,2024-04-02 5:48
 E008550,U001155,page_view,/help,,tablet,Brave,,,FALSE,2023-10-24 8:12
E000984,u001496,doc_create,,2023-04-09 4:00,DESKTOP,,Windows,,0,2023-04-09 4:00
E007678,U001145,doc_delete,,,DESKTOP,Safari,Windows,,TRUE,2023-09-03 19:16
E005318, u002146 ,ai_search,,06/01/2023 06:39,,Edge,,,,2023-06-01 6:39
E006326,U001484,doc_delete,,2023-03-03 20:17,tablet,Firefox,Linux,684,TRUE,2023-03-03 20:17
E008797,U000725,comment,,02/26/2024 15:07,,,macOS,unknown,TRUE,2024-02-26 15:07
E003960,U002272,integration_error,,01/07/2023 21:45,,Brave,,634,FALSE,2023-01-07 21:45
E005341, U002583 ,doc_delete,,,tablet,Firefox,,,FALSE,2025-02-01 22:02
E006818,U001529,login,/integrations,2024-10-31 5:38,DESKTOP,Edge,Linux,,0,2024-10-31 5:38
E001454,USR-000910,comment,,2023-12-13 20:15,desktop,Chrome,iOS,443,,2023-12-13 20:15
E002503,U000283,doc_edit,,0000-00-00 00:00:00,tablet,Safari,Android,,1,2023-08-25 3:52
E001139,U001297,integration_connect,,,,Firefox,macOS,1699,1,2023-12-22 8:22
E001290,U001083,doc_create,,11/21/2023 16:04,desktop,,macOS,,0,2023-11-21 16:04
E006781,U001823,export,,01/02/2023 17:45,,Brave,Windows,452,FALSE,2023-01-02 17:45
E006021,U001105,integration_connect,,08/24/2023 03:43,DESKTOP,,Windows,,TRUE,2023-08-24 3:43
E008050,U001410,logout,/help,2025-01-13 3:09,tablet,,iOS,,1,2025-01-13 3:09
E001684,U000398,doc_delete,,,tablet,Safari,,1363,FALSE,2024-10-30 0:23
E007964,U001697,integration_connect,,0000-00-00 00:00:00,,Edge,,,FALSE,2025-03-12 8:26
E002548,U000838,doc_create,,2024-08-20,,Firefox,,unknown,TRUE,2024-08-20 2:46
E003762,U000460,integration_error,,2024-05-17,DESKTOP,Safari,macOS,,FALSE,2024-05-17 23:25
E002088,U001988,ai_search,,2023-05-15,tablet,Chrome,Android,1260,0,2023-05-15 18:43
E007295,U001922,EXPORT,,2024-08-30 20:40,,Chrome,Linux,,FALSE,2024-08-30 20:40
E008465,USR-001437,integration_error,,2024-12-22 21:08,,Safari,Linux,1611,FALSE,2024-12-22 21:08
 E008425,U001906,doc_edit,,2023-03-21 16:59,desktop,Firefox,iOS,unknown,TRUE,2023-03-21 16:59
E000691,U000250,share,,01/23/2024 14:33,,,Windows,,TRUE,2024-01-23 14:33
E008448,U001579,logout,/docs,2025-06-14 9:23,DESKTOP,Brave,macOS,,TRUE,2025-06-14 9:23
E005161,U000439,ai_search,,2024-07-18 7:37,,Firefox,,1038,FALSE,2024-07-18 7:37
E003716,U001315,login,/pricing,03/12/2023 13:27,desktop,Firefox,iOS,411,FALSE,2023-03-12 13:27
E003250,U001067,comment,,2024-09-08,,Edge,Android,,TRUE,2024-09-08 5:59
E003176,U002149,search,,08/09/2024 04:43,mobile,Chrome,macOS,unknown,TRUE,2024-08-09 4:43
E004087,U000957,doc_delete,,05/15/2025 10:34,DESKTOP,,,,,2025-05-15 10:34
E002604,U001249,login,/dashboard,03/29/2024 02:07,tablet,Firefox,,unknown,,2024-03-29 2:07
E005866,U001832,doc_create,,03/01/2025 19:25,,Safari,Android,unknown,,2025-03-01 19:25
E005578,U000629,page_view,/docs,0000-00-00 00:00:00,tablet,Edge,,unknown,0,2023-03-19 15:15
E002167,U001760,export,,01/27/2025 18:18,DESKTOP,,,,0,2025-01-27 18:18
E007920,U002389,integration_error,,2023-11-13 23:14,DESKTOP,,macOS,,TRUE,2023-11-13 23:14
E005003,U001769,logout,/settings,0000-00-00 00:00:00,DESKTOP,Edge,Android,unknown,TRUE,2023-08-11 2:46
E006764,U001620,integration_connect,,2024-07-13,DESKTOP,Chrome,iOS,,1,2024-07-13 9:26
E002433,U000532,comment,,12/14/2024 11:10,desktop,Safari,Windows,188,FALSE,2024-12-14 11:10
E006103,U000281,DOC_DELETE,,2024-07-30 18:17,,Firefox,,,FALSE,2024-07-30 18:17
E004115,U000753,comment,,01/13/2023 12:49,tablet,,Android,,FALSE,2023-01-13 12:49
e008371,U000148,page_view,/dashboard,2023-01-07 1:40,,Chrome,Windows,,FALSE,2023-01-07 1:40
E005599,U001712,integration_error,,2024-09-30,mobile,,Android,,FALSE,2024-09-30 12:01
e005712,U000254,AI_SEARCH,,,DESKTOP,Firefox,,,,2024-11-15 9:45
e005067,U002001,doc_delete,,2023-08-10,,Brave,Windows,76,FALSE,2023-08-10 2:25
E006891,U000582,share,,06/21/2023 11:23,tablet,Brave,Linux,,,2023-06-21 11:23
E005255,USR-000886,search,,05/05/2023 15:24,tablet,Safari,macOS,unknown,FALSE,2023-05-05 15:24
E000628,U000675,share,,2025-02-21 4:39,desktop,Chrome,Linux,unknown,TRUE,2025-02-21 4:39
E008440,U002540,ai_search,,01/25/2023 18:11,DESKTOP,Brave,Android,,TRUE,2023-01-25 18:11
E005660,U000684,doc_create,,02/10/2024 15:30,DESKTOP,Edge,,1606,TRUE,2024-02-10 15:30
E006729,U000662,search,,2025-03-05 15:36,mobile,Chrome,,,1,2025-03-05 15:36
e005749,U000180,logout,/integrations,0000-00-00 00:00:00,,,Android,,1,2024-04-14 16:09
E004842,u000584,EXPORT,,2023-08-08,,Brave,macOS,,TRUE,2023-08-08 4:18
E002265,u002078,search,,2025-01-12,DESKTOP,Safari,Windows,305,,2025-01-12 3:19
E000726,U002214,doc_edit,,2025-04-01,,Chrome,Linux,491,0,2025-04-01 3:50
e002074,U002239,doc_delete,,,desktop,Firefox,Linux,,1,2024-06-27 14:44
E002049,U000227,integration_error,,04/04/2023 18:51,DESKTOP,Brave,iOS,29,,2023-04-04 18:51
E000806,U000318,doc_create,,2024-04-03 12:28,,,Windows,,FALSE,2024-04-03 12:28
E004822,U001633,integration_error,,02/10/2023 18:20,mobile,Brave,Windows,,TRUE,2023-02-10 18:20
E002671,U001261,integration_connect,,0000-00-00 00:00:00,DESKTOP,,macOS,,FALSE,2024-12-06 10:02
E000699,U001087,login,/docs,2024-12-05,desktop,,,,0,2024-12-05 2:07
E006572,U000412,search,,2025-02-27,,Brave,iOS,600,FALSE,2025-02-27 8:39
E005179,U001471,export,,,DESKTOP,,macOS,,FALSE,2023-03-25 18:13
E008146,U001024,integration_error,,11/08/2023 16:20,desktop,Brave,Windows,unknown,0,2023-11-08 16:20
E007722,U001597,integration_error,,2025-05-24 7:56,tablet,Chrome,Android,,FALSE,2025-05-24 7:56
E002978,U000743,share,,2023-01-13,mobile,Firefox,Linux,24,TRUE,2023-01-13 1:42
E008298,U002329,share,,2023-08-01 12:55,desktop,Chrome,macOS,,FALSE,2023-08-01 12:55
E008491,U001865,search,,,,Chrome,,,TRUE,2023-03-03 2:00
E001492, U002504 ,login,/admin,2023-03-16,tablet,Chrome,,,FALSE,2023-03-16 21:34
E004378, U001166 ,login,/docs,03/20/2025 19:37,tablet,Chrome,macOS,unknown,TRUE,2025-03-20 19:37
E004751,U001282,page_view,/onboarding,11/08/2024 11:09,,,,398,TRUE,2024-11-08 11:09
E008831,USR-000534,share,,2023-07-27,DESKTOP,Edge,macOS,,TRUE,2023-07-27 18:55
E004744,U001272,login,/billing,05/29/2025 06:52,,,,1018,FALSE,2025-05-29 6:52
E000647,U000246,logout,/admin,2023-11-27 1:34,mobile,Chrome,Windows,,TRUE,2023-11-27 1:34
E003793,U000358,comment,,12/29/2024 18:30,,Firefox,Linux,unknown,,2024-12-29 18:30
E008130,U001155,logout,/admin,10/21/2023 15:07,tablet,,macOS,unknown,FALSE,2023-10-21 15:07
E000670,USR-001528,DOC_DELETE,,06/17/2025 07:08,,Safari,Linux,,TRUE,2025-06-17 7:08
E004266,U000697,share,,2023-01-17,,,Linux,,,2023-01-17 12:33
E002262,U001966,integration_error,,2023-01-28 23:52,desktop,Chrome,Windows,982,1,2023-01-28 23:52
E001552,U000973,comment,,2025-01-19 9:28,tablet,Chrome,,1583,FALSE,2025-01-19 9:28
E007297,U001656,search,,11/29/2023 19:39,,Edge,,,FALSE,2023-11-29 19:39
E007537,U000329,login,/help,03/11/2023 18:25,,Chrome,Linux,unknown,,2023-03-11 18:25
E006969,U002461,share,,2025-01-01 6:07,tablet,,Android,unknown,TRUE,2025-01-01 6:07
E008388,U000833,doc_create,,2023-08-27 5:54,,Edge,Windows,,TRUE,2023-08-27 5:54
E001161,U001989,doc_delete,,,desktop,Safari,Android,1468,TRUE,2023-02-24 18:50
E006234,U002370,comment,,11/26/2024 21:48,desktop,Firefox,iOS,unknown,TRUE,2024-11-26 21:48
E000488,U001243,export,,06/05/2023 18:56,tablet,Safari,macOS,32,1,2023-06-05 18:56
E000989,U002037,doc_edit,,2025-04-27,tablet,,iOS,unknown,FALSE,2025-04-27 21:06
E003082,U000389,share,,2024-03-23,mobile,Firefox,macOS,,1,2024-03-23 23:54
E004986, U000638 ,ai_search,,2024-07-28,mobile,,macOS,,0,2024-07-28 22:07
E004155,U002416,login,/pricing,,,Brave,Linux,37,TRUE,2024-04-02 23:10
E007201,U000315,doc_create,,0000-00-00 00:00:00,tablet,,Windows,,TRUE,2025-02-25 4:01
E002412,U001399,logout,/onboarding,0000-00-00 00:00:00,,Brave,,,1,2024-11-11 15:22
E007403,U001467,search,,0000-00-00 00:00:00,,Edge,Windows,,0,2025-06-01 1:34
E004568,U000997,login,/search,02/07/2023 13:33,DESKTOP,Chrome,macOS,1458,0,2023-02-07 13:33
E006792,U000562,integration_connect,,2023-05-29,,Brave,,,FALSE,2023-05-29 23:33
E001301,u001333,doc_create,,2023-08-03 18:05,,Brave,,1244,,2023-08-03 18:05
E008213,U001638,page_view,/dashboard,2023-08-20,,Safari,Windows,,,2023-08-20 5:22
E003238,U002275,INTEGRATION_CONNECT,,2023-10-23 11:24,,Edge,,1789,1,2023-10-23 11:24
E002186,U002525,comment,,2025-05-19,,Brave,,699,1,2025-05-19 0:11
E006233,U000542,search,,2023-04-17 7:16,,Firefox,,,FALSE,2023-04-17 7:16
E004345,U002441,doc_delete,,2023-09-12 10:17,tablet,Chrome,,unknown,FALSE,2023-09-12 10:17
E007254,U001847,doc_edit,,04/28/2024 14:40,mobile,,Windows,unknown,,2024-04-28 14:40
E007233,U000430,comment,,06/15/2025 01:49,desktop,Brave,Linux,,TRUE,2025-06-15 1:49
E005089,U001439,integration_error,,,desktop,Firefox,Android,,,2024-04-01 21:57
E002944,U000462,export,,0000-00-00 00:00:00,,Edge,macOS,,TRUE,2024-09-23 3:36
E003353,U002561,comment,,10/26/2024 07:06,desktop,Chrome,iOS,unknown,TRUE,2024-10-26 7:06
E002616,U000118,logout,/admin,05/25/2024 17:05,desktop,Brave,iOS,unknown,,2024-05-25 17:05
E004334,U001082,doc_create,,2024-11-10,DESKTOP,Brave,Windows,,FALSE,2024-11-10 10:50
E000506,U001774,SHARE,,2025-04-14 8:43,mobile,Brave,,unknown,,2025-04-14 8:43
E003329,U002512,integration_error,,2024-01-15 14:24,,,Android,,,2024-01-15 14:24
E001786,U001466,doc_delete,,2023-01-19,mobile,Edge,,,FALSE,2023-01-19 17:48
E003679,U001379,comment,,2023-05-20,desktop,Edge,Linux,,TRUE,2023-05-20 12:34
E008063,U001154,ai_search,,2025-05-21 0:40,desktop,,macOS,,FALSE,2025-05-21 0:40
E003982, U000391 ,login,/settings,05/26/2025 06:23,DESKTOP,Safari,macOS,,,2025-05-26 6:23
E000395,U002091,comment,,04/10/2023 17:24,tablet,,Linux,673,FALSE,2023-04-10 17:24
E003822,U002197,logout,/settings,06/29/2023 15:09,DESKTOP,Safari,iOS,,0,2023-06-29 15:09
E003830,USR-001677,login,/dashboard,04/14/2024 13:25,,Brave,iOS,,TRUE,2024-04-14 13:25
E002232,U000652,share,,2023-10-08,,,Linux,,0,2023-10-08 21:48
E008518,U000056,export,,2025-04-18,,Brave,,246,TRUE,2025-04-18 1:58
E006787,U001822,AI_SEARCH,,2023-03-05,,Firefox,Linux,unknown,1,2023-03-05 16:10
E001572,u002129,comment,,2025-01-22 3:21,,Chrome,,,FALSE,2025-01-22 3:21
E004701,U001270,search,,2023-09-25,,Firefox,Linux,,,2023-09-25 22:57
E003211,U000083,logout,/dashboard,2024-08-18 12:39,mobile,Edge,,,FALSE,2024-08-18 12:39
E003559,u000173,doc_create,,,mobile,,iOS,unknown,FALSE,2024-07-05 17:17
e008766, U001337 ,comment,,03/30/2023 15:53,,,iOS,unknown,,2023-03-30 15:53
E006884,U001458,doc_edit,,2024-09-21,DESKTOP,,Windows,,1,2024-09-21 6:57
E004019,U001873,doc_delete,,,tablet,,Windows,,TRUE,2023-12-23 17:18
E006332,U000934,ai_search,,07/05/2024 02:17,tablet,,,,TRUE,2024-07-05 2:17
E006441,U000027,share,,,DESKTOP,,Linux,1000,,2024-09-10 13:09
E001214,U001486,doc_create,,02/19/2025 09:36,,Edge,Linux,unknown,FALSE,2025-02-19 9:36
E003132,U000454,share,,2023-08-13,mobile,Chrome,Windows,1119,,2023-08-13 6:33
E008052,U001287,integration_connect,,,,Safari,Android,,1,2024-08-10 21:18
E001970,U000794,export,,2024-09-14,,Edge,macOS,,1,2024-09-14 13:00
E004748,U001676,doc_delete,,2023-11-14 11:30,mobile,Brave,,,1,2023-11-14 11:30
 E006060,U000492,INTEGRATION_CONNECT,,,mobile,Firefox,Android,,TRUE,2025-03-05 3:22
E006651,U002494,search,,0000-00-00 00:00:00,mobile,Brave,iOS,1373,TRUE,2024-02-15 4:59
E006816,U000167,SHARE,,2024-08-11,,,macOS,,,2024-08-11 18:52
E008918,U000423,ai_search,,2025-01-08 21:41,,,Android,1589,TRUE,2025-01-08 21:41
E002817,U001628,export,,2023-08-03,desktop,,Windows,1316,,2023-08-03 13:36
E008354,U000170,doc_edit,,11/26/2023 21:57,mobile,Brave,Linux,862,TRUE,2023-11-26 21:57
E006201,U000836,integration_error,,,desktop,Edge,macOS,,FALSE,2024-08-09 13:37
E005800,U000584,login,/help,2023-10-22,mobile,Safari,macOS,1661,,2023-10-22 11:34
e007510,U000624,doc_delete,,10/11/2024 06:39,tablet,Edge,,unknown,,2024-10-11 6:39
E008035,U000498,login,/dashboard,2023-10-31 22:54,,,iOS,,0,2023-10-31 22:54
e005955,U000238,comment,,05/17/2024 10:00,mobile,Chrome,Linux,638,FALSE,2024-05-17 10:00
E003057,U001468,doc_edit,,10/01/2023 09:47,,,Windows,unknown,0,2023-10-01 9:47
E001178,U000099,integration_connect,,06/30/2024 08:09,desktop,,macOS,,,2024-06-30 8:09
E003896,U001061,integration_connect,,06/06/2025 04:10,DESKTOP,,macOS,unknown,TRUE,2025-06-06 4:10
E008255,U002282,logout,/docs,11/05/2023 03:46,tablet,,iOS,,,2023-11-05 3:46
E008867,U002279,share,,04/07/2023 08:34,mobile,,iOS,707,TRUE,2023-04-07 8:34
e005969,U000486,doc_edit,,,mobile,Safari,,unknown,TRUE,2023-09-21 6:49
e005452,U002082,search,,,mobile,Brave,,780,FALSE,2023-04-20 15:18
E004928,U001855,PAGE_VIEW,/dashboard,2023-10-09 1:27,,Chrome,macOS,unknown,,2023-10-09 1:27
E008704,U001934,comment,,,desktop,Brave,,unknown,FALSE,2024-06-06 16:26
E006890,U000008,logout,/pricing,0000-00-00 00:00:00,tablet,,Android,,1,2024-12-30 16:30
E005074,U001995,doc_edit,,2023-11-24 7:12,,,Windows,270,TRUE,2023-11-24 7:12
E007617,U000841,login,/help,02/15/2024 22:51,desktop,,iOS,,TRUE,2024-02-15 22:51
E005905,U002544,doc_edit,,12/05/2023 12:34,,Edge,Android,,,2023-12-05 12:34
 E004936,u001284,comment,,2024-04-17,DESKTOP,,Windows,174,TRUE,2024-04-17 17:12
e000601,U001729,page_view,/settings,2024-11-30 7:59,DESKTOP,,Android,,TRUE,2024-11-30 7:59
E001953,U001926,integration_error,,,tablet,Brave,Windows,,TRUE,2025-04-19 4:37
E002267,U002536,comment,,03/17/2024 11:07,,Brave,Android,1340,TRUE,2024-03-17 11:07
E008696,U000662,search,,,tablet,Chrome,Android,,,2025-04-17 9:06
E006876, U000184 ,logout,/pricing,03/12/2023 00:35,mobile,Safari,macOS,unknown,TRUE,2023-03-12 0:35
E004487,U001633,comment,,2023-04-10,DESKTOP,,Windows,961,FALSE,2023-04-10 18:16
E006158,U000084,doc_edit,,05/03/2024 00:18,,,Windows,,,2024-05-03 0:18
E002294,u002453,doc_delete,,2023-06-01,,,,1159,TRUE,2023-06-01 23:17
E001795,U000715,doc_edit,,04/21/2024 10:07,tablet,Edge,,,TRUE,2024-04-21 10:07
E002318,U000448,doc_edit,,06/19/2024 02:11,,Brave,iOS,921,0,2024-06-19 2:11
E000941,U001176,doc_edit,,0000-00-00 00:00:00,tablet,Safari,iOS,,,2025-04-24 15:26
E005595,U000348,search,,10/02/2024 15:49,desktop,,Android,,TRUE,2024-10-02 15:49
E002063, U000232 ,comment,,2024-04-08 4:03,,Safari,Windows,,TRUE,2024-04-08 4:03
E003471,U000846,comment,,2025-02-21 12:10,,Firefox,Windows,unknown,,2025-02-21 12:10
E006908,U000134,login,/integrations,09/09/2024 23:56,,,macOS,,FALSE,2024-09-09 23:56
E007756,U000457,doc_create,,2024-12-19,,Firefox,macOS,1593,FALSE,2024-12-19 8:26
E008998, U000003 ,doc_create,,2023-02-28 2:52,DESKTOP,Edge,macOS,unknown,TRUE,2023-02-28 2:52
E003972,U002212,page_view,/billing,06/03/2024 03:10,,Safari,,,TRUE,2024-06-03 3:10
E008919,U001198,AI_SEARCH,,03/14/2023 11:09,tablet,Edge,,,TRUE,2023-03-14 11:09
E000607,u001374,doc_edit,,04/21/2024 15:08,DESKTOP,,Android,1004,TRUE,2024-04-21 15:08
E005815,u000145,export,,2024-12-28 13:11,,,Windows,,FALSE,2024-12-28 13:11
E000282,U001029,EXPORT,,03/07/2023 21:07,,Chrome,Linux,unknown,FALSE,2023-03-07 21:07
E002408,U000865,ai_search,,2025-05-15,tablet,Edge,Windows,,0,2025-05-15 9:29
E008105,  U000003  ,doc_create,,2024-12-23 3:12,,Firefox,,,,2024-12-23 3:12
E008818,U001186,doc_delete,,2024-11-16,,Brave,,unknown,TRUE,2024-11-16 19:40
E008236,U000351,comment,,0000-00-00 00:00:00,tablet,,Windows,,FALSE,2025-02-15 23:05
E006932,U001029,doc_delete,,2024-03-02 14:20,DESKTOP,Safari,iOS,,FALSE,2024-03-02 14:20
E007621,U001167,comment,,2024-02-16 14:45,tablet,,macOS,446,0,2024-02-16 14:45
E008444,U001820,search,,2023-07-12,tablet,Chrome,Linux,unknown,TRUE,2023-07-12 5:49
E003828,U002072,page_view,/admin,06/09/2025 05:47,,Chrome,Windows,,FALSE,2025-06-09 5:47
E003351,U001995,integration_connect,,08/20/2024 12:31,tablet,Firefox,macOS,,TRUE,2024-08-20 12:31
E002201,U001498,doc_create,,2023-07-29,tablet,,macOS,unknown,,2023-07-29 6:25
E002417,U000946,search,,03/24/2023 20:21,,,,,1,2023-03-24 20:21
E005216,U002197,login,/dashboard,01/31/2025 02:34,desktop,,macOS,1775,TRUE,2025-01-31 2:34
E007715,U000451,export,,2025-03-24 3:59,mobile,Brave,Android,958,FALSE,2025-03-24 3:59
 E004051,U000427,doc_create,,2025-04-30 9:47,tablet,Edge,Linux,,TRUE,2025-04-30 9:47
E000683,U000452,share,,07/14/2024 16:30,DESKTOP,Brave,iOS,unknown,FALSE,2024-07-14 16:30
E005794,U000660,doc_edit,,2024-07-21 11:36,,Safari,Linux,unknown,,2024-07-21 11:36
E007383,U000118,doc_create,,06/14/2024 15:53,DESKTOP,,Linux,unknown,TRUE,2024-06-14 15:53
E002905,U000154,doc_edit,,2023-12-12 3:23,desktop,,macOS,,TRUE,2023-12-12 3:23
E003830,U000462,comment,,2025-03-18 0:21,desktop,Safari,Android,1471,FALSE,2025-03-18 0:21
E005466,U001757,ai_search,,08/14/2023 16:57,tablet,Chrome,,,FALSE,2023-08-14 16:57
E004805,U000545,export,,01/03/2023 23:04,DESKTOP,Firefox,Linux,unknown,1,2023-01-03 23:04
E006795,U001270,comment,,07/28/2024 11:27,tablet,Chrome,,,TRUE,2024-07-28 11:27
E004791,U000876,doc_create,,01/20/2025 16:26,desktop,Chrome,,744,0,2025-01-20 16:26
E006064,U001105,comment,,2024-02-28,,Firefox,macOS,,,2024-02-28 12:25
E007776,U001676,logout,/admin,2023-03-15,mobile,Firefox,Windows,,TRUE,2023-03-15 4:29
 E007357,U001871,ai_search,,09/25/2023 04:51,mobile,,,1650,FALSE,2023-09-25 4:51
E002792,U000419,doc_delete,,2024-11-09,DESKTOP,Edge,,,0,2024-11-09 18:15
E000984,U000660,ai_search,,,desktop,Brave,Linux,unknown,TRUE,2024-01-22 12:29
E006698,U000596,integration_error,,,mobile,,,1392,0,2025-02-04 7:35
E005245,U001473,logout,/onboarding,12/16/2024 05:47,,Brave,macOS,,,2024-12-16 5:47
E004674,U002061,export,,,mobile,Brave,Linux,,1,2023-09-19 1:56
E004953,U001235,share,,2023-06-23 16:36,DESKTOP,,,,,2023-06-23 16:36
E007111,U002366,integration_error,,05/05/2025 06:48,mobile,Safari,Linux,,,2025-05-05 6:48
E002485,U001152,doc_edit,,05/06/2024 22:12,tablet,,Linux,,FALSE,2024-05-06 22:12
E005881,U000617,page_view,/integrations,04/04/2023 08:20,tablet,Brave,Android,unknown,,2023-04-04 8:20
E008860,U000512,ai_search,,2024-04-14 3:15,,Firefox,Windows,,FALSE,2024-04-14 3:15
E003075,U000478,integration_connect,,2024-09-30,desktop,,iOS,1236,,2024-09-30 17:34
E008273,U000990,doc_edit,,06/18/2025 03:43,mobile,Chrome,,,FALSE,2025-06-18 3:43
E004464,U002269,comment,,2025-03-18,desktop,Edge,Windows,1393,FALSE,2025-03-18 13:25
E003247,U000439,integration_error,,03/11/2025 21:35,desktop,Edge,Linux,1274,,2025-03-11 21:35
E006380,U002226,login,/admin,07/02/2023 09:59,DESKTOP,Edge,Linux,889,FALSE,2023-07-02 9:59
E003748,U002041,search,,2025-06-06,desktop,,,,0,2025-06-06 11:25
E008274,U001856,ai_search,,2024-07-19,,Brave,,,FALSE,2024-07-19 11:42
E002255,U001008,logout,/integrations,06/13/2025 09:59,,Firefox,Android,unknown,FALSE,2025-06-13 9:59
E005352,U001667,login,/settings,2024-11-01,mobile,,,,,2024-11-01 9:32
E005535,U001916,integration_error,,2023-11-24,mobile,,Windows,,0,2023-11-24 13:41
E007770, U000846 ,integration_error,,2023-01-14 21:43,mobile,Edge,Windows,1403,FALSE,2023-01-14 21:43
E003511,U001477,page_view,/onboarding,2025-03-03 4:33,tablet,Edge,macOS,,1,2025-03-03 4:33
E003667,U002118,ai_search,,2025-02-17,,,Windows,,1,2025-02-17 1:38
E003026,U000896,doc_create,,,DESKTOP,,Windows,,,2023-10-28 20:06
e003634,U001461,comment,,0000-00-00 00:00:00,desktop,Firefox,,unknown,,2023-10-23 2:54
E006552,U000056,ai_search,,2023-03-07 7:13,DESKTOP,Chrome,macOS,,FALSE,2023-03-07 7:13
E001390,U000418,page_view,/admin,2024-06-25,,,macOS,unknown,TRUE,2024-06-25 2:42
E006918,U001172,integration_error,,11/22/2023 21:06,,,,181,,2023-11-22 21:06
E005564,U000703,comment,,09/18/2023 17:00,,Safari,iOS,unknown,0,2023-09-18 17:00
E007086,U000177,search,,2024-04-26,,Safari,Windows,1176,FALSE,2024-04-26 2:10
E004886,U001208,export,,01/23/2025 15:31,,,Linux,,0,2025-01-23 15:31
E006511,U000853,page_view,/docs,2023-08-25,,Edge,,unknown,,2023-08-25 15:22
E007722,U002084,comment,,2024-04-12 15:04,,Brave,Android,unknown,0,2024-04-12 15:04
E000891,U000013,export,,12/12/2023 23:02,DESKTOP,Chrome,,unknown,FALSE,2023-12-12 23:02
 E007930,U001254,integration_connect,,03/16/2023 01:22,,,,568,TRUE,2023-03-16 1:22
E004977,U001234,logout,/integrations,2023-12-15,desktop,Edge,,,FALSE,2023-12-15 21:01
E004280,U000109,share,,2024-10-30 7:00,DESKTOP,Safari,Linux,unknown,,2024-10-30 7:00
E003682,U002483,doc_create,,2024-05-10 5:16,mobile,,,unknown,FALSE,2024-05-10 5:16
E008681,U000062,integration_connect,,2024-09-02 5:17,desktop,Brave,macOS,604,,2024-09-02 5:17
E005251,U001195,logout,/settings,11/11/2023 10:15,tablet,Brave,,,FALSE,2023-11-11 10:15
E006886,U000948,page_view,/onboarding,2023-03-14,,Brave,Linux,,TRUE,2023-03-14 0:04
E005525,U000617,logout,/billing,05/07/2023 13:48,,Safari,Linux,,0,2023-05-07 13:48
 E006576,U002245,page_view,/search,2024-05-11,,,Android,,TRUE,2024-05-11 11:33
E005455,U001106,logout,/help,2024-12-24,DESKTOP,,,1647,TRUE,2024-12-24 23:59
E006748,U000808,share,,02/07/2024 05:08,,Firefox,,,,2024-02-07 5:08
E006009,U000394,login,/admin,06/22/2024 17:33,,Edge,,,FALSE,2024-06-22 17:33
E000766,U000072,comment,,2025-02-03 1:51,,Edge,iOS,,FALSE,2025-02-03 1:51
E007794,U001517,ai_search,,01/26/2024 03:39,,Brave,Windows,unknown,FALSE,2024-01-26 3:39
E008794,U002372,share,,10/03/2023 16:32,desktop,,macOS,,1,2023-10-03 16:32
E003743,U001008,ai_search,,02/12/2023 12:46,mobile,Safari,Linux,1693,,2023-02-12 12:46
E000995,u000608,integration_error,,0000-00-00 00:00:00,DESKTOP,Firefox,Android,,,2024-11-16 16:51
E006194,U002554,logout,/billing,,,Safari,,,TRUE,2024-10-05 13:54
E002045,u000594,doc_delete,,03/06/2024 06:35,DESKTOP,Safari,,621,1,2024-03-06 6:35
E005646,U001461,export,,2023-09-17,desktop,,,,,2023-09-17 2:27
E005813,U002510,page_view,/dashboard,,desktop,,Windows,,,2025-01-20 19:40
E005921,U000711,doc_edit,,02/27/2025 07:41,,Safari,,920,FALSE,2025-02-27 7:41
E005225,U001466,comment,,2024-12-24,,,Windows,unknown,TRUE,2024-12-24 6:23
E000154,u001403,doc_create,,2025-01-02 19:17,tablet,Brave,Windows,,FALSE,2025-01-02 19:17
E000312,U001365,doc_edit,,12/06/2024 01:28,,,,,0,2024-12-06 1:28
E002136,U002557,page_view,/settings,,,Brave,macOS,,FALSE,2024-12-26 20:39
E001620,U001044,doc_delete,,06/10/2023 01:17,,Brave,macOS,,,2023-06-10 1:17
E003397,U002222,PAGE_VIEW,/billing,2024-11-23,desktop,Chrome,iOS,,FALSE,2024-11-23 6:02
E007496, U001542 ,integration_connect,,2024-04-13,mobile,Chrome,iOS,,FALSE,2024-04-13 21:05
 E000652,U001294,search,,10/10/2023 06:34,tablet,Brave,macOS,742,FALSE,2023-10-10 6:34
E002823, U001357 ,search,,2024-10-05 17:31,,Chrome,iOS,,FALSE,2024-10-05 17:31
E001498,U000042,share,,2024-02-01,mobile,Safari,iOS,unknown,FALSE,2024-02-01 20:18
E000045,U001130,login,/search,2024-02-29 9:32,mobile,Brave,,unknown,,2024-02-29 9:32
E003193,U001642,logout,/search,,tablet,Edge,,1466,TRUE,2024-03-19 1:36
E005149,u002566,share,,,tablet,,,1272,,2024-09-28 13:41
E000095,U001031,doc_edit,,01/09/2025 11:25,tablet,Firefox,Android,unknown,FALSE,2025-01-09 11:25
e002000,u001448,comment,,11/27/2024 17:33,DESKTOP,Chrome,,645,FALSE,2024-11-27 17:33
E003843,U001488,logout,/onboarding,,,Edge,,,,2024-02-25 7:19
E002540,U002484,comment,,07/02/2024 19:04,tablet,Edge,Linux,,,2024-07-02 19:04
E000290,U001205,search,,2023-10-14,,Safari,,1068,FALSE,2023-10-14 4:41
E001365,U001745,doc_create,,02/23/2023 17:32,,Chrome,macOS,unknown,TRUE,2023-02-23 17:32
E007303,U000075,export,,07/24/2024 11:03,,Brave,iOS,unknown,,2024-07-24 11:03
E006521,U001295,logout,/help,,DESKTOP,Brave,Android,42,,2024-05-20 0:48
E004561,U001676,doc_create,,2024-11-15,DESKTOP,,Android,,FALSE,2024-11-15 15:37
E003934,U001973,integration_connect,,2023-07-25,,Safari,Windows,,0,2023-07-25 10:33
E008751,U002121,integration_connect,,,mobile,Edge,Linux,,0,2025-01-02 15:51
E004254,U000615,logout,/billing,2025-05-25 6:41,mobile,Firefox,,407,FALSE,2025-05-25 6:41
E008012,U001906,doc_delete,,0000-00-00 00:00:00,desktop,Brave,Linux,,0,2025-06-03 6:51
E002896,u001489,login,/help,2024-04-05,tablet,,Linux,,0,2024-04-05 21:41
E004672,U000661,integration_error,,03/20/2024 17:55,mobile,Firefox,Android,,0,2024-03-20 17:55
E005199,U000286,integration_connect,,2024-03-02,,,iOS,,1,2024-03-02 2:55
E005806,U001018,login,/integrations,2023-02-27,mobile,Brave,iOS,,,2023-02-27 5:36
E000289,U000545,search,,01/07/2023 17:55,,,iOS,749,,2023-01-07 17:55
E004078,U002476,login,/admin,06/23/2023 23:31,,Brave,,,1,2023-06-23 23:31
E005724,U001046,doc_create,,,,,Windows,,,2023-07-11 22:22
E002651,U000193,doc_edit,,2024-08-05 6:05,DESKTOP,Chrome,Windows,,,2024-08-05 6:05
E000844,U002590,export,,2024-10-26,DESKTOP,Firefox,macOS,unknown,TRUE,2024-10-26 19:37
E005071,U001111,page_view,/billing,2024-12-03 6:15,,Edge,,1153,FALSE,2024-12-03 6:15
E000897,U001516,logout,/billing,2024-06-18,,Chrome,Android,,,2024-06-18 13:20
E005649, U001589 ,LOGIN,/dashboard,2024-04-30,mobile,Chrome,,,TRUE,2024-04-30 9:50
E005143,U001292,login,/help,2024-03-04,mobile,,Windows,1736,,2024-03-04 9:13
E004357,U002402,integration_connect,,,tablet,,,1148,TRUE,2023-11-01 14:42
E008111,U001949,login,/docs,2023-01-19,,,Linux,unknown,1,2023-01-19 8:23
E000739,U001261,export,,07/03/2023 18:23,DESKTOP,Edge,,unknown,0,2023-07-03 18:23
E008329,U000391,page_view,/admin,2025-04-23,,,,,1,2025-04-23 18:57
E005356, U000303 ,comment,,08/07/2024 12:52,mobile,Safari,,,FALSE,2024-08-07 12:52
E000368,U000875,integration_connect,,,DESKTOP,Chrome,Windows,,TRUE,2025-02-07 16:55
E000224,U000204,comment,,04/08/2023 14:16,,Edge,Linux,1727,1,2023-04-08 14:16
E001474,U000809,doc_edit,,,DESKTOP,Chrome,iOS,unknown,TRUE,2023-03-14 9:52
E000056,U001459,comment,,,,,Windows,,0,2024-03-30 19:59
E008484,USR-000221,export,,,,,iOS,,,2024-02-17 11:23
E000536,U001387,LOGOUT,/integrations,2023-02-07,DESKTOP,Chrome,,unknown,FALSE,2023-02-07 20:35
E007286,U001786,integration_connect,,2023-04-06,,Chrome,,1636,TRUE,2023-04-06 6:18
E006838,U001340,integration_error,,2023-12-09,tablet,Brave,,,,2023-12-09 19:00
E001531,U000633,login,/help,07/15/2024 18:47,mobile,,Android,,FALSE,2024-07-15 18:47
E008393,U000708,integration_error,,,DESKTOP,Safari,Windows,,,2023-03-13 0:04
E006967,U000869,integration_connect,,2024-06-11 9:41,,Firefox,iOS,unknown,0,2024-06-11 9:41
E002355,U000355,search,,10/07/2024 19:06,mobile,,,,,2024-10-07 19:06
E006331,U001046,export,,0000-00-00 00:00:00,,,iOS,,FALSE,2024-11-26 8:19
E005442,U000023,comment,,04/22/2023 08:50,DESKTOP,,Linux,,TRUE,2023-04-22 8:50
E001475,U000245,page_view,/pricing,07/10/2024 02:54,DESKTOP,Edge,iOS,654,,2024-07-10 2:54
E007217,U000114,page_view,/help,0000-00-00 00:00:00,,,Android,,TRUE,2024-07-09 15:54
E008578,U000833,login,/billing,01/28/2023 00:18,,Safari,Windows,,1,2023-01-28 0:18
E000681,U001438,doc_create,,04/09/2024 15:45,mobile,Brave,,unknown,1,2024-04-09 15:45
E005275,U000225,ai_search,,2024-05-25 20:22,,Edge,iOS,,0,2024-05-25 20:22
E005011,U000082,logout,/admin,2024-06-27,DESKTOP,,Windows,1270,,2024-06-27 8:52
E001366,U002123,integration_error,,,mobile,Brave,macOS,unknown,0,2024-07-08 19:03
E000483,U000626,ai_search,,10/17/2024 03:55,tablet,Edge,Android,unknown,FALSE,2024-10-17 3:55
e006477,U002313,logout,/admin,2024-07-24 3:42,,,macOS,,,2024-07-24 3:42
E004147,U001727,search,,03/14/2025 04:49,DESKTOP,Safari,iOS,unknown,,2025-03-14 4:49
E007977,U001207,doc_edit,,2023-06-04 0:56,,Safari,Linux,1138,FALSE,2023-06-04 0:56
E006840,U000108,ai_search,,2023-01-02 15:01,DESKTOP,Firefox,iOS,unknown,0,2023-01-02 15:01
E004128,U000846,page_view,/help,12/20/2023 14:12,,,Android,,,2023-12-20 14:12
E001006,U001599,ai_search,,2023-10-03,,Safari,iOS,unknown,1,2023-10-03 15:12
E005533,U001876,doc_delete,,10/17/2024 06:22,mobile,Safari,,,TRUE,2024-10-17 6:22
E008127,U002555,logout,/help,,desktop,Firefox,Windows,,1,2024-05-01 22:35
E007227,U000189,login,/billing,2023-06-30,mobile,Brave,,,TRUE,2023-06-30 6:20
E004509,U000322,export,,2025-06-07,mobile,Edge,iOS,,,2025-06-07 23:53
E006770,U000100,ai_search,,2023-06-21 19:36,tablet,Chrome,,,,2023-06-21 19:36
E005973,U000308,integration_error,,,,,Linux,,,2023-07-19 0:50
E003145,u002580,page_view,/integrations,06/27/2023 16:10,,Edge,Windows,unknown,,2023-06-27 16:10
E000346,U002298,doc_edit,,12/28/2023 10:11,desktop,,Android,unknown,FALSE,2023-12-28 10:11
E006808,U000535,share,,2024-08-24 10:54,,Firefox,Windows,,,2024-08-24 10:54
E004978,U001147,doc_edit,,2023-02-03 20:54,DESKTOP,Edge,,,,2023-02-03 20:54
E002209,U000423,logout,/dashboard,2023-08-14,,Firefox,macOS,,0,2023-08-14 23:25
E006829,U002468,page_view,/settings,2023-07-14 11:07,desktop,Firefox,,,,2023-07-14 11:07
E000224,U001947,search,,12/21/2024 11:29,DESKTOP,Firefox,Android,,TRUE,2024-12-21 11:29
E008793,U002041,ai_search,,2023-06-09,DESKTOP,Brave,Linux,1353,1,2023-06-09 9:19
E006339,U001848,comment,,11/12/2024 07:31,desktop,Chrome,Windows,1133,FALSE,2024-11-12 7:31
E000417,U000122,search,,05/19/2024 20:25,desktop,,,,TRUE,2024-05-19 20:25
E006535,U001757,doc_create,,2025-02-20,,,iOS,,FALSE,2025-02-20 11:50
E003594,U000887,doc_delete,,0000-00-00 00:00:00,desktop,,,unknown,,2025-01-17 23:12
E000372, U001741 ,doc_delete,,2025-04-25 4:00,,Firefox,Linux,1057,FALSE,2025-04-25 4:00
E000501,U001978,export,,2024-10-31,desktop,Safari,macOS,,FALSE,2024-10-31 19:57
E001058,U000738,page_view,/integrations,2023-09-24 5:59,DESKTOP,,iOS,1442,0,2023-09-24 5:59
E000385,U002256,logout,/help,02/07/2023 12:01,DESKTOP,Edge,Linux,unknown,TRUE,2023-02-07 12:01
E007234,U002416,comment,,2023-12-07,,Chrome,iOS,unknown,TRUE,2023-12-07 9:08
E006737,U000224,doc_edit,,0000-00-00 00:00:00,,,macOS,,,2024-01-30 14:44
E007122,U001948,comment,,05/20/2023 23:06,,Firefox,,,FALSE,2023-05-20 23:06
E004225, U000179 ,logout,/pricing,2025-03-23,mobile,Edge,Windows,,TRUE,2025-03-23 13:54
E002547,U001974,export,,2025-05-24 11:44,,Edge,Linux,,FALSE,2025-05-24 11:44
E006219,U000008,integration_error,,09/11/2023 19:38,,Edge,Android,,0,2023-09-11 19:38
E003154,U000830,logout,/dashboard,2024-07-22 6:54,tablet,,,,FALSE,2024-07-22 6:54
E005583,U001957,page_view,/help,07/21/2024 20:51,desktop,Chrome,,,FALSE,2024-07-21 20:51
E002903,U002489,search,,2023-04-12 17:56,tablet,Safari,Linux,,TRUE,2023-04-12 17:56
E003013,U002131,doc_delete,,2023-12-19,,Chrome,,unknown,FALSE,2023-12-19 23:07
E005246,U002428,search,,05/29/2025 11:02,DESKTOP,Firefox,macOS,,FALSE,2025-05-29 11:02
E007897,U000730,integration_connect,,2023-05-02,,,macOS,,TRUE,2023-05-02 8:00
E002235,u001422,integration_connect,,2024-12-27,mobile,,,,TRUE,2024-12-27 13:10
E007616,U001594,integration_error,,09/14/2024 03:47,tablet,,iOS,57,TRUE,2024-09-14 3:47
E008858,U001895,doc_delete,,2023-08-05 1:25,DESKTOP,Chrome,macOS,unknown,FALSE,2023-08-05 1:25
E003007,U001504,comment,,07/26/2023 11:33,,Firefox,Android,,,2023-07-26 11:33
E006698,U001969,share,,2023-06-09,desktop,Firefox,macOS,,,2023-06-09 2:56
E001097,U002436,doc_edit,,2024-08-20,mobile,Firefox,Windows,1436,,2024-08-20 11:41
E005958,U000572,search,,,mobile,Safari,Linux,,TRUE,2023-04-29 3:42
E008001,U002596,search,,2023-09-17 20:42,DESKTOP,Edge,Linux,unknown,FALSE,2023-09-17 20:42
E008881,U002459,doc_create,,0000-00-00 00:00:00,,,,652,0,2023-10-26 0:23
E008203,U000892,ai_search,,2023-01-05 23:45,tablet,,Android,,TRUE,2023-01-05 23:45
E003665,u000940,comment,,2024-12-18,DESKTOP,Safari,Android,unknown,,2024-12-18 1:57
E001950,U001331,ai_search,,,DESKTOP,Chrome,,,,2023-05-02 6:47
E001327,U002356,doc_create,,2023-02-19,,Safari,Windows,,TRUE,2023-02-19 5:50
E008195,U001661,share,,10/18/2024 11:34,desktop,,Android,unknown,TRUE,2024-10-18 11:34
E004664,U001474,ai_search,,2024-09-10 12:56,,,macOS,940,,2024-09-10 12:56
E008919,U000060,integration_connect,,,DESKTOP,Chrome,Linux,,1,2023-10-05 0:29
E005589,U002560,comment,,2025-01-05 2:53,tablet,Firefox,,unknown,,2025-01-05 2:53
E002503,U001664,doc_create,,2025-03-24,,Safari,Linux,,FALSE,2025-03-24 16:50
E008459,U001943,page_view,/billing,2024-07-28 0:37,tablet,Firefox,,unknown,TRUE,2024-07-28 0:37
E001639,U000162,doc_create,,07/14/2023 17:43,DESKTOP,Edge,Linux,,FALSE,2023-07-14 17:43
E001933,USR-002274,doc_delete,,0000-00-00 00:00:00,desktop,Edge,macOS,1639,1,2024-07-23 13:10
E001831,U002506,ai_search,,05/24/2025 06:12,tablet,,Windows,201,FALSE,2025-05-24 6:12
E001612,U001506,export,,04/11/2024 12:21,DESKTOP,,iOS,,FALSE,2024-04-11 12:21
E008244,U001127,search,,2024-09-21,tablet,Chrome,Android,,,2024-09-21 14:19
E002934,U001848,doc_create,,07/19/2023 02:56,,Safari,Android,,TRUE,2023-07-19 2:56
E002579,U000682,logout,/help,2025-01-23 9:25,mobile,Chrome,Android,1731,FALSE,2025-01-23 9:25
E004038,U000664,export,,2024-12-03 19:23,DESKTOP,Edge,Windows,unknown,FALSE,2024-12-03 19:23
E007671,U000331,ai_search,,04/22/2024 11:02,,Safari,Linux,,FALSE,2024-04-22 11:02
E005356,U001966,comment,,01/31/2023 13:01,tablet,Edge,,1138,FALSE,2023-01-31 13:01
E005201, U000369 ,doc_delete,,2023-12-21 0:35,DESKTOP,Chrome,,unknown,,2023-12-21 0:35
E002290,U000140,doc_create,,2025-04-03,desktop,,,unknown,0,2025-04-03 18:41
E007630,U001799,doc_delete,,04/26/2024 14:00,DESKTOP,Safari,Linux,,TRUE,2024-04-26 14:00
E006906, U001340 ,export,,,mobile,Brave,Windows,389,TRUE,2024-07-07 22:31
E007098,U000212,integration_error,,2025-04-21,,,,,TRUE,2025-04-21 20:43
E003954,U001611,ai_search,,2024-03-27,desktop,,iOS,,TRUE,2024-03-27 12:43
E008807,U000394,logout,/billing,09/26/2024 20:40,desktop,Brave,,1277,0,2024-09-26 20:40
E006060, U000242 ,search,,2024-09-05 7:58,mobile,Edge,Android,,TRUE,2024-09-05 7:58
E001523,U001725,doc_delete,,0000-00-00 00:00:00,mobile,,Android,unknown,TRUE,2024-09-30 21:31
E005877,U000257,integration_connect,,2024-01-31,desktop,Edge,macOS,,0,2024-01-31 11:04
E000622,USR-000806,page_view,/integrations,12/05/2023 01:36,mobile,Edge,Windows,126,TRUE,2023-12-05 1:36
E003036,U001092,search,,2024-05-30 22:29,tablet,Edge,macOS,,0,2024-05-30 22:29
 E008861,U001540,LOGIN,/admin,2023-02-08,,Safari,,,FALSE,2023-02-08 12:26
E000324,U002481,integration_error,,09/06/2024 22:11,mobile,,,unknown,FALSE,2024-09-06 22:11
E003700,U000990,login,/onboarding,2024-06-19,desktop,Brave,,,1,2024-06-19 4:56
E007401,U000651,ai_search,,0000-00-00 00:00:00,,Brave,,,FALSE,2024-03-20 10:29
E004886,U002491,export,,2024-09-19,,Brave,Android,,0,2024-09-19 18:32
E003805, U000627 ,share,,2025-03-17 23:17,tablet,Chrome,,unknown,TRUE,2025-03-17 23:17
E000951,U000342,doc_delete,,12/29/2024 10:03,desktop,,Windows,unknown,FALSE,2024-12-29 10:03
E002044,U001650,integration_error,,,,,Android,,TRUE,2023-08-02 5:50
E001103,U000495,doc_delete,,05/27/2024 13:50,DESKTOP,,,,FALSE,2024-05-27 13:50
E004320,U000725,login,/search,11/01/2023 14:15,,Edge,iOS,,FALSE,2023-11-01 14:15
E007217,U000780,doc_edit,,2024-11-26,DESKTOP,Chrome,Windows,,TRUE,2024-11-26 15:36
E004318,U001842,search,,2023-05-01,desktop,,iOS,unknown,0,2023-05-01 23:53
E008107,U000275,integration_error,,08/23/2023 12:38,mobile,Brave,Linux,606,FALSE,2023-08-23 12:38
E000975,U002177,login,/search,05/10/2025 04:17,tablet,Firefox,,,,2025-05-10 4:17
E002819,U000437,ai_search,,03/09/2025 04:09,tablet,Brave,Linux,unknown,FALSE,2025-03-09 4:09
E002607,U001824,export,,2024-01-03,,Brave,,,FALSE,2024-01-03 20:34
E008868,U001949,doc_create,,2024-05-01,DESKTOP,,macOS,,TRUE,2024-05-01 1:24
E005439,U001675,ai_search,,2024-06-27 4:41,desktop,Firefox,iOS,unknown,1,2024-06-27 4:41
E000260,U002596,login,/integrations,03/13/2023 18:39,DESKTOP,Firefox,,1795,TRUE,2023-03-13 18:39
E002621,U001325,ai_search,,2023-09-22,desktop,Brave,Linux,,,2023-09-22 23:31
E002977,U000406,ai_search,,03/24/2024 05:30,DESKTOP,,Android,,TRUE,2024-03-24 5:30
E007740,U000608,integration_error,,2023-07-01 20:14,tablet,Chrome,iOS,,TRUE,2023-07-01 20:14
e002117,U000844,doc_edit,,2023-09-09 22:23,desktop,Firefox,,unknown,FALSE,2023-09-09 22:23
E003840,U000247,export,,2024-06-01,,Safari,iOS,1440,,2024-06-01 3:49
e005068,U002419,comment,,,DESKTOP,Chrome,iOS,unknown,1,2024-05-10 21:14
E003187,U000683,ai_search,,2024-06-28 20:45,,Edge,Linux,,,2024-06-28 20:45
E006338,U001889,doc_edit,,11/09/2024 03:21,desktop,,Android,807,TRUE,2024-11-09 3:21
E006374,U002333,search,,2023-02-27,desktop,,Linux,1708,,2023-02-27 12:46
E001165,U000668,integration_connect,,04/20/2024 20:47,mobile,Firefox,Linux,,FALSE,2024-04-20 20:47
E001752,U000419,doc_edit,,2025-05-14,,Edge,iOS,1093,0,2025-05-14 5:05
e003150,U001096,doc_delete,,04/28/2023 20:32,DESKTOP,Brave,,unknown,TRUE,2023-04-28 20:32
E003235,U002322,comment,,2024-10-04 15:41,tablet,,,unknown,1,2024-10-04 15:41
E002889,U002178,doc_create,,02/11/2023 18:16,DESKTOP,Chrome,macOS,1646,,2023-02-11 18:16
E004613,U000130,login,/pricing,2023-08-30 12:41,DESKTOP,Firefox,,,TRUE,2023-08-30 12:41
E006762,U001517,LOGIN,/integrations,09/28/2024 01:54,,Firefox,Windows,432,FALSE,2024-09-28 1:54
E008646,u000109,search,,2023-11-30,mobile,Chrome,Windows,,FALSE,2023-11-30 21:57
E008172,U000450,integration_connect,,01/17/2024 06:53,DESKTOP,,iOS,,,2024-01-17 6:53
E006692,U002215,page_view,/help,02/06/2024 09:17,desktop,Edge,Linux,,TRUE,2024-02-06 9:17
E005061,U000159,login,/dashboard,2024-05-13,,Firefox,Windows,201,1,2024-05-13 5:59
E005967,U000878,page_view,/admin,11/12/2023 11:44,,Firefox,,,,2023-11-12 11:44
E006794,U002474,login,/dashboard,08/07/2024 21:58,tablet,Firefox,Android,,TRUE,2024-08-07 21:58
E000828,U000469,doc_edit,,05/05/2023 23:16,,Brave,,434,TRUE,2023-05-05 23:16
E004110,U001629,integration_connect,,,mobile,Edge,,365,TRUE,2025-04-24 21:20
E001379,u001135,ai_search,,2023-12-04,,,macOS,1091,,2023-12-04 4:12
E008703,U000180,page_view,/dashboard,,mobile,Edge,Android,,1,2023-09-08 0:57
E001856,U000861,doc_delete,,09/10/2023 17:20,mobile,Safari,Windows,,FALSE,2023-09-10 17:20
E005625,USR-001396,share,,2023-06-04,mobile,Safari,Linux,unknown,,2023-06-04 0:51
E000075,u000877,logout,/settings,,mobile,,iOS,unknown,TRUE,2024-08-31 10:07
E006399,U002373,ai_search,,2023-09-20 13:18,,Brave,,unknown,TRUE,2023-09-20 13:18
E004034,U002029,doc_edit,,2025-03-09,DESKTOP,,macOS,unknown,FALSE,2025-03-09 5:01
E007121,U001453,share,,2023-04-10,,Edge,Windows,,,2023-04-10 2:18
E006434,U001700,doc_delete,,2023-02-20,,Chrome,iOS,1306,,2023-02-20 8:07
E007841,U001580,ai_search,,2024-01-23,,,,951,FALSE,2024-01-23 16:25
E007678, U001415 ,export,,2023-07-21,desktop,Safari,Android,,,2023-07-21 13:05
E008841,U001548,comment,,2024-12-02 3:50,,Brave,macOS,unknown,TRUE,2024-12-02 3:50
E002653,U000072,doc_delete,,,mobile,Chrome,Linux,1356,,2024-03-19 15:15
E007256,U000049,page_view,/dashboard,12/26/2024 04:38,mobile,Edge,Windows,,TRUE,2024-12-26 4:38
E008965,U001029,export,,0000-00-00 00:00:00,DESKTOP,,Windows,,FALSE,2023-06-23 10:53
E008604,U001973,integration_connect,,12/11/2024 17:29,,Safari,Linux,73,1,2024-12-11 17:29
E008767,U000454,doc_edit,,02/06/2025 20:14,mobile,Firefox,,,,2025-02-06 20:14
E007962,U002451,export,,2025-05-23,,Brave,,unknown,TRUE,2025-05-23 14:23
E004591,U002497,doc_create,,06/05/2023 10:45,,,,1406,0,2023-06-05 10:45
E002970,U001805,login,/dashboard,2024-06-04 2:32,desktop,Firefox,macOS,unknown,,2024-06-04 2:32
E003384,U002277,share,,12/03/2024 05:01,,Edge,,1367,FALSE,2024-12-03 5:01
E008473,U002524,logout,/admin,2023-02-26 16:29,,Brave,Windows,unknown,TRUE,2023-02-26 16:29
E002432,U001574,doc_create,,01/12/2023 23:13,mobile,Chrome,iOS,,,2023-01-12 23:13
E000636,u002352,comment,,2023-05-03 11:42,mobile,,Linux,304,0,2023-05-03 11:42
E002334,U000506,export,,04/28/2024 04:36,,,,unknown,FALSE,2024-04-28 4:36
E006930,U000324,ai_search,,2023-02-04,mobile,Chrome,iOS,unknown,,2023-02-04 19:40
E006986,U000655,share,,,,Safari,,,TRUE,2024-06-07 0:23
E005109,U001130,comment,,2023-01-17,desktop,,macOS,,FALSE,2023-01-17 15:51
E008710,U002172,DOC_EDIT,,07/20/2024 07:02,,Firefox,,,FALSE,2024-07-20 7:02
E004178,U001377,doc_create,,2023-07-23,mobile,Brave,iOS,,1,2023-07-23 21:13
e001291,U001439,doc_delete,,2023-07-17 19:40,,Edge,Windows,unknown,,2023-07-17 19:40
E002128,U001864,ai_search,,2024-11-03 21:42,tablet,Brave,Android,1705,1,2024-11-03 21:42
E007811,U002231,search,,,DESKTOP,Firefox,,,TRUE,2023-03-20 23:20
E002038,U000833,export,,2025-05-15 11:34,mobile,Brave,,,,2025-05-15 11:34
E001521,U000997,doc_delete,,2024-08-14 19:07,tablet,,Windows,,FALSE,2024-08-14 19:07
E003032,U002099,logout,/pricing,2023-09-26,desktop,,,,,2023-09-26 0:52
E005185,U000316,doc_create,,2023-07-12,desktop,Firefox,,,0,2023-07-12 15:10
E006598,U000563,integration_error,,06/29/2024 18:19,,Brave,Linux,,0,2024-06-29 18:19
E000552,U001891,integration_connect,,,DESKTOP,Chrome,,unknown,0,2024-06-23 21:30
E007791,U002356,doc_create,,2024-12-22,,,Windows,,TRUE,2024-12-22 7:30
E000881,U001471,doc_edit,,10/18/2024 14:15,DESKTOP,Chrome,Windows,46,FALSE,2024-10-18 14:15
E002641,U001381,doc_delete,,08/27/2024 17:58,desktop,Firefox,Windows,,0,2024-08-27 17:58
E002406,U001031,search,,,DESKTOP,,Linux,,,2023-06-28 7:33
E002534,U001953,integration_connect,,09/07/2024 21:53,desktop,Chrome,iOS,,,2024-09-07 21:53
E004680,U001747,logout,/dashboard,11/20/2024 19:19,desktop,,,,0,2024-11-20 19:19
E007837,U001586,login,/billing,2023-02-11 12:08,desktop,Safari,,,,2023-02-11 12:08
E000687,U000108,integration_connect,,2025-06-10,DESKTOP,,macOS,323,TRUE,2025-06-10 5:06
E007159,U002566,search,,2023-12-16,desktop,Firefox,Windows,,FALSE,2023-12-16 18:00
E008228,U000949,integration_connect,,2025-02-08 15:11,,Firefox,Android,unknown,TRUE,2025-02-08 15:11
E001609,U002388,page_view,/docs,2024-01-30 16:09,desktop,Edge,Android,unknown,,2024-01-30 16:09
E005674,U001822,INTEGRATION_ERROR,,05/21/2024 04:43,,Edge,Linux,unknown,FALSE,2024-05-21 4:43
E006357,U000044,doc_edit,,2023-10-21 19:15,DESKTOP,,iOS,unknown,1,2023-10-21 19:15
E002798,U000551,logout,/settings,2024-02-13 21:08,DESKTOP,Firefox,iOS,,0,2024-02-13 21:08
E007856,U001613,doc_edit,,07/03/2024 04:27,,Brave,iOS,,1,2024-07-03 4:27
 E008111,U002247,share,,12/28/2023 04:23,,Edge,Android,1260,,2023-12-28 4:23
E005257,U000130,login,/search,2023-11-02 15:41,,,macOS,unknown,,2023-11-02 15:41
E008855,U001574,logout,/help,,tablet,,iOS,1677,0,2024-08-23 7:36
E006432,U001840,ai_search,,2024-12-28,,Brave,iOS,,0,2024-12-28 12:48
E001949, U001944 ,page_view,/search,2025-05-24 13:41,DESKTOP,Edge,,,,2025-05-24 13:41
E004272,U000794,logout,/pricing,2025-06-10 21:39,mobile,Firefox,Windows,1280,,2025-06-10 21:39
E008704,U002473,page_view,/integrations,,mobile,Brave,,,,2023-10-16 1:26
E001751,U001143,doc_edit,,2024-05-24 21:51,tablet,Chrome,iOS,,TRUE,2024-05-24 21:51
E000547,U001806,share,,2023-10-07 23:25,tablet,Brave,Linux,,,2023-10-07 23:25
E001569,U000870,doc_edit,,,mobile,Chrome,Android,,,2025-04-02 5:14
E007389,U002363,comment,,2024-10-31 5:31,,,iOS,unknown,,2024-10-31 5:31
E007262,U002450,doc_delete,,2023-08-17,,Safari,,,,2023-08-17 0:38
E006089,usr-000771,comment,,04/04/2025 15:06,mobile,,iOS,unknown,0,2025-04-04 15:06
E001047,U000287,DOC_EDIT,,2024-06-27 17:05,desktop,Brave,macOS,,FALSE,2024-06-27 17:05
E008822,U001192,search,,2024-11-10,,Edge,iOS,,FALSE,2024-11-10 6:09
 E003196,U000334,page_view,/settings,03/25/2023 17:12,,Safari,Android,unknown,FALSE,2023-03-25 17:12
E007716,U000973,integration_connect,,2023-02-09 18:39,tablet,Chrome,Android,unknown,FALSE,2023-02-09 18:39
E004321,U000970,integration_connect,,2023-10-14 7:55,,Brave,iOS,unknown,,2023-10-14 7:55
E007963,U001961,comment,,2023-08-07 10:47,mobile,,,,1,2023-08-07 10:47
E004773, U002447 ,integration_connect,,2024-09-08 1:27,DESKTOP,Safari,,unknown,1,2024-09-08 1:27
E007451,U002581,integration_connect,,2025-05-02,,Chrome,Linux,,,2025-05-02 6:57
e004654,U000963,ai_search,,12/24/2023 10:32,DESKTOP,Firefox,Android,unknown,,2023-12-24 10:32
E007545,U000458,integration_error,,07/30/2023 19:38,tablet,Brave,Android,188,1,2023-07-30 19:38
E000478,U000314,doc_delete,,,DESKTOP,Safari,,1339,1,2023-11-01 2:44
E004664,U000670,login,/admin,01/02/2024 06:18,,Edge,,unknown,FALSE,2024-01-02 6:18
E006578,U001895,page_view,/dashboard,2023-11-21 7:04,tablet,,Android,unknown,1,2023-11-21 7:04
E004999,U002342,INTEGRATION_ERROR,,2023-08-06 15:29,DESKTOP,,Android,unknown,1,2023-08-06 15:29
E000978,U001291,ai_search,,06/08/2025 21:06,DESKTOP,Chrome,Windows,,0,2025-06-08 21:06
E002797,U000393,integration_connect,,09/21/2024 02:50,DESKTOP,Firefox,iOS,,TRUE,2024-09-21 2:50
E001333,U000166,share,,2024-11-11 12:35,tablet,Firefox,Windows,,FALSE,2024-11-11 12:35
E000232,U000344,login,/docs,09/18/2024 02:47,,Chrome,,,1,2024-09-18 2:47
E005066,U000808,ai_search,,02/23/2025 13:36,DESKTOP,,,,TRUE,2025-02-23 13:36
E003082,U000913,logout,/search,2024-05-26 23:32,mobile,Firefox,,518,1,2024-05-26 23:32
E002155,U002504,doc_delete,,11/09/2024 02:28,mobile,Brave,,,FALSE,2024-11-09 2:28
E005053,U000681,doc_create,,04/01/2023 01:00,desktop,Firefox,iOS,,,2023-04-01 1:00
E000201,U001533,logout,/pricing,09/21/2023 07:30,,Chrome,,,FALSE,2023-09-21 7:30
E000242,USR-001340,ai_search,,2024-10-23,desktop,Brave,Linux,,FALSE,2024-10-23 17:29
E000885,U000050,comment,,2024-09-18 16:49,mobile,Safari,Windows,,0,2024-09-18 16:49
E001677,U001739,AI_SEARCH,,06/23/2024 09:36,mobile,Firefox,Windows,165,FALSE,2024-06-23 9:36
 E007823, U002256 ,login,/billing,,,Firefox,macOS,,0,2024-10-20 9:18
 E001468,U001242,share,,2023-01-05,desktop,Safari,,,FALSE,2023-01-05 23:43
E003857,U000240,login,/onboarding,2024-06-26,desktop,Brave,Android,1066,TRUE,2024-06-26 4:51
E005672,U002564,export,,01/04/2024 23:23,desktop,Firefox,iOS,unknown,,2024-01-04 23:23
E004343,U001497,integration_error,,0000-00-00 00:00:00,mobile,,,unknown,FALSE,2023-11-04 21:41
E005287,U002256,logout,/pricing,2023-08-20,desktop,Safari,,unknown,TRUE,2023-08-20 22:55
E000785,U002464,login,/integrations,04/21/2023 13:25,,Edge,Android,unknown,FALSE,2023-04-21 13:25
E000023,U000800,integration_connect,,06/02/2025 13:55,DESKTOP,Edge,Android,,1,2025-06-02 13:55
E006381,U001231,ai_search,,05/23/2024 07:50,DESKTOP,Edge,macOS,,,2024-05-23 7:50
E000470,U002548,COMMENT,,2023-11-04,mobile,Edge,Android,1750,0,2023-11-04 1:00
E005484,U002502,share,,2023-11-06 20:43,desktop,Safari,,unknown,1,2023-11-06 20:43
E001408,U001840,page_view,/pricing,05/27/2025 01:04,DESKTOP,,Linux,67,0,2025-05-27 1:04
E002645,U002377,doc_delete,,03/04/2023 12:59,,Firefox,Linux,,TRUE,2023-03-04 12:59
E001159,U000409,integration_connect,,2024-01-13,mobile,Firefox,Linux,,1,2024-01-13 15:55
E000995,U000774,doc_edit,,,desktop,Safari,macOS,,0,2024-02-14 12:07
E000231,U000958,ai_search,,2023-01-12 3:08,,,Windows,,TRUE,2023-01-12 3:08
E000883,U000422,SHARE,,,DESKTOP,Firefox,Windows,,TRUE,2024-05-22 13:18
E008250,U001590,export,,2024-11-19,,Edge,Android,,FALSE,2024-11-19 11:18
E004020,U002557,login,/admin,2023-08-08,,,Windows,,TRUE,2023-08-08 16:00
E001867,U002393,doc_create,,,mobile,Firefox,Linux,,TRUE,2024-09-26 18:58
E000659,U001826,logout,/billing,03/31/2024 05:03,,,Android,,FALSE,2024-03-31 5:03
E006489,U000454,doc_create,,,tablet,Chrome,Linux,unknown,TRUE,2023-04-16 12:54
E000055,U002277,search,,2024-10-09,desktop,Edge,macOS,,TRUE,2024-10-09 2:09
E000672,U001363,doc_create,,2024-08-30 12:07,desktop,Firefox,Linux,,TRUE,2024-08-30 12:07
E008709,U002099,logout,/admin,0000-00-00 00:00:00,tablet,Edge,Linux,,0,2023-05-03 7:13
E005690,U000835,doc_create,,2023-10-03,tablet,,iOS,unknown,TRUE,2023-10-03 14:16
E005103,U001081,page_view,/integrations,03/25/2024 11:30,,Safari,,,TRUE,2024-03-25 11:30
E003620,U001039,search,,2024-04-25 20:58,DESKTOP,Edge,Linux,,FALSE,2024-04-25 20:58
e005579,U002326,doc_edit,,2023-02-07 23:01,tablet,,Linux,unknown,,2023-02-07 23:01
E005186,U000120,doc_edit,,,desktop,Chrome,macOS,601,TRUE,2024-09-06 19:54
E000117,U000259,export,,2024-01-28,desktop,,,,0,2024-01-28 6:33
E000766,U001766,doc_delete,,07/25/2024 21:13,mobile,Brave,iOS,,1,2024-07-25 21:13
E000653,U001515,login,/pricing,,,,macOS,unknown,,2024-11-03 17:01
E008075,U001004,doc_edit,,06/09/2023 05:42,tablet,,,unknown,FALSE,2023-06-09 5:42
E008677,U000523,integration_connect,,2025-03-14 20:07,desktop,Firefox,,363,TRUE,2025-03-14 20:07
E008469,U000811,search,,08/17/2023 15:20,tablet,Brave,Android,,FALSE,2023-08-17 15:20
E006291,U000093,ai_search,,,desktop,Safari,iOS,,FALSE,2024-04-22 14:07
E000819,U000423,search,,2023-08-26,tablet,,,808,,2023-08-26 8:43
E004359,U000659,integration_error,,0000-00-00 00:00:00,mobile,,,318,FALSE,2023-11-27 13:01
E003925,U001424,integration_error,,2023-04-25 10:30,,Edge,iOS,unknown,1,2023-04-25 10:30
E001760,U001468,doc_edit,,2024-12-14,tablet,Edge,,unknown,TRUE,2024-12-14 12:18
E003430,U001455,login,/integrations,01/11/2025 21:11,tablet,Edge,Linux,,,2025-01-11 21:11
E006726,U000547,integration_error,,2023-10-29,mobile,,Android,unknown,TRUE,2023-10-29 11:59
E007447,U000442,ai_search,,2023-07-30,mobile,Edge,iOS,959,TRUE,2023-07-30 23:44
E004197,U002114,login,/search,12/26/2023 14:46,tablet,Chrome,iOS,,1,2023-12-26 14:46
E008405,U000863,doc_delete,,07/03/2024 00:06,mobile,Firefox,,982,FALSE,2024-07-03 0:06
E000826,U001623,doc_create,,,desktop,Edge,macOS,,TRUE,2023-10-30 5:12
E001374,U002466,comment,,09/05/2023 13:35,desktop,,iOS,,TRUE,2023-09-05 13:35
E006531,u002542,page_view,/dashboard,2023-12-15,mobile,Firefox,,unknown,1,2023-12-15 5:58
E001810,U002545,page_view,/admin,0000-00-00 00:00:00,desktop,Safari,Android,unknown,0,2024-02-26 23:07
E001741,U002109,search,,05/11/2023 05:01,tablet,,Linux,,,2023-05-11 5:01
E004211,USR-000911,page_view,/admin,,DESKTOP,,Windows,,TRUE,2025-05-30 21:39
E005520,U002457,login,/search,2023-04-08,,,macOS,unknown,,2023-04-08 10:02
E004418,U001249,comment,,2024-02-10 15:17,mobile,Chrome,macOS,,1,2024-02-10 15:17
E003138,U000634,search,,2023-04-01 14:06,desktop,Firefox,Windows,,0,2023-04-01 14:06
E001272,U000405,integration_connect,,03/20/2023 00:06,DESKTOP,,iOS,,,2023-03-20 0:06
E001329, U001679 ,doc_delete,,2025-06-15 3:49,desktop,Safari,Linux,1442,FALSE,2025-06-15 3:49
e004213,U001912,doc_create,,07/30/2024 18:15,tablet,,Android,,FALSE,2024-07-30 18:15
E001305,U001075,search,,2024-03-19,,Chrome,iOS,,TRUE,2024-03-19 8:39
E001431,U000430,logout,/billing,2024-08-20,,,macOS,unknown,0,2024-08-20 7:03
E003158,U002180,integration_error,,2024-07-25 10:11,,,Windows,unknown,,2024-07-25 10:11
E001943,U001516,search,,2023-12-22 10:41,desktop,,Linux,unknown,,2023-12-22 10:41
E005429,U001905,integration_error,,2025-01-25,,Safari,,,0,2025-01-25 17:59
E003792,U002024,comment,,2023-06-12,tablet,Chrome,macOS,unknown,TRUE,2023-06-12 12:44
E000754, U001636 ,search,,2023-01-17 5:11,mobile,Brave,iOS,101,TRUE,2023-01-17 5:11
e006197,U002320,doc_delete,,12/20/2023 13:14,tablet,Firefox,,unknown,FALSE,2023-12-20 13:14
E007390,U002365,logout,/admin,2025-03-07,tablet,,iOS,,0,2025-03-07 23:17
E000832, U000778 ,login,/pricing,2023-03-24,DESKTOP,Brave,Android,,TRUE,2023-03-24 0:48
E006893,U000694,integration_connect,,2023-02-03 6:28,DESKTOP,Chrome,Windows,,0,2023-02-03 6:28
E004899,U001481,doc_delete,,10/18/2024 12:25,tablet,Edge,Windows,,FALSE,2024-10-18 12:25
E001568,U000757,search,,2023-08-02,mobile,Firefox,,unknown,TRUE,2023-08-02 9:15
E001498, U000548 ,doc_edit,,2025-03-09 2:25,,Firefox,macOS,unknown,FALSE,2025-03-09 2:25
E002199,U002555,search,,2024-02-26,,Firefox,Windows,unknown,TRUE,2024-02-26 8:17
E003639,U000012,share,,2024-06-14,mobile,Edge,Windows,,,2024-06-14 5:41
E001945,U002329,ai_search,,05/01/2023 14:14,,Safari,,unknown,1,2023-05-01 14:14
E005671,U000280,ai_search,,2024-03-17,tablet,Firefox,,unknown,,2024-03-17 15:09
E001040,U000590,integration_connect,,2023-08-10 1:11,tablet,,macOS,,1,2023-08-10 1:11
E007443,U002486,comment,,0000-00-00 00:00:00,,Chrome,Linux,478,1,2023-05-27 11:36
E000950,U001611,integration_connect,,2025-01-01,DESKTOP,Safari,,,,2025-01-01 19:54
E005256,U002376,ai_search,,,DESKTOP,Brave,Windows,,1,2023-11-02 5:13
E000797,USR-001332,comment,,04/25/2024 07:00,DESKTOP,Safari,,unknown,FALSE,2024-04-25 7:00
E007633,U001741,ai_search,,0000-00-00 00:00:00,,Firefox,Windows,,1,2025-03-06 6:50
E004776,U000781,INTEGRATION_ERROR,,04/06/2024 16:55,,Edge,Linux,unknown,TRUE,2024-04-06 16:55
E006720,U001732,doc_delete,,04/16/2025 17:20,desktop,,Linux,unknown,FALSE,2025-04-16 17:20
E002794,U001688,login,/integrations,09/26/2023 23:59,desktop,Edge,,,,2023-09-26 23:59
 E000521,u000865,comment,,04/30/2023 08:25,tablet,Firefox,,894,FALSE,2023-04-30 8:25
E006682,U000561,login,/integrations,11/14/2023 18:33,desktop,,Linux,1087,TRUE,2023-11-14 18:33
E000557,U001559,ai_search,,2023-02-07 18:38,DESKTOP,Firefox,,,TRUE,2023-02-07 18:38
E003988,U002042,login,/billing,2024-10-18,DESKTOP,Brave,Windows,unknown,,2024-10-18 20:50
E007453,U000834,ai_search,,11/02/2023 16:04,tablet,Edge,macOS,,1,2023-11-02 16:04
E005198,U000109,login,/dashboard,2024-12-27 5:21,mobile,Safari,macOS,,,2024-12-27 5:21
 E007763,U000622,integration_connect,,2025-03-24,tablet,Firefox,Windows,1637,FALSE,2025-03-24 23:44
E004312,U000023,integration_error,,,,,Android,,FALSE,2023-08-06 15:06
E002057,U001435,integration_error,,0000-00-00 00:00:00,tablet,,macOS,unknown,,2023-06-09 22:39
E001039,USR-000886,export,,2023-03-18,,Firefox,Android,unknown,TRUE,2023-03-18 20:11
E002408,U001136,SEARCH,,2023-06-19,mobile,,Android,1282,FALSE,2023-06-19 12:07
E002756,U002283,doc_create,,2025-01-22,,,,unknown,1,2025-01-22 19:34
E001130,U002192,share,,0000-00-00 00:00:00,,Edge,Linux,unknown,TRUE,2023-11-03 21:23
E000044,U002216,comment,,11/18/2023 06:43,,Firefox,macOS,,,2023-11-18 6:43
E002234,U000437,doc_edit,,2023-03-22,,,Windows,unknown,1,2023-03-22 1:51
E006985, U000718 ,doc_create,,2025-06-09 23:49,,Firefox,Android,,0,2025-06-09 23:49
E005244,U000196,login,/docs,2024-08-09,desktop,Safari,,716,FALSE,2024-08-09 2:07
E006521,U000117,comment,,03/04/2023 19:37,,Brave,macOS,1036,TRUE,2023-03-04 19:37
E005433,U001363,share,,,DESKTOP,Brave,Android,unknown,FALSE,2023-09-30 0:30
E004483,U000430,logout,/admin,07/08/2023 08:00,,Edge,macOS,,0,2023-07-08 8:00
E007491,U002022,login,/pricing,05/01/2024 16:07,mobile,,macOS,1459,0,2024-05-01 16:07
E000297,U000341,integration_connect,,,,Safari,iOS,93,0,2025-06-09 7:29
E005234,U000814,ai_search,,05/06/2023 18:35,,,,unknown,0,2023-05-06 18:35
E008619,U000431,integration_connect,,03/24/2024 17:20,DESKTOP,Firefox,Linux,,FALSE,2024-03-24 17:20
E002977,U001709,login,/dashboard,2024-09-16,desktop,Chrome,,,FALSE,2024-09-16 8:43
E008564,U001724,doc_delete,,2024-02-27,,,,1671,TRUE,2024-02-27 12:30
E001690,U001625,integration_connect,,06/13/2024 14:27,,Edge,macOS,unknown,FALSE,2024-06-13 14:27
E006501,U001465,integration_connect,,12/05/2024 23:35,,,Windows,,,2024-12-05 23:35
E008061,U001498,ai_search,,2023-07-15 2:20,,Brave,iOS,136,TRUE,2023-07-15 2:20
E008146,U002487,share,,07/10/2024 13:36,,Edge,Android,77,FALSE,2024-07-10 13:36
E004615,U000880,export,,01/16/2023 15:17,,,iOS,928,TRUE,2023-01-16 15:17
 E000287,U000923,logout,/onboarding,04/29/2025 08:41,desktop,Safari,Windows,,1,2025-04-29 8:41
E005412,U000006,share,,2024-10-25 9:17,,,,,,2024-10-25 9:17
E003339,U000983,login,/settings,2024-11-25 15:09,DESKTOP,Chrome,,,FALSE,2024-11-25 15:09
E003985,U000038,login,/billing,2024-07-06,,Brave,Windows,,TRUE,2024-07-06 17:26
E002325,U001904,search,,,mobile,Brave,Linux,unknown,FALSE,2023-05-04 4:49
E003631,U001313,comment,,06/24/2023 07:56,DESKTOP,Firefox,Android,unknown,FALSE,2023-06-24 7:56
E000429, U001292 ,logout,/settings,2024-01-22 23:26,,,,unknown,FALSE,2024-01-22 23:26
E008798,U001020,integration_connect,,2023-08-09 19:54,DESKTOP,Firefox,Android,841,,2023-08-09 19:54
E001005,U000874,login,/help,2023-03-30,desktop,Firefox,Linux,,,2023-03-30 5:36
E005162,U001815,doc_edit,,2023-08-02 13:41,tablet,Chrome,iOS,,FALSE,2023-08-02 13:41
E006325,U000300,comment,,2025-02-10 6:33,tablet,,Linux,,,2025-02-10 6:33
E007697,U001373,search,,03/04/2024 13:03,tablet,,Android,,FALSE,2024-03-04 13:03
E004712,U001204,comment,,2025-03-15,desktop,Brave,,,TRUE,2025-03-15 15:22
E004431,U001657,share,,05/27/2024 15:28,desktop,Safari,,unknown,FALSE,2024-05-27 15:28
E005540,U000604,doc_delete,,04/23/2023 16:50,tablet,Brave,Linux,729,TRUE,2023-04-23 16:50
E008876,U001908,comment,,2025-03-11 15:44,mobile,,Windows,1197,FALSE,2025-03-11 15:44
E002337,U000159,logout,/admin,12/04/2023 23:03,DESKTOP,Chrome,Linux,,1,2023-12-04 23:03
e007096,U000183,integration_error,,2024-03-26,DESKTOP,Safari,Android,,0,2024-03-26 8:15
E003853,U001522,share,,2025-01-06,DESKTOP,Safari,macOS,,0,2025-01-06 20:04
E002030,U000023,login,/onboarding,2024-06-06 6:12,desktop,Brave,Linux,,FALSE,2024-06-06 6:12
E001620,U000429,doc_delete,,2023-01-23 11:02,,,iOS,unknown,TRUE,2023-01-23 11:02
E001539,U000405,doc_edit,,11/12/2023 23:46,DESKTOP,Chrome,Windows,unknown,,2023-11-12 23:46
E002497,U000109,ai_search,,06/08/2023 09:28,tablet,Edge,Windows,unknown,FALSE,2023-06-08 9:28
E001676, U001663 ,DOC_CREATE,,2024-10-23 23:40,DESKTOP,Chrome,macOS,,0,2024-10-23 23:40
E008572,U000590,integration_connect,,2023-01-03 14:47,DESKTOP,Safari,iOS,,0,2023-01-03 14:47
E003171,U000619,search,,03/03/2024 06:54,,,Windows,43,,2024-03-03 6:54
E001113,U000043,share,,0000-00-00 00:00:00,desktop,,Linux,,TRUE,2024-11-14 11:30
E005944,U001910,doc_edit,,2024-09-08,DESKTOP,Edge,Linux,unknown,,2024-09-08 4:51
E007348,U000053,comment,,2023-05-04,DESKTOP,Chrome,,,,2023-05-04 20:05
E003702,U001747,page_view,/search,09/02/2024 02:12,desktop,,,,,2024-09-02 2:12
E003397,U000524,doc_create,,2024-08-25 22:34,,Brave,Linux,,,2024-08-25 22:34
E006938,U000803,integration_connect,,,tablet,Edge,Windows,,0,2023-05-30 20:12
E004030,U002595,search,,12/06/2023 04:51,mobile,Safari,Linux,unknown,0,2023-12-06 4:51
E006626,u000073,doc_create,,04/27/2023 02:55,DESKTOP,,Windows,,FALSE,2023-04-27 2:55
E002546,U001185,comment,,2023-04-28,tablet,Chrome,Linux,298,TRUE,2023-04-28 13:52
E001908, U002355 ,logout,/admin,,desktop,Firefox,Linux,1291,0,2023-03-31 8:05
E001336,U000076,doc_delete,,2024-08-12,DESKTOP,Edge,Android,,1,2024-08-12 3:44
E005671, u001921 ,doc_delete,,03/10/2024 15:52,desktop,Chrome,iOS,130,0,2024-03-10 15:52
E000910,U000234,doc_delete,,11/13/2024 07:24,desktop,Firefox,iOS,,FALSE,2024-11-13 7:24
E000493, U001393 ,comment,,2023-03-05,,Safari,Android,,FALSE,2023-03-05 4:54
E006350,U000166,share,,08/12/2024 22:26,tablet,Brave,iOS,,TRUE,2024-08-12 22:26
E007654, U000018 ,comment,,05/07/2023 22:13,desktop,Edge,Windows,unknown,FALSE,2023-05-07 22:13
E005583,U001072,page_view,/integrations,2023-08-23,,Brave,iOS,648,TRUE,2023-08-23 20:46
E002879,U000852,logout,/pricing,03/16/2023 01:53,desktop,,Linux,unknown,FALSE,2023-03-16 1:53
E005886,U001978,doc_create,,2025-01-20,desktop,Brave,,1165,1,2025-01-20 21:39
E001107,U002054,export,,0000-00-00 00:00:00,desktop,,Windows,,,2023-06-02 18:16
E005528,U002485,doc_create,,,,Safari,,,1,2024-07-10 7:29
E005028,U000988,doc_delete,,2023-01-08,tablet,,,unknown,FALSE,2023-01-08 18:16
E005967,U001779,page_view,/docs,0000-00-00 00:00:00,,,Android,,FALSE,2024-05-31 6:11
E001175,U001009,search,,07/22/2023 21:24,,Safari,,unknown,,2023-07-22 21:24
E000059,U001241,doc_edit,,2025-03-26 1:02,DESKTOP,Brave,Linux,,,2025-03-26 1:02
E006072,U001411,search,,2025-01-19 11:06,,,macOS,unknown,,2025-01-19 11:06
E003297,U000326,doc_edit,,,tablet,Firefox,iOS,1295,FALSE,2023-03-26 15:30
E005036,U001710,doc_edit,,2023-10-15 18:23,mobile,Chrome,Linux,,,2023-10-15 18:23
 E001855,U000963,integration_connect,,2023-06-30,tablet,,,1476,,2023-06-30 16:11
E008175,u001852,login,/search,2023-09-23,desktop,Chrome,Linux,,0,2023-09-23 16:44
E008332,U000823,logout,/help,10/16/2023 04:46,desktop,Chrome,Linux,,TRUE,2023-10-16 4:46
E007757, U000838 ,doc_delete,,03/10/2025 00:11,,,Android,,1,2025-03-10 0:11
E000195,U001993,doc_delete,,2024-07-05 1:59,mobile,,Windows,,1,2024-07-05 1:59
E005320,U002418,doc_edit,,10/11/2024 18:45,tablet,Chrome,Windows,1597,FALSE,2024-10-11 18:45
E005758,U002424,share,,2025-05-11 2:00,tablet,Chrome,Android,804,TRUE,2025-05-11 2:00
E002165,U000661,integration_connect,,2024-12-18 23:39,DESKTOP,Safari,,168,FALSE,2024-12-18 23:39
E000437,U002457,COMMENT,,0000-00-00 00:00:00,desktop,Edge,,,,2023-05-10 14:28
E003885,U001841,integration_error,,07/20/2024 00:44,mobile,,,unknown,1,2024-07-20 0:44
E003716,U000872,comment,,,DESKTOP,,Windows,534,FALSE,2024-10-08 3:13
E005289,U001114,doc_edit,,2023-04-23,DESKTOP,Chrome,iOS,unknown,0,2023-04-23 4:44
E008358,U000889,export,,03/12/2023 16:58,,,Android,unknown,0,2023-03-12 16:58
E004596,U001192,logout,/search,2024-05-15 19:18,,Chrome,Linux,unknown,TRUE,2024-05-15 19:18
E007646,U002443,doc_edit,,2025-01-21,tablet,Safari,Android,1484,TRUE,2025-01-21 5:54
 E001847,U002396,integration_error,,2023-10-25 15:25,desktop,Firefox,,,1,2023-10-25 15:25
E004206,U001891,page_view,/docs,11/29/2023 06:21,DESKTOP,Firefox,macOS,529,0,2023-11-29 6:21
 E006978,u001675,integration_error,,10/18/2024 06:47,desktop,Edge,Android,,1,2024-10-18 6:47
E006659,U002171,login,/onboarding,04/23/2025 08:22,,,iOS,,FALSE,2025-04-23 8:22
E008790,U001455,login,/integrations,2024-12-03,DESKTOP,,macOS,69,FALSE,2024-12-03 15:18
E006802,U001429,search,,2024-08-10,desktop,Edge,,,,2024-08-10 14:00
E006305,U001508,doc_delete,,,mobile,,,,TRUE,2024-07-16 19:19
E000345,U001623,SEARCH,,2024-11-05 22:58,,,Android,,TRUE,2024-11-05 22:58
E005758,U001081,integration_connect,,05/08/2024 03:03,tablet,Edge,iOS,,,2024-05-08 3:03
E000851,U002384,login,/docs,2024-08-18 20:18,DESKTOP,,iOS,,,2024-08-18 20:18
E002672,U001008,search,,08/16/2024 01:14,,Safari,Android,,TRUE,2024-08-16 1:14
E008972,U002152,export,,05/03/2024 19:10,DESKTOP,Chrome,,,,2024-05-03 19:10
E006894, U002176 ,page_view,/dashboard,,,Edge,Windows,1216,0,2023-02-08 8:43
E008078,U002095,share,,06/07/2025 00:05,desktop,Brave,iOS,278,FALSE,2025-06-07 0:05
E006725,U002050,doc_delete,,2024-08-19 9:30,desktop,Brave,Android,,FALSE,2024-08-19 9:30
E002758,U001314,page_view,/search,2023-11-19 11:42,mobile,Safari,,,FALSE,2023-11-19 11:42
E002683,u001670,logout,/docs,08/01/2024 22:38,mobile,Edge,macOS,unknown,,2024-08-01 22:38
E008840,U001177,share,,2025-03-20 1:51,,Chrome,Linux,unknown,TRUE,2025-03-20 1:51
E007804,u002328,share,,2023-11-10 6:50,mobile,Firefox,macOS,,FALSE,2023-11-10 6:50
E007670,U002309,doc_edit,,09/25/2024 12:50,,Firefox,,1752,TRUE,2024-09-25 12:50
E001402,U002418,login,/admin,10/21/2023 06:37,desktop,Safari,iOS,,0,2023-10-21 6:37
E006464,U001955,page_view,/admin,2023-03-29 21:47,desktop,Firefox,Windows,,TRUE,2023-03-29 21:47
E002246,U002538,doc_edit,,2023-01-21 10:49,,Edge,,1607,TRUE,2023-01-21 10:49
E007858,U001373,doc_delete,,,DESKTOP,Firefox,macOS,,,2024-05-01 5:55
E004762,U000610,ai_search,,2023-05-12 3:55,mobile,Chrome,Linux,,FALSE,2023-05-12 3:55
E006591,U002405,page_view,/dashboard,2023-05-02 3:15,tablet,Edge,Android,491,FALSE,2023-05-02 3:15
E004607,U000189,integration_error,,05/08/2024 15:51,mobile,Edge,macOS,,FALSE,2024-05-08 15:51
E001085,U002027,integration_error,,2023-11-11 19:42,DESKTOP,,,unknown,TRUE,2023-11-11 19:42
E000448,U002503,export,,2024-12-31 2:06,mobile,Chrome,,216,TRUE,2024-12-31 2:06
E002692,U000630,search,,2024-05-03,,,,,FALSE,2024-05-03 16:36
E001537,U000328,export,,2025-04-03,,,Linux,,,2025-04-03 9:15
E005921,U002221,logout,/integrations,07/24/2024 09:01,tablet,,,,0,2024-07-24 9:01
E008949,U002011,search,,2023-06-28 13:58,mobile,Brave,iOS,,FALSE,2023-06-28 13:58
E003411,U001159,logout,/onboarding,11/12/2023 12:24,mobile,Firefox,iOS,unknown,0,2023-11-12 12:24
E000906,U002305,share,,2023-05-26,mobile,Chrome,Linux,,0,2023-05-26 12:49
E005875, U000989 ,logout,/integrations,09/26/2024 02:55,DESKTOP,Safari,Windows,,,2024-09-26 2:55
E006867,U001610,integration_error,,07/18/2024 21:27,,Brave,Linux,unknown,FALSE,2024-07-18 21:27
E005423,U000598,ai_search,,2025-05-16 23:06,,Firefox,iOS,unknown,FALSE,2025-05-16 23:06
E004582,U001966,doc_edit,,05/19/2025 00:31,,,iOS,unknown,TRUE,2025-05-19 0:31
E008904,U000963,login,/settings,2023-11-04 7:37,mobile,,Android,unknown,TRUE,2023-11-04 7:37
E007524,U002436,search,,2023-04-04,desktop,Chrome,Windows,,TRUE,2023-04-04 4:51
E003739,U001537,PAGE_VIEW,/admin,2025-03-24,,,,,TRUE,2025-03-24 0:25
E008113, U000707 ,page_view,/help,2024-10-23 1:43,DESKTOP,,,,1,2024-10-23 1:43
E006152, U001943 ,doc_delete,,06/15/2024 10:45,DESKTOP,Safari,,,0,2024-06-15 10:45
E004118,u002299,doc_delete,,2025-04-19,tablet,Firefox,iOS,,,2025-04-19 5:56
E007347,U001093,doc_edit,,2023-07-29,mobile,Firefox,Linux,1203,0,2023-07-29 12:10
E007244,U002539,doc_edit,,2025-06-11 22:53,,,Windows,,TRUE,2025-06-11 22:53
E007790, U001417 ,integration_error,,05/18/2025 12:04,DESKTOP,Firefox,macOS,60,FALSE,2025-05-18 12:04
E004132,U000889,logout,/dashboard,03/23/2025 20:49,mobile,Firefox,Linux,478,FALSE,2025-03-23 20:49
E001151,U000130,page_view,/pricing,,tablet,,macOS,unknown,TRUE,2023-06-22 10:40
E008625,u000888,integration_connect,,12/04/2023 20:16,tablet,,Windows,,,2023-12-04 20:16
E008840,U000165,logout,/docs,2023-08-23 18:16,,Edge,Windows,,1,2023-08-23 18:16
E000275,U002069,doc_delete,,09/01/2024 06:40,tablet,,Windows,,1,2024-09-01 6:40
E000600,U000189,search,,2023-04-04,tablet,Firefox,Linux,1571,,2023-04-04 11:19
E008364,U001725,search,,03/08/2024 13:04,,Brave,Android,unknown,TRUE,2024-03-08 13:04
E000081,U002589,doc_create,,03/25/2023 13:52,,,,,FALSE,2023-03-25 13:52
E003490,U001558,doc_create,,04/10/2023 21:13,,Chrome,Android,,0,2023-04-10 21:13
e004832,U002241,integration_error,,08/18/2023 04:28,,Safari,Windows,,FALSE,2023-08-18 4:28
E001290, U001305 ,comment,,06/14/2023 02:10,DESKTOP,Brave,Linux,unknown,0,2023-06-14 2:10
E006917,U001913,comment,,2024-06-05 8:54,,,,1479,TRUE,2024-06-05 8:54
E005335,U000417,ai_search,,2025-04-26 13:54,desktop,Firefox,,,FALSE,2025-04-26 13:54
E004740,U001516,integration_connect,,04/23/2023 20:36,mobile,Edge,Windows,unknown,FALSE,2023-04-23 20:36
E006679,U001280,doc_edit,,2023-07-19 11:48,,,Windows,,0,2023-07-19 11:48
E006065,U001671,integration_connect,,2024-01-04 0:46,mobile,Firefox,macOS,,1,2024-01-04 0:46
E001123,U002319,login,/search,0000-00-00 00:00:00,tablet,,,,,2024-01-01 20:56
E003564,U000478,export,,2025-05-11 13:24,desktop,,Linux,,TRUE,2025-05-11 13:24
E005654,U002442,integration_connect,,2024-06-29 17:47,mobile,Safari,Linux,,,2024-06-29 17:47
e007961,u000102,logout,/docs,,DESKTOP,Brave,,unknown,TRUE,2024-04-12 15:15
E002503,u000195,page_view,/docs,2023-10-31,,Safari,Android,,TRUE,2023-10-31 19:37
E003276,u001274,integration_error,,2024-05-10 21:34,tablet,,Android,1366,,2024-05-10 21:34
E005243,U002585,comment,,,mobile,Chrome,macOS,,FALSE,2024-08-12 20:01
E007474,U000031,page_view,/pricing,,,Safari,Android,,FALSE,2025-02-06 18:10
E002012,U001110,page_view,/pricing,04/27/2023 22:51,,Edge,macOS,unknown,FALSE,2023-04-27 22:51
E006771,U002319,logout,/settings,12/05/2024 11:27,,Edge,iOS,,TRUE,2024-12-05 11:27
E005623,u001781,doc_create,,,desktop,Safari,Linux,unknown,TRUE,2025-01-25 21:23
E000293,U000530,integration_connect,,03/03/2025 03:33,DESKTOP,Chrome,,,TRUE,2025-03-03 3:33
E006135, U000021 ,PAGE_VIEW,/onboarding,2024-08-27,,Brave,Linux,unknown,,2024-08-27 2:44
E006738,U002012,search,,11/06/2024 06:01,desktop,Brave,Linux,unknown,TRUE,2024-11-06 6:01
E001796,U002317,page_view,/admin,2023-06-13,desktop,Safari,iOS,,TRUE,2023-06-13 10:26
E000063,U001314,ai_search,,,,,Android,843,,2024-03-12 19:35
E004402,U000673,EXPORT,,05/08/2025 21:43,,Brave,Android,unknown,0,2025-05-08 21:43
E005620,u000429,ai_search,,2023-08-07,DESKTOP,Edge,macOS,833,1,2023-08-07 11:58
E002596,U001021,logout,/docs,2023-10-08,,,Android,,FALSE,2023-10-08 13:57
E002104, U001223 ,comment,,2024-12-11 6:32,,Edge,iOS,unknown,FALSE,2024-12-11 6:32
E005121,U001667,search,,2024-02-27 10:56,tablet,Edge,iOS,unknown,,2024-02-27 10:56
E005261,U002407,doc_create,,12/26/2023 04:43,DESKTOP,,macOS,912,,2023-12-26 4:43
E002542,u002573,integration_connect,,10/08/2023 23:10,tablet,,Android,,1,2023-10-08 23:10
E007279,U001339,doc_delete,,2024-08-13,,,Linux,,FALSE,2024-08-13 10:14
E006993,u002490,doc_delete,,08/19/2024 03:23,,Safari,,unknown,FALSE,2024-08-19 3:23
E003863,USR-002262,search,,,desktop,Edge,,179,FALSE,2023-03-18 6:19
E001604,U001430,share,,0000-00-00 00:00:00,desktop,Firefox,Android,,,2023-10-06 15:13
E002227,U002244,integration_error,,2024-12-31,tablet,,macOS,,FALSE,2024-12-31 5:48
E002558,U002531,export,,2024-06-10 0:40,mobile,Firefox,Android,,0,2024-06-10 0:40
e003860,U002431,export,,2023-08-11,,,Linux,unknown,0,2023-08-11 9:23
E000825,U000217,doc_create,,12/25/2023 15:10,mobile,,iOS,,TRUE,2023-12-25 15:10
E002699,U000193,login,/pricing,10/03/2023 12:11,,Edge,iOS,,1,2023-10-03 12:11
E001681,u001678,doc_delete,,2023-05-21 12:36,desktop,Brave,,unknown,0,2023-05-21 12:36
E002904,U000702,share,,06/15/2023 20:40,desktop,Safari,Android,784,TRUE,2023-06-15 20:40
E003456,USR-000487,integration_error,,2024-10-13,mobile,,macOS,,0,2024-10-13 11:35
E005651,U002430,doc_edit,,12/22/2023 04:36,DESKTOP,Edge,macOS,400,TRUE,2023-12-22 4:36
E005139,U001467,share,,2025-05-18,,Brave,macOS,205,TRUE,2025-05-18 13:10
E007466,U001384,doc_edit,,2024-05-06,,Edge,,,TRUE,2024-05-06 12:10
E003880,U001203,doc_create,,01/29/2025 02:40,desktop,Edge,macOS,unknown,TRUE,2025-01-29 2:40
E007882,U002566,integration_error,,2024-04-25 4:49,,Brave,macOS,,,2024-04-25 4:49
E003936,U002492,search,,01/20/2024 03:14,DESKTOP,Firefox,iOS,,,2024-01-20 3:14
E007761,U000554,integration_error,,06/18/2025 06:42,DESKTOP,Firefox,macOS,584,,2025-06-18 6:42
E002354,U001526,logout,/onboarding,2023-09-15 8:01,DESKTOP,Firefox,macOS,,FALSE,2023-09-15 8:01
E006352,U002176,integration_connect,,11/26/2023 13:30,DESKTOP,,macOS,,FALSE,2023-11-26 13:30
E006219,U000696,page_view,/pricing,2023-01-10 3:25,tablet,,,unknown,FALSE,2023-01-10 3:25
E007537,U000749,integration_connect,,2024-07-22 19:46,mobile,Chrome,,498,FALSE,2024-07-22 19:46
E005049,U000793,doc_edit,,01/24/2023 20:23,DESKTOP,Brave,Windows,,FALSE,2023-01-24 20:23
E007956,U002330,login,/integrations,2024-11-07 17:11,mobile,Brave,,455,FALSE,2024-11-07 17:11
E004573,U001492,login,/admin,2024-09-19 1:48,,Chrome,iOS,,,2024-09-19 1:48
E001873,U002373,search,,0000-00-00 00:00:00,DESKTOP,Safari,,,1,2024-11-28 11:17
E000511,U000529,logout,/search,2024-07-12 20:13,mobile,,,unknown,FALSE,2024-07-12 20:13
E008762,U001361,export,,06/21/2024 01:38,mobile,Edge,macOS,972,,2024-06-21 1:38
E003340,U001838,doc_create,,2023-04-12,desktop,,,,FALSE,2023-04-12 6:15
E006375,U002200,doc_edit,,01/19/2025 23:04,,Brave,,,TRUE,2025-01-19 23:04
E003865,U000237,page_view,/onboarding,2024-01-24,mobile,Brave,Windows,unknown,TRUE,2024-01-24 16:42
E002237,U001478,search,,11/05/2023 17:06,desktop,Brave,iOS,,,2023-11-05 17:06
E004780,U000664,logout,/docs,03/12/2023 12:43,,Firefox,Linux,,,2023-03-12 12:43
e000519,U002417,logout,/pricing,2024-10-22,tablet,,Linux,unknown,FALSE,2024-10-22 23:39
E004801,U001446,page_view,/onboarding,,desktop,Edge,iOS,,FALSE,2023-10-04 17:33
E000492,U001277,doc_edit,,2023-09-23 12:08,DESKTOP,,iOS,unknown,FALSE,2023-09-23 12:08
E002545,USR-001232,login,/admin,2025-04-13 9:38,desktop,Safari,,403,TRUE,2025-04-13 9:38
E000848,u000673,integration_connect,,,,Edge,Android,unknown,FALSE,2024-01-26 1:33
E001155,U000446,share,,2023-01-06 18:04,DESKTOP,Chrome,Linux,unknown,,2023-01-06 18:04
E008419,U001818,logout,/help,09/06/2024 07:23,desktop,Safari,iOS,unknown,0,2024-09-06 7:23
E007687,U000737,share,,0000-00-00 00:00:00,,Edge,macOS,,,2023-12-22 4:38
E008660,U001287,share,,2023-03-20,desktop,Edge,iOS,unknown,,2023-03-20 20:17
E002792,U000167,integration_connect,,2024-05-04 16:22,desktop,,macOS,1782,TRUE,2024-05-04 16:22
E000188, U000626 ,logout,/billing,11/09/2024 12:22,,Edge,macOS,600,TRUE,2024-11-09 12:22
E005130,U000838,search,,2025-02-22 17:31,tablet,Safari,,,1,2025-02-22 17:31
E001963,U000375,doc_edit,,04/26/2023 06:30,,,,,TRUE,2023-04-26 6:30
 E004157,U000516,doc_edit,,07/16/2023 08:53,,,,,FALSE,2023-07-16 8:53
 E000864,U001964,integration_error,,,desktop,Firefox,macOS,,0,2025-01-28 11:26
E007630,U000193,comment,,2024-07-19 2:18,mobile,Brave,Windows,,FALSE,2024-07-19 2:18
E000710,U001309,ai_search,,2023-01-20,,Edge,,,TRUE,2023-01-20 16:34
E000898,U002221,login,/dashboard,2024-03-30,mobile,Firefox,iOS,unknown,TRUE,2024-03-30 17:43
E004241,U000221,integration_connect,,,tablet,,iOS,1559,TRUE,2025-02-15 13:06
E000354,U002312,export,,09/16/2024 13:28,tablet,Firefox,macOS,unknown,,2024-09-16 13:28
E000731,U002132,integration_error,,2025-02-24 9:20,desktop,Chrome,iOS,,FALSE,2025-02-24 9:20
E008532,U001587,integration_error,,06/15/2025 16:48,,,Linux,,,2025-06-15 16:48
E001957,u001670,search,,0000-00-00 00:00:00,tablet,Safari,Android,,FALSE,2024-07-30 5:17
E004184,U000855,export,,09/16/2024 01:36,mobile,,Windows,951,,2024-09-16 1:36
E008246,U000116,doc_edit,,0000-00-00 00:00:00,mobile,Edge,Windows,unknown,TRUE,2024-05-11 3:27
E005801,U001290,search,,2025-06-11 19:54,mobile,Edge,,,FALSE,2025-06-11 19:54
E008747,U000966,login,/docs,11/15/2023 23:51,,,macOS,,0,2023-11-15 23:51
E004681,U000929,integration_error,,,,Edge,Windows,,FALSE,2024-11-09 1:23
E006082,u002294,integration_error,,2025-06-13 13:17,tablet,,Android,,FALSE,2025-06-13 13:17
E001892,U001525,page_view,/pricing,2024-04-20,,Brave,macOS,,1,2024-04-20 0:20
E000831,U002463,integration_connect,,01/09/2025 03:48,,Chrome,Android,,FALSE,2025-01-09 3:48
E003690,U001198,logout,/pricing,,DESKTOP,Chrome,,,,2024-03-15 0:44
E000943,U000027,comment,,08/07/2024 05:44,tablet,Brave,Android,unknown,FALSE,2024-08-07 5:44
E001783,U002289,integration_connect,,2025-01-26 17:04,tablet,Edge,macOS,,,2025-01-26 17:04
E002880, U000463 ,integration_connect,,2025-05-17,DESKTOP,Firefox,,1367,FALSE,2025-05-17 7:54
E006645,U000920,export,,2025-03-10,,Chrome,Linux,unknown,TRUE,2025-03-10 11:23
E003636,U000682,logout,/pricing,04/08/2024 18:30,,,Windows,unknown,FALSE,2024-04-08 18:30
E006164,U001982,login,/billing,2025-05-10 6:17,DESKTOP,Safari,Android,832,1,2025-05-10 6:17
E000275,U000148,doc_edit,,,DESKTOP,,Android,,1,2025-04-03 10:34
E005649,U002329,share,,2023-11-01,tablet,,iOS,,TRUE,2023-11-01 5:41
E005174,U000391,doc_delete,,2025-01-23 10:20,mobile,,iOS,,TRUE,2025-01-23 10:20
E000630,U000527,doc_delete,,,,Edge,,,1,2023-07-31 16:24
E002507, U001475 ,doc_edit,,2024-04-11,desktop,,Android,,1,2024-04-11 7:34
E006294,U001668,login,/settings,2023-07-28 12:35,desktop,Chrome,,,,2023-07-28 12:35
E006910,U002072,login,/pricing,2023-06-16 5:17,,Edge,Android,192,FALSE,2023-06-16 5:17
E001810,U002458,ai_search,,2023-09-27,desktop,Brave,Linux,unknown,,2023-09-27 0:48
E002230,U000401,login,/admin,2023-01-22,tablet,Safari,iOS,unknown,1,2023-01-22 10:28
E005688,U000025,search,,07/03/2024 13:58,tablet,Brave,Linux,unknown,FALSE,2024-07-03 13:58
E005941,U000713,comment,,12/15/2023 10:30,DESKTOP,,macOS,788,FALSE,2023-12-15 10:30
E005800,u000093,ai_search,,2023-02-04 13:49,mobile,,Android,348,,2023-02-04 13:49
E000824,U000535,export,,0000-00-00 00:00:00,mobile,,Windows,,,2024-10-31 2:47
E004319,U001776,integration_connect,,2023-04-29,desktop,Firefox,,,TRUE,2023-04-29 2:01
E008505,U001414,logout,/docs,2023-04-09,desktop,,Linux,602,0,2023-04-09 14:56
E003156,U001665,ai_search,,2025-01-09 2:38,,Brave,Android,,TRUE,2025-01-09 2:38
E000322,U001340,logout,/billing,01/01/2024 09:51,desktop,Safari,iOS,92,,2024-01-01 9:51
E008967,U000735,PAGE_VIEW,/pricing,2023-01-04,desktop,,Windows,753,,2023-01-04 20:04
E008569, u000783 ,login,/admin,2024-10-18 5:11,mobile,Brave,,840,,2024-10-18 5:11
E000607,U000041,export,,2023-08-20 13:11,desktop,Brave,Linux,,TRUE,2023-08-20 13:11
E006265,U001791,integration_error,,09/08/2023 17:19,tablet,Chrome,macOS,,1,2023-09-08 17:19
E001410,U000066,logout,/pricing,2023-02-25 10:37,tablet,Edge,Android,unknown,TRUE,2023-02-25 10:37
E002376,U000859,share,,2023-08-10 19:11,,Edge,macOS,,0,2023-08-10 19:11
E007733,U001543,comment,,2023-01-30 21:13,tablet,,iOS,,FALSE,2023-01-30 21:13
E000884,u000142,ai_search,,0000-00-00 00:00:00,tablet,Firefox,Linux,,1,2025-02-25 20:45
e004737,U001053,page_view,/pricing,2023-06-17 4:11,,Edge,Linux,,TRUE,2023-06-17 4:11
E006625,U000171,comment,,0000-00-00 00:00:00,tablet,Chrome,Android,,0,2024-03-21 10:00
E001315,U002170,share,,2023-12-23,mobile,Safari,Linux,749,,2023-12-23 17:03
e008042,U000570,search,,2023-03-17,tablet,Chrome,,,FALSE,2023-03-17 3:51
E002660,U000907,page_view,/dashboard,,desktop,,Windows,unknown,FALSE,2024-04-08 12:43
E001063,U002542,doc_edit,,2024-09-23 15:35,mobile,Safari,Windows,1333,,2024-09-23 15:35
E003017,U001287,logout,/billing,2024-03-24 22:18,DESKTOP,Edge,Android,,TRUE,2024-03-24 22:18
E006218,U000844,SEARCH,,04/18/2025 15:31,tablet,Brave,iOS,1750,FALSE,2025-04-18 15:31
E000081,U001608,share,,2023-06-26,,Brave,,,TRUE,2023-06-26 10:58
E003653,USR-002235,export,,,tablet,,iOS,379,0,2024-12-12 12:33
E008685,U000644,doc_delete,,2023-07-11,desktop,Edge,Windows,,,2023-07-11 21:13
E007387,U000912,login,/onboarding,2025-01-23 16:47,,Safari,Android,,,2025-01-23 16:47
E004583,U000501,share,,,tablet,,Windows,,TRUE,2024-09-15 13:32
E002593,U001326,export,,03/05/2023 16:12,,Chrome,,,FALSE,2023-03-05 16:12
E000627, U001755 ,export,,2023-12-09,mobile,Chrome,,,TRUE,2023-12-09 14:02
E003949,U000008,comment,,01/26/2023 16:01,,Brave,macOS,,1,2023-01-26 16:01
E003533,U002488,doc_edit,,03/04/2023 09:42,,Brave,iOS,847,TRUE,2023-03-04 9:42
E003905,U000522,search,,09/26/2023 06:43,desktop,Firefox,Android,,TRUE,2023-09-26 6:43
E006231,U001496,doc_edit,,2024-12-03,,Safari,,,0,2024-12-03 13:49
E001263,U001727,ai_search,,09/29/2023 04:53,DESKTOP,,Linux,1298,,2023-09-29 4:53
E000415,U000180,comment,,2024-05-03 11:02,mobile,,Windows,,TRUE,2024-05-03 11:02
E007909,U001780,integration_connect,,2023-03-16,DESKTOP,Firefox,Windows,unknown,FALSE,2023-03-16 10:06
E002034,U001581,doc_edit,,04/12/2023 20:35,mobile,Edge,Windows,,FALSE,2023-04-12 20:35
E000596,U001420,export,,2023-04-16 16:41,,Safari,iOS,322,TRUE,2023-04-16 16:41
E007258,u001758,search,,07/22/2023 18:32,desktop,Chrome,Android,,,2023-07-22 18:32
E001179,U001952,integration_error,,,DESKTOP,Edge,Linux,1611,FALSE,2023-04-08 19:28
E003607,U000905,integration_connect,,2023-12-10 7:39,tablet,Brave,Windows,,1,2023-12-10 7:39
E004498, U000570 ,share,,04/14/2024 22:49,,Safari,Windows,732,FALSE,2024-04-14 22:49
E003975,U002278,export,,,mobile,Brave,macOS,844,1,2025-03-04 14:50
E007627,U002017,integration_error,,2023-05-14,,,iOS,,TRUE,2023-05-14 2:33
E000039,U002027,integration_connect,,11/28/2024 11:16,desktop,Chrome,Windows,,TRUE,2024-11-28 11:16
E002986,U000762,share,,2024-12-20 15:26,tablet,,iOS,127,,2024-12-20 15:26
E001911,USR-002258,integration_error,,2023-06-23 13:30,DESKTOP,Safari,,,1,2023-06-23 13:30
E000377,U001116,search,,2023-03-29,,Brave,macOS,unknown,FALSE,2023-03-29 20:16
E002491,U000050,doc_delete,,10/07/2024 06:41,DESKTOP,Firefox,Linux,unknown,0,2024-10-07 6:41
E008955,U001228,integration_error,,2024-01-09,,,Linux,1396,FALSE,2024-01-09 21:39
E002394,U000154,share,,2024-02-01 15:18,mobile,Chrome,Linux,unknown,,2024-02-01 15:18
E005204,U002173,doc_edit,,2024-06-09 1:40,,Chrome,Android,,TRUE,2024-06-09 1:40
e006693,U001233,export,,07/18/2023 07:26,DESKTOP,Chrome,Windows,,,2023-07-18 7:26
E002645,U002296,export,,2023-06-22 22:57,,Safari,Windows,unknown,,2023-06-22 22:57
E003850,U000038,comment,,2023-10-27,mobile,Chrome,macOS,unknown,TRUE,2023-10-27 12:46
E008265,U002144,logout,/onboarding,02/25/2024 19:00,,Brave,,unknown,,2024-02-25 19:00
E008342,U001953,comment,,2024-07-05 11:29,DESKTOP,Firefox,Android,,1,2024-07-05 11:29
E007409,U001604,search,,2023-02-04 18:23,tablet,,Windows,263,0,2023-02-04 18:23
E006555,U001084,comment,,2024-07-05,tablet,,Android,,,2024-07-05 15:16
E004615,u000701,page_view,/onboarding,11/16/2024 16:03,DESKTOP,Safari,,,1,2024-11-16 16:03
E006677,USR-002262,comment,,03/29/2023 00:42,,Safari,Windows,514,TRUE,2023-03-29 0:42
E005161,U001427,doc_create,,05/03/2024 09:43,tablet,,Linux,869,FALSE,2024-05-03 9:43
E002908,U000166,doc_create,,2024-01-27,,Brave,Linux,,FALSE,2024-01-27 11:32
E002350,u001851,integration_error,,05/16/2024 22:23,desktop,,,,,2024-05-16 22:23
E002073,U001676,doc_delete,,03/26/2023 15:49,mobile,Safari,Linux,,TRUE,2023-03-26 15:49
E003342,u001287,integration_connect,,11/20/2024 13:19,tablet,Chrome,,unknown,TRUE,2024-11-20 13:19
E007309,U000273,comment,,2024-10-01 20:57,desktop,Firefox,,,FALSE,2024-10-01 20:57
E006865,U001890,comment,,,tablet,Chrome,,,,2023-07-27 13:01
E002706,U000220,search,,2023-03-25,mobile,Brave,Android,,,2023-03-25 22:01
E006577,U001766,logout,/integrations,2023-01-09 14:29,,Brave,macOS,,FALSE,2023-01-09 14:29
 E000964,U000810,ai_search,,11/08/2023 01:41,,Brave,macOS,,,2023-11-08 1:41
E008923,U000863,login,/search,2023-03-23,,Safari,Android,,FALSE,2023-03-23 2:33
E001841,U001606,search,,,mobile,Edge,Android,19,,2024-11-10 6:59
E008327,USR-002274,integration_error,,2025-02-04,,,Linux,,TRUE,2025-02-04 3:42
E005223,U000264,comment,,06/04/2023 01:38,,Edge,iOS,989,0,2023-06-04 1:38
E006742,U001786,page_view,/search,06/26/2024 07:48,,,iOS,,1,2024-06-26 7:48
 E005287,U001630,doc_create,,2024-07-10 17:37,,Brave,Android,1709,,2024-07-10 17:37
E003906,U001686,integration_connect,,,DESKTOP,,Linux,,TRUE,2024-08-04 20:08
E007403,U000391,doc_edit,,,mobile,,Linux,,,2025-04-15 17:25
E008574,U001973,page_view,/search,11/22/2024 15:22,mobile,Brave,Windows,,,2024-11-22 15:22
E002654,U000732,login,/search,,,,Android,,FALSE,2024-09-29 21:33
E005897,U001650,export,,12/06/2024 22:44,DESKTOP,Safari,,1498,,2024-12-06 22:44
E000713,U000302,export,,2023-02-16,,Safari,,unknown,FALSE,2023-02-16 7:55
E008220,U001314,integration_connect,,08/01/2024 11:17,tablet,Safari,,1732,FALSE,2024-08-01 11:17
E002439,U001106,share,,2023-03-04,desktop,Edge,Android,unknown,TRUE,2023-03-04 9:35
E007030,U000152,doc_delete,,2023-05-15 20:57,desktop,Firefox,,,,2023-05-15 20:57
E004265,USR-000771,integration_connect,,2024-09-28,mobile,Firefox,Windows,,1,2024-09-28 10:20
E000267,U000121,search,,01/02/2024 09:34,,Firefox,,,TRUE,2024-01-02 9:34
E005523,U001619,search,,2023-05-12,,,Windows,,0,2023-05-12 15:16
E001220,U000105,comment,,2025-04-15,,,,,FALSE,2025-04-15 4:38
E007198,U000004,integration_connect,,2024-08-24 8:55,mobile,Chrome,,1787,FALSE,2024-08-24 8:55
E000552,U002156,integration_connect,,,,Brave,,679,FALSE,2024-09-02 16:57
E003627,U000791,ai_search,,2024-02-03 7:28,,Safari,Linux,,0,2024-02-03 7:28
E007685,U000840,integration_connect,,2023-10-31,DESKTOP,Edge,Android,,TRUE,2023-10-31 1:06
E002183,U000940,ai_search,,01/29/2023 15:56,desktop,Firefox,Android,unknown,FALSE,2023-01-29 15:56
E002940,U002025,doc_create,,2023-07-21,,,iOS,322,1,2023-07-21 13:46
E001331,U000190,comment,,,,Firefox,Linux,958,,2024-08-29 3:51
E002072,U001152,page_view,/search,07/15/2023 06:45,,Safari,,,1,2023-07-15 6:45
E005927,U001334,integration_error,,2024-11-20,,Safari,,,,2024-11-20 8:02
E001505,U000653,export,,,,Safari,macOS,,TRUE,2023-04-18 11:47
E004241,u000801,ai_search,,,tablet,,Linux,,TRUE,2023-05-04 20:14
E004699,U001154,logout,/integrations,12/02/2023 03:43,,Brave,iOS,,TRUE,2023-12-02 3:43
E003341,U000546,search,,12/16/2023 10:39,DESKTOP,,macOS,,1,2023-12-16 10:39
E004111,U001709,doc_delete,,2024-06-11,desktop,,,1068,,2024-06-11 9:57
E001542,u000720,login,/help,04/21/2024 01:29,mobile,Firefox,,unknown,1,2024-04-21 1:29
E004871,U002230,ai_search,,2023-07-29,,Safari,,1504,1,2023-07-29 16:35
E007211,U001088,LOGIN,/pricing,07/18/2023 21:48,DESKTOP,,Windows,,TRUE,2023-07-18 21:48
E006461,U002056,logout,/pricing,2024-10-24 19:35,,,iOS,319,,2024-10-24 19:35
E001936,U001011,LOGIN,/admin,2024-06-25,tablet,Safari,Android,1147,1,2024-06-25 7:36
E002827,U002046,share,,2023-12-17 16:47,,Safari,iOS,unknown,,2023-12-17 16:47
E008671,U000920,doc_create,,,,Brave,macOS,,1,2024-05-18 11:46
E000060,U000596,doc_edit,,2025-01-23,,,Windows,,,2025-01-23 2:02
E004353,U002125,page_view,/help,04/21/2025 18:15,mobile,,,,FALSE,2025-04-21 18:15
E007634,USR-000521,ai_search,,02/19/2024 01:38,desktop,Chrome,Android,unknown,,2024-02-19 1:38
E000446,U000371,share,,2024-10-19 4:30,tablet,Safari,,,1,2024-10-19 4:30
e003409,U000822,doc_create,,2023-04-15 6:45,mobile,Edge,Windows,,1,2023-04-15 6:45
E005293,U002358,comment,,,tablet,Safari,,480,FALSE,2024-04-16 22:28
E003468,U001035,export,,08/22/2024 23:20,tablet,Edge,iOS,1691,TRUE,2024-08-22 23:20
E008058,U001748,ai_search,,04/13/2023 08:51,DESKTOP,,,1410,TRUE,2023-04-13 8:51
E006273,u001773,share,,10/11/2024 15:10,tablet,Edge,Windows,541,,2024-10-11 15:10
E007513,U001334,doc_delete,,2024-06-14,desktop,,,unknown,FALSE,2024-06-14 14:55
E001958,u000647,integration_error,,04/18/2024 05:34,,Chrome,Android,975,0,2024-04-18 5:34
E007628,U001666,integration_error,,2025-04-12 17:35,mobile,Chrome,Windows,399,TRUE,2025-04-12 17:35
E002175,U000891,search,,2023-07-02,tablet,Firefox,iOS,unknown,,2023-07-02 4:45
E000754,U000155,integration_error,,,desktop,Brave,,235,0,2025-05-22 17:28
E008486,U001440,doc_edit,,2023-08-30 5:57,,Safari,Android,,FALSE,2023-08-30 5:57
 E001640,U002118,share,,06/10/2023 19:49,tablet,Chrome,iOS,,TRUE,2023-06-10 19:49
E007319,U001118,export,,12/15/2024 20:19,,,,,FALSE,2024-12-15 20:19
E003838,U000750,page_view,/admin,2023-01-26 23:10,tablet,,,585,TRUE,2023-01-26 23:10
 E000378,U002092,doc_edit,,07/23/2024 17:55,,Firefox,,unknown,FALSE,2024-07-23 17:55
E000609,U000634,login,/docs,09/03/2023 04:18,DESKTOP,Firefox,iOS,unknown,TRUE,2023-09-03 4:18
E008853,U001061,ai_search,,2025-03-17,,Chrome,Windows,,,2025-03-17 20:23
E007693, U001921 ,integration_connect,,2023-12-18 7:17,,Chrome,,,,2023-12-18 7:17
E003953,U002432,comment,,2023-09-25 12:14,,Chrome,iOS,unknown,,2023-09-25 12:14
E003429,U001958,doc_create,,2023-03-17,DESKTOP,,,,,2023-03-17 3:20
E007210,u001046,comment,,11/17/2024 15:55,tablet,Chrome,Windows,,1,2024-11-17 15:55
E007000,U000300,doc_edit,,2024-10-06 1:22,mobile,,macOS,,FALSE,2024-10-06 1:22
E005866,U001949,integration_connect,,2024-01-27,desktop,Brave,Android,,0,2024-01-27 11:07
E005266,u000344,logout,/settings,2024-06-17,,Chrome,Android,,FALSE,2024-06-17 1:13
E006329,U002521,search,,2025-03-09,tablet,,,,FALSE,2025-03-09 5:01
E006900,U000346,ai_search,,2024-03-09 21:07,DESKTOP,,,,FALSE,2024-03-09 21:07
E004969, u002043 ,ai_search,,2023-03-02 20:01,DESKTOP,Edge,Android,,,2023-03-02 20:01
E001907,U001994,login,/onboarding,2023-09-08 7:34,,Brave,Windows,unknown,1,2023-09-08 7:34
E007581,U000527,logout,/help,05/23/2024 10:13,desktop,Safari,,,,2024-05-23 10:13
e002546,u001712,integration_error,,2024-06-29,mobile,Firefox,Windows,1563,1,2024-06-29 1:53
 E001735,U001105,integration_error,,2024-01-01,,Brave,,unknown,TRUE,2024-01-01 23:58
E001551,U001421,export,,05/18/2023 11:29,mobile,Chrome,,unknown,,2023-05-18 11:29
E003120,U001548,doc_edit,,2024-03-07,DESKTOP,Edge,Linux,973,1,2024-03-07 5:19
E002423,U000574,doc_delete,,2024-11-07,DESKTOP,,Linux,666,,2024-11-07 18:06
 E004489,U000418,page_view,/admin,2025-01-08 17:16,mobile,Brave,macOS,,TRUE,2025-01-08 17:16
E007330,U001900,doc_edit,,0000-00-00 00:00:00,,Edge,Android,,TRUE,2024-08-10 18:54
E007743,U000727,ai_search,,,DESKTOP,,Linux,unknown,TRUE,2025-05-16 7:24
E001693,U000155,share,,2023-01-18,,Brave,Windows,,,2023-01-18 13:31
E007179,U000880,logout,/onboarding,2023-02-23 23:11,tablet,Brave,iOS,,,2023-02-23 23:11
E000148,U000259,ai_search,,0000-00-00 00:00:00,mobile,Edge,macOS,,FALSE,2024-07-18 12:01
E005989, U002138 ,integration_error,,2024-07-06,DESKTOP,Edge,Android,,,2024-07-06 20:59
E005588,U001572,doc_edit,,2023-07-05 4:23,mobile,Edge,Android,,,2023-07-05 4:23
E002047,U002543,doc_edit,,04/28/2024 08:58,DESKTOP,Brave,Android,,TRUE,2024-04-28 8:58
E001230, u000489 ,ai_search,,0000-00-00 00:00:00,desktop,,,,FALSE,2023-04-06 20:17
E002584,U000955,logout,/billing,04/01/2024 23:56,,Brave,Linux,,0,2024-04-01 23:56
E000207,U002402,integration_error,,0000-00-00 00:00:00,,Edge,,,1,2025-01-19 13:13
E003406,U000420,doc_create,,10/08/2023 10:54,,,Android,,TRUE,2023-10-08 10:54
E000166,U000834,login,/docs,10/15/2023 22:10,desktop,Brave,macOS,unknown,FALSE,2023-10-15 22:10
E007708,U000027,share,,2025-06-15,DESKTOP,,macOS,1402,1,2025-06-15 23:01
E004433,U002408,export,,2025-03-26 1:54,desktop,,Windows,,1,2025-03-26 1:54
E008472, U001589 ,doc_create,,03/01/2024 20:24,tablet,Brave,,,TRUE,2024-03-01 20:24
E003425,U002114,export,,,,,,unknown,0,2023-04-03 16:55
E003739,U001537,PAGE_VIEW,/admin,2025-03-24,,,,,TRUE,2025-03-24 0:25
E003186,u001179,search,,07/06/2023 01:48,,Chrome,,,,2023-07-06 1:48
E008512, U002199 ,integration_connect,,2025-04-03 13:23,mobile,Brave,macOS,1455,TRUE,2025-04-03 13:23
E003318,U001200,comment,,09/09/2024 08:22,DESKTOP,Edge,Linux,,,2024-09-09 8:22
E005508, U002379 ,doc_create,,2023-06-10,mobile,,iOS,unknown,FALSE,2023-06-10 17:03
E007238,U000150,ai_search,,2024-06-07,,,Linux,unknown,FALSE,2024-06-07 20:22
E000291,U001049,ai_search,,02/07/2023 19:13,,Edge,macOS,,FALSE,2023-02-07 19:13
E005851,U002193,comment,,10/09/2024 16:09,mobile,,macOS,unknown,TRUE,2024-10-09 16:09
E001014,U001164,doc_delete,,2024-01-20,desktop,,Windows,unknown,0,2024-01-20 23:49
E003932,U001378,integration_connect,,12/11/2023 02:11,,Edge,,,,2023-12-11 2:11
E002760,U001491,doc_edit,,,mobile,Brave,Windows,,TRUE,2023-07-25 21:40
E005219,U000820,export,,06/05/2023 13:36,tablet,Chrome,,1227,,2023-06-05 13:36
E002878,U000366,logout,/integrations,2025-05-20 0:52,tablet,Chrome,,unknown,TRUE,2025-05-20 0:52
E008037,U000540,export,,11/09/2024 07:40,,Edge,Linux,982,FALSE,2024-11-09 7:40
E001591,U002364,page_view,/settings,04/17/2024 01:56,tablet,Firefox,,unknown,TRUE,2024-04-17 1:56
E004425,U002012,doc_create,,2024-03-24 8:26,mobile,Firefox,Windows,unknown,,2024-03-24 8:26
E002909,U000650,logout,/integrations,2025-02-14,DESKTOP,Safari,Windows,,TRUE,2025-02-14 1:22
E007478,U000164,ai_search,,2025-03-16,DESKTOP,Brave,iOS,1748,TRUE,2025-03-16 9:26
E005441,U000743,doc_edit,,2023-03-26,,Edge,Linux,,,2023-03-26 19:08
E006670,U001523,logout,/billing,2025-05-16 16:59,,,,409,TRUE,2025-05-16 16:59
E005539,U002593,doc_edit,,2024-06-17,tablet,Safari,iOS,,,2024-06-17 23:26
E001932,U001355,comment,,2025-02-15,tablet,,Android,14,,2025-02-15 19:10
E005497,U000143,ai_search,,2023-04-08 18:00,,,Windows,31,FALSE,2023-04-08 18:00
E006600,U002277,logout,/pricing,,,Edge,,494,0,2024-01-28 9:06
E002834,U001218,share,,2024-12-19,tablet,Safari,Android,,,2024-12-19 22:10
E008094, U002226 ,page_view,/docs,2024-02-09 9:08,desktop,,macOS,unknown,TRUE,2024-02-09 9:08
E002392,U002423,doc_edit,,2024-05-22,desktop,Safari,,418,,2024-05-22 6:04
E000023,U000722,search,,2024-02-27 9:21,desktop,Firefox,,unknown,FALSE,2024-02-27 9:21
E002089,U000392,search,,01/22/2025 08:48,DESKTOP,Firefox,iOS,unknown,1,2025-01-22 8:48
E001610,U001355,comment,,,mobile,Brave,,unknown,FALSE,2023-07-10 22:41
E005707,U001613,share,,12/18/2024 15:35,,Firefox,iOS,246,FALSE,2024-12-18 15:35
E002156, U002027 ,ai_search,,11/06/2023 13:19,,,,,FALSE,2023-11-06 13:19
E000341,U000959,doc_create,,04/09/2024 15:06,tablet,,,,FALSE,2024-04-09 15:06
E004593,u001185,logout,/search,07/26/2024 15:42,,,macOS,,,2024-07-26 15:42
E001854,U000999,doc_delete,,2023-03-15,,Edge,macOS,unknown,,2023-03-15 19:20
e004192,U001160,share,,07/12/2023 11:55,,,,767,TRUE,2023-07-12 11:55
E004432,U001321,page_view,/docs,2023-10-31,desktop,Firefox,macOS,,TRUE,2023-10-31 15:45
E001755,U000581,integration_connect,,08/09/2024 11:40,,Brave,macOS,,,2024-08-09 11:40
E001274, U001386 ,doc_edit,,2024-07-13,mobile,Firefox,Android,unknown,FALSE,2024-07-13 5:36
E008171,U001006,doc_edit,,0000-00-00 00:00:00,,Safari,,unknown,,2024-04-18 9:01
E001830,U001340,search,,,,Chrome,macOS,,FALSE,2023-12-01 20:39
E007295,U000864,share,,2024-11-21 4:29,DESKTOP,Safari,,226,,2024-11-21 4:29
e008438,U001343,login,/admin,06/01/2023 05:16,mobile,Chrome,macOS,,,2023-06-01 5:16
E005532,U002386,doc_edit,,12/05/2023 21:09,,Brave,,,0,2023-12-05 21:09
E001377,U002498,comment,,0000-00-00 00:00:00,,Edge,Windows,,1,2023-07-18 16:43
E002424,U002254,comment,,2024-12-27 15:40,mobile,Edge,,1737,FALSE,2024-12-27 15:40
E001974,U001943,search,,2024-10-24 8:14,tablet,Safari,Linux,,,2024-10-24 8:14
E002592,U002304,AI_SEARCH,,07/14/2023 21:26,,Safari,,,FALSE,2023-07-14 21:26
E007775,U000575,page_view,/search,2023-09-06 14:16,tablet,,,unknown,,2023-09-06 14:16
E000764,USR-000626,doc_delete,,01/04/2023 22:36,desktop,Safari,Android,208,TRUE,2023-01-04 22:36
E001560,U002108,search,,08/13/2023 16:41,,Edge,macOS,unknown,TRUE,2023-08-13 16:41
E001701,USR-000476,export,,2024-04-15,DESKTOP,Firefox,Windows,,TRUE,2024-04-15 19:10
E003916,u000894,integration_error,,,mobile,Safari,iOS,unknown,FALSE,2023-12-06 3:42
E006040,U001768,ai_search,,07/29/2023 15:12,,Chrome,,,1,2023-07-29 15:12
E007036,U000276,doc_delete,,06/13/2025 13:06,tablet,Edge,macOS,,1,2025-06-13 13:06
E008579,U002041,integration_error,,0000-00-00 00:00:00,,Firefox,Windows,unknown,0,2023-11-08 21:24
E002062,U002488,doc_create,,,mobile,,,,,2025-04-24 7:05
E002526,U000654,logout,/docs,,DESKTOP,,,413,1,2024-01-28 12:35
e003056,U000961,doc_delete,,,desktop,Safari,Android,unknown,,2023-01-12 12:29
E007342,U001838,login,/docs,2023-04-06,DESKTOP,,Linux,,1,2023-04-06 6:12
E002413,U002502,integration_connect,,,,Firefox,Android,,TRUE,2024-04-15 19:32
E008780,U002420,doc_edit,,04/15/2023 07:01,,Edge,macOS,,FALSE,2023-04-15 7:01
E004189,u001462,doc_create,,2025-03-26 12:09,mobile,Brave,,,,2025-03-26 12:09
E005241,U001952,share,,2023-12-04 0:29,,,,,FALSE,2023-12-04 0:29
E006860,U001001,comment,,2023-10-19 20:39,,Edge,Linux,unknown,TRUE,2023-10-19 20:39
E005007,U000148,ai_search,,2024-10-26,mobile,Edge,Windows,,,2024-10-26 15:53
E006439,U002406,doc_edit,,2024-03-18 7:57,DESKTOP,Safari,,,FALSE,2024-03-18 7:57
E007414,U001111,doc_delete,,0000-00-00 00:00:00,,,,1395,TRUE,2023-03-01 11:41
E000933,USR-001467,export,,2025-04-26 13:33,tablet,Firefox,iOS,,TRUE,2025-04-26 13:33
 E004430,U002508,logout,/integrations,04/10/2023 12:27,tablet,,Linux,unknown,TRUE,2023-04-10 12:27
E002203,u002276,search,,08/08/2023 12:49,,Firefox,iOS,unknown,FALSE,2023-08-08 12:49
E007734,U001884,logout,/billing,08/30/2024 03:07,tablet,Edge,,unknown,0,2024-08-30 3:07
E001918,U000023,login,/integrations,2023-08-01,desktop,,Windows,1039,TRUE,2023-08-01 22:44
E001979,U000358,share,,10/17/2024 05:37,,Brave,Windows,unknown,0,2024-10-17 5:37
E003634,U002562,COMMENT,,01/28/2023 21:10,DESKTOP,,Linux,,1,2023-01-28 21:10
E006300,USR-001085,comment,,2025-01-27,mobile,Safari,iOS,unknown,,2025-01-27 21:28
E007492,U000613,share,,,desktop,,,,,2024-07-10 6:12
E006756,U000446,export,,2024-06-27,tablet,Edge,,unknown,1,2024-06-27 11:27
E008771,U001097,page_view,/integrations,03/08/2025 06:21,mobile,Chrome,Linux,unknown,FALSE,2025-03-08 6:21
e001860,U001787,share,,10/09/2024 21:34,DESKTOP,Safari,,,FALSE,2024-10-09 21:34
 E001196,u001560,integration_error,,09/18/2024 20:06,,,iOS,351,FALSE,2024-09-18 20:06
E002409,U002512,page_view,/dashboard,0000-00-00 00:00:00,mobile,Brave,,unknown,,2023-04-18 4:54
E002938,U001147,doc_create,,2024-08-28 11:33,mobile,Brave,Linux,,TRUE,2024-08-28 11:33
E006724,U000197,page_view,/dashboard,11/24/2024 00:36,,,iOS,,1,2024-11-24 0:36
E008087,U000441,integration_connect,,08/28/2023 23:50,desktop,Firefox,,,,2023-08-28 23:50
E007133,U002362,share,,2024-09-08 1:55,,,,,FALSE,2024-09-08 1:55
E004771,U000656,ai_search,,04/17/2024 07:40,,,macOS,,,2024-04-17 7:40
E002328,U001911,ai_search,,2025-01-06 22:26,mobile,Edge,Android,433,1,2025-01-06 22:26
E005463,U000939,comment,,2023-08-06,,Firefox,iOS,1023,1,2023-08-06 2:38
e004499,U002205,integration_error,,0000-00-00 00:00:00,desktop,Brave,Android,,FALSE,2024-10-16 17:15
E008023,u001731,comment,,2023-07-11,desktop,Brave,Linux,,TRUE,2023-07-11 14:47
e006376,U001856,search,,01/03/2023 04:19,mobile,,Linux,,FALSE,2023-01-03 4:19
E003498,U000180,export,,2024-12-26 19:58,desktop,,macOS,,,2024-12-26 19:58
E005750,U000238,page_view,/admin,02/28/2024 01:31,tablet,Firefox,,,0,2024-02-28 1:31
E000936,U001302,integration_connect,,03/11/2024 10:14,tablet,Edge,Windows,,,2024-03-11 10:14
E001904, U001272 ,doc_delete,,,mobile,,iOS,unknown,TRUE,2023-08-10 8:35
e003027,U000294,doc_delete,,06/01/2025 10:13,mobile,,iOS,397,TRUE,2025-06-01 10:13
E003932,U001610,doc_delete,,02/18/2024 10:39,,Brave,Android,,,2024-02-18 10:39
E001069,U001037,comment,,2023-05-07 21:42,,Safari,iOS,,,2023-05-07 21:42
E005175,u002571,login,/onboarding,,,Edge,Linux,unknown,,2023-06-10 21:24
E008964,U002083,ai_search,,03/01/2024 05:54,DESKTOP,Chrome,Linux,,TRUE,2024-03-01 5:54
E000400,u002121,doc_create,,05/29/2025 07:25,desktop,Safari,Linux,,FALSE,2025-05-29 7:25
E000066,U001786,integration_error,,2023-05-25 16:45,desktop,Firefox,,unknown,TRUE,2023-05-25 16:45
E004529,U001396,doc_delete,,09/15/2023 05:37,desktop,Chrome,Android,,TRUE,2023-09-15 5:37
E008074,U000940,export,,2024-08-22,,Safari,Linux,1634,TRUE,2024-08-22 3:34
E001537,U002536,ai_search,,01/02/2024 22:09,,,iOS,,0,2024-01-02 22:09
E008779,U002167,search,,2025-02-02,desktop,,Android,1251,FALSE,2025-02-02 10:37
e001347,U000026,search,,04/04/2025 13:36,,Firefox,Windows,unknown,0,2025-04-04 13:36
E000482,U000590,page_view,/integrations,2024-07-05 0:29,mobile,Chrome,Android,,,2024-07-05 0:29
E002654,U001193,integration_connect,,01/15/2023 15:59,,Edge,Linux,,0,2023-01-15 15:59
E001645,U001953,integration_error,,2024-11-04 7:13,,Safari,Linux,,FALSE,2024-11-04 7:13
E004250,U000210,page_view,/pricing,03/11/2024 02:23,DESKTOP,Safari,Linux,1193,TRUE,2024-03-11 2:23
E006220,U001106,ai_search,,2023-07-19 16:45,DESKTOP,,,,,2023-07-19 16:45
E004139,U000760,login,/search,2024-05-11 9:41,tablet,Brave,Linux,,1,2024-05-11 9:41
E006953,U002541,login,/dashboard,,,,Android,615,1,2024-03-23 22:52
E006567,U000028,search,,2025-03-06 22:38,desktop,Chrome,Linux,,,2025-03-06 22:38
E006228,U001099,doc_delete,,2024-07-27 15:32,tablet,Firefox,,unknown,TRUE,2024-07-27 15:32
E006879,U000029,doc_delete,,2025-05-08 3:15,DESKTOP,Safari,iOS,,FALSE,2025-05-08 3:15
E007669,U002254,comment,,11/21/2024 08:12,,,iOS,unknown,FALSE,2024-11-21 8:12
E006424,u001216,integration_connect,,01/23/2024 01:37,DESKTOP,,macOS,231,1,2024-01-23 1:37
E001625,U002161,doc_create,,2024-03-16 5:22,,Firefox,Windows,,FALSE,2024-03-16 5:22
E000806,U001952,page_view,/help,2024-01-24,DESKTOP,Edge,Android,,,2024-01-24 3:19
E008168,U002359,comment,,0000-00-00 00:00:00,DESKTOP,Edge,,801,0,2024-11-22 22:23
E004731,U002260,doc_edit,,,tablet,Firefox,macOS,unknown,TRUE,2023-08-15 15:00
E000521,U000181,ai_search,,2025-03-26 10:22,,Edge,Linux,,TRUE,2025-03-26 10:22
E008843,U000058,login,/docs,05/06/2024 02:38,desktop,,macOS,,FALSE,2024-05-06 2:38
E001915, U001761 ,integration_error,,2025-01-31 0:47,,Safari,,,0,2025-01-31 0:47
E002064,U000073,login,/admin,,,Chrome,Linux,,,2024-05-28 11:14
e005813,U002079,share,,2024-02-19,,Brave,,,1,2024-02-19 20:04
E001772,U000966,ai_search,,2024-01-08 13:41,mobile,,iOS,unknown,TRUE,2024-01-08 13:41
E000810,U000027,doc_create,,2024-06-01 8:42,,Edge,macOS,unknown,,2024-06-01 8:42
E004664,U002297,doc_edit,,2024-04-05,mobile,Edge,Windows,1554,TRUE,2024-04-05 4:15
E001739,U001102,doc_create,,05/21/2025 04:31,DESKTOP,,Android,unknown,1,2025-05-21 4:31
E004042,U000208,integration_error,,04/24/2023 19:01,,Firefox,Windows,unknown,TRUE,2023-04-24 19:01
E005036,U002574,doc_create,,2024-04-09 7:45,,,macOS,unknown,0,2024-04-09 7:45
E003309,U001949,doc_edit,,03/08/2025 03:57,desktop,Brave,iOS,,1,2025-03-08 3:57
E004695,U001696,doc_delete,,2024-02-03,DESKTOP,Chrome,Android,873,1,2024-02-03 18:30
E003490,U000968,share,,0000-00-00 00:00:00,,Safari,,,0,2023-05-04 2:53
E003226,U001882,doc_create,,2024-06-14 13:20,,Chrome,Windows,,,2024-06-14 13:20
E005490,u001585,ai_search,,2025-04-03,DESKTOP,Safari,Windows,,TRUE,2025-04-03 8:56
E004790,USR-002258,page_view,/integrations,,DESKTOP,Chrome,,,,2024-12-19 0:56
E008250,U001034,page_view,/dashboard,2023-11-09 8:19,mobile,,Windows,,,2023-11-09 8:19
E006391,U001018,ai_search,,12/24/2023 00:19,tablet,Safari,,196,FALSE,2023-12-24 0:19
E006940,U000104,share,,08/20/2024 09:15,tablet,Firefox,iOS,,TRUE,2024-08-20 9:15
E008022,U002237,search,,,,,Windows,749,1,2024-03-03 14:15
E001419,U001004,logout,/integrations,2023-11-14 23:45,desktop,Chrome,,,,2023-11-14 23:45
E003298,U001222,export,,12/26/2024 20:53,mobile,Firefox,iOS,unknown,TRUE,2024-12-26 20:53
E001937,U002293,search,,04/05/2024 12:21,desktop,Firefox,,,1,2024-04-05 12:21
E004528,U002491,doc_edit,,2024-02-18 15:20,,Brave,Linux,1041,TRUE,2024-02-18 15:20
E005246,U002105,export,,04/22/2023 15:54,mobile,Brave,iOS,unknown,FALSE,2023-04-22 15:54
E005115,U001349,comment,,2024-07-13,DESKTOP,Safari,,1172,1,2024-07-13 10:19
E001622,U000164,logout,/integrations,2025-04-30 7:49,DESKTOP,Firefox,,,0,2025-04-30 7:49
E008721,U001813,comment,,06/02/2023 18:43,,Edge,iOS,594,,2023-06-02 18:43
E003501,U002497,logout,/search,2024-08-22,mobile,Firefox,Windows,unknown,0,2024-08-22 13:41
E002392,U000517,comment,,0000-00-00 00:00:00,tablet,Edge,Windows,,0,2024-03-22 10:07
E004064,U000686,share,,2023-06-06,tablet,Edge,,,TRUE,2023-06-06 5:39
E002988,U002187,page_view,/help,,,Edge,Linux,1654,TRUE,2023-07-01 14:24
E006475,U001395,export,,,,Brave,macOS,unknown,1,2024-11-23 9:58
E007100,U000529,integration_error,,2023-10-01,tablet,Safari,macOS,unknown,TRUE,2023-10-01 10:01
E005714,U002529,page_view,/admin,2025-06-16,,,,,TRUE,2025-06-16 14:44
E004618,U001350,doc_delete,,0000-00-00 00:00:00,mobile,,,unknown,1,2023-04-05 6:51
E002386,u000821,login,/pricing,2024-04-17,desktop,Chrome,Windows,unknown,0,2024-04-17 18:04
E007562,U001138,logout,/billing,2023-11-24,DESKTOP,Firefox,Linux,,TRUE,2023-11-24 15:49
E000894,U000013,doc_edit,,2023-03-21,DESKTOP,Edge,,unknown,1,2023-03-21 19:37
E008435,U002020,doc_delete,,,mobile,Edge,,639,TRUE,2025-06-08 3:09
E008417,U002301,login,/help,,,Chrome,,,0,2023-10-23 7:37
E008339,u001968,search,,11/27/2023 11:36,DESKTOP,Edge,Linux,,TRUE,2023-11-27 11:36
E000233,U000841,login,/billing,2023-05-27,desktop,,macOS,,TRUE,2023-05-27 5:00
E008039,U002487,doc_create,,12/23/2023 09:31,desktop,Brave,iOS,unknown,FALSE,2023-12-23 9:31
E000048,U001832,export,,2024-01-30,,,,unknown,FALSE,2024-01-30 2:26
E007181,U002276,export,,2024-11-30 4:20,,,Windows,unknown,TRUE,2024-11-30 4:20
E008670,U000007,comment,,2025-05-11,,,,,0,2025-05-11 4:11
e008094,U002529,logout,/help,,tablet,,macOS,,,2023-05-19 13:30
e002409,U000446,login,/onboarding,2024-11-10 2:03,mobile,Firefox,Windows,,,2024-11-10 2:03
E005249,U001172,doc_delete,,2024-12-03,,Chrome,iOS,,0,2024-12-03 20:24
E002786, U001409 ,login,/search,03/29/2023 08:24,,Safari,Android,unknown,FALSE,2023-03-29 8:24
E001416,U001344,doc_create,,2023-10-11 13:46,,Firefox,macOS,unknown,1,2023-10-11 13:46
E000447,U002380,login,/onboarding,0000-00-00 00:00:00,,Safari,macOS,1614,FALSE,2023-05-14 16:27
E004604,U002040,comment,,2023-07-09 1:48,,,,,,2023-07-09 1:48
E006794,U000842,page_view,/admin,0000-00-00 00:00:00,DESKTOP,Chrome,Windows,unknown,0,2024-10-01 6:17
e006295, U000003 ,share,,06/14/2024 07:29,DESKTOP,Brave,,,TRUE,2024-06-14 7:29
E005968, U002089 ,login,/admin,2023-03-31,,Safari,,,FALSE,2023-03-31 0:05
E007443,U002025,page_view,/docs,06/02/2023 08:10,,Chrome,Linux,64,0,2023-06-02 8:10
E006721,U000904,login,/onboarding,2024-03-31 19:06,desktop,Edge,,472,,2024-03-31 19:06
E000336,U000824,integration_connect,,2025-02-26 12:11,tablet,Brave,Android,805,,2025-02-26 12:11
E004759,U002459,doc_delete,,01/27/2025 00:36,mobile,Chrome,macOS,,FALSE,2025-01-27 0:36
E001359,U000454,integration_connect,,2025-03-01,desktop,Edge,Windows,,TRUE,2025-03-01 12:41
E007761,U002571,integration_connect,,2025-04-27 23:41,desktop,Edge,Android,unknown,TRUE,2025-04-27 23:41
E003166,u001396,ai_search,,2024-02-14,DESKTOP,,Windows,unknown,0,2024-02-14 6:51
E003626,U002210,comment,,2023-05-30,DESKTOP,Chrome,Android,1371,TRUE,2023-05-30 13:16
E003881,U001928,integration_connect,,2023-01-27,DESKTOP,Safari,Linux,,TRUE,2023-01-27 13:00
E005697,U000294,integration_connect,,09/03/2024 22:05,DESKTOP,,Android,,TRUE,2024-09-03 22:05
E001535,U000506,integration_error,,,,,iOS,unknown,,2023-06-12 18:50
E005890,U000988,share,,01/22/2024 01:18,mobile,Brave,macOS,unknown,FALSE,2024-01-22 1:18
E000720,u000039,doc_create,,06/15/2025 02:58,,Chrome,Linux,,1,2025-06-15 2:58
E003501,U001817,integration_connect,,07/07/2023 07:21,,Safari,,1668,TRUE,2023-07-07 7:21
E007837,U001773,PAGE_VIEW,/search,,desktop,Brave,Linux,593,,2023-11-02 18:47
E006772,U001704,share,,2024-04-21 2:49,tablet,Firefox,Linux,,TRUE,2024-04-21 2:49
E002085,U000406,integration_connect,,,desktop,,,,,2023-01-23 11:32
E003019,U000561,doc_delete,,04/05/2025 11:32,mobile,Firefox,iOS,350,TRUE,2025-04-05 11:32
E001822,U002552,doc_delete,,2023-12-29 4:58,mobile,Safari,Android,unknown,TRUE,2023-12-29 4:58
E006696,U002383,share,,2023-09-01 7:25,desktop,Firefox,,,,2023-09-01 7:25
e004125,U002289,search,,06/11/2025 08:51,mobile,Brave,,unknown,TRUE,2025-06-11 8:51
E003591,U001009,doc_edit,,2025-03-24 6:50,tablet,Brave,iOS,unknown,,2025-03-24 6:50
 E005164,U002151,share,,2025-04-29,DESKTOP,Brave,iOS,1654,1,2025-04-29 2:53
E007113,U000169,doc_delete,,2023-05-31 10:53,desktop,,,503,TRUE,2023-05-31 10:53
E001700,U000502,comment,,2023-03-02,desktop,Brave,Linux,unknown,0,2023-03-02 9:17
E007693,USR-000262,share,,09/06/2023 06:15,DESKTOP,Safari,Android,unknown,FALSE,2023-09-06 6:15
E002096,U001948,integration_connect,,2023-10-20 1:37,DESKTOP,Chrome,Windows,1160,,2023-10-20 1:37
E004268,U001481,export,,12/09/2023 18:55,DESKTOP,Firefox,,,,2023-12-09 18:55
E005688,U000972,login,/dashboard,2024-05-30,,Safari,,,FALSE,2024-05-30 8:04
E003659,U000407,export,,02/09/2025 06:04,,,Android,unknown,FALSE,2025-02-09 6:04
E007067,U001027,comment,,2023-03-23,desktop,,Windows,908,TRUE,2023-03-23 9:19
E002738,U000360,integration_error,,08/19/2024 09:07,,Edge,macOS,1634,FALSE,2024-08-19 9:07
E001590,U002305,page_view,/billing,2023-04-16 6:41,desktop,Firefox,,1229,0,2023-04-16 6:41
E007004, U001161 ,doc_edit,,2025-06-12,desktop,Chrome,,,TRUE,2025-06-12 16:14
E000636,U002022,logout,/onboarding,0000-00-00 00:00:00,mobile,Firefox,Linux,unknown,TRUE,2024-01-06 4:13
E004445,u001382,integration_connect,,2023-02-10,tablet,Chrome,Windows,,TRUE,2023-02-10 14:06
E002755,U001425,search,,01/25/2023 11:35,DESKTOP,Safari,,unknown,FALSE,2023-01-25 11:35
E002722,U002379,logout,/search,04/07/2025 09:04,desktop,Firefox,macOS,699,FALSE,2025-04-07 9:04
E008126,U000582,ai_search,,03/21/2023 13:19,DESKTOP,Brave,,unknown,TRUE,2023-03-21 13:19
E000618,U002122,share,,2025-04-17 21:52,,Edge,Linux,,TRUE,2025-04-17 21:52
E002658,U000035,doc_edit,,2025-03-11 6:35,DESKTOP,Firefox,,704,0,2025-03-11 6:35
e001173, U001478 ,integration_connect,,05/02/2024 16:37,tablet,Chrome,,,FALSE,2024-05-02 16:37
E002111,U000008,logout,/admin,2023-09-08,,Firefox,Android,552,,2023-09-08 10:59
E006042,U001071,integration_error,,,,Chrome,macOS,unknown,0,2025-04-17 10:42
E006487,U000180,integration_error,,03/21/2023 20:47,mobile,Firefox,,unknown,,2023-03-21 20:47
E008030,U002066,integration_connect,,04/01/2025 11:20,,,macOS,unknown,FALSE,2025-04-01 11:20
E000028,U000041,integration_connect,,06/19/2025 15:56,DESKTOP,,iOS,,0,2025-06-19 15:56
E004493,U000738,logout,/dashboard,07/29/2024 23:30,tablet,,iOS,unknown,1,2024-07-29 23:30
E004383,U002395,export,,2023-06-01 18:35,tablet,Safari,,unknown,TRUE,2023-06-01 18:35
E002281,U001216,export,,2023-06-17,desktop,Safari,Linux,1415,TRUE,2023-06-17 1:24
E004610,U000896,search,,2025-05-06,desktop,,iOS,unknown,1,2025-05-06 8:04
E004963,U002361,integration_error,,2025-03-28,,,Android,,TRUE,2025-03-28 8:41
E006690,U002214,doc_create,,12/05/2024 12:19,desktop,Edge,Linux,,,2024-12-05 12:19
E006458,U002230,integration_error,,08/19/2024 17:14,DESKTOP,,,1550,TRUE,2024-08-19 17:14
E007304,U001703,doc_create,,2025-04-30 21:02,mobile,Edge,Windows,unknown,FALSE,2025-04-30 21:02
E004192,U001772,doc_create,,2024-02-06 0:50,,Safari,Windows,,,2024-02-06 0:50
E004988,U002407,login,/admin,2024-10-05 21:44,,Chrome,macOS,,FALSE,2024-10-05 21:44
E000062,U000252,DOC_DELETE,,03/06/2023 04:10,mobile,Firefox,iOS,unknown,TRUE,2023-03-06 4:10
E000272,U000162,login,/settings,2024-02-04 22:33,tablet,Brave,iOS,1467,FALSE,2024-02-04 22:33
E008865,U001137,export,,2024-01-21,mobile,Edge,,1496,,2024-01-21 19:48
E007510,U000823,doc_delete,,2023-02-16 13:30,,Brave,macOS,,1,2023-02-16 13:30
E003781,U000998,doc_edit,,,mobile,Edge,macOS,1110,1,2023-01-08 5:07
E004297,USR-001609,integration_connect,,2023-02-03 9:17,tablet,,Windows,641,FALSE,2023-02-03 9:17
E002759,U002140,login,/billing,2023-03-11,desktop,Brave,Linux,439,FALSE,2023-03-11 13:22
E001748, U000555 ,doc_create,,08/25/2024 23:49,tablet,Chrome,Linux,unknown,,2024-08-25 23:49
E005920,U000144,SEARCH,,12/21/2024 07:58,,Edge,,unknown,1,2024-12-21 7:58
E000573,U001052,integration_error,,2024-03-08 10:51,mobile,Chrome,Linux,379,0,2024-03-08 10:51
E002666,U000276,share,,2023-01-01,mobile,Brave,,1424,FALSE,2023-01-01 15:45
E001875,U002053,doc_delete,,08/30/2023 23:09,desktop,Edge,Windows,1586,TRUE,2023-08-30 23:09
E003339,U000327,doc_create,,2023-10-30,DESKTOP,,,,0,2023-10-30 19:29
E005096,U001007,search,,10/22/2023 02:19,,,macOS,1594,FALSE,2023-10-22 2:19
E006327,U001137,search,,05/11/2023 09:44,DESKTOP,Firefox,Linux,,FALSE,2023-05-11 9:44
E000849,U000747,share,,04/26/2024 13:42,,Edge,iOS,,,2024-04-26 13:42
E008103,U000810,integration_connect,,02/01/2025 21:40,,Brave,,22,TRUE,2025-02-01 21:40
E008324,U000564,doc_edit,,2025-06-11,mobile,Chrome,Windows,,FALSE,2025-06-11 15:28
E006960,U001363,comment,,2023-03-25,tablet,,Linux,,1,2023-03-25 14:48
E007572,U002225,integration_error,,10/19/2023 21:42,,Brave,,,1,2023-10-19 21:42
E003054,U000235,doc_edit,,09/04/2023 08:47,tablet,,Windows,,TRUE,2023-09-04 8:47
E005994,U000964,search,,03/27/2024 11:23,desktop,,macOS,,FALSE,2024-03-27 11:23
E007846,U001938,integration_error,,2024-05-07,tablet,,iOS,1103,0,2024-05-07 1:27
E005615,U002229,integration_error,,05/30/2023 11:56,,Firefox,,unknown,FALSE,2023-05-30 11:56
E001428,U000481,doc_create,,2024-03-10,DESKTOP,Safari,iOS,,,2024-03-10 3:52
E003255,U001429,ai_search,,02/05/2023 09:22,,Chrome,Android,,FALSE,2023-02-05 9:22
E001773,U000331,doc_edit,,2024-06-22,,,,156,TRUE,2024-06-22 21:35
E003580,U001626,page_view,/billing,2023-07-21 2:51,DESKTOP,Edge,Android,,TRUE,2023-07-21 2:51
E006067,U000576,login,/settings,2024-02-16 14:51,tablet,Safari,Android,,,2024-02-16 14:51
E001400,U002455,integration_error,,04/14/2023 18:41,DESKTOP,Chrome,Windows,unknown,TRUE,2023-04-14 18:41
E002127,U001886,comment,,01/15/2025 12:18,tablet,,macOS,,TRUE,2025-01-15 12:18
E007427,U000489,ai_search,,2024-08-13,tablet,Chrome,macOS,unknown,FALSE,2024-08-13 11:33
E004158,U000659,integration_error,,2024-04-30 4:43,tablet,Firefox,macOS,778,TRUE,2024-04-30 4:43
E001070,U002319,comment,,11/30/2023 06:11,mobile,Edge,Linux,1704,FALSE,2023-11-30 6:11
E000376,U001854,integration_connect,,2024-08-14 6:31,desktop,Brave,Android,,TRUE,2024-08-14 6:31
E006461,U002068,doc_edit,,09/11/2023 18:10,mobile,,iOS,unknown,TRUE,2023-09-11 18:10
E003957,U001341,page_view,/search,06/25/2023 20:55,,Edge,iOS,,TRUE,2023-06-25 20:55
E001956,U001644,integration_connect,,2023-11-06 23:47,tablet,,,,TRUE,2023-11-06 23:47
E002454,U000018,share,,2024-11-03 6:54,,Chrome,Linux,,,2024-11-03 6:54
E006961,U000056,ai_search,,2024-09-14,,Brave,,56,0,2024-09-14 1:43
E000002,U002340,integration_connect,,2024-01-14,desktop,Firefox,,unknown,FALSE,2024-01-14 14:39
E008702,U001373,doc_edit,,2025-03-03 3:36,mobile,,,,0,2025-03-03 3:36
E002789,U002191,login,/onboarding,02/03/2025 16:58,,Chrome,Android,,1,2025-02-03 16:58
E001534,U000073,login,/docs,06/16/2024 03:32,tablet,,macOS,unknown,,2024-06-16 3:32
E005323,U001270,comment,,2024-11-24,desktop,Firefox,,1024,0,2024-11-24 14:15
E007577,U000736,export,,2023-12-28 1:59,tablet,Edge,Windows,1014,FALSE,2023-12-28 1:59
E000433,U000386,doc_delete,,2023-11-23,tablet,Brave,,unknown,FALSE,2023-11-23 1:28
E004007,U001512,ai_search,,06/18/2024 23:38,DESKTOP,Safari,Android,unknown,,2024-06-18 23:38
E001902,U000001,doc_create,,09/29/2024 18:07,,Safari,,885,TRUE,2024-09-29 18:07
E005142,U001315,doc_create,,10/07/2024 21:20,tablet,,iOS,unknown,1,2024-10-07 21:20
E003056,u002294,share,,12/23/2024 12:37,DESKTOP,Brave,iOS,unknown,FALSE,2024-12-23 12:37
E004291,U000061,doc_delete,,04/29/2025 04:35,,Edge,Android,,FALSE,2025-04-29 4:35
E004268,U002076,page_view,/pricing,2024-04-29,,Firefox,Linux,,TRUE,2024-04-29 7:12
e002965,U000302,search,,2024-04-18 18:00,,,macOS,860,,2024-04-18 18:00
E006551,U001688,search,,07/01/2023 00:03,desktop,Brave,iOS,,TRUE,2023-07-01 0:03
E006057,u002490,page_view,/settings,2024-12-28 13:48,mobile,Firefox,iOS,682,TRUE,2024-12-28 13:48
E004738,U000068,login,/help,2023-09-22,mobile,,,962,1,2023-09-22 21:09
E004103,U001076,ai_search,,11/13/2023 21:40,,Chrome,macOS,,TRUE,2023-11-13 21:40
E002250,U001300,doc_delete,,2023-12-05,,,Android,1763,TRUE,2023-12-05 19:08
E008781,U000009,search,,2024-04-30 13:55,,Firefox,Linux,,TRUE,2024-04-30 13:55
E007440,U000250,doc_create,,05/08/2025 10:47,DESKTOP,,macOS,1673,,2025-05-08 10:47
E007141,U001496,logout,/admin,04/15/2025 07:37,tablet,Safari,Linux,1293,,2025-04-15 7:37
E005948,U000645,export,,03/10/2025 16:40,desktop,Chrome,,,1,2025-03-10 16:40
E007092,U001880,comment,,2023-05-08 9:23,mobile,Edge,macOS,,FALSE,2023-05-08 9:23
E003226,U002049,doc_create,,01/28/2024 19:44,DESKTOP,Safari,macOS,,TRUE,2024-01-28 19:44
E002526,U001381,logout,/onboarding,2024-01-19 0:34,mobile,Chrome,Android,unknown,,2024-01-19 0:34
E002259,U001929,page_view,/docs,2023-01-24,,Safari,Linux,unknown,TRUE,2023-01-24 19:27
E003322,U002531,doc_delete,,2023-04-19 14:40,tablet,,iOS,,FALSE,2023-04-19 14:40
E000988,USR-001272,integration_connect,,2024-10-01 20:44,,Safari,macOS,unknown,TRUE,2024-10-01 20:44
E008974,U000158,ai_search,,2024-06-07,tablet,Brave,macOS,unknown,TRUE,2024-06-07 21:31
E008154,U002554,doc_delete,,01/20/2024 10:50,mobile,Brave,Linux,unknown,FALSE,2024-01-20 10:50
E001316,U001477,doc_delete,,2023-10-30,DESKTOP,Brave,macOS,unknown,,2023-10-30 10:14
E002947,U000142,comment,,05/02/2024 02:12,,,,785,,2024-05-02 2:12
E006154,u000944,export,,2024-08-05 12:12,,,,unknown,0,2024-08-05 12:12
E000519,U001391,integration_error,,2023-05-15 6:06,,,iOS,,1,2023-05-15 6:06
E007280,U001044,logout,/onboarding,2024-01-27,DESKTOP,Edge,iOS,1471,TRUE,2024-01-27 12:02
E008328,U002291,integration_error,,2024-12-04,,Edge,,,FALSE,2024-12-04 21:02
 E005924,U000709,login,/integrations,2024-05-15 14:19,,,,unknown,FALSE,2024-05-15 14:19
E000380,U002243,page_view,/admin,2025-04-22 6:51,DESKTOP,,macOS,,TRUE,2025-04-22 6:51
E000246,USR-000976,ai_search,,2025-01-21 12:40,,,,331,,2025-01-21 12:40
E003258,U002422,logout,/billing,03/09/2023 11:23,desktop,Edge,,,TRUE,2023-03-09 11:23
E008672,U001398,integration_error,,,,Edge,Linux,,,2025-05-09 4:00
E000317,U002382,logout,/onboarding,2024-08-28,desktop,Firefox,,unknown,1,2024-08-28 16:29
E006125,U000165,share,,2024-08-21 23:53,DESKTOP,Chrome,iOS,unknown,1,2024-08-21 23:53
E002733,U002386,integration_connect,,07/22/2024 06:12,desktop,,Android,1406,0,2024-07-22 6:12
E002760,U000296,doc_create,,02/11/2024 00:31,desktop,,,1228,1,2024-02-11 0:31
E003630,U001218,login,/help,07/03/2024 14:36,,Firefox,macOS,1630,TRUE,2024-07-03 14:36
E005008,U001434,export,,06/08/2024 22:30,tablet,Brave,Windows,215,0,2024-06-08 22:30
E007107,U000036,comment,,,desktop,Safari,Linux,,1,2023-04-16 7:50
E003040,U001981,doc_edit,,2024-11-03 17:58,,Brave,macOS,136,0,2024-11-03 17:58
E005842,U000482,doc_create,,2024-08-31 4:46,DESKTOP,Edge,,,FALSE,2024-08-31 4:46
E000535,U001629,logout,/admin,2024-08-11,mobile,Firefox,Windows,unknown,,2024-08-11 20:19
E005683,U002363,LOGOUT,/dashboard,02/25/2025 23:32,desktop,Edge,,,0,2025-02-25 23:32
E008531,U000522,doc_delete,,12/19/2023 18:48,desktop,,macOS,1223,FALSE,2023-12-19 18:48
E003069,U001299,doc_delete,,06/04/2024 10:58,,Chrome,Linux,,TRUE,2024-06-04 10:58
E006166,U001866,search,,2023-07-15 4:23,desktop,Chrome,macOS,687,1,2023-07-15 4:23
E004527,U001538,doc_create,,05/03/2024 15:46,,,Android,809,,2024-05-03 15:46
E006493,USR-001136,page_view,/dashboard,2024-02-10,DESKTOP,,Linux,,,2024-02-10 12:45
E005148,U000541,doc_edit,,,desktop,Chrome,Android,,FALSE,2025-02-12 17:39
E003524,U001211,doc_delete,,2023-12-23,mobile,Edge,macOS,unknown,TRUE,2023-12-23 22:57
E004151,U002545,doc_edit,,04/14/2025 13:34,desktop,Edge,,unknown,,2025-04-14 13:34
E008947,U000024,page_view,/settings,2024-01-09,DESKTOP,Safari,macOS,,,2024-01-09 17:02
E008404,u001261,INTEGRATION_ERROR,,2023-09-24 8:38,desktop,Safari,Windows,,,2023-09-24 8:38
E005190,U000273,search,,0000-00-00 00:00:00,desktop,,,unknown,FALSE,2024-08-14 19:47
E002292,U001910,page_view,/admin,2023-01-31,DESKTOP,Firefox,iOS,676,TRUE,2023-01-31 6:55
E004589,U000981,ai_search,,12/20/2024 16:17,tablet,Chrome,Linux,503,FALSE,2024-12-20 16:17
E002152,U001027,export,,2023-02-21,,Brave,Android,unknown,TRUE,2023-02-21 22:52
E003464,U001614,integration_error,,12/04/2023 13:09,,,Android,unknown,,2023-12-04 13:09
E008129,U000027,page_view,/onboarding,02/18/2023 21:21,,,,,FALSE,2023-02-18 21:21
E008589,U002421,share,,2024-09-02 15:03,DESKTOP,,Windows,,TRUE,2024-09-02 15:03
E001983,U002446,page_view,/help,2023-05-24,desktop,Safari,Linux,,FALSE,2023-05-24 0:46
E002938,U001694,share,,03/05/2024 17:05,,Brave,Android,987,TRUE,2024-03-05 17:05
E000533,u001449,export,,,tablet,Chrome,iOS,,TRUE,2024-08-30 14:48
E008406,U000658,page_view,/dashboard,06/01/2023 09:18,desktop,Brave,,,TRUE,2023-06-01 9:18
E000040,U001766,export,,2023-07-21 18:46,,Safari,iOS,unknown,1,2023-07-21 18:46
E006314,U002444,page_view,/admin,2025-01-10,mobile,Edge,,,TRUE,2025-01-10 14:47
E001575,U002155,integration_connect,,2023-05-14 5:18,,,Linux,unknown,TRUE,2023-05-14 5:18
E002108,U001506,search,,04/22/2023 15:42,DESKTOP,,Android,,,2023-04-22 15:42
E005107,U001195,ai_search,,2025-06-03 11:59,mobile,Safari,iOS,unknown,0,2025-06-03 11:59
E005989,U002090,integration_error,,2024-08-27 20:56,desktop,,Windows,696,FALSE,2024-08-27 20:56
E001524,U001898,login,/dashboard,11/27/2023 08:17,DESKTOP,Brave,Linux,,TRUE,2023-11-27 8:17
E000208,U001017,integration_connect,,10/04/2024 21:45,DESKTOP,Edge,,unknown,TRUE,2024-10-04 21:45
E004165,U000299,export,,09/18/2023 09:28,tablet,Chrome,,245,,2023-09-18 9:28
E000716,U001622,comment,,03/08/2025 22:16,DESKTOP,Safari,iOS,,TRUE,2025-03-08 22:16
E001625,U002371,login,/settings,2024-05-07,DESKTOP,,Windows,,FALSE,2024-05-07 17:35
E004332,U001918,login,/settings,2023-01-23 16:16,tablet,Edge,Android,,FALSE,2023-01-23 16:16
e000057,U002556,integration_connect,,04/21/2025 14:17,,,,,FALSE,2025-04-21 14:17
E005969,U000775,doc_edit,,2024-04-25 6:19,tablet,Chrome,,,TRUE,2024-04-25 6:19
e003529,U000323,search,,2024-08-09,desktop,Firefox,Linux,unknown,FALSE,2024-08-09 18:58
E001445,U000775,comment,,03/31/2025 07:54,,Edge,macOS,,TRUE,2025-03-31 7:54
E003478,U002581,page_view,/billing,2025-05-25 19:12,tablet,Chrome,macOS,,FALSE,2025-05-25 19:12
E000782,U002384,doc_create,,2023-08-29,,Brave,Android,,FALSE,2023-08-29 15:40
E002531,U002580,login,/admin,2024-08-03 15:04,DESKTOP,Safari,macOS,unknown,FALSE,2024-08-03 15:04
E004618,U001574,page_view,/settings,2023-06-29,desktop,Brave,Android,826,1,2023-06-29 23:38
E005763,U001658,export,,2024-08-31 22:12,mobile,,Android,,TRUE,2024-08-31 22:12
E006152,U000203,comment,,,mobile,Brave,,,TRUE,2023-11-19 12:06
E003193,U000148,export,,10/29/2024 11:04,desktop,Chrome,Windows,unknown,1,2024-10-29 11:04
E004375,U002144,page_view,/integrations,2023-09-27,desktop,Safari,Android,unknown,TRUE,2023-09-27 20:45
E003089,u002294,comment,,2023-09-12 14:22,,Safari,Linux,unknown,1,2023-09-12 14:22
E004323,U002556,comment,,2024-11-01,,,Android,unknown,1,2024-11-01 3:45
E004949,U001100,integration_error,,2024-09-01 16:15,mobile,Edge,,1548,FALSE,2024-09-01 16:15
E007512, U001799 ,logout,/onboarding,01/30/2023 18:23,,Chrome,Linux,,,2023-01-30 18:23
E004862,U000374,login,/onboarding,2024-06-26 21:56,desktop,,Windows,unknown,,2024-06-26 21:56
E008687,U002503,integration_connect,,2024-12-28 18:42,mobile,Chrome,macOS,unknown,FALSE,2024-12-28 18:42
E005179,U001958,doc_create,,2023-06-08,,Brave,Windows,,FALSE,2023-06-08 4:26
E001284,U002133,integration_error,,0000-00-00 00:00:00,desktop,,,,0,2024-09-23 19:55
e008209,U002049,export,,2023-03-28 18:45,,Brave,Android,,,2023-03-28 18:45
e003807,U001011,export,,05/23/2025 10:28,DESKTOP,Edge,iOS,unknown,0,2025-05-23 10:28
E008706,U001656,doc_delete,,2024-09-12 1:05,DESKTOP,,,,TRUE,2024-09-12 1:05
E008184,u002376,doc_create,,06/09/2025 02:44,DESKTOP,Safari,,,FALSE,2025-06-09 2:44
E005817,U001056,doc_delete,,,mobile,Edge,macOS,unknown,TRUE,2025-04-20 1:19
E003351,U001291,doc_delete,,2024-05-23 16:52,tablet,Firefox,iOS,372,FALSE,2024-05-23 16:52
E004548,U000182,page_view,/pricing,2024-02-22,desktop,Edge,macOS,,0,2024-02-22 8:57
E001632,U000387,doc_create,,08/10/2024 09:35,,,iOS,unknown,0,2024-08-10 9:35
E001291,U001536,doc_delete,,,tablet,Edge,macOS,unknown,FALSE,2023-12-07 14:33
E003705,U002151,login,/help,2025-02-17 7:57,DESKTOP,Brave,Windows,unknown,FALSE,2025-02-17 7:57
E003480,U001959,share,,2023-09-04 11:21,DESKTOP,,iOS,1438,FALSE,2023-09-04 11:21
E000107,U000323,login,/help,2025-05-28,tablet,Edge,,,FALSE,2025-05-28 11:11
E001420,U001769,integration_error,,2023-03-08,desktop,,Windows,,0,2023-03-08 19:22
E000995,U001493,login,/admin,2023-12-30 6:24,desktop,Safari,Android,unknown,0,2023-12-30 6:24
E001273,U000640,doc_edit,,2023-11-12 6:02,DESKTOP,,Linux,,1,2023-11-12 6:02
E005140, U000569 ,integration_connect,,,tablet,,macOS,,,2023-12-21 22:12
E007971,U002538,page_view,/pricing,03/10/2023 11:27,tablet,,Android,993,0,2023-03-10 11:27
E004978,U001602,ai_search,,2023-07-17 4:02,desktop,Brave,,645,1,2023-07-17 4:02
E001867,U000248,doc_delete,,02/19/2025 16:55,desktop,Safari,macOS,990,TRUE,2025-02-19 16:55
 E006623,U001810,search,,2025-04-25,desktop,,,unknown,FALSE,2025-04-25 13:43
E006926,U000732,integration_error,,10/02/2024 13:09,,Chrome,Android,,FALSE,2024-10-02 13:09
E000718,U002271,integration_connect,,2023-12-22,,Brave,Android,,TRUE,2023-12-22 10:22
E008272,U000618,doc_create,,2024-12-29,tablet,,macOS,unknown,,2024-12-29 15:52
E006033,U001717,share,,2025-06-12 8:55,DESKTOP,Chrome,Linux,,FALSE,2025-06-12 8:55
E008977,U000309,integration_connect,,2023-05-21,desktop,,macOS,unknown,,2023-05-21 2:35
E006478,U001991,doc_delete,,2024-09-16,desktop,Chrome,,,,2024-09-16 23:26
E008146,U001292,doc_edit,,2023-09-13,DESKTOP,,iOS,371,TRUE,2023-09-13 5:08
E007638,U002309,doc_edit,,2023-12-18,desktop,,iOS,,FALSE,2023-12-18 21:06
E008541,U000238,comment,,2024-12-14 20:27,tablet,Firefox,,,FALSE,2024-12-14 20:27
E006070,U001937,logout,/docs,09/25/2024 07:41,desktop,Chrome,,unknown,0,2024-09-25 7:41
 E008498,U000249,search,,2025-03-25,,Edge,,unknown,TRUE,2025-03-25 4:16
E004034,U001991,doc_create,,2024-05-23,DESKTOP,,Windows,unknown,0,2024-05-23 9:59
e004220, U000569 ,search,,2023-11-19,tablet,,iOS,1024,TRUE,2023-11-19 10:45
E006496,U001671,login,/settings,10/15/2024 00:49,desktop,Chrome,macOS,124,,2024-10-15 0:49
E008212,U001375,doc_create,,2024-06-30,desktop,Edge,macOS,,TRUE,2024-06-30 23:56
E000475,U002295,comment,,2024-04-08 15:32,desktop,Brave,,unknown,TRUE,2024-04-08 15:32
E007971,U000505,doc_edit,,06/06/2025 03:42,mobile,Chrome,macOS,unknown,TRUE,2025-06-06 3:42
E008159,U000244,integration_connect,,03/26/2023 15:56,,Firefox,,,TRUE,2023-03-26 15:56
E008802,u000887,logout,/docs,,,Chrome,macOS,39,FALSE,2023-06-19 11:00
E005932, u001844 ,integration_error,,03/31/2024 09:40,DESKTOP,Brave,,,1,2024-03-31 9:40
E003560,U001991,page_view,/billing,2024-04-24 1:06,,Firefox,iOS,,1,2024-04-24 1:06
E007888,U002545,integration_connect,,04/25/2024 15:42,desktop,Firefox,,unknown,,2024-04-25 15:42
E005064,U001313,doc_delete,,0000-00-00 00:00:00,,Edge,,unknown,0,2023-08-03 22:01
E007169,U002463,doc_edit,,2023-05-01,tablet,Edge,Windows,,,2023-05-01 20:08
E003837,u001949,doc_delete,,2023-07-08,mobile,Edge,macOS,309,1,2023-07-08 0:54
E002682,U001937,comment,,05/30/2025 18:22,DESKTOP,,Android,unknown,,2025-05-30 18:22
E000209,U002106,DOC_DELETE,,2023-01-28,DESKTOP,Brave,macOS,,FALSE,2023-01-28 18:16
E006052,U001173,login,/docs,2024-02-19 0:56,tablet,Chrome,,,0,2024-02-19 0:56
E007476,U002543,comment,,2023-01-02,tablet,Safari,macOS,882,0,2023-01-02 8:50
E005547,U001919,doc_create,,01/12/2023 01:06,tablet,,,759,1,2023-01-12 1:06
E006797,U002354,page_view,/admin,04/04/2023 22:52,,Safari,macOS,879,FALSE,2023-04-04 22:52
E003762,U001103,doc_edit,,2023-08-04,,,iOS,,FALSE,2023-08-04 2:50
E005071,U000465,doc_create,,02/18/2023 05:03,tablet,Firefox,Windows,,FALSE,2023-02-18 5:03
e008225,U001934,logout,/dashboard,01/14/2023 04:48,tablet,Edge,iOS,unknown,,2023-01-14 4:48
E002896,U001931,doc_delete,,04/23/2024 03:41,desktop,,,,0,2024-04-23 3:41
E005185,U001797,doc_create,,0000-00-00 00:00:00,desktop,,Windows,unknown,FALSE,2024-04-07 13:13
e007280,U002394,page_view,/integrations,03/29/2024 20:36,DESKTOP,Safari,iOS,unknown,TRUE,2024-03-29 20:36
E005883,U001838,login,/search,2025-03-29 11:25,DESKTOP,,iOS,1177,,2025-03-29 11:25
E000784,U001099,integration_connect,,03/25/2025 13:16,,Chrome,Windows,,TRUE,2025-03-25 13:16
E000469,U000164,search,,06/20/2023 03:26,tablet,,Windows,,,2023-06-20 3:26
E008151,U000687,ai_search,,,tablet,Firefox,iOS,,0,2025-06-15 10:33
E002784,U001781,share,,04/21/2023 08:39,DESKTOP,,,,,2023-04-21 8:39
E004689,U002099,doc_create,,2024-05-27,desktop,,Android,,TRUE,2024-05-27 21:43
E004203,U000320,integration_error,,2023-07-02 21:18,,Firefox,Windows,,1,2023-07-02 21:18
E002818,U001226,login,/billing,,mobile,Chrome,,1277,,2023-12-04 10:40
E008174,U001332,ai_search,,2023-08-08,,Safari,iOS,875,,2023-08-08 2:02
e008973,U001120,EXPORT,,2024-02-02 9:56,DESKTOP,,Windows,,TRUE,2024-02-02 9:56
E000596,U001410,doc_delete,,,desktop,Safari,,,TRUE,2023-01-27 18:20
E001456,U001414,integration_error,,07/15/2023 04:07,desktop,,Linux,unknown,TRUE,2023-07-15 4:07
E008769,U001574,doc_create,,0000-00-00 00:00:00,,Chrome,Android,unknown,1,2023-08-31 17:22
 E004597,U000272,comment,,2025-02-20 16:52,desktop,Chrome,Windows,,1,2025-02-20 16:52
E004447,U001608,doc_create,,2024-02-14 7:07,,,,1244,,2024-02-14 7:07
E002764,U001224,share,,2024-11-11 1:42,,,iOS,,FALSE,2024-11-11 1:42
E000891,U001943,doc_edit,,03/12/2024 10:05,DESKTOP,Chrome,macOS,,0,2024-03-12 10:05
E007685,U001367,login,/integrations,2023-08-19,desktop,Firefox,,673,FALSE,2023-08-19 4:32
E007735,U001528,DOC_EDIT,,07/11/2024 05:37,,Chrome,,,FALSE,2024-07-11 5:37
E006081,U001522,page_view,/billing,2023-10-14 2:26,tablet,Safari,,,FALSE,2023-10-14 2:26
E003467,U000023,export,,2023-03-10 7:48,desktop,,macOS,,TRUE,2023-03-10 7:48
E006398,U000489,integration_connect,,2023-07-06 17:06,,,,,0,2023-07-06 17:06
E000293,U000673,doc_create,,2023-05-31 15:17,,Edge,Android,,,2023-05-31 15:17
E002914,U000272,login,/search,2024-03-26,DESKTOP,Brave,iOS,unknown,TRUE,2024-03-26 20:33
E005472,U000245,search,,0000-00-00 00:00:00,mobile,Firefox,Android,,0,2025-03-15 8:20
E007599,U002253,export,,2023-03-25 1:50,desktop,,macOS,unknown,FALSE,2023-03-25 1:50
E004579,u000773,doc_delete,,2025-03-17,,Safari,Linux,unknown,,2025-03-17 13:29
E006354,U001896,page_view,/pricing,11/29/2024 05:57,,Brave,Windows,unknown,0,2024-11-29 5:57
E004320,U000781,export,,02/04/2025 00:23,mobile,Firefox,,,FALSE,2025-02-04 0:23
e007664,U000383,doc_create,,12/10/2023 09:18,,,,486,FALSE,2023-12-10 9:18
E002168,U000580,doc_create,,0000-00-00 00:00:00,,Chrome,Android,,,2024-12-08 22:28
E008057,U000466,logout,/settings,2024-12-27 3:23,desktop,Brave,,unknown,TRUE,2024-12-27 3:23
E006915,U002287,ai_search,,2024-06-25,,Safari,iOS,,TRUE,2024-06-25 22:19
E006296,U000261,login,/admin,02/17/2023 17:08,,,macOS,,1,2023-02-17 17:08
E007506,U001792,page_view,/docs,2023-05-21 12:38,mobile,Safari,iOS,988,1,2023-05-21 12:38
E007196,U000614,login,/docs,2023-05-30 19:23,,Safari,Android,,TRUE,2023-05-30 19:23
E002430,U000518,comment,,2024-10-22 10:20,,Brave,Android,,,2024-10-22 10:20
E008879,U000724,integration_error,,2023-12-27 16:19,,,iOS,unknown,1,2023-12-27 16:19
E002394,U002402,export,,2024-12-08 21:35,tablet,Chrome,Android,1394,,2024-12-08 21:35
E002556, U000608 ,logout,/integrations,03/25/2025 11:21,,,Windows,,,2025-03-25 11:21
E003939, u002493 ,integration_connect,,2024-06-18,DESKTOP,,,,,2024-06-18 3:47
E000770, U002316 ,ai_search,,,,Brave,iOS,unknown,1,2023-06-29 5:53
E004789,U001817,login,/pricing,2024-01-08,,Firefox,,631,TRUE,2024-01-08 2:13
e000543,U000425,logout,/onboarding,2025-01-03 12:47,,Edge,Android,,FALSE,2025-01-03 12:47
E002359,U002546,ai_search,,10/22/2023 14:44,DESKTOP,Chrome,,unknown,TRUE,2023-10-22 14:44
E003470,u002513,share,,04/09/2023 22:02,,Firefox,,unknown,FALSE,2023-04-09 22:02
E007358,U000609,integration_connect,,,desktop,Safari,,1632,FALSE,2024-07-03 5:06
E008030,U000391,ai_search,,2023-10-24,tablet,,Android,unknown,1,2023-10-24 18:39
E007194,U000396,share,,2025-01-03,mobile,,,,,2025-01-03 14:04
E006640,U001468,login,/settings,2024-09-03 15:52,desktop,Firefox,,,0,2024-09-03 15:52
E002097,U000898,doc_delete,,0000-00-00 00:00:00,,Chrome,macOS,unknown,FALSE,2024-11-13 9:17
E005279,U001167,comment,,2024-12-31 9:10,,Safari,Windows,unknown,0,2024-12-31 9:10
E001747,U000393,doc_edit,,05/18/2023 16:28,DESKTOP,Safari,Linux,,FALSE,2023-05-18 16:28
E001401,U000140,comment,,07/31/2024 09:09,tablet,Brave,iOS,unknown,,2024-07-31 9:09
 E001631,U002240,doc_create,,08/12/2023 21:07,DESKTOP,Chrome,,1627,0,2023-08-12 21:07
E001775,U000967,export,,,,,iOS,,0,2023-12-29 17:10
E006737,U001898,integration_error,,03/16/2025 05:29,mobile,Chrome,iOS,unknown,FALSE,2025-03-16 5:29
E004373,U000749,export,,04/09/2025 22:54,desktop,Safari,,,1,2025-04-09 22:54
E000564,u000517,doc_delete,,2025-01-23,DESKTOP,Firefox,,,FALSE,2025-01-23 11:52
E000080,U001940,doc_edit,,,,Firefox,Android,unknown,TRUE,2025-01-01 17:10
E008449,U001236,integration_connect,,05/02/2024 16:07,tablet,Safari,Android,836,1,2024-05-02 16:07
E002670,U000971,integration_error,,02/25/2024 18:45,mobile,Brave,Windows,649,FALSE,2024-02-25 18:45
E006336,U000630,share,,09/14/2024 13:42,DESKTOP,,Linux,unknown,1,2024-09-14 13:42
E002360,U002578,doc_create,,2023-07-26,,Chrome,,260,0,2023-07-26 17:58
E001263,U001879,doc_create,,2024-04-15,desktop,Safari,iOS,unknown,TRUE,2024-04-15 15:54
E005214,  U000526  ,EXPORT,,11/23/2023 11:59,,Brave,Linux,1086,TRUE,2023-11-23 11:59
E005756,U001907,ai_search,,2024-10-30 12:06,,Safari,iOS,1138,TRUE,2024-10-30 12:06
E000301,U000186,search,,2023-03-25 5:28,DESKTOP,Edge,Android,515,FALSE,2023-03-25 5:28
e003106,U000824,share,,2024-08-20 19:23,,Edge,macOS,,0,2024-08-20 19:23
E005046,USR-001511,logout,/pricing,08/07/2024 16:01,,Brave,macOS,219,,2024-08-07 16:01
E005261,U000767,share,,06/15/2024 16:52,,Firefox,Windows,unknown,0,2024-06-15 16:52
E005145,U000096,search,,07/30/2023 09:09,,Edge,,797,FALSE,2023-07-30 9:09
E005296,U001295,doc_edit,,,,Chrome,Linux,863,0,2025-02-08 3:14
E006883,U001415,comment,,2025-03-02 1:15,,Edge,,,,2025-03-02 1:15
E000318,U000405,doc_create,,2024-06-06 7:20,desktop,,macOS,,FALSE,2024-06-06 7:20
E002141,U000653,ai_search,,2023-05-19,DESKTOP,Chrome,Android,558,TRUE,2023-05-19 21:47
E003847,U000455,doc_create,,2025-02-14,mobile,,Android,,,2025-02-14 15:22
E000873,U000561,logout,/admin,2024-07-18,tablet,Firefox,,,1,2024-07-18 8:03
E006009,U001469,integration_error,,2024-10-05,,Brave,iOS,,1,2024-10-05 20:27
E000662,U000433,ai_search,,2024-02-11,,,macOS,,,2024-02-11 22:08
E008495,u002175,export,,2023-11-01 15:46,,Edge,macOS,unknown,FALSE,2023-11-01 15:46
E003637,U002298,logout,/help,2025-02-09,tablet,Firefox,macOS,,TRUE,2025-02-09 22:56
E002152,U000230,ai_search,,2023-06-01,,Brave,Linux,unknown,,2023-06-01 14:28
E005609,USR-000483,login,/dashboard,10/10/2024 09:27,DESKTOP,,Android,unknown,TRUE,2024-10-10 9:27
E006329,U002225,doc_delete,,07/09/2024 20:50,mobile,Firefox,,unknown,1,2024-07-09 20:50
E008221,USR-002291,page_view,/docs,2024-10-30 10:33,desktop,Firefox,Linux,,FALSE,2024-10-30 10:33
E005960,u001725,export,,,tablet,Edge,macOS,,1,2023-03-23 15:23
E003321,U000643,integration_error,,09/09/2024 00:34,desktop,Edge,macOS,,FALSE,2024-09-09 0:34
E007526,U000655,page_view,/integrations,2024-04-08 6:22,desktop,Firefox,Android,,,2024-04-08 6:22
E000065,u001585,comment,,2023-03-13 21:12,desktop,,iOS,,,2023-03-13 21:12
E002717,U002327,doc_edit,,,,Brave,Android,1094,0,2025-05-25 16:53
E007044,U001271,integration_error,,01/14/2024 04:29,desktop,Firefox,Windows,,TRUE,2024-01-14 4:29
E003967, U001372 ,login,/help,2025-04-17 5:03,desktop,Brave,Windows,60,,2025-04-17 5:03
E007713,U002196,doc_create,,08/02/2023 05:40,tablet,Edge,,,,2023-08-02 5:40
E001309,U000079,export,,2024-04-15,DESKTOP,,,,,2024-04-15 15:18
E001598,U000387,integration_connect,,04/10/2024 17:43,,Chrome,,921,FALSE,2024-04-10 17:43
E005938,U000638,share,,02/17/2025 11:46,DESKTOP,Chrome,macOS,unknown,1,2025-02-17 11:46
E001940,U000123,logout,/docs,2025-02-09,DESKTOP,Edge,,unknown,0,2025-02-09 7:31
e005315,U002575,LOGOUT,/pricing,,,Chrome,,,TRUE,2023-11-03 3:52
e000985,U002411,integration_connect,,2024-09-12,,Firefox,Linux,,FALSE,2024-09-12 1:58
E006207,U001778,doc_delete,,0000-00-00 00:00:00,DESKTOP,Brave,Linux,unknown,,2024-10-13 15:29
E003180,U000782,doc_create,,2024-10-17,,,macOS,,,2024-10-17 17:29
E007281,U001619,comment,,,,,Linux,,,2023-01-20 16:57
E000058,USR-002556,integration_error,,,,Firefox,,,1,2023-12-06 6:55
E000884,U001768,page_view,/settings,2025-04-07,tablet,Chrome,Android,,1,2025-04-07 9:54
E001565,U002185,share,,07/17/2023 22:54,desktop,,Linux,,1,2023-07-17 22:54
E001796,U001318,ai_search,,06/15/2025 06:31,desktop,Brave,iOS,unknown,,2025-06-15 6:31
E005396,U001831,share,,2023-01-26 4:16,,Edge,iOS,,FALSE,2023-01-26 4:16
E005668,U001938,integration_error,,2023-02-14 9:29,desktop,Brave,,,FALSE,2023-02-14 9:29
E002527,U001432,comment,,2023-04-27,mobile,Edge,,unknown,0,2023-04-27 0:27
E004428,U002073,integration_connect,,2023-11-29 13:12,,Chrome,macOS,,FALSE,2023-11-29 13:12
E002030,U001609,login,/settings,06/17/2024 16:23,,Chrome,Linux,500,,2024-06-17 16:23
E004697,U002502,doc_delete,,2023-06-08,,Chrome,iOS,,,2023-06-08 22:32
E004711,U002426,comment,,2023-01-28 9:39,DESKTOP,Firefox,,,FALSE,2023-01-28 9:39
E008210, U000176 ,integration_connect,,08/23/2024 09:47,,Firefox,Android,unknown,TRUE,2024-08-23 9:47
E000803,U002253,search,,2025-06-13,mobile,,,189,,2025-06-13 8:15
E004950,U000140,logout,/dashboard,03/21/2024 08:14,,Safari,Android,699,FALSE,2024-03-21 8:14
E001385,U001111,share,,2023-07-24,mobile,Edge,iOS,,0,2023-07-24 2:26
E006530,USR-000220,doc_create,,2024-02-03,desktop,Firefox,Linux,,1,2024-02-03 2:43
E002372,U002141,ai_search,,2023-10-09,,Brave,,,1,2023-10-09 0:13
E002409,U002322,integration_connect,,03/07/2025 01:50,tablet,Brave,,unknown,FALSE,2025-03-07 1:50
E007123,USR-001035,search,,02/08/2024 18:38,tablet,,,,,2024-02-08 18:38
E003662, U000016 ,integration_error,,07/05/2024 07:08,,Safari,iOS,unknown,,2024-07-05 7:08
E008163,U000199,logout,/docs,2024-04-19 4:06,desktop,Firefox,Android,,TRUE,2024-04-19 4:06
E005258,U001418,login,/integrations,2023-09-28 18:30,tablet,Safari,,unknown,,2023-09-28 18:30
E007941,U000146,DOC_CREATE,,2024-12-23,tablet,,Windows,,TRUE,2024-12-23 5:02
E004531,U000171,integration_connect,,2024-12-01,desktop,,Linux,,,2024-12-01 19:30
E000251,U000758,ai_search,,2025-01-17,desktop,,,,,2025-01-17 19:46
E004104, u001630 ,ai_search,,06/17/2024 06:20,,Chrome,Android,unknown,,2024-06-17 6:20
E001751,U000312,doc_create,,2024-01-20,tablet,Edge,Linux,unknown,,2024-01-20 8:41
E001804,U001451,integration_error,,12/10/2024 23:20,tablet,Safari,iOS,unknown,1,2024-12-10 23:20
E000164,u001414,integration_connect,,,,,,unknown,TRUE,2024-11-29 8:46
E002113,U001567,search,,10/14/2024 21:09,desktop,Safari,iOS,325,0,2024-10-14 21:09
E008676,U000506,doc_edit,,2024-06-23,,,macOS,,1,2024-06-23 18:25
E007983,U000557,comment,,0000-00-00 00:00:00,,,macOS,unknown,1,2025-01-23 9:16
E006403,U002167,integration_connect,,2023-02-11,desktop,Chrome,iOS,,TRUE,2023-02-11 10:59
E004610,U002459,page_view,/settings,2024-02-28,tablet,Safari,,,FALSE,2024-02-28 14:24
E005024,U001155,share,,2024-12-18,,Brave,iOS,,TRUE,2024-12-18 17:42
E004602,U002122,page_view,/integrations,2025-02-06,,Safari,,53,FALSE,2025-02-06 3:46
E005477,U002292,share,,2023-04-24 13:16,,Chrome,iOS,unknown,FALSE,2023-04-24 13:16
E003803,U000365,integration_connect,,2023-01-05,,,Windows,,TRUE,2023-01-05 13:56
E001359,U001381,integration_connect,,,desktop,Edge,,unknown,1,2023-04-10 7:58
E008020,U000157,comment,,2023-04-30 18:28,,,iOS,,,2023-04-30 18:28
E005001,U000098,logout,/docs,2023-01-07 11:54,mobile,Safari,,,,2023-01-07 11:54
E006966,U001355,search,,2025-06-15,mobile,Brave,macOS,1751,TRUE,2025-06-15 23:08
E003560,U000038,integration_error,,2024-12-18 16:21,desktop,Brave,iOS,188,FALSE,2024-12-18 16:21
E001559,u001055,login,/admin,2024-05-25 15:51,,,iOS,1632,1,2024-05-25 15:51
E004796,U001641,integration_error,,06/16/2023 11:44,,Chrome,,unknown,FALSE,2023-06-16 11:44
E005936,U002453,logout,/integrations,2024-01-05,DESKTOP,Firefox,macOS,,1,2024-01-05 3:20
E001848,U000600,comment,,2023-08-11 21:20,DESKTOP,Edge,,887,1,2023-08-11 21:20
e003549,U001681,doc_edit,,2025-04-04 6:07,tablet,Firefox,macOS,unknown,TRUE,2025-04-04 6:07
E003829, U000543 ,share,,01/28/2023 04:21,mobile,Safari,iOS,unknown,,2023-01-28 4:21
E004195,U001337,page_view,/docs,2024-07-31 4:04,desktop,Firefox,macOS,43,FALSE,2024-07-31 4:04
E006077,U001033,page_view,/onboarding,05/17/2024 08:42,mobile,Brave,macOS,,FALSE,2024-05-17 8:42
e007720,U000260,share,,0000-00-00 00:00:00,mobile,Edge,macOS,,FALSE,2023-02-04 12:40
E002430,U000162,export,,2024-10-04 23:08,DESKTOP,Brave,Windows,706,TRUE,2024-10-04 23:08
E005728,U000487,page_view,/pricing,,DESKTOP,Firefox,Windows,unknown,TRUE,2023-12-25 17:50
E008555,U000012,login,/settings,2024-02-29 10:20,,,,,FALSE,2024-02-29 10:20
E007691,U000397,share,,07/06/2024 15:25,tablet,Safari,iOS,,FALSE,2024-07-06 15:25
E000023,U001970,doc_edit,,05/28/2023 21:09,mobile,Safari,,,FALSE,2023-05-28 21:09
E007732,U000497,doc_edit,,11/02/2024 06:47,DESKTOP,Safari,iOS,unknown,FALSE,2024-11-02 6:47
E008519,U001914,page_view,/integrations,2024-08-20,tablet,Chrome,Linux,1015,FALSE,2024-08-20 0:05
E002276,U001874,integration_error,,,DESKTOP,,macOS,,TRUE,2024-09-08 2:45
E004973,U001952,login,/search,03/15/2023 16:46,,Edge,,1084,TRUE,2023-03-15 16:46
E005247,U001340,logout,/settings,05/13/2023 11:48,DESKTOP,Safari,Android,,,2023-05-13 11:48
E000717,U002339,integration_error,,2024-09-18,mobile,Chrome,,,TRUE,2024-09-18 10:09
e006068,U000174,login,/onboarding,0000-00-00 00:00:00,,,Linux,unknown,1,2024-04-01 0:00
E003846,U001580,logout,/help,09/10/2024 08:11,,Firefox,,,,2024-09-10 8:11
E000383,U000957,page_view,/billing,2024-06-08 11:03,desktop,,Windows,,TRUE,2024-06-08 11:03
E007136,U002154,integration_connect,,2023-02-06 2:30,desktop,Firefox,,1368,,2023-02-06 2:30
E004636,U001963,comment,,,DESKTOP,Brave,iOS,,0,2023-01-16 20:54
E006448,U000926,export,,2023-02-03,tablet,,Windows,486,,2023-02-03 11:48
e003693,U000460,SEARCH,,0000-00-00 00:00:00,,Chrome,Linux,671,,2025-06-14 4:28
E006362,U002290,login,/billing,2024-04-10,DESKTOP,,iOS,,FALSE,2024-04-10 15:30
E002977,U001046,integration_connect,,,tablet,Safari,Windows,833,FALSE,2023-12-03 21:21
E003616,U002593,doc_create,,12/19/2024 05:06,tablet,Firefox,macOS,unknown,1,2024-12-19 5:06
E002283,U001689,doc_delete,,10/13/2024 01:16,desktop,Firefox,Linux,unknown,FALSE,2024-10-13 1:16
E006321,U001987,integration_error,,07/19/2023 00:45,desktop,,Linux,unknown,FALSE,2023-07-19 0:45
E007448,USR-001461,comment,,0000-00-00 00:00:00,mobile,Safari,Android,914,,2024-02-09 23:37
E002367,U001412,page_view,/settings,2023-08-21 11:48,tablet,Brave,Android,1793,0,2023-08-21 11:48
E002473,U000724,doc_create,,2023-09-04 7:22,desktop,Edge,,,0,2023-09-04 7:22
E004701,U000205,doc_delete,,2024-06-15,DESKTOP,Firefox,,unknown,,2024-06-15 10:15
E008903,U001508,comment,,2023-05-21 0:23,mobile,Safari,,,TRUE,2023-05-21 0:23
E005653,U001423,doc_create,,2023-03-06,desktop,Safari,Linux,,TRUE,2023-03-06 11:58
E000635,U001066,search,,05/01/2024 09:10,,Brave,Windows,1450,,2024-05-01 9:10
E004210,U002058,doc_edit,,2024-08-25 17:24,tablet,Chrome,Android,,0,2024-08-25 17:24
E006699,U001135,doc_create,,2025-01-30 23:28,desktop,Edge,Linux,,,2025-01-30 23:28
E001183,U000547,doc_delete,,2023-07-09,DESKTOP,Brave,,940,FALSE,2023-07-09 19:13
E005779, U001349 ,page_view,/dashboard,2024-09-11,,Firefox,Linux,,FALSE,2024-09-11 20:40
E003340,U001785,doc_edit,,11/05/2023 22:42,desktop,Edge,iOS,,TRUE,2023-11-05 22:42
E007957,U002158,search,,2023-03-31 12:47,,Brave,Android,unknown,FALSE,2023-03-31 12:47
E003311,u000164,export,,,,Safari,,unknown,TRUE,2024-11-22 11:10
E008760, U000920 ,logout,/integrations,2025-05-17 19:15,tablet,Safari,,,FALSE,2025-05-17 19:15
E001636,u000840,ai_search,,11/15/2024 15:29,desktop,Safari,Windows,unknown,1,2024-11-15 15:29
E003355, U001841 ,doc_create,,2023-03-24 11:11,mobile,Safari,,unknown,FALSE,2023-03-24 11:11
E002424,U002254,comment,,2024-12-27 15:40,mobile,Edge,,1737,FALSE,2024-12-27 15:40
E006579,USR-001682,doc_create,,2023-09-19 13:22,DESKTOP,,Linux,324,FALSE,2023-09-19 13:22
E005021,U000249,integration_connect,,,,Brave,Windows,510,FALSE,2024-10-24 11:29
E001102,U002086,comment,,2024-12-30 2:27,desktop,,,unknown,0,2024-12-30 2:27
 E005342,U000480,doc_edit,,2025-03-04,,Chrome,,1258,,2025-03-04 19:35
E000122,U000459,doc_edit,,2023-02-23 20:04,,Firefox,,,1,2023-02-23 20:04
E000811,U000047,page_view,/help,2024-11-05 7:19,DESKTOP,,Windows,,1,2024-11-05 7:19
E007510,U002272,doc_edit,,,tablet,,,,TRUE,2023-07-18 9:23
E003274,U001618,doc_delete,,2023-10-08,,,,unknown,,2023-10-08 19:17
 E000242,U000929,SHARE,,0000-00-00 00:00:00,DESKTOP,Chrome,Windows,unknown,,2023-08-06 7:34
E000667, U002070 ,integration_error,,,tablet,,macOS,171,,2025-03-28 16:59
E002485,U002466,comment,,10/26/2024 05:00,,Brave,Android,303,FALSE,2024-10-26 5:00
E005036,U000755,login,/onboarding,,tablet,Chrome,iOS,,TRUE,2023-12-27 4:50
E003523,U001636,comment,,2024-08-28 2:09,,Safari,,unknown,0,2024-08-28 2:09
E001021,U001429,doc_create,,2024-10-30 10:02,tablet,Safari,macOS,,,2024-10-30 10:02
E001495,U002478,doc_create,,2023-08-25 5:29,,Firefox,iOS,unknown,,2023-08-25 5:29
E006918,U001451,doc_edit,,01/11/2023 06:12,,Chrome,Windows,,TRUE,2023-01-11 6:12
E000479, U001832 ,integration_error,,2023-07-21 19:55,mobile,Brave,Android,,TRUE,2023-07-21 19:55
E006220, U002484 ,integration_error,,12/29/2024 21:07,mobile,Firefox,Linux,1474,TRUE,2024-12-29 21:07
E003584,U000587,search,,04/15/2025 20:22,desktop,Chrome,,unknown,1,2025-04-15 20:22
E000754,U002186,page_view,/help,08/22/2023 10:10,,Firefox,Windows,1522,1,2023-08-22 10:10
E002317,U000110,doc_delete,,01/26/2025 18:14,desktop,Safari,macOS,unknown,1,2025-01-26 18:14
E008498,U000010,search,,0000-00-00 00:00:00,desktop,Brave,Linux,,0,2024-03-27 12:15
E007183,U002446,DOC_EDIT,,2024-09-27 8:55,DESKTOP,Edge,Windows,unknown,,2024-09-27 8:55
E004680,U001103,ai_search,,2023-01-14 12:12,mobile,Brave,Linux,,FALSE,2023-01-14 12:12
E001252,U002384,share,,2024-02-05 8:29,DESKTOP,Brave,Linux,,,2024-02-05 8:29
E001400,u002294,doc_create,,10/20/2024 12:05,,,Linux,,FALSE,2024-10-20 12:05
E001581,U001680,export,,07/20/2024 02:19,DESKTOP,Firefox,,1577,0,2024-07-20 2:19
E006871,U000200,export,,2024-08-29,desktop,Firefox,Android,779,,2024-08-29 3:43
E006818,U000375,search,,,,Firefox,Android,,TRUE,2025-01-01 16:34
E003012,U000082,search,,,,,iOS,1789,FALSE,2025-04-13 20:02
e004883,U000312,comment,,12/07/2023 15:12,tablet,,Windows,,FALSE,2023-12-07 15:12
e007869,U001289,share,,2023-10-15 22:31,mobile,Edge,Windows,,TRUE,2023-10-15 22:31
 e008545,U000216,logout,/docs,05/30/2025 10:48,,Brave,Windows,,,2025-05-30 10:48
E004732,U000967,integration_error,,01/04/2024 08:14,mobile,Chrome,,1001,TRUE,2024-01-04 8:14
E006864,U000278,doc_edit,,01/23/2025 22:40,,Chrome,,,,2025-01-23 22:40
E001975,U001116,logout,/dashboard,01/02/2025 10:26,,Firefox,Android,,0,2025-01-02 10:26
E006862,U001642,integration_error,,2025-02-19,,Firefox,,unknown,0,2025-02-19 21:37
E002152,U000648,ai_search,,2025-04-22 13:22,,Chrome,Linux,unknown,,2025-04-22 13:22
E003000,U000849,share,,05/11/2025 18:06,desktop,Firefox,Android,497,,2025-05-11 18:06
E000946,U000487,ai_search,,2024-01-13,tablet,,iOS,unknown,TRUE,2024-01-13 7:09
E003074,u001093,logout,/dashboard,2023-01-17 14:40,,Chrome,Linux,,TRUE,2023-01-17 14:40
E004839,U001644,integration_error,,2023-05-04,tablet,Edge,,unknown,TRUE,2023-05-04 13:53
E008262,U000621,export,,,,Brave,iOS,,,2024-07-24 4:16
E007192,U000543,integration_connect,,2025-05-15,mobile,Safari,macOS,1506,TRUE,2025-05-15 1:06
E006841,U000491,doc_edit,,2024-01-16,desktop,Firefox,,,FALSE,2024-01-16 13:56
E006225,U001016,logout,/search,2023-01-13,desktop,Chrome,iOS,,TRUE,2023-01-13 23:31
E003976,U000386,doc_edit,,02/10/2023 13:09,desktop,,macOS,1539,TRUE,2023-02-10 13:09
E002792,U000237,DOC_EDIT,,05/05/2024 05:08,,Firefox,,unknown,,2024-05-05 5:08
E001368,U001146,share,,2024-03-22,,,Windows,158,TRUE,2024-03-22 18:13
E001778,U001387,doc_create,,0000-00-00 00:00:00,desktop,Chrome,,unknown,,2023-09-13 15:30
E005177,U001107,doc_edit,,2025-06-08,mobile,,Linux,,,2025-06-08 7:01
E005033,U001209,ai_search,,,tablet,Chrome,Windows,unknown,FALSE,2025-03-05 11:27
E007521,U000977,search,,2024-02-19 20:46,mobile,Safari,Linux,unknown,,2024-02-19 20:46
E008967,U001856,doc_create,,03/09/2025 04:44,mobile,,,605,1,2025-03-09 4:44
E008868,U001318,INTEGRATION_CONNECT,,2024-07-24 11:23,tablet,Firefox,,,,2024-07-24 11:23
E002393,U002241,share,,01/27/2025 10:11,,Safari,Android,,,2025-01-27 10:11
E006697,U000725,login,/pricing,01/19/2024 19:05,DESKTOP,Brave,,451,1,2024-01-19 19:05
E003910,U000137,doc_create,,01/05/2023 06:46,,Edge,,672,FALSE,2023-01-05 6:46
E003160,U002168,doc_edit,,02/19/2023 03:23,mobile,,,unknown,TRUE,2023-02-19 3:23
E000757,U000106,doc_delete,,0000-00-00 00:00:00,tablet,Firefox,,,0,2023-02-17 9:00
E001428,U001360,page_view,/admin,10/21/2023 08:09,mobile,,,136,0,2023-10-21 8:09
E004426,U001738,doc_edit,,04/06/2023 00:45,mobile,Chrome,Android,,1,2023-04-06 0:45
E002293,U000435,ai_search,,2024-12-08 5:22,DESKTOP,Safari,iOS,365,,2024-12-08 5:22
E004849, U001769 ,ai_search,,,desktop,,Android,1710,,2024-02-02 20:00
E002725,U000824,integration_error,,2024-10-19,desktop,Chrome,,,,2024-10-19 7:00
E007897,U000932,integration_connect,,06/12/2023 10:37,mobile,Chrome,,,FALSE,2023-06-12 10:37
E002388,U002592,login,/help,04/15/2023 00:48,DESKTOP,Brave,,,1,2023-04-15 0:48
E000265,U001067,doc_edit,,06/14/2023 13:51,,,,unknown,TRUE,2023-06-14 13:51
E003238,U000835,doc_edit,,01/05/2024 04:29,,Chrome,macOS,,0,2024-01-05 4:29
E006980,U002414,ai_search,,04/17/2023 09:44,desktop,Firefox,macOS,,FALSE,2023-04-17 9:44
E004146,U000029,integration_connect,,12/29/2024 13:54,mobile,Safari,Android,500,,2024-12-29 13:54
E006176,U000994,login,/docs,2023-04-14 11:42,,Firefox,macOS,116,TRUE,2023-04-14 11:42
E004058,U002502,doc_create,,,desktop,Firefox,macOS,,,2023-04-23 15:04
E005012,U000021,ai_search,,01/07/2025 13:29,tablet,Safari,,unknown,,2025-01-07 13:29
E004061,U001463,integration_error,,2024-09-27 14:28,,Brave,iOS,,TRUE,2024-09-27 14:28
E000518,U001158,ai_search,,07/20/2024 07:19,mobile,Chrome,macOS,,,2024-07-20 7:19
E007850, U000190 ,doc_create,,2025-01-09,,,macOS,,,2025-01-09 14:03
E006135,U001028,export,,09/03/2023 05:32,,,macOS,957,FALSE,2023-09-03 5:32
E006337,U000447,page_view,/help,11/16/2023 09:06,desktop,Firefox,,,TRUE,2023-11-16 9:06
E008479,U001026,export,,04/03/2025 10:25,tablet,Firefox,iOS,,0,2025-04-03 10:25
E002414,U000415,share,,2023-07-19 20:48,mobile,Safari,Linux,,TRUE,2023-07-19 20:48
E004629,U002000,integration_connect,,04/14/2024 16:02,DESKTOP,Edge,,,,2024-04-14 16:02
E003909, U001620 ,doc_edit,,2025-05-03 21:49,,Firefox,Windows,,FALSE,2025-05-03 21:49
e005938,U000601,export,,2025-06-02,,Edge,Windows,308,TRUE,2025-06-02 12:40
E004662,U000232,page_view,/pricing,,DESKTOP,Chrome,iOS,666,TRUE,2024-09-10 19:14
E000991, U001256 ,login,/billing,04/15/2024 21:38,,Safari,Windows,1083,FALSE,2024-04-15 21:38
E000133,U000192,page_view,/settings,2024-06-28 6:32,desktop,Edge,Windows,1306,,2024-06-28 6:32
E006065,u000665,integration_connect,,,DESKTOP,Safari,Linux,,TRUE,2023-09-12 9:07
E003638,U002317,page_view,/search,05/20/2023 00:31,tablet,Brave,Linux,,0,2023-05-20 0:31
E006871,U001164,export,,2024-03-13 10:28,DESKTOP,Safari,iOS,,1,2024-03-13 10:28
E005126,U000951,integration_error,,12/14/2023 10:46,,Edge,macOS,1661,TRUE,2023-12-14 10:46
E001764,U001496,share,,0000-00-00 00:00:00,DESKTOP,Firefox,,unknown,FALSE,2024-11-16 19:04
E003948,U001566,export,,,desktop,Safari,macOS,,TRUE,2023-11-19 1:53
E006194,u001464,integration_error,,04/23/2025 20:04,,,,,TRUE,2025-04-23 20:04
E005976,U000234,login,/admin,2023-01-12,mobile,,Android,unknown,,2023-01-12 16:15
E007052,U000242,search,,,desktop,Safari,Android,165,1,2024-09-27 15:28
E004132,U002531,page_view,/pricing,2023-06-16 15:12,tablet,,Windows,,,2023-06-16 15:12
E005672,U001864,comment,,2024-01-27 13:43,,Brave,Android,,TRUE,2024-01-27 13:43
E006813,U001908,integration_error,,2024-08-13,DESKTOP,Safari,Android,,,2024-08-13 9:52
E004730,U001593,comment,,04/04/2025 10:39,,Edge,macOS,938,,2025-04-04 10:39
E000905,U002045,doc_create,,10/27/2023 01:41,DESKTOP,Firefox,Android,unknown,FALSE,2023-10-27 1:41
E004459,U002473,page_view,/settings,2024-02-18,DESKTOP,Chrome,macOS,,TRUE,2024-02-18 5:31
e004713,U000809,doc_delete,,08/26/2024 05:46,desktop,Safari,Windows,1143,,2024-08-26 5:46
E002947,u000944,export,,2023-06-04 14:47,DESKTOP,Chrome,,,,2023-06-04 14:47
E000722,U001123,export,,2024-09-01 6:43,,Safari,Android,unknown,FALSE,2024-09-01 6:43
E004267,U000772,login,/admin,2023-12-19,mobile,Edge,,,TRUE,2023-12-19 13:40
E004224,U000656,doc_edit,,2025-05-09,tablet,,Windows,421,FALSE,2025-05-09 17:33
E001068,U001435,doc_delete,,2025-05-06,desktop,Brave,Linux,,FALSE,2025-05-06 18:35
E003652,U002302,page_view,/dashboard,2023-06-11,mobile,Brave,macOS,,TRUE,2023-06-11 5:02
E004585,U002271,integration_connect,,2023-09-10,,,Windows,1425,TRUE,2023-09-10 2:15
E000197,U001009,search,,2024-12-05,DESKTOP,Brave,macOS,unknown,,2024-12-05 16:53
E005279,u001397,page_view,/admin,2024-08-09 18:09,,Chrome,Android,,,2024-08-09 18:09
E002790,U001096,doc_edit,,03/26/2023 11:20,tablet,Safari,Windows,1598,FALSE,2023-03-26 11:20
E008165,USR-000034,page_view,/admin,2024-05-19 8:38,,Edge,,,TRUE,2024-05-19 8:38
E003030,U002058,integration_error,,2023-03-20 12:20,,,Android,,1,2023-03-20 12:20
E004575,U001483,logout,/dashboard,07/21/2024 00:44,DESKTOP,Edge,Linux,,,2024-07-21 0:44
E004570,U000504,comment,,2024-08-16,tablet,Edge,macOS,,,2024-08-16 21:42
E008217,U000506,doc_create,,07/28/2024 21:48,DESKTOP,Brave,iOS,unknown,TRUE,2024-07-28 21:48
E008365,u001374,page_view,/settings,2023-07-30 21:41,,Safari,macOS,965,TRUE,2023-07-30 21:41
E004877,U001617,doc_create,,2023-04-10 1:00,tablet,,iOS,1093,,2023-04-10 1:00
E001773,U000313,integration_error,,0000-00-00 00:00:00,mobile,Chrome,Windows,,TRUE,2024-11-06 6:53
E002739,U001977,logout,/pricing,05/21/2024 15:25,DESKTOP,Edge,,,0,2024-05-21 15:25
E002992,U001981,logout,/search,2024-12-22 10:53,mobile,Firefox,Linux,,FALSE,2024-12-22 10:53
E006785,U002285,page_view,/search,,,Edge,macOS,unknown,FALSE,2024-08-16 1:32
E003226,U000753,doc_delete,,11/28/2024 13:23,,Firefox,,,FALSE,2024-11-28 13:23
E003493,U000092,doc_edit,,2024-11-09,,Edge,,,TRUE,2024-11-09 2:24
E008988,U000973,page_view,/pricing,2024-05-08,tablet,Chrome,,33,1,2024-05-08 16:24
E003858,u000189,doc_create,,0000-00-00 00:00:00,,,macOS,1726,0,2023-02-13 3:11
E000162,U000235,comment,,2025-05-14,,Brave,Linux,,TRUE,2025-05-14 5:16
E002117, U000600 ,doc_create,,07/15/2024 01:55,mobile,Brave,Windows,unknown,TRUE,2024-07-15 1:55
E008563,U001114,doc_edit,,2025-06-14 12:52,tablet,Safari,Linux,,,2025-06-14 12:52
E000400,U001799,doc_edit,,2025-05-31,mobile,Chrome,Linux,357,FALSE,2025-05-31 19:43
E000212,U001627,doc_create,,2023-02-18 7:39,desktop,Edge,Windows,,TRUE,2023-02-18 7:39
E005341,U000428,search,,07/17/2024 18:35,desktop,Brave,,,1,2024-07-17 18:35
E001271,U000344,page_view,/billing,2024-11-09 20:02,,Chrome,macOS,,0,2024-11-09 20:02
E000567,U000080,doc_edit,,2024-05-07 1:42,desktop,,Linux,597,0,2024-05-07 1:42
E000369,U001049,logout,/dashboard,2023-07-18,tablet,Chrome,,,,2023-07-18 7:41
E005509,U001654,comment,,2024-05-07 8:12,,,Linux,,FALSE,2024-05-07 8:12
E006399,U000933,login,/admin,0000-00-00 00:00:00,,Safari,Linux,171,TRUE,2025-05-29 4:46
E000709,u001362,logout,/settings,2023-05-30,,Firefox,Windows,837,,2023-05-30 8:19
E005366, U000619 ,search,,2023-06-10 4:07,mobile,Chrome,macOS,,,2023-06-10 4:07
E005806,U000001,doc_delete,,03/12/2024 08:42,,Edge,,,,2024-03-12 8:42
E003833,U002029,comment,,,,Edge,macOS,,,2024-08-21 22:27
E006560,U000103,comment,,,DESKTOP,,,759,0,2023-04-16 2:30
E004815,U001657,ai_search,,2023-02-28,DESKTOP,,Linux,127,,2023-02-28 18:42
E004265,U001092,export,,04/08/2024 00:12,DESKTOP,Brave,Windows,,FALSE,2024-04-08 0:12
E003644,U000375,page_view,/docs,2024-11-05 23:23,tablet,Chrome,Windows,,TRUE,2024-11-05 23:23
E004081,U002468,doc_delete,,2023-08-08,DESKTOP,Safari,,,TRUE,2023-08-08 13:08
E002245,U001789,logout,/billing,2024-08-16 16:31,mobile,Safari,Android,,,2024-08-16 16:31
E002874,U000075,page_view,/docs,,tablet,Firefox,macOS,67,FALSE,2023-02-08 9:55
E008099,U000432,search,,04/16/2025 02:52,,Brave,,,TRUE,2025-04-16 2:52
E004279,U000719,page_view,/docs,2024-02-12 5:19,tablet,Brave,iOS,,TRUE,2024-02-12 5:19
E001801,U001125,integration_error,,05/08/2025 19:45,DESKTOP,Safari,Windows,498,TRUE,2025-05-08 19:45
E003674, U002191 ,integration_connect,,10/10/2023 12:24,,,macOS,unknown,FALSE,2023-10-10 12:24
e000547, u001881 ,search,,12/15/2023 13:00,desktop,Firefox,Windows,,TRUE,2023-12-15 13:00
e002912,U001608,doc_edit,,2023-12-22 6:44,DESKTOP,Brave,iOS,,,2023-12-22 6:44
E001705,U000671,page_view,/pricing,,,,,,,2023-06-29 5:40
E007572,U000777,ai_search,,2024-09-23,DESKTOP,Safari,,,0,2024-09-23 21:09
E007613,U000460,doc_create,,2025-06-03 22:41,desktop,Firefox,macOS,,1,2025-06-03 22:41
E005176, U002466 ,ai_search,,2024-10-31 7:37,,Firefox,Linux,1087,FALSE,2024-10-31 7:37
E007988,U002071,page_view,/billing,2025-03-07 6:21,,Firefox,,,,2025-03-07 6:21
E001922,U000069,page_view,/pricing,2025-06-09,DESKTOP,Safari,Android,,FALSE,2025-06-09 22:46
E004286,U001842,integration_error,,04/05/2025 07:12,desktop,Brave,,unknown,FALSE,2025-04-05 7:12
E005948,U002519,doc_create,,2024-02-13,,,Windows,,TRUE,2024-02-13 20:58
E005871,U000456,comment,,2023-06-05,,Safari,Windows,unknown,1,2023-06-05 6:28
E003959,U002072,login,/pricing,2023-06-14,tablet,Chrome,,808,FALSE,2023-06-14 4:31
E007107,U002591,doc_edit,,2024-09-02 15:46,mobile,Brave,,,FALSE,2024-09-02 15:46
E007765,U000200,doc_create,,10/26/2024 19:39,DESKTOP,Brave,iOS,,FALSE,2024-10-26 19:39
E006437,U002350,ai_search,,2025-05-14 21:02,tablet,,Linux,unknown,FALSE,2025-05-14 21:02
E000242,U000895,doc_create,,2025-03-24 22:16,mobile,,,unknown,,2025-03-24 22:16
E003776,  U002043  ,search,,2023-07-31 4:32,tablet,Firefox,Windows,269,FALSE,2023-07-31 4:32
E000464,U000278,login,/integrations,2024-10-26,,Firefox,Linux,unknown,,2024-10-26 4:37
E003482,U000341,share,,10/10/2024 14:08,,Chrome,,,1,2024-10-10 14:08
E002637,U000133,integration_connect,,2025-02-05,,Brave,Windows,946,TRUE,2025-02-05 1:32
E002105,U002394,logout,/onboarding,09/14/2023 10:22,mobile,Firefox,,1507,,2023-09-14 10:22
E001654,U000805,share,,04/10/2025 05:46,,Brave,iOS,1035,FALSE,2025-04-10 5:46
E008821,U001163,comment,,,,Safari,,201,FALSE,2023-06-17 21:41
E004050, U000403 ,integration_connect,,07/04/2023 13:08,,,,,FALSE,2023-07-04 13:08
E001268,U002391,ai_search,,09/22/2024 14:21,tablet,Brave,macOS,,TRUE,2024-09-22 14:21
E003170,U002022,login,/onboarding,2024-05-06 17:10,,,Android,,,2024-05-06 17:10
E008798,U001938,share,,,DESKTOP,Edge,Android,unknown,FALSE,2025-06-09 10:18
E005616,U000532,doc_delete,,2023-01-21,,Chrome,Linux,1023,FALSE,2023-01-21 19:31
E003938,U001082,login,/onboarding,2024-11-10 21:31,desktop,Edge,Windows,,,2024-11-10 21:31
E001816,U000726,logout,/admin,2025-03-21,,Firefox,,,TRUE,2025-03-21 7:52
E000052,U002233,logout,/dashboard,06/15/2023 22:50,mobile,Safari,,unknown,0,2023-06-15 22:50
E008513,U000224,doc_create,,2024-05-28 8:43,tablet,,,unknown,FALSE,2024-05-28 8:43
E005624,U001752,integration_error,,01/09/2025 18:39,DESKTOP,Brave,Linux,,TRUE,2025-01-09 18:39
E001089,U001820,integration_error,,2024-03-20,tablet,Edge,macOS,unknown,TRUE,2024-03-20 23:35
E007371,U002259,export,,2023-07-22 10:40,desktop,,macOS,unknown,TRUE,2023-07-22 10:40
E008868,U001596,page_view,/docs,2023-05-13,,,Linux,unknown,,2023-05-13 21:26
E007620,U002562,comment,,,tablet,Safari,macOS,240,FALSE,2024-12-27 10:24
E004943, U001478 ,doc_delete,,09/14/2023 13:01,mobile,Edge,macOS,752,0,2023-09-14 13:01
E004879,U001216,comment,,2023-06-13,DESKTOP,Firefox,iOS,,0,2023-06-13 16:25
E008931,U001104,doc_create,,04/09/2024 12:26,,,Android,722,0,2024-04-09 12:26
E005014,U001794,doc_create,,2024-02-24,,,macOS,unknown,,2024-02-24 22:39
E002872,U000795,search,,,mobile,Edge,macOS,,0,2024-02-06 22:41
E005187,U001648,ai_search,,10/11/2024 22:53,desktop,Chrome,Linux,,FALSE,2024-10-11 22:53
E000871,U000357,doc_create,,2023-02-10 6:03,DESKTOP,,,,,2023-02-10 6:03
E002237,U001370,doc_delete,,2025-01-19 12:31,mobile,,Linux,unknown,TRUE,2025-01-19 12:31
E006060,U001154,ai_search,,01/13/2024 03:54,DESKTOP,Brave,iOS,1123,,2024-01-13 3:54
E001756,U001451,logout,/admin,09/22/2024 22:24,desktop,Firefox,iOS,,,2024-09-22 22:24
E001825,U001500,search,,06/17/2024 09:28,tablet,Chrome,macOS,unknown,0,2024-06-17 9:28
E002229,USR-000922,ai_search,,,,Firefox,macOS,,0,2023-12-13 11:15
E008744,u000685,doc_create,,,tablet,Edge,macOS,250,TRUE,2023-02-08 14:19
 E007113,U002202,comment,,2023-01-11 17:07,DESKTOP,,Linux,,,2023-01-11 17:07
E001681,U000317,ai_search,,09/12/2024 00:43,tablet,Firefox,Windows,unknown,1,2024-09-12 0:43
E005096,u000715,search,,02/20/2024 14:11,,Brave,Linux,1751,0,2024-02-20 14:11
E007852,U000033,page_view,/dashboard,06/02/2024 16:08,DESKTOP,Edge,Windows,unknown,TRUE,2024-06-02 16:08
E000677,U002521,login,/integrations,2025-05-17 1:57,tablet,Brave,Android,,,2025-05-17 1:57
E008295,u000947,search,,01/31/2025 03:23,mobile,,macOS,280,FALSE,2025-01-31 3:23
E006628,U001555,comment,,2023-07-25 14:08,desktop,Chrome,Android,,0,2023-07-25 14:08
E008643,U001982,doc_edit,,2024-09-24,desktop,,Android,1427,,2024-09-24 21:51
E004902,U001496,export,,,desktop,Firefox,Android,1513,,2023-01-09 20:43
E000026,U002462,doc_delete,,2024-08-24 4:39,desktop,Brave,,807,TRUE,2024-08-24 4:39
E004406, U001329 ,doc_delete,,2024-04-16 9:45,DESKTOP,Edge,,unknown,,2024-04-16 9:45
E005956,u000794,search,,05/19/2023 03:31,,Edge,Windows,unknown,0,2023-05-19 3:31
 E000711,U002284,login,/docs,2023-10-18 1:24,mobile,Safari,Windows,,0,2023-10-18 1:24
E005272,U001576,page_view,/settings,02/09/2024 11:53,,Edge,,,,2024-02-09 11:53
E005387,U001496,doc_edit,,2024-10-01 17:48,,Firefox,,,TRUE,2024-10-01 17:48
E005629,U001253,doc_create,,06/01/2023 16:15,,Chrome,iOS,,FALSE,2023-06-01 16:15
E002296,U001058,page_view,/help,2024-06-23 19:31,mobile,Chrome,Android,unknown,FALSE,2024-06-23 19:31
E002810,U001140,doc_edit,,2024-04-11,,Edge,macOS,unknown,FALSE,2024-04-11 5:20
E006695,U002072,integration_connect,,06/13/2023 13:56,DESKTOP,Firefox,,,FALSE,2023-06-13 13:56
E006408,U001510,page_view,/settings,02/26/2024 05:53,tablet,Brave,macOS,unknown,,2024-02-26 5:53
E004655,U002137,export,,04/18/2023 02:37,DESKTOP,Safari,Linux,unknown,,2023-04-18 2:37
E001532,U000213,page_view,/search,05/27/2023 16:53,desktop,,,,TRUE,2023-05-27 16:53
E003672,U000415,share,,2024-06-27 15:16,,Safari,,1693,FALSE,2024-06-27 15:16
E008407,U001452,export,,2024-03-14,tablet,Chrome,,unknown,0,2024-03-14 2:02
E003459,U001603,logout,/integrations,,tablet,Firefox,,unknown,FALSE,2024-08-05 4:16
E008812,USR-000227,logout,/onboarding,2024-01-04,desktop,Safari,Android,,,2024-01-04 9:40
E000118,U000850,doc_edit,,0000-00-00 00:00:00,tablet,Chrome,Linux,732,TRUE,2025-05-13 20:44
E005397,U001121,share,,2023-06-09,desktop,Brave,macOS,,1,2023-06-09 13:53
E000868,U001068,page_view,/integrations,2025-02-22,,Firefox,iOS,unknown,FALSE,2025-02-22 1:17
E004460,U002524,ai_search,,08/12/2023 01:48,DESKTOP,Chrome,,unknown,,2023-08-12 1:48
E004712,U001713,logout,/pricing,02/24/2024 21:25,,Safari,,54,TRUE,2024-02-24 21:25
E004033,U000532,logout,/integrations,2023-06-15 0:40,tablet,Brave,,1444,TRUE,2023-06-15 0:40
E004010,U000365,doc_create,,2024-10-16 11:12,mobile,Chrome,Linux,,FALSE,2024-10-16 11:12
E008955,U001816,integration_connect,,2025-02-16,,,macOS,,TRUE,2025-02-16 20:20
E005965,U001850,doc_edit,,0000-00-00 00:00:00,desktop,Edge,,unknown,TRUE,2025-01-15 8:52
e002431,U000440,search,,2023-07-02,,Edge,,,1,2023-07-02 11:59
E000473,u000602,page_view,/billing,2023-09-16 7:31,DESKTOP,Firefox,Android,,0,2023-09-16 7:31
E000638,U001957,logout,/pricing,05/13/2023 03:12,,,,1144,1,2023-05-13 3:12
E005704,U001036,integration_error,,2024-07-10,DESKTOP,Edge,,unknown,,2024-07-10 0:58
E004057,u002402,login,/integrations,2024-12-11 12:43,tablet,,Windows,1139,FALSE,2024-12-11 12:43
E005572,U001012,integration_connect,,2023-11-29,mobile,,Android,,1,2023-11-29 0:09
E007674,U002122,export,,2024-08-27 1:36,desktop,Firefox,Android,,FALSE,2024-08-27 1:36
E001066, U001934 ,doc_create,,0000-00-00 00:00:00,,Safari,macOS,1182,TRUE,2025-02-07 13:20
E004691,U002556,share,,2023-09-05 10:53,mobile,Chrome,,197,TRUE,2023-09-05 10:53
E004979,U001554,doc_create,,2025-04-04 10:05,DESKTOP,Safari,macOS,,TRUE,2025-04-04 10:05
E007899,U000018,doc_create,,,desktop,Chrome,iOS,1531,,2023-11-15 6:26
E003328,U000449,comment,,2023-07-04,,Firefox,Linux,unknown,1,2023-07-04 11:33
E006810,U002005,doc_edit,,2023-07-14,mobile,Edge,Linux,,,2023-07-14 0:13
E007671,U000367,login,/admin,03/30/2024 21:43,,Safari,Linux,317,FALSE,2024-03-30 21:43
E005108,U001020,doc_delete,,2023-04-14 16:33,tablet,Firefox,,,FALSE,2023-04-14 16:33
E002267,U001914,export,,2023-08-06 18:00,,Chrome,Linux,,FALSE,2023-08-06 18:00
E005652,U000369,doc_delete,,12/03/2024 19:58,,,Linux,unknown,0,2024-12-03 19:58
E006324,U000020,comment,,2025-05-24,,Edge,Windows,,,2025-05-24 21:40
E002620,U002421,logout,/billing,10/21/2023 11:15,,Chrome,,unknown,,2023-10-21 11:15
E002366,U001460,doc_create,,,DESKTOP,,Windows,unknown,,2023-06-04 0:32
E008219,U001828,export,,04/14/2024 16:04,desktop,,iOS,6,0,2024-04-14 16:04
E007814,U001112,search,,2023-12-02,desktop,Brave,macOS,,,2023-12-02 22:44
E007817,U001121,integration_error,,07/07/2023 11:52,mobile,,Android,,TRUE,2023-07-07 11:52
E000683,U002493,page_view,/help,2023-04-07,,Chrome,macOS,unknown,,2023-04-07 5:56
E001594,U001400,logout,/onboarding,10/26/2024 14:20,desktop,,Android,unknown,TRUE,2024-10-26 14:20
E004436,U001732,export,,2023-04-20 11:27,,,Windows,,1,2023-04-20 11:27
E000424,u001043,ai_search,,05/18/2025 08:35,DESKTOP,Edge,Windows,,,2025-05-18 8:35
E005298,U001756,doc_create,,2023-10-11 14:15,,Edge,Android,,0,2023-10-11 14:15
E002927,U001236,logout,/admin,03/24/2025 12:29,,,Linux,unknown,,2025-03-24 12:29
E008465,U001235,login,/settings,2024-06-10,mobile,,,unknown,FALSE,2024-06-10 8:14
E006847,u001505,export,,2023-07-01 14:05,,Edge,,,0,2023-07-01 14:05
E000795,U000401,search,,05/25/2025 12:17,desktop,,macOS,1078,1,2025-05-25 12:17
E003862,U000044,ai_search,,05/15/2023 21:09,desktop,Brave,Linux,unknown,FALSE,2023-05-15 21:09
E005557,U000020,login,/integrations,02/21/2024 19:28,mobile,,iOS,1078,TRUE,2024-02-21 19:28
E004810,u001774,integration_error,,07/11/2024 19:03,,,iOS,unknown,TRUE,2024-07-11 19:03
E005488,U001916,doc_create,,2024-09-02 1:49,,Chrome,iOS,1428,FALSE,2024-09-02 1:49
E001248,U002069,doc_create,,03/27/2025 16:15,,Firefox,,,,2025-03-27 16:15
E006819,U001199,doc_edit,,05/29/2025 05:50,,Safari,Windows,1789,FALSE,2025-05-29 5:50
E007786,U000709,doc_delete,,2024-12-08,mobile,Brave,,1336,TRUE,2024-12-08 1:35
E007943,U000489,doc_delete,,,,Brave,macOS,,FALSE,2023-02-14 5:29
E007909,U001115,integration_connect,,02/21/2025 18:28,,Firefox,iOS,529,,2025-02-21 18:28
E003294,U000579,page_view,/search,2024-05-31,,Edge,,,TRUE,2024-05-31 15:13
E004828,U001946,comment,,0000-00-00 00:00:00,mobile,Edge,Android,,FALSE,2024-07-14 4:12
E007670,U000540,search,,2023-10-15 23:36,DESKTOP,Edge,macOS,,0,2023-10-15 23:36
E001044,U000102,search,,0000-00-00 00:00:00,,,,,FALSE,2024-10-19 9:28
E000146,U000610,doc_delete,,2024-09-06,tablet,,macOS,unknown,,2024-09-06 0:28
E004736,U000535,ai_search,,10/06/2024 02:46,tablet,Brave,Android,1524,,2024-10-06 2:46
 E001096,U001790,doc_create,,2023-03-31,mobile,,Windows,unknown,,2023-03-31 13:39
E001902,U000033,ai_search,,,,,Android,,FALSE,2024-07-10 15:02
E007633,U002373,integration_error,,2023-02-23,DESKTOP,,,unknown,1,2023-02-23 16:24
E007493,u000800,doc_delete,,,,,Windows,unknown,TRUE,2023-02-03 6:57
E006580,U001236,integration_connect,,2023-10-05 10:26,DESKTOP,,macOS,,FALSE,2023-10-05 10:26
E004409,U000336,doc_edit,,2023-04-10,tablet,Edge,iOS,,0,2023-04-10 9:01
E006580,U001085,comment,,06/26/2023 04:38,mobile,Firefox,Linux,unknown,1,2023-06-26 4:38
E003546,U001330,ai_search,,06/24/2024 15:41,,,iOS,1571,1,2024-06-24 15:41
E007186,U000058,comment,,2023-11-03 15:50,mobile,Chrome,Windows,,FALSE,2023-11-03 15:50
E006488,U000396,doc_delete,,2024-12-21 12:32,mobile,Edge,,,TRUE,2024-12-21 12:32
E003487,U001094,integration_error,,03/08/2024 09:57,tablet,,macOS,,FALSE,2024-03-08 9:57
E008110,U002029,integration_connect,,04/12/2024 19:40,DESKTOP,Firefox,macOS,,1,2024-04-12 19:40
E007072,U000070,page_view,/settings,08/08/2023 20:44,tablet,Edge,Linux,unknown,,2023-08-08 20:44
E006600,U000678,logout,/integrations,0000-00-00 00:00:00,tablet,Brave,,,TRUE,2023-12-09 16:19
E001121,U002132,share,,2023-07-04 21:30,,,macOS,339,FALSE,2023-07-04 21:30
E004828,U002209,integration_connect,,0000-00-00 00:00:00,,Chrome,Windows,unknown,FALSE,2023-06-15 5:10
E008247,U001653,login,/onboarding,2025-03-28 17:10,desktop,Edge,macOS,unknown,FALSE,2025-03-28 17:10
E005799, U000087 ,doc_create,,2025-03-05 4:29,mobile,Safari,iOS,,1,2025-03-05 4:29
e004158,U000209,share,,2024-02-21 13:34,mobile,Safari,Linux,unknown,1,2024-02-21 13:34
E002731,U000755,doc_edit,,08/07/2023 22:29,DESKTOP,Safari,Android,,FALSE,2023-08-07 22:29
E003585,U001273,export,,2024-05-07 5:58,desktop,Edge,Windows,1029,,2024-05-07 5:58
E003917, U001701 ,login,/integrations,,tablet,,iOS,,TRUE,2023-11-29 12:16
E008721,u001374,login,/integrations,2023-04-01,mobile,,,,1,2023-04-01 11:11
E003126,U002527,comment,,04/10/2023 17:18,tablet,Brave,iOS,,FALSE,2023-04-10 17:18
E007669,U000757,search,,01/26/2025 03:38,DESKTOP,Safari,Android,1113,FALSE,2025-01-26 3:38
E002159,U000190,integration_error,,0000-00-00 00:00:00,tablet,Edge,Linux,,FALSE,2023-10-06 0:47
E005464,U000438,doc_create,,07/30/2023 09:24,desktop,Safari,Android,,FALSE,2023-07-30 9:24
E001154,U001045,share,,04/12/2025 01:57,tablet,,macOS,,,2025-04-12 1:57
e004683,U002256,page_view,/integrations,08/28/2023 17:30,DESKTOP,Chrome,,,FALSE,2023-08-28 17:30
E007623,U002479,export,,2025-05-04,,,macOS,,1,2025-05-04 12:02
E007257,u000317,share,,,DESKTOP,Firefox,Windows,,1,2023-11-29 6:45
E007378,U000613,integration_connect,,,mobile,Safari,macOS,267,1,2024-12-18 1:05
E001445,U001466,share,,01/19/2025 14:48,mobile,Edge,Windows,unknown,1,2025-01-19 14:48
E000239,U001451,export,,,tablet,Brave,Linux,510,1,2024-10-16 21:49
E007075,U000044,comment,,2025-05-26 11:31,mobile,Safari,macOS,,TRUE,2025-05-26 11:31
E007699,U001588,export,,02/19/2024 05:36,mobile,Edge,Android,,FALSE,2024-02-19 5:36
E007455,U001829,export,,2023-11-25 8:45,tablet,,Android,,0,2023-11-25 8:45
E006614,U002194,logout,/search,2023-02-06 15:30,mobile,Safari,,,FALSE,2023-02-06 15:30
E004707,U000008,login,/admin,2024-02-05 3:14,,Safari,iOS,unknown,,2024-02-05 3:14
 E003487,U001071,page_view,/dashboard,,,Chrome,Windows,unknown,0,2024-04-01 11:09
E007130,U000960,search,,07/15/2024 19:03,DESKTOP,Firefox,,unknown,,2024-07-15 19:03
E000588,U001012,doc_delete,,2024-07-07,,,,,TRUE,2024-07-07 1:48
E006516,U001096,integration_connect,,2023-01-19 17:37,DESKTOP,Chrome,Android,,FALSE,2023-01-19 17:37
E005115,U002314,integration_error,,2023-05-31 15:17,desktop,Chrome,Windows,393,,2023-05-31 15:17
E000267,U002563,doc_delete,,2024-09-09,desktop,Safari,iOS,unknown,0,2024-09-09 16:20
E003735,U001927,doc_edit,,2023-10-20 6:30,,,iOS,,1,2023-10-20 6:30
E007052,U001933,share,,03/04/2024 01:48,tablet,Chrome,Android,unknown,,2024-03-04 1:48
E002504,U000926,comment,,2023-02-04 14:06,desktop,,Linux,,FALSE,2023-02-04 14:06
E006586,U000316,doc_delete,,2023-11-09 5:41,DESKTOP,Edge,iOS,,,2023-11-09 5:41
E002932,U000976,doc_create,,2023-02-26,DESKTOP,,,unknown,0,2023-02-26 12:16
E006066,U000336,doc_create,,2023-07-27 12:54,mobile,Firefox,macOS,,TRUE,2023-07-27 12:54
E007806,U000682,share,,05/26/2025 00:43,tablet,Brave,,1024,1,2025-05-26 0:43
E000075,U001468,login,/search,2024-02-26 13:14,mobile,,macOS,1108,TRUE,2024-02-26 13:14
E007365,U002424,doc_edit,,,desktop,Firefox,,,FALSE,2024-10-11 21:25
E007449,U001810,integration_error,,01/09/2024 18:21,DESKTOP,,,1035,,2024-01-09 18:21
E006979,U001617,integration_error,,08/21/2024 19:19,tablet,,macOS,,FALSE,2024-08-21 19:19
E008503,U001291,doc_delete,,03/25/2023 21:27,mobile,Brave,Linux,,0,2023-03-25 21:27
E006345,U001785,ai_search,,2025-05-18 13:26,,Chrome,macOS,,FALSE,2025-05-18 13:26
E007707, U000611 ,DOC_DELETE,,,,Edge,Linux,,1,2024-11-24 17:09
E000957,U000976,page_view,/search,02/11/2024 16:03,desktop,,iOS,1705,,2024-02-11 16:03
E004622,U001944,share,,2023-06-18 20:55,desktop,Brave,Linux,,1,2023-06-18 20:55
E002781,U001995,login,/onboarding,2024-04-09 4:16,tablet,Safari,Linux,,,2024-04-09 4:16
E004240,U001173,comment,,0000-00-00 00:00:00,DESKTOP,Edge,Android,unknown,TRUE,2023-03-06 15:18
E001251,U001994,ai_search,,2024-04-12 10:56,mobile,Firefox,iOS,,FALSE,2024-04-12 10:56
 E000395,U002060,export,,11/05/2023 21:37,desktop,Safari,Windows,,TRUE,2023-11-05 21:37
E006875,U000605,doc_delete,,2025-02-07 12:16,,Chrome,Windows,1167,,2025-02-07 12:16
E000347,U000906,export,,12/08/2024 00:33,mobile,Firefox,,1476,FALSE,2024-12-08 0:33
E002478,U002152,integration_error,,02/12/2024 00:55,desktop,,Linux,,FALSE,2024-02-12 0:55
E008813,U001693,integration_error,,2023-11-28,,Safari,macOS,,,2023-11-28 1:46
E004721,U000122,export,,,,,Linux,,,2024-07-10 10:51
E003092,U001376,doc_delete,,2025-05-14 17:16,desktop,Chrome,Windows,,0,2025-05-14 17:16
e008152,U000328,ai_search,,01/06/2023 18:30,mobile,Brave,macOS,52,FALSE,2023-01-06 18:30
E003371,U001991,ai_search,,,tablet,Chrome,Linux,238,TRUE,2023-09-04 11:42
e004940,U002156,comment,,0000-00-00 00:00:00,tablet,,Linux,,0,2023-05-22 8:40
E004312,U001129,doc_delete,,,desktop,Brave,,,FALSE,2024-03-30 21:57
E008735,U000313,share,,05/27/2024 05:57,desktop,,macOS,1489,TRUE,2024-05-27 5:57
E001981,u000664,integration_error,,2024-02-04,,Brave,Android,unknown,TRUE,2024-02-04 8:57
E007626,U000007,login,/billing,02/08/2025 14:45,tablet,Firefox,Linux,unknown,0,2025-02-08 14:45
E004515,U002319,doc_delete,,01/10/2023 12:08,,Edge,iOS,unknown,TRUE,2023-01-10 12:08
E006435,U001346,comment,,0000-00-00 00:00:00,,Safari,,,,2024-11-06 5:51
E004487,U001825,doc_create,,2023-06-13,DESKTOP,Chrome,,unknown,FALSE,2023-06-13 12:25
E007687,U001730,logout,/dashboard,0000-00-00 00:00:00,DESKTOP,Safari,,,FALSE,2024-01-29 22:16
E000137, u001405 ,integration_error,,2024-05-26 3:44,,,,,0,2024-05-26 3:44
E006687,U001447,search,,07/03/2024 00:21,mobile,Firefox,,,,2024-07-03 0:21
E007144,U002493,ai_search,,12/26/2024 02:11,,Firefox,,,FALSE,2024-12-26 2:11
E001528,U001852,login,/admin,2025-01-30 22:05,,Edge,Windows,unknown,1,2025-01-30 22:05
E004259, U001589 ,export,,2023-04-23,desktop,Safari,Windows,,,2023-04-23 12:20
E006887, U000232 ,integration_connect,,2024-01-02,,,Linux,73,,2024-01-02 12:12
E002990,U000921,integration_error,,10/30/2024 04:22,DESKTOP,,Android,,TRUE,2024-10-30 4:22
E007171,U001626,doc_create,,2024-09-02 18:03,tablet,,Linux,188,TRUE,2024-09-02 18:03
E007951,U001000,doc_delete,,2024-07-07,mobile,Safari,,,TRUE,2024-07-07 11:16
e007563,U000255,integration_error,,,,,iOS,,TRUE,2023-03-06 17:09
E006817,U001343,logout,/billing,2024-08-07,mobile,Edge,iOS,889,1,2024-08-07 18:30
E005306,U002007,doc_delete,,0000-00-00 00:00:00,DESKTOP,,Android,1202,,2024-03-06 4:37
E003606,USR-001060,logout,/admin,2024-09-08 23:07,,,,unknown,TRUE,2024-09-08 23:07
E002077,U001676,integration_error,,2023-04-20,,,iOS,153,TRUE,2023-04-20 8:43
E009000,U002084,doc_edit,,2023-07-14 4:22,desktop,Brave,Android,519,TRUE,2023-07-14 4:22
E004228,U000021,doc_edit,,2024-12-01,desktop,,iOS,,TRUE,2024-12-01 17:41
E000237,U000222,doc_delete,,,mobile,Edge,iOS,86,1,2023-07-20 3:07
E002924,U002295,login,/admin,2023-12-11,mobile,Brave,Android,,TRUE,2023-12-11 8:59
E007225, U001648 ,share,,2024-06-11 12:53,,Brave,Windows,752,0,2024-06-11 12:53
E002072,u002020,logout,/search,2023-12-13 4:59,,Edge,,434,FALSE,2023-12-13 4:59
E005878,U000306,integration_connect,,2023-03-06,,Safari,Android,,TRUE,2023-03-06 14:03
E005132,U000190,export,,12/02/2024 23:17,tablet,Chrome,macOS,,FALSE,2024-12-02 23:17
E001910,U000247,search,,04/20/2024 05:30,mobile,Firefox,Linux,85,TRUE,2024-04-20 5:30
E003507,U002215,export,,2024-05-04,,,,unknown,TRUE,2024-05-04 10:39
E005249,U001290,page_view,/settings,,,Chrome,iOS,1456,FALSE,2023-12-01 5:47
E006442,u001563,SHARE,,2023-01-03 9:54,mobile,Brave,Android,,FALSE,2023-01-03 9:54
E006403,U000451,export,,2023-05-13 2:02,desktop,Edge,Android,1011,1,2023-05-13 2:02
E003644,U000530,comment,,2023-12-21 2:42,,Firefox,iOS,,0,2023-12-21 2:42
E007245,U001571,search,,2024-05-11,desktop,Edge,,,TRUE,2024-05-11 22:16
E007811,U000220,ai_search,,,mobile,,Android,,,2025-02-05 7:22
E005472,U000851,integration_connect,,10/31/2023 13:45,,Edge,iOS,,,2023-10-31 13:45
E000964,u000844,logout,/settings,2023-10-01 3:42,,Brave,Linux,unknown,1,2023-10-01 3:42
E008500,u000115,doc_create,,2024-11-13 0:30,,Edge,macOS,,TRUE,2024-11-13 0:30
E000915,U001547,doc_create,,06/16/2023 07:52,,,iOS,,,2023-06-16 7:52
E007433,U001150,export,,,desktop,Safari,macOS,,0,2024-12-29 3:48
E000629,U001335,logout,/docs,0000-00-00 00:00:00,tablet,Safari,iOS,,0,2023-07-16 8:31
E002576,U000850,integration_connect,,2023-11-12 15:19,DESKTOP,Safari,iOS,,,2023-11-12 15:19
E001332,U002457,doc_delete,,09/07/2024 19:19,,,iOS,,TRUE,2024-09-07 19:19
E007210,U001573,share,,01/12/2025 19:09,tablet,Safari,macOS,,TRUE,2025-01-12 19:09
E000786,U000910,logout,/integrations,2023-07-21 9:16,DESKTOP,,macOS,,,2023-07-21 9:16
E002503,U001770,share,,2023-12-06,desktop,Chrome,Android,,FALSE,2023-12-06 17:20
E007125,U000254,AI_SEARCH,,02/01/2023 08:31,,Chrome,macOS,,FALSE,2023-02-01 8:31
E002726,U002066,ai_search,,2023-11-03,DESKTOP,Safari,Android,unknown,TRUE,2023-11-03 16:52
E008934,u000420,integration_error,,09/29/2024 09:59,,Safari,Linux,,FALSE,2024-09-29 9:59
e006418,u000719,integration_connect,,,,,macOS,,0,2024-12-15 1:59
E004366,U001986,export,,12/31/2023 09:15,mobile,Safari,macOS,940,TRUE,2023-12-31 9:15
E004020, u000559 ,doc_edit,,01/14/2025 17:02,,Safari,Android,,,2025-01-14 17:02
E000973,U001225,comment,,2024-02-05 15:55,desktop,,Linux,,TRUE,2024-02-05 15:55
E003568,u000228,comment,,11/09/2024 04:09,tablet,Safari,Windows,,,2024-11-09 4:09
E006324,U001455,page_view,/search,2023-08-04,mobile,,Linux,1592,FALSE,2023-08-04 9:42
E000340, U000250 ,integration_error,,2023-03-26,,Safari,Windows,,TRUE,2023-03-26 1:49
E004424,U002477,integration_connect,,2024-07-24 1:24,DESKTOP,Firefox,,,,2024-07-24 1:24
E008925,U001866,doc_delete,,0000-00-00 00:00:00,DESKTOP,,iOS,,,2024-09-04 22:00
E001385,U001191,integration_connect,,,,Safari,,unknown,,2024-02-22 0:43
E006908,U001212,comment,,,tablet,,Windows,,,2025-05-20 0:23
E005334,U000782,integration_error,,12/18/2023 20:04,desktop,Edge,Android,unknown,1,2023-12-18 20:04
E002584,U001367,doc_delete,,2023-05-15,desktop,,Android,1704,1,2023-05-15 15:22
E000985,U000120,doc_create,,2024-06-30,mobile,Chrome,Windows,unknown,1,2024-06-30 4:05
E003133,U002244,share,,10/27/2023 06:08,tablet,,iOS,,1,2023-10-27 6:08
E004692,u000557,doc_edit,,2023-02-15 13:57,tablet,,,,0,2023-02-15 13:57
E004721,u001021,ai_search,,2023-01-11 10:26,,Brave,Windows,,1,2023-01-11 10:26
E006130, U000572 ,search,,2023-09-29 8:15,,,Android,unknown,1,2023-09-29 8:15
E005967, U001776 ,doc_delete,,2024-04-12,tablet,Edge,Android,unknown,1,2024-04-12 3:39
E007865,U002022,doc_edit,,03/09/2023 23:33,mobile,,,,TRUE,2023-03-09 23:33
E005973,U001146,doc_delete,,2023-08-06 4:55,desktop,Chrome,iOS,,FALSE,2023-08-06 4:55
E001257,U001510,integration_error,,,,Edge,,1598,FALSE,2023-09-23 12:47
E003603,u001678,share,,02/22/2025 11:25,tablet,,iOS,,0,2025-02-22 11:25
E000737,U001007,integration_connect,,2023-04-19,mobile,Chrome,Android,772,TRUE,2023-04-19 5:27
E002401,U000182,page_view,/docs,2024-07-12 21:10,,Edge,Linux,unknown,FALSE,2024-07-12 21:10
E008875,U000342,export,,,tablet,,Android,,TRUE,2023-05-18 10:37
E001220,U001529,login,/docs,2024-11-20 15:30,,Firefox,Android,,TRUE,2024-11-20 15:30
E002204, U000018 ,export,,2024-12-22,desktop,,Windows,,FALSE,2024-12-22 4:22
E000610,U000843,integration_error,,12/13/2023 04:41,,Chrome,macOS,,0,2023-12-13 4:41
E001988,U001567,search,,06/30/2024 21:23,desktop,,,200,TRUE,2024-06-30 21:23
E007220,U000456,doc_edit,,2023-06-29 10:33,DESKTOP,Chrome,,,,2023-06-29 10:33
E000112,U000350,page_view,/help,10/29/2024 14:50,tablet,Firefox,,,FALSE,2024-10-29 14:50
E007933,U002414,export,,2024-01-05,desktop,Safari,,,FALSE,2024-01-05 20:27
E001174,U002361,share,,,tablet,,Android,,TRUE,2024-04-20 11:39
E005920,U000517,share,,2025-03-21 6:54,tablet,,iOS,1092,TRUE,2025-03-21 6:54
E004804,U002425,integration_error,,2024-10-22 7:24,DESKTOP,,Android,unknown,TRUE,2024-10-22 7:24
E005344,U001749,login,/search,2023-05-26,,Safari,Linux,1489,,2023-05-26 12:33
E004450,U002505,doc_delete,,2023-11-13 5:29,,Brave,Linux,,FALSE,2023-11-13 5:29
E005273,U000161,logout,/billing,2023-08-31 14:08,DESKTOP,Chrome,Windows,,,2023-08-31 14:08
E004929,U002029,doc_create,,08/25/2024 14:08,tablet,,macOS,unknown,1,2024-08-25 14:08
E008362,u001524,doc_create,,2025-06-13 15:33,,Brave,Windows,1723,0,2025-06-13 15:33
E005304,U000789,doc_edit,,10/24/2024 19:28,mobile,,,,0,2024-10-24 19:28
E008744,U000151,integration_error,,03/07/2023 09:18,tablet,Edge,macOS,,FALSE,2023-03-07 9:18
E004028,USR-001089,integration_connect,,2024-10-23,DESKTOP,,Windows,,0,2024-10-23 13:30
E003002,U002396,share,,12/03/2024 12:52,mobile,Firefox,Linux,unknown,,2024-12-03 12:52
E000799,U002539,doc_edit,,2023-03-24 0:10,,Brave,,unknown,TRUE,2023-03-24 0:10
E001842,U001551,export,,04/28/2024 07:29,mobile,Safari,macOS,,FALSE,2024-04-28 7:29
E006703,U001362,integration_error,,10/31/2024 15:04,,,,,FALSE,2024-10-31 15:04
E005780,U000302,doc_delete,,01/29/2025 22:00,tablet,,,,1,2025-01-29 22:00
E000775,U000811,doc_create,,,tablet,Brave,iOS,unknown,0,2025-04-06 6:28
E004220,U000597,integration_connect,,2024-03-21 3:09,mobile,Safari,,1791,0,2024-03-21 3:09
E003985, U002472 ,ai_search,,04/20/2024 09:56,mobile,Safari,,,TRUE,2024-04-20 9:56
E006281,U000364,integration_error,,2023-06-08 12:14,tablet,,,unknown,TRUE,2023-06-08 12:14
E003181,U001629,ai_search,,2023-04-30,,Safari,Windows,,,2023-04-30 8:55
E000586,U001538,logout,/billing,2024-08-30 10:53,,Edge,Android,,0,2024-08-30 10:53
E003415,u000592,ai_search,,,,,,900,,2023-10-18 21:23
E001229,u002475,ai_search,,2023-12-16 15:56,,Brave,Android,,,2023-12-16 15:56
E005011,U000433,integration_error,,2023-01-17,,Firefox,,1284,,2023-01-17 13:20
E001900,U001435,logout,/integrations,2024-04-02 4:46,desktop,Safari,,unknown,,2024-04-02 4:46
E007604,U001318,login,/docs,07/25/2023 02:04,desktop,,Android,unknown,TRUE,2023-07-25 2:04
E007343,U002102,login,/admin,04/20/2025 20:08,tablet,Edge,iOS,,TRUE,2025-04-20 20:08
E002274,U001215,doc_edit,,2025-05-03,tablet,Firefox,,,,2025-05-03 6:00
E004299,U000061,doc_delete,,10/04/2024 15:43,,Chrome,,,,2024-10-04 15:43
E003894,U000392,share,,09/13/2023 06:38,,,Windows,,0,2023-09-13 6:38
E003098,U000940,comment,,08/04/2023 04:16,,,iOS,789,0,2023-08-04 4:16
E006455,U002415,doc_create,,2023-05-20 19:43,tablet,,iOS,1414,,2023-05-20 19:43
E006607,U002452,export,,03/12/2025 17:10,DESKTOP,,macOS,,0,2025-03-12 17:10
E006461,u001374,logout,/search,2024-01-30,desktop,,iOS,,0,2024-01-30 8:10
E002849, U001102 ,export,,2023-01-27,,Safari,Windows,,FALSE,2023-01-27 10:29
E006120,U001154,logout,/docs,04/14/2024 03:13,,Chrome,iOS,,TRUE,2024-04-14 3:13
E007622,U000023,doc_edit,,2024-11-28,mobile,Edge,,,0,2024-11-28 23:35
E002359,U001499,logout,/admin,2024-12-11,,Brave,macOS,unknown,1,2024-12-11 3:40
E004862,u001209,export,,,tablet,Chrome,,,FALSE,2025-04-06 5:20
E006124,U000686,ai_search,,2025-05-25 17:48,mobile,Brave,Linux,,FALSE,2025-05-25 17:48
E002581,U000448,integration_error,,0000-00-00 00:00:00,mobile,,Linux,unknown,,2023-11-27 19:39
E003079,U000011,INTEGRATION_CONNECT,,,mobile,Safari,Linux,793,1,2024-01-23 0:31
E008357,U002278,logout,/settings,0000-00-00 00:00:00,,,Android,,1,2024-02-02 21:22
E006491,U002381,doc_edit,,2023-07-18,mobile,,iOS,,,2023-07-18 12:35
e004777,U002459,doc_edit,,2024-09-01 23:13,tablet,,Android,,FALSE,2024-09-01 23:13
E002484,U002457,doc_create,,2023-03-29 9:06,mobile,Safari,iOS,,TRUE,2023-03-29 9:06
E008321,U001952,doc_delete,,08/10/2024 13:28,,Safari,macOS,1251,1,2024-08-10 13:28
E008801,U001552,doc_delete,,,,Edge,Windows,515,FALSE,2023-07-03 11:17
 E007729,U000727,export,,01/07/2025 19:20,,,macOS,96,FALSE,2025-01-07 19:20
E000456,U000117,export,,2023-09-18,DESKTOP,Firefox,,,,2023-09-18 1:54
E004416,U000496,logout,/admin,07/04/2024 13:42,DESKTOP,,Android,,FALSE,2024-07-04 13:42
E007671,U000331,ai_search,,04/22/2024 11:02,,Safari,Linux,,FALSE,2024-04-22 11:02
E004630,U001929,integration_connect,,2024-11-22 4:00,,Safari,macOS,,0,2024-11-22 4:00
E008233,U000225,doc_create,,,DESKTOP,Firefox,Android,90,0,2024-04-06 0:02
E001984,U002136,doc_delete,,2024-02-22 6:32,DESKTOP,Edge,Linux,,,2024-02-22 6:32
E007645,U000179,ai_search,,01/22/2024 18:35,DESKTOP,Firefox,macOS,882,FALSE,2024-01-22 18:35
E005691,U001642,doc_delete,,10/03/2023 05:08,DESKTOP,Brave,macOS,,,2023-10-03 5:08
E000855,U001940,integration_connect,,2024-06-18 12:35,desktop,Safari,iOS,,TRUE,2024-06-18 12:35
E006578,U001641,integration_connect,,0000-00-00 00:00:00,DESKTOP,Firefox,Windows,unknown,0,2023-01-12 21:45
E001509,U002063,search,,2023-09-29,mobile,Firefox,Windows,,1,2023-09-29 19:34
E008188,U002134,logout,/integrations,,,Edge,,382,,2025-01-08 17:37
E007936,U002479,login,/onboarding,2025-01-06 13:26,mobile,,iOS,,TRUE,2025-01-06 13:26
E001948,U001472,doc_create,,2024-09-28 7:26,tablet,,,1036,TRUE,2024-09-28 7:26
E000730,U000641,doc_edit,,05/11/2025 09:59,desktop,Brave,macOS,,TRUE,2025-05-11 9:59
E000574,U001454,ai_search,,01/03/2023 15:50,,Chrome,,396,,2023-01-03 15:50
E001861,U000196,logout,/onboarding,2023-08-08 7:45,,Chrome,Linux,unknown,FALSE,2023-08-08 7:45
E005067,U002474,share,,2023-11-17,tablet,,,266,,2023-11-17 14:06
E005442,U000859,page_view,/integrations,2024-03-02 2:06,mobile,Firefox,,,0,2024-03-02 2:06
E005731,U002084,integration_connect,,2023-08-20 10:48,desktop,,Windows,unknown,1,2023-08-20 10:48
E005289,U000619,share,,2023-03-07 8:12,mobile,,iOS,181,TRUE,2023-03-07 8:12
E004419,U001229,login,/admin,02/11/2023 15:00,,Edge,macOS,unknown,1,2023-02-11 15:00
E006107,U001629,doc_edit,,2024-05-18,,,Linux,603,0,2024-05-18 3:37
E000895,U001904,export,,2023-11-16,desktop,Chrome,,,TRUE,2023-11-16 16:32
E007199,U001320,export,,2024-11-30,tablet,Safari,Windows,,FALSE,2024-11-30 7:27
E006466,U001617,logout,/integrations,09/01/2023 17:33,DESKTOP,,Linux,346,1,2023-09-01 17:33
E000413,U002280,doc_edit,,2025-03-30,tablet,,Android,,TRUE,2025-03-30 23:14
E008840,U000634,doc_create,,2025-06-02 16:33,mobile,Brave,iOS,,,2025-06-02 16:33
E007803,U000638,doc_delete,,,tablet,Brave,iOS,1473,,2023-05-10 19:35
E000913,U001728,doc_delete,,02/19/2025 10:03,tablet,,Android,,TRUE,2025-02-19 10:03
E005005,U001878,ai_search,,2023-10-19 10:36,mobile,Edge,iOS,,,2023-10-19 10:36
E006715,U001267,login,/onboarding,02/27/2023 13:28,tablet,,macOS,1183,1,2023-02-27 13:28
E000114,U001974,share,,2025-06-12,tablet,,,1315,,2025-06-12 22:46
E004755,U001026,page_view,/integrations,2024-06-16,,Brave,iOS,,,2024-06-16 3:36
E005506,U001650,doc_edit,,2024-03-06 6:13,,,Linux,,1,2024-03-06 6:13
E005910,U002549,export,,2024-07-22,,,macOS,428,FALSE,2024-07-22 16:30
E000040,U002177,login,/admin,2023-01-11,desktop,Chrome,Android,,,2023-01-11 6:21
E004044,U001686,integration_connect,,02/21/2024 14:51,,,macOS,unknown,,2024-02-21 14:51
E000108,U000642,comment,,11/20/2023 02:44,DESKTOP,,Linux,,,2023-11-20 2:44
E004450,U001803,comment,,04/28/2025 12:30,mobile,Chrome,,unknown,TRUE,2025-04-28 12:30
E007519,U001133,share,,2024-02-14,tablet,Edge,,1429,,2024-02-14 0:27
E005718,U001525,login,/billing,10/24/2023 16:37,DESKTOP,Brave,Android,unknown,FALSE,2023-10-24 16:37
E008260,U001988,doc_edit,,2023-11-10 15:13,,Edge,Windows,1663,TRUE,2023-11-10 15:13
E002441,U000339,doc_delete,,02/10/2025 16:52,,Firefox,Android,1196,TRUE,2025-02-10 16:52
E001027,u000838,share,,2024-10-06 22:19,,,,,TRUE,2024-10-06 22:19
E001454,U000119,login,/integrations,02/07/2023 05:19,,Chrome,iOS,,FALSE,2023-02-07 5:19
E002137,U002304,login,/search,2024-07-29 17:27,tablet,Firefox,iOS,,,2024-07-29 17:27
E006933,U000236,page_view,/search,2024-02-29,,Edge,iOS,605,1,2024-02-29 20:44
E007736,U000859,logout,/onboarding,12/28/2023 23:51,tablet,Brave,Linux,unknown,,2023-12-28 23:51
E002737,U001007,doc_edit,,05/01/2025 05:27,,Safari,macOS,unknown,0,2025-05-01 5:27
E004702,U000800,doc_create,,2024-09-08 20:52,,,macOS,unknown,FALSE,2024-09-08 20:52
E007692,U000918,export,,2023-11-19,mobile,,iOS,,FALSE,2023-11-19 6:56
E000337,U000211,comment,,2024-01-18,,Edge,,unknown,0,2024-01-18 8:31
E004709,U000562,ai_search,,2024-04-30 20:03,mobile,Edge,Android,,1,2024-04-30 20:03
E005047,u000238,doc_edit,,09/23/2024 19:54,,Edge,Android,1494,TRUE,2024-09-23 19:54
E007657,U002437,integration_connect,,06/14/2025 06:48,mobile,Edge,iOS,,,2025-06-14 6:48
E001029,u002436,page_view,/help,06/07/2024 18:26,,Brave,iOS,1551,1,2024-06-07 18:26
E002174,U001707,doc_edit,,08/09/2024 23:51,,Brave,Linux,,,2024-08-09 23:51
E002925,U001168,comment,,2023-01-16,tablet,,iOS,,,2023-01-16 12:20
E007086,U000987,doc_create,,0000-00-00 00:00:00,tablet,Chrome,,unknown,FALSE,2023-01-15 9:06
E005360,U001618,doc_delete,,2024-06-16 0:12,mobile,Edge,Linux,1061,FALSE,2024-06-16 0:12
E002107,U002467,doc_delete,,,mobile,,Android,unknown,,2025-04-22 8:09
E008564,U001252,share,,2025-01-23 1:47,DESKTOP,Firefox,,111,TRUE,2025-01-23 1:47
E003971,U001575,login,/docs,2023-09-09,,Safari,,,FALSE,2023-09-09 14:07
E007366,U001059,doc_delete,,2023-11-16,desktop,Chrome,iOS,,TRUE,2023-11-16 10:06
E008222,U000032,doc_create,,,,Chrome,,unknown,TRUE,2023-11-27 19:44
E008034,U001823,search,,09/23/2024 04:18,tablet,Edge,,,FALSE,2024-09-23 4:18
E000394,u000923,search,,10/06/2023 14:15,DESKTOP,Brave,Linux,unknown,FALSE,2023-10-06 14:15
E007986,USR-000591,doc_create,,0000-00-00 00:00:00,tablet,Edge,Linux,unknown,1,2024-11-09 1:54
E002118, U001064 ,integration_error,,05/25/2024 20:01,tablet,Chrome,Android,unknown,,2024-05-25 20:01
E002162,U000592,comment,,2024-11-10 7:31,DESKTOP,Edge,macOS,1432,TRUE,2024-11-10 7:31
E004638,U002218,page_view,/pricing,2025-03-04 13:59,,,,507,FALSE,2025-03-04 13:59
E007181,U000537,comment,,03/04/2025 13:26,mobile,,Android,,1,2025-03-04 13:26
E002798,U002313,page_view,/search,2024-07-23,desktop,Edge,,1002,,2024-07-23 0:20
E006800,U000369,integration_connect,,,tablet,Edge,iOS,,,2025-02-18 3:31
e003553,U000509,doc_create,,05/26/2025 19:28,,Edge,,unknown,,2025-05-26 19:28
E004181,U001667,page_view,/search,0000-00-00 00:00:00,tablet,Brave,Windows,,,2023-07-16 23:47
E005859,U002600,integration_connect,,,tablet,Safari,iOS,1558,FALSE,2023-12-12 8:01
E006645,U000519,doc_delete,,0000-00-00 00:00:00,desktop,Chrome,,,FALSE,2023-06-09 1:16
E005339,U002034,INTEGRATION_ERROR,,2023-09-20 9:43,,Safari,Android,unknown,0,2023-09-20 9:43
E000060,U000538,doc_edit,,04/09/2025 14:48,DESKTOP,Edge,Windows,unknown,FALSE,2025-04-09 14:48
E005014,U001833,ai_search,,01/30/2025 07:50,tablet,Firefox,Android,unknown,,2025-01-30 7:50
E002071,U002411,doc_edit,,04/22/2025 18:30,mobile,Firefox,,unknown,,2025-04-22 18:30
E004810,U002372,login,/onboarding,2025-04-14 7:31,DESKTOP,,,,FALSE,2025-04-14 7:31
E008008,U001180,logout,/settings,2025-03-01,tablet,Firefox,,,TRUE,2025-03-01 18:35
E008300,U001445,page_view,/docs,2023-01-02 2:01,tablet,Brave,Android,unknown,TRUE,2023-01-02 2:01
E001896,U002561,doc_create,,,tablet,,Windows,unknown,TRUE,2025-02-12 6:31
E000199,U001035,page_view,/onboarding,07/10/2024 21:51,mobile,Edge,macOS,479,,2024-07-10 21:51
E002258,U002315,doc_delete,,2023-04-06,tablet,Safari,Android,,0,2023-04-06 19:54
E002992,U000550,integration_error,,2025-02-10,DESKTOP,Edge,Windows,,TRUE,2025-02-10 3:18
E006914,U002083,doc_create,,,,Edge,,,TRUE,2023-08-29 13:48
E001777,U002200,login,/integrations,,,Firefox,macOS,910,FALSE,2023-06-21 19:37
E008951,U001337,comment,,2023-10-16 7:07,mobile,Safari,Windows,,TRUE,2023-10-16 7:07
E007837,U000174,INTEGRATION_CONNECT,,12/02/2023 09:44,,Firefox,macOS,,1,2023-12-02 9:44
E000116,U000231,page_view,/integrations,2024-05-27,,Firefox,,222,1,2024-05-27 3:40
E005507,U000600,integration_error,,0000-00-00 00:00:00,desktop,Firefox,Linux,,TRUE,2025-04-05 14:06
E008467,U001059,INTEGRATION_CONNECT,,2025-02-28 22:04,DESKTOP,,Android,unknown,TRUE,2025-02-28 22:04
E005865,U000153,logout,/dashboard,,tablet,,Linux,unknown,,2023-12-02 0:36
E000942,U000053,integration_error,,2023-10-01,tablet,,Android,13,,2023-10-01 16:15
E000655,U001302,page_view,/dashboard,2023-06-07 8:42,,Edge,iOS,1355,0,2023-06-07 8:42
E003465,U000918,search,,05/07/2024 00:06,,Brave,iOS,,FALSE,2024-05-07 0:06
E004554,U000999,ai_search,,03/25/2024 09:47,,,Android,928,TRUE,2024-03-25 9:47
E008212,U001343,doc_edit,,0000-00-00 00:00:00,,Edge,Windows,unknown,,2025-05-04 18:43
E003698,U000923,login,/search,2024-09-04,desktop,Edge,Windows,unknown,0,2024-09-04 6:06
E004097,U001802,comment,,05/23/2023 10:33,,,macOS,,TRUE,2023-05-23 10:33
E005076,U002445,doc_delete,,,tablet,Chrome,Windows,unknown,TRUE,2023-05-30 15:19
E004005,U002586,integration_connect,,07/28/2024 01:28,,Firefox,,unknown,FALSE,2024-07-28 1:28
E002491,U002400,ai_search,,2023-12-31,,Safari,Windows,,TRUE,2023-12-31 12:55
E008997,U001737,export,,2024-03-31 11:51,mobile,Edge,macOS,,FALSE,2024-03-31 11:51
E007456,U002582,doc_delete,,07/16/2023 13:35,,,iOS,,0,2023-07-16 13:35
E003276,U000103,integration_connect,,02/05/2025 01:21,DESKTOP,,Windows,unknown,FALSE,2025-02-05 1:21
E006306,U000192,login,/search,2025-01-24,desktop,Chrome,macOS,,,2025-01-24 4:31
E008905,U002436,doc_create,,2024-09-11,tablet,Safari,,,FALSE,2024-09-11 2:04
E004928, U001762 ,doc_create,,12/09/2023 13:50,mobile,,macOS,,0,2023-12-09 13:50
E003843,U000246,doc_edit,,04/07/2024 22:11,tablet,,Linux,unknown,TRUE,2024-04-07 22:11
E008858,u002464,export,,07/14/2024 20:08,desktop,Chrome,,,0,2024-07-14 20:08
E006120,U001633,search,,2023-12-03,mobile,Brave,Windows,,0,2023-12-03 10:29
E002976,U000043,comment,,2023-03-11,tablet,,Windows,unknown,FALSE,2023-03-11 20:07
E008518,U002005,ai_search,,2024-09-21,mobile,Chrome,macOS,,TRUE,2024-09-21 3:17
E005274,U000744,page_view,/onboarding,2023-12-18,DESKTOP,Brave,iOS,1710,,2023-12-18 9:37
E007034,U001789,doc_create,,08/12/2024 05:32,tablet,Chrome,Linux,42,,2024-08-12 5:32
E007576,U000670,logout,/billing,2024-12-25 8:06,mobile,,Linux,,TRUE,2024-12-25 8:06
E005593,U001398,doc_delete,,2023-12-24 8:26,desktop,Safari,,1338,0,2023-12-24 8:26
E008967,U002098,integration_error,,2025-02-26,desktop,Brave,iOS,,,2025-02-26 2:50
E008191,U000455,comment,,2023-02-09,,,macOS,,1,2023-02-09 8:09
E005820,U000963,login,/dashboard,08/05/2024 04:37,desktop,Edge,macOS,,0,2024-08-05 4:37
E003000,U000115,search,,2023-04-09,,Chrome,macOS,703,TRUE,2023-04-09 3:35
E001327,U001794,export,,09/02/2023 13:02,desktop,Edge,Android,,,2023-09-02 13:02
e002945,U000572,login,/admin,2023-10-07 23:23,tablet,Brave,,unknown,TRUE,2023-10-07 23:23
E005540,U001689,comment,,2023-10-21,tablet,Safari,macOS,1662,TRUE,2023-10-21 20:42
E007590,U002307,ai_search,,0000-00-00 00:00:00,DESKTOP,Edge,macOS,,TRUE,2024-08-18 10:47
E002817,U002506,SEARCH,,09/30/2023 10:12,,,,,,2023-09-30 10:12
E005567,U001628,share,,2024-04-14 3:05,mobile,Edge,iOS,,,2024-04-14 3:05
E005830,U001466,comment,,2024-11-06,mobile,Brave,,unknown,TRUE,2024-11-06 16:24
E005872,USR-002569,doc_create,,,desktop,Brave,iOS,unknown,1,2023-06-02 6:54
E004190,U002444,login,/pricing,04/27/2023 03:52,DESKTOP,Edge,,1206,,2023-04-27 3:52
E001775,U001462,doc_delete,,11/28/2024 07:53,desktop,Brave,iOS,1487,FALSE,2024-11-28 7:53
E000894,U001184,logout,/admin,12/05/2023 01:06,,Edge,macOS,1448,FALSE,2023-12-05 1:06
e002159,U001775,doc_create,,10/13/2023 13:03,,,iOS,unknown,FALSE,2023-10-13 13:03
E000003,U000447,share,,2024-01-18,mobile,Chrome,Linux,,TRUE,2024-01-18 14:18
E005124,U001933,comment,,,desktop,Safari,Linux,unknown,FALSE,2024-05-09 7:17
E001926,U001387,login,/dashboard,10/08/2023 19:18,,Edge,,540,,2023-10-08 19:18
E001362,U002108,search,,2024-12-10 17:45,mobile,,,,FALSE,2024-12-10 17:45
E003882,u000244,login,/docs,2023-08-10 14:04,mobile,Chrome,,,FALSE,2023-08-10 14:04
E003701,U000275,export,,,mobile,Edge,Android,unknown,,2025-03-07 3:33
E008116,U001307,search,,,DESKTOP,Safari,macOS,,,2025-03-10 1:38
E001645,U000484,doc_edit,,2024-03-09 23:30,desktop,Brave,Android,557,,2024-03-09 23:30
E003677,U002571,search,,02/13/2025 13:32,DESKTOP,,Windows,,FALSE,2025-02-13 13:32
E000752,U002154,integration_error,,2024-10-03 19:11,,Firefox,Android,,FALSE,2024-10-03 19:11
E000570,U000029,integration_error,,09/20/2023 16:40,DESKTOP,,,,FALSE,2023-09-20 16:40
E004539,USR-000761,search,,2024-09-19 12:55,DESKTOP,Chrome,Windows,,TRUE,2024-09-19 12:55
e001899,U000065,search,,2023-01-31,mobile,Safari,,,,2023-01-31 17:12
E006598,U001200,doc_create,,2024-06-25 20:27,desktop,Chrome,,,TRUE,2024-06-25 20:27
E004774,U000414,share,,2023-02-05,,,Linux,,,2023-02-05 23:19
E005589,U001326,export,,03/13/2024 04:24,DESKTOP,,Linux,unknown,FALSE,2024-03-13 4:24
E001478,U000717,integration_error,,2023-09-03 18:22,mobile,,Android,,FALSE,2023-09-03 18:22
E001768,U001126,search,,2023-10-18 7:41,DESKTOP,Brave,Android,unknown,1,2023-10-18 7:41
E003498,U002457,doc_create,,,tablet,Brave,,,1,2024-03-30 10:17
E003697, U000249 ,integration_error,,2023-11-28 21:47,,Brave,,,,2023-11-28 21:47
E003367,U002472,logout,/docs,03/18/2025 09:27,tablet,Safari,Android,,0,2025-03-18 9:27
E007152,U000928,search,,12/25/2023 13:29,,,macOS,991,FALSE,2023-12-25 13:29
E000114,U001456,integration_connect,,08/09/2024 12:34,DESKTOP,,Android,,FALSE,2024-08-09 12:34
E003925,U002362,doc_create,,02/22/2023 21:01,tablet,,Linux,unknown,FALSE,2023-02-22 21:01
E004252,U000465,comment,,04/26/2023 23:31,,,macOS,,,2023-04-26 23:31
E008024,U000254,ai_search,,,tablet,Edge,,,,2023-03-20 5:59
E001426,U000102,comment,,2024-09-21 4:29,desktop,Firefox,Android,,TRUE,2024-09-21 4:29
E003284,U001149,integration_connect,,10/14/2024 08:16,tablet,Chrome,iOS,,FALSE,2024-10-14 8:16
E006376,U001802,logout,/search,0000-00-00 00:00:00,desktop,Brave,,,FALSE,2025-02-15 23:05
E007396,U001210,logout,/billing,0000-00-00 00:00:00,tablet,,Android,,1,2023-10-16 7:17
E003014,U001440,page_view,/settings,2023-07-23 7:00,,Chrome,,,TRUE,2023-07-23 7:00
E007467,U001430,login,/search,2025-05-09,tablet,Firefox,Windows,,1,2025-05-09 15:43
E008836,U001100,logout,/dashboard,2023-08-20,,Safari,iOS,1093,,2023-08-20 17:56
E002536,U000856,share,,2023-02-02 13:12,,Safari,,,0,2023-02-02 13:12
E004628, U001589 ,login,/integrations,,,Safari,Android,,TRUE,2023-02-16 8:32
E005228,U000452,search,,2025-03-27,DESKTOP,Safari,iOS,,FALSE,2025-03-27 20:30
E003886,U002079,doc_create,,2023-02-01,DESKTOP,Chrome,,1677,0,2023-02-01 12:26
E007916,U001250,logout,/search,0000-00-00 00:00:00,DESKTOP,Safari,,162,,2023-10-03 22:49
E007173,U000604,SHARE,,2024-03-04 0:47,desktop,Brave,macOS,,1,2024-03-04 0:47
E007821,U000790,logout,/search,2023-11-02 13:26,mobile,,Linux,,TRUE,2023-11-02 13:26
E008912,U000900,doc_delete,,2024-08-06 23:43,tablet,,macOS,,0,2024-08-06 23:43
E005245,U001279,search,,12/05/2023 05:34,DESKTOP,,iOS,,TRUE,2023-12-05 5:34
E008434, U000659 ,search,,2023-06-07 19:46,desktop,Safari,,,1,2023-06-07 19:46
E007767,U001084,comment,,,tablet,Safari,,1072,,2024-02-22 5:26
E006413,U002007,login,/search,03/31/2025 11:09,tablet,,macOS,,0,2025-03-31 11:09
E005360,U001035,page_view,/docs,04/02/2023 23:08,mobile,,Linux,,TRUE,2023-04-02 23:08
E005297,U000146,search,,,,,,,FALSE,2025-06-12 23:48
E005565,U000161,page_view,/integrations,04/18/2023 09:44,,,Android,unknown,,2023-04-18 9:44
E005054,u002278,search,,2024-07-03 11:39,mobile,Edge,,unknown,FALSE,2024-07-03 11:39
E005963,U002327,comment,,,desktop,Firefox,macOS,,,2024-08-22 8:41
E008611,U002012,doc_create,,0000-00-00 00:00:00,,Firefox,,860,FALSE,2024-08-17 16:01
E003386,U000437,integration_connect,,2023-03-31 22:32,DESKTOP,Firefox,macOS,,,2023-03-31 22:32
E001312,U001615,share,,2023-11-21,desktop,Chrome,,unknown,,2023-11-21 10:29
E001464,U001988,integration_error,,2023-03-15 19:49,,Edge,Linux,553,TRUE,2023-03-15 19:49
E001365,U002417,integration_error,,08/02/2024 23:39,mobile,Brave,,1697,1,2024-08-02 23:39
E007027,U000007,search,,11/08/2024 06:54,,,Windows,,0,2024-11-08 6:54
E005079,U000206,logout,/onboarding,2024-09-04 8:32,,Safari,Android,331,TRUE,2024-09-04 8:32
E001775,U002409,comment,,2025-01-11,DESKTOP,,Windows,unknown,FALSE,2025-01-11 23:08
E008814,U000306,comment,,2023-10-20,desktop,Brave,macOS,545,0,2023-10-20 9:46
E008778,U001822,ai_search,,05/24/2025 02:06,DESKTOP,,macOS,1009,1,2025-05-24 2:06
E004281,U002434,comment,,2025-02-01,desktop,Edge,Windows,unknown,,2025-02-01 4:09
E004228,U001245,doc_delete,,2024-03-31,mobile,,Linux,unknown,TRUE,2024-03-31 11:18
E000815,U001337,page_view,/docs,,mobile,,,,,2023-10-14 12:56
E004643,U001104,page_view,/onboarding,2023-03-19,DESKTOP,,Windows,,1,2023-03-19 21:51
E002342, U002447 ,login,/pricing,10/16/2024 19:10,,Edge,Linux,,,2024-10-16 19:10
E004154,U000995,integration_error,,08/30/2023 17:07,tablet,Edge,,,1,2023-08-30 17:07
E000323,u000124,logout,/integrations,2023-03-02 10:44,,Firefox,iOS,,0,2023-03-02 10:44
E005120,U002292,comment,,2024-12-02 0:30,DESKTOP,,macOS,,TRUE,2024-12-02 0:30
E005326,U002493,doc_edit,,,,Firefox,macOS,unknown,TRUE,2023-11-08 11:41
E008769,U000938,page_view,/dashboard,01/31/2024 16:06,,Edge,Android,unknown,,2024-01-31 16:06
E008987,U000365,search,,2023-10-17 5:44,mobile,Firefox,macOS,,TRUE,2023-10-17 5:44
E005912, U000928 ,export,,2023-03-30 0:41,desktop,,iOS,,TRUE,2023-03-30 0:41
E008723,U002045,search,,07/21/2023 02:35,desktop,Safari,Windows,unknown,TRUE,2023-07-21 2:35
E003360,U000177,integration_error,,2024-04-20 4:15,desktop,Brave,Windows,,FALSE,2024-04-20 4:15
 E008175,U000215,ai_search,,2023-01-09 14:20,,,macOS,,TRUE,2023-01-09 14:20
E006082,U000965,search,,02/03/2025 05:57,tablet,Chrome,iOS,,,2025-02-03 5:57
E000570,U000310,search,,09/30/2024 17:29,desktop,Brave,Windows,491,FALSE,2024-09-30 17:29
E006019,USR-000908,ai_search,,10/01/2023 12:01,tablet,Brave,Android,,FALSE,2023-10-01 12:01
E001296,U001511,search,,01/24/2025 16:31,desktop,,iOS,,1,2025-01-24 16:31
E002298,U001038,doc_create,,,tablet,Brave,iOS,unknown,TRUE,2023-04-30 11:50
E007195,U000838,integration_error,,12/17/2023 16:52,,,,,,2023-12-17 16:52
E005450,U000107,doc_edit,,,DESKTOP,Brave,,,0,2024-09-22 14:40
 E002624,U001052,LOGOUT,/dashboard,09/18/2023 06:42,,,iOS,,1,2023-09-18 6:42
E003453,U001061,comment,,2023-01-25,,Edge,Windows,1733,TRUE,2023-01-25 15:57
E001286,U001613,search,,02/07/2025 07:38,,Safari,Android,,,2025-02-07 7:38
E003067,u000827,integration_connect,,04/20/2024 11:31,,Chrome,Windows,unknown,FALSE,2024-04-20 11:31
E004714,U002510,integration_connect,,2024-01-21,,,iOS,451,FALSE,2024-01-21 3:01
E000333,U000496,export,,05/22/2024 06:37,DESKTOP,Brave,Linux,unknown,TRUE,2024-05-22 6:37
E000279,U000225,doc_create,,03/17/2023 14:18,,Firefox,macOS,,,2023-03-17 14:18
E003907,U000229,doc_delete,,05/26/2024 08:00,desktop,Brave,macOS,,,2024-05-26 8:00
E007547,U001215,integration_connect,,2025-05-09 18:46,DESKTOP,Chrome,,426,FALSE,2025-05-09 18:46
E000062,U001348,share,,,mobile,,macOS,,TRUE,2023-10-23 18:43
E002048,U000612,share,,2023-10-27,tablet,,,unknown,FALSE,2023-10-27 6:29
E004401,U001004,share,,07/08/2023 11:28,desktop,Firefox,iOS,1452,,2023-07-08 11:28
E000223,U000585,page_view,/dashboard,10/16/2024 17:05,,Safari,iOS,,0,2024-10-16 17:05
E008207,U002054,INTEGRATION_CONNECT,,2024-06-07 17:08,,Edge,macOS,,1,2024-06-07 17:08
E002801,U000872,integration_error,,,desktop,Edge,Android,unknown,,2023-03-31 11:07
E004838,U002387,share,,04/08/2023 17:13,DESKTOP,Chrome,Android,,,2023-04-08 17:13
E006657,U001005,DOC_EDIT,,01/01/2025 22:03,desktop,,,unknown,FALSE,2025-01-01 22:03
E004446,USR-000771,DOC_DELETE,,2023-10-27 14:57,DESKTOP,,Linux,,,2023-10-27 14:57
E003690,u000878,comment,,02/11/2023 02:18,,Chrome,,1505,TRUE,2023-02-11 2:18
E003996,U000318,login,/search,12/15/2023 02:19,mobile,Brave,Linux,,FALSE,2023-12-15 2:19
E001070,USR-002014,doc_edit,,2024-08-29,,Firefox,Android,,FALSE,2024-08-29 19:05
E000324,U002002,doc_create,,07/05/2024 06:46,desktop,Brave,macOS,,TRUE,2024-07-05 6:46
E008977,U000328,doc_delete,,2023-07-16,mobile,Safari,,,,2023-07-16 23:22
E003488, U001049 ,comment,,09/24/2023 02:43,tablet,Chrome,iOS,,,2023-09-24 2:43
E006450,U000389,doc_edit,,2023-08-15 1:47,desktop,Edge,,unknown,,2023-08-15 1:47
E007575,U002115,doc_delete,,09/03/2023 05:20,desktop,Chrome,Windows,,,2023-09-03 5:20
E001067,U002309,login,/billing,07/28/2024 03:44,tablet,Brave,iOS,,TRUE,2024-07-28 3:44
E008551,U000438,doc_edit,,,tablet,,iOS,734,0,2025-02-13 1:36
E004040,U002431,logout,/billing,2024-11-14 20:16,,Brave,Android,,,2024-11-14 20:16
E002469,U001019,comment,,2024-04-21,desktop,Edge,Linux,440,FALSE,2024-04-21 15:14
e003004, u001580 ,integration_connect,,2025-02-14 19:25,desktop,,Linux,,0,2025-02-14 19:25
E007619,U002253,ai_search,,2023-06-25 15:04,DESKTOP,Firefox,,unknown,0,2023-06-25 15:04
E005473,U000791,login,/onboarding,2024-07-10 10:11,mobile,Firefox,,,TRUE,2024-07-10 10:11
E007822, U002141 ,page_view,/billing,2024-12-10 20:40,,,,1492,1,2024-12-10 20:40
E004222,U000887,integration_connect,,2024-04-11,desktop,Brave,Android,,0,2024-04-11 0:13
E006533,U001416,doc_create,,2025-03-10 4:49,DESKTOP,Chrome,Android,,,2025-03-10 4:49
E008722, U002453 ,login,/pricing,2023-01-18,tablet,Safari,Linux,,0,2023-01-18 13:16
E001077,U001858,logout,/docs,2023-08-05 17:55,,,Android,,TRUE,2023-08-05 17:55
E006534,U002363,export,,2025-01-25,,Chrome,Windows,,1,2025-01-25 6:06
E004358,U001321,login,/search,12/23/2024 01:21,tablet,,,,1,2024-12-23 1:21
E000931,U002045,ai_search,,04/19/2024 23:52,tablet,Safari,,,1,2024-04-19 23:52
E005086, u002572 ,doc_create,,01/14/2023 12:09,tablet,,Android,597,FALSE,2023-01-14 12:09
E003399,U001593,login,/dashboard,2024-11-03 3:45,,Edge,macOS,,1,2024-11-03 3:45
E006581,U001830,export,,2023-05-23,mobile,,iOS,unknown,1,2023-05-23 9:54
E003226,U002005,logout,/settings,,,,,,0,2024-10-20 14:31
E004310,U001132,doc_edit,,2025-02-14,desktop,Edge,Android,unknown,TRUE,2025-02-14 8:14
E007088,U001325,doc_edit,,2023-07-17 5:31,DESKTOP,Firefox,iOS,,TRUE,2023-07-17 5:31
E003844,U001812,doc_create,,,tablet,,Windows,1002,0,2025-02-14 16:11
E004533,U000784,page_view,/admin,2024-08-20,DESKTOP,Firefox,Linux,,TRUE,2024-08-20 2:07
E002676,U002303,comment,,07/07/2024 05:57,mobile,Brave,Android,,FALSE,2024-07-07 5:57
E006978,U001259,integration_error,,2025-03-07 2:13,DESKTOP,Firefox,Linux,,FALSE,2025-03-07 2:13
E005541,U001268,comment,,03/22/2024 09:40,mobile,Safari,,,FALSE,2024-03-22 9:40
E006531,U000180,doc_edit,,2023-12-08 16:39,tablet,Safari,Windows,1094,FALSE,2023-12-08 16:39
E001276,U000132,doc_edit,,2023-08-14 3:31,DESKTOP,,Linux,656,0,2023-08-14 3:31
E004350,U002396,doc_edit,,0000-00-00 00:00:00,desktop,,Linux,,1,2024-05-13 13:19
E006665, U000593 ,search,,2025-06-11,DESKTOP,Brave,Linux,,1,2025-06-11 23:31
E006238,U000979,share,,2024-07-01 4:39,,Safari,Windows,,FALSE,2024-07-01 4:39
E003777,USR-001880,logout,/admin,2023-03-10 15:44,,Edge,Windows,,FALSE,2023-03-10 15:44
E002871, U001846 ,search,,2024-04-21 13:04,,Safari,macOS,193,TRUE,2024-04-21 13:04
E001602,U000635,page_view,/dashboard,01/24/2025 12:08,desktop,Firefox,Android,unknown,,2025-01-24 12:08
E006886,U002097,doc_delete,,08/03/2023 19:17,mobile,Edge,,933,FALSE,2023-08-03 19:17
E005390,U000748,doc_create,,05/11/2023 06:11,DESKTOP,Safari,Windows,152,TRUE,2023-05-11 6:11
E002708,u002238,page_view,/integrations,2024-06-24,,Safari,,unknown,0,2024-06-24 8:35
E007003,U001438,doc_edit,,04/03/2024 06:47,tablet,,Android,,0,2024-04-03 6:47
E008968,U001263,logout,/admin,2023-10-28,,Firefox,Android,,TRUE,2023-10-28 6:31
E002808,U000442,integration_error,,2025-05-07 5:26,,Chrome,Android,unknown,1,2025-05-07 5:26
E008575,U001484,search,,07/04/2024 01:19,desktop,Edge,,unknown,,2024-07-04 1:19
E002327,u000604,comment,,04/30/2025 09:59,tablet,Edge,macOS,unknown,1,2025-04-30 9:59
E000458,U000367,page_view,/dashboard,11/01/2024 11:35,tablet,Edge,Windows,136,FALSE,2024-11-01 11:35
E004761,U000503,doc_create,,2024-07-18 22:32,tablet,Chrome,iOS,,TRUE,2024-07-18 22:32
E000764,U000826,export,,2023-02-08,,Edge,iOS,,TRUE,2023-02-08 7:52
E003338,U000295,logout,/dashboard,0000-00-00 00:00:00,DESKTOP,Brave,,,0,2023-01-15 18:39
e007870,U001459,logout,/docs,2025-04-22,DESKTOP,Edge,,,FALSE,2025-04-22 4:47
E002205,u000705,share,,2024-11-12 7:28,tablet,Edge,,44,FALSE,2024-11-12 7:28
E001174,U000951,ai_search,,08/06/2024 21:43,,Safari,macOS,,,2024-08-06 21:43
E001962,U000878,export,,,,Firefox,,,,2024-06-01 14:46
E000421,U002345,integration_connect,,06/01/2023 23:02,tablet,,Windows,unknown,0,2023-06-01 23:02
E006552,U001364,doc_delete,,01/26/2025 08:24,mobile,Firefox,,,0,2025-01-26 8:24
E005857,U001069,share,,2023-01-17,,Brave,,,1,2023-01-17 18:03
E006706,U001479,export,,01/28/2025 23:01,desktop,Firefox,,,TRUE,2025-01-28 23:01
E005252,U001491,integration_error,,2025-04-14,mobile,,macOS,unknown,TRUE,2025-04-14 9:58
E006614,U002183,export,,02/22/2023 10:22,tablet,,iOS,,FALSE,2023-02-22 10:22
E002895,U001346,search,,2025-06-05,desktop,Firefox,Linux,,FALSE,2025-06-05 7:10
E007900, U002248 ,share,,07/05/2023 10:22,,,,,FALSE,2023-07-05 10:22
E007237,U000679,doc_create,,2024-02-08 7:25,mobile,,macOS,,,2024-02-08 7:25
E005059,U000247,ai_search,,2024-05-15,,Edge,iOS,unknown,TRUE,2024-05-15 11:58
E005087,u002490,doc_create,,2025-04-28 5:51,desktop,Chrome,Linux,unknown,TRUE,2025-04-28 5:51
E000841,U000758,doc_create,,2023-11-03,,Brave,,,TRUE,2023-11-03 19:49
E005320,U000408,comment,,2023-12-06,DESKTOP,,,unknown,1,2023-12-06 22:32
E002025,U000733,integration_connect,,2023-06-14 3:20,,Edge,Android,,0,2023-06-14 3:20
E000033,USR-000683,login,/docs,02/10/2025 09:52,DESKTOP,Chrome,Windows,1483,0,2025-02-10 9:52
E008022,U000031,logout,/help,2024-10-13,tablet,Firefox,Android,unknown,0,2024-10-13 22:36
E005824,U001768,doc_create,,2023-12-12 11:27,desktop,,iOS,,1,2023-12-12 11:27
E004356,U000753,login,/help,2023-05-18 22:41,,Brave,macOS,382,FALSE,2023-05-18 22:41
E008084,U002384,doc_create,,,desktop,Firefox,Linux,,,2023-11-01 18:04
E008043,USR-002262,doc_create,,10/16/2023 12:58,,Chrome,Linux,unknown,,2023-10-16 12:58
E008497,U002214,integration_error,,05/24/2024 14:05,,Chrome,Linux,1385,TRUE,2024-05-24 14:05
E001044,U001702,logout,/admin,2023-09-20,DESKTOP,,Linux,,TRUE,2023-09-20 9:15
E007433,U000770,export,,2023-08-09,DESKTOP,Safari,,,1,2023-08-09 2:06
E001008,U002220,comment,,08/20/2024 02:11,,Edge,iOS,,FALSE,2024-08-20 2:11
E000558,U001984,integration_error,,2023-12-14 23:10,,Chrome,iOS,unknown,0,2023-12-14 23:10
E004762,U001007,search,,06/19/2025 13:30,desktop,Firefox,Windows,unknown,1,2025-06-19 13:30
E005876,u001033,page_view,/settings,2024-11-15 15:46,,,,unknown,1,2024-11-15 15:46
E004122,U001924,comment,,2023-04-21 5:54,DESKTOP,,Linux,,1,2023-04-21 5:54
E007401,U001241,export,,03/07/2023 04:49,desktop,Chrome,Linux,,FALSE,2023-03-07 4:49
E002570,U002088,comment,,2023-05-01,,,Windows,393,TRUE,2023-05-01 7:19
E004853,U001001,ai_search,,2024-06-09 19:45,mobile,Safari,Linux,1303,TRUE,2024-06-09 19:45
E003239,U000185,page_view,/help,2024-08-19 4:08,mobile,Brave,macOS,1095,,2024-08-19 4:08
E004771,U000115,login,/pricing,01/16/2025 05:41,desktop,Safari,Linux,,TRUE,2025-01-16 5:41
E008945,U001900,logout,/dashboard,,DESKTOP,,Android,,TRUE,2024-10-05 13:05
e006501, U002083 ,ai_search,,11/18/2024 01:51,,Edge,macOS,unknown,FALSE,2024-11-18 1:51
E007631,U000798,INTEGRATION_CONNECT,,0000-00-00 00:00:00,,Chrome,macOS,130,1,2024-03-25 12:46
E003313,U000294,comment,,2024-05-06 22:51,,Edge,,,TRUE,2024-05-06 22:51
E000436,U002366,doc_create,,01/28/2024 17:51,desktop,,macOS,,FALSE,2024-01-28 17:51
E000999,U002051,share,,2023-10-15,tablet,Firefox,Android,,,2023-10-15 10:35
E007582,U000532,comment,,2023-10-27,tablet,,Linux,251,TRUE,2023-10-27 12:21
E001675,U000075,comment,,2024-12-26 1:40,desktop,Safari,macOS,,,2024-12-26 1:40
E007398,U002311,login,/billing,2023-08-24 9:25,tablet,,Linux,,FALSE,2023-08-24 9:25
E001980,U000562,page_view,/pricing,2023-08-25,,,,220,,2023-08-25 19:42
E001063,U001170,share,,,tablet,,,unknown,1,2023-01-12 8:58
E003963,U000353,integration_connect,,03/12/2023 00:00,desktop,,,unknown,FALSE,2023-03-12 0:00
E005830,U000698,page_view,/search,2025-03-22,desktop,Brave,,1220,FALSE,2025-03-22 10:59
E007611,U001418,doc_delete,,0000-00-00 00:00:00,,Safari,iOS,1338,TRUE,2024-09-11 14:56
E004253,U001114,search,,05/12/2024 13:18,,Brave,macOS,1700,1,2024-05-12 13:18
E004196,U002152,page_view,/billing,2023-08-23 9:32,,Edge,Linux,,1,2023-08-23 9:32
E006408,U001688,logout,/billing,2024-09-16,desktop,Safari,iOS,,FALSE,2024-09-16 14:52
E001959,U002442,logout,/help,,mobile,Edge,macOS,,,2024-10-07 9:12
E000006,U000644,doc_edit,,07/17/2024 16:28,DESKTOP,Safari,Android,1367,,2024-07-17 16:28
E000235,U001864,login,/search,2024-06-24 17:24,desktop,,Windows,,,2024-06-24 17:24
E001574,U002498,share,,2023-12-25 5:00,DESKTOP,Brave,,,0,2023-12-25 5:00
E006620,U002367,login,/integrations,12/27/2024 05:13,DESKTOP,,Linux,214,TRUE,2024-12-27 5:13
E002241,U000525,share,,,,,Android,,1,2023-06-22 6:36
E000323,U001171,comment,,2024-07-28,tablet,Safari,iOS,,FALSE,2024-07-28 22:37
E002490,U001276,ai_search,,2025-05-07 2:04,DESKTOP,Firefox,Linux,928,,2025-05-07 2:04
E006931,U002560,integration_error,,2023-11-01 6:58,mobile,,,unknown,TRUE,2023-11-01 6:58
E005240,U001562,integration_connect,,2024-05-05 5:38,tablet,,Linux,,TRUE,2024-05-05 5:38
E004537,U000363,doc_create,,04/19/2025 01:14,DESKTOP,Edge,iOS,1244,0,2025-04-19 1:14
E004991,U001345,integration_error,,05/04/2025 08:19,,Chrome,iOS,,1,2025-05-04 8:19
E007641,U000795,doc_create,,11/14/2024 23:52,mobile,,,,1,2024-11-14 23:52
E007032,U000097,doc_edit,,2023-08-25 15:46,mobile,Safari,,,FALSE,2023-08-25 15:46
E002998,U002008,doc_delete,,07/18/2024 18:08,desktop,,Linux,,FALSE,2024-07-18 18:08
E001705,U001771,share,,2024-04-06 10:18,mobile,Safari,Android,unknown,TRUE,2024-04-06 10:18
E001831,U001956,doc_create,,06/22/2023 20:55,,Safari,Linux,unknown,,2023-06-22 20:55
E007548,U002521,doc_create,,2023-09-06 6:05,,Chrome,,,0,2023-09-06 6:05
E001522,U000778,integration_connect,,12/11/2023 22:57,mobile,,Linux,unknown,,2023-12-11 22:57
E006360,U001117,page_view,/docs,,,Edge,,977,FALSE,2024-05-19 14:22
E008140,U001424,login,/billing,2023-12-05 4:10,tablet,Firefox,Windows,,TRUE,2023-12-05 4:10
E003182, U000979 ,integration_connect,,05/01/2023 18:05,,,,unknown,FALSE,2023-05-01 18:05
E004836,U000989,share,,,mobile,Safari,,1272,,2024-02-07 4:00
 E006335, U000446 ,doc_edit,,2023-12-25 16:36,desktop,Edge,Android,,1,2023-12-25 16:36
E001840,U000054,doc_delete,,05/17/2025 21:12,,,Windows,,TRUE,2025-05-17 21:12
E000413,U000523,ai_search,,01/10/2023 17:46,,Brave,Linux,unknown,1,2023-01-10 17:46
E008190,U000284,share,,2024-09-16 8:31,DESKTOP,Brave,macOS,,FALSE,2024-09-16 8:31
E002894,U002500,ai_search,,02/24/2023 20:50,desktop,,macOS,,,2023-02-24 20:50
E000421,U001973,doc_edit,,0000-00-00 00:00:00,mobile,Firefox,iOS,,0,2024-07-15 23:24
E007455, U002353 ,page_view,/pricing,2024-06-23 7:25,desktop,Brave,,,FALSE,2024-06-23 7:25
e001899,U001676,integration_error,,2025-03-09,tablet,Chrome,macOS,,TRUE,2025-03-09 7:55
E002379,U000758,doc_create,,,mobile,,,unknown,FALSE,2024-10-12 13:12
E003414,U001379,doc_edit,,2024-07-21,,,Windows,,,2024-07-21 0:21
E002782,U000127,logout,/docs,,,Safari,Linux,,1,2024-06-22 20:29
E005183,U001855,doc_create,,2024-08-04,,Safari,,,,2024-08-04 18:28
E000150,U000958,ai_search,,2024-10-12 21:31,DESKTOP,Firefox,Windows,,0,2024-10-12 21:31
E002895,U000904,login,/admin,2024-11-23,desktop,,macOS,173,,2024-11-23 5:51
E004928,U001855,PAGE_VIEW,/dashboard,2023-10-09 1:27,,Chrome,macOS,unknown,,2023-10-09 1:27
E007580, U000392 ,doc_create,,2023-01-30,,Firefox,Linux,1673,FALSE,2023-01-30 19:54
E007926,u000768,login,/dashboard,2023-01-27 23:40,mobile,Brave,Windows,509,TRUE,2023-01-27 23:40
E005765, U001821 ,export,,04/13/2023 01:17,tablet,Safari,,,TRUE,2023-04-13 1:17
E003874,u001718,doc_delete,,2024-08-09 1:54,,Edge,Android,unknown,TRUE,2024-08-09 1:54
E006403,U001753,page_view,/admin,2023-01-12,,Chrome,Windows,unknown,TRUE,2023-01-12 23:35
E002416,U001354,export,,2023-04-27,,Brave,Android,1382,1,2023-04-27 0:50
E008400,U000690,share,,2023-03-21,,Safari,,,,2023-03-21 14:35
E007142,U000364,doc_delete,,2025-04-20,,Brave,,,0,2025-04-20 20:29
E006504,U000962,ai_search,,01/26/2025 14:55,,Firefox,,,,2025-01-26 14:55
E001019,U000318,doc_edit,,12/29/2024 11:01,tablet,Chrome,Linux,unknown,0,2024-12-29 11:01
E001148,U001360,search,,2024-05-23,tablet,Edge,Linux,1178,,2024-05-23 21:30
E008634, u002165 ,integration_connect,,12/08/2023 20:34,,Safari,,unknown,TRUE,2023-12-08 20:34
E001840,U002002,export,,2023-06-12 10:03,tablet,Brave,iOS,1329,TRUE,2023-06-12 10:03
E006255,U000626,integration_connect,,2024-09-05 5:09,tablet,,iOS,,0,2024-09-05 5:09
E005559,U001879,doc_edit,,03/11/2025 12:09,,Brave,Linux,,,2025-03-11 12:09
E000896,U000638,comment,,2024-08-16,tablet,Chrome,Windows,,FALSE,2024-08-16 22:05
E003439,U000562,ai_search,,10/11/2023 05:56,desktop,Edge,Windows,,FALSE,2023-10-11 5:56
E001413,U000168,export,,2023-02-03,tablet,Safari,,,,2023-02-03 9:14
E001546, U001695 ,comment,,07/09/2023 20:46,tablet,Chrome,Android,373,TRUE,2023-07-09 20:46
E004371,U001034,doc_create,,2024-06-27,,Chrome,Linux,,TRUE,2024-06-27 18:45
E006162,U000938,doc_delete,,2025-01-01,,,macOS,601,,2025-01-01 15:54
E006081,U001238,doc_create,,2023-08-04 7:56,DESKTOP,,,1055,FALSE,2023-08-04 7:56
E001998,U001708,login,/admin,2024-04-29,,Chrome,Linux,,TRUE,2024-04-29 9:52
E007102, U001624 ,comment,,06/02/2025 01:39,tablet,Firefox,,539,0,2025-06-02 1:39
E005132,USR-000922,integration_error,,,desktop,Edge,,,FALSE,2023-10-11 3:11
E008622,U001840,doc_delete,,2024-08-03,DESKTOP,Brave,macOS,1033,TRUE,2024-08-03 6:28
E008870,U001756,integration_error,,2024-05-12,DESKTOP,Edge,Windows,,,2024-05-12 20:43
E001268,U002556,SEARCH,,05/31/2024 11:59,DESKTOP,Chrome,Linux,,TRUE,2024-05-31 11:59
E002515,U000152,doc_edit,,2024-04-21 18:04,desktop,,,,,2024-04-21 18:04
E003256,U002224,login,/help,03/24/2025 12:05,mobile,Edge,macOS,1296,1,2025-03-24 12:05
E005978,U000018,share,,08/10/2024 04:16,desktop,Chrome,macOS,,FALSE,2024-08-10 4:16
E003949,U000592,search,,04/19/2024 13:26,,Edge,,,TRUE,2024-04-19 13:26
E006708,USR-000404,doc_edit,,2023-05-14,tablet,Firefox,iOS,,FALSE,2023-05-14 12:04
E000726,U002461,ai_search,,2024-06-15,,,macOS,1436,,2024-06-15 15:31
E003486, u000527 ,ai_search,,,mobile,Chrome,Windows,,,2023-10-22 23:16
E000273,u000701,comment,,05/22/2023 02:54,,Brave,,,0,2023-05-22 2:54
E005889,U000846,login,/dashboard,2024-04-27 21:46,tablet,Brave,Android,,FALSE,2024-04-27 21:46
E003474,U000973,page_view,/settings,,DESKTOP,Safari,Android,,0,2025-01-11 5:22
E007061,U000078,search,,02/19/2024 13:29,mobile,Brave,Android,,,2024-02-19 13:29
E004299,U000660,export,,2024-08-03 21:13,,,Linux,,0,2024-08-03 21:13
E007426,U001470,doc_create,,,desktop,Chrome,Windows,1689,1,2024-09-27 14:57
E000306,U001943,export,,06/27/2023 03:10,DESKTOP,,Windows,unknown,1,2023-06-27 3:10
E001460,u002008,export,,2023-09-24,tablet,,Windows,110,FALSE,2023-09-24 15:44
E000534,U000647,doc_delete,,2023-11-20 20:39,,Brave,,unknown,,2023-11-20 20:39
 E008991,U002429,comment,,2023-10-08 6:56,,Edge,iOS,604,0,2023-10-08 6:56
E008108,U002409,integration_connect,,2024-09-05 14:43,desktop,Brave,Windows,,TRUE,2024-09-05 14:43
E006340,U002479,page_view,/docs,2023-07-25,desktop,,iOS,1652,1,2023-07-25 23:02
E003400,U002370,page_view,/docs,2023-02-09,DESKTOP,Chrome,,,1,2023-02-09 3:51
E007854,U001168,comment,,02/28/2024 23:33,,Safari,Linux,unknown,1,2024-02-28 23:33
E004353,U001092,doc_edit,,2024-05-30 18:07,mobile,,macOS,1088,,2024-05-30 18:07
E000191,U000009,logout,/settings,2023-06-21 21:58,,Safari,Linux,,FALSE,2023-06-21 21:58
E008207,U001179,doc_delete,,2024-10-26,tablet,Edge,iOS,unknown,1,2024-10-26 1:57
e007610, U001502 ,share,,2023-02-03,tablet,Firefox,,202,1,2023-02-03 13:05
E007798,U001257,doc_create,,05/25/2024 07:10,,Brave,Windows,unknown,FALSE,2024-05-25 7:10
E005583,U001965,doc_create,,2024-03-03,,,Android,,FALSE,2024-03-03 6:06
E002851,U002548,doc_edit,,0000-00-00 00:00:00,,,Windows,,FALSE,2024-09-06 21:28
E007543,U002374,login,/integrations,01/25/2025 06:54,,Brave,macOS,933,FALSE,2025-01-25 6:54
E000216,U000912,ai_search,,2023-06-11 10:50,,,macOS,unknown,1,2023-06-11 10:50
E004335,U002144,doc_delete,,2023-09-22 23:18,,Brave,macOS,unknown,,2023-09-22 23:18
E003833,U001365,ai_search,,,,Chrome,iOS,,TRUE,2025-04-15 0:55
E002170,U000915,LOGOUT,/dashboard,2023-11-26,DESKTOP,,macOS,unknown,TRUE,2023-11-26 23:11
E001171,U000014,logout,/pricing,2025-04-05,,Firefox,,,FALSE,2025-04-05 7:48
E008578,U000512,doc_create,,2024-04-17 16:07,DESKTOP,,Windows,unknown,,2024-04-17 16:07
E001371, u000894 ,comment,,2023-12-16,,Brave,Android,,TRUE,2023-12-16 21:19
E005869,U001375,logout,/search,2023-06-26 22:42,desktop,Chrome,Android,unknown,1,2023-06-26 22:42
E004324,U001173,doc_edit,,2023-04-04,,,Android,,TRUE,2023-04-04 8:18
E003336,U000792,DOC_DELETE,,2024-02-25 11:02,,,,1468,TRUE,2024-02-25 11:02
E005531,U002078,share,,10/12/2024 05:58,,Safari,Windows,,1,2024-10-12 5:58
E002021,U000724,integration_connect,,2024-06-14 2:18,DESKTOP,Chrome,Linux,unknown,TRUE,2024-06-14 2:18
E008279,U000155,ai_search,,,mobile,Safari,macOS,unknown,TRUE,2023-06-20 21:58
E008569,U001328,doc_create,,02/28/2023 00:52,,Safari,,,,2023-02-28 0:52
E000535,U001762,doc_edit,,01/14/2025 23:35,DESKTOP,,Linux,unknown,FALSE,2025-01-14 23:35
E002150,U000136,integration_connect,,2023-01-25,,Brave,,,TRUE,2023-01-25 12:08
E001519,U000956,ai_search,,2023-08-25 16:21,mobile,Safari,Android,1139,0,2023-08-25 16:21
E004852,U002106,integration_connect,,12/07/2023 02:48,,,,,,2023-12-07 2:48
E008541,U002059,integration_connect,,2023-06-15 10:11,,Chrome,Windows,unknown,,2023-06-15 10:11
E001535,U001743,ai_search,,2024-09-28 18:44,,Firefox,,921,,2024-09-28 18:44
E000997,U000782,doc_edit,,2025-01-14,mobile,,Android,,,2025-01-14 23:54
E000117,U002439,share,,12/29/2023 12:02,mobile,Safari,Windows,,0,2023-12-29 12:02
E000121,u001810,ai_search,,2023-07-24,tablet,,,unknown,TRUE,2023-07-24 23:35
E002761,U000812,export,,05/17/2025 18:32,DESKTOP,Edge,Windows,,,2025-05-17 18:32
E001426,U000639,comment,,02/21/2024 06:28,,Edge,Android,1553,FALSE,2024-02-21 6:28
E005824,U000229,integration_error,,05/31/2023 18:35,mobile,Firefox,Windows,,0,2023-05-31 18:35
E004913,u001345,share,,03/24/2023 11:20,,,macOS,unknown,FALSE,2023-03-24 11:20
E006983,USR-002248,export,,2024-11-13,desktop,Safari,Linux,188,TRUE,2024-11-13 23:10
E008288,U000874,doc_create,,2024-10-11,tablet,Chrome,Linux,,TRUE,2024-10-11 0:05
E002463,U000912,export,,2023-09-18,tablet,Chrome,macOS,,FALSE,2023-09-18 14:21
E008151, U001095 ,page_view,/onboarding,2025-01-08,DESKTOP,Safari,Linux,unknown,0,2025-01-08 3:24
E004753,U000596,doc_edit,,2024-02-28 3:04,mobile,Firefox,Linux,,,2024-02-28 3:04
E005916, U001503 ,LOGOUT,/help,2023-02-12 6:58,mobile,Firefox,macOS,unknown,0,2023-02-12 6:58
E001857,U001492,export,,02/20/2023 11:46,tablet,Firefox,,492,0,2023-02-20 11:46
E008341,U002245,export,,02/20/2025 15:35,,Safari,Linux,,,2025-02-20 15:35
E000699,U000692,search,,03/16/2024 16:11,,Brave,Linux,unknown,TRUE,2024-03-16 16:11
E007033,U000978,export,,2025-03-10,,,,,0,2025-03-10 17:06
E004027,u001031,doc_delete,,,mobile,Safari,Linux,1538,FALSE,2024-02-03 10:15
E005966,U002424,logout,/search,,tablet,Brave,Windows,,FALSE,2023-02-26 18:14
E004075,U002054,doc_delete,,2024-05-24,DESKTOP,Brave,Android,unknown,FALSE,2024-05-24 17:16
E005180,U002013,logout,/docs,07/13/2023 11:03,tablet,Brave,,1491,FALSE,2023-07-13 11:03
E000848,U002196,export,,2023-06-11 8:00,tablet,Edge,Android,unknown,1,2023-06-11 8:00
E007383,U001901,ai_search,,03/10/2023 19:48,DESKTOP,Edge,Windows,,TRUE,2023-03-10 19:48
E005874,U001745,integration_connect,,08/29/2024 14:46,mobile,Brave,iOS,668,TRUE,2024-08-29 14:46
E003041,U001387,search,,,DESKTOP,,,,,2023-03-03 10:39
E002458,U002567,ai_search,,,,,,314,0,2024-04-17 9:14
E008004,U002435,doc_edit,,2024-03-06 12:40,mobile,Chrome,Windows,,,2024-03-06 12:40
E000468,U001722,search,,0000-00-00 00:00:00,,,Linux,,TRUE,2023-06-26 10:09
E002417,U000135,doc_delete,,2023-06-05,tablet,,,,TRUE,2023-06-05 12:27
E004331,U002380,login,/help,03/21/2024 03:07,mobile,Brave,Windows,,FALSE,2024-03-21 3:07
E002401,U001856,doc_edit,,2023-09-26 15:27,,,,,,2023-09-26 15:27
E008121,U001592,doc_create,,07/13/2023 02:29,desktop,Chrome,,,FALSE,2023-07-13 2:29
E005412,U000363,integration_error,,06/21/2024 14:48,,Edge,iOS,unknown,0,2024-06-21 14:48
E008619,U000596,comment,,,mobile,Firefox,Windows,unknown,FALSE,2025-05-04 20:30
E004392,U000980,export,,02/04/2025 01:48,tablet,Safari,iOS,,0,2025-02-04 1:48
E004429, U000253 ,ai_search,,12/23/2023 23:27,,Firefox,,,,2023-12-23 23:27
E000580,U002143,page_view,/admin,05/13/2023 14:45,,Safari,,878,FALSE,2023-05-13 14:45
E008214,U002438,integration_error,,2024-09-09 4:42,DESKTOP,Chrome,Windows,unknown,TRUE,2024-09-09 4:42
E005260,U002062,doc_delete,,2023-09-23 21:19,DESKTOP,Firefox,macOS,unknown,,2023-09-23 21:19
E005808,U000900,search,,2023-06-10,mobile,Brave,,,0,2023-06-10 12:23
E003745,U001938,ai_search,,2024-10-09,,,,,1,2024-10-09 11:55
E001801,U002340,doc_edit,,07/30/2023 02:45,tablet,Firefox,macOS,,0,2023-07-30 2:45
E008524,U001370,page_view,/docs,,,,Windows,1741,TRUE,2023-08-14 11:26
E006694,U001276,search,,06/21/2023 08:37,,Firefox,,,,2023-06-21 8:37
E008044,U001837,integration_connect,,2024-08-31,,,iOS,,0,2024-08-31 10:04
E002738,U000548,search,,2025-05-03,,,iOS,unknown,FALSE,2025-05-03 16:41
E002359, U001463 ,search,,03/04/2025 04:43,,,Linux,72,TRUE,2025-03-04 4:43
E008962, U002467 ,ai_search,,05/01/2024 07:51,,Firefox,Windows,519,,2024-05-01 7:51
E008471,U002096,login,/onboarding,2023-05-11 3:25,desktop,Edge,Linux,unknown,FALSE,2023-05-11 3:25
E003204,USR-001298,doc_edit,,01/15/2023 23:07,mobile,Edge,macOS,,FALSE,2023-01-15 23:07
E004585,U000228,doc_delete,,02/25/2024 05:10,,Brave,,,,2024-02-25 5:10
E001665,U001658,search,,06/03/2024 04:09,,Firefox,macOS,1322,0,2024-06-03 4:09
E008781,U002201,login,/search,2024-05-08,DESKTOP,,Linux,1523,TRUE,2024-05-08 23:17
E006921,U001516,search,,2024-11-27,,,Windows,unknown,,2024-11-27 18:26
E003123,U000855,logout,/settings,01/22/2024 22:00,tablet,Safari,,unknown,FALSE,2024-01-22 22:00
E007937,U001294,export,,12/30/2024 03:11,DESKTOP,Firefox,Android,,0,2024-12-30 3:11
E000436,U001065,doc_delete,,10/30/2024 01:27,,Edge,macOS,,FALSE,2024-10-30 1:27
E004494,U001068,search,,01/04/2025 15:49,DESKTOP,Chrome,Windows,486,,2025-01-04 15:49
E003018,U002234,integration_connect,,2025-04-06 13:34,tablet,Safari,macOS,486,FALSE,2025-04-06 13:34
E007067,U002358,login,/billing,2025-05-10 10:46,mobile,Edge,Android,906,,2025-05-10 10:46
E002970,U000745,logout,/dashboard,0000-00-00 00:00:00,,,,403,,2023-01-11 8:04
E001418,U002451,export,,2025-01-02,,Safari,Android,,FALSE,2025-01-02 12:15
E007199,u001648,export,,2025-04-07,mobile,,Android,unknown,TRUE,2025-04-07 16:17
E003248,U000516,doc_edit,,10/27/2023 09:25,DESKTOP,Chrome,Android,1225,FALSE,2023-10-27 9:25
e006575,U001338,search,,2023-12-04,tablet,Chrome,,,0,2023-12-04 14:31
E003640,U000278,integration_connect,,11/20/2023 20:17,desktop,Safari,Windows,960,FALSE,2023-11-20 20:17
E008722, U000327 ,ai_search,,01/08/2024 12:02,,Safari,Linux,1289,1,2024-01-08 12:02
E002414,U000635,export,,2023-08-13 7:47,DESKTOP,,iOS,,TRUE,2023-08-13 7:47
E007509,u000009,INTEGRATION_CONNECT,,2024-06-30 17:25,desktop,,,unknown,FALSE,2024-06-30 17:25
E004302,U001451,logout,/docs,2025-06-01 7:52,,,,unknown,TRUE,2025-06-01 7:52
E000491,U000770,search,,2024-10-28 1:15,tablet,Safari,iOS,,FALSE,2024-10-28 1:15
E005705,U000427,integration_error,,2023-11-18,mobile,Brave,,unknown,,2023-11-18 17:37
E002973,U000412,login,/admin,2025-06-09 20:06,tablet,Brave,,unknown,1,2025-06-09 20:06
E004826,U002380,export,,,,Edge,macOS,,,2024-12-25 20:02
e004997,U002162,logout,/admin,2023-01-19,desktop,Brave,,809,FALSE,2023-01-19 6:33
E005645,U002387,doc_edit,,2025-04-11,,Brave,macOS,,,2025-04-11 9:45
E006103,U000281,DOC_DELETE,,2024-07-30 18:17,,Firefox,,,FALSE,2024-07-30 18:17
E006567,U002579,integration_error,,2023-03-15,,Brave,Android,,FALSE,2023-03-15 19:03
E002113,U000089,logout,/dashboard,02/17/2023 11:21,,Brave,macOS,,1,2023-02-17 11:21
E006310,U001691,doc_delete,,2024-09-06 2:05,DESKTOP,,,591,0,2024-09-06 2:05
E001065,U001781,comment,,2024-12-11 6:17,,Chrome,Windows,982,,2024-12-11 6:17
E001993,USR-001472,logout,/dashboard,2025-05-12 11:36,,Chrome,Android,,FALSE,2025-05-12 11:36
E000947,U002002,doc_edit,,01/26/2023 10:09,,Firefox,iOS,,FALSE,2023-01-26 10:09
E000045,U000405,doc_delete,,2024-11-02,desktop,Safari,Windows,317,FALSE,2024-11-02 0:10
E000883,u000177,integration_error,,2023-03-22 3:52,DESKTOP,Safari,Windows,unknown,TRUE,2023-03-22 3:52
E003159,U000202,comment,,2025-04-13 20:41,,Firefox,,,1,2025-04-13 20:41
E001172,U001750,ai_search,,02/04/2024 08:26,tablet,Brave,,,1,2024-02-04 8:26
E007243,U000063,search,,2023-03-10,,Brave,Windows,,TRUE,2023-03-10 13:29
E000350,u000056,integration_connect,,2023-10-28,desktop,Firefox,,unknown,0,2023-10-28 16:48
E006892,U001848,page_view,/pricing,02/22/2025 08:01,DESKTOP,,iOS,unknown,TRUE,2025-02-22 8:01
E003821,U002516,export,,05/30/2023 06:16,DESKTOP,Safari,macOS,unknown,0,2023-05-30 6:16
E007290,U001032,doc_delete,,2024-08-17,DESKTOP,Brave,Android,unknown,TRUE,2024-08-17 10:18
E000368,U000305,comment,,07/18/2024 05:53,mobile,,Android,,TRUE,2024-07-18 5:53
E002435,U002216,doc_create,,01/25/2024 06:49,tablet,,macOS,unknown,FALSE,2024-01-25 6:49
E001056,u001409,doc_delete,,2025-05-26 20:29,tablet,Firefox,Linux,unknown,0,2025-05-26 20:29
E004537,u000986,export,,2023-08-06,DESKTOP,Edge,macOS,,TRUE,2023-08-06 14:57
E000896,U002534,login,/search,10/09/2023 10:19,,Safari,Linux,unknown,1,2023-10-09 10:19
E005402,U001495,share,,,mobile,Firefox,Windows,611,,2025-04-14 22:45
E001882,U000036,integration_error,,2024-06-11,,,Android,unknown,,2024-06-11 16:40
E002754,U000029,doc_edit,,05/28/2025 15:19,DESKTOP,Brave,,,FALSE,2025-05-28 15:19
E006797,U000046,AI_SEARCH,,,tablet,,,unknown,,2024-02-19 7:53
E001835,USR-002485,doc_delete,,2024-12-26,,Safari,,,,2024-12-26 7:18
E002334,U001348,integration_error,,2024-11-01 11:14,mobile,Chrome,,unknown,,2024-11-01 11:14
E007494,u000435,logout,/integrations,2024-10-09,,Brave,Windows,unknown,FALSE,2024-10-09 16:05
E008104,U001012,export,,2023-12-04,,,Windows,670,TRUE,2023-12-04 4:40
E005126,U000549,search,,2023-07-27 23:31,mobile,,macOS,,1,2023-07-27 23:31
E004635,U001315,share,,09/12/2023 23:56,desktop,,iOS,1319,1,2023-09-12 23:56
E005549,U001018,doc_create,,0000-00-00 00:00:00,mobile,,,946,FALSE,2023-03-16 22:56
E003467,U000238,doc_delete,,2023-04-03,desktop,Safari,Android,,FALSE,2023-04-03 2:13
E008984,U001797,login,/admin,2024-02-17 15:43,mobile,,iOS,,TRUE,2024-02-17 15:43
E004339,U002292,doc_delete,,,,Firefox,macOS,764,0,2023-05-13 9:24
e005580,U002116,doc_edit,,03/16/2024 16:41,desktop,,,1453,TRUE,2024-03-16 16:41
E007435,U001265,doc_delete,,2024-12-13 2:06,mobile,,macOS,213,0,2024-12-13 2:06
E003214,U001667,login,/search,2024-07-04 20:56,DESKTOP,Edge,Linux,,FALSE,2024-07-04 20:56
E004234,U002442,page_view,/search,2024-02-28 12:10,,Chrome,Windows,unknown,0,2024-02-28 12:10
E008248,U000867,share,,10/28/2023 00:57,,,Windows,,,2023-10-28 0:57
E006627,U000237,integration_error,,2023-02-25,DESKTOP,Brave,macOS,711,TRUE,2023-02-25 10:09
E003808,U001560,search,,2024-05-11,desktop,Brave,Windows,20,,2024-05-11 4:19
E004438,USR-000929,share,,2023-04-09,DESKTOP,,macOS,unknown,,2023-04-09 4:12
E007006,U001801,comment,,06/30/2024 01:41,desktop,Firefox,Windows,,,2024-06-30 1:41
E008119,U001705,doc_delete,,2025-06-16 4:24,tablet,,Windows,400,1,2025-06-16 4:24
e008375,U002358,integration_error,,2024-11-19 23:03,,Safari,,,TRUE,2024-11-19 23:03
E001623,U000028,comment,,2024-04-20 0:25,tablet,Safari,,,TRUE,2024-04-20 0:25
 E004617,U000348,doc_create,,2023-01-22,,Edge,Windows,,,2023-01-22 4:26
E002846,U001008,share,,,DESKTOP,,,,,2024-03-16 14:20
E001008,U000329,search,,10/28/2023 18:03,tablet,Edge,Android,,,2023-10-28 18:03
E001760,U001837,integration_error,,06/25/2024 13:14,tablet,Brave,iOS,,0,2024-06-25 13:14
E007843,U000658,doc_delete,,10/10/2024 15:00,DESKTOP,Firefox,macOS,1764,1,2024-10-10 15:00
E005143,U000799,share,,2024-01-18 20:57,,,Linux,unknown,FALSE,2024-01-18 20:57
E000726,U000284,comment,,2023-09-11,DESKTOP,Chrome,Android,1331,TRUE,2023-09-11 16:06
E000954,U001395,login,/integrations,0000-00-00 00:00:00,desktop,,,,FALSE,2023-03-02 15:43
E008712,U001675,integration_connect,,,tablet,,,,,2024-01-26 1:36
E003069,U000542,search,,12/11/2024 03:16,,Safari,Android,,TRUE,2024-12-11 3:16
E004129,U002237,export,,,mobile,Edge,Linux,991,0,2024-05-21 12:23
E002905,U000949,AI_SEARCH,,2023-02-21 17:56,tablet,,iOS,,FALSE,2023-02-21 17:56
E005439,U000370,comment,,2023-10-26 6:39,,Edge,macOS,604,TRUE,2023-10-26 6:39
 E003235,USR-000965,doc_delete,,2023-05-09 15:46,,Chrome,Linux,1797,,2023-05-09 15:46
 E001487,U002291,doc_delete,,2024-03-06,DESKTOP,Chrome,macOS,829,0,2024-03-06 19:34
E001915,U000837,page_view,/billing,2023-04-16 20:30,mobile,,Linux,1707,FALSE,2023-04-16 20:30
 E001039,U000666,ai_search,,2024-10-11 22:23,mobile,Chrome,,1199,TRUE,2024-10-11 22:23
E003841,U000144,logout,/onboarding,2023-03-25,DESKTOP,Chrome,iOS,,TRUE,2023-03-25 9:38
E006182,U002232,page_view,/admin,2024-02-06 3:31,,,Linux,unknown,TRUE,2024-02-06 3:31
E006824,U001315,ai_search,,06/17/2025 02:24,mobile,,Android,unknown,TRUE,2025-06-17 2:24
E005357,U002384,logout,/admin,0000-00-00 00:00:00,DESKTOP,Edge,Windows,unknown,0,2023-06-04 11:17
E006814,U000753,share,,,tablet,Safari,Linux,unknown,,2024-09-18 22:15
E005497,U000733,doc_edit,,0000-00-00 00:00:00,desktop,Safari,Android,unknown,FALSE,2023-05-11 3:00
E003607,U001191,page_view,/search,2024-05-10 21:20,,Safari,Android,unknown,TRUE,2024-05-10 21:20
E008454,U000835,integration_connect,,,desktop,Safari,Windows,,TRUE,2023-05-19 3:41
E007343,U002162,search,,01/12/2024 14:53,tablet,,iOS,unknown,TRUE,2024-01-12 14:53
E003755,U000116,export,,,desktop,Edge,Linux,,,2023-04-21 19:34
E006378,U001735,login,/pricing,06/20/2024 23:34,tablet,Safari,,1474,FALSE,2024-06-20 23:34
E004418,U001620,ai_search,,2023-10-30,tablet,Chrome,,unknown,FALSE,2023-10-30 0:58
E004354,U002553,ai_search,,2023-09-16,,Safari,iOS,unknown,TRUE,2023-09-16 2:20
E002414,U001763,login,/integrations,2023-08-20 14:11,mobile,Chrome,iOS,,,2023-08-20 14:11
E005985,U000838,search,,2023-08-24 23:59,tablet,Edge,iOS,,FALSE,2023-08-24 23:59
E008335,U001240,ai_search,,2023-12-15 19:39,tablet,Firefox,,950,TRUE,2023-12-15 19:39
E004479,U000615,search,,,DESKTOP,Safari,,93,FALSE,2023-02-09 18:27
E002257,U000016,search,,2023-03-25,tablet,Firefox,Linux,,TRUE,2023-03-25 15:11
E003523,U000940,logout,/integrations,07/04/2023 08:15,,,,194,FALSE,2023-07-04 8:15
E006797,u001125,integration_error,,2025-02-22 7:09,desktop,Safari,,,FALSE,2025-02-22 7:09
E003042,U000563,logout,/pricing,0000-00-00 00:00:00,mobile,Safari,iOS,unknown,0,2023-01-15 12:16
E005815,u001216,doc_edit,,06/17/2025 21:07,desktop,,,375,,2025-06-17 21:07
E003146,U000702,logout,/settings,,,,iOS,unknown,TRUE,2024-01-24 3:33
E007234,U001103,page_view,/pricing,02/26/2025 12:15,,,iOS,unknown,FALSE,2025-02-26 12:15
E005842, U000183 ,search,,09/12/2023 01:28,desktop,Safari,Windows,unknown,TRUE,2023-09-12 1:28
E000345,U001623,SEARCH,,2024-11-05 22:58,,,Android,,TRUE,2024-11-05 22:58
E003412,U002390,doc_create,,2023-07-15 9:04,,Edge,Windows,,0,2023-07-15 9:04
E006636,U000091,doc_create,,06/09/2023 15:46,DESKTOP,Brave,,1683,FALSE,2023-06-09 15:46
E008764,U001179,LOGOUT,/billing,2023-06-12 2:48,tablet,Edge,,,,2023-06-12 2:48
E008682,u001670,doc_create,,2024-04-04,desktop,,Windows,unknown,FALSE,2024-04-04 1:09
E002373,U001026,integration_connect,,2023-07-07 13:59,DESKTOP,Firefox,Linux,228,,2023-07-07 13:59
E002237,U001704,comment,,11/23/2023 22:40,DESKTOP,Brave,Android,,TRUE,2023-11-23 22:40
E006119,U000512,doc_edit,,2024-08-27,tablet,Edge,Linux,,1,2024-08-27 7:48
E008191,U000309,integration_connect,,,tablet,,,,,2023-05-31 11:53
E005215,U002497,doc_edit,,02/22/2023 21:51,desktop,Safari,Linux,,,2023-02-22 21:51
E007969,U000800,comment,,2023-10-22 9:02,,Edge,,unknown,TRUE,2023-10-22 9:02
E007938,U001009,login,/integrations,05/30/2024 14:52,,Firefox,Windows,unknown,TRUE,2024-05-30 14:52
E004416,U000733,integration_connect,,0000-00-00 00:00:00,desktop,Chrome,iOS,,FALSE,2024-11-14 20:51
E003640,U002269,login,/pricing,05/30/2025 10:28,,Firefox,Windows,,0,2025-05-30 10:28
E000752,U000780,search,,12/20/2024 10:32,mobile,,Android,,0,2024-12-20 10:32
E000514,U001710,integration_error,,2024-02-23 3:35,,Edge,Linux,unknown,TRUE,2024-02-23 3:35
E001393, USR-000914 ,doc_delete,,2023-03-02,,Firefox,Android,547,FALSE,2023-03-02 19:55
E004055,U000164,login,/admin,2023-02-05,tablet,,,,FALSE,2023-02-05 22:10
E007155,U001415,page_view,/billing,07/01/2023 05:27,,,,unknown,TRUE,2023-07-01 5:27
E006326,U000217,doc_create,,2024-06-21 6:02,DESKTOP,Brave,iOS,unknown,TRUE,2024-06-21 6:02
E005884,U002590,export,,2024-11-14 23:47,,Chrome,,unknown,1,2024-11-14 23:47
E003185,U000165,export,,2025-02-05,,Edge,iOS,,0,2025-02-05 10:21
E007504,USR-000024,doc_delete,,09/18/2023 22:10,,,iOS,unknown,,2023-09-18 22:10
E005734,U001669,integration_connect,,09/19/2023 02:25,mobile,Safari,macOS,,0,2023-09-19 2:25
E006204,U002216,integration_connect,,12/25/2024 02:09,DESKTOP,Edge,macOS,,,2024-12-25 2:09
E002345,U001734,doc_delete,,2023-06-14 9:06,tablet,Chrome,Android,unknown,TRUE,2023-06-14 9:06
E003622,U001857,ai_search,,2024-09-17,,Chrome,Windows,,FALSE,2024-09-17 22:33
E000029,U000660,integration_error,,2023-12-30 11:43,,Safari,Linux,,,2023-12-30 11:43
E006602,U000045,integration_connect,,04/30/2023 00:10,desktop,Chrome,,508,TRUE,2023-04-30 0:10
E008603,U001327,doc_delete,,2025-01-24 5:28,,,Android,,FALSE,2025-01-24 5:28
E006307,U001030,share,,,tablet,,Windows,,,2023-06-15 12:37
E000821,U001029,integration_connect,,11/17/2024 05:24,,Edge,,unknown,TRUE,2024-11-17 5:24
E006979,U000990,doc_delete,,2023-10-22 20:56,tablet,,,,TRUE,2023-10-22 20:56
E006881,U000588,comment,,08/03/2024 11:42,,,Windows,,TRUE,2024-08-03 11:42
E003037,U000794,comment,,07/09/2023 12:25,,Chrome,Android,unknown,FALSE,2023-07-09 12:25
E002366,U000548,comment,,06/08/2023 11:13,,Firefox,Windows,,TRUE,2023-06-08 11:13
E001094,U001777,integration_connect,,2024-08-29,mobile,,,,FALSE,2024-08-29 2:14
E002185,U001235,share,,2023-11-06 3:05,desktop,,Linux,,FALSE,2023-11-06 3:05
E005467,U000777,comment,,2024-11-02 0:26,,Chrome,macOS,unknown,FALSE,2024-11-02 0:26
E003533,U001689,export,,08/17/2023 21:10,desktop,Firefox,Windows,unknown,0,2023-08-17 21:10
E006904,u000474,logout,/dashboard,2024-06-28 1:18,desktop,,Android,unknown,0,2024-06-28 1:18
E004204,U002277,doc_delete,,2024-07-24 5:49,,Safari,macOS,,TRUE,2024-07-24 5:49
E005176,U001800,page_view,/dashboard,05/04/2024 18:42,,,Windows,,FALSE,2024-05-04 18:42
E006807, USR-002344 ,integration_connect,,2025-03-18 7:35,,Brave,Linux,unknown,0,2025-03-18 7:35
E000761,U002277,search,,2024-05-17,,Edge,macOS,,TRUE,2024-05-17 10:56
E001704,U001234,share,,2023-09-19,DESKTOP,,Windows,,TRUE,2023-09-19 12:15
E003956,U000657,integration_connect,,,,Safari,Linux,,TRUE,2023-01-16 9:31
E000285,U002030,doc_create,,2023-09-23 12:13,desktop,Firefox,iOS,,FALSE,2023-09-23 12:13
E008338,U001639,search,,2024-03-05 1:16,mobile,Safari,,112,,2024-03-05 1:16
E004811,U000523,login,/help,,tablet,,,645,1,2025-02-21 16:13
E001405,u000762,export,,2024-08-24 2:47,tablet,Firefox,Android,796,0,2024-08-24 2:47
E001831,U002177,doc_delete,,05/04/2025 02:35,DESKTOP,Brave,Linux,1334,FALSE,2025-05-04 2:35
E000791,U000013,search,,2023-11-14,mobile,Chrome,Windows,,FALSE,2023-11-14 13:47
E006410,U001567,comment,,0000-00-00 00:00:00,desktop,Brave,iOS,unknown,TRUE,2024-03-28 2:47
E007152,U000608,export,,07/12/2024 18:15,desktop,,iOS,,,2024-07-12 18:15
E006573,U000307,export,,,mobile,Safari,,208,TRUE,2023-01-05 19:16
E006083,u000462,page_view,/admin,0000-00-00 00:00:00,,,,unknown,0,2024-11-11 17:21
E005702,U002171,share,,10/23/2024 08:17,DESKTOP,Edge,Android,,,2024-10-23 8:17
E008379,U001513,comment,,2024-03-25,desktop,Firefox,Windows,unknown,1,2024-03-25 12:37
E007613,U002421,doc_create,,08/01/2023 06:24,,Brave,Linux,761,0,2023-08-01 6:24
E000636,U000961,doc_create,,10/26/2023 00:00,mobile,,Linux,,TRUE,2023-10-26 0:00
E006887,U001096,ai_search,,2025-02-01,desktop,,iOS,unknown,FALSE,2025-02-01 8:18
E007925,U000068,doc_create,,01/24/2025 06:50,,Firefox,macOS,,,2025-01-24 6:50
E006238,U001526,ai_search,,2024-03-23,,Firefox,iOS,,,2024-03-23 17:52
E006060,U001436,ai_search,,2024-12-30,,Firefox,macOS,unknown,0,2024-12-30 1:34
E001456,u001827,login,/docs,01/26/2024 10:44,,Brave,Linux,518,FALSE,2024-01-26 10:44
E003786,U001199,search,,2024-10-15 18:06,,Chrome,,,0,2024-10-15 18:06
 E008979,U000506,integration_error,,,,Firefox,macOS,,1,2024-01-27 10:27
E004301,U001024,doc_edit,,06/02/2024 12:45,mobile,Edge,macOS,,FALSE,2024-06-02 12:45
E002940,U000140,login,/settings,06/06/2024 12:56,DESKTOP,Firefox,Windows,,,2024-06-06 12:56
E007991,USR-000927,page_view,/onboarding,2023-08-05,,Firefox,Linux,unknown,TRUE,2023-08-05 19:13
E004830,U001005,page_view,/admin,2023-04-15 8:33,mobile,,iOS,,,2023-04-15 8:33
E008533,U000990,page_view,/help,2025-02-24,,Chrome,Android,128,,2025-02-24 19:44
E001169, U001589 ,doc_delete,,,DESKTOP,Chrome,macOS,804,TRUE,2024-09-02 16:19
E002407,U000872,logout,/billing,06/21/2024 03:17,DESKTOP,Firefox,Windows,965,FALSE,2024-06-21 3:17
E005363,U002282,login,/onboarding,2023-12-13 23:59,DESKTOP,Edge,Windows,,TRUE,2023-12-13 23:59
E008328,U001533,integration_connect,,2024-06-25,tablet,Chrome,Linux,,FALSE,2024-06-25 23:39
E004440,U002234,export,,02/04/2023 16:00,desktop,Brave,macOS,,FALSE,2023-02-04 16:00
E001727,U001242,ai_search,,2023-01-02 0:07,,,,,,2023-01-02 0:07
E007083,U002403,login,/billing,0000-00-00 00:00:00,,,Android,,0,2023-11-27 9:41
E001840,U000054,doc_delete,,05/17/2025 21:12,,,Windows,,TRUE,2025-05-17 21:12
E001324,U000607,page_view,/admin,2024-04-09 2:32,desktop,Edge,iOS,,FALSE,2024-04-09 2:32
E008321,U001285,doc_delete,,2023-03-08,mobile,Firefox,,,1,2023-03-08 16:02
E000829,U000161,page_view,/onboarding,2023-08-04 0:52,desktop,Brave,iOS,,FALSE,2023-08-04 0:52
E004152,U001660,integration_error,,05/21/2024 02:25,desktop,,,unknown,TRUE,2024-05-21 2:25
E004916,U000722,ai_search,,2024-03-21 10:22,,Safari,iOS,,1,2024-03-21 10:22
E004977,U002547,search,,04/30/2025 09:40,,Chrome,Linux,unknown,TRUE,2025-04-30 9:40
E000225, U001724 ,ai_search,,2025-04-22,mobile,Edge,Linux,,FALSE,2025-04-22 7:26
E000623,U000103,integration_connect,,2023-03-13,,Brave,Windows,,,2023-03-13 10:09
e007571,U002217,login,/dashboard,2023-05-27 20:02,,,,,,2023-05-27 20:02
E008944, U001333 ,doc_delete,,,desktop,,iOS,unknown,TRUE,2023-11-09 22:15
E000389,U001686,search,,2023-06-04,tablet,,,unknown,TRUE,2023-06-04 14:20
E000075,U000141,share,,2023-05-30,DESKTOP,,Windows,1102,TRUE,2023-05-30 14:05
E007800,U002050,ai_search,,05/20/2023 06:23,,,macOS,1319,0,2023-05-20 6:23
E002231,U000525,export,,2024-03-27,tablet,Edge,iOS,,,2024-03-27 9:37
e008479,U000937,page_view,/search,2024-06-10 2:51,desktop,Firefox,,384,0,2024-06-10 2:51
E005186,U001976,integration_error,,2024-01-29,,Safari,Linux,,FALSE,2024-01-29 23:34
E001525,U002205,ai_search,,,,Edge,Linux,unknown,0,2023-08-20 4:43
E001578, U002344 ,page_view,/settings,04/24/2023 05:25,,Firefox,Android,,,2023-04-24 5:25
E004736,U002161,doc_create,,2024-02-07 0:49,,Edge,Windows,,TRUE,2024-02-07 0:49
E004193,U001526,search,,03/02/2023 21:19,mobile,Chrome,Linux,,FALSE,2023-03-02 21:19
E003874,U000340,doc_delete,,03/04/2023 13:04,DESKTOP,Brave,Android,599,1,2023-03-04 13:04
E004511,U001666,page_view,/billing,2023-12-04,desktop,Firefox,Linux,unknown,,2023-12-04 4:42
E007364,U000546,integration_error,,03/11/2025 11:41,DESKTOP,Safari,Android,171,,2025-03-11 11:41
E008094,U001004,integration_error,,07/09/2024 14:11,desktop,,iOS,,,2024-07-09 14:11
E003270,U002470,integration_connect,,,DESKTOP,Chrome,,unknown,TRUE,2025-02-04 20:47
E001516,U000071,login,/docs,01/13/2025 10:24,,Brave,,24,FALSE,2025-01-13 10:24
E003446,U000625,doc_edit,,2023-08-30,desktop,Brave,Windows,848,1,2023-08-30 18:58
E000716,U000113,DOC_DELETE,,04/21/2025 18:23,DESKTOP,Firefox,Windows,,,2025-04-21 18:23
E007059,U002382,doc_edit,,11/18/2024 18:24,tablet,Edge,Android,,TRUE,2024-11-18 18:24
E003153,U001588,doc_edit,,06/21/2023 20:29,,,Android,,1,2023-06-21 20:29
E006516,u001529,integration_connect,,06/19/2023 03:54,,Brave,,unknown,,2023-06-19 3:54
E000959,U001356,share,,01/14/2025 16:20,desktop,,Android,761,TRUE,2025-01-14 16:20
E000199,U001975,doc_delete,,,,Safari,,1717,FALSE,2024-03-03 23:11
E000266,U001710,comment,,12/12/2024 21:35,desktop,Firefox,Android,782,FALSE,2024-12-12 21:35
E003118,U002022,SEARCH,,2024-04-25,tablet,Safari,Linux,85,TRUE,2024-04-25 0:47
E007265,U000040,comment,,2024-01-24 13:19,DESKTOP,Brave,iOS,,,2024-01-24 13:19
E000667,U002036,export,,02/20/2025 17:06,DESKTOP,Safari,macOS,,FALSE,2025-02-20 17:06
E008116,U001157,ai_search,,2025-04-02 15:19,mobile,Chrome,,1214,TRUE,2025-04-02 15:19
E001520,U001132,search,,0000-00-00 00:00:00,,Edge,Android,unknown,FALSE,2024-08-10 10:39
E001303,u000522,doc_edit,,0000-00-00 00:00:00,tablet,Firefox,iOS,871,TRUE,2024-03-18 18:25
E005939,U001128,comment,,2023-04-17,mobile,,Linux,1661,FALSE,2023-04-17 12:27
E005594,U002082,integration_connect,,,tablet,,iOS,unknown,,2023-04-27 7:29
E003216,U002206,logout,/settings,08/18/2023 08:59,,,iOS,1725,1,2023-08-18 8:59
E007196,U002594,integration_connect,,2023-02-15 8:47,,,Android,,,2023-02-15 8:47
 E001452,u000173,search,,2025-03-31,,,,unknown,TRUE,2025-03-31 17:58
E008011,U000007,export,,11/21/2023 05:45,tablet,Chrome,Android,1521,0,2023-11-21 5:45
E002453,U000907,integration_error,,2023-08-06 13:56,DESKTOP,Brave,iOS,unknown,0,2023-08-06 13:56
E003278,u001691,doc_delete,,,desktop,,Android,710,FALSE,2024-03-03 1:44
E007089,U000123,comment,,2023-11-04,desktop,Firefox,,,TRUE,2023-11-04 18:57
E008460,U000719,integration_error,,2024-01-13 18:14,mobile,Safari,Windows,1758,TRUE,2024-01-13 18:14
E007275,U001769,integration_error,,2023-05-29,,Brave,Android,,0,2023-05-29 13:49
E002562,U001238,export,,03/12/2023 12:27,DESKTOP,Brave,Android,unknown,,2023-03-12 12:27
E001104,U000575,doc_edit,,2024-02-16,mobile,Edge,,unknown,0,2024-02-16 2:59
E004719,U000285,integration_connect,,2024-09-25 5:36,mobile,Chrome,Windows,,,2024-09-25 5:36
E006378,U000406,doc_delete,,2023-11-11,DESKTOP,,,unknown,,2023-11-11 9:09
E008521,U002351,integration_connect,,2025-01-23 5:54,,Edge,macOS,,,2025-01-23 5:54
E005170,U001123,doc_delete,,06/22/2024 13:18,DESKTOP,Safari,Linux,259,FALSE,2024-06-22 13:18
E006187,U001583,ai_search,,2024-08-17 7:11,tablet,Edge,,unknown,FALSE,2024-08-17 7:11
E008634,U001494,doc_create,,06/03/2025 04:16,desktop,,,,0,2025-06-03 4:16
E003944,U001383,doc_create,,11/12/2023 03:40,,,Linux,unknown,0,2023-11-12 3:40
E002696,U002090,integration_error,,07/01/2023 20:53,DESKTOP,Brave,Linux,unknown,FALSE,2023-07-01 20:53
E008672,U000122,ai_search,,08/02/2023 12:09,tablet,Safari,macOS,1737,1,2023-08-02 12:09
E003142, U000150 ,search,,0000-00-00 00:00:00,,,Android,,,2024-05-08 17:25
E001462,U000861,login,/onboarding,2024-03-24,,,iOS,,FALSE,2024-03-24 16:12
E001770,U000703,SEARCH,,03/23/2023 23:58,tablet,,iOS,,FALSE,2023-03-23 23:58
E001840,U001410,integration_error,,04/24/2024 01:12,desktop,Firefox,Linux,unknown,TRUE,2024-04-24 1:12
E007599,U001919,integration_connect,,2025-03-08,,Edge,iOS,904,,2025-03-08 12:08
E003571,U001354,comment,,0000-00-00 00:00:00,tablet,Brave,,1785,,2024-06-06 18:09
E007221,U000332,ai_search,,04/17/2025 15:42,desktop,,,,,2025-04-17 15:42
E004326,u000867,comment,,2024-10-28 17:59,,,iOS,849,FALSE,2024-10-28 17:59
e003224,U001511,share,,06/18/2024 18:16,mobile,Chrome,Linux,,,2024-06-18 18:16
E005885,U000412,doc_edit,,,,Chrome,,233,TRUE,2023-10-12 11:05
E000004,U002303,doc_create,,2024-04-02 15:01,mobile,Brave,Android,,1,2024-04-02 15:01
E006365,U000232,export,,2023-08-16,DESKTOP,Chrome,Linux,732,,2023-08-16 11:37
E004205,U001677,ai_search,,2024-05-17,,Edge,,unknown,,2024-05-17 14:01
e001500,U000913,comment,,12/19/2023 00:38,tablet,Chrome,macOS,unknown,0,2023-12-19 0:38
E001788,U002377,doc_delete,,2024-08-19,mobile,Firefox,,,,2024-08-19 18:19
E000894,U001015,comment,,2025-05-26,,Brave,,1394,FALSE,2025-05-26 18:39
E000405,U002389,login,/admin,,desktop,Firefox,iOS,unknown,1,2024-03-19 22:48
E006476,U001215,integration_connect,,2023-01-01 10:40,desktop,Edge,macOS,,FALSE,2023-01-01 10:40
E001304,U001433,integration_connect,,2024-06-15 20:15,DESKTOP,Brave,,,0,2024-06-15 20:15
E002803,U000736,logout,/settings,2024-11-19 13:25,DESKTOP,Brave,,unknown,1,2024-11-19 13:25
E002048,U000975,SEARCH,,02/08/2024 03:42,DESKTOP,,,,TRUE,2024-02-08 3:42
E002918,U002040,page_view,/admin,2023-07-24 12:09,,Chrome,,1273,1,2023-07-24 12:09
E006420,U001389,page_view,/admin,01/22/2024 08:22,desktop,Firefox,Windows,,1,2024-01-22 8:22
 E004022,USR-002510,export,,2024-07-01 22:48,tablet,,Android,833,,2024-07-01 22:48
E004243,U000302,login,/billing,2025-01-10,mobile,Firefox,Linux,unknown,FALSE,2025-01-10 12:05
E002925, U000403 ,doc_edit,,0000-00-00 00:00:00,mobile,Chrome,macOS,unknown,TRUE,2025-05-11 4:46
E002098,U001285,page_view,/dashboard,03/08/2024 02:56,tablet,Edge,Windows,unknown,,2024-03-08 2:56
E000204,u000198,export,,,mobile,Firefox,,149,,2024-08-28 0:19
E006599,U000197,doc_edit,,2024-10-18 16:41,,,,,0,2024-10-18 16:41
E002233,U000791,doc_create,,2024-06-23 10:18,mobile,Edge,,,0,2024-06-23 10:18
E000207,U000119,integration_error,,0000-00-00 00:00:00,,Brave,iOS,unknown,1,2023-02-22 7:34
E002498,U000208,integration_error,,0000-00-00 00:00:00,,Chrome,,,FALSE,2025-04-07 23:45
E004888,U002336,doc_create,,2023-06-15,tablet,Edge,Linux,1510,FALSE,2023-06-15 11:42
E007666,U001349,doc_create,,,,Edge,macOS,55,FALSE,2025-04-05 17:23
E004737,U001253,comment,,09/18/2024 12:19,tablet,,,,FALSE,2024-09-18 12:19
E004729,U002393,integration_error,,01/10/2025 01:41,desktop,,iOS,unknown,FALSE,2025-01-10 1:41
E007040,U002074,search,,02/16/2025 14:27,tablet,Edge,Android,724,TRUE,2025-02-16 14:27
e008166,U001397,doc_edit,,2023-05-08,DESKTOP,Chrome,Android,unknown,TRUE,2023-05-08 22:19
E003775,U001938,login,/admin,12/29/2024 20:34,tablet,,Android,unknown,FALSE,2024-12-29 20:34
E001029,U001143,export,,04/03/2024 13:20,mobile,Brave,Linux,unknown,FALSE,2024-04-03 13:20
E007093,U002357,comment,,,,Edge,Linux,1744,TRUE,2025-05-15 21:19
e001969,U001256,ai_search,,06/18/2024 11:43,desktop,Edge,Android,,1,2024-06-18 11:43
E004118,U000863,doc_edit,,01/17/2024 16:34,,Firefox,Android,,0,2024-01-17 16:34
E003029,U001814,ai_search,,,mobile,Safari,Windows,,TRUE,2023-02-14 7:51
E003938,U002208,page_view,/pricing,03/09/2023 06:28,tablet,Brave,Windows,595,FALSE,2023-03-09 6:28
E003877,U002091,integration_error,,2023-08-26,mobile,Safari,iOS,unknown,1,2023-08-26 18:55
E008965,U000494,login,/docs,06/15/2023 06:32,mobile,Brave,macOS,,,2023-06-15 6:32
E002858,U000007,login,/onboarding,2025-01-24 0:01,,,macOS,,FALSE,2025-01-24 0:01
E001478,U001905,doc_delete,,2025-01-14,desktop,Firefox,Android,unknown,FALSE,2025-01-14 17:31
E002711,U001657,integration_error,,2024-12-23,,,Linux,unknown,TRUE,2024-12-23 8:00
E003181,U001611,comment,,01/20/2025 00:00,,,Android,,TRUE,2025-01-20 0:00
E005472,U001690,logout,/settings,09/25/2023 17:36,,,iOS,,FALSE,2023-09-25 17:36
E008860,U002214,search,,2024-11-26 16:43,tablet,,,,,2024-11-26 16:43
E004754,U001421,page_view,/docs,2025-01-08 6:50,mobile,,,,,2025-01-08 6:50
E001829,U002220,doc_create,,,mobile,,Windows,,FALSE,2023-12-14 18:37
E008533,U001856,share,,,,,macOS,292,FALSE,2025-01-11 2:47
E005949,U001726,doc_delete,,01/27/2023 19:56,desktop,Safari,Windows,,0,2023-01-27 19:56
E007664,U002327,doc_edit,,2025-05-14,,Safari,,unknown,FALSE,2025-05-14 7:29
E004219,U000110,doc_delete,,2025-02-17,DESKTOP,Edge,macOS,,0,2025-02-17 4:30
E003601,U000924,doc_delete,,2023-03-26,,Edge,macOS,,1,2023-03-26 22:13
E003342,U001337,comment,,11/13/2024 07:22,,Edge,iOS,,0,2024-11-13 7:22
E005355,U000949,ai_search,,,DESKTOP,,Linux,1634,,2025-01-06 23:56
E003263,U001653,integration_connect,,2024-10-17 14:56,,Edge,Windows,,,2024-10-17 14:56
E005638,U000471,search,,2023-04-30,mobile,Edge,Windows,,TRUE,2023-04-30 8:17
E004627,U000262,login,/dashboard,03/23/2024 10:47,,,,,0,2024-03-23 10:47
E008102,U000478,integration_error,,,mobile,Brave,Android,240,0,2025-01-17 9:38
E001058,U001072,doc_edit,,,,Edge,,1059,,2025-03-26 15:44
E003324,U000464,logout,/pricing,09/11/2023 21:21,,Firefox,,1018,,2023-09-11 21:21
E007025, U001784 ,export,,08/25/2024 21:32,mobile,Chrome,Android,,FALSE,2024-08-25 21:32
E001720,U000914,export,,2024-04-04,mobile,Chrome,,unknown,TRUE,2024-04-04 17:56
E007697,U002113,doc_create,,2025-03-01 2:58,DESKTOP,Brave,,unknown,,2025-03-01 2:58
E000326,U002417,share,,2024-04-12 22:51,,Edge,Android,unknown,FALSE,2024-04-12 22:51
E007050,U000461,search,,03/12/2024 12:59,DESKTOP,Edge,,,1,2024-03-12 12:59
E003146,U001423,doc_edit,,2024-04-22,desktop,Brave,macOS,unknown,TRUE,2024-04-22 4:07
E001296,U000977,page_view,/integrations,01/06/2023 18:49,desktop,Firefox,macOS,,,2023-01-06 18:49
E004721,U000477,login,/admin,02/22/2024 15:38,,Edge,iOS,,FALSE,2024-02-22 15:38
E002204,U001095,share,,03/02/2025 07:20,,,Windows,760,TRUE,2025-03-02 7:20
e004797,U001709,search,,0000-00-00 00:00:00,desktop,Edge,Windows,1157,,2024-03-23 2:10
E003159,U001938,ai_search,,10/17/2024 20:07,desktop,,,,TRUE,2024-10-17 20:07
E002706,U001675,export,,06/15/2023 01:39,,Brave,Windows,unknown,FALSE,2023-06-15 1:39
E007736,U002572,page_view,/docs,12/15/2023 08:56,tablet,Edge,iOS,1390,,2023-12-15 8:56
E005019,U000392,login,/billing,02/04/2023 18:39,mobile,Brave,Android,839,1,2023-02-04 18:39
E001411,U000554,integration_connect,,01/25/2025 11:18,,Safari,,unknown,0,2025-01-25 11:18
E000255,U001511,doc_edit,,2024-08-09,mobile,Safari,iOS,,,2024-08-09 19:08
E005261,U000333,logout,/pricing,04/13/2025 02:04,mobile,Firefox,Windows,,TRUE,2025-04-13 2:04
E006714, U000578 ,share,,,tablet,Brave,iOS,unknown,TRUE,2024-09-03 17:31
E006017,U000498,logout,/billing,2024-02-11,desktop,Chrome,Linux,198,FALSE,2024-02-11 18:40
E008153,u002047,doc_edit,,08/16/2024 20:54,desktop,,iOS,unknown,,2024-08-16 20:54
E008301,U002553,share,,2025-02-07 4:49,mobile,Brave,iOS,,0,2025-02-07 4:49
E001968,U000550,export,,10/19/2024 08:55,desktop,Chrome,Android,unknown,FALSE,2024-10-19 8:55
E001156,U002167,search,,2023-03-20 12:02,mobile,Chrome,Windows,331,FALSE,2023-03-20 12:02
E005943,U001134,integration_connect,,2024-10-06,desktop,,Windows,1132,TRUE,2024-10-06 14:36
E003816, U000620 ,search,,06/06/2023 18:30,,Edge,,unknown,TRUE,2023-06-06 18:30
E007351,U001227,doc_create,,2023-08-13 18:46,DESKTOP,Brave,Windows,,0,2023-08-13 18:46
E008457,U002239,login,/pricing,2023-02-24,DESKTOP,Safari,Linux,,FALSE,2023-02-24 18:57
E001450,U000388,ai_search,,02/08/2023 14:33,,,macOS,,TRUE,2023-02-08 14:33
E005663,U002269,ai_search,,0000-00-00 00:00:00,DESKTOP,Chrome,,1493,0,2025-06-02 6:06
E000305,u002490,logout,/dashboard,0000-00-00 00:00:00,DESKTOP,,Linux,,TRUE,2024-10-15 1:06
E001815,U001500,doc_create,,2024-10-01,mobile,Brave,Linux,,1,2024-10-01 13:27
E008521,U001633,comment,,2023-02-16 2:12,desktop,Brave,,,,2023-02-16 2:12
E003413,U002486,doc_create,,03/02/2024 03:18,DESKTOP,Firefox,,,1,2024-03-02 3:18
E003566,U000243,comment,,03/08/2023 23:41,,Safari,macOS,unknown,,2023-03-08 23:41
E004000,U001538,search,,0000-00-00 00:00:00,,Firefox,Android,,1,2023-03-27 12:32
E003496,U001530,doc_create,,2023-08-03,mobile,Safari,iOS,,FALSE,2023-08-03 13:23
E005484,U000232,export,,0000-00-00 00:00:00,,,macOS,,0,2025-06-10 0:19
E005056,U001925,doc_edit,,2024-05-18,tablet,Edge,iOS,unknown,,2024-05-18 14:54
E004394,U001482,page_view,/settings,,,,,1253,FALSE,2024-03-05 21:57
E007579,U002118,share,,2023-04-12 8:59,DESKTOP,,Linux,,TRUE,2023-04-12 8:59
E007082,U001768,logout,/pricing,08/27/2024 01:05,,Safari,iOS,1095,1,2024-08-27 1:05
E000020,U001451,doc_create,,2025-04-04,DESKTOP,Safari,macOS,830,FALSE,2025-04-04 18:19
E004033, U000331 ,doc_delete,,0000-00-00 00:00:00,desktop,,Windows,,FALSE,2025-06-05 5:14
E004034,U002029,doc_edit,,2025-03-09,DESKTOP,,macOS,unknown,FALSE,2025-03-09 5:01
E007276,U000531,login,/admin,2023-06-04,desktop,Brave,Android,unknown,FALSE,2023-06-04 9:14
E001045,U001392,doc_edit,,2023-08-28,desktop,Brave,Linux,1253,FALSE,2023-08-28 20:48
E006368, U000467 ,export,,2025-01-08 11:27,tablet,Firefox,,,FALSE,2025-01-08 11:27
E005402,U001660,integration_connect,,2025-01-07 23:49,mobile,Chrome,macOS,,,2025-01-07 23:49
E008003,U001344,integration_connect,,08/20/2024 06:37,,,,,TRUE,2024-08-20 6:37
E002189,U000697,doc_edit,,2025-05-09 23:45,mobile,Firefox,,,FALSE,2025-05-09 23:45
E004867,U002562,logout,/settings,2024-03-28 18:16,mobile,Brave,Windows,354,,2024-03-28 18:16
E008629,U001513,search,,06/13/2025 21:15,mobile,Edge,,,0,2025-06-13 21:15
E007072,U002078,page_view,/onboarding,03/15/2023 01:13,mobile,Safari,Android,,1,2023-03-15 1:13
E000787, U000258 ,doc_create,,12/08/2024 10:35,desktop,Brave,,unknown,FALSE,2024-12-08 10:35
E001660,U000169,doc_delete,,,,,,unknown,0,2025-05-13 20:00
E000064,U001011,doc_create,,2023-09-17 16:51,tablet,,,,TRUE,2023-09-17 16:51
E001081,U002132,login,/docs,07/21/2023 23:21,desktop,,Android,unknown,TRUE,2023-07-21 23:21
E003443,U001876,export,,12/18/2023 15:14,,,,,TRUE,2023-12-18 15:14
E002718,U000190,login,/settings,12/25/2023 18:37,,Edge,,648,FALSE,2023-12-25 18:37
E002755,U000941,doc_edit,,,DESKTOP,,,,TRUE,2024-10-09 22:54
E000125,U000096,doc_create,,09/08/2024 13:41,tablet,Firefox,,,,2024-09-08 13:41
E007919,U002126,integration_error,,2023-06-12,desktop,Edge,Linux,unknown,,2023-06-12 9:32
E007278,U002207,export,,11/06/2024 17:08,,,,895,FALSE,2024-11-06 17:08
E005381,U002387,DOC_EDIT,,05/05/2025 23:30,,Chrome,Windows,,TRUE,2025-05-05 23:30
E005096,U001599,search,,2024-07-05,,Brave,iOS,,,2024-07-05 13:04
E005181,U000180,ai_search,,08/31/2024 20:02,DESKTOP,,macOS,unknown,FALSE,2024-08-31 20:02
E006078,USR-000717,share,,07/29/2023 02:57,,,Linux,,,2023-07-29 2:57
E004132,U002093,login,/dashboard,2023-11-20,tablet,Edge,Android,unknown,TRUE,2023-11-20 6:21
E008161,U001839,doc_edit,,11/27/2023 03:20,desktop,Firefox,,unknown,TRUE,2023-11-27 3:20
E005981,U000508,LOGIN,/dashboard,09/26/2024 13:42,,,macOS,unknown,1,2024-09-26 13:42
E004203,U002221,doc_create,,2024-01-01,tablet,Firefox,Windows,unknown,0,2024-01-01 11:35
E005951,U001480,INTEGRATION_ERROR,,0000-00-00 00:00:00,,Safari,Linux,,FALSE,2023-08-27 9:26
E001399,U002315,doc_delete,,10/18/2023 21:38,,Safari,,590,,2023-10-18 21:38
E008702,USR-002498,doc_create,,09/15/2023 19:02,mobile,Safari,,,FALSE,2023-09-15 19:02
E000918,U001932,share,,,DESKTOP,,,435,,2023-12-07 22:17
E002386,U000195,doc_create,,,DESKTOP,Safari,Windows,,TRUE,2023-10-05 5:20
E003407,U001308,export,,2023-07-14,tablet,Edge,,,FALSE,2023-07-14 4:39
E000033,U001094,integration_error,,2023-08-31,DESKTOP,,,unknown,,2023-08-31 22:08
E003747,U001570,comment,,,,,,,0,2023-05-02 17:14
E002436, U000523 ,integration_error,,2025-05-30 3:06,,Brave,Linux,unknown,FALSE,2025-05-30 3:06
E005558,U002443,comment,,0000-00-00 00:00:00,desktop,,Android,unknown,,2025-04-17 1:16
E003581,U002329,integration_connect,,09/18/2024 11:56,desktop,,macOS,,TRUE,2024-09-18 11:56
E000255,U000475,search,,02/20/2024 10:26,mobile,Brave,iOS,unknown,1,2024-02-20 10:26
E005058,U001791,doc_delete,,,tablet,Chrome,Windows,unknown,1,2024-08-21 6:45
E001627,U000029,DOC_EDIT,,01/12/2024 22:58,desktop,Brave,macOS,1541,TRUE,2024-01-12 22:58
E007008,U002574,page_view,/admin,07/15/2023 16:57,mobile,Chrome,Linux,unknown,FALSE,2023-07-15 16:57
E007723,U000758,doc_create,,2023-08-21 21:56,tablet,,,,TRUE,2023-08-21 21:56
E000190,U000093,export,,,DESKTOP,,,,TRUE,2024-08-31 21:15
 e005091,U001237,comment,,2024-05-10 4:40,,Safari,,,0,2024-05-10 4:40
E008452, U001170 ,logout,/dashboard,06/03/2023 03:37,mobile,Firefox,,,,2023-06-03 3:37
E008853,U001956,doc_edit,,2024-03-17 13:25,desktop,Edge,Android,,FALSE,2024-03-17 13:25
E007996,USR-001369,doc_create,,2023-08-04,desktop,Safari,iOS,129,,2023-08-04 21:11
E002436,U002253,integration_connect,,04/14/2023 16:52,,Safari,macOS,,FALSE,2023-04-14 16:52
E006338,U000755,doc_edit,,2024-07-15 14:17,mobile,,Windows,unknown,0,2024-07-15 14:17
E008610,U000502,search,,2023-04-11 8:09,,,macOS,,0,2023-04-11 8:09
E008878,U000020,integration_connect,,,DESKTOP,Chrome,,,TRUE,2023-10-09 21:01
E007691,U001901,doc_edit,,02/01/2024 12:01,DESKTOP,Brave,Android,unknown,0,2024-02-01 12:01
E001253,U002582,ai_search,,07/28/2023 10:42,tablet,,Linux,unknown,1,2023-07-28 10:42
E006020,u001538,export,,,tablet,Brave,Windows,1401,,2023-11-06 15:02
E006298, U002165 ,doc_create,,,mobile,Chrome,,,TRUE,2024-08-25 21:30
E004262, U000184 ,doc_edit,,2023-11-26 5:22,tablet,Firefox,iOS,,FALSE,2023-11-26 5:22
E002872, U000077 ,login,/settings,0000-00-00 00:00:00,desktop,Edge,Linux,,,2024-05-05 15:33
 E004437,U000746,logout,/admin,10/28/2023 00:02,desktop,Firefox,,unknown,FALSE,2023-10-28 0:02
e008333,U000855,export,,2024-08-05,tablet,,Windows,,,2024-08-05 11:56
E008989,U001844,page_view,/settings,05/31/2023 00:02,mobile,,iOS,unknown,,2023-05-31 0:02
E002002,U000919,page_view,/admin,2023-04-17 20:44,,Firefox,,,FALSE,2023-04-17 20:44
E002427,U000831,ai_search,,01/09/2024 15:57,,,Linux,,TRUE,2024-01-09 15:57
E002630,U001549,doc_edit,,2024-02-21,mobile,Brave,Windows,,1,2024-02-21 14:21
E001576,U001615,login,/pricing,2025-03-18,desktop,Safari,,,TRUE,2025-03-18 14:56
E004295,U000252,doc_delete,,01/10/2024 11:29,tablet,,,unknown,0,2024-01-10 11:29
E008581,U002491,login,/billing,0000-00-00 00:00:00,DESKTOP,Chrome,Linux,,,2024-05-09 8:57
E005228,U000753,page_view,/settings,06/22/2024 19:04,mobile,Firefox,macOS,unknown,FALSE,2024-06-22 19:04
E003160, U000433 ,search,,,DESKTOP,Brave,,,1,2023-03-16 15:47
E004946,u002583,integration_error,,2025-05-21 15:20,DESKTOP,Edge,iOS,,TRUE,2025-05-21 15:20
E003954,U001780,page_view,/admin,2023-12-10 6:25,tablet,Safari,,,,2023-12-10 6:25
E004011,U000829,export,,01/13/2024 02:59,desktop,,macOS,unknown,TRUE,2024-01-13 2:59
E005688,U001343,share,,,mobile,Brave,Android,unknown,,2024-03-28 12:00
E002990,U001808,doc_edit,,2025-01-16 3:35,tablet,,,,,2025-01-16 3:35
E003930,U001603,login,/integrations,2025-05-30,,Brave,Linux,,TRUE,2025-05-30 18:09
E002734,U000098,doc_edit,,0000-00-00 00:00:00,tablet,,macOS,,1,2024-02-19 19:02
E001918,U001797,logout,/dashboard,2024-02-27 10:56,,Chrome,,,,2024-02-27 10:56
E002210,U001129,integration_connect,,2025-05-29 23:00,,Firefox,Windows,319,1,2025-05-29 23:00
E000327,U001360,share,,2025-06-18 9:29,,Safari,macOS,unknown,,2025-06-18 9:29
E007042,U000913,doc_edit,,,DESKTOP,Firefox,Windows,,FALSE,2023-08-10 17:57
E003739, U000170 ,share,,07/27/2024 09:44,desktop,,,,FALSE,2024-07-27 9:44
E007449,U001997,doc_delete,,2023-04-30 6:31,DESKTOP,,iOS,640,0,2023-04-30 6:31
E000357,U002033,ai_search,,07/25/2024 11:21,mobile,Safari,Android,,,2024-07-25 11:21
 E005417,U002409,doc_edit,,2024-04-01 3:12,mobile,Firefox,Linux,,TRUE,2024-04-01 3:12
E005586,U001735,integration_connect,,03/08/2025 01:24,mobile,,Linux,926,,2025-03-08 1:24
E004271,U001683,export,,08/05/2023 02:44,mobile,Firefox,,unknown,0,2023-08-05 2:44
E002088,U001766,integration_connect,,06/15/2025 14:47,mobile,Safari,iOS,,,2025-06-15 14:47
E006402,USR-002014,doc_create,,06/26/2024 09:08,mobile,,Android,,FALSE,2024-06-26 9:08
E005338,U000890,doc_delete,,,desktop,Safari,Android,,TRUE,2023-12-04 9:54
E005369, u000346 ,doc_edit,,01/05/2023 16:36,DESKTOP,Edge,macOS,,FALSE,2023-01-05 16:36
E004828,U001997,share,,05/30/2023 05:06,DESKTOP,Chrome,macOS,1246,FALSE,2023-05-30 5:06
E004479,U000599,share,,05/23/2023 16:52,desktop,Chrome,Linux,,0,2023-05-23 16:52
E003062,U000256,integration_connect,,,,Brave,,,TRUE,2025-01-20 18:42
E008449,USR-000952,doc_edit,,11/10/2024 16:42,desktop,Edge,,unknown,TRUE,2024-11-10 16:42
E002279,U001757,doc_create,,2023-03-29,DESKTOP,,iOS,,0,2023-03-29 20:53
E003637,U001667,share,,05/21/2025 05:26,DESKTOP,Safari,macOS,1390,FALSE,2025-05-21 5:26
E008693,U000718,search,,2023-11-18 4:45,tablet,Chrome,Android,unknown,FALSE,2023-11-18 4:45
E004857,U002408,comment,,2024-02-09 0:49,DESKTOP,,Linux,,FALSE,2024-02-09 0:49
e004731,U002320,page_view,/settings,2023-01-17 5:39,mobile,Firefox,,unknown,FALSE,2023-01-17 5:39
E006631,u001524,search,,2024-01-01 16:23,DESKTOP,Chrome,iOS,unknown,TRUE,2024-01-01 16:23
E008798,U001355,comment,,08/11/2024 19:58,tablet,Brave,Android,,,2024-08-11 19:58
E005494,U000495,comment,,11/22/2024 00:46,desktop,,Linux,,FALSE,2024-11-22 0:46
E002793,U002137,search,,0000-00-00 00:00:00,desktop,,macOS,,TRUE,2023-11-06 7:07
E001084,U000163,doc_create,,02/21/2023 08:42,mobile,Firefox,,,FALSE,2023-02-21 8:42
E006156,U002510,comment,,06/17/2025 19:11,DESKTOP,Chrome,Linux,,0,2025-06-17 19:11
E000419,U000007,login,/docs,2025-02-05 4:37,,Firefox,Linux,unknown,FALSE,2025-02-05 4:37
E000865,U001237,doc_delete,,2023-08-13 18:55,DESKTOP,,Windows,1412,,2023-08-13 18:55
E003174,U002072,ai_search,,2024-04-19,DESKTOP,Safari,Linux,,1,2024-04-19 1:48
E003968,U001646,logout,/dashboard,03/26/2025 22:34,,Safari,,unknown,FALSE,2025-03-26 22:34
E006537,U000524,doc_edit,,08/13/2024 06:05,desktop,,,1269,1,2024-08-13 6:05
E007156,USR-002137,doc_create,,2024-02-10 10:55,tablet,,Android,,TRUE,2024-02-10 10:55
E005188,U000240,page_view,/help,2025-01-26,,Chrome,iOS,211,,2025-01-26 17:54
E007360,U000979,search,,2023-09-27 21:58,desktop,,iOS,300,0,2023-09-27 21:58
E005203,U001293,comment,,2023-06-21,tablet,Chrome,macOS,569,0,2023-06-21 22:51
E006628,U002426,doc_create,,08/18/2023 12:17,,,macOS,694,FALSE,2023-08-18 12:17
E006600,U002194,page_view,/billing,2025-03-07,DESKTOP,Edge,Linux,352,FALSE,2025-03-07 3:26
E002173,U000689,doc_create,,04/25/2023 05:10,,,,,TRUE,2023-04-25 5:10
E004476,U001554,search,,2024-04-21 6:45,tablet,,,,,2024-04-21 6:45
E004108,U001169,export,,2024-10-25,,,Windows,,FALSE,2024-10-25 22:52
E008476,U001206,doc_create,,2023-02-07 22:38,mobile,Edge,Android,,1,2023-02-07 22:38
E000411,U001717,export,,2025-03-24,,Brave,,,0,2025-03-24 8:37
E003896,U002501,doc_edit,,02/27/2023 16:25,mobile,Chrome,Windows,unknown,,2023-02-27 16:25
E003140,U001347,share,,2025-05-13,DESKTOP,,macOS,unknown,0,2025-05-13 21:53
E007917,U001757,integration_connect,,0000-00-00 00:00:00,,,Linux,1728,,2024-05-20 20:17
E003550,U000099,doc_delete,,07/04/2024 04:27,,Firefox,,,0,2024-07-04 4:27
E008699,U001100,doc_edit,,,,Brave,Windows,unknown,,2024-04-03 20:13
E007436, U000659 ,doc_create,,2024-04-25,DESKTOP,,,,TRUE,2024-04-25 22:02
e000481,U000289,share,,0000-00-00 00:00:00,mobile,,Android,unknown,0,2023-05-19 19:02
E006195,U001162,integration_connect,,2024-03-22 23:46,,Chrome,Windows,,FALSE,2024-03-22 23:46
E001291,U001208,integration_error,,,,,iOS,unknown,TRUE,2024-07-30 13:52
E001214,U001106,doc_create,,2024-09-02,,Edge,,,,2024-09-02 8:09
E004694,U001109,doc_edit,,02/17/2023 03:47,DESKTOP,Safari,iOS,,FALSE,2023-02-17 3:47
E007629,U001865,integration_error,,2024-07-05,desktop,,macOS,,0,2024-07-05 8:32
E000169,U001929,doc_delete,,0000-00-00 00:00:00,mobile,Firefox,Linux,,TRUE,2023-04-23 20:27
E004983,U001681,share,,10/18/2023 19:32,tablet,Firefox,iOS,unknown,1,2023-10-18 19:32
E000674,U000339,page_view,/admin,2025-02-06,tablet,Chrome,macOS,,0,2025-02-06 22:11
E000071,U002491,integration_connect,,2023-05-25,mobile,Firefox,iOS,unknown,0,2023-05-25 15:02
E002265,U000981,DOC_DELETE,,2023-11-11,tablet,,,,1,2023-11-11 21:58
E004638,U001601,COMMENT,,2024-10-05 0:57,DESKTOP,Edge,,,FALSE,2024-10-05 0:57
 E000816,U002244,comment,,0000-00-00 00:00:00,,,macOS,641,,2025-01-19 13:24
E003984,U002479,search,,,,Brave,,749,,2024-01-26 10:51
E001008,U001937,search,,,,Firefox,iOS,,,2024-03-06 3:12
E000809,U001526,doc_edit,,,tablet,Firefox,Android,933,TRUE,2024-04-09 10:13
E003484,U002094,export,,2023-07-12,,Firefox,macOS,unknown,0,2023-07-12 12:07
E007494,U000097,integration_error,,2023-01-24,mobile,,,unknown,FALSE,2023-01-24 23:42
E005906,U000359,doc_delete,,2023-07-06 18:44,tablet,Brave,Android,1010,FALSE,2023-07-06 18:44
E001390, u000056 ,ai_search,,2025-01-10,desktop,Chrome,Windows,unknown,,2025-01-10 18:26
E004989,u001220,doc_delete,,2024-09-25,DESKTOP,Safari,,unknown,,2024-09-25 16:43
E000773,U000962,doc_create,,2025-05-05,desktop,Edge,,,0,2025-05-05 20:09
 E005795,U002496,doc_edit,,,tablet,Chrome,Windows,unknown,FALSE,2025-04-02 21:57
E007986,U000695,integration_error,,2024-06-15 9:06,DESKTOP,Edge,macOS,unknown,,2024-06-15 9:06
E005909,U001928,logout,/docs,2023-08-31 16:10,DESKTOP,Brave,,,TRUE,2023-08-31 16:10
E001097,U000553,export,,0000-00-00 00:00:00,tablet,Edge,Linux,909,1,2023-08-12 12:09
E003152,U002566,page_view,/pricing,07/31/2024 13:59,desktop,,iOS,unknown,TRUE,2024-07-31 13:59
E007461,U000602,ai_search,,03/20/2025 01:54,desktop,,,147,FALSE,2025-03-20 1:54
E003157,U002052,logout,/billing,2025-04-07 23:18,DESKTOP,Chrome,Android,188,,2025-04-07 23:18
E006812,U001455,integration_error,,2025-04-02 6:04,,Firefox,,1635,1,2025-04-02 6:04
E005812,U001689,doc_edit,,2025-05-26 14:06,desktop,Firefox,Linux,,0,2025-05-26 14:06
E005939,U000942,page_view,/help,2023-12-25 12:40,mobile,Chrome,Android,,1,2023-12-25 12:40
E001375,U000226,doc_edit,,2023-04-30 5:29,DESKTOP,Edge,,unknown,0,2023-04-30 5:29
E006868,u000426,integration_error,,2023-10-02 20:29,desktop,Brave,Windows,,0,2023-10-02 20:29
e004936,U002538,doc_edit,,2024-12-05 19:57,DESKTOP,,,unknown,,2024-12-05 19:57
E008191,U000166,doc_edit,,08/16/2024 09:46,mobile,Edge,macOS,,FALSE,2024-08-16 9:46
E002392,U001398,share,,06/29/2024 16:56,,Chrome,Android,,,2024-06-29 16:56
E008733,U001791,export,,2023-07-27,,Firefox,macOS,,,2023-07-27 22:59
E000356,U002273,page_view,/pricing,2024-07-06 19:28,,Chrome,,,FALSE,2024-07-06 19:28
E000237,u002294,page_view,/admin,2025-03-21 15:03,,Edge,macOS,,FALSE,2025-03-21 15:03
E007351, U001980 ,login,/onboarding,2023-08-02,tablet,Firefox,macOS,864,,2023-08-02 13:53
e002246,u000921,login,/pricing,04/06/2024 06:05,mobile,Firefox,,,TRUE,2024-04-06 6:05
E007139,U002465,logout,/dashboard,01/07/2024 10:11,,Firefox,Android,,1,2024-01-07 10:11
E001129,U000152,share,,2024-04-24 0:16,tablet,Chrome,,834,,2024-04-24 0:16
E002560,U002346,doc_edit,,2023-01-11 11:47,tablet,,macOS,916,1,2023-01-11 11:47
E005909,U000615,export,,2024-09-01,,Safari,iOS,,FALSE,2024-09-01 14:13
E003425,U000285,integration_error,,01/08/2025 13:12,,Chrome,,1271,0,2025-01-08 13:12
E003214,U000484,doc_edit,,,,Safari,iOS,,,2025-05-25 1:45
E006948,U002122,integration_error,,0000-00-00 00:00:00,DESKTOP,Edge,,1711,0,2023-01-28 21:29
E007664,USR-002213,logout,/settings,2024-01-16,mobile,Edge,Linux,588,FALSE,2024-01-16 16:36
E000815,U002233,logout,/pricing,09/02/2024 10:12,,,Linux,unknown,TRUE,2024-09-02 10:12
E006551,U000002,LOGOUT,/dashboard,09/16/2024 01:31,,Firefox,,unknown,TRUE,2024-09-16 1:31
E008830,U000200,integration_connect,,05/19/2024 04:19,mobile,Firefox,macOS,,FALSE,2024-05-19 4:19
E004470,U000486,ai_search,,2023-05-03,desktop,Brave,Android,,1,2023-05-03 23:18
E000670,U001717,integration_connect,,0000-00-00 00:00:00,mobile,Safari,iOS,,0,2024-06-05 15:10
E008669,U000341,doc_create,,2024-06-30 21:52,tablet,,,,FALSE,2024-06-30 21:52
E007544,U001108,doc_edit,,2024-05-09 2:04,tablet,,iOS,,FALSE,2024-05-09 2:04
E002188,U001749,LOGIN,/dashboard,06/01/2024 06:40,DESKTOP,Chrome,macOS,,FALSE,2024-06-01 6:40
E006941,u001635,logout,/settings,12/20/2023 03:44,,,,unknown,,2023-12-20 3:44
E001637,U002144,export,,06/13/2025 16:15,,,,354,FALSE,2025-06-13 16:15
E004865,U001667,ai_search,,03/21/2024 00:36,,Edge,,,FALSE,2024-03-21 0:36
E003131,U002354,comment,,2023-07-01,,Edge,,321,,2023-07-01 9:11
E006692,u000716,logout,/integrations,,,Firefox,iOS,,0,2023-06-23 3:04
E008482,U002143,comment,,,tablet,,Linux,unknown,,2023-03-07 17:50
E000330,u001989,share,,2025-05-14 10:50,DESKTOP,,Android,,TRUE,2025-05-14 10:50
E004482,U001490,comment,,2023-04-22 5:53,DESKTOP,Edge,macOS,745,0,2023-04-22 5:53
E003771,U002134,integration_connect,,12/15/2023 03:11,desktop,Chrome,,unknown,0,2023-12-15 3:11
E003983,U002406,login,/admin,,tablet,Safari,macOS,190,FALSE,2023-11-24 20:51
E002219,U000818,login,/integrations,02/05/2025 11:49,desktop,,,691,1,2025-02-05 11:49
E005257,U000130,login,/search,2023-11-02 15:41,,,macOS,unknown,,2023-11-02 15:41
E000374,U001711,export,,2023-05-05,desktop,,macOS,,,2023-05-05 3:05
E002042,U002065,doc_create,,08/23/2023 07:00,,,Windows,1267,TRUE,2023-08-23 7:00
E007208,U000992,doc_create,,07/11/2024 06:21,tablet,Safari,Linux,,,2024-07-11 6:21
E000495,U001649,search,,11/12/2024 19:20,mobile,Chrome,iOS,unknown,TRUE,2024-11-12 19:20
E002652,U002368,integration_error,,12/22/2024 22:08,DESKTOP,Edge,,,0,2024-12-22 22:08
E006551,U001060,comment,,11/19/2024 13:57,desktop,Safari,iOS,,,2024-11-19 13:57
E008893,U002147,doc_delete,,2023-10-08 12:10,DESKTOP,Safari,macOS,unknown,,2023-10-08 12:10
E006080,U000301,integration_connect,,2023-10-03 1:53,DESKTOP,Firefox,Windows,,FALSE,2023-10-03 1:53
E001497,U001821,logout,/docs,2024-01-19 18:31,tablet,,macOS,,0,2024-01-19 18:31
E008860,U001770,ai_search,,01/14/2025 03:57,,,macOS,,FALSE,2025-01-14 3:57
E000444,U001962,integration_connect,,2024-05-08 8:35,,Brave,,,TRUE,2024-05-08 8:35
E002816,U001612,integration_connect,,2023-10-01 7:26,DESKTOP,Chrome,Android,unknown,FALSE,2023-10-01 7:26
E005185,U000012,integration_error,,,tablet,Safari,Linux,,FALSE,2024-07-22 6:06
 E002865,U001874,integration_error,,0000-00-00 00:00:00,,,,,TRUE,2023-04-23 12:57
E007149,U002107,logout,/integrations,2024-06-05 5:19,tablet,,macOS,,0,2024-06-05 5:19
E000982,U001526,logout,/settings,,desktop,,Linux,,1,2025-05-27 17:34
E008630,U000098,integration_connect,,2023-08-09,DESKTOP,,,,TRUE,2023-08-09 7:49
 E001750,U002341,integration_error,,2024-01-06 8:17,tablet,,,unknown,,2024-01-06 8:17
E007331, U000327 ,integration_error,,2024-11-27,tablet,,macOS,,,2024-11-27 10:44
E000534,U002013,page_view,/settings,,,Brave,iOS,1364,0,2023-10-10 7:20
E001196,U000351,comment,,11/09/2024 21:51,mobile,Safari,iOS,,TRUE,2024-11-09 21:51
E000603,U002156,page_view,/search,2023-04-01 17:40,DESKTOP,Brave,Linux,,,2023-04-01 17:40
E006204,U000220,comment,,2024-11-02,desktop,,,1723,TRUE,2024-11-02 22:24
E000829,U000182,integration_error,,,mobile,Chrome,Windows,unknown,TRUE,2025-06-03 0:42
E003895,U000913,comment,,09/03/2023 06:56,tablet,Brave,Windows,1383,TRUE,2023-09-03 6:56
E008552,U002386,export,,2025-02-21,,,Android,,TRUE,2025-02-21 7:58
E004585,U000265,ai_search,,12/30/2023 10:58,DESKTOP,Chrome,,,,2023-12-30 10:58
E006605,U000329,doc_edit,,02/02/2025 11:31,desktop,Edge,macOS,,1,2025-02-02 11:31
E005804,U001320,share,,2024-02-09 19:05,tablet,Brave,,,FALSE,2024-02-09 19:05
E002202,U000007,search,,,desktop,Brave,Windows,,FALSE,2023-07-20 10:34
E005415,U000597,login,/billing,2024-02-14,desktop,,macOS,unknown,,2024-02-14 11:23
E004892,U001249,page_view,/integrations,,mobile,Safari,,unknown,1,2024-04-23 7:10
E002226,U001843,search,,01/27/2025 21:16,,Brave,,unknown,FALSE,2025-01-27 21:16
E004101,U001429,export,,2025-04-14 5:47,mobile,Chrome,,,0,2025-04-14 5:47
E001469,U002108,comment,,0000-00-00 00:00:00,mobile,,Android,,TRUE,2023-04-04 14:44
E000173,U002462,DOC_CREATE,,,DESKTOP,Chrome,,,TRUE,2023-08-15 6:13
E004833,U002599,doc_edit,,2025-02-13,,,iOS,1475,1,2025-02-13 19:09
e001372,U002381,doc_create,,2023-09-22 9:13,,Brave,Windows,660,1,2023-09-22 9:13
E001661,U000006,comment,,2025-03-17 12:38,,Firefox,,619,1,2025-03-17 12:38
e006322,U001508,export,,2025-03-22 15:06,,Chrome,macOS,1687,FALSE,2025-03-22 15:06
E008038,u001727,search,,2023-09-03,DESKTOP,,Windows,unknown,TRUE,2023-09-03 11:06
E005841,USR-000909,share,,0000-00-00 00:00:00,tablet,Brave,Android,1744,,2025-06-10 18:17
E003968,USR-000909,share,,07/19/2023 18:28,DESKTOP,Firefox,Windows,unknown,FALSE,2023-07-19 18:28
E006130,U001484,page_view,/integrations,05/16/2025 01:43,mobile,Safari,Windows,743,,2025-05-16 1:43
E008853,U000642,integration_error,,2023-06-28 14:09,,Edge,iOS,1268,,2023-06-28 14:09
E001034,U002468,export,,2023-04-03 15:03,DESKTOP,,Windows,810,TRUE,2023-04-03 15:03
E007005,U001108,doc_create,,04/10/2024 06:54,mobile,,iOS,,TRUE,2024-04-10 6:54
E007286,U002441,PAGE_VIEW,/settings,2024-09-04 18:56,DESKTOP,Brave,macOS,,TRUE,2024-09-04 18:56
E000455,U001861,login,/billing,,tablet,Chrome,Linux,unknown,1,2023-08-28 6:13
E005294,U001009,doc_edit,,12/17/2023 18:36,,Firefox,iOS,unknown,1,2023-12-17 18:36
E007124,U002161,logout,/help,08/18/2024 05:20,tablet,Chrome,iOS,201,1,2024-08-18 5:20
E003438,U001953,doc_create,,,tablet,,Windows,,TRUE,2025-01-06 9:27
E003392,U000554,comment,,06/29/2023 20:44,tablet,Chrome,,,FALSE,2023-06-29 20:44
E003921,U000630,doc_delete,,0000-00-00 00:00:00,DESKTOP,,Android,unknown,FALSE,2025-03-08 3:04
E008800,U002259,login,/settings,,tablet,Safari,macOS,unknown,1,2024-03-07 6:44
E007830,U000932,share,,02/29/2024 10:59,mobile,Brave,,,,2024-02-29 10:59
E006953,U000281,share,,0000-00-00 00:00:00,desktop,Edge,macOS,,TRUE,2024-05-08 6:15
E002821,U002504,SEARCH,,04/12/2024 22:52,tablet,Brave,Linux,unknown,FALSE,2024-04-12 22:52
E005241,U000623,LOGIN,/dashboard,2023-05-09 2:32,tablet,Firefox,iOS,unknown,FALSE,2023-05-09 2:32
E005910,U000643,search,,2024-12-05,,Firefox,Windows,unknown,,2024-12-05 23:41
E000593,U000816,integration_connect,,2024-05-03 3:56,DESKTOP,Brave,Windows,unknown,TRUE,2024-05-03 3:56
E003830,u000685,logout,/billing,2025-04-12 8:57,tablet,Chrome,,,TRUE,2025-04-12 8:57
E000167,u000552,integration_connect,,2023-01-03 9:56,,Edge,macOS,,FALSE,2023-01-03 9:56
E005906,U001370,integration_connect,,04/11/2023 22:03,,,macOS,536,FALSE,2023-04-11 22:03
E000375,U001934,ai_search,,12/01/2024 16:59,mobile,Firefox,,,FALSE,2024-12-01 16:59
E006479,U000644,login,/dashboard,2024-11-10,,,,,TRUE,2024-11-10 0:57
E005714,U001267,comment,,0000-00-00 00:00:00,,,,,1,2023-01-02 7:08
E008880,U000966,logout,/dashboard,06/16/2023 08:59,,,macOS,,TRUE,2023-06-16 8:59
E000770,U001354,login,/help,,,Firefox,Windows,unknown,,2024-05-26 1:36
E003768,U002374,integration_connect,,2024-04-17 12:28,,,macOS,1561,TRUE,2024-04-17 12:28
E001648,U001969,doc_edit,,12/31/2024 05:21,,Edge,Linux,unknown,1,2024-12-31 5:21
E007132,U000478,page_view,/admin,2024-05-19 10:53,mobile,,,,,2024-05-19 10:53
E001582,U002416,doc_delete,,01/01/2024 04:59,mobile,Brave,Linux,1424,FALSE,2024-01-01 4:59
E002084,U001800,search,,,,Brave,Windows,unknown,TRUE,2024-12-28 0:00
E000910,U002330,ai_search,,2024-05-25 10:42,mobile,Edge,,,,2024-05-25 10:42
E004033,U000149,integration_connect,,2025-01-23 20:20,DESKTOP,,Windows,234,,2025-01-23 20:20
E001932,U001860,doc_create,,2025-01-05,mobile,,Windows,,FALSE,2025-01-05 21:37
E004575,U000531,share,,2024-08-13,,Safari,iOS,unknown,FALSE,2024-08-13 10:58
E001667,U001794,doc_edit,,2023-01-27 4:01,mobile,Edge,macOS,1722,1,2023-01-27 4:01
E000469,U002232,share,,11/18/2023 23:20,,,Windows,161,,2023-11-18 23:20
E001897,U000838,integration_connect,,08/16/2023 19:32,desktop,,,,,2023-08-16 19:32
E006029, U001916 ,ai_search,,2025-02-18,,,iOS,,,2025-02-18 11:01
E008598,U001148,comment,,2023-05-06,,Brave,iOS,unknown,0,2023-05-06 19:59
E004852,U002047,comment,,2023-01-24 16:56,,,,,1,2023-01-24 16:56
E000493,U001139,share,,2025-01-30 23:44,,,,279,1,2025-01-30 23:44
E002790,U001682,page_view,/dashboard,,tablet,Brave,,unknown,TRUE,2023-08-19 7:46
E006350,U000932,login,/admin,,,,Windows,,FALSE,2023-02-05 23:58
E000049,U002012,export,,11/29/2023 00:21,DESKTOP,,Linux,,TRUE,2023-11-29 0:21
E007587,U000612,login,/admin,04/19/2023 07:09,mobile,Brave,,unknown,FALSE,2023-04-19 7:09
E001389,U000816,logout,/docs,03/18/2024 04:55,mobile,Brave,Android,unknown,TRUE,2024-03-18 4:55
E008523,U000677,page_view,/docs,2024-11-20 4:27,DESKTOP,,macOS,,,2024-11-20 4:27
E001259,U001756,export,,2023-10-18 11:38,DESKTOP,Firefox,Android,,FALSE,2023-10-18 11:38
E005592,U001726,doc_create,,2024-10-27 1:46,,Safari,Android,451,0,2024-10-27 1:46
E002827,U001533,login,/dashboard,12/24/2024 20:46,DESKTOP,Edge,macOS,unknown,FALSE,2024-12-24 20:46
E004216, u000598 ,logout,/onboarding,2024-02-03 13:15,,,iOS,unknown,TRUE,2024-02-03 13:15
E000168,U000364,export,,2025-06-02,desktop,Firefox,Windows,1359,TRUE,2025-06-02 5:49
E004747,u002396,ai_search,,2025-01-19 14:48,DESKTOP,Edge,iOS,,FALSE,2025-01-19 14:48
E004226,U002111,doc_edit,,04/19/2025 14:02,desktop,Firefox,Linux,,0,2025-04-19 14:02
E000011,U000445,share,,,,Brave,iOS,,1,2024-03-14 16:53
E007260,U001062,login,/admin,2023-12-31 11:35,DESKTOP,Firefox,,1757,,2023-12-31 11:35
E003311,U001864,search,,,mobile,Chrome,,319,FALSE,2023-07-05 17:40
E008780,U002133,doc_edit,,2023-02-14,desktop,,Linux,,TRUE,2023-02-14 2:46
E004148, U001702 ,doc_edit,,07/04/2024 02:00,,Safari,Linux,873,TRUE,2024-07-04 2:00
 E004599,U000201,integration_error,,2023-12-07,,,,unknown,FALSE,2023-12-07 7:42
E005437,U000073,share,,2023-10-11 21:20,tablet,,Windows,unknown,1,2023-10-11 21:20
E005311,U000682,integration_error,,2023-12-19 8:30,,Brave,Android,300,,2023-12-19 8:30
E006311,U000133,login,/onboarding,2023-09-28,tablet,Safari,Android,507,0,2023-09-28 17:02
E001296,U001765,doc_delete,,04/22/2023 21:35,desktop,Chrome,iOS,unknown,0,2023-04-22 21:35
E006038,U000966,page_view,/help,2025-02-14,DESKTOP,Firefox,iOS,,,2025-02-14 8:49
E005781,U000713,integration_connect,,0000-00-00 00:00:00,mobile,Edge,iOS,,,2024-04-10 3:59
E001574,U000349,logout,/onboarding,09/26/2023 12:34,,Edge,macOS,,FALSE,2023-09-26 12:34
E008141,U001361,ai_search,,2025-03-27 9:50,desktop,,Android,unknown,,2025-03-27 9:50
E001206,U001500,doc_delete,,2024-12-06,mobile,Safari,,unknown,,2024-12-06 9:35
E006664,U000071,login,/settings,,,Firefox,iOS,,FALSE,2023-01-12 15:01
E000943,U001611,login,/docs,08/17/2023 13:42,mobile,Edge,Windows,865,FALSE,2023-08-17 13:42
E007737,u001731,DOC_DELETE,,2024-09-23 3:52,desktop,Chrome,,742,TRUE,2024-09-23 3:52
E000175, U000918 ,doc_delete,,06/09/2025 14:43,DESKTOP,,iOS,,,2025-06-09 14:43
E003475,U000264,ai_search,,,,,Linux,,0,2024-02-23 15:43
E008597,U000094,ai_search,,10/12/2024 02:25,,Safari,,,FALSE,2024-10-12 2:25
E000854,U000858,integration_error,,2024-01-23,tablet,Firefox,,,TRUE,2024-01-23 17:29
E004191,U002173,share,,2023-05-29,desktop,,,470,TRUE,2023-05-29 17:06
E008020,U000015,share,,2024-06-02,,,Android,unknown,,2024-06-02 15:07
E006319,U001959,search,,2024-07-21 13:54,DESKTOP,Safari,,,TRUE,2024-07-21 13:54
E000420,U001466,search,,12/24/2023 06:59,tablet,Edge,iOS,,1,2023-12-24 6:59
E004443,U000482,doc_edit,,2025-02-17 11:57,,,macOS,,1,2025-02-17 11:57
E006704,U000721,doc_create,,2024-01-26 9:22,tablet,Firefox,Linux,1367,FALSE,2024-01-26 9:22
E005336,U000070,integration_connect,,05/13/2024 21:57,DESKTOP,,Android,,TRUE,2024-05-13 21:57
E001365, u001589 ,search,,2024-09-14 0:31,desktop,Firefox,Android,,FALSE,2024-09-14 0:31
E003546,U000023,export,,,tablet,Edge,,unknown,1,2024-06-14 15:36
E007532,U002266,share,,02/19/2024 03:21,mobile,,macOS,unknown,1,2024-02-19 3:21
E008059, U001096 ,export,,08/20/2023 23:14,,,Android,unknown,0,2023-08-20 23:14
E003863,U001806,doc_create,,02/18/2024 18:19,tablet,Chrome,macOS,,,2024-02-18 18:19
E004275,U000962,integration_connect,,01/27/2023 16:09,,,iOS,,TRUE,2023-01-27 16:09
E007601,U000038,login,/pricing,2023-02-10 16:35,mobile,Firefox,,unknown,TRUE,2023-02-10 16:35
E006851,USR-000644,share,,2024-04-20,DESKTOP,,iOS,,TRUE,2024-04-20 3:19
E003227,U002244,doc_delete,,03/25/2025 16:33,DESKTOP,Safari,,,FALSE,2025-03-25 16:33
E002675,U000277,logout,/billing,05/14/2024 12:17,mobile,Safari,Windows,,,2024-05-14 12:17
E008006,USR-000021,comment,,2025-05-21 1:01,mobile,Safari,,,TRUE,2025-05-21 1:01
E006131,U000458,integration_error,,2023-10-25,DESKTOP,Edge,Linux,1700,TRUE,2023-10-25 17:46
E004845,U001282,login,/dashboard,2023-03-25,mobile,Edge,macOS,,1,2023-03-25 20:11
E002433,U001647,logout,/billing,2025-04-27 16:38,,Firefox,Android,,TRUE,2025-04-27 16:38
E000028,U001709,share,,12/26/2024 14:10,mobile,Edge,,unknown,0,2024-12-26 14:10
E000308,U001715,ai_search,,2023-11-06 17:52,DESKTOP,,,,FALSE,2023-11-06 17:52
E004788,U001708,doc_delete,,2023-10-27,,Brave,macOS,98,TRUE,2023-10-27 19:04
E004590,USR-002537,logout,/admin,2025-04-11,desktop,Edge,Android,1058,TRUE,2025-04-11 17:18
E003300,U000707,login,/settings,0000-00-00 00:00:00,desktop,Firefox,Linux,880,,2024-08-01 23:29
E000618,USR-002380,ai_search,,2023-08-19 19:55,,Brave,Linux,1041,TRUE,2023-08-19 19:55
E003148,U000628,doc_create,,2023-01-16,,Brave,macOS,,FALSE,2023-01-16 20:47
E005226,U002429,doc_edit,,2023-01-17,tablet,Firefox,Windows,,,2023-01-17 6:44
E008538,U000410,comment,,05/16/2025 21:58,desktop,Edge,Android,,TRUE,2025-05-16 21:58
E004057,U002284,doc_edit,,2023-05-19,tablet,,macOS,,FALSE,2023-05-19 10:20
E002357,U000321,page_view,/billing,01/02/2023 23:04,,Firefox,Android,883,FALSE,2023-01-02 23:04
E007132,U000547,ai_search,,,DESKTOP,,,344,FALSE,2024-05-10 20:00
E003248,U001813,integration_connect,,10/05/2023 09:02,tablet,Firefox,,1010,FALSE,2023-10-05 9:02
E006693,U001533,comment,,2023-11-29,DESKTOP,Firefox,,,FALSE,2023-11-29 17:34
e001902,U000661,logout,/help,2025-04-15 22:03,,Chrome,iOS,,TRUE,2025-04-15 22:03
E008315,U000721,ai_search,,04/30/2023 05:39,desktop,Edge,iOS,1295,FALSE,2023-04-30 5:39
E000703,U000341,doc_delete,,2023-07-24,,Brave,iOS,,1,2023-07-24 17:28
E006540,U000143,page_view,/pricing,0000-00-00 00:00:00,tablet,Brave,Android,1748,FALSE,2024-02-01 6:34
E003110,U002172,search,,10/17/2023 15:39,tablet,Safari,macOS,,TRUE,2023-10-17 15:39
E001364,u002193,share,,,,,Windows,unknown,,2023-01-02 13:41
E002448,USR-001634,comment,,04/16/2023 21:46,DESKTOP,,,,TRUE,2023-04-16 21:46
E005359,U001009,search,,2023-04-04 5:05,,Edge,macOS,,FALSE,2023-04-04 5:05
E004668,U001160,doc_delete,,2023-11-05,mobile,Firefox,Android,,TRUE,2023-11-05 13:54
E006081,U000482,search,,2023-11-06,,Edge,,unknown,FALSE,2023-11-06 14:03
E005982,U001471,integration_connect,,06/14/2023 09:10,mobile,,iOS,1422,1,2023-06-14 9:10
E005933,U001939,search,,0000-00-00 00:00:00,tablet,Edge,,,1,2024-04-07 18:50
E003536,U000225,doc_create,,0000-00-00 00:00:00,mobile,Brave,Android,unknown,0,2024-10-06 21:00
E001165,U002198,integration_error,,,,Safari,iOS,,1,2023-11-19 22:22
E004538,U000093,page_view,/integrations,2024-05-12 1:59,,Edge,Linux,unknown,0,2024-05-12 1:59
E007585,U000063,doc_edit,,,tablet,Firefox,Linux,1003,TRUE,2024-02-14 21:55
E007954,U001472,ai_search,,0000-00-00 00:00:00,tablet,Edge,Windows,,TRUE,2024-02-23 19:07
E001271,U001873,doc_delete,,06/12/2025 18:53,tablet,Brave,,,TRUE,2025-06-12 18:53
E007320,U000008,ai_search,,12/19/2023 07:32,,Firefox,macOS,unknown,0,2023-12-19 7:32
E001485,U001207,search,,05/02/2024 18:07,desktop,Firefox,Linux,,TRUE,2024-05-02 18:07
E006575,U000561,ai_search,,2024-09-17,desktop,Edge,Android,,FALSE,2024-09-17 20:03
E000338,U000933,comment,,2024-02-10 6:52,,Safari,Windows,,FALSE,2024-02-10 6:52
E007255,U000162,integration_connect,,2023-09-19,,,,,FALSE,2023-09-19 2:20
E004336,U001375,doc_delete,,2023-06-18 2:48,,Edge,Android,,TRUE,2023-06-18 2:48
E004843,U001292,search,,0000-00-00 00:00:00,desktop,Edge,Linux,,FALSE,2025-05-09 21:58
E005892,USR-001185,search,,2025-02-04 9:33,,Chrome,,unknown,FALSE,2025-02-04 9:33
E008060,U002587,integration_connect,,2023-02-11 22:33,desktop,Brave,iOS,unknown,,2023-02-11 22:33
E008107,U001085,login,/pricing,2023-02-07 11:37,tablet,Chrome,Android,1711,,2023-02-07 11:37
E007196,U000194,logout,/dashboard,0000-00-00 00:00:00,desktop,Edge,iOS,1134,FALSE,2025-04-26 1:00
E003747,U002359,share,,2023-04-21 17:41,mobile,,Android,,,2023-04-21 17:41
E000247,U002134,share,,2023-07-14 19:21,,Chrome,iOS,unknown,FALSE,2023-07-14 19:21
E005433,U001877,page_view,/integrations,,tablet,Edge,macOS,unknown,FALSE,2023-07-25 7:51
E001787, U002589 ,doc_edit,,2023-06-24,tablet,Firefox,,,,2023-06-24 18:42
e000083,U001260,share,,2024-08-16 8:18,tablet,Brave,macOS,unknown,TRUE,2024-08-16 8:18
E007849,u000067,ai_search,,2023-05-06 2:37,DESKTOP,,,,1,2023-05-06 2:37
E004282,U001684,search,,2023-08-10 21:17,mobile,,Windows,,TRUE,2023-08-10 21:17
E002585,U000130,share,,2023-08-06,DESKTOP,Safari,,unknown,TRUE,2023-08-06 0:41
E002889,U002469,SHARE,,2023-02-24,tablet,Chrome,Windows,,TRUE,2023-02-24 21:06
E001043,U002016,export,,2023-12-04,desktop,Safari,,,FALSE,2023-12-04 12:24
E002578,U000409,export,,01/19/2023 00:25,,,Android,,FALSE,2023-01-19 0:25
E001801, U001979 ,ai_search,,2024-04-15,mobile,Brave,Windows,,1,2024-04-15 16:03
E007378,U001414,doc_edit,,2025-02-09,DESKTOP,Firefox,macOS,497,1,2025-02-09 23:00
E000811,U002047,share,,2023-03-13,,Edge,macOS,unknown,FALSE,2023-03-13 1:21
E007009, U001620 ,search,,,tablet,Safari,Linux,,TRUE,2024-01-16 19:10
E000608,U002253,doc_delete,,04/29/2025 09:04,,Firefox,macOS,unknown,,2025-04-29 9:04
E006691,U000884,logout,/admin,,mobile,Chrome,Windows,,TRUE,2024-12-13 8:39
E005697,U000836,export,,02/17/2024 05:20,,Edge,Android,,TRUE,2024-02-17 5:20
E004171,U002318,export,,,desktop,,,,TRUE,2023-02-24 3:24
E007502,U000865,share,,2023-04-02,DESKTOP,Chrome,Android,,0,2023-04-02 15:17
E006699,U002487,search,,2024-04-06 13:03,DESKTOP,,iOS,1110,1,2024-04-06 13:03
E004684,u002251,page_view,/dashboard,09/21/2024 00:00,,Firefox,Android,,FALSE,2024-09-21 0:00
E001161,U000355,login,/help,08/28/2023 13:39,mobile,Firefox,iOS,964,1,2023-08-28 13:39
E004973,U002026,comment,,03/29/2023 21:46,tablet,Chrome,Windows,unknown,TRUE,2023-03-29 21:46
E007932,U001996,share,,2023-05-22 0:56,tablet,,,,FALSE,2023-05-22 0:56
E006239,U001071,doc_create,,2023-08-03,,Safari,iOS,,TRUE,2023-08-03 6:21
E000857,U000760,doc_delete,,2023-05-13,tablet,Safari,macOS,,0,2023-05-13 20:44
E006947,U000183,page_view,/integrations,2024-06-07,,Edge,Windows,,1,2024-06-07 16:44
E004241,USR-000669,doc_delete,,12/31/2023 02:01,tablet,Firefox,,unknown,1,2023-12-31 2:01
E001286,U001304,login,/onboarding,08/26/2024 10:33,DESKTOP,Brave,,,FALSE,2024-08-26 10:33
E006065,U001123,logout,/billing,2024-12-31,DESKTOP,Edge,macOS,327,FALSE,2024-12-31 4:08
E000751,U001570,ai_search,,03/05/2025 20:01,,Firefox,Linux,,0,2025-03-05 20:01
E001333,U001448,doc_edit,,06/14/2023 01:35,DESKTOP,,,,TRUE,2023-06-14 1:35
E000737,U000738,logout,/settings,2024-02-20,mobile,Safari,Linux,,FALSE,2024-02-20 13:04
E008606,U002053,integration_error,,2023-07-20,desktop,Brave,Linux,523,0,2023-07-20 4:14
E004565,U002559,export,,01/08/2024 15:54,DESKTOP,,,,1,2024-01-08 15:54
E006132,U000068,comment,,,,Safari,Linux,unknown,FALSE,2025-04-22 19:55
E003682,U002599,share,,12/05/2023 15:19,tablet,,iOS,unknown,TRUE,2023-12-05 15:19
E007812,U002591,integration_error,,2023-05-11,,Firefox,macOS,,1,2023-05-11 13:55
E004809, U000177 ,login,/billing,2023-10-06,desktop,Firefox,Windows,,FALSE,2023-10-06 17:56
E001752,U000830,integration_connect,,,tablet,Chrome,Windows,,TRUE,2024-05-16 19:21
e004481,U002280,logout,/help,2024-08-03 10:25,tablet,Edge,,,FALSE,2024-08-03 10:25
E000854,U001867,integration_error,,09/03/2024 13:47,,Edge,,unknown,FALSE,2024-09-03 13:47
E005497,U001229,doc_delete,,2025-04-30 1:54,desktop,Firefox,macOS,unknown,,2025-04-30 1:54
E003126,U001595,comment,,,tablet,,iOS,,,2023-06-12 21:55
E007888,U002104,integration_connect,,04/07/2023 16:12,,,macOS,,,2023-04-07 16:12
E005722,U002092,doc_create,,06/13/2025 07:11,,,iOS,unknown,,2025-06-13 7:11
E007797,U002062,export,,2023-09-15,,Brave,,687,1,2023-09-15 22:46
E000199,U000872,login,/dashboard,01/03/2024 01:23,desktop,Firefox,Android,1326,0,2024-01-03 1:23
E001116,U000863,share,,2024-03-19,,Edge,Android,unknown,TRUE,2024-03-19 3:57
E007224,U000693,login,/search,03/31/2023 22:50,mobile,,Windows,,FALSE,2023-03-31 22:50
E003236,U001910,doc_delete,,2024-01-08,,Chrome,Windows,396,FALSE,2024-01-08 17:34
E004519,U001071,logout,/settings,,,,,,,2025-02-28 1:02
E004274,U001094,logout,/integrations,,desktop,Safari,Windows,,TRUE,2023-12-05 23:00
E002547,u002502,comment,,2024-06-21 22:35,desktop,Firefox,Windows,unknown,TRUE,2024-06-21 22:35
E002848,u001285,doc_edit,,,desktop,Brave,Linux,,0,2025-05-17 6:00
E008340,U000672,integration_error,,2023-04-13,,,macOS,unknown,TRUE,2023-04-13 10:02
E002430,U000625,comment,,2024-06-28,tablet,,iOS,unknown,0,2024-06-28 3:25
E002012,U002531,doc_create,,2024-03-25,DESKTOP,Brave,Android,827,TRUE,2024-03-25 12:25
E002651,U000298,doc_create,,2024-05-09,desktop,Safari,Linux,,,2024-05-09 22:12
E003351,u002346,page_view,/docs,2025-03-25,tablet,Brave,Linux,unknown,1,2025-03-25 3:47
E006411,U001496,search,,08/25/2024 10:16,mobile,,,unknown,,2024-08-25 10:16
E001073,U000074,search,,2024-07-03,tablet,Edge,Windows,,TRUE,2024-07-03 2:57
E008672,U000122,ai_search,,08/02/2023 12:09,tablet,Safari,macOS,1737,1,2023-08-02 12:09
E004462, U001417 ,comment,,02/14/2023 20:07,desktop,Brave,,,TRUE,2023-02-14 20:07
E002090,U000925,login,/billing,2024-10-21,,Safari,macOS,,TRUE,2024-10-21 21:44
E002559,U000171,logout,/billing,2023-12-22 16:53,,Safari,iOS,459,,2023-12-22 16:53
E000180,U002056,comment,,,mobile,Edge,Windows,unknown,FALSE,2024-01-19 4:39
E002642,u001287,doc_delete,,0000-00-00 00:00:00,,,macOS,,1,2023-12-18 11:48
E005901,U002112,share,,2024-12-15,mobile,Edge,iOS,,TRUE,2024-12-15 19:52
E002932,U000477,doc_create,,05/06/2023 04:56,,Safari,,,0,2023-05-06 4:56
E004277,USR-000119,page_view,/pricing,11/28/2024 23:10,,Chrome,macOS,unknown,,2024-11-28 23:10
E007113,U001959,integration_error,,07/28/2023 21:47,tablet,,Linux,,0,2023-07-28 21:47
e007660,U001983,integration_error,,,,Edge,macOS,,,2023-03-04 6:00
E002320,U000631,search,,09/02/2023 10:01,tablet,,iOS,,1,2023-09-02 10:01
e007541,U001347,share,,2025-02-21,mobile,,Linux,unknown,FALSE,2025-02-21 21:10
E000130,U001547,doc_edit,,2023-06-20,desktop,,Android,unknown,1,2023-06-20 15:45
E008350,U000815,doc_delete,,09/16/2024 21:08,DESKTOP,Safari,,,FALSE,2024-09-16 21:08
E001828,USR-000151,integration_error,,2024-07-21 18:19,desktop,Edge,Android,,1,2024-07-21 18:19
E001376,U001458,doc_create,,2023-09-30 20:13,mobile,Chrome,macOS,,TRUE,2023-09-30 20:13
E005061,U001467,logout,/help,04/22/2025 05:00,,,,,,2025-04-22 5:00
E008399,u000361,doc_delete,,2025-02-23,,Brave,Linux,,TRUE,2025-02-23 4:10
E008449,U001628,doc_edit,,11/13/2024 02:32,DESKTOP,Edge,Windows,unknown,FALSE,2024-11-13 2:32
E000483,U000254,login,/search,2023-10-02 18:03,,Edge,iOS,1019,,2023-10-02 18:03
E008658,U000164,ai_search,,05/18/2024 20:54,,Safari,,,TRUE,2024-05-18 20:54
E007465,U002313,integration_error,,06/13/2023 12:18,,Firefox,,,FALSE,2023-06-13 12:18
E003763,U001160,export,,02/07/2025 17:45,desktop,Edge,iOS,,FALSE,2025-02-07 17:45
E007218,U000313,ai_search,,0000-00-00 00:00:00,desktop,,,317,1,2024-10-29 18:03
E005055,U000974,COMMENT,,2023-03-24,,,Android,,FALSE,2023-03-24 6:00
E001775, U001902 ,integration_connect,,2024-10-03,mobile,Edge,Android,unknown,1,2024-10-03 14:13
E001368,U000296,integration_connect,,04/26/2023 02:56,desktop,Firefox,Linux,,TRUE,2023-04-26 2:56
E008926,U001134,search,,2023-03-23,mobile,Safari,,380,TRUE,2023-03-23 6:31
E002145,U001931,ai_search,,2023-07-30 3:37,mobile,Chrome,iOS,,,2023-07-30 3:37
E000702,U001603,search,,06/13/2025 00:55,tablet,Brave,,,,2025-06-13 0:55
E000592,U000177,doc_edit,,2024-03-29,mobile,Firefox,Android,1057,,2024-03-29 21:34
E005470,u000239,doc_edit,,,,Safari,macOS,,,2023-11-13 22:15
E007585,U000791,login,/settings,2025-03-01 6:27,DESKTOP,Brave,iOS,1720,FALSE,2025-03-01 6:27
E005597,U001224,page_view,/integrations,2023-12-23 10:55,DESKTOP,Edge,Linux,,TRUE,2023-12-23 10:55
E001856,U000893,logout,/search,2025-02-22 5:54,desktop,Brave,iOS,unknown,TRUE,2025-02-22 5:54
E005745,U001191,page_view,/pricing,2023-12-19,tablet,Brave,Android,unknown,FALSE,2023-12-19 18:54
E007351,U000320,logout,/admin,2025-05-02,DESKTOP,Firefox,Windows,,FALSE,2025-05-02 11:30
E006226,U000610,search,,03/06/2025 21:06,,Brave,,990,TRUE,2025-03-06 21:06
E003485,U001070,ai_search,,2023-06-06 18:26,desktop,Chrome,macOS,,TRUE,2023-06-06 18:26
E002073,U002069,doc_create,,,mobile,Firefox,Linux,unknown,0,2024-10-13 10:52
E001872,U001793,doc_delete,,2023-04-23 6:58,,,,783,0,2023-04-23 6:58
E003873,U001797,DOC_DELETE,,05/20/2025 07:14,desktop,Edge,,unknown,FALSE,2025-05-20 7:14
E000935,U001177,share,,04/08/2023 07:47,,Safari,Linux,,FALSE,2023-04-08 7:47
E007146,U000373,share,,03/10/2025 01:04,mobile,Safari,Windows,,,2025-03-10 1:04
E007338, USR-000314 ,login,/help,01/23/2023 21:43,mobile,Firefox,macOS,,,2023-01-23 21:43
E000753,U000119,ai_search,,08/18/2024 03:18,,Edge,macOS,,TRUE,2024-08-18 3:18
E004331,U000321,doc_delete,,2023-12-07 23:55,tablet,Safari,,unknown,FALSE,2023-12-07 23:55
E002574,U002005,export,,2023-06-20 23:04,mobile,Safari,Windows,unknown,1,2023-06-20 23:04
E007085,U001221,logout,/billing,2025-04-06,desktop,,macOS,unknown,FALSE,2025-04-06 14:03
E007207,U001158,export,,12/24/2023 07:45,tablet,Brave,Android,unknown,FALSE,2023-12-24 7:45
E004536,U001620,integration_error,,02/22/2024 12:14,mobile,,,,FALSE,2024-02-22 12:14
E006441,U001895,doc_create,,01/31/2025 19:55,mobile,Brave,Android,unknown,,2025-01-31 19:55
E003087,U001583,doc_create,,2023-12-21 12:40,,Firefox,Linux,,1,2023-12-21 12:40
E005864,U001835,page_view,/pricing,2023-04-14,,Safari,,420,0,2023-04-14 14:50
E003969,U001896,comment,,2024-03-11 1:38,,Chrome,,1336,TRUE,2024-03-11 1:38
E007087,U002572,page_view,/dashboard,2025-04-26 12:51,DESKTOP,,macOS,1123,0,2025-04-26 12:51
E004248,U000962,comment,,06/11/2024 09:06,,,Android,,,2024-06-11 9:06
E002129,U000563,doc_create,,2024-03-28 4:08,mobile,Edge,Windows,223,,2024-03-28 4:08
E006035,U000435,login,/help,2024-09-26,mobile,,macOS,unknown,,2024-09-26 18:55
E000571,U000592,doc_delete,,03/26/2023 00:26,desktop,,Windows,,,2023-03-26 0:26
E004277,u002236,INTEGRATION_CONNECT,,2024-11-29 17:44,mobile,Edge,Windows,,FALSE,2024-11-29 17:44
E000179,U000418,doc_create,,2023-01-12 1:43,mobile,Firefox,iOS,,,2023-01-12 1:43
E003123,U001814,doc_create,,07/20/2023 13:41,,,Linux,,TRUE,2023-07-20 13:41
E007427,U002386,export,,2024-07-19 19:53,mobile,Brave,,,FALSE,2024-07-19 19:53
E000945,U000298,share,,2024-06-24 19:16,,Firefox,Windows,,0,2024-06-24 19:16
E000206,U000518,login,/dashboard,0000-00-00 00:00:00,,,Windows,,FALSE,2023-06-27 12:31
E007955,u002338,page_view,/integrations,2023-11-28 3:34,desktop,Brave,Windows,,FALSE,2023-11-28 3:34
E002723,U000930,doc_edit,,,DESKTOP,,,119,TRUE,2023-01-27 15:09
E005170,U002169,share,,2024-01-27 22:03,mobile,Firefox,,,TRUE,2024-01-27 22:03
E000795,U000222,export,,04/18/2023 12:27,tablet,Firefox,,,FALSE,2023-04-18 12:27
E007155,u002246,logout,/docs,06/21/2024 01:38,,Firefox,Windows,,,2024-06-21 1:38
E006176,U001249,export,,0000-00-00 00:00:00,desktop,,Linux,unknown,TRUE,2024-12-18 13:34
E005815,U002326,ai_search,,2023-05-22 8:31,,Edge,Linux,unknown,,2023-05-22 8:31
E008691,U001473,logout,/billing,10/05/2024 20:09,desktop,Safari,macOS,unknown,FALSE,2024-10-05 20:09
E005887,U001354,share,,06/02/2023 11:16,tablet,,,,1,2023-06-02 11:16
E007726,USR-002024,page_view,/search,2023-04-11 11:34,,,Android,1793,FALSE,2023-04-11 11:34
E006787,U001386,integration_connect,,10/06/2024 21:13,,Safari,Linux,unknown,FALSE,2024-10-06 21:13
E003198,U001615,doc_edit,,09/01/2023 06:33,DESKTOP,Chrome,Windows,87,FALSE,2023-09-01 6:33
E006885,U001842,page_view,/onboarding,2024-01-05,mobile,Chrome,Android,unknown,TRUE,2024-01-05 5:25
E002505,U001295,doc_delete,,2023-09-03,,Edge,Android,unknown,TRUE,2023-09-03 20:20
E003630,USR-002584,integration_connect,,2024-02-21 6:58,,,iOS,unknown,,2024-02-21 6:58
E003064,U001184,export,,2023-04-29,,Brave,Windows,unknown,FALSE,2023-04-29 9:58
E004864,u002188,doc_edit,,,tablet,Firefox,Windows,,FALSE,2023-02-20 0:47
E004715,U001193,page_view,/settings,2023-12-08 22:19,,,,,FALSE,2023-12-08 22:19
E006916,U002540,AI_SEARCH,,,mobile,Brave,macOS,706,FALSE,2024-11-22 17:17
E002738,U002217,doc_create,,2025-06-09 13:29,mobile,Edge,Windows,,TRUE,2025-06-09 13:29
E000701,U001192,login,/billing,2025-01-20 2:21,tablet,,iOS,,0,2025-01-20 2:21
E000620,U001850,login,/dashboard,2023-08-21,,Chrome,Android,64,,2023-08-21 9:52
E003448,U001369,share,,2023-04-20 8:44,DESKTOP,Firefox,macOS,,TRUE,2023-04-20 8:44
E008053,U001110,search,,2023-12-08 23:05,,Edge,iOS,1419,TRUE,2023-12-08 23:05
E000685,U000064,search,,04/10/2025 02:03,desktop,Safari,,,FALSE,2025-04-10 2:03
E008104,U000718,comment,,2023-09-12,desktop,Brave,Linux,unknown,,2023-09-12 20:00
E008264,U002438,doc_create,,2023-04-06,,,,,0,2023-04-06 0:47
E008316,U002383,search,,2023-04-14,desktop,Edge,,,1,2023-04-14 4:24
E004126,U000071,logout,/billing,0000-00-00 00:00:00,DESKTOP,Chrome,Linux,,TRUE,2023-09-24 9:38
 E000456,U000860,page_view,/dashboard,2023-09-05 18:07,,Chrome,,1161,0,2023-09-05 18:07
E000266,U001986,search,,,desktop,,Linux,,0,2025-06-05 23:57
E006461,U000472,page_view,/dashboard,,tablet,Firefox,,1099,,2025-02-12 19:03
E004269,U000987,logout,/billing,2024-07-27,desktop,,Android,1268,FALSE,2024-07-27 3:35
E008000,U000686,doc_delete,,05/28/2024 02:11,DESKTOP,Safari,iOS,,TRUE,2024-05-28 2:11
E006438,U001559,LOGIN,/docs,2023-12-04,,Chrome,,326,1,2023-12-04 2:56
E006293,U001588,integration_error,,2023-10-02 0:07,DESKTOP,,,,FALSE,2023-10-02 0:07
E002998,u000665,comment,,2023-03-10 9:50,DESKTOP,Firefox,Android,,1,2023-03-10 9:50
E005155,U000690,share,,2023-11-16 23:05,tablet,Brave,,1578,TRUE,2023-11-16 23:05
E007610,U002514,doc_edit,,0000-00-00 00:00:00,,Chrome,Windows,,TRUE,2023-04-13 14:07
E008655, u000506 ,page_view,/admin,,mobile,Chrome,macOS,,TRUE,2025-06-11 7:15
E003308,U001307,doc_edit,,,tablet,,Android,,,2024-04-13 19:58
E001082,U000338,login,/admin,2024-07-04,tablet,Edge,Android,,1,2024-07-04 19:25
E003781,U001009,share,,10/23/2023 23:56,,Brave,Linux,,FALSE,2023-10-23 23:56
E006321,U001450,comment,,02/03/2025 11:18,desktop,Brave,Linux,947,TRUE,2025-02-03 11:18
E008493,U001139,login,/dashboard,2024-08-06 12:08,desktop,,iOS,40,TRUE,2024-08-06 12:08
e003645,U002207,integration_connect,,2024-11-04 5:52,,,Windows,unknown,,2024-11-04 5:52
E000717,U001531,doc_edit,,0000-00-00 00:00:00,,,macOS,,,2023-08-22 11:30
E008236,U000629,integration_error,,2025-01-22,tablet,Brave,macOS,unknown,FALSE,2025-01-22 12:22
E008564,U001252,share,,2025-01-23 1:47,DESKTOP,Firefox,,111,TRUE,2025-01-23 1:47
E008340,U002285,integration_error,,05/23/2024 02:33,,Firefox,Windows,unknown,FALSE,2024-05-23 2:33
E002398,U002082,integration_error,,2024-08-01 7:54,,Safari,macOS,,1,2024-08-01 7:54
E003241,U002559,doc_edit,,2025-06-10 14:46,,Edge,Windows,,FALSE,2025-06-10 14:46
e000180,U000019,share,,04/10/2023 11:03,DESKTOP,Chrome,,,0,2023-04-10 11:03
E004891,U001326,integration_error,,,DESKTOP,Edge,,1025,1,2024-09-15 9:05
E002230,U002433,integration_connect,,05/03/2024 10:38,,,,,0,2024-05-03 10:38
E003167,U001145,export,,2024-06-26,,Firefox,macOS,,,2024-06-26 14:20
E007049,U002360,share,,,DESKTOP,Brave,macOS,,TRUE,2024-02-10 15:24
E001682,U000036,integration_connect,,2023-07-14 10:10,desktop,Chrome,Windows,,FALSE,2023-07-14 10:10
 E002000,U001238,login,/dashboard,2023-04-28,mobile,Safari,Windows,unknown,TRUE,2023-04-28 12:26
E006251,U001022,DOC_EDIT,,,tablet,Brave,macOS,847,TRUE,2025-04-23 11:58
E002685,U000586,ai_search,,06/05/2024 07:53,,,iOS,,,2024-06-05 7:53
E003898,U000426,page_view,/docs,09/16/2024 03:20,desktop,,iOS,unknown,,2024-09-16 3:20
E004848,U002143,comment,,,tablet,Safari,,,0,2024-10-14 14:21
E001135,U000809,doc_edit,,0000-00-00 00:00:00,DESKTOP,,,,TRUE,2024-07-25 10:30
E004066, U000696 ,comment,,,,,,1212,FALSE,2025-05-28 4:27
E004974,u002167,ai_search,,2025-04-18,tablet,Edge,macOS,,FALSE,2025-04-18 17:43
E008031,U001479,doc_create,,12/06/2023 07:49,,Safari,iOS,,,2023-12-06 7:49
E001574,U000460,doc_edit,,10/28/2024 16:02,DESKTOP,Edge,Android,,FALSE,2024-10-28 16:02
E006252,U000238,doc_create,,2023-10-17,,Firefox,Android,1583,,2023-10-17 20:49
E003115,U000729,export,,2025-01-23,desktop,,Android,447,TRUE,2025-01-23 10:43
E001895,U001145,login,/settings,04/20/2023 05:01,tablet,Brave,,unknown,TRUE,2023-04-20 5:01
E006007,U000237,integration_error,,,DESKTOP,,,unknown,FALSE,2024-04-06 0:20
E007992,U000168,doc_create,,2023-08-08,,Brave,,unknown,,2023-08-08 6:01
E000368,U002560,integration_error,,2025-04-07,DESKTOP,,macOS,1434,,2025-04-07 1:38
E002640,U000808,page_view,/docs,,desktop,,,232,,2024-04-09 10:48
E005650,U001969,integration_connect,,,desktop,Brave,,unknown,,2025-05-24 1:20
E001112,U001920,integration_connect,,09/22/2023 00:07,,Brave,iOS,,FALSE,2023-09-22 0:07
E005858,U000250,login,/settings,2023-09-27,DESKTOP,,Linux,,FALSE,2023-09-27 4:41
E003093,U002288,integration_error,,0000-00-00 00:00:00,mobile,,Linux,,FALSE,2023-04-27 17:40
E006028,U001745,logout,/pricing,2024-04-15,,Safari,iOS,,TRUE,2024-04-15 20:29
E006202,U000376,doc_edit,,2024-05-05,desktop,Safari,Android,,TRUE,2024-05-05 7:55
E002549,U000973,doc_delete,,2024-09-04 7:49,DESKTOP,,iOS,,FALSE,2024-09-04 7:49
E006079,U002569,export,,07/01/2023 20:30,mobile,,Windows,695,0,2023-07-01 20:30
E006855,U001710,doc_edit,,2024-10-09 22:25,,Firefox,Linux,,0,2024-10-09 22:25
E005000,U001348,export,,,desktop,Edge,Android,,TRUE,2023-10-23 16:43
E003861,U001345,integration_error,,01/23/2024 12:21,,Brave,Windows,820,FALSE,2024-01-23 12:21
E006863,U001853,doc_create,,11/08/2023 15:28,tablet,,Windows,unknown,FALSE,2023-11-08 15:28
E003910,U000572,page_view,/admin,04/01/2024 19:04,,,,,,2024-04-01 19:04
E002334,U000022,comment,,04/10/2025 22:46,DESKTOP,,macOS,877,,2025-04-10 22:46
E002395,U000828,doc_edit,,07/04/2024 19:59,mobile,Brave,,174,FALSE,2024-07-04 19:59
E002422,U001788,search,,2023-08-26 6:33,,,Windows,,FALSE,2023-08-26 6:33
E007447,U001301,search,,05/23/2023 04:45,desktop,Firefox,iOS,unknown,FALSE,2023-05-23 4:45
e007241,U001042,logout,/onboarding,2024-04-19 20:39,tablet,,macOS,246,TRUE,2024-04-19 20:39
E000304,U000461,ai_search,,2023-02-21,,Chrome,Windows,,,2023-02-21 0:11
E001188,U001883,integration_error,,02/10/2023 05:50,DESKTOP,Chrome,,,TRUE,2023-02-10 5:50
E005911, U000048 ,logout,/dashboard,07/12/2023 06:35,desktop,Chrome,Windows,,,2023-07-12 6:35
E007650,U001226,ai_search,,2023-02-11,mobile,,macOS,,0,2023-02-11 5:15
E007596,u000810,login,/onboarding,0000-00-00 00:00:00,tablet,Safari,iOS,,,2023-08-13 11:38
E007976,U001082,login,/admin,05/22/2023 19:31,DESKTOP,,macOS,,,2023-05-22 19:31
E003445,U001625,ai_search,,2023-01-09 19:33,tablet,,macOS,unknown,FALSE,2023-01-09 19:33
E002949,U002520,export,,2023-08-21,mobile,Chrome,Linux,,FALSE,2023-08-21 8:44
E001575,U001086,comment,,2024-11-06 3:18,tablet,,Windows,unknown,1,2024-11-06 3:18
E000090,U000735,share,,,DESKTOP,Safari,,unknown,TRUE,2025-01-20 0:57
E002532,U000996,share,,2024-10-26 22:20,,,Android,unknown,FALSE,2024-10-26 22:20
E003630,U002323,doc_delete,,09/17/2023 13:17,,Brave,Android,,,2023-09-17 13:17
E003967,U002222,ai_search,,05/18/2024 10:00,mobile,Firefox,macOS,unknown,TRUE,2024-05-18 10:00
E004391,U000875,ai_search,,2024-01-22,tablet,Brave,iOS,unknown,TRUE,2024-01-22 6:54
E003445,U001644,page_view,/dashboard,08/10/2024 00:20,,Chrome,macOS,,1,2024-08-10 0:20
E005949,U002140,comment,,03/13/2023 17:33,,Brave,Android,,FALSE,2023-03-13 17:33
E000220,U001423,login,/help,,mobile,Safari,iOS,,TRUE,2024-09-16 3:23
E002710,U000340,doc_create,,0000-00-00 00:00:00,,,,,FALSE,2024-09-16 6:00
E003957,U002185,login,/help,,mobile,,Linux,,FALSE,2023-03-12 3:02
E004729,U002219,search,,06/28/2023 07:59,desktop,Firefox,iOS,unknown,,2023-06-28 7:59
E001678,U001581,comment,,,DESKTOP,Chrome,Android,142,0,2024-03-05 10:33
E007107,U002264,login,/settings,05/29/2023 05:43,,Chrome,,unknown,1,2023-05-29 5:43
E001980,USR-001988,comment,,2024-11-18 15:45,DESKTOP,Safari,,unknown,FALSE,2024-11-18 15:45
E005395,U000002,export,,2024-11-28 23:12,desktop,,Android,1025,TRUE,2024-11-28 23:12
E006037,U001131,logout,/onboarding,2024-06-12,,Safari,Linux,,TRUE,2024-06-12 7:43
E005362, U000181 ,ai_search,,2023-09-05 3:31,,Firefox,iOS,,FALSE,2023-09-05 3:31
E004766,U002398,ai_search,,10/17/2024 08:45,desktop,,,,,2024-10-17 8:45
E004681,U000253,login,/pricing,,mobile,Safari,iOS,unknown,TRUE,2025-03-12 12:46
E000717,U001800,doc_delete,,11/06/2023 06:53,mobile,,iOS,26,TRUE,2023-11-06 6:53
E007546,u002251,page_view,/dashboard,2024-08-08,mobile,Edge,macOS,unknown,0,2024-08-08 5:13
E005817,U002527,logout,/onboarding,2023-10-11 2:12,,,,1423,TRUE,2023-10-11 2:12
E001297,USR-001874,search,,12/19/2024 02:49,,,,,TRUE,2024-12-19 2:49
E003462,U002252,doc_create,,02/24/2024 18:40,mobile,,macOS,,FALSE,2024-02-24 18:40
E007264,U002314,share,,,mobile,Edge,iOS,unknown,TRUE,2024-12-20 6:40
E003373,U001970,DOC_EDIT,,2023-02-16 4:38,mobile,Safari,Linux,unknown,FALSE,2023-02-16 4:38
E002935,U000758,integration_connect,,0000-00-00 00:00:00,,,,,0,2025-02-28 22:48
E000391,U001929,integration_connect,,0000-00-00 00:00:00,,Brave,,,TRUE,2024-11-28 2:17
E001822,U001117,doc_edit,,2024-04-12,tablet,Firefox,,unknown,TRUE,2024-04-12 13:15
E001301,U000776,page_view,/docs,2023-06-01,mobile,Firefox,,,1,2023-06-01 14:39
 e002347,u000562,search,,,desktop,Safari,Android,,TRUE,2023-11-27 17:55
E003117,U001544,doc_delete,,,tablet,Brave,,,0,2025-05-10 12:30
E002401, U000400 ,doc_edit,,02/15/2024 09:33,tablet,,Android,183,1,2024-02-15 9:33
E007415, U001640 ,INTEGRATION_ERROR,,,tablet,Edge,iOS,,FALSE,2025-02-20 20:40
E001961,U001196,logout,/dashboard,2024-08-21 9:59,DESKTOP,Chrome,Linux,,FALSE,2024-08-21 9:59
E007019,U001858,share,,,mobile,Chrome,Windows,unknown,FALSE,2025-02-02 10:25
E002238,U002196,integration_error,,05/22/2025 15:03,,Safari,Android,1675,TRUE,2025-05-22 15:03
E001916,U001895,page_view,/docs,11/24/2024 00:49,mobile,,Linux,,FALSE,2024-11-24 0:49
E008884,U001245,doc_delete,,2024-09-01 19:59,DESKTOP,,Linux,,,2024-09-01 19:59
E005614,U001523,doc_delete,,2024-12-20 21:18,tablet,Chrome,Android,,0,2024-12-20 21:18
E008952,U002195,share,,2023-03-28 10:18,DESKTOP,,Windows,,,2023-03-28 10:18
E008514,U001217,integration_error,,2023-09-09,,Chrome,Android,,TRUE,2023-09-09 21:03
E007993,U001487,page_view,/help,2024-12-22 4:46,,Firefox,Linux,1329,0,2024-12-22 4:46
E005127,U001634,export,,,,Chrome,Linux,,,2025-05-22 6:29
E003491,U000427,doc_edit,,10/19/2024 04:40,,,iOS,unknown,,2024-10-19 4:40
E003080,U000056,page_view,/admin,2024-06-30 17:06,DESKTOP,Safari,Linux,,1,2024-06-30 17:06
E005364, U000103 ,ai_search,,2023-09-28,DESKTOP,Edge,,,,2023-09-28 7:49
E000099,U000858,integration_error,,04/07/2025 15:25,,Edge,iOS,,,2025-04-07 15:25
E004945,u001438,integration_connect,,2024-11-12 0:59,,Safari,iOS,unknown,0,2024-11-12 0:59
E006900,U000072,doc_create,,2023-01-13,mobile,,iOS,,,2023-01-13 7:15
 E001411,U000968,ai_search,,,DESKTOP,Safari,,unknown,FALSE,2025-02-14 3:51
E002704,U002468,search,,2023-01-21,tablet,Brave,iOS,,,2023-01-21 6:52
E007707,U001171,search,,11/26/2024 09:02,mobile,,,882,TRUE,2024-11-26 9:02
E007710,U000793,doc_delete,,2025-03-31 12:59,desktop,,,,,2025-03-31 12:59
E005816,U001933,logout,/admin,2025-06-13,mobile,Edge,Windows,,,2025-06-13 0:29
E004323,U001174,search,,11/02/2024 18:21,DESKTOP,Firefox,Linux,unknown,FALSE,2024-11-02 18:21
e006440,U001176,ai_search,,2024-11-30 18:07,desktop,,,1076,,2024-11-30 18:07
E006144,USR-000358,integration_error,,02/26/2023 08:49,tablet,,Windows,939,,2023-02-26 8:49
E000848,U000638,doc_create,,2024-05-27 18:52,,Safari,macOS,,TRUE,2024-05-27 18:52
E008766,U002212,doc_edit,,2024-11-08,desktop,,Windows,,TRUE,2024-11-08 2:07
E002910,U001063,ai_search,,08/31/2024 19:23,,Chrome,,,0,2024-08-31 19:23
e007921,U000080,search,,2024-05-11 19:43,tablet,Firefox,Linux,,TRUE,2024-05-11 19:43
E000263,U000021,login,/billing,2023-01-24,desktop,,,unknown,TRUE,2023-01-24 0:34
E003790,U001596,integration_error,,2025-06-17 7:00,desktop,Chrome,,707,TRUE,2025-06-17 7:00
E003511,U000955,doc_create,,2023-01-26 23:31,mobile,Brave,,,,2023-01-26 23:31
E005432,U001179,doc_delete,,,,Edge,Windows,308,,2023-03-16 17:53
E006475,U000419,login,/search,2023-03-10,DESKTOP,Edge,macOS,unknown,TRUE,2023-03-10 20:35
E006577,U000572,doc_delete,,2024-03-12,tablet,Edge,Windows,,FALSE,2024-03-12 21:29
E007182,u001841,integration_error,,04/26/2025 02:20,DESKTOP,Firefox,Android,,FALSE,2025-04-26 2:20
E003944,U001774,page_view,/docs,03/01/2025 14:18,desktop,Edge,Windows,,FALSE,2025-03-01 14:18
E008062,U002463,search,,12/22/2023 22:21,DESKTOP,Chrome,,,0,2023-12-22 22:21
E005304,U002257,doc_delete,,2024-10-09,desktop,Brave,,unknown,TRUE,2024-10-09 9:47
E006259,U002497,export,,2024-05-20 7:57,mobile,Safari,,,FALSE,2024-05-20 7:57
e006038,U000391,login,/docs,0000-00-00 00:00:00,DESKTOP,Firefox,Windows,,0,2025-05-21 4:58
E003602,U002477,doc_delete,,11/17/2023 14:43,,Edge,,,,2023-11-17 14:43
E002692,U001117,export,,,,,Windows,,1,2025-03-18 22:11
E002302,U000097,export,,2023-10-07,DESKTOP,Safari,Android,,TRUE,2023-10-07 4:23
E008440,U000571,doc_create,,,DESKTOP,Firefox,macOS,,TRUE,2024-03-27 1:17
E001053,U000267,doc_edit,,2024-06-02,desktop,Edge,Android,,0,2024-06-02 0:36
E008770,U001602,doc_edit,,09/07/2023 05:37,mobile,,,,FALSE,2023-09-07 5:37
E002216,U001410,share,,2023-02-20 17:16,desktop,Edge,macOS,unknown,0,2023-02-20 17:16
E008993,U000009,doc_edit,,2024-01-03 23:35,mobile,Brave,Linux,,FALSE,2024-01-03 23:35
E002244,U000316,doc_create,,04/04/2023 06:39,mobile,Brave,,,,2023-04-04 6:39
E007659,U000782,doc_delete,,,desktop,Edge,Windows,1130,FALSE,2023-06-16 8:49
E006074,U000131,logout,/integrations,,desktop,Firefox,Android,unknown,,2023-07-31 6:01
E006040,U000717,integration_connect,,2024-02-24 18:12,tablet,Edge,macOS,,FALSE,2024-02-24 18:12
E006962,u000200,export,,2025-01-14,DESKTOP,Chrome,Windows,718,TRUE,2025-01-14 16:32
E005933,U000047,logout,/billing,2024-03-23 17:08,tablet,Safari,Windows,891,0,2024-03-23 17:08
E008234,U001233,doc_edit,,2024-08-02,mobile,Chrome,macOS,,0,2024-08-02 22:12
 E001092,U002453,doc_delete,,,tablet,Edge,macOS,,1,2024-08-24 13:42
E001563,U000705,integration_connect,,04/22/2023 18:19,DESKTOP,,Linux,,0,2023-04-22 18:19
e001500,U000351,doc_delete,,06/21/2024 15:05,,Edge,Windows,unknown,0,2024-06-21 15:05
E004985,U000703,search,,2023-01-04,DESKTOP,Edge,macOS,,1,2023-01-04 7:55
E002227,U001747,ai_search,,2024-09-11,tablet,Chrome,Linux,unknown,FALSE,2024-09-11 6:21
E007711,U002195,doc_edit,,09/26/2023 23:13,mobile,,iOS,1431,,2023-09-26 23:13
e004645,U001462,login,/settings,05/13/2025 18:04,DESKTOP,Edge,Android,327,1,2025-05-13 18:04
E000831,U002589,logout,/admin,,desktop,,macOS,,,2023-08-23 3:08
E007294,U001490,search,,04/22/2025 22:38,DESKTOP,,macOS,,TRUE,2025-04-22 22:38
E005670,U000753,SHARE,,2025-01-30,desktop,Chrome,,unknown,FALSE,2025-01-30 2:16
E001620,U002557,login,/help,2023-04-24,,Edge,iOS,unknown,TRUE,2023-04-24 14:15
E000642,U002594,doc_delete,,2023-03-09 23:56,desktop,,,,,2023-03-09 23:56
E006785,U001999,export,,08/13/2023 11:53,mobile,,,,,2023-08-13 11:53
E005460,U002020,doc_delete,,12/01/2023 19:55,DESKTOP,Safari,,1730,1,2023-12-01 19:55
E000729,U000637,logout,/docs,2024-03-10,desktop,Safari,,unknown,FALSE,2024-03-10 19:14
E007394,U001354,integration_connect,,,,Chrome,iOS,,,2023-08-03 16:47
e005392,U002090,integration_error,,,,Chrome,,,FALSE,2024-05-20 18:42
E002218,U001571,comment,,,DESKTOP,,Windows,,,2025-02-04 23:53
E004831,U000335,doc_delete,,10/08/2023 13:00,tablet,Safari,iOS,unknown,FALSE,2023-10-08 13:00
E007466,U002015,doc_edit,,2025-04-20 23:56,,Safari,Android,1047,FALSE,2025-04-20 23:56
E008785,U001872,login,/admin,2024-09-11,desktop,,Android,,0,2024-09-11 11:08
E005629,U002278,logout,/pricing,2023-06-03 2:35,,,iOS,unknown,,2023-06-03 2:35
E000134,U000570,PAGE_VIEW,/search,0000-00-00 00:00:00,DESKTOP,Chrome,macOS,unknown,TRUE,2024-08-14 16:42
E005936,U000973,share,,06/08/2023 06:54,desktop,Brave,Linux,333,0,2023-06-08 6:54
E007962,U001316,doc_delete,,,desktop,,Linux,,0,2023-05-11 8:06
E002923,U002542,share,,2024-10-26,,,Windows,18,TRUE,2024-10-26 1:25
E004217,u000529,search,,2023-01-14 3:43,mobile,Chrome,Windows,unknown,FALSE,2023-01-14 3:43
E004478,U001989,share,,2023-03-06 11:05,DESKTOP,Edge,,,0,2023-03-06 11:05
E004566,U001423,doc_delete,,0000-00-00 00:00:00,tablet,Brave,Linux,unknown,0,2023-12-24 2:11
E003660,U000002,search,,,DESKTOP,Safari,Android,unknown,FALSE,2025-01-30 9:08
E002212, U002491 ,comment,,09/10/2023 23:06,DESKTOP,Edge,Android,,,2023-09-10 23:06
E007921, U001040 ,integration_connect,,2024-05-26,tablet,Edge,Linux,,FALSE,2024-05-26 13:03
E002739,U000767,ai_search,,,,,,,,2024-01-26 19:05
E008103,U002489,doc_create,,08/16/2024 23:21,tablet,Brave,Windows,1543,TRUE,2024-08-16 23:21
E001160,U000810,integration_connect,,12/31/2024 20:24,,Firefox,Android,1315,,2024-12-31 20:24
E001101,U001156,integration_connect,,07/01/2024 11:46,,,,,TRUE,2024-07-01 11:46
E008683,U001816,doc_edit,,0000-00-00 00:00:00,desktop,,Linux,,1,2023-07-16 6:54
E007756,USR-002014,doc_delete,,2024-06-20,desktop,Edge,Windows,,1,2024-06-20 5:10
E005715,U001959,export,,0000-00-00 00:00:00,mobile,Safari,Android,,1,2023-03-31 3:40
e008714,U001738,doc_edit,,,mobile,,Android,,TRUE,2024-08-19 15:18
E001905,u000124,login,/docs,0000-00-00 00:00:00,DESKTOP,Safari,,,FALSE,2024-02-07 4:16
E000391,U001247,integration_error,,2025-03-01,mobile,Safari,Android,unknown,,2025-03-01 15:38
E000429,U000005,logout,/admin,2024-03-17,DESKTOP,,Android,,,2024-03-17 15:31
E002500,U001246,logout,/pricing,2025-01-15,desktop,Chrome,Linux,1033,,2025-01-15 15:13
E005570,U001629,export,,0000-00-00 00:00:00,tablet,Chrome,Windows,1634,1,2023-04-01 19:41
E001801,U001285,share,,2025-02-27,,,macOS,,,2025-02-27 16:01
E008960,U000312,doc_edit,,2024-10-20,,,,unknown,FALSE,2024-10-20 13:32
E003113,U000811,integration_error,,09/17/2023 04:17,,Safari,Linux,,FALSE,2023-09-17 4:17
E006386,u002299,comment,,09/06/2024 21:07,tablet,Edge,iOS,unknown,TRUE,2024-09-06 21:07
E005828,U000618,integration_connect,,,,Safari,Android,,,2023-10-30 11:46
E005073,USR-001762,page_view,/settings,2024-11-21 22:16,tablet,Edge,Windows,,,2024-11-21 22:16
E005936,U002052,doc_delete,,04/17/2024 01:24,desktop,Brave,Linux,340,,2024-04-17 1:24
E003022,U002555,doc_create,,2024-10-07 5:33,,Edge,iOS,468,TRUE,2024-10-07 5:33
E002081,U000002,login,/integrations,12/13/2023 02:40,tablet,Safari,,,TRUE,2023-12-13 2:40
E001883,U002551,doc_delete,,2025-05-22,desktop,Edge,,unknown,0,2025-05-22 13:51
E000406,U002100,doc_delete,,2024-06-08 6:02,,Firefox,iOS,,,2024-06-08 6:02
E001309,U002310,doc_delete,,2025-04-23,DESKTOP,Safari,Linux,,0,2025-04-23 14:14
E000091,U002130,doc_edit,,2025-04-08,desktop,Safari,iOS,,FALSE,2025-04-08 11:26
E000229,U001512,export,,,,,Android,,TRUE,2023-01-19 8:29
E008949,U001283,logout,/admin,,tablet,Brave,,,FALSE,2024-10-31 18:14
E005204,U002270,doc_create,,2025-05-17 12:39,desktop,,Android,unknown,FALSE,2025-05-17 12:39
E006252,U002224,login,/dashboard,2023-01-24,tablet,Brave,Linux,unknown,,2023-01-24 11:08
E002647,U001128,search,,08/04/2023 16:55,,Safari,,,,2023-08-04 16:55
E007562,U001714,page_view,/admin,04/08/2023 02:59,mobile,,iOS,,TRUE,2023-04-08 2:59
E008940,U000633,doc_create,,2024-01-21,mobile,Chrome,,unknown,,2024-01-21 9:11
E001735,U000713,integration_error,,2023-02-04 5:28,tablet,Brave,Linux,unknown,1,2023-02-04 5:28
E003848,U001615,integration_connect,,,mobile,,Android,unknown,FALSE,2023-08-12 1:59
E000021,U000081,search,,03/03/2024 17:03,mobile,Edge,macOS,,,2024-03-03 17:03
E008567,U002013,doc_create,,2024-08-20 23:25,tablet,Safari,Linux,unknown,TRUE,2024-08-20 23:25
E000399,U002206,integration_error,,2023-06-08 0:03,,,iOS,,,2023-06-08 0:03
E007453,U001490,doc_create,,2025-02-23 10:03,DESKTOP,,iOS,,,2025-02-23 10:03
E003303,U000500,comment,,0000-00-00 00:00:00,DESKTOP,Firefox,iOS,unknown,,2025-03-17 18:06
E008727,U002591,logout,/search,2023-03-11 14:11,,,iOS,unknown,0,2023-03-11 14:11
E006113,U000731,doc_delete,,2024-07-18 18:42,desktop,,macOS,,0,2024-07-18 18:42
E000158,U001660,share,,2023-04-21,desktop,Safari,Android,,0,2023-04-21 3:18
E004254,U001805,INTEGRATION_CONNECT,,12/31/2024 21:26,desktop,,Windows,1308,0,2024-12-31 21:26
E005012,U001491,integration_connect,,10/13/2024 01:18,DESKTOP,Brave,macOS,unknown,FALSE,2024-10-13 1:18
E004127,U001166,logout,/settings,,DESKTOP,,,,FALSE,2025-03-07 21:51
E006366,U001176,search,,04/26/2023 16:06,desktop,,Android,12,TRUE,2023-04-26 16:06
E008382,U001620,doc_create,,,,Firefox,Android,1296,TRUE,2025-03-22 14:11
E000780,U002377,share,,2023-10-09,,Chrome,,,,2023-10-09 15:36
E000544,U002522,share,,05/01/2024 03:32,,Safari,Windows,298,FALSE,2024-05-01 3:32
E004324,U001827,logout,/help,03/01/2025 09:44,DESKTOP,Safari,iOS,,,2025-03-01 9:44
E004411,U001458,integration_connect,,2023-05-19,,,,unknown,TRUE,2023-05-19 8:54
E004377,U001777,search,,2024-02-06 16:25,tablet,,macOS,,FALSE,2024-02-06 16:25
E006123, U000990 ,doc_delete,,,tablet,Safari,Android,378,,2024-04-14 20:44
E006134,U002047,integration_error,,06/17/2024 19:24,desktop,Firefox,iOS,,,2024-06-17 19:24
E005117,U002566,comment,,10/03/2024 14:18,tablet,Edge,Android,,0,2024-10-03 14:18
E004432,U001614,ai_search,,03/26/2023 05:37,,Safari,,,0,2023-03-26 5:37
E006622,U002056,doc_create,,03/25/2025 18:15,tablet,Chrome,iOS,unknown,1,2025-03-25 18:15
E001523,U001961,doc_create,,2025-01-16 5:57,desktop,Firefox,Android,unknown,0,2025-01-16 5:57
E007960,U001019,logout,/admin,02/14/2025 18:16,desktop,Firefox,Windows,460,,2025-02-14 18:16
E007418,U000469,comment,,2025-03-13,DESKTOP,Safari,Android,1663,,2025-03-13 5:28
E000031,u002251,search,,06/19/2024 04:49,tablet,Brave,iOS,443,FALSE,2024-06-19 4:49
E008160,U001420,doc_edit,,02/01/2025 13:41,mobile,Brave,,,TRUE,2025-02-01 13:41
E006577,U001735,integration_error,,2024-08-05,,Safari,iOS,,,2024-08-05 6:50
E003748,U001886,doc_edit,,05/10/2023 03:52,,,Linux,429,1,2023-05-10 3:52
E008475,U001477,share,,,desktop,Chrome,,,,2023-06-28 9:23
e001865,U000929,integration_error,,12/21/2024 16:50,desktop,Safari,Android,,FALSE,2024-12-21 16:50
E008258,U001465,ai_search,,2024-08-21 6:57,desktop,,iOS,,FALSE,2024-08-21 6:57
E002754,U000841,share,,2023-04-12 18:04,desktop,Edge,,169,TRUE,2023-04-12 18:04
E000914,U001661,integration_error,,05/09/2023 19:39,,Firefox,iOS,,FALSE,2023-05-09 19:39
E005326,U002121,doc_delete,,2024-10-05 15:15,DESKTOP,Brave,Android,,FALSE,2024-10-05 15:15
E001571,U001193,integration_connect,,0000-00-00 00:00:00,,Firefox,,unknown,0,2025-03-17 16:49
E007455, u000969 ,ai_search,,,mobile,,iOS,,1,2023-09-13 19:49
E000795,U000180,share,,2023-01-08,,Edge,macOS,44,1,2023-01-08 18:12
E005984,u000414,logout,/admin,0000-00-00 00:00:00,,Chrome,,,,2023-08-23 8:31
E001447,U000668,comment,,2023-06-25 6:56,tablet,Edge,macOS,unknown,1,2023-06-25 6:56
E006316,U000099,page_view,/dashboard,07/27/2024 14:05,,Safari,Linux,,,2024-07-27 14:05
E004402,U001756,comment,,2024-08-18,,,iOS,1415,TRUE,2024-08-18 4:55
E001937,U002424,export,,2023-08-07,desktop,,Windows,,,2023-08-07 22:18
E006422,U000882,doc_delete,,2025-03-28 19:31,desktop,,,,TRUE,2025-03-28 19:31
E000191, U001559 ,search,,2023-04-13,,,,,,2023-04-13 15:24
E005517,U000058,doc_create,,2024-01-09,mobile,Brave,,,FALSE,2024-01-09 1:37
E007984,U000422,export,,2023-02-12,,Chrome,iOS,1229,,2023-02-12 15:36
E008285,U001195,doc_create,,,tablet,Firefox,macOS,856,,2025-05-17 4:44
E003662,USR-000922,doc_delete,,2024-07-02 23:18,DESKTOP,Edge,Windows,,TRUE,2024-07-02 23:18
E004456,U000424,doc_delete,,2024-03-17,,Safari,macOS,,FALSE,2024-03-17 13:49
E007840,U000482,doc_edit,,2023-07-19 18:37,tablet,Firefox,,1116,0,2023-07-19 18:37
E002738, u000702 ,doc_edit,,2025-01-24,,Safari,macOS,,FALSE,2025-01-24 4:30
E004655,U001549,ai_search,,09/17/2024 18:48,tablet,Chrome,Windows,,FALSE,2024-09-17 18:48
E005660,U002551,logout,/dashboard,10/12/2024 07:09,tablet,,,,TRUE,2024-10-12 7:09
E004755,U000691,search,,2025-06-09,,Chrome,Windows,unknown,TRUE,2025-06-09 9:03
E005902,U001352,integration_error,,07/28/2023 00:42,,Chrome,macOS,365,FALSE,2023-07-28 0:42
E000295,u000354,ai_search,,2025-03-29 11:35,,,macOS,104,FALSE,2025-03-29 11:35
E004863,U000876,export,,12/03/2023 02:49,DESKTOP,Chrome,Linux,,TRUE,2023-12-03 2:49
 E003854,U000915,login,/pricing,2024-12-12 16:12,mobile,Brave,,unknown,TRUE,2024-12-12 16:12
E004772,u000992,doc_create,,2023-04-15 14:24,DESKTOP,Brave,Linux,unknown,FALSE,2023-04-15 14:24
E007865,U000702,integration_connect,,2024-10-12,desktop,,macOS,952,FALSE,2024-10-12 9:29
E008925,U000887,export,,2023-11-15 17:48,DESKTOP,Firefox,Windows,821,TRUE,2023-11-15 17:48
E001910,U000972,doc_edit,,04/13/2023 09:26,,,,,,2023-04-13 9:26
E005627,U001730,export,,09/18/2024 13:58,desktop,Safari,Linux,unknown,FALSE,2024-09-18 13:58
E006124,U001239,share,,11/17/2023 05:08,,Chrome,,771,,2023-11-17 5:08
 E007931,U001518,search,,2025-01-18 8:52,,Brave,,,FALSE,2025-01-18 8:52
E008071,U000927,doc_delete,,02/23/2025 05:27,tablet,Safari,Windows,,FALSE,2025-02-23 5:27
E004000,U002383,ai_search,,2024-05-09,mobile,Safari,,,,2024-05-09 2:56
E000160,U001176,doc_delete,,2023-12-20 0:11,,Firefox,iOS,unknown,FALSE,2023-12-20 0:11
E006887,U000456,login,/billing,,,,Linux,,FALSE,2024-12-11 6:52
E007097,U002013,LOGOUT,/docs,0000-00-00 00:00:00,mobile,Safari,macOS,,TRUE,2024-10-03 9:04
E007856,U002045,ai_search,,05/14/2025 22:47,mobile,Firefox,iOS,,FALSE,2025-05-14 22:47
E000919,U000561,ai_search,,2024-07-16 16:14,desktop,Edge,iOS,792,TRUE,2024-07-16 16:14
E000628,U001892,doc_edit,,2023-06-01,mobile,Chrome,Linux,unknown,FALSE,2023-06-01 13:37
E002139,U001166,login,/dashboard,2025-01-06,mobile,Safari,macOS,unknown,TRUE,2025-01-06 6:25
E007059,U002259,logout,/integrations,2023-06-06,,Chrome,,unknown,,2023-06-06 14:47
E005251,U001082,share,,04/14/2025 14:45,,Brave,iOS,,FALSE,2025-04-14 14:45
E007345,U000234,ai_search,,03/21/2025 15:49,,,Windows,unknown,TRUE,2025-03-21 15:49
E003505,U001906,search,,09/26/2024 23:03,,Chrome,Android,unknown,FALSE,2024-09-26 23:03
E003966,U001916,page_view,/search,01/28/2025 06:27,,,Windows,646,0,2025-01-28 6:27
E002572,U002047,ai_search,,01/30/2024 06:27,,,macOS,,FALSE,2024-01-30 6:27
E000059,U002437,PAGE_VIEW,/admin,05/28/2025 04:14,mobile,Firefox,iOS,unknown,TRUE,2025-05-28 4:14
E006898,U000706,integration_error,,2025-05-31 6:08,mobile,Edge,,unknown,TRUE,2025-05-31 6:08
E003595, U001907 ,doc_edit,,2023-01-09 17:02,,Edge,,1466,FALSE,2023-01-09 17:02
E000409, U000569 ,export,,2024-08-14,,Firefox,,,TRUE,2024-08-14 9:31
E002778,U002230,ai_search,,12/18/2023 09:03,,Firefox,,unknown,TRUE,2023-12-18 9:03
E004255,U000561,login,/pricing,12/14/2023 00:00,,Edge,Linux,,TRUE,2023-12-14 0:00
E006610,U002094,logout,/search,,mobile,,iOS,unknown,TRUE,2023-08-07 22:36
E004821,U000929,doc_delete,,12/13/2023 13:31,DESKTOP,Firefox,,,,2023-12-13 13:31
E004947,U001063,doc_create,,2024-03-31 0:29,tablet,Chrome,iOS,unknown,TRUE,2024-03-31 0:29
E006203,U001726,doc_edit,,05/16/2025 17:45,,Edge,iOS,,1,2025-05-16 17:45
E007580,U002069,logout,/dashboard,05/29/2024 03:44,,Safari,macOS,,0,2024-05-29 3:44
E005668,U001948,page_view,/settings,2023-08-17 2:07,desktop,Safari,iOS,,1,2023-08-17 2:07
E007873,U001426,doc_delete,,03/10/2025 06:07,,Edge,Linux,,1,2025-03-10 6:07
E005474,U001890,doc_create,,06/12/2024 16:16,mobile,Edge,,,TRUE,2024-06-12 16:16
E005978,u001374,integration_error,,12/31/2023 10:20,tablet,Edge,Android,,TRUE,2023-12-31 10:20
E006924,U000703,login,/dashboard,07/20/2023 17:18,tablet,,Windows,,,2023-07-20 17:18
E003861,U000027,doc_edit,,03/20/2024 09:30,,Firefox,Windows,,TRUE,2024-03-20 9:30
E005502,U000303,search,,2025-01-17 21:02,DESKTOP,Firefox,Android,,TRUE,2025-01-17 21:02
E002179,U001168,doc_edit,,06/01/2023 21:56,,Brave,Windows,,,2023-06-01 21:56
E003038, U002389 ,login,/help,2025-06-02 0:51,mobile,,,1230,1,2025-06-02 0:51
E008217,U001189,export,,2023-09-02 14:35,,Firefox,Linux,190,,2023-09-02 14:35
E000034,U000939,login,/admin,,tablet,Chrome,Android,,FALSE,2023-03-15 17:16
E003972,U001038,page_view,/onboarding,07/08/2023 06:36,,,macOS,1635,1,2023-07-08 6:36
 E003584, U001658 ,search,,2023-12-25 1:13,,Safari,macOS,unknown,0,2023-12-25 1:13
E000527,U002463,integration_error,,11/11/2024 06:15,desktop,Chrome,,295,,2024-11-11 6:15
E001256,U001436,logout,/search,07/06/2023 16:03,DESKTOP,Safari,Linux,unknown,FALSE,2023-07-06 16:03
E005803,U000456,login,/docs,2023-09-08,tablet,,macOS,1451,,2023-09-08 10:46
E001656,U000406,share,,,,Edge,Linux,,1,2025-03-13 12:45
E004394,U001301,doc_edit,,2025-02-26,DESKTOP,Safari,iOS,1425,FALSE,2025-02-26 9:43
E005167, u001388 ,integration_connect,,0000-00-00 00:00:00,mobile,,,,TRUE,2023-04-01 15:51
E001174,U001157,export,,2024-06-16,,,macOS,unknown,0,2024-06-16 14:25
E008711,U002148,integration_error,,09/02/2024 12:41,DESKTOP,Edge,Windows,unknown,1,2024-09-02 12:41
E006006,U000232,page_view,/pricing,,,Firefox,Android,,FALSE,2024-10-21 20:53
E002331,U000370,comment,,04/12/2024 10:46,DESKTOP,,iOS,,,2024-04-12 10:46
E003101,U000434,doc_edit,,2023-04-20,,Chrome,Windows,499,FALSE,2023-04-20 12:15
E004815,U001613,doc_edit,,2024-03-10 19:35,mobile,Brave,macOS,,TRUE,2024-03-10 19:35
E003834,U000005,doc_create,,03/09/2024 16:57,DESKTOP,Chrome,,,1,2024-03-09 16:57
E008649,U001740,share,,2024-10-17,mobile,Safari,,,1,2024-10-17 17:14
E005688,U002095,integration_connect,,12/18/2024 09:35,DESKTOP,Edge,macOS,,TRUE,2024-12-18 9:35
e000933,U000104,integration_connect,,2025-05-20 9:48,tablet,Chrome,iOS,,FALSE,2025-05-20 9:48
E006725,U001929,SHARE,,,DESKTOP,Safari,,771,FALSE,2023-04-28 18:14
E002939,U000718,logout,/billing,11/25/2024 20:07,,,,,0,2024-11-25 20:07
E007498,U000577,integration_connect,,2023-01-22 20:11,tablet,Chrome,Android,,,2023-01-22 20:11
E008045,U000507,share,,2024-09-25,DESKTOP,,Windows,,FALSE,2024-09-25 22:54
E000922,U001639,integration_error,,2024-01-19,,Edge,,977,0,2024-01-19 13:16
E005095,U001860,search,,06/25/2023 21:22,DESKTOP,,Windows,,FALSE,2023-06-25 21:22
E006749,U001184,share,,10/15/2023 12:25,,Firefox,Windows,,TRUE,2023-10-15 12:25
E007617,U000657,SEARCH,,2023-03-15,desktop,,Windows,,TRUE,2023-03-15 9:13
E003711,U002104,ai_search,,2023-01-14 22:31,desktop,Firefox,Android,unknown,,2023-01-14 22:31
E002041,U002379,doc_create,,,mobile,Firefox,,,TRUE,2023-06-08 18:45
E008825,u001731,logout,/search,2025-04-14,mobile,Edge,Linux,1431,,2025-04-14 1:18
E006585,U002320,ai_search,,06/08/2024 22:59,DESKTOP,Brave,iOS,1024,TRUE,2024-06-08 22:59
 E008670,U000766,login,/billing,2023-04-24 5:01,mobile,,Windows,1280,,2023-04-24 5:01
e003603,U000093,ai_search,,2024-09-02 11:59,mobile,Chrome,Android,unknown,TRUE,2024-09-02 11:59
E000590,U001035,page_view,/search,2025-03-30 11:10,tablet,Edge,iOS,,0,2025-03-30 11:10
E005196,U001106,integration_connect,,,tablet,Firefox,Windows,251,0,2024-07-10 19:11
E000443,U001609,search,,02/15/2025 14:34,,,,,0,2025-02-15 14:34
E003836,U001716,share,,2023-06-15 21:29,mobile,Brave,Windows,,0,2023-06-15 21:29
E001857,U001787,integration_connect,,,,Firefox,Android,,0,2024-03-02 1:06
E008401,U001836,doc_delete,,2024-07-23,,Brave,Windows,,,2024-07-23 20:05
E002210,U001197,page_view,/billing,2024-06-03 15:00,,Edge,,unknown,TRUE,2024-06-03 15:00
E002600,U001204,ai_search,,2024-06-16 23:01,DESKTOP,,Windows,1681,,2024-06-16 23:01
E006736,U001652,integration_error,,2023-04-24,desktop,Edge,macOS,,,2023-04-24 22:22
E005791,USR-001574,export,,03/12/2023 22:28,mobile,Firefox,Android,,FALSE,2023-03-12 22:28
E001815,USR-001084,share,,2023-07-07,desktop,,,724,,2023-07-07 13:48
E004778,U002372,comment,,2023-12-27,,Edge,Linux,1073,FALSE,2023-12-27 13:21
E002421,U001314,doc_delete,,2025-05-24,mobile,Safari,iOS,unknown,TRUE,2025-05-24 21:45
E003310,U002102,export,,10/21/2024 10:13,,Firefox,Windows,unknown,,2024-10-21 10:13
E002130,U001760,doc_edit,,12/27/2024 03:42,,Brave,,,0,2024-12-27 3:42
E005809,U001184,share,,,tablet,Safari,Windows,,,2023-05-24 6:37
E004877,U002357,export,,2023-07-27,DESKTOP,Brave,,,,2023-07-27 20:15
E003633,U000228,ai_search,,09/27/2023 14:27,mobile,Brave,Android,unknown,TRUE,2023-09-27 14:27
E001075,U001793,share,,0000-00-00 00:00:00,desktop,Safari,macOS,261,FALSE,2025-06-17 9:23
E008633,U001855,doc_delete,,05/22/2025 13:32,tablet,,macOS,,0,2025-05-22 13:32
E004015,U000677,export,,2025-04-19,tablet,Safari,,,TRUE,2025-04-19 5:42
E003588,USR-000534,ai_search,,,,Chrome,,unknown,FALSE,2024-06-29 10:12
E006312,U001215,export,,2025-01-06 4:46,,,,,,2025-01-06 4:46
E002479,U002166,share,,2025-03-03,DESKTOP,,Windows,unknown,,2025-03-03 21:45
E001768,U001629,share,,0000-00-00 00:00:00,desktop,,,,,2024-04-22 11:31
E005571, U002506 ,export,,02/06/2023 22:18,tablet,Brave,Windows,unknown,,2023-02-06 22:18
E003548,U001046,doc_edit,,07/02/2024 03:15,desktop,Chrome,iOS,,FALSE,2024-07-02 3:15
E006796,U001308,doc_edit,,03/19/2025 04:21,tablet,Brave,,,TRUE,2025-03-19 4:21
E006679,U002226,logout,/billing,05/22/2024 16:30,tablet,Brave,Windows,1729,TRUE,2024-05-22 16:30
E006205,U002465,doc_create,,2025-05-23 10:53,,Firefox,,unknown,,2025-05-23 10:53
E000494,U000957,ai_search,,2024-02-06 13:39,tablet,Edge,,1593,FALSE,2024-02-06 13:39
E002242,U000902,ai_search,,,mobile,,iOS,,FALSE,2025-05-08 12:21
E007284,U001973,doc_delete,,2024-09-11,tablet,,,unknown,,2024-09-11 9:36
E000180,U000572,integration_connect,,09/29/2023 00:00,DESKTOP,Chrome,,,TRUE,2023-09-29 0:00
E007473,U000675,share,,2024-11-28 7:40,,Firefox,Windows,,,2024-11-28 7:40
E005949,U001429,logout,/settings,2024-05-24 1:27,,Edge,,unknown,TRUE,2024-05-24 1:27
E001500,u001678,login,/dashboard,,desktop,,Android,unknown,1,2023-04-25 13:54
E007099,U001330,logout,/settings,2025-03-11,mobile,Brave,macOS,unknown,1,2025-03-11 10:01
E008159,U000365,ai_search,,2023-04-11,tablet,Edge,,,FALSE,2023-04-11 2:14
E002234,U000437,doc_edit,,2023-03-22,,,Windows,unknown,1,2023-03-22 1:51
E006422,U002521,search,,2024-05-07 11:55,desktop,Safari,,,,2024-05-07 11:55
E004272,U002462,comment,,07/05/2024 07:56,desktop,,Android,,,2024-07-05 7:56
 E002430,U002048,doc_edit,,2025-05-11,tablet,Brave,iOS,,TRUE,2025-05-11 22:48
E000055,U001617,doc_create,,03/21/2025 16:53,DESKTOP,Edge,Linux,unknown,,2025-03-21 16:53
E003344,U000186,export,,,DESKTOP,,,598,,2024-06-21 15:01
E003527,U001857,doc_edit,,03/24/2024 07:24,DESKTOP,Edge,Android,,,2024-03-24 7:24
E003346,U001445,export,,04/12/2024 22:28,,Safari,,,0,2024-04-12 22:28
E005819,U002042,logout,/docs,,mobile,Edge,macOS,937,0,2025-02-01 23:19
E000941,U001143,doc_delete,,2024-02-16,desktop,Safari,,unknown,TRUE,2024-02-16 11:41
E005265,U001806,search,,01/19/2024 21:34,DESKTOP,Safari,macOS,530,,2024-01-19 21:34
E006913,USR-000998,doc_create,,01/17/2024 19:12,tablet,,Linux,762,1,2024-01-17 19:12
E004648,U001004,ai_search,,08/24/2023 02:23,,Safari,,unknown,TRUE,2023-08-24 2:23
E000765,U000716,SEARCH,,0000-00-00 00:00:00,,,Linux,1157,,2025-02-25 11:55
E003454,U001328,integration_connect,,0000-00-00 00:00:00,,Safari,iOS,unknown,1,2023-11-26 20:06
E001580,U001530,login,/search,2023-08-16 0:01,tablet,Edge,Linux,,0,2023-08-16 0:01
E003493, U001655 ,integration_error,,2023-09-27,,Brave,macOS,unknown,,2023-09-27 17:45
E004873,U001340,comment,,2024-06-07,tablet,Edge,iOS,,1,2024-06-07 8:08
e007621,U002585,doc_edit,,2023-03-05 10:09,tablet,Chrome,Android,1036,TRUE,2023-03-05 10:09
E006463,U001880,integration_connect,,01/19/2023 05:53,DESKTOP,Chrome,,unknown,,2023-01-19 5:53
E007961,U001683,share,,2024-02-16,,Chrome,macOS,388,,2024-02-16 14:43
e003171,U001573,doc_create,,2024-01-01 21:29,DESKTOP,,Windows,,FALSE,2024-01-01 21:29
E007916,U000187,login,/settings,2024-10-12 2:33,tablet,,Linux,,TRUE,2024-10-12 2:33
E001066, U001749 ,comment,,10/30/2024 14:40,desktop,Brave,Android,,1,2024-10-30 14:40
E005072,USR-002042,logout,/dashboard,2024-07-15 18:45,,Firefox,Android,,FALSE,2024-07-15 18:45
E004816,U002131,page_view,/integrations,2023-05-03 9:01,,Firefox,macOS,,,2023-05-03 9:01
E006183,U000043,page_view,/dashboard,2024-08-15,mobile,Safari,Windows,,FALSE,2024-08-15 7:45
E004886,U002376,export,,2024-12-01 21:11,,Edge,iOS,unknown,FALSE,2024-12-01 21:11
E006159,u002403,integration_connect,,2024-08-02,tablet,Firefox,iOS,,,2024-08-02 5:09
E000805,U002118,integration_connect,,2024-12-31 7:54,mobile,Firefox,Linux,unknown,0,2024-12-31 7:54
E005713, U000164 ,integration_connect,,2024-01-14,,Edge,macOS,,0,2024-01-14 16:11
E002071,U001190,comment,,11/08/2023 08:06,,Safari,Linux,1266,,2023-11-08 8:06
E006528,U001630,doc_edit,,0000-00-00 00:00:00,,,iOS,,,2025-05-04 21:47
E004242,U001166,integration_error,,2024-01-25 4:27,,Edge,Windows,700,,2024-01-25 4:27
E000436,U000855,logout,/pricing,2023-03-04,,Chrome,Android,,TRUE,2023-03-04 9:30
E002053,U002586,integration_connect,,03/30/2024 01:03,mobile,,Android,unknown,TRUE,2024-03-30 1:03
E003001,U000181,integration_error,,2024-01-28,mobile,Brave,macOS,,TRUE,2024-01-28 2:25
E008456,U000393,ai_search,,11/03/2023 18:27,tablet,Safari,iOS,604,FALSE,2023-11-03 18:27
E000430,U002484,export,,08/21/2023 19:49,mobile,Safari,Android,,,2023-08-21 19:49
E001620,U002214,logout,/dashboard,12/29/2023 19:03,DESKTOP,,,1565,FALSE,2023-12-29 19:03
E008340,u000056,export,,02/01/2025 17:18,mobile,,Linux,,TRUE,2025-02-01 17:18
E004376,U000710,doc_create,,09/19/2024 20:36,,Safari,iOS,348,,2024-09-19 20:36
E004974,U002085,login,/dashboard,2025-03-24,desktop,,Linux,,,2025-03-24 12:55
E008818,U001081,share,,0000-00-00 00:00:00,DESKTOP,,iOS,,1,2023-11-14 10:11
E001058,USR-002261,logout,/integrations,,tablet,Safari,macOS,,0,2025-05-28 4:16
E008129,U001595,doc_create,,03/19/2025 18:34,mobile,Chrome,Android,unknown,FALSE,2025-03-19 18:34
E004711,U002235,search,,2024-05-25,DESKTOP,Firefox,,,FALSE,2024-05-25 2:05
E000005,u000208,export,,2023-11-13,tablet,Firefox,,,TRUE,2023-11-13 19:21
E002089, U000776 ,doc_edit,,0000-00-00 00:00:00,desktop,Edge,Linux,unknown,FALSE,2023-08-30 18:29
E006213,U000515,doc_delete,,2023-09-30 10:09,tablet,Firefox,,unknown,TRUE,2023-09-30 10:09
e001172,U000342,doc_edit,,03/08/2023 12:53,tablet,Edge,macOS,,FALSE,2023-03-08 12:53
E004794,U001801,page_view,/billing,0000-00-00 00:00:00,,Brave,,1026,TRUE,2023-05-16 3:37
E005018,U002230,share,,2025-06-01,,Edge,iOS,unknown,FALSE,2025-06-01 6:18
E008210,U001664,integration_error,,07/24/2024 05:28,,Safari,Windows,994,FALSE,2024-07-24 5:28
E007367,U001128,login,/integrations,04/22/2024 23:33,,,macOS,583,1,2024-04-22 23:33
E005573,U002542,share,,05/02/2024 23:09,,Safari,,1062,0,2024-05-02 23:09
E006172,U000501,share,,2023-05-02 0:17,mobile,Safari,iOS,,TRUE,2023-05-02 0:17
E003326,U000774,doc_delete,,2024-01-05 6:16,mobile,Chrome,,,0,2024-01-05 6:16
E002825,U001880,page_view,/dashboard,02/28/2023 16:39,,Firefox,iOS,,FALSE,2023-02-28 16:39
E005194,U001755,search,,05/14/2024 08:15,tablet,,Android,,1,2024-05-14 8:15
E001517,U001018,integration_error,,01/18/2025 18:39,,Edge,macOS,unknown,FALSE,2025-01-18 18:39
E007786,U001740,integration_connect,,2024-07-27 15:52,tablet,Edge,Linux,,FALSE,2024-07-27 15:52
E006076,U000297,share,,,mobile,Brave,macOS,,FALSE,2024-10-03 10:10
E007765,U000198,integration_connect,,,DESKTOP,Brave,Linux,1529,FALSE,2024-05-02 12:55
E008773,U000968,doc_create,,2023-07-04 11:58,mobile,Chrome,Windows,,FALSE,2023-07-04 11:58
E007287,U000348,integration_error,,2024-12-09,,Chrome,,,TRUE,2024-12-09 19:03
E004029,U000533,doc_edit,,2023-08-04,desktop,Edge,iOS,,,2023-08-04 0:55
E005669,U001156,ai_search,,0000-00-00 00:00:00,mobile,,macOS,1637,0,2023-07-08 15:33
E001345,U001909,integration_connect,,2023-02-13 13:04,desktop,Brave,Linux,1222,FALSE,2023-02-13 13:04
E002026,U001504,doc_create,,07/20/2023 21:57,DESKTOP,,Windows,,0,2023-07-20 21:57
E007591,U000154,doc_edit,,2023-10-22 8:36,DESKTOP,Brave,,,0,2023-10-22 8:36
E008084,U002117,export,,2023-03-02 9:52,desktop,Chrome,Android,,0,2023-03-02 9:52
E003330,U001787,doc_edit,,2024-03-08,DESKTOP,Safari,,unknown,,2024-03-08 20:14
E002192,U000589,export,,0000-00-00 00:00:00,,Edge,Android,,,2025-02-06 16:12
E000887,U000589,doc_edit,,2024-09-19 21:40,DESKTOP,Safari,,,FALSE,2024-09-19 21:40
E001146,U001506,logout,/onboarding,06/08/2023 17:48,mobile,Chrome,,unknown,FALSE,2023-06-08 17:48
E007823,U002218,logout,/billing,2023-10-23,desktop,Chrome,Linux,,FALSE,2023-10-23 0:06
E006241,U001234,ai_search,,2024-05-26 4:34,desktop,Firefox,Linux,,,2024-05-26 4:34
E001915,U000743,doc_create,,2023-07-06 7:09,,Safari,macOS,,TRUE,2023-07-06 7:09
E001302,u001668,integration_connect,,2023-01-25 13:39,,Edge,iOS,1727,FALSE,2023-01-25 13:39
E001211,U001508,integration_error,,2023-01-20,DESKTOP,,iOS,274,0,2023-01-20 5:46
E008253,U001163,integration_connect,,2023-01-06,DESKTOP,Brave,macOS,,,2023-01-06 23:19
E004965,U000515,integration_connect,,10/31/2023 15:30,,Safari,macOS,,FALSE,2023-10-31 15:30
 E003968,U002395,search,,2024-07-12 21:01,mobile,Chrome,,unknown,TRUE,2024-07-12 21:01
E005247,U002452,doc_delete,,2024-04-21,DESKTOP,Firefox,,,TRUE,2024-04-21 3:54
E008241,U001221,doc_create,,2023-08-16 2:52,mobile,,macOS,,,2023-08-16 2:52
E008714,U002353,page_view,/help,0000-00-00 00:00:00,,,,,,2023-07-23 23:47
E000539,U000833,page_view,/docs,2024-08-27,desktop,Firefox,macOS,unknown,TRUE,2024-08-27 8:34
E007748,U001054,integration_error,,03/17/2023 11:37,,,iOS,,1,2023-03-17 11:37
E002017,U000238,ai_search,,2023-07-01,DESKTOP,,Android,,FALSE,2023-07-01 23:50
E004929,U000477,login,/billing,04/13/2023 10:33,tablet,Brave,macOS,,FALSE,2023-04-13 10:33
E000632,U001361,ai_search,,2024-07-25 7:39,mobile,Safari,,,1,2024-07-25 7:39
E006912,U001626,comment,,2023-06-05 13:30,DESKTOP,Chrome,iOS,,TRUE,2023-06-05 13:30
E000206,U002484,search,,2024-07-06 0:43,mobile,Chrome,Windows,,TRUE,2024-07-06 0:43
E006540,USR-001939,comment,,01/07/2023 06:03,,Edge,Windows,unknown,,2023-01-07 6:03
E003878,u002168,login,/help,06/28/2023 03:58,,Edge,,,TRUE,2023-06-28 3:58
E008518,USR-000499,logout,/integrations,,,Edge,,939,TRUE,2024-12-02 4:55
 E000411,U000536,doc_delete,,2023-01-08,mobile,Chrome,,,FALSE,2023-01-08 1:35
E005668, U000441 ,share,,,DESKTOP,,iOS,,0,2023-10-17 9:28
E004035,U002570,search,,2023-10-11 22:18,mobile,,Android,,FALSE,2023-10-11 22:18
E001434,U002034,integration_error,,2023-04-24,mobile,,macOS,,FALSE,2023-04-24 8:51
E005923,U001581,logout,/dashboard,,tablet,Firefox,,unknown,,2023-02-24 23:38
E000647,U001457,comment,,07/26/2023 07:00,,Edge,Android,unknown,FALSE,2023-07-26 7:00
E007690,U001994,comment,,10/28/2023 04:57,tablet,Firefox,iOS,unknown,1,2023-10-28 4:57
E005784, U001405 ,doc_create,,,DESKTOP,Chrome,Android,,,2023-03-21 6:35
E004635,U001532,comment,,,desktop,Brave,,unknown,0,2023-08-04 16:02
E003034,U000094,export,,05/09/2025 15:09,,Chrome,Linux,,TRUE,2025-05-09 15:09
E002042,U001146,doc_delete,,2024-08-09 14:17,mobile,,,,0,2024-08-09 14:17
E006309,U000793,share,,2024-03-07,mobile,Safari,macOS,,FALSE,2024-03-07 5:52
E005695,U001043,share,,02/11/2025 12:08,mobile,Chrome,Android,,,2025-02-11 12:08
E008519,U001879,doc_delete,,,tablet,Brave,,,FALSE,2023-09-15 6:05
E008374,U002072,logout,/billing,03/05/2025 02:07,desktop,Edge,iOS,unknown,FALSE,2025-03-05 2:07
e003574,U002435,integration_error,,2024-05-31,mobile,Brave,macOS,,FALSE,2024-05-31 22:47
E007684,U000717,logout,/search,,mobile,Safari,macOS,,,2024-09-03 11:01
E008503,U001928,logout,/dashboard,2025-05-29 21:59,desktop,,macOS,,,2025-05-29 21:59
E006454,U002335,integration_connect,,,,Edge,Linux,,FALSE,2023-10-25 2:04
E002479,U001551,logout,/integrations,2023-06-13 13:02,desktop,Firefox,Android,,,2023-06-13 13:02
E003719,U002063,doc_create,,,,Safari,iOS,,,2024-04-19 3:54
E007658,U001712,export,,03/23/2024 10:36,mobile,Firefox,,355,FALSE,2024-03-23 10:36
E000657,U002034,page_view,/help,2023-12-11 0:26,,Brave,Windows,,,2023-12-11 0:26
E000044,U001289,doc_create,,2023-10-19,desktop,,,,FALSE,2023-10-19 19:51
E008911,U000651,login,/help,2025-05-05 0:52,DESKTOP,Chrome,,,TRUE,2025-05-05 0:52
E001919,U001447,login,/docs,08/21/2024 07:46,DESKTOP,Safari,,unknown,FALSE,2024-08-21 7:46
E006938,U001857,ai_search,,2024-11-29 22:45,,Edge,,840,TRUE,2024-11-29 22:45
E007447,U000698,integration_connect,,05/30/2023 21:21,,,Linux,,0,2023-05-30 21:21
E007904,U000722,share,,2024-11-25 21:55,DESKTOP,,Android,,FALSE,2024-11-25 21:55
E003570,U002578,integration_connect,,2024-09-26,DESKTOP,Chrome,Android,489,1,2024-09-26 18:14
E001738,U002153,search,,2023-06-03,,,Android,,TRUE,2023-06-03 7:43
E008862,U002377,ai_search,,,desktop,,,128,FALSE,2023-12-15 23:09
E005366,U001325,share,,11/21/2023 08:32,,,Android,,TRUE,2023-11-21 8:32
E008475,U002396,doc_edit,,2023-04-15 9:19,mobile,Firefox,Windows,1398,FALSE,2023-04-15 9:19
E005970,U001838,comment,,2023-10-09,tablet,Brave,,,1,2023-10-09 15:43
E004981,U001990,page_view,/search,2025-05-26 19:42,,Safari,iOS,unknown,FALSE,2025-05-26 19:42
E008573,U002538,share,,04/29/2024 05:01,DESKTOP,,,,1,2024-04-29 5:01
E004029,U001939,search,,,,Brave,macOS,,1,2024-01-07 7:02
E008382, U001582 ,ai_search,,2024-07-08 23:37,,,Windows,1606,TRUE,2024-07-08 23:37
E008738,U002154,ai_search,,01/17/2023 19:02,mobile,,Android,unknown,0,2023-01-17 19:02
E004506,u002207,doc_edit,,0000-00-00 00:00:00,,Brave,Android,unknown,FALSE,2024-04-07 10:41
E004568,U000274,comment,,2023-09-22,desktop,,Android,831,,2023-09-22 19:53
E000191,U000818,integration_error,,0000-00-00 00:00:00,,,Android,,0,2023-01-06 1:51
E007074,U002406,login,/billing,04/12/2023 21:47,,,macOS,,TRUE,2023-04-12 21:47
e005506,U001843,doc_edit,,12/01/2023 15:49,tablet,Chrome,Linux,,FALSE,2023-12-01 15:49
E000012,U000121,integration_connect,,06/01/2025 19:47,,Edge,macOS,,,2025-06-01 19:47
E008913,U000575,login,/billing,,DESKTOP,Safari,iOS,1770,TRUE,2023-10-11 11:39
E008048,U000872,doc_edit,,2024-05-14,,,macOS,,TRUE,2024-05-14 7:25
E003064,USR-001111,doc_create,,05/23/2024 21:45,mobile,Firefox,,,FALSE,2024-05-23 21:45
E006444,U000426,login,/integrations,2023-07-21 11:55,,Safari,,,TRUE,2023-07-21 11:55
E007520,U000572,export,,01/17/2023 18:07,,,macOS,1543,FALSE,2023-01-17 18:07
E004268,U001505,search,,2023-11-22,tablet,Edge,iOS,unknown,TRUE,2023-11-22 4:11
E002188,U000106,page_view,/dashboard,09/24/2023 04:39,tablet,Firefox,Linux,unknown,TRUE,2023-09-24 4:39
E007331,U000951,share,,01/21/2025 05:24,DESKTOP,,Windows,,FALSE,2025-01-21 5:24
E008220,U001993,login,/search,,,Firefox,iOS,unknown,,2023-03-25 16:46
E001793,U000497,comment,,2023-09-21,mobile,,Linux,1519,TRUE,2023-09-21 8:09
E006811,U000197,integration_error,,2023-08-14 20:47,,Edge,Android,,TRUE,2023-08-14 20:47
E006489,U000192,doc_create,,2023-03-03 12:23,DESKTOP,Chrome,Windows,1629,FALSE,2023-03-03 12:23
E007897,U002472,logout,/search,09/27/2024 17:05,desktop,Brave,,unknown,,2024-09-27 17:05
E004717,U001190,doc_create,,10/18/2024 23:00,tablet,Chrome,,unknown,1,2024-10-18 23:00
E008549,U000615,integration_error,,,,Brave,Linux,1748,TRUE,2024-12-23 17:20
E008269,U000164,integration_connect,,05/04/2023 05:26,desktop,,macOS,,TRUE,2023-05-04 5:26
E001612,U000743,doc_create,,2025-02-27,,Safari,Android,unknown,,2025-02-27 8:02
E005422,U000410,page_view,/billing,,mobile,,,,FALSE,2024-11-25 16:28
E008276,U001740,ai_search,,,DESKTOP,Safari,Windows,,,2023-09-19 10:56
E005439,U001786,doc_edit,,04/21/2025 05:23,,Brave,Android,,,2025-04-21 5:23
E008775,U001663,integration_error,,2024-12-03 4:28,mobile,Edge,iOS,34,FALSE,2024-12-03 4:28
e000905,U000756,export,,2024-03-22,mobile,Brave,Linux,unknown,,2024-03-22 17:43
E004171,U000161,page_view,/search,02/19/2023 08:39,tablet,Firefox,,,1,2023-02-19 8:39
E007194,USR-000476,page_view,/integrations,2023-01-25 11:44,,Chrome,Android,unknown,,2023-01-25 11:44
E004778,U002060,ai_search,,2024-07-27 17:13,,Safari,Android,,,2024-07-27 17:13
E002338,U001183,share,,2024-04-05 18:45,,,macOS,unknown,FALSE,2024-04-05 18:45
E005927,USR-002357,comment,,2025-05-22 14:32,DESKTOP,,Linux,unknown,FALSE,2025-05-22 14:32
E004610,U001744,doc_create,,2024-08-15,DESKTOP,Edge,,,,2024-08-15 0:10
E007851,u002094,share,,,desktop,Chrome,Windows,,,2023-08-13 8:12
E002752,U001481,ai_search,,2023-11-19 2:53,DESKTOP,,Linux,unknown,0,2023-11-19 2:53
E005462,U002484,integration_error,,11/12/2023 12:35,,Edge,,,1,2023-11-12 12:35
E000422,u000879,integration_connect,,2023-10-22,DESKTOP,Firefox,Linux,,FALSE,2023-10-22 18:50
E000337, U002062 ,doc_edit,,0000-00-00 00:00:00,mobile,Brave,,,0,2023-11-01 20:24
E003670,U001906,login,/search,0000-00-00 00:00:00,DESKTOP,Edge,iOS,,FALSE,2024-11-29 21:16
E002131,U000418,login,/search,0000-00-00 00:00:00,mobile,Safari,,,0,2023-01-08 18:25
E000333,U002369,doc_create,,2024-01-23 11:45,desktop,,,unknown,1,2024-01-23 11:45
E001986,U000722,login,/search,,,Chrome,Android,,FALSE,2023-03-09 16:02
E008592,U000727,login,/help,11/10/2023 20:05,desktop,Brave,iOS,,,2023-11-10 20:05
E003824,U000148,share,,2023-01-26,mobile,,,unknown,0,2023-01-26 9:50
E000525,U000123,doc_edit,,2023-12-26 22:01,,,iOS,,1,2023-12-26 22:01
E005045,U001504,export,,2024-03-05,mobile,Brave,Linux,,,2024-03-05 5:19
E002819,U000658,doc_edit,,2023-01-03,DESKTOP,Chrome,macOS,107,0,2023-01-03 17:57
E002260,U001832,search,,,,,iOS,unknown,1,2024-11-26 8:12
E005844,U000540,page_view,/help,2024-11-23 3:14,desktop,Edge,,,FALSE,2024-11-23 3:14
E002359,U001026,doc_create,,04/06/2025 20:09,mobile,Firefox,Windows,unknown,FALSE,2025-04-06 20:09
E001522,u001011,export,,2024-09-23 18:05,,,Linux,unknown,FALSE,2024-09-23 18:05
E003547,U000083,share,,2024-09-22,mobile,Safari,iOS,,TRUE,2024-09-22 5:58
E000998,U000992,export,,2023-02-11 1:04,DESKTOP,,,unknown,FALSE,2023-02-11 1:04
E001839,U001857,doc_create,,2024-04-01,tablet,Brave,,,TRUE,2024-04-01 11:47
E003614,U000073,share,,2023-11-21,desktop,,,151,TRUE,2023-11-21 3:33
E003237, U000420 ,page_view,/pricing,2023-06-02,,Brave,Android,,FALSE,2023-06-02 1:31
E004024,U001765,doc_create,,2023-08-26 0:55,DESKTOP,,,unknown,,2023-08-26 0:55
E000752,U001184,export,,02/09/2025 12:16,,Edge,Linux,71,FALSE,2025-02-09 12:16
E006337,U000919,share,,2023-07-28,mobile,Safari,iOS,,TRUE,2023-07-28 19:47
E005057,U001260,doc_create,,04/02/2025 03:41,DESKTOP,Chrome,,unknown,TRUE,2025-04-02 3:41
E003115,U002266,logout,/docs,,tablet,,Windows,,TRUE,2023-12-26 23:50
E002806,U000743,doc_edit,,05/05/2023 16:46,,Firefox,iOS,,1,2023-05-05 16:46
E008429,U001497,page_view,/pricing,2024-11-02,tablet,Firefox,iOS,,TRUE,2024-11-02 12:28
E007168,U001202,page_view,/dashboard,2023-05-02,,,Windows,1304,FALSE,2023-05-02 0:42
E004347,U001972,login,/billing,2024-08-21,mobile,,Windows,,1,2024-08-21 2:03
E006417,USR-002262,doc_create,,2025-02-23,desktop,Brave,iOS,,FALSE,2025-02-23 8:00
E000444,U002420,ai_search,,,,Chrome,,,,2024-08-11 23:18
E004849,U002098,ai_search,,2024-02-19,DESKTOP,Brave,iOS,,FALSE,2024-02-19 12:33
E003486,U002527,comment,,,mobile,Edge,,unknown,0,2024-10-22 23:48
E001010, USR-000593 ,page_view,/docs,05/07/2025 01:07,DESKTOP,Safari,,455,FALSE,2025-05-07 1:07
E000326,U000269,doc_create,,2025-04-14,desktop,Safari,Android,unknown,,2025-04-14 11:37
E003729,U000533,ai_search,,2024-09-25,DESKTOP,,iOS,unknown,TRUE,2024-09-25 14:38
E006499,U001350,export,,03/18/2025 03:16,,,,1785,,2025-03-18 3:16
E005481, U000355 ,export,,06/13/2025 01:16,desktop,Safari,Linux,,,2025-06-13 1:16
 E004168,U000544,doc_edit,,01/05/2024 19:44,,Firefox,Android,397,,2024-01-05 19:44
E000404,U002114,comment,,2024-10-24,DESKTOP,Chrome,Windows,unknown,,2024-10-24 21:01
E007679,U000228,comment,,2023-05-31 23:26,mobile,,,,0,2023-05-31 23:26
E003632,U001727,integration_error,,2023-06-10,DESKTOP,Chrome,macOS,,1,2023-06-10 1:11
E002482,USR-002279,ai_search,,2023-01-27,,,Android,1598,FALSE,2023-01-27 3:22
E001440,u001301,doc_create,,01/01/2023 02:20,mobile,Edge,Windows,unknown,1,2023-01-01 2:20
E006740, U001184 ,integration_error,,01/09/2023 05:43,,Chrome,,unknown,TRUE,2023-01-09 5:43
E000513,U000852,ai_search,,02/21/2025 07:56,,,macOS,,,2025-02-21 7:56
E007821,U002574,share,,0000-00-00 00:00:00,,Brave,,766,FALSE,2024-10-08 10:04
E007510,u000118,doc_delete,,2024-07-18,mobile,Brave,,,TRUE,2024-07-18 4:53
E002885,U001547,login,/settings,2024-08-16 3:32,desktop,Chrome,,,TRUE,2024-08-16 3:32
E006862,u001761,logout,/docs,2023-07-27 17:42,,Edge,,1391,1,2023-07-27 17:42
E003740,U001054,page_view,/dashboard,12/01/2024 13:23,,Edge,macOS,unknown,0,2024-12-01 13:23
E001468,U001321,doc_delete,,2025-02-27 22:58,desktop,Safari,macOS,,0,2025-02-27 22:58
E001318,U000678,logout,/integrations,,,Firefox,Linux,1638,,2024-07-06 23:03
E003576,U001198,share,,08/08/2024 23:02,DESKTOP,Safari,iOS,1676,FALSE,2024-08-08 23:02
E007277,USR-001561,ai_search,,2024-01-10,,,Android,,,2024-01-10 7:26
E001396,U001006,integration_connect,,03/21/2023 05:07,mobile,,Windows,unknown,TRUE,2023-03-21 5:07
E000542,U001271,doc_create,,0000-00-00 00:00:00,DESKTOP,,macOS,,TRUE,2023-06-09 16:21
E005003,U002162,search,,,tablet,Safari,Linux,,,2025-02-15 7:52
E003753, U001665 ,doc_edit,,2024-02-17 20:18,desktop,Safari,,,1,2024-02-17 20:18
E000896,U002497,integration_error,,02/08/2025 12:04,desktop,Safari,macOS,unknown,1,2025-02-08 12:04
E000862,U000302,export,,06/07/2023 20:33,,,macOS,,,2023-06-07 20:33
E008272,U001485,AI_SEARCH,,01/15/2025 05:33,tablet,Brave,Linux,unknown,,2025-01-15 5:33
E005677,U000574,share,,05/13/2023 14:52,desktop,,Windows,,1,2023-05-13 14:52
E006222, U002070 ,doc_edit,,05/30/2025 15:51,mobile,Safari,Windows,unknown,TRUE,2025-05-30 15:51
E008352,U000245,page_view,/integrations,0000-00-00 00:00:00,mobile,,Android,,1,2024-10-04 9:45
E000330,U000421,doc_edit,,12/21/2024 05:51,desktop,Safari,iOS,1499,,2024-12-21 5:51
E006357,U000083,doc_create,,,tablet,Firefox,,8,0,2023-03-06 14:35
E001428, U002064 ,export,,10/20/2023 19:58,,Chrome,Linux,,,2023-10-20 19:58
E006868,U000272,ai_search,,2025-05-24,desktop,,,,1,2025-05-24 7:45
E004016,U002149,PAGE_VIEW,/help,2023-05-07 9:06,desktop,,,,,2023-05-07 9:06
E002433,U001058,ai_search,,2025-06-05,DESKTOP,Safari,iOS,,TRUE,2025-06-05 23:13
e004863,U000503,export,,2024-10-19 20:17,desktop,Brave,iOS,,FALSE,2024-10-19 20:17
E000191,U001432,search,,2023-08-22 1:15,tablet,,Windows,,FALSE,2023-08-22 1:15
E008592,U001227,ai_search,,0000-00-00 00:00:00,desktop,Firefox,,,TRUE,2024-06-07 17:38
E006056,u000377,integration_connect,,2023-11-27,,Firefox,Windows,,,2023-11-27 17:31
E007544,U001305,comment,,11/29/2024 21:35,desktop,Edge,,,TRUE,2024-11-29 21:35
E005091,U001977,page_view,/search,06/05/2023 09:33,tablet,Safari,Linux,unknown,FALSE,2023-06-05 9:33
E001359,U001990,logout,/dashboard,03/03/2023 18:57,desktop,Brave,Android,unknown,TRUE,2023-03-03 18:57
E001594,U001198,search,,0000-00-00 00:00:00,,,Windows,,TRUE,2024-10-20 18:24
E005738,U000234,doc_create,,2023-05-20 3:13,mobile,Chrome,,,,2023-05-20 3:13
E005555,U001615,doc_create,,2025-03-26,,Safari,iOS,,1,2025-03-26 11:29
E002172,U001922,doc_edit,,03/10/2023 14:12,tablet,Edge,macOS,,FALSE,2023-03-10 14:12
e003378,U001611,doc_delete,,2023-07-28,tablet,Firefox,Linux,unknown,0,2023-07-28 23:10
E007958,U001253,export,,01/08/2023 11:27,mobile,Chrome,iOS,388,TRUE,2023-01-08 11:27
E000331,U002543,export,,02/13/2023 10:58,desktop,Safari,Android,1792,TRUE,2023-02-13 10:58
E004486,U000745,search,,2023-10-15,tablet,,Windows,,1,2023-10-15 2:40
E005966,U001774,page_view,/search,2024-11-30 14:40,,Chrome,macOS,unknown,0,2024-11-30 14:40
E002470,u001770,search,,03/24/2024 04:27,DESKTOP,Chrome,,,TRUE,2024-03-24 4:27
E007958,U000707,doc_create,,2023-12-22,tablet,Safari,Windows,,TRUE,2023-12-22 3:39
E005517,U000022,login,/integrations,,DESKTOP,Chrome,macOS,,FALSE,2025-05-23 8:12
E003969,U000358,share,,2023-08-09 14:04,,Chrome,,1589,0,2023-08-09 14:04
E002427,U001117,export,,,,,iOS,,,2024-09-11 9:30
E001170,U002006,ai_search,,2025-02-22 19:17,,Firefox,Windows,601,FALSE,2025-02-22 19:17
E007393,U000664,doc_create,,02/27/2025 18:20,,,macOS,170,1,2025-02-27 18:20
E006822,U000609,login,/admin,02/06/2024 18:17,DESKTOP,Edge,Android,,FALSE,2024-02-06 18:17
E004160,U001319,doc_edit,,09/21/2024 09:45,DESKTOP,Chrome,iOS,,TRUE,2024-09-21 9:45
E007496,U000051,integration_error,,10/29/2024 06:24,DESKTOP,Edge,Android,unknown,FALSE,2024-10-29 6:24
E000066,U000888,export,,06/30/2023 19:11,desktop,Edge,macOS,1438,0,2023-06-30 19:11
E004436,U001166,logout,/help,2024-01-15 6:31,tablet,Safari,,1577,1,2024-01-15 6:31
E002408,U000809,export,,2023-11-01,DESKTOP,Brave,,unknown,0,2023-11-01 19:43
E000669,U001515,doc_delete,,0000-00-00 00:00:00,mobile,Brave,Windows,,TRUE,2025-06-12 6:45
E008096,U000017,search,,11/18/2024 16:25,mobile,Firefox,iOS,,,2024-11-18 16:25
E004760,U001369,share,,10/25/2024 12:59,,Brave,Linux,655,1,2024-10-25 12:59
E003067,U001107,doc_delete,,2024-05-07,tablet,Firefox,macOS,,FALSE,2024-05-07 23:21
E003201, U000570 ,login,/admin,2024-10-16,,Safari,macOS,319,FALSE,2024-10-16 5:27
E003128,U000025,share,,01/07/2025 02:11,tablet,Brave,iOS,696,,2025-01-07 2:11
E006322,U000006,doc_edit,,0000-00-00 00:00:00,DESKTOP,Brave,,,TRUE,2024-06-11 20:36
 E007352,u001273,share,,0000-00-00 00:00:00,desktop,,Android,,,2024-07-02 20:42
E001219,U001244,doc_edit,,05/15/2023 01:21,,,,unknown,,2023-05-15 1:21
E008054,u001071,ai_search,,05/23/2023 11:13,tablet,Edge,,1736,FALSE,2023-05-23 11:13
E004223,U001368,ai_search,,06/01/2025 11:23,mobile,Brave,Android,,TRUE,2025-06-01 11:23
e006852,U000406,search,,2023-04-23,DESKTOP,Brave,macOS,unknown,0,2023-04-23 0:06
E003174,U000458,ai_search,,01/26/2024 21:14,mobile,,Windows,unknown,FALSE,2024-01-26 21:14
E004036,U002055,doc_create,,2023-04-20,,Edge,macOS,,FALSE,2023-04-20 10:52
E008545,U002212,doc_delete,,2025-02-22 21:11,DESKTOP,,Linux,,FALSE,2025-02-22 21:11
E003523, U002478 ,logout,/admin,12/02/2023 05:11,,Firefox,iOS,unknown,1,2023-12-02 5:11
E004911,U000867,share,,2023-11-01,DESKTOP,Safari,macOS,,0,2023-11-01 19:10
E005171,U000866,integration_error,,2023-10-04 12:16,,Safari,Linux,,FALSE,2023-10-04 12:16
E002292,U000152,share,,2024-02-15,DESKTOP,Brave,Android,unknown,1,2024-02-15 18:57
E007791,U002402,INTEGRATION_ERROR,,,desktop,Brave,,,FALSE,2023-04-27 2:40
E004007, U001979 ,doc_create,,06/08/2025 21:15,,Safari,,,0,2025-06-08 21:15
E005632,U000064,doc_create,,2023-11-29 9:07,desktop,Brave,,unknown,,2023-11-29 9:07
E002004,U002089,share,,07/07/2024 19:02,,Edge,iOS,unknown,TRUE,2024-07-07 19:02
e005677,u000887,doc_create,,2024-10-27,mobile,,Windows,415,1,2024-10-27 11:32
E000669,U002146,logout,/help,2023-07-08 1:47,,,,unknown,0,2023-07-08 1:47
E005856,U000236,doc_delete,,,desktop,Chrome,Linux,,,2024-08-17 4:37
E003803,U000562,doc_edit,,06/12/2023 05:28,mobile,Firefox,macOS,544,FALSE,2023-06-12 5:28
E007720,U002132,share,,2025-03-22 13:10,mobile,Edge,Android,,,2025-03-22 13:10
e000648,U001542,share,,08/25/2023 03:18,mobile,Safari,Windows,unknown,FALSE,2023-08-25 3:18
E002680,U000123,AI_SEARCH,,2025-04-05 15:13,desktop,Firefox,macOS,,1,2025-04-05 15:13
E001099,U001214,doc_create,,09/21/2023 14:05,,Firefox,,unknown,TRUE,2023-09-21 14:05
E002822, U001921 ,logout,/pricing,2023-11-13,DESKTOP,,,,FALSE,2023-11-13 17:00
E001479,U001204,comment,,2025-05-15 20:18,tablet,Safari,,,TRUE,2025-05-15 20:18
E004974,U002073,doc_delete,,08/17/2023 22:09,mobile,,Windows,,FALSE,2023-08-17 22:09
E001688,U002396,ai_search,,2023-04-08,DESKTOP,Edge,Android,unknown,0,2023-04-08 19:55
E001691,U000803,login,/settings,08/28/2024 21:45,,Firefox,Android,unknown,0,2024-08-28 21:45
E006628,U001012,integration_connect,,2024-07-05 9:22,tablet,,Linux,,FALSE,2024-07-05 9:22
E005177,U002452,page_view,/docs,0000-00-00 00:00:00,,Chrome,Android,525,FALSE,2025-04-06 6:01
E002546,U000329,share,,,desktop,Firefox,,unknown,TRUE,2024-07-31 5:35
E001687,U000130,login,/dashboard,06/28/2024 12:05,desktop,,macOS,,,2024-06-28 12:05
E001709,U001359,comment,,2023-08-20,,Edge,macOS,,FALSE,2023-08-20 9:12
E000742,U002314,share,,02/04/2025 00:02,DESKTOP,,,unknown,1,2025-02-04 0:02
E004381,U002062,doc_edit,,,,,Android,unknown,,2023-08-26 13:31
E002868,U000049,integration_error,,04/12/2024 00:59,mobile,,macOS,,FALSE,2024-04-12 0:59
E007865,U001577,doc_edit,,12/07/2024 00:45,mobile,Safari,Windows,,FALSE,2024-12-07 0:45
E003224,U001087,integration_connect,,,DESKTOP,Edge,,1229,0,2024-12-20 18:20
E000772,u000752,doc_delete,,2025-01-14,desktop,Brave,,,,2025-01-14 18:42
E004552,U000090,comment,,05/31/2023 12:53,,Edge,,unknown,,2023-05-31 12:53
E003667,U001475,doc_edit,,2023-05-07,mobile,,,,TRUE,2023-05-07 0:48
E006332,u001032,doc_create,,2024-02-16 6:11,tablet,Chrome,,unknown,,2024-02-16 6:11
E003040,U001859,integration_connect,,2024-02-15 15:26,desktop,Edge,,unknown,0,2024-02-15 15:26
E005072,u000903,doc_create,,02/24/2025 23:39,,Firefox,,1590,FALSE,2025-02-24 23:39
E008092,U000148,export,,2025-01-09 4:56,,Brave,Android,,1,2025-01-09 4:56
E002548,U000503,doc_create,,2024-01-21 7:41,DESKTOP,Safari,Android,1497,1,2024-01-21 7:41
E002990,U000766,doc_edit,,2024-01-09,,Edge,macOS,1308,TRUE,2024-01-09 13:54
E006539,U000383,export,,2023-06-23,DESKTOP,,iOS,,1,2023-06-23 11:40
E003446,U000804,share,,2024-03-13,,Firefox,Windows,unknown,TRUE,2024-03-13 0:04
E006319,U002500,search,,2023-02-10 16:24,DESKTOP,,macOS,unknown,TRUE,2023-02-10 16:24
E004289,U002057,integration_connect,,12/15/2024 06:07,mobile,,macOS,1646,TRUE,2024-12-15 6:07
E001306,U000249,PAGE_VIEW,/pricing,2024-06-15,tablet,Brave,,unknown,TRUE,2024-06-15 21:21
E008132,U001616,integration_connect,,08/22/2024 13:47,tablet,,Android,90,TRUE,2024-08-22 13:47
E002352,U001808,share,,05/19/2023 00:27,,Brave,,,TRUE,2023-05-19 0:27
E003950,U000501,share,,01/25/2023 22:11,,Safari,,,FALSE,2023-01-25 22:11
E000288,U002542,DOC_EDIT,,2023-04-21 0:45,tablet,Edge,Windows,unknown,TRUE,2023-04-21 0:45
E001040,U001649,SHARE,,11/13/2024 14:01,mobile,Chrome,,,FALSE,2024-11-13 14:01
E004932,U001823,login,/admin,2024-01-20,desktop,Brave,Windows,,,2024-01-20 2:01
E007349,U000590,ai_search,,,tablet,Edge,Android,1472,FALSE,2024-06-04 16:58
E007414,U002355,search,,11/16/2024 16:49,,,,,,2024-11-16 16:49
E005882,U000482,integration_error,,05/25/2023 05:32,,,macOS,unknown,1,2023-05-25 5:32
E000880,U000152,doc_edit,,07/12/2023 10:23,,,iOS,unknown,FALSE,2023-07-12 10:23
E007352,U002163,integration_connect,,2024-05-30 13:43,tablet,Brave,Windows,unknown,1,2024-05-30 13:43
E001132,U001517,logout,/search,2025-02-08,mobile,Edge,Windows,922,,2025-02-08 9:00
E001698,U001513,doc_delete,,2024-03-24 7:16,desktop,,,,FALSE,2024-03-24 7:16
E000482,U001135,login,/billing,0000-00-00 00:00:00,,Safari,Linux,unknown,,2024-04-24 14:18
E007256,U000591,doc_delete,,10/19/2023 00:38,mobile,,Linux,,1,2023-10-19 0:38
E004734,U000377,share,,2024-07-07 3:01,DESKTOP,,Windows,,FALSE,2024-07-07 3:01
E006304,U001152,ai_search,,0000-00-00 00:00:00,desktop,Brave,Android,1658,,2024-01-15 15:46
E003698,U001650,doc_edit,,,desktop,,iOS,1225,,2024-04-27 17:49
E005879,U001770,comment,,2025-04-24,,Edge,Windows,926,FALSE,2025-04-24 1:18
E001779,U000642,integration_connect,,2023-10-13 18:25,DESKTOP,,,,FALSE,2023-10-13 18:25
E005356,u000077,doc_edit,,2023-11-05 5:48,,Firefox,macOS,,0,2023-11-05 5:48
E007739,U000034,integration_connect,,2025-03-08,desktop,Chrome,,unknown,1,2025-03-08 9:44
E006591,U002568,share,,06/13/2023 20:43,DESKTOP,,Android,,TRUE,2023-06-13 20:43
E007669,U001609,integration_error,,0000-00-00 00:00:00,tablet,Safari,,unknown,TRUE,2023-07-16 14:55
E000317,U001498,integration_error,,07/29/2023 20:10,mobile,,,unknown,,2023-07-29 20:10
E005305,U001274,logout,/search,2023-08-14,,Chrome,,,1,2023-08-14 15:26
E002245,U000182,page_view,/search,03/06/2025 18:23,mobile,,,,0,2025-03-06 18:23
E004199,U000401,integration_connect,,2023-11-08,,Safari,,,TRUE,2023-11-08 3:50
E001817,U000844,login,/pricing,2024-11-29,tablet,Firefox,iOS,,1,2024-11-29 18:22
E005418,U001883,page_view,/settings,2023-04-25 17:53,DESKTOP,Brave,iOS,unknown,FALSE,2023-04-25 17:53
E008889,U000988,login,/settings,03/06/2023 11:46,,,macOS,1781,FALSE,2023-03-06 11:46
E003047,U000458,doc_delete,,01/11/2024 07:49,desktop,Firefox,macOS,,TRUE,2024-01-11 7:49
 E006858, U001681 ,doc_delete,,02/09/2025 11:06,tablet,Chrome,Windows,,FALSE,2025-02-09 11:06
E000051,U002403,share,,,desktop,Brave,iOS,129,TRUE,2023-05-03 21:36
E002061, U001558 ,export,,0000-00-00 00:00:00,,Firefox,,,FALSE,2023-03-29 13:05
E005109,U000397,comment,,01/30/2023 10:10,desktop,Brave,macOS,unknown,0,2023-01-30 10:10
E005648,U000171,integration_error,,2025-06-06 10:52,,Edge,Linux,1593,,2025-06-06 10:52
E008220,U000353,doc_create,,2023-01-18,mobile,Safari,,,FALSE,2023-01-18 23:01
E004052,U000413,integration_error,,,desktop,Brave,,,FALSE,2023-11-30 9:29
E003098,U002321,login,/docs,2025-05-27 5:21,desktop,Safari,Linux,unknown,TRUE,2025-05-27 5:21
E006408,U000187,export,,2025-05-14,desktop,,macOS,,1,2025-05-14 22:51
E003393,U001774,page_view,/settings,,DESKTOP,Safari,Android,,,2024-10-20 19:39
E000045,U001656,login,/onboarding,,,Edge,,unknown,0,2024-12-29 22:43
E008036,u001286,comment,,0000-00-00 00:00:00,desktop,Firefox,Linux,,,2023-10-31 17:25
E003580,U002291,export,,2025-01-06 1:58,,Brave,macOS,unknown,0,2025-01-06 1:58
E005714,u001954,comment,,2023-02-01,DESKTOP,Firefox,Android,,0,2023-02-01 0:19
E002055,U001919,search,,0000-00-00 00:00:00,,Edge,iOS,,,2023-03-19 15:44
E007428,U001870,ai_search,,2025-01-09,DESKTOP,,Linux,379,FALSE,2025-01-09 23:30
E004414,U000520,login,/help,2024-01-17,,Safari,,442,,2024-01-17 22:13
E000853,U000465,doc_delete,,,,,,,TRUE,2025-03-30 2:53
E008336, u000810 ,login,/dashboard,2024-10-31 16:28,,Chrome,Windows,,TRUE,2024-10-31 16:28
E003200,U000496,export,,2023-03-16,mobile,Chrome,,,,2023-03-16 6:47
E000710, U000367 ,integration_connect,,2024-01-24 6:19,tablet,Brave,macOS,14,,2024-01-24 6:19
E000919,U000465,SEARCH,,05/15/2024 18:17,mobile,Brave,macOS,632,,2024-05-15 18:17
E004880,U000456,doc_create,,2023-11-06 8:39,mobile,,macOS,,,2023-11-06 8:39
E003167,U001660,share,,07/26/2024 18:07,,,,,,2024-07-26 18:07
E003040,U000279,doc_create,,10/17/2023 19:17,mobile,Chrome,Windows,,FALSE,2023-10-17 19:17
E003173,U000255,logout,/search,03/03/2023 13:20,tablet,,Windows,,0,2023-03-03 13:20
E004199,U001702,share,,2025-02-28 22:54,,Safari,Linux,,TRUE,2025-02-28 22:54
E000064,U000805,comment,,02/22/2025 19:46,,,iOS,unknown,,2025-02-22 19:46
E008753,U000846,doc_delete,,2023-10-21 20:25,desktop,Safari,Linux,1653,,2023-10-21 20:25
E004199,U001037,doc_edit,,2023-01-31,,Brave,iOS,,FALSE,2023-01-31 8:23
E000258, U002417 ,login,/pricing,09/19/2023 20:30,,Firefox,macOS,399,FALSE,2023-09-19 20:30
E003895,U002028,integration_connect,,2023-06-29 6:46,DESKTOP,,iOS,unknown,1,2023-06-29 6:46
E002152,U002259,page_view,/docs,2024-11-15,desktop,Edge,macOS,,FALSE,2024-11-15 15:54
E005867,U000603,export,,04/30/2024 16:51,tablet,Edge,macOS,,1,2024-04-30 16:51
E005458, U002567 ,share,,09/04/2024 14:22,tablet,,macOS,,TRUE,2024-09-04 14:22
E000207,U002086,logout,/integrations,,,Safari,Android,,FALSE,2025-02-21 2:37
E000058,U002417,doc_create,,2025-04-30,tablet,,Linux,unknown,TRUE,2025-04-30 18:32
E006845,U001085,integration_connect,,,desktop,Chrome,,,0,2023-08-29 13:47
E003970,U001367,doc_create,,0000-00-00 00:00:00,mobile,Safari,Windows,,TRUE,2024-08-03 13:16
E000827,U000826,ai_search,,2023-03-16,mobile,Safari,Linux,,0,2023-03-16 11:51
E005272,U001832,login,/search,2023-04-09,,Edge,Android,,1,2023-04-09 12:30
E007271,U000975,doc_create,,2024-08-13 19:40,DESKTOP,Edge,Android,,,2024-08-13 19:40
E006659,U001517,export,,05/26/2023 23:53,,Chrome,Windows,1526,0,2023-05-26 23:53
E004602,U001620,comment,,0000-00-00 00:00:00,DESKTOP,Safari,,unknown,FALSE,2023-01-11 19:32
E008141,U002435,export,,2024-03-21,desktop,,,unknown,FALSE,2024-03-21 11:34
E007862,U000090,page_view,/onboarding,2023-12-09 16:23,mobile,Chrome,Android,,,2023-12-09 16:23
E003714,U001522,integration_connect,,2023-11-01,,Chrome,Android,unknown,,2023-11-01 19:53
E001105,U000029,share,,2024-12-02 22:33,mobile,Edge,,84,TRUE,2024-12-02 22:33
E000881,U000797,comment,,2025-06-05,,Chrome,Windows,unknown,,2025-06-05 12:18
 E004652,U000076,login,/integrations,0000-00-00 00:00:00,,,Android,,TRUE,2024-05-11 9:19
E006294,u000622,login,/settings,2023-06-22,mobile,Safari,Linux,unknown,,2023-06-22 15:37
E008913,U002111,page_view,/dashboard,,DESKTOP,Chrome,Linux,,0,2023-09-04 11:03
E005023,U000458,doc_edit,,,tablet,Brave,Android,,FALSE,2023-09-22 9:43
E006302,U001377,doc_create,,07/05/2023 11:06,tablet,Safari,macOS,unknown,FALSE,2023-07-05 11:06
E000272,U000766,doc_create,,07/27/2024 08:13,,Edge,Windows,,,2024-07-27 8:13
E006076,U000975,doc_delete,,0000-00-00 00:00:00,tablet,Edge,,,1,2023-08-22 4:48
E004589,U000861,login,/integrations,01/30/2023 03:27,desktop,Chrome,iOS,,TRUE,2023-01-30 3:27
E007988,U001510,doc_edit,,2024-03-03 22:03,DESKTOP,Chrome,Android,,FALSE,2024-03-03 22:03
E003519,USR-002258,search,,2023-08-08,mobile,Safari,,unknown,FALSE,2023-08-08 7:01
 E004577,U001105,search,,2024-01-24,,Edge,Linux,,FALSE,2024-01-24 2:39
E002238,U001734,doc_create,,2023-01-07 8:40,tablet,,Linux,,TRUE,2023-01-07 8:40
E007025,U001017,doc_delete,,2024-06-23,mobile,Chrome,,,FALSE,2024-06-23 7:06
E007462,U002206,comment,,02/17/2025 15:29,tablet,,,,TRUE,2025-02-17 15:29
E001216,U001421,logout,/docs,08/27/2024 19:42,,Brave,,1388,1,2024-08-27 19:42
E002574,U002005,export,,2023-06-20 23:04,mobile,Safari,Windows,unknown,1,2023-06-20 23:04
E001555,U000507,doc_delete,,2025-02-21 13:16,desktop,Edge,Android,unknown,,2025-02-21 13:16
E005065,U002041,doc_delete,,04/27/2024 23:05,desktop,Firefox,,,FALSE,2024-04-27 23:05
E006696,U002331,share,,0000-00-00 00:00:00,,Safari,,,,2024-10-25 16:43
E004010,U000101,AI_SEARCH,,03/09/2025 18:01,DESKTOP,Safari,Linux,,FALSE,2025-03-09 18:01
E002627,U002307,integration_error,,,tablet,Chrome,macOS,unknown,,2023-06-04 22:02
E001051,U002063,share,,2025-01-29 9:57,mobile,Edge,Linux,1647,TRUE,2025-01-29 9:57
E007387,USR-002175,logout,/dashboard,09/23/2023 06:09,desktop,,Windows,,TRUE,2023-09-23 6:09
E005870,U001827,login,/billing,2025-03-13,,Safari,,,FALSE,2025-03-13 0:31
E006455,U001988,integration_error,,0000-00-00 00:00:00,,Brave,Android,,TRUE,2023-08-29 6:54
E006404,U000846,login,/pricing,2025-03-16,,,Linux,1508,FALSE,2025-03-16 23:35
E008968,U002152,comment,,02/02/2023 16:28,desktop,,,,,2023-02-02 16:28
E005074,U000525,doc_create,,2024-12-04,tablet,Firefox,Linux,,FALSE,2024-12-04 17:01
E001071,U002174,login,/search,2023-10-21 1:59,,Chrome,macOS,unknown,0,2023-10-21 1:59
E000654, U000365 ,ai_search,,06/12/2025 06:14,,Safari,iOS,,,2025-06-12 6:14
E006613,U000204,share,,05/06/2024 00:42,,Chrome,,unknown,1,2024-05-06 0:42
E007384,U001325,login,/billing,2025-02-03,desktop,Edge,iOS,,TRUE,2025-02-03 5:31
E006134,U000171,login,/search,2023-05-27 8:40,tablet,Edge,,958,,2023-05-27 8:40
E006223, u000906 ,doc_edit,,2023-07-28,desktop,,,,1,2023-07-28 14:55
E006051,u000307,page_view,/search,2024-12-27 10:36,desktop,,Linux,unknown,TRUE,2024-12-27 10:36
E003917,U000577,doc_edit,,08/17/2023 23:44,DESKTOP,Safari,Android,,,2023-08-17 23:44
E003937,U002283,doc_delete,,08/16/2024 17:02,,Brave,iOS,,FALSE,2024-08-16 17:02
E008986,U002589,share,,,mobile,,Windows,unknown,FALSE,2024-05-21 17:07
E007695,U001975,logout,/settings,05/07/2024 04:40,desktop,,Android,,1,2024-05-07 4:40
E007003,U000757,login,/docs,,,Firefox,Windows,,,2025-01-13 8:51
E006925,U002176,share,,2025-01-04,,Brave,Linux,unknown,FALSE,2025-01-04 10:17
E008673,U000432,integration_error,,2023-03-07,tablet,Safari,macOS,unknown,TRUE,2023-03-07 14:07
E001438,U000205,page_view,/admin,0000-00-00 00:00:00,mobile,Safari,iOS,1017,FALSE,2023-08-12 16:34
E000011,U000320,comment,,,desktop,Safari,Android,,,2025-03-17 12:33
E002259,u000602,ai_search,,2023-07-29,mobile,Safari,Windows,unknown,TRUE,2023-07-29 2:57
E000138,U000689,integration_error,,08/03/2024 09:06,mobile,Brave,,,FALSE,2024-08-03 9:06
E001874,U002419,page_view,/help,01/15/2023 11:03,,Edge,,,TRUE,2023-01-15 11:03
E003056,U002303,doc_create,,02/21/2024 22:05,,Firefox,iOS,unknown,TRUE,2024-02-21 22:05
e006667,U002387,ai_search,,2023-10-31 0:31,DESKTOP,Brave,Linux,,1,2023-10-31 0:31
E000192,U001685,integration_error,,05/20/2023 10:49,DESKTOP,,,unknown,FALSE,2023-05-20 10:49
E002199, U000678 ,doc_delete,,2023-11-20 12:28,DESKTOP,,Windows,,FALSE,2023-11-20 12:28
E008385,usr-000771,doc_edit,,0000-00-00 00:00:00,desktop,Brave,Android,,0,2023-11-04 23:36
E005993,U000443,integration_connect,,02/12/2023 12:39,,,,,TRUE,2023-02-12 12:39
E003900,U000976,comment,,2025-01-22 13:54,DESKTOP,,,1786,0,2025-01-22 13:54
E005098,U002284,logout,/docs,07/21/2024 18:54,tablet,Brave,iOS,unknown,TRUE,2024-07-21 18:54
E002524,U000579,integration_error,,2023-04-22,,Edge,Android,unknown,0,2023-04-22 23:31
E005559,U001474,doc_create,,2023-09-03,DESKTOP,,Android,unknown,0,2023-09-03 23:38
E001175,U000027,ai_search,,2023-01-10 3:54,desktop,Firefox,macOS,,0,2023-01-10 3:54
E003347,U000673,doc_edit,,10/24/2024 04:41,DESKTOP,Chrome,macOS,unknown,0,2024-10-24 4:41
E006896,U001093,doc_delete,,03/18/2023 13:56,tablet,Firefox,Windows,,TRUE,2023-03-18 13:56
E002603,U001549,export,,2023-06-12,,,Linux,,,2023-06-12 2:43
E004032,U001698,doc_edit,,12/10/2024 04:04,tablet,Safari,,,,2024-12-10 4:04
E008216,U002177,integration_error,,2024-09-06,mobile,,Windows,,0,2024-09-06 10:35
E001211,U000993,logout,/pricing,2023-08-30,mobile,Firefox,Windows,unknown,TRUE,2023-08-30 11:35
E008969,U000170,logout,/search,03/24/2024 08:15,,Firefox,iOS,863,FALSE,2024-03-24 8:15
E004323,U001578,integration_connect,,02/19/2023 10:40,,Chrome,,,TRUE,2023-02-19 10:40
E007177,U000636,integration_error,,2023-10-12,desktop,Firefox,Linux,unknown,TRUE,2023-10-12 15:10
E006894,U001774,login,/dashboard,2024-11-19,mobile,Edge,Linux,unknown,0,2024-11-19 15:10
E008142, U000818 ,search,,2024-03-27 2:14,desktop,,iOS,unknown,1,2024-03-27 2:14
E000397,u002440,doc_create,,2025-05-16,DESKTOP,Brave,Windows,unknown,,2025-05-16 20:48
E003582,U000567,integration_connect,,06/06/2024 14:49,,Safari,Android,unknown,FALSE,2024-06-06 14:49
E007498,U001024,page_view,/admin,2023-08-16,tablet,Brave,iOS,,TRUE,2023-08-16 18:59
E003432,U001646,search,,2023-10-11 12:01,,,Android,947,TRUE,2023-10-11 12:01
E004597,U001833,export,,2024-01-14 17:37,,,macOS,,TRUE,2024-01-14 17:37
E002609,U001935,logout,/billing,02/01/2025 10:58,desktop,,,,1,2025-02-01 10:58
E002523,U002577,doc_delete,,0000-00-00 00:00:00,tablet,Brave,macOS,,0,2025-02-07 21:34
E000958,USR-002338,ai_search,,,tablet,Chrome,,,FALSE,2024-11-16 13:32
E001116,U000965,search,,2023-06-03,mobile,,macOS,,1,2023-06-03 9:57
e002114,u002129,search,,09/18/2023 22:26,DESKTOP,Edge,iOS,,TRUE,2023-09-18 22:26
E007577,U001962,logout,/settings,01/16/2025 04:13,,,,unknown,1,2025-01-16 4:13
E003526,U002242,export,,08/09/2024 09:46,,Brave,iOS,,FALSE,2024-08-09 9:46
E007044,U000263,integration_connect,,2024-01-20 11:27,DESKTOP,,Android,unknown,,2024-01-20 11:27
E002075,U000107,integration_connect,,12/18/2023 23:37,DESKTOP,Safari,iOS,,TRUE,2023-12-18 23:37
E008838,U000710,share,,2025-01-02,mobile,Safari,,280,0,2025-01-02 21:45
E008680,U001418,search,,2024-10-17 18:42,DESKTOP,,Linux,923,TRUE,2024-10-17 18:42
E006813,U001681,integration_error,,2024-07-13 12:17,desktop,Firefox,Linux,937,,2024-07-13 12:17
E006425,U000810,logout,/onboarding,2024-03-28 13:28,mobile,Chrome,Android,unknown,TRUE,2024-03-28 13:28
E004997,U002286,doc_delete,,,,Brave,,,TRUE,2024-03-07 22:26
E006849,U000480,LOGOUT,/integrations,2024-03-13 23:07,tablet,Chrome,,unknown,FALSE,2024-03-13 23:07
E007403,USR-001743,doc_edit,,,,Firefox,,,FALSE,2023-08-22 7:34
E007400,U000580,export,,2023-09-16 7:59,mobile,Edge,,1534,TRUE,2023-09-16 7:59
E007041, U000971 ,page_view,/search,10/12/2023 07:45,DESKTOP,,Android,unknown,0,2023-10-12 7:45
E008225,U000364,share,,2023-08-20 0:16,DESKTOP,Firefox,,unknown,0,2023-08-20 0:16
E003803,u002161,ai_search,,04/28/2023 13:34,,Brave,Linux,,1,2023-04-28 13:34
E006551,U001986,doc_delete,,2025-04-11,,Edge,,,0,2025-04-11 2:41
E000073,U000486,login,/onboarding,06/01/2024 04:49,mobile,Brave,iOS,,0,2024-06-01 4:49
E000776,U000202,integration_connect,,2023-03-21,DESKTOP,Chrome,Android,,0,2023-03-21 16:30
E004029,U002454,integration_connect,,2024-05-04 18:38,desktop,Safari,,,0,2024-05-04 18:38
E002367,U002407,ai_search,,2024-06-21 11:03,DESKTOP,Firefox,Android,unknown,TRUE,2024-06-21 11:03
E004919,USR-002014,login,/help,2024-01-17 5:36,,Chrome,iOS,,,2024-01-17 5:36
E003737,u001638,page_view,/dashboard,,,Brave,Windows,797,1,2024-06-12 13:15
E006070,U000267,export,,0000-00-00 00:00:00,desktop,Brave,macOS,,0,2023-10-10 20:02
E006021,U000496,search,,2023-12-26 19:35,tablet,Firefox,Android,,FALSE,2023-12-26 19:35
E003455,U000774,search,,12/06/2023 23:37,,,Android,,0,2023-12-06 23:37
E001384, U001139 ,ai_search,,05/09/2024 19:40,desktop,Firefox,iOS,973,,2024-05-09 19:40
E003434,U000272,login,/settings,0000-00-00 00:00:00,,,iOS,,TRUE,2024-03-13 10:58
E002862,U000760,page_view,/pricing,08/16/2023 13:00,DESKTOP,Chrome,Android,,FALSE,2023-08-16 13:00
E000433,U000400,doc_delete,,2023-12-01,tablet,Firefox,,1393,TRUE,2023-12-01 2:48
E002082,U000721,logout,/onboarding,2023-08-09 2:16,tablet,,iOS,557,0,2023-08-09 2:16
E000646,U001135,page_view,/onboarding,12/07/2023 00:45,,Safari,Windows,1297,FALSE,2023-12-07 0:45
E004930,U002552,share,,06/17/2025 01:05,,,Linux,,FALSE,2025-06-17 1:05
E001615,U000381,integration_error,,2023-09-14,mobile,Edge,,,TRUE,2023-09-14 18:52
E008436,U000270,export,,2023-07-15 15:58,tablet,Brave,Linux,1720,,2023-07-15 15:58
E002182,U000816,doc_edit,,07/07/2024 06:28,tablet,,Android,,FALSE,2024-07-07 6:28
E007404,U002434,integration_connect,,08/06/2024 19:04,,Safari,Android,942,,2024-08-06 19:04
E004004,U000581,doc_create,,2024-04-16 12:33,DESKTOP,Chrome,Linux,,0,2024-04-16 12:33
E007971,U001170,comment,,,tablet,,macOS,1681,,2023-08-30 20:32
E003676,U000954,doc_delete,,04/21/2024 02:23,DESKTOP,,Android,,,2024-04-21 2:23
E006601,U000475,comment,,03/21/2023 23:06,tablet,,,,0,2023-03-21 23:06
E005952,U000333,integration_connect,,2023-07-26,,Edge,Linux,,1,2023-07-26 8:57
E004533,U000140,export,,2023-07-28,tablet,,Windows,208,,2023-07-28 21:04
E003514,U001741,doc_edit,,2024-03-20,DESKTOP,Edge,,,0,2024-03-20 6:07
E008700,U001669,logout,/settings,05/22/2023 20:28,,Safari,Android,unknown,TRUE,2023-05-22 20:28
e005332,U000446,search,,2024-03-21 16:11,tablet,,macOS,,,2024-03-21 16:11
e002534,U002273,export,,2023-10-22,,,,,FALSE,2023-10-22 0:40
E008380,U001951,logout,/search,,,Edge,iOS,unknown,TRUE,2023-04-28 14:44
E003314,U001925,comment,,09/05/2024 13:47,desktop,Chrome,,1513,0,2024-09-05 13:47
E000038,U001951,integration_connect,,09/08/2023 13:20,,Brave,macOS,,TRUE,2023-09-08 13:20
E001619,U001975,integration_error,,05/26/2025 09:12,desktop,Chrome,,873,,2025-05-26 9:12
E006800,U001033,ai_search,,2023-12-15 13:56,,Firefox,Android,1640,0,2023-12-15 13:56
E005556,U002198,logout,/dashboard,01/16/2024 10:57,tablet,Safari,Windows,,,2024-01-16 10:57
E004855,U001750,doc_delete,,09/13/2024 05:29,,,Linux,1168,TRUE,2024-09-13 5:29
E004048,U001344,export,,2025-03-27,tablet,Brave,Windows,unknown,,2025-03-27 11:12
E006613,U001563,export,,06/22/2024 21:51,tablet,Firefox,Linux,unknown,FALSE,2024-06-22 21:51
E000433,U002240,doc_delete,,2023-11-20 22:54,tablet,Safari,Windows,,,2023-11-20 22:54
E006872,U000129,search,,2024-05-31 16:46,mobile,Brave,iOS,,FALSE,2024-05-31 16:46
E005099,U000919,doc_create,,2024-01-23,DESKTOP,Edge,,,0,2024-01-23 8:53
E004812,U001475,logout,/onboarding,,mobile,Edge,,,,2024-01-04 11:22
E002182,U000850,ai_search,,,desktop,Brave,Android,,TRUE,2023-11-29 10:42
E007307,U002301,integration_error,,2023-04-18 8:14,desktop,Edge,,1608,0,2023-04-18 8:14
E007209,USR-001821,ai_search,,2024-11-27 16:05,,,macOS,1763,,2024-11-27 16:05
E008177,U001645,export,,2023-01-31 13:56,,,macOS,660,TRUE,2023-01-31 13:56
E008994,U000011,share,,2024-11-15,mobile,Brave,Linux,,TRUE,2024-11-15 2:36
E004925,U001597,ai_search,,0000-00-00 00:00:00,mobile,,macOS,224,TRUE,2024-10-12 18:45
E000744,U001487,ai_search,,2025-01-07,,,iOS,unknown,TRUE,2025-01-07 17:52
e003467,U001297,LOGIN,/billing,2025-02-22 9:13,desktop,Safari,Android,unknown,,2025-02-22 9:13
E005124,U000024,ai_search,,2023-10-26 19:55,mobile,Edge,Android,unknown,,2023-10-26 19:55
E002730,U001941,comment,,10/01/2024 08:34,desktop,Firefox,,,TRUE,2024-10-01 8:34
E003755,U001657,login,/integrations,01/11/2025 21:42,DESKTOP,Edge,macOS,,1,2025-01-11 21:42
E000053,U000790,search,,05/25/2025 19:24,DESKTOP,Chrome,Windows,,,2025-05-25 19:24
E002674,U002153,export,,06/23/2023 01:44,DESKTOP,,macOS,1413,,2023-06-23 1:44
E000394,U001062,ai_search,,2023-07-03 17:39,tablet,Brave,macOS,unknown,1,2023-07-03 17:39
E006494,U002459,share,,10/25/2023 16:12,mobile,,macOS,,TRUE,2023-10-25 16:12
E002890,U000630,share,,2024-02-16,,Edge,,864,1,2024-02-16 17:56
E002532,U001521,share,,2024-05-14 1:27,mobile,Edge,,,0,2024-05-14 1:27
E003627,U002140,doc_create,,2024-08-31,,Edge,,378,TRUE,2024-08-31 11:00
E000625, U002481 ,page_view,/dashboard,2025-01-18 0:40,mobile,Brave,macOS,1540,TRUE,2025-01-18 0:40
E003973,U000022,doc_edit,,2024-08-03,DESKTOP,Safari,,429,FALSE,2024-08-03 22:39
E007920,U000972,logout,/search,2024-03-22 13:03,,Edge,iOS,1514,,2024-03-22 13:03
E003224,U001635,doc_edit,,2025-01-28 17:13,mobile,,,141,TRUE,2025-01-28 17:13
E003756,U000912,doc_delete,,2023-02-03 23:58,DESKTOP,Safari,Windows,,FALSE,2023-02-03 23:58
E001679,U000522,doc_edit,,05/05/2024 23:41,mobile,Firefox,Android,1145,,2024-05-05 23:41
E000807,U000500,logout,/billing,2023-10-03,mobile,,iOS,,FALSE,2023-10-03 21:34
E008157,U000931,ai_search,,09/01/2023 07:57,tablet,Brave,Linux,1473,1,2023-09-01 7:57
E001375,U000982,doc_edit,,2024-06-24,,,iOS,,,2024-06-24 23:01
E003731,U001477,logout,/help,2023-09-22 9:58,tablet,Edge,macOS,627,1,2023-09-22 9:58
E003946,U002142,ai_search,,2024-09-16,DESKTOP,Edge,macOS,,0,2024-09-16 14:45
E008601,U002334,page_view,/admin,2024-07-17 16:42,tablet,,,,FALSE,2024-07-17 16:42
E003659,U001478,comment,,,DESKTOP,Edge,,,0,2023-10-27 16:42
E000691,U000838,doc_create,,08/30/2023 13:08,,Edge,,unknown,,2023-08-30 13:08
E008509,U002011,share,,2023-09-11 0:42,,Firefox,,522,FALSE,2023-09-11 0:42
E006933,U002430,login,/help,2023-05-12,,,Android,unknown,TRUE,2023-05-12 19:35
E000589, U001902 ,ai_search,,01/28/2025 09:40,mobile,Chrome,iOS,1381,,2025-01-28 9:40
E006384,U000552,doc_delete,,11/02/2024 14:00,,,,,TRUE,2024-11-02 14:00
E004124,U000484,export,,2025-05-21,,Firefox,iOS,1775,TRUE,2025-05-21 20:37
E000057,u002141,doc_edit,,03/16/2024 02:18,desktop,Edge,,unknown,,2024-03-16 2:18
E002871,U002452,page_view,/dashboard,2025-01-09,desktop,Firefox,Android,,1,2025-01-09 8:29
E008068,U002256,search,,10/03/2023 02:08,desktop,Brave,,,1,2023-10-03 2:08
E002842,U000734,doc_delete,,2023-03-26 0:00,tablet,Safari,,,TRUE,2023-03-26 0:00
E008372,U001034,search,,2023-11-07 19:46,,,,unknown,,2023-11-07 19:46
E008334, U000452 ,search,,11/21/2024 13:15,,Brave,,,FALSE,2024-11-21 13:15
E007581,U002474,login,/dashboard,2024-06-13,mobile,Chrome,,,,2024-06-13 10:40
E004076,U001392,logout,/settings,,,Edge,Android,unknown,TRUE,2023-08-14 0:10
E007732,U002156,ai_search,,2024-04-29 9:08,desktop,Safari,iOS,,FALSE,2024-04-29 9:08
E007972,U000655,ai_search,,02/21/2024 12:27,tablet,Firefox,Windows,,FALSE,2024-02-21 12:27
E005176,U000873,integration_connect,,04/04/2023 22:29,,,iOS,,FALSE,2023-04-04 22:29
E002610,U000465,doc_delete,,2024-07-14 5:20,,Brave,macOS,,1,2024-07-14 5:20
E006292,U002015,share,,,DESKTOP,Chrome,Android,,TRUE,2023-06-18 15:19
E003645,U002196,EXPORT,,2024-12-17 14:05,desktop,Chrome,Linux,1656,,2024-12-17 14:05
E004415,U000376,doc_delete,,0000-00-00 00:00:00,tablet,Edge,Linux,1032,TRUE,2025-02-27 3:04
E005280,U000201,doc_delete,,2025-02-13,,Safari,,,FALSE,2025-02-13 10:08
E001457,U000244,export,,04/18/2023 02:12,,Brave,Linux,830,FALSE,2023-04-18 2:12
E002486,U001134,logout,/onboarding,2024-05-02,mobile,Firefox,,,0,2024-05-02 15:18
E004585,U000724,doc_edit,,2025-02-10,,Chrome,macOS,,FALSE,2025-02-10 17:38
E002017,U002202,integration_connect,,2024-07-27,desktop,Firefox,,242,FALSE,2024-07-27 19:31
E007642,U002454,doc_edit,,2023-03-05 1:35,DESKTOP,Edge,macOS,,TRUE,2023-03-05 1:35
E000777,USR-000771,search,,2025-05-07 21:50,,,macOS,1350,1,2025-05-07 21:50
E004331,U000332,page_view,/billing,10/08/2023 17:10,tablet,Edge,Windows,unknown,0,2023-10-08 17:10
E003077,U000813,integration_connect,,10/17/2024 05:31,,Safari,Windows,unknown,,2024-10-17 5:31
E001719,U001915,doc_edit,,2023-06-20 16:44,tablet,,,,1,2023-06-20 16:44
E007490,U001533,export,,2025-04-15 21:46,tablet,,,unknown,1,2025-04-15 21:46
E006830,U001981,search,,01/09/2023 19:34,desktop,,Linux,,,2023-01-09 19:34
E007634,U001260,doc_create,,2024-02-27 21:41,,,,,,2024-02-27 21:41
E002010,U001056,login,/docs,2023-12-10 22:26,,,,unknown,TRUE,2023-12-10 22:26
E002863,U001764,ai_search,,03/20/2023 05:07,desktop,Edge,macOS,unknown,0,2023-03-20 5:07
E000037,U001969,ai_search,,2025-03-13,tablet,,,1264,FALSE,2025-03-13 3:36
E004530,U001468,search,,,tablet,Edge,Linux,1555,FALSE,2023-06-23 7:17
E008982,U000633,ai_search,,2024-11-01 1:14,,,Linux,unknown,FALSE,2024-11-01 1:14
E001786,U001309,doc_edit,,2023-09-14 3:09,tablet,,,,,2023-09-14 3:09
E003746,U002316,doc_edit,,,DESKTOP,Brave,Windows,,FALSE,2023-07-07 8:07
E007434,U001434,login,/dashboard,2024-05-03,DESKTOP,Brave,,807,1,2024-05-03 10:10
E006014,U001686,comment,,,mobile,Chrome,,,FALSE,2023-03-13 19:11
E005087,U001474,comment,,2025-03-10,DESKTOP,Firefox,Android,723,0,2025-03-10 6:35
E006301,U001402,doc_create,,03/17/2023 16:52,,Safari,,976,,2023-03-17 16:52
E008168,U001725,ai_search,,,desktop,,Linux,unknown,0,2024-01-14 5:26
E003113,U000393,login,/admin,2023-07-19,tablet,Brave,,,FALSE,2023-07-19 10:43
E006000, U000847 ,ai_search,,2023-11-06 20:54,DESKTOP,Brave,Linux,unknown,TRUE,2023-11-06 20:54
E003492, U002065 ,share,,2023-07-26,tablet,Edge,Windows,,FALSE,2023-07-26 23:47
E003268,U000987,integration_error,,2024-12-24,desktop,Chrome,Android,,FALSE,2024-12-24 11:59
E008067, U001190 ,export,,2023-09-21 18:13,,Firefox,Android,,TRUE,2023-09-21 18:13
E001259,U000354,COMMENT,,2025-05-08,DESKTOP,Edge,,,TRUE,2025-05-08 23:04
E002514,U000106,logout,/search,2024-04-14,desktop,Firefox,Android,unknown,,2024-04-14 9:02
E001502,U000293,doc_edit,,2023-03-09 3:02,,Safari,macOS,,TRUE,2023-03-09 3:02
E005725,U001223,page_view,/dashboard,2023-02-05,DESKTOP,Firefox,,763,TRUE,2023-02-05 13:31
E002957,U001193,doc_delete,,08/02/2023 04:34,,Edge,,,1,2023-08-02 4:34
E007925,u001612,integration_connect,,2024-10-14 19:52,DESKTOP,Safari,Linux,unknown,TRUE,2024-10-14 19:52
E004925,U000679,integration_error,,06/13/2024 17:19,mobile,,,925,TRUE,2024-06-13 17:19
E001051,U002092,comment,,,tablet,,iOS,,TRUE,2024-10-06 18:14
E006879,U002394,export,,2025-06-01 14:57,,Firefox,Android,,TRUE,2025-06-01 14:57
E008584,U001273,page_view,/settings,06/19/2023 09:05,DESKTOP,Brave,macOS,198,,2023-06-19 9:05
E006762,U000052,integration_connect,,2023-01-07 3:10,,,iOS,unknown,TRUE,2023-01-07 3:10
E008535,U001366,doc_create,,02/10/2023 20:31,,Brave,Linux,839,TRUE,2023-02-10 20:31
E007624,U000256,doc_delete,,2024-01-26 0:33,tablet,,,1634,,2024-01-26 0:33
E002847,U001618,logout,/search,2023-08-16,desktop,,Windows,,1,2023-08-16 23:19
E006215,U000446,doc_edit,,04/30/2023 23:23,DESKTOP,Brave,,244,TRUE,2023-04-30 23:23
E004955,U001931,comment,,2023-02-27,,,Linux,unknown,FALSE,2023-02-27 6:22
E003547,U001942,page_view,/onboarding,05/21/2024 23:41,tablet,Chrome,macOS,,FALSE,2024-05-21 23:41
E006727,U001253,doc_delete,,2023-04-06 1:37,desktop,Chrome,macOS,1275,1,2023-04-06 1:37
E001197,U001564,export,,2023-09-23,desktop,Chrome,Windows,,,2023-09-23 2:06
E003116,U001468,doc_create,,,tablet,,,,1,2023-10-26 23:41
E002095,U001684,page_view,/settings,,tablet,Edge,Linux,1426,TRUE,2025-05-12 16:59
E008706,U001102,export,,,tablet,Safari,iOS,unknown,0,2024-03-13 5:56
E006965,USR-002420,login,/dashboard,12/31/2024 12:01,,Safari,macOS,,,2024-12-31 12:01
E000549,U001712,share,,05/10/2025 17:08,mobile,Chrome,,845,,2025-05-10 17:08
E006884,U000606,share,,2023-11-27,DESKTOP,Safari,macOS,,FALSE,2023-11-27 12:15
E003059,U000871,logout,/admin,2025-01-26 10:00,tablet,,iOS,,FALSE,2025-01-26 10:00
E001164,U001695,doc_delete,,2023-03-07,desktop,,,,,2023-03-07 7:46
E006498,U001702,doc_edit,,01/26/2025 06:46,desktop,Firefox,macOS,,0,2025-01-26 6:46
e008522, U000614 ,page_view,/help,2023-06-28 11:18,,Edge,Windows,,1,2023-06-28 11:18
E002673,u000692,share,,2024-11-30,,,,,1,2024-11-30 16:59
E005648,U000838,doc_delete,,01/13/2025 22:14,DESKTOP,Brave,,unknown,0,2025-01-13 22:14
E001028,U001713,page_view,/dashboard,2025-06-01 5:58,tablet,Chrome,macOS,,0,2025-06-01 5:58
E004698,U002263,doc_delete,,2024-02-21,desktop,,Android,,0,2024-02-21 14:30
E004677,U001258,integration_connect,,0000-00-00 00:00:00,mobile,,iOS,1643,1,2024-09-18 7:06
E001413,U000268,integration_error,,2023-10-16,,,macOS,1435,1,2023-10-16 20:18
E002349,U000729,ai_search,,0000-00-00 00:00:00,desktop,,macOS,,FALSE,2023-07-16 1:38
E000308,U000574,login,/admin,2024-11-04 20:28,,Edge,Android,331,TRUE,2024-11-04 20:28
E006487,U002107,page_view,/integrations,2023-02-28 23:32,mobile,Edge,Linux,,TRUE,2023-02-28 23:32
E006544,U001668,comment,,2025-04-12,tablet,Chrome,macOS,,,2025-04-12 11:36
E006262,U002230,integration_error,,2024-08-06,DESKTOP,Firefox,macOS,587,,2024-08-06 18:06
E007864,U000369,login,/integrations,2025-02-14,mobile,,Linux,,TRUE,2025-02-14 2:29
E006997,u000239,integration_connect,,12/09/2024 20:08,mobile,Brave,macOS,,TRUE,2024-12-09 20:08
E003745, U000114 ,doc_edit,,2024-08-03 5:20,mobile,,Linux,,1,2024-08-03 5:20
E007275,U000625,doc_edit,,2023-06-14,,Firefox,iOS,,FALSE,2023-06-14 22:39
E005540,U000772,page_view,/integrations,0000-00-00 00:00:00,mobile,Firefox,macOS,,TRUE,2024-01-29 7:34
E003786, U000838 ,comment,,,tablet,Firefox,Linux,1684,1,2024-05-23 4:04
E007150,U000712,logout,/admin,2023-12-26 6:56,mobile,,Windows,,0,2023-12-26 6:56
E000991,U000249,doc_delete,,2023-05-31 8:10,mobile,Firefox,Android,unknown,0,2023-05-31 8:10
E007800,U001532,search,,2024-10-30,tablet,Chrome,Windows,,FALSE,2024-10-30 1:41
E004800,U000417,doc_create,,09/22/2023 06:54,DESKTOP,,,,FALSE,2023-09-22 6:54
E004897,U001389,export,,2023-04-18 20:11,,Safari,,770,FALSE,2023-04-18 20:11
E000339,U002325,comment,,2023-08-04,,Firefox,,,,2023-08-04 6:42
E006719,USR-000326,doc_delete,,,mobile,,Windows,,TRUE,2024-05-02 0:49
E004565,U000496,integration_error,,,tablet,Safari,Windows,,FALSE,2023-03-07 16:56
E006919,U001791,comment,,11/06/2023 17:20,desktop,Chrome,macOS,unknown,TRUE,2023-11-06 17:20
E007001,U001005,logout,/integrations,0000-00-00 00:00:00,,,macOS,480,TRUE,2023-05-03 18:57
 E007046,U000832,INTEGRATION_ERROR,,2025-01-16 1:29,,Chrome,,,1,2025-01-16 1:29
E008534,U001601,page_view,/admin,2024-04-10,tablet,Safari,Windows,,FALSE,2024-04-10 14:47
E002307,U000547,export,,2023-07-30 5:42,mobile,Safari,Linux,,,2023-07-30 5:42
E007016,U001503,share,,2023-10-19 1:43,,,Android,,1,2023-10-19 1:43
E003870,u001893,doc_delete,,09/13/2023 04:16,tablet,Edge,Windows,117,0,2023-09-13 4:16
E002976,U000905,comment,,,,Safari,Windows,unknown,1,2025-02-27 14:37
E003128,U001007,search,,,mobile,Firefox,Windows,1521,,2023-04-01 22:43
E002258,U001197,login,/billing,09/30/2023 03:54,tablet,Brave,,unknown,,2023-09-30 3:54
E000618,U001540,comment,,2023-12-16,desktop,Safari,Linux,unknown,,2023-12-16 12:57
E003146,U000370,doc_create,,10/14/2024 14:22,tablet,,,1285,FALSE,2024-10-14 14:22
E003338,U000996,EXPORT,,2025-06-04 20:36,,,iOS,unknown,TRUE,2025-06-04 20:36
E003177,U000209,doc_edit,,06/09/2023 07:22,,Safari,Linux,,FALSE,2023-06-09 7:22
E004103,U001441,doc_create,,2025-03-01,,Brave,Windows,260,1,2025-03-01 22:54
E008118,U000626,integration_error,,2023-10-14 5:33,,Firefox,iOS,,,2023-10-14 5:33
E005013,U001994,login,/pricing,2023-07-07 14:24,tablet,Firefox,iOS,736,,2023-07-07 14:24
E005479,U001663,ai_search,,03/01/2023 13:15,tablet,,Linux,,TRUE,2023-03-01 13:15
E001923,U000410,export,,07/13/2024 19:19,desktop,Firefox,Linux,1780,TRUE,2024-07-13 19:19
E008984,U001566,doc_edit,,04/17/2025 08:08,DESKTOP,Chrome,Linux,776,FALSE,2025-04-17 8:08
E003913,U000596,share,,04/30/2023 01:17,mobile,,Windows,,FALSE,2023-04-30 1:17
E002076,U001566,doc_delete,,2023-01-13,,Chrome,macOS,,TRUE,2023-01-13 9:55
E006718,U001342,logout,/dashboard,0000-00-00 00:00:00,desktop,Edge,,unknown,1,2024-09-09 19:34
E002957,U001200,doc_delete,,2023-09-11 8:57,desktop,Firefox,,863,TRUE,2023-09-11 8:57
E006953,U002289,logout,/docs,2024-06-13 10:06,,Safari,macOS,,,2024-06-13 10:06
E004357,U002195,page_view,/help,11/04/2024 15:52,desktop,Brave,,1003,,2024-11-04 15:52
E008813,U000219,page_view,/onboarding,2023-10-20 23:48,tablet,Safari,,unknown,,2023-10-20 23:48
e003220,U002128,doc_create,,2023-11-29,mobile,Edge,,861,,2023-11-29 17:38
E002911,U000070,page_view,/billing,2024-09-25 3:34,DESKTOP,Brave,,,,2024-09-25 3:34
E005357,U001024,doc_create,,2024-07-25,desktop,Firefox,Windows,,,2024-07-25 2:12
E004075,U000145,doc_edit,,05/03/2025 18:01,,Firefox,,1210,FALSE,2025-05-03 18:01
E003601,u000726,ai_search,,2023-01-04 6:33,,Firefox,Windows,315,TRUE,2023-01-04 6:33
E006798,U000256,export,,2023-01-12 4:02,,Chrome,Linux,1596,TRUE,2023-01-12 4:02
E002408,U001355,page_view,/pricing,2023-08-30 14:34,,,iOS,1656,1,2023-08-30 14:34
E002359,U001027,logout,/help,01/19/2025 02:16,,Firefox,Android,,1,2025-01-19 2:16
E008386,U001445,integration_error,,12/09/2024 05:36,,Firefox,Linux,,TRUE,2024-12-09 5:36
E001219,U002006,export,,12/15/2024 02:44,tablet,,macOS,,0,2024-12-15 2:44
E000106,u000777,doc_delete,,2024-08-22,mobile,Edge,iOS,unknown,FALSE,2024-08-22 8:20
E008797, U002344 ,page_view,/pricing,2023-03-22,tablet,Firefox,,,TRUE,2023-03-22 16:54
E007775,u000187,ai_search,,0000-00-00 00:00:00,,Firefox,,1579,FALSE,2024-12-16 16:26
E003889,U001673,logout,/dashboard,,tablet,,Android,,TRUE,2024-04-14 14:11
E008425,U002020,share,,2024-05-08,DESKTOP,Safari,,,,2024-05-08 23:00
E002144,U001362,comment,,08/08/2023 00:34,mobile,Chrome,,,0,2023-08-08 0:34
E006861,U001566,search,,2025-05-17 3:43,mobile,Chrome,iOS,,TRUE,2025-05-17 3:43
E004796,U000899,doc_edit,,05/11/2025 08:35,mobile,,iOS,743,FALSE,2025-05-11 8:35
E006481,U000313,ai_search,,03/27/2024 14:23,DESKTOP,Safari,Linux,,TRUE,2024-03-27 14:23
E006272,U000340,share,,2024-03-21 11:04,,Safari,,unknown,TRUE,2024-03-21 11:04
E002918,U002358,integration_error,,0000-00-00 00:00:00,,Edge,Windows,,0,2023-11-08 0:55
E004766,U001737,logout,/admin,,tablet,Brave,,unknown,,2023-05-25 19:48
E008971,U002316,doc_create,,2023-09-29 2:07,desktop,,,unknown,FALSE,2023-09-29 2:07
E008189,U002554,doc_create,,2024-02-23 4:20,,Safari,,,TRUE,2024-02-23 4:20
E008248,U000238,comment,,,,Chrome,macOS,unknown,TRUE,2023-12-15 1:34
E003170,U000046,doc_edit,,2024-01-12 1:20,DESKTOP,Brave,Linux,,1,2024-01-12 1:20
e007271,u000508,comment,,2024-08-26 3:17,,Chrome,Linux,,TRUE,2024-08-26 3:17
E002525,U001034,doc_edit,,06/03/2025 03:24,DESKTOP,Safari,macOS,unknown,TRUE,2025-06-03 3:24
E007338,U000623,comment,,0000-00-00 00:00:00,,,Linux,unknown,,2024-04-29 17:42
E008538,U001118,integration_connect,,08/14/2023 02:34,,Firefox,iOS,248,0,2023-08-14 2:34
E006583,U001630,page_view,/integrations,2023-10-18,tablet,Safari,,,,2023-10-18 12:12
E005517,U001117,doc_create,,2024-03-29 3:14,desktop,Edge,Android,,TRUE,2024-03-29 3:14
E004470,U000211,doc_delete,,12/18/2024 16:31,,Safari,,,,2024-12-18 16:31
E004009,U002287,doc_create,,2023-04-14 15:20,,Safari,iOS,,FALSE,2023-04-14 15:20
E006049,U000907,doc_edit,,11/29/2023 06:04,,,Windows,,1,2023-11-29 6:04
E006197,U001070,ai_search,,01/19/2023 15:07,,Brave,Android,164,1,2023-01-19 15:07
E000929,U001218,login,/billing,04/10/2025 04:17,desktop,,,unknown,FALSE,2025-04-10 4:17
E004912,U002486,export,,2023-07-27 22:02,desktop,Firefox,Linux,,,2023-07-27 22:02
E008062,U001293,share,,2024-11-25 21:55,tablet,Safari,Linux,unknown,,2024-11-25 21:55
E001051,U000309,logout,/dashboard,0000-00-00 00:00:00,,Chrome,Android,,0,2023-03-31 1:24
E008465,U000741,login,/onboarding,05/08/2025 21:49,DESKTOP,Chrome,,578,TRUE,2025-05-08 21:49
E005886,U000955,page_view,/settings,2025-06-12 1:14,DESKTOP,,Linux,,FALSE,2025-06-12 1:14
E003208,U001430,share,,04/19/2023 06:56,,,Linux,291,,2023-04-19 6:56
E006794,U000581,integration_connect,,05/12/2023 09:31,,Edge,iOS,1308,FALSE,2023-05-12 9:31
E001962,U002437,doc_create,,,desktop,,,,FALSE,2024-06-13 4:05
E004467,u001365,login,/admin,2025-03-25,mobile,Edge,,,0,2025-03-25 18:32
E004630,U000890,ai_search,,0000-00-00 00:00:00,tablet,Brave,,unknown,1,2023-10-23 12:59
E005517,U000020,doc_create,,2024-02-08,desktop,Safari,,,0,2024-02-08 8:34
E007801,U000455,integration_connect,,05/26/2025 17:11,desktop,,,,TRUE,2025-05-26 17:11
E002610,U002286,integration_error,,01/01/2025 22:03,mobile,Edge,iOS,,FALSE,2025-01-01 22:03
E003146,U001149,doc_delete,,0000-00-00 00:00:00,,Edge,Windows,,1,2024-09-28 13:16
E003550,U001055,comment,,03/01/2025 12:28,mobile,,Android,,FALSE,2025-03-01 12:28
E007591,U000690,COMMENT,,,,Brave,Android,unknown,TRUE,2023-02-07 0:02
e001271, U001143 ,export,,07/22/2023 22:06,desktop,,Android,unknown,TRUE,2023-07-22 22:06
E006776,U001286,page_view,/help,2023-06-18 9:01,tablet,Edge,macOS,,1,2023-06-18 9:01
E005852,U002181,logout,/docs,2025-03-25,desktop,,Windows,216,TRUE,2025-03-25 22:30
E003431,u001191,login,/integrations,07/01/2023 21:12,DESKTOP,,Windows,,,2023-07-01 21:12
E005974,U001504,export,,04/03/2025 23:17,,,Windows,1778,,2025-04-03 23:17
E001560,U002108,search,,08/13/2023 16:41,,Edge,macOS,unknown,TRUE,2023-08-13 16:41
E004569,U000194,LOGOUT,/docs,2025-01-27 15:43,desktop,Chrome,iOS,,,2025-01-27 15:43
E002289,U000514,login,/search,2023-03-14 17:27,,Edge,,,,2023-03-14 17:27
E005278,U000183,integration_error,,2024-08-24,mobile,Chrome,macOS,1123,TRUE,2024-08-24 22:42
E002252,U002421,INTEGRATION_ERROR,,01/29/2023 18:46,,Edge,Linux,,,2023-01-29 18:46
E004553, U002463 ,doc_delete,,04/26/2023 13:14,DESKTOP,Safari,,unknown,TRUE,2023-04-26 13:14
E002096,U001847,export,,08/24/2023 02:51,DESKTOP,,,1329,,2023-08-24 2:51
E007120,U001263,integration_error,,05/28/2025 20:48,mobile,Brave,Windows,546,TRUE,2025-05-28 20:48
E004139,U000323,ai_search,,2024-12-04,mobile,Edge,Windows,,,2024-12-04 1:14
E003207,U002420,doc_delete,,02/27/2024 16:51,DESKTOP,Firefox,Windows,,TRUE,2024-02-27 16:51
E001735,U001221,doc_delete,,2024-06-02 11:33,,Brave,Windows,unknown,,2024-06-02 11:33
E005663,U000134,search,,2025-04-22 9:28,,Safari,,223,1,2025-04-22 9:28
E005442,U001238,login,/search,2025-03-23,tablet,,macOS,,FALSE,2025-03-23 6:50
E004130,U000710,ai_search,,03/04/2024 22:20,tablet,Edge,,1767,TRUE,2024-03-04 22:20
E004794,U000734,ai_search,,09/02/2023 10:58,tablet,,,,,2023-09-02 10:58
E002382,U002579,login,/pricing,,desktop,Edge,,1713,0,2025-02-13 7:55
E004860,U000271,comment,,2024-02-12,desktop,Firefox,Android,,1,2024-02-12 19:22
E000298,U001801,logout,/billing,,,Safari,Linux,,0,2023-07-24 12:42
E002278,U000415,login,/docs,2025-03-28,mobile,Safari,,,TRUE,2025-03-28 20:51
E000247,U000573,login,/integrations,02/01/2023 06:00,DESKTOP,Firefox,macOS,,0,2023-02-01 6:00
E006282,U001364,export,,2024-09-01,tablet,Safari,iOS,,FALSE,2024-09-01 20:30
E001122,U001629,share,,11/24/2024 13:17,,,,945,FALSE,2024-11-24 13:17
E000104,USR-000922,logout,/help,2024-03-26,desktop,,,873,FALSE,2024-03-26 11:46
E008635,U001860,doc_delete,,2023-02-19 10:02,,,Android,,FALSE,2023-02-19 10:02
E008933,U001595,integration_error,,,DESKTOP,,Windows,,,2024-02-14 4:36
E007304,U000167,comment,,2024-09-01,desktop,,Windows,unknown,0,2024-09-01 12:52
E002622,U000001,doc_delete,,01/15/2023 14:10,tablet,Safari,Windows,,,2023-01-15 14:10
e001575,U000012,share,,2023-08-17,,Safari,Windows,,0,2023-08-17 3:37
E002029,U000174,logout,/search,0000-00-00 00:00:00,,,iOS,641,FALSE,2023-01-16 19:06
E006437,u001698,export,,2023-10-30 18:57,DESKTOP,Brave,Windows,204,1,2023-10-30 18:57
E001183,U001130,doc_create,,05/06/2024 03:16,,Brave,,unknown,,2024-05-06 3:16
E007129,U000396,page_view,/search,2023-08-03,desktop,Brave,iOS,unknown,FALSE,2023-08-03 13:52
E004342,U002596,doc_create,,10/09/2023 18:06,,Brave,,1205,,2023-10-09 18:06
E001033,U000932,search,,2023-03-25,DESKTOP,Safari,,unknown,FALSE,2023-03-25 15:29
E001750,U002239,doc_create,,2024-05-16 6:17,mobile,Firefox,,,0,2024-05-16 6:17
E006339,U000958,comment,,2023-12-19 23:27,DESKTOP,,Android,,,2023-12-19 23:27
E002780,U000036,doc_delete,,0000-00-00 00:00:00,mobile,Firefox,,,,2023-06-13 7:59
E006224,USR-002591,share,,01/09/2025 06:35,DESKTOP,Brave,,unknown,TRUE,2025-01-09 6:35
E008843,U001321,page_view,/integrations,2023-10-22 5:11,mobile,Brave,Windows,573,0,2023-10-22 5:11
E003344,U000186,export,,,DESKTOP,,,598,,2024-06-21 15:01
E001763,U000600,integration_error,,0000-00-00 00:00:00,mobile,Chrome,Android,,1,2023-12-10 21:22
E000742,USR-000121,doc_create,,0000-00-00 00:00:00,,,Windows,112,0,2023-06-24 0:41
E006629,U000856,share,,11/08/2023 17:06,mobile,Brave,Android,561,,2023-11-08 17:06
E007651,U000148,integration_error,,01/03/2025 20:46,DESKTOP,Firefox,Windows,,TRUE,2025-01-03 20:46
E000387,U001156,page_view,/help,2025-02-06,,,Android,978,TRUE,2025-02-06 9:57
E006798,U002463,ai_search,,05/27/2025 14:08,mobile,,Windows,1206,FALSE,2025-05-27 14:08
E005369,U000516,doc_delete,,2023-11-14,desktop,Safari,Linux,,1,2023-11-14 12:43
E005626,u000005,share,,,desktop,Firefox,macOS,1595,TRUE,2024-09-24 20:12
E007384,U000131,doc_edit,,2025-04-21 16:00,mobile,,,,FALSE,2025-04-21 16:00
E006432,U002136,doc_edit,,,DESKTOP,,,,TRUE,2024-09-01 6:09
E007391,U000929,share,,2024-01-31 16:29,mobile,Brave,iOS,1623,0,2024-01-31 16:29
E003961,u000360,login,/search,2023-07-17 6:16,DESKTOP,,Linux,unknown,FALSE,2023-07-17 6:16
E003407,U000416,search,,2024-09-14 21:34,desktop,Brave,Linux,unknown,0,2024-09-14 21:34
e001056,U001620,search,,2023-01-28,mobile,,Linux,,FALSE,2023-01-28 16:04
E005713,U000415,doc_delete,,2024-04-23 23:07,DESKTOP,Edge,Windows,1482,,2024-04-23 23:07
E007301,U000589,ai_search,,2024-08-30,,Brave,iOS,,FALSE,2024-08-30 12:35
E001947,U002420,comment,,2023-08-29 20:00,,Edge,iOS,unknown,TRUE,2023-08-29 20:00
E008222,U000949,integration_error,,,DESKTOP,Brave,,,,2024-06-20 8:48
E005234,u001367,search,,01/07/2023 14:07,,Chrome,Windows,unknown,,2023-01-07 14:07
E003367,U002394,export,,2023-06-15,,Edge,macOS,,,2023-06-15 1:48
E000401,U000259,share,,2023-01-13,desktop,,Windows,unknown,FALSE,2023-01-13 4:53
E003957,U002368,doc_create,,10/01/2024 16:34,,Edge,,,TRUE,2024-10-01 16:34
E004976,U000060,doc_delete,,2024-07-13 7:54,tablet,,Android,1360,0,2024-07-13 7:54
E001776,U001952,ai_search,,0000-00-00 00:00:00,desktop,Firefox,Android,1794,TRUE,2023-03-23 4:33
E000733,U001809,doc_create,,06/05/2024 22:15,desktop,Firefox,macOS,1011,FALSE,2024-06-05 22:15
E003245,U001853,page_view,/onboarding,2024-08-12 20:42,,Safari,Android,,,2024-08-12 20:42
E004009,U001366,comment,,2024-06-10 20:26,,Safari,Android,unknown,TRUE,2024-06-10 20:26
E002944,U000847,doc_delete,,09/21/2024 17:41,tablet,,macOS,,,2024-09-21 17:41
E008475,U000882,comment,,2023-04-04 21:53,,Safari,,,TRUE,2023-04-04 21:53
E003630,U001772,ai_search,,2023-02-26 12:41,DESKTOP,Brave,,unknown,FALSE,2023-02-26 12:41
E005371,U000225,doc_create,,2025-04-02 6:27,tablet,Safari,,,1,2025-04-02 6:27
E006563,U001592,doc_create,,2024-12-01,,Firefox,macOS,,FALSE,2024-12-01 10:53
E008339,U001484,integration_error,,2024-12-22 6:27,DESKTOP,,Windows,unknown,0,2024-12-22 6:27
E002310,U000714,comment,,2025-04-15 17:54,,Brave,,,0,2025-04-15 17:54
E000465,U000872,doc_delete,,02/04/2024 05:43,tablet,,Android,394,1,2024-02-04 5:43
E008802,USR-001793,AI_SEARCH,,2023-12-01,,,,unknown,,2023-12-01 18:22
E008395,U002505,login,/dashboard,2024-04-28 9:54,tablet,,Linux,unknown,1,2024-04-28 9:54
E005717,U000598,comment,,0000-00-00 00:00:00,mobile,,iOS,unknown,,2024-01-27 18:22
E001021,U000534,doc_edit,,2024-08-20,tablet,Edge,Android,,FALSE,2024-08-20 20:20
E002076,U001222,page_view,/docs,,mobile,Chrome,,,FALSE,2023-04-27 20:44
E007342,U001608,doc_edit,,05/29/2025 21:38,desktop,Chrome,Linux,unknown,TRUE,2025-05-29 21:38
E001967,U000515,share,,0000-00-00 00:00:00,mobile,Safari,,,TRUE,2025-02-09 11:32
e002385,U001825,doc_delete,,01/03/2025 02:55,,Chrome,Android,,TRUE,2025-01-03 2:55
E003838,U000651,doc_edit,,2025-06-03,,Edge,Android,,FALSE,2025-06-03 14:04
E008916,U001641,integration_error,,05/19/2023 12:19,DESKTOP,Chrome,Linux,unknown,FALSE,2023-05-19 12:19
e004047,U001475,search,,,mobile,Chrome,Linux,,1,2024-06-14 13:36
E005735,U001682,integration_error,,2023-01-18,desktop,,macOS,,FALSE,2023-01-18 15:39
E008199,U001638,doc_create,,2024-08-27 14:31,,Edge,Linux,,FALSE,2024-08-27 14:31
E000961,U001704,doc_edit,,,,,,,0,2024-09-11 22:50
E000763,U000090,login,/dashboard,2024-07-15 4:56,tablet,Brave,Windows,1340,TRUE,2024-07-15 4:56
E002143,U000224,logout,/billing,05/26/2023 02:19,mobile,,,591,1,2023-05-26 2:19
 E006687,U000403,page_view,/admin,,DESKTOP,,macOS,1267,1,2024-01-18 15:31
E004720,U002285,export,,,desktop,Firefox,Linux,unknown,0,2023-01-19 19:56
E006070,U000263,logout,/help,2023-01-13,mobile,,,unknown,TRUE,2023-01-13 23:05
E000656, USR-000022 ,doc_edit,,2023-09-30,DESKTOP,Edge,Linux,,,2023-09-30 9:15
E004523,U001717,integration_connect,,,tablet,Edge,iOS,,,2023-04-25 4:07
E000121,U002492,SEARCH,,04/22/2025 06:46,desktop,Edge,Windows,,FALSE,2025-04-22 6:46
E007332,U000008,integration_error,,,tablet,Brave,macOS,,FALSE,2023-10-27 12:25
E005471,U000608,login,/search,01/22/2023 14:09,,Edge,,,0,2023-01-22 14:09
E005567,USR-000531,page_view,/search,,tablet,,Android,unknown,FALSE,2024-11-01 15:58
E008910,U000574,logout,/help,,desktop,Edge,Linux,,TRUE,2024-05-18 20:15
E001980,U001790,export,,2023-05-20,,Firefox,Windows,,FALSE,2023-05-20 21:27
E005850,U002436,search,,2025-02-28 12:58,tablet,,macOS,597,TRUE,2025-02-28 12:58
E003038,U001762,page_view,/pricing,2024-09-29,,Chrome,Linux,,,2024-09-29 13:41
E004187,U001058,export,,04/22/2025 20:38,DESKTOP,,Windows,1322,,2025-04-22 20:38
E004440,u001325,comment,,2023-03-31,,Chrome,Android,unknown,FALSE,2023-03-31 17:13
E003228,U001644,logout,/settings,2024-03-27,desktop,Chrome,,,FALSE,2024-03-27 20:06
E002266,U000236,ai_search,,2023-08-28,,Safari,,,TRUE,2023-08-28 22:07
E006083,U002206,export,,2024-06-12 4:45,mobile,Safari,iOS,,1,2024-06-12 4:45
E006012,u002419,LOGIN,/pricing,,DESKTOP,Edge,,,0,2024-08-02 18:36
E002520,U002466,login,/dashboard,2025-04-15 2:17,,Firefox,,1224,,2025-04-15 2:17
E000645,U000999,search,,,,Chrome,,,,2023-05-01 16:53
E004650,U001193,login,/dashboard,2023-07-07 5:42,mobile,,Android,,TRUE,2023-07-07 5:42
E008814,U000682,login,/billing,06/18/2024 12:01,tablet,,iOS,,0,2024-06-18 12:01
E006804,u002440,integration_error,,2025-01-04,desktop,Firefox,iOS,unknown,FALSE,2025-01-04 9:22
E001573,U001279,ai_search,,,mobile,Firefox,,,1,2023-02-23 18:15
E003346,u000159,integration_error,,03/19/2025 16:03,,Chrome,Linux,unknown,,2025-03-19 16:03
E004963, USR-001632 ,ai_search,,,,Firefox,Android,unknown,FALSE,2024-03-24 21:45
E004815,U000653,integration_error,,02/21/2025 09:21,,Brave,,,1,2025-02-21 9:21
E008771,U000816,ai_search,,09/10/2023 03:40,,Safari,macOS,unknown,0,2023-09-10 3:40
E004067,U000331,doc_delete,,2024-07-19,,,,,TRUE,2024-07-19 0:16
E005426, U000150 ,integration_error,,2024-12-28 6:32,mobile,Brave,,unknown,FALSE,2024-12-28 6:32
E001390,U000155,integration_error,,2023-08-11,tablet,Edge,,unknown,TRUE,2023-08-11 12:03
E005712,USR-001298,integration_error,,02/08/2024 20:16,desktop,Brave,,unknown,,2024-02-08 20:16
E007202,U001139,logout,/pricing,,,Edge,iOS,,,2023-03-03 12:40
E005705,U000725,integration_error,,03/22/2025 16:27,DESKTOP,Firefox,,unknown,,2025-03-22 16:27
E004215, USR-001072 ,export,,2024-10-25 14:49,desktop,,,1573,,2024-10-25 14:49
E003894,U002435,DOC_CREATE,,2024-09-22 23:02,,Brave,,,0,2024-09-22 23:02
E007270,U001513,ai_search,,2025-05-25 4:52,,Brave,,unknown,TRUE,2025-05-25 4:52
E002684,U001209,doc_delete,,2023-01-10 0:03,mobile,Edge,macOS,,TRUE,2023-01-10 0:03
e001302,U002564,doc_edit,,01/18/2024 09:38,tablet,,,,,2024-01-18 9:38
E008683,U001550,ai_search,,2023-02-01 21:35,DESKTOP,Chrome,Android,,0,2023-02-01 21:35
E006799,U000919,doc_create,,2024-06-28,desktop,Firefox,Windows,,FALSE,2024-06-28 11:56
E005972,U000967,integration_error,,2023-04-26 0:43,mobile,Edge,iOS,,0,2023-04-26 0:43
E003036,U001918,export,,2023-11-02 22:12,DESKTOP,,macOS,unknown,,2023-11-02 22:12
E004679,USR-001151,doc_edit,,11/16/2023 17:21,tablet,Chrome,,,FALSE,2023-11-16 17:21
E007188,U000114,integration_connect,,2023-08-10,DESKTOP,Chrome,Android,1396,FALSE,2023-08-10 0:49
E001829,U000720,doc_delete,,2025-04-02 21:16,,Firefox,iOS,,0,2025-04-02 21:16
E000273,U001751,ai_search,,2025-06-09 11:32,,Firefox,Windows,,TRUE,2025-06-09 11:32
E007410,U000167,login,/admin,2023-01-25,mobile,Chrome,Windows,,,2023-01-25 8:09
E000908,U000209,share,,07/29/2023 14:17,mobile,,Windows,,FALSE,2023-07-29 14:17
E003093,U000144,share,,2023-01-23,,Firefox,macOS,unknown,TRUE,2023-01-23 7:07
E001461,U001618,doc_delete,,2024-01-17 13:05,tablet,,Android,unknown,1,2024-01-17 13:05
E001981,U001995,doc_edit,,2023-07-15 2:01,,,macOS,,1,2023-07-15 2:01
E002985,u001312,logout,/help,2024-04-05,,Chrome,Linux,1459,1,2024-04-05 17:26
E002393,U000079,search,,2023-05-31,desktop,Safari,,unknown,1,2023-05-31 7:48
E008978,u001926,integration_connect,,2025-01-22,mobile,Firefox,iOS,,1,2025-01-22 7:09
E000060,U000185,login,/help,2025-02-15,tablet,Chrome,iOS,242,TRUE,2025-02-15 9:10
e004430,U002022,page_view,/dashboard,05/16/2023 02:12,mobile,,,unknown,,2023-05-16 2:12
E004768,U000051,integration_error,,2023-03-31,,Edge,Android,1063,TRUE,2023-03-31 22:57
E008772,U001668,integration_error,,04/03/2024 15:44,tablet,Edge,iOS,1463,FALSE,2024-04-03 15:44
E001985,U000263,integration_connect,,05/07/2025 03:05,DESKTOP,,Linux,,,2025-05-07 3:05
E002322,U000120,doc_create,,2025-05-06 22:13,,Safari,,unknown,FALSE,2025-05-06 22:13
E007460,U001527,integration_connect,,2024-07-27 6:22,desktop,Firefox,Windows,unknown,FALSE,2024-07-27 6:22
E001764,U000177,logout,/pricing,01/06/2025 17:14,DESKTOP,Edge,iOS,1792,TRUE,2025-01-06 17:14
E005299,u000927,integration_connect,,0000-00-00 00:00:00,mobile,Edge,iOS,1117,TRUE,2023-10-17 3:21
E004563,U000839,doc_create,,2024-10-13 20:20,tablet,Chrome,iOS,,FALSE,2024-10-13 20:20
E000216,U001039,page_view,/search,04/22/2023 21:03,tablet,Chrome,,,0,2023-04-22 21:03
E000848,U000181,doc_edit,,2023-10-13,,,,,FALSE,2023-10-13 5:59
E008448,U002117,export,,05/08/2024 07:13,mobile,Chrome,,,1,2024-05-08 7:13
E006127,U001743,doc_edit,,2023-06-16,,,Android,1418,1,2023-06-16 0:02
E002946,U000534,search,,08/11/2023 15:16,,Chrome,Windows,,TRUE,2023-08-11 15:16
E007800,U001687,logout,/settings,2024-08-19,,Safari,Linux,,1,2024-08-19 0:31
E006951,U000681,logout,/help,08/29/2023 21:09,,Firefox,Windows,375,TRUE,2023-08-29 21:09
E002142,U000178,integration_connect,,2024-09-03,,,Linux,unknown,FALSE,2024-09-03 20:41
E004735,U000010,ai_search,,2024-01-25 8:31,desktop,Brave,iOS,,TRUE,2024-01-25 8:31
E005787,u001076,integration_error,,01/20/2023 13:48,mobile,,macOS,1211,FALSE,2023-01-20 13:48
E007568,U002528,integration_error,,2025-01-05 0:11,DESKTOP,Chrome,Android,,1,2025-01-05 0:11
E005826,U000232,integration_error,,11/18/2024 19:24,tablet,,Linux,1033,1,2024-11-18 19:24
E008963,U000798,comment,,05/05/2025 11:37,tablet,Safari,macOS,,,2025-05-05 11:37
E004209,U001163,share,,11/24/2024 22:08,tablet,Edge,Linux,,FALSE,2024-11-24 22:08
E008230,U000029,share,,2025-01-05,,Chrome,Linux,,FALSE,2025-01-05 3:21
E002669,U000121,doc_create,,2024-01-12 22:35,,Chrome,Android,1600,1,2024-01-12 22:35
E005111,U002406,logout,/onboarding,0000-00-00 00:00:00,,Chrome,Android,unknown,FALSE,2024-10-30 2:04
E005871,U000260,comment,,2023-10-05 1:44,desktop,Brave,,,TRUE,2023-10-05 1:44
E008513,USR-000978,comment,,08/04/2023 10:34,,,macOS,263,1,2023-08-04 10:34
E002533,U001656,ai_search,,2024-06-01,DESKTOP,Chrome,,761,TRUE,2024-06-01 9:17
E003674,U000101,integration_error,,,mobile,,iOS,,0,2024-01-13 3:45
E007135,U000489,integration_error,,2024-07-09,,Safari,Windows,unknown,FALSE,2024-07-09 19:17
E005129,U001300,login,/integrations,,DESKTOP,Chrome,iOS,,FALSE,2023-07-11 10:39
E001940,U001931,page_view,/integrations,2023-12-21 20:51,desktop,,,unknown,TRUE,2023-12-21 20:51
E008540,U000682,login,/billing,2024-03-26 13:47,,Chrome,,,FALSE,2024-03-26 13:47
E000650, U000984 ,logout,/search,06/07/2024 02:53,,,Linux,,TRUE,2024-06-07 2:53
E008704,USR-000669,integration_error,,09/08/2023 13:38,desktop,Chrome,,unknown,0,2023-09-08 13:38
E008701,U002052,search,,2024-12-29,,Chrome,Android,,TRUE,2024-12-29 9:14
E005574,U001833,ai_search,,2025-04-11 6:55,mobile,Chrome,iOS,1365,0,2025-04-11 6:55
E000886,U002355,doc_edit,,2024-09-23 4:29,,,Android,,FALSE,2024-09-23 4:29
E003941,U001888,ai_search,,05/25/2025 03:13,DESKTOP,,,,,2025-05-25 3:13
E007927, U000526 ,logout,/pricing,0000-00-00 00:00:00,desktop,Firefox,,1593,,2024-08-05 21:06
E004971,U002421,ai_search,,2023-04-21,,Brave,Linux,,TRUE,2023-04-21 23:46
E008703,U000415,logout,/pricing,06/18/2023 08:41,DESKTOP,Firefox,Android,,0,2023-06-18 8:41
E000010,U000302,doc_edit,,02/15/2023 08:17,DESKTOP,,Android,,,2023-02-15 8:17
E006464,U000130,comment,,2025-03-05,mobile,Brave,macOS,unknown,,2025-03-05 17:18
E007269, U002117 ,logout,/pricing,2025-03-21,mobile,Chrome,Windows,460,FALSE,2025-03-21 17:29
E000529,U000527,integration_error,,12/07/2024 08:48,tablet,Brave,iOS,,,2024-12-07 8:48
E000277,U001070,doc_edit,,2025-03-16 15:03,,Firefox,,1014,FALSE,2025-03-16 15:03
E001103,U000713,search,,07/25/2024 11:16,desktop,,Linux,1432,,2024-07-25 11:16
E003599,U000531,comment,,05/27/2025 12:07,,Brave,Windows,unknown,TRUE,2025-05-27 12:07
E005709,U000017,search,,06/30/2024 08:58,mobile,Edge,Linux,,TRUE,2024-06-30 8:58
E007142,U000489,share,,2023-01-27,desktop,,Linux,unknown,,2023-01-27 2:22
E002613,U001169,doc_delete,,0000-00-00 00:00:00,tablet,,iOS,,FALSE,2023-02-28 13:02
E001993,U002389,logout,/dashboard,2024-09-03 14:41,,Edge,,1322,FALSE,2024-09-03 14:41
E003227,U002284,ai_search,,2023-05-10,,,iOS,,TRUE,2023-05-10 22:00
E004901,u000829,doc_edit,,2025-04-12,DESKTOP,Firefox,,unknown,,2025-04-12 2:25
E005937,U002224,doc_delete,,02/28/2023 15:02,mobile,,macOS,,0,2023-02-28 15:02
E008135,U001549,share,,01/13/2023 12:50,,Brave,,unknown,TRUE,2023-01-13 12:50
E000082,U001411,ai_search,,2023-05-20 4:13,mobile,Edge,,,FALSE,2023-05-20 4:13
E006365,U001777,ai_search,,2023-10-12,mobile,,Android,706,,2023-10-12 18:46
E008620,U002501,doc_delete,,2023-11-04,,Safari,Android,,FALSE,2023-11-04 7:27
E005698,U000617,logout,/onboarding,2025-05-18 15:00,DESKTOP,,iOS,,TRUE,2025-05-18 15:00
E007827,U002286,doc_edit,,2024-02-07 18:16,,Edge,,,TRUE,2024-02-07 18:16
E008743,U001126,share,,2024-01-02 2:53,,,Linux,1681,0,2024-01-02 2:53
E008733,U002305,share,,,desktop,Edge,Android,unknown,TRUE,2024-09-03 23:42
E003274,U001779,search,,06/13/2025 00:42,DESKTOP,,Android,22,FALSE,2025-06-13 0:42
E003929,U000407,integration_connect,,2024-01-28 5:10,tablet,Edge,macOS,,TRUE,2024-01-28 5:10
E006729,U001131,integration_error,,,DESKTOP,,,,1,2024-04-01 0:54
E003388,U001347,logout,/search,07/23/2023 06:19,DESKTOP,Edge,iOS,unknown,0,2023-07-23 6:19
E007647,U001640,share,,06/10/2023 15:40,mobile,,iOS,,0,2023-06-10 15:40
E007699,U002299,page_view,/settings,2024-11-22,,Brave,macOS,unknown,1,2024-11-22 20:37
E005668,U001008,logout,/billing,2023-09-04 3:24,DESKTOP,,,,0,2023-09-04 3:24
E008818,U000320,comment,,04/01/2024 05:02,tablet,Safari,Linux,,,2024-04-01 5:02
E008030,U002379,doc_delete,,12/25/2024 11:19,mobile,Safari,macOS,506,TRUE,2024-12-25 11:19
E002555,U000097,login,/docs,07/09/2023 08:28,mobile,,,593,TRUE,2023-07-09 8:28
E004668,U001991,search,,01/13/2024 05:44,mobile,Firefox,,,TRUE,2024-01-13 5:44
e004745,U001219,share,,05/19/2025 02:58,mobile,Brave,Linux,unknown,,2025-05-19 2:58
E006626,U002188,share,,2024-10-08 9:27,,Firefox,Linux,,TRUE,2024-10-08 9:27
E000878,U001208,page_view,/pricing,0000-00-00 00:00:00,,Firefox,Windows,unknown,1,2025-06-10 10:10
E003395,U000236,login,/billing,,,,iOS,unknown,FALSE,2024-04-17 23:15
e006704,U001917,integration_error,,11/29/2024 15:02,tablet,Brave,iOS,1339,0,2024-11-29 15:02
E004419,U002375,search,,01/14/2025 16:32,DESKTOP,,,unknown,1,2025-01-14 16:32
E002607,U001423,share,,2024-06-08,,Edge,Windows,,,2024-06-08 22:10
E008508,U000089,login,/search,2023-05-14 0:09,mobile,Edge,Android,,1,2023-05-14 0:09
E008999,U001305,page_view,/help,2024-06-16,,Brave,,,,2024-06-16 2:46
E000325,u000124,share,,10/24/2023 05:07,tablet,Safari,Linux,1667,,2023-10-24 5:07
E002744,u002129,DOC_CREATE,,0000-00-00 00:00:00,,Safari,,,0,2023-07-19 6:42
e001502,U001216,page_view,/admin,07/26/2023 16:41,desktop,Safari,Android,998,TRUE,2023-07-26 16:41
E006484,U002082,integration_error,,2023-10-30 17:29,,,Linux,unknown,1,2023-10-30 17:29
E000068,U000724,ai_search,,0000-00-00 00:00:00,mobile,,iOS,448,1,2024-06-07 5:11
E007817, U000526 ,search,,04/26/2024 02:19,tablet,,,1534,FALSE,2024-04-26 2:19
E004597,U001909,ai_search,,2024-02-04,,Edge,,,0,2024-02-04 0:42
E001768,U001106,logout,/dashboard,12/03/2023 15:13,,Firefox,,815,,2023-12-03 15:13
E004513,U000804,search,,,desktop,Chrome,macOS,unknown,,2024-11-10 23:23
E005340,U001010,doc_edit,,2023-02-01 12:51,desktop,,Windows,1632,,2023-02-01 12:51
E006039,U001832,doc_delete,,2023-02-06 0:25,tablet,,Windows,,TRUE,2023-02-06 0:25
E004482,U001577,logout,/onboarding,2023-06-25,,,Linux,,,2023-06-25 12:25
E008938, U001502 ,export,,2023-06-12,,Safari,iOS,,FALSE,2023-06-12 10:45
E007954,U001644,doc_create,,03/28/2025 00:40,,Chrome,Windows,unknown,0,2025-03-28 0:40
E007571,U000544,search,,2024-02-23 5:01,,,Windows,1502,FALSE,2024-02-23 5:01
E005141,U001022,export,,06/28/2023 07:13,,Brave,iOS,unknown,TRUE,2023-06-28 7:13
E008847,U002599,integration_connect,,2024-04-02,desktop,Brave,macOS,1182,,2024-04-02 18:42
E000268,U001495,ai_search,,2025-06-15,,Brave,Linux,unknown,TRUE,2025-06-15 23:08
E006822,U000345,integration_error,,11/13/2024 14:34,mobile,Edge,iOS,,FALSE,2024-11-13 14:34
E002065,U001663,logout,/integrations,0000-00-00 00:00:00,tablet,Brave,Android,1260,0,2023-01-20 2:15
E003800,U000456,doc_create,,2024-10-17,desktop,,macOS,,0,2024-10-17 14:06
E005993,U000570,search,,12/19/2023 21:07,desktop,Safari,,,0,2023-12-19 21:07
E008236,U001075,integration_connect,,0000-00-00 00:00:00,,Safari,iOS,,TRUE,2024-04-15 13:47
E000444,U002331,login,/billing,2023-03-07,DESKTOP,Safari,Windows,,1,2023-03-07 17:12
E001893,U000209,PAGE_VIEW,/dashboard,,DESKTOP,Brave,macOS,,FALSE,2024-01-09 13:26
E002058,u000968,integration_connect,,2023-10-15,,Brave,Windows,1280,FALSE,2023-10-15 3:25
E007563,u002253,ai_search,,2025-03-13,,Edge,,,,2025-03-13 8:54
E006161,u000236,ai_search,,2023-11-12,DESKTOP,,Linux,1226,TRUE,2023-11-12 6:04
E001884,U002306,logout,/docs,0000-00-00 00:00:00,,Edge,Windows,,1,2024-04-29 18:42
E008709,U001955,doc_delete,,2023-08-26,,Safari,,unknown,1,2023-08-26 23:47
E005909,U002111,doc_edit,,0000-00-00 00:00:00,,Chrome,,,0,2024-02-24 12:34
E008474,U001124,logout,/dashboard,2024-03-25,desktop,Chrome,,632,1,2024-03-25 5:58
E000448,U000984,page_view,/settings,2023-05-10,,,macOS,,1,2023-05-10 4:10
E000293,U001832,comment,,2023-01-20 16:26,mobile,Brave,Windows,unknown,0,2023-01-20 16:26
E000416,U002189,search,,2025-06-13,,,macOS,,FALSE,2025-06-13 17:13
E005791,U002591,integration_error,,2024-06-04 15:37,,Chrome,Windows,unknown,TRUE,2024-06-04 15:37
E002601,U000410,comment,,03/24/2025 00:32,mobile,Safari,Windows,936,0,2025-03-24 0:32
E006555,U000434,ai_search,,03/11/2023 01:18,mobile,,macOS,,FALSE,2023-03-11 1:18
E000597,U000474,integration_connect,,2024-02-26,,Safari,macOS,unknown,TRUE,2024-02-26 16:46
E008521,U000640,login,/pricing,2024-08-22,mobile,Edge,iOS,unknown,0,2024-08-22 11:23
E005512,USR-001645,doc_create,,2023-09-17,tablet,Chrome,macOS,,TRUE,2023-09-17 0:47
E000511,U000481,page_view,/dashboard,10/01/2024 13:36,mobile,,,,1,2024-10-01 13:36
E006469,U002596,ai_search,,2024-01-23,,Brave,Windows,593,,2024-01-23 19:41
E005735,U001725,ai_search,,2023-03-07,DESKTOP,,,333,,2023-03-07 21:33
E006526,U002578,doc_create,,,tablet,Firefox,iOS,573,FALSE,2023-10-11 18:03
E001268,U002444,page_view,/pricing,,,Edge,Linux,,,2023-08-03 16:28
E006698,U000984,export,,2023-05-01,desktop,,Windows,1076,FALSE,2023-05-01 0:11
E008678,u000479,doc_delete,,2024-01-18 21:34,,Chrome,Android,,,2024-01-18 21:34
E007172,U001568,doc_delete,,05/23/2023 20:35,tablet,,,unknown,0,2023-05-23 20:35
E005644, U001589 ,share,,2023-07-05 20:49,tablet,Safari,Android,,,2023-07-05 20:49
E006013, U000986 ,doc_edit,,,,Edge,Android,768,,2024-05-23 6:15
E000255,U002226,doc_create,,0000-00-00 00:00:00,,,iOS,1147,TRUE,2024-06-21 15:48
E005836,U000447,export,,,desktop,Firefox,macOS,,,2025-04-11 21:22
E000178,U001192,comment,,09/30/2024 09:04,DESKTOP,Brave,Windows,,,2024-09-30 9:04
E007897,u000336,comment,,2024-11-16,tablet,Chrome,Windows,unknown,1,2024-11-16 22:39
E001660,U000511,logout,/dashboard,2024-04-17 2:48,DESKTOP,Chrome,,unknown,,2024-04-17 2:48
E005417,U001736,integration_connect,,2024-02-28,DESKTOP,,Windows,,FALSE,2024-02-28 3:22
E005659,U000324,ai_search,,2025-05-20 7:10,DESKTOP,Edge,macOS,1161,0,2025-05-20 7:10
E000492,U001442,integration_error,,2025-02-06,desktop,Brave,Windows,unknown,TRUE,2025-02-06 13:20
E007313,U000271,login,/help,10/02/2024 10:31,,Firefox,Linux,unknown,0,2024-10-02 10:31
E006872,U000190,integration_error,,2023-06-18 0:27,,Edge,,unknown,,2023-06-18 0:27
E006422,U001094,doc_delete,,06/03/2024 17:23,tablet,Safari,,,1,2024-06-03 17:23
E005280,USR-000370,export,,2025-06-10,,Edge,Windows,,TRUE,2025-06-10 3:18
E006593,U002526,ai_search,,11/17/2023 00:14,DESKTOP,Safari,Android,1153,TRUE,2023-11-17 0:14
E007250,U000171,comment,,2023-11-20 19:25,DESKTOP,,Windows,1199,,2023-11-20 19:25
E004448,U002234,share,,09/10/2023 06:29,,Brave,macOS,unknown,TRUE,2023-09-10 6:29
E002024,U002066,doc_delete,,2023-11-14 7:49,,Edge,macOS,unknown,,2023-11-14 7:49
E006631,U002516,comment,,2024-08-03,tablet,Safari,Linux,unknown,TRUE,2024-08-03 16:34
E004362,U002205,logout,/onboarding,,mobile,,,862,,2024-09-18 0:01
E006564,U000885,page_view,/pricing,01/27/2025 15:38,desktop,,,unknown,1,2025-01-27 15:38
E000453,U002287,doc_edit,,06/02/2025 12:48,tablet,Safari,iOS,,,2025-06-02 12:48
E002011,U001402,search,,10/08/2023 16:32,,,Windows,789,0,2023-10-08 16:32
E007797,u000543,logout,/admin,2024-07-10 4:41,,Safari,Linux,,,2024-07-10 4:41
E001163,U001178,comment,,,desktop,Brave,,,FALSE,2024-04-03 2:12
E006196,U002576,logout,/search,,DESKTOP,,Linux,1656,FALSE,2024-10-10 21:38
E000146,U002308,logout,/admin,2024-02-14,,,macOS,,1,2024-02-14 22:52
E005589,U002372,integration_connect,,,desktop,Brave,,1397,FALSE,2023-11-09 15:44
E002579,U001445,integration_error,,2024-08-14 18:26,,Brave,Android,,FALSE,2024-08-14 18:26
E001823,U000069,page_view,/pricing,2024-02-27,mobile,Chrome,macOS,,FALSE,2024-02-27 22:39
E002940, U002384 ,ai_search,,2024-08-24,mobile,Firefox,,,1,2024-08-24 18:31
E008366,U000750,export,,2023-04-02,desktop,Safari,Windows,unknown,0,2023-04-02 5:19
E003866,U000250,integration_connect,,02/05/2025 07:04,tablet,Firefox,,,TRUE,2025-02-05 7:04
E007333,U000653,SHARE,,08/31/2024 14:27,,,Windows,,0,2024-08-31 14:27
E006601,U000730,search,,2024-04-08,DESKTOP,Brave,Linux,unknown,,2024-04-08 11:23
E007018,U001943,integration_error,,,DESKTOP,Brave,Linux,unknown,0,2024-11-25 13:11
E000124,U001413,integration_connect,,2023-02-25,,Safari,Windows,unknown,,2023-02-25 17:29
E007961,U002113,ai_search,,04/12/2024 04:29,,Firefox,Android,,1,2024-04-12 4:29
E005852,U001133,export,,10/27/2024 11:42,,,,,TRUE,2024-10-27 11:42
E007375,U001025,doc_edit,,,desktop,,,,TRUE,2023-04-24 23:49
E001345,U001043,login,/integrations,0000-00-00 00:00:00,mobile,Brave,,,TRUE,2025-06-17 6:36
E007080,U002494,integration_error,,2023-08-24,,Safari,,1471,TRUE,2023-08-24 1:44
E003342,U000695,logout,/billing,09/26/2024 10:51,mobile,,Linux,868,TRUE,2024-09-26 10:51
e006017,U001026,doc_edit,,2025-01-24,desktop,Safari,,,FALSE,2025-01-24 4:27
E007528,U002516,doc_create,,2025-05-17 15:34,,,,,TRUE,2025-05-17 15:34
E000642,U001991,page_view,/search,,mobile,Chrome,,1532,FALSE,2025-04-11 16:59
E003457,U002551,search,,09/30/2023 00:34,tablet,Chrome,,,FALSE,2023-09-30 0:34
E005936,U001215,page_view,/admin,2023-08-02,desktop,Brave,,,,2023-08-02 14:38
E007463,U000631,login,/settings,06/16/2023 07:02,,Edge,,867,1,2023-06-16 7:02
E005627,U002100,integration_error,,03/17/2024 02:01,desktop,Safari,Android,,TRUE,2024-03-17 2:01
E008356,U001704,doc_create,,2025-05-08 3:20,mobile,,Android,,TRUE,2025-05-08 3:20
E006886,U002355,doc_create,,2023-09-22 23:10,mobile,Edge,Android,,FALSE,2023-09-22 23:10
E003088,U000640,search,,08/28/2024 08:58,mobile,Safari,Android,,,2024-08-28 8:58
E002693,u001679,doc_delete,,2024-10-07 7:34,,Brave,Android,,TRUE,2024-10-07 7:34
E000220,U001411,export,,,,Edge,Windows,unknown,0,2023-09-19 19:56
E007145,U001478,login,/docs,2025-05-17 13:56,,Safari,,,1,2025-05-17 13:56
E004765,U000007,integration_error,,2024-04-21 12:59,desktop,Edge,Android,,0,2024-04-21 12:59
E002803,U000374,INTEGRATION_ERROR,,02/25/2025 01:38,mobile,Brave,,,,2025-02-25 1:38
E006648, U002256 ,logout,/admin,,,Safari,,,TRUE,2024-01-27 19:37
E005719,u001242,doc_edit,,,tablet,Safari,Android,,1,2024-06-13 10:18
E007548,U002163,doc_create,,2024-05-10,DESKTOP,Firefox,,,FALSE,2024-05-10 22:59
E002743,U002011,search,,2025-06-07 23:04,,,Linux,unknown,,2025-06-07 23:04
E006120,U002382,search,,12/12/2023 19:36,desktop,Chrome,macOS,unknown,,2023-12-12 19:36
E002289,u002202,integration_error,,,desktop,Safari,Windows,unknown,TRUE,2023-02-19 1:17
e001590,U002355,doc_delete,,2024-12-30 19:56,,,Windows,,FALSE,2024-12-30 19:56
E006636,U000091,doc_create,,06/09/2023 15:46,DESKTOP,Brave,,1683,FALSE,2023-06-09 15:46
E008778,U001365,login,/admin,12/28/2024 22:58,DESKTOP,Edge,Android,unknown,FALSE,2024-12-28 22:58
E007694,U001547,integration_connect,,2025-06-09 10:15,mobile,Edge,Windows,unknown,TRUE,2025-06-09 10:15
E005015,u001453,search,,2023-07-19 3:22,,Safari,,,0,2023-07-19 3:22
E001423,U001598,logout,/onboarding,2024-05-16,tablet,Chrome,Android,,FALSE,2024-05-16 15:42
E008134,u000681,page_view,/dashboard,06/18/2023 23:11,,,iOS,827,1,2023-06-18 23:11
E004817,U001545,logout,/billing,07/03/2024 00:22,DESKTOP,,macOS,unknown,TRUE,2024-07-03 0:22
E003582,U000564,doc_create,,2024-08-02,DESKTOP,Safari,iOS,unknown,TRUE,2024-08-02 23:26
E006464,U000769,integration_error,,2025-02-06,tablet,,iOS,1265,,2025-02-06 6:05
E005718,U002232,ai_search,,04/11/2024 08:50,,,,,,2024-04-11 8:50
E005517,U000429,doc_edit,,05/24/2023 09:45,mobile,,Windows,,FALSE,2023-05-24 9:45
E001129,U002023,integration_error,,2025-05-03 21:26,mobile,,,unknown,,2025-05-03 21:26
E004409,U001553,integration_connect,,2025-01-14,tablet,Brave,,,TRUE,2025-01-14 23:49
E005215,u002094,integration_error,,2023-12-28 8:45,DESKTOP,Brave,,1033,,2023-12-28 8:45
E005476,U002579,doc_create,,,,,macOS,70,FALSE,2025-04-22 19:56
E008628,U000027,search,,06/01/2023 03:36,desktop,Safari,macOS,1727,,2023-06-01 3:36
e001403,U001226,ai_search,,11/14/2023 11:00,DESKTOP,,Linux,,0,2023-11-14 11:00
E004509,u000167,logout,/search,,desktop,Safari,iOS,unknown,,2023-11-13 18:37
E001466,U000134,doc_delete,,08/04/2024 03:19,,Firefox,iOS,,,2024-08-04 3:19
E004829,U000154,integration_connect,,04/25/2025 20:52,tablet,,Android,318,0,2025-04-25 20:52
E003824,U000063,export,,06/03/2025 13:25,,Brave,,,FALSE,2025-06-03 13:25
E002907,U000119,ai_search,,01/19/2024 10:34,,Firefox,Linux,,0,2024-01-19 10:34
E002489,U000163,login,/settings,03/10/2025 03:32,DESKTOP,Brave,macOS,164,TRUE,2025-03-10 3:32
E006835,U002395,integration_connect,,2024-05-27,tablet,Edge,Linux,unknown,TRUE,2024-05-27 20:37
E000656,U002328,page_view,/pricing,,,Edge,Windows,,FALSE,2023-06-26 16:48
E005739,u001954,ai_search,,04/04/2025 10:54,DESKTOP,,,,1,2025-04-04 10:54
E004347,u001858,doc_create,,,mobile,Brave,Windows,,,2023-03-29 23:07
E002872,U000667,LOGOUT,/search,11/27/2023 21:21,,Edge,,unknown,,2023-11-27 21:21
E002327,U001497,share,,0000-00-00 00:00:00,DESKTOP,,macOS,1008,FALSE,2023-05-22 2:39
E007246,U000268,search,,11/14/2024 19:27,,Brave,Windows,44,TRUE,2024-11-14 19:27
E004559,U001625,integration_error,,2024-06-13 1:14,DESKTOP,,iOS,727,TRUE,2024-06-13 1:14
E003530,U000266,page_view,/integrations,02/09/2023 08:33,mobile,Chrome,Windows,unknown,0,2023-02-09 8:33
E003290,U001985,logout,/onboarding,10/23/2024 15:02,desktop,Firefox,iOS,unknown,0,2024-10-23 15:02
E001758,u001040,integration_connect,,2023-05-14 13:58,desktop,Firefox,Android,,1,2023-05-14 13:58
E007696,u002251,COMMENT,,2024-03-18 1:29,DESKTOP,Brave,,,FALSE,2024-03-18 1:29
E008339,U000269,export,,2024-06-16,tablet,Brave,Linux,119,TRUE,2024-06-16 10:53
e007487, U000627 ,page_view,/dashboard,2023-10-25 4:04,,Brave,Linux,unknown,TRUE,2023-10-25 4:04
E003172,U001590,share,,,desktop,Edge,,1457,TRUE,2023-03-06 10:04
E003641,U000462,logout,/dashboard,2024-03-17,mobile,Edge,Linux,unknown,TRUE,2024-03-17 17:45
E007667,U001502,search,,,,Edge,Windows,unknown,,2025-04-05 22:55
E008424,U000314,doc_delete,,07/20/2024 11:30,DESKTOP,Brave,,,1,2024-07-20 11:30
 E007902,U000847,doc_edit,,10/15/2024 07:12,desktop,Chrome,,,TRUE,2024-10-15 7:12
E004679,U000115,page_view,/docs,2023-10-23 8:09,,Safari,,,,2023-10-23 8:09
E002246,U001072,logout,/search,2023-12-08,mobile,Chrome,Android,,,2023-12-08 16:32
E000629,U000778,search,,04/08/2025 06:17,,Firefox,macOS,,,2025-04-08 6:17
E007386,U001259,search,,05/12/2023 20:59,DESKTOP,,iOS,,TRUE,2023-05-12 20:59
E007544,U001120,page_view,/billing,2023-05-29,DESKTOP,,,unknown,TRUE,2023-05-29 19:15
E007768,U000151,page_view,/admin,04/27/2024 04:51,mobile,,Android,unknown,TRUE,2024-04-27 4:51
E002655,USR-000550,doc_create,,05/23/2024 21:30,desktop,Edge,iOS,643,TRUE,2024-05-23 21:30
E005568,U000916,doc_edit,,2024-01-26 13:07,DESKTOP,,Android,unknown,TRUE,2024-01-26 13:07
E000451,U000108,export,,07/17/2024 01:31,,Firefox,iOS,453,FALSE,2024-07-17 1:31
E006611,U002111,share,,2024-03-08 5:17,desktop,,Linux,323,TRUE,2024-03-08 5:17
E002829,U000682,export,,2025-03-13 6:29,tablet,,Windows,1314,FALSE,2025-03-13 6:29
E005451,U000769,integration_connect,,09/08/2024 03:35,DESKTOP,Firefox,macOS,unknown,FALSE,2024-09-08 3:35
E008699,U001372,doc_edit,,2024-10-05,mobile,,Windows,unknown,,2024-10-05 7:17
E001842,U001969,doc_create,,,tablet,,,1324,0,2023-05-25 8:01
E002652,U002211,integration_connect,,,tablet,Safari,,unknown,0,2024-08-18 19:40
E003409,U000570,integration_connect,,2025-04-09,tablet,Safari,Android,574,FALSE,2025-04-09 22:58
E004416,U001922,ai_search,,06/08/2023 06:44,mobile,Brave,Android,1300,TRUE,2023-06-08 6:44
E005426,U002008,integration_connect,,,mobile,Safari,,unknown,1,2023-11-20 15:57
E006693,U000365,ai_search,,2025-06-16 17:48,desktop,Safari,Linux,,FALSE,2025-06-16 17:48
E000406,U000115,login,/integrations,2024-09-21 9:56,desktop,Firefox,iOS,1058,TRUE,2024-09-21 9:56
E004304,U002130,doc_edit,,,,,iOS,1063,TRUE,2023-01-23 15:57
E000952,U001647,search,,2025-04-30,desktop,Safari,Android,,FALSE,2025-04-30 9:13
E004819,U002593,logout,/search,2024-10-12 6:12,,Chrome,,1382,,2024-10-12 6:12
E008606,U001111,ai_search,,2024-07-02 20:39,tablet,Chrome,Linux,552,,2024-07-02 20:39
E005426,U001185,doc_delete,,0000-00-00 00:00:00,mobile,Safari,,1037,,2024-07-05 18:51
E007436,U001058,logout,/settings,02/14/2024 05:35,desktop,Firefox,Windows,1163,,2024-02-14 5:35
E006270,U001276,page_view,/settings,2024-11-25 23:50,tablet,Firefox,Windows,,0,2024-11-25 23:50
E004585,U000724,doc_edit,,2025-02-10,,Chrome,macOS,,FALSE,2025-02-10 17:38
E002322,U001418,export,,2023-04-23,desktop,,Windows,unknown,TRUE,2023-04-23 16:44
E004435,U001706,logout,/help,,desktop,Brave,macOS,,FALSE,2023-04-05 10:57
E005919,U002564,logout,/settings,2023-06-04,,Brave,Windows,unknown,1,2023-06-04 14:11
E006251,U001181,doc_delete,,2024-08-28,DESKTOP,Edge,Android,,,2024-08-28 15:16
E007540,U002109,doc_edit,,2023-07-07,desktop,Chrome,,275,FALSE,2023-07-07 5:22
E004183,u001825,comment,,2025-01-17,mobile,,Windows,1408,0,2025-01-17 1:02
E002787,U002520,comment,,2024-12-16,,Safari,iOS,unknown,TRUE,2024-12-16 19:28
E006828,U000062,page_view,/billing,2023-04-01,tablet,,,,TRUE,2023-04-01 12:16
E000750,U001671,search,,0000-00-00 00:00:00,DESKTOP,Brave,,unknown,TRUE,2023-01-29 11:55
E005162, USR-002344 ,share,,12/20/2023 17:11,desktop,Chrome,Linux,621,1,2023-12-20 17:11
E003098,U000657,page_view,/billing,0000-00-00 00:00:00,mobile,,iOS,,1,2024-03-24 21:06
E006919,U002367,integration_error,,2024-11-30,DESKTOP,Chrome,,,TRUE,2024-11-30 14:10
E002032,u001267,page_view,/admin,01/26/2023 08:26,,Chrome,macOS,562,FALSE,2023-01-26 8:26
E005376,U002423,SEARCH,,04/28/2024 17:48,,Brave,macOS,,FALSE,2024-04-28 17:48
E004330,U000622,integration_connect,,07/18/2024 13:10,,Firefox,Windows,,1,2024-07-18 13:10
E008276,U000675,comment,,08/11/2024 21:35,desktop,,iOS,,FALSE,2024-08-11 21:35
E008819,U002521,ai_search,,2025-02-26,,Edge,Linux,,,2025-02-26 6:55
E005292,U000715,doc_delete,,2023-10-12 0:33,mobile,Firefox,macOS,,TRUE,2023-10-12 0:33
E000121,U002031,comment,,2023-04-03 12:18,mobile,Chrome,macOS,,0,2023-04-03 12:18
E000273,U002228,export,,,mobile,Brave,macOS,181,FALSE,2023-04-29 17:53
E000161,U002023,doc_delete,,2024-11-25,DESKTOP,,,1180,1,2024-11-25 4:33
E005567,U000981,search,,03/06/2023 08:09,,Safari,iOS,,,2023-03-06 8:09
E001618,U002417,doc_edit,,2023-07-30,DESKTOP,Firefox,Android,1445,FALSE,2023-07-30 12:03
E008817,U000418,doc_edit,,01/27/2025 22:41,,Chrome,Android,,,2025-01-27 22:41
E000333,U001692,integration_error,,2025-01-15,,Chrome,,254,FALSE,2025-01-15 12:41
E004747,U000354,export,,2024-09-25,DESKTOP,Safari,Linux,unknown,FALSE,2024-09-25 13:46
E003908,U002468,export,,2025-01-07,mobile,Chrome,Android,,1,2025-01-07 7:24
E008334,u000943,ai_search,,2025-05-02 3:22,DESKTOP,Edge,iOS,1383,FALSE,2025-05-02 3:22
E003618,U000999,page_view,/docs,2024-07-19 10:37,mobile,Firefox,Linux,unknown,0,2024-07-19 10:37
E008213,U001465,integration_error,,2024-02-18 3:59,mobile,Chrome,Linux,,1,2024-02-18 3:59
E008584,U000190,share,,2023-11-02 21:16,mobile,Edge,iOS,,1,2023-11-02 21:16
E006979,U001729,logout,/help,2025-06-11,tablet,,Android,,FALSE,2025-06-11 17:23
E006417,U001799,login,/help,2024-08-09,DESKTOP,Chrome,Linux,unknown,,2024-08-09 9:11
E006968,u001291,share,,2024-12-19,,Edge,Android,962,TRUE,2024-12-19 3:37
E008513,U001609,export,,05/11/2023 23:20,,Brave,,,FALSE,2023-05-11 23:20
E001256,U001347,ai_search,,2024-02-11 5:33,desktop,Chrome,,unknown,,2024-02-11 5:33
E000867,U002047,page_view,/settings,2024-04-01,,Brave,Windows,,0,2024-04-01 8:30
E000004,U002563,search,,0000-00-00 00:00:00,DESKTOP,,,1562,,2023-03-31 6:20
E005350,U002257,search,,2023-11-06 12:15,DESKTOP,Chrome,Linux,unknown,,2023-11-06 12:15
E006897,U000129,integration_connect,,2023-03-11,tablet,Safari,Android,,FALSE,2023-03-11 5:04
E004785,U002132,comment,,04/11/2025 17:17,,Safari,Android,1029,TRUE,2025-04-11 17:17
E006400,U002422,doc_delete,,2024-07-18,tablet,Brave,macOS,unknown,,2024-07-18 9:02
E001587,U001426,share,,11/05/2023 12:34,mobile,Safari,Android,16,FALSE,2023-11-05 12:34
E000572,USR-002014,doc_delete,,08/27/2024 11:05,,,Windows,953,,2024-08-27 11:05
E000762,USR-000286,page_view,/pricing,2024-12-12,mobile,Edge,,855,TRUE,2024-12-12 22:00
E003186,U000308,ai_search,,01/21/2024 19:34,DESKTOP,Safari,,unknown,,2024-01-21 19:34
E000619,U000331,share,,06/04/2024 22:36,desktop,,iOS,unknown,1,2024-06-04 22:36
E004712,U001319,search,,0000-00-00 00:00:00,,Brave,Windows,1510,,2024-08-02 21:52
E000008, U001873 ,doc_edit,,2025-04-03 2:51,mobile,Edge,Android,,TRUE,2025-04-03 2:51
E005590,U001257,integration_connect,,2025-05-07,desktop,Firefox,Linux,unknown,FALSE,2025-05-07 16:04
E000783,U001340,INTEGRATION_CONNECT,,01/23/2025 02:19,,Firefox,macOS,,0,2025-01-23 2:19
E007416,U002438,share,,2023-04-19 20:10,,Chrome,Linux,unknown,0,2023-04-19 20:10
E005455,U000457,comment,,2023-07-31,DESKTOP,Safari,,,,2023-07-31 19:22
E001473,U001230,doc_delete,,2023-03-14,mobile,Safari,Android,,FALSE,2023-03-14 18:31
E007170,U002220,ai_search,,09/03/2024 09:09,,Safari,Linux,,FALSE,2024-09-03 9:09
E003130,U002114,doc_edit,,03/24/2023 23:16,,Firefox,Linux,698,FALSE,2023-03-24 23:16
E002529,U000230,comment,,,desktop,,iOS,unknown,,2024-06-04 18:24
E000650,U000832,doc_create,,09/30/2023 00:43,desktop,,macOS,1133,0,2023-09-30 0:43
E002362,U002375,integration_error,,2025-05-11,mobile,,,,FALSE,2025-05-11 0:39
E003544,U001782,INTEGRATION_CONNECT,,06/17/2023 11:26,mobile,Firefox,,949,FALSE,2023-06-17 11:26
E006992,U000858,doc_edit,,2023-09-14,,Firefox,iOS,,TRUE,2023-09-14 18:12
e003088, u000157 ,login,/help,2025-03-02 11:06,DESKTOP,,,,,2025-03-02 11:06
E004773,U001955,integration_connect,,2024-09-15 6:40,DESKTOP,Brave,,unknown,,2024-09-15 6:40
E003298,U001574,doc_delete,,05/09/2025 11:42,DESKTOP,Brave,Windows,unknown,,2025-05-09 11:42
E008058, U001035 ,comment,,2023-04-29 23:32,,,Android,unknown,,2023-04-29 23:32
E008945,U001039,share,,2023-04-20,mobile,Brave,macOS,252,FALSE,2023-04-20 0:16
E002712,U000431,doc_create,,2023-05-19 4:35,,Brave,iOS,1181,,2023-05-19 4:35
E004055,U002331,integration_error,,03/09/2024 03:34,tablet,,,unknown,,2024-03-09 3:34
E003565,U002341,integration_connect,,07/02/2023 15:39,mobile,Safari,macOS,,1,2023-07-02 15:39
E006339,U002515,integration_connect,,2024-04-30,,Safari,,unknown,,2024-04-30 22:48
E003977,U000831,doc_delete,,2024-02-03 0:42,DESKTOP,Edge,Android,802,FALSE,2024-02-03 0:42
E000606, U000421 ,doc_edit,,2025-03-10,,,Windows,1010,TRUE,2025-03-10 23:57
E004965,U001465,page_view,/pricing,06/03/2025 23:38,tablet,Edge,iOS,,0,2025-06-03 23:38
e005550,U001597,share,,05/31/2025 22:58,mobile,,Windows,1240,,2025-05-31 22:58
E000829,U002325,export,,2024-08-27 0:29,mobile,Chrome,Windows,1261,1,2024-08-27 0:29
E003965, U002247 ,logout,/docs,2023-11-04 7:52,,Brave,Windows,unknown,1,2023-11-04 7:52
E002810,U001491,integration_error,,2023-02-25,desktop,Chrome,iOS,827,,2023-02-25 5:22
E004612,U000243,search,,2023-04-20,mobile,Firefox,,,,2023-04-20 6:48
E001985,USR-000473,login,/docs,01/28/2024 21:26,,Brave,,,FALSE,2024-01-28 21:26
E006605,U001820,page_view,/help,,mobile,Edge,,,TRUE,2025-02-01 22:03
E000026,U001886,page_view,/onboarding,2024-03-28,tablet,Safari,,,1,2024-03-28 13:25
E002111,U002569,doc_delete,,08/14/2024 19:07,,Edge,Windows,364,1,2024-08-14 19:07
E008722,u000152,comment,,06/07/2025 10:36,,Chrome,iOS,1446,0,2025-06-07 10:36
E004039,U002253,integration_connect,,,DESKTOP,Firefox,,,,2025-01-21 4:12
E001555,U001908,login,/help,2023-06-17,,Chrome,Android,512,1,2023-06-17 10:24
E008288,U002386,search,,2025-01-20,desktop,Brave,,unknown,FALSE,2025-01-20 6:36
E008612,U000694,doc_edit,,12/07/2024 05:29,desktop,Brave,Linux,,TRUE,2024-12-07 5:29
E006106,U002248,share,,2024-11-24,DESKTOP,,Android,unknown,TRUE,2024-11-24 3:03
E002694,U000272,doc_delete,,08/05/2023 02:59,desktop,Firefox,Android,,TRUE,2023-08-05 2:59
E007798,U001260,doc_edit,,2025-01-09,,Safari,,unknown,FALSE,2025-01-09 6:10
e005048,U000384,login,/dashboard,2023-02-08 22:51,desktop,,,,,2023-02-08 22:51
E002739,U001300,login,/integrations,,tablet,Chrome,macOS,unknown,TRUE,2024-11-21 3:12
E003681,U000984,doc_delete,,2024-09-23 7:06,,,macOS,unknown,FALSE,2024-09-23 7:06
E003483,U002494,doc_delete,,,,Chrome,macOS,,TRUE,2024-12-10 19:56
E002937,U002347,ai_search,,10/18/2023 03:34,DESKTOP,Firefox,Windows,,,2023-10-18 3:34
E007820,U000749,doc_edit,,05/10/2023 06:49,,,Linux,1273,FALSE,2023-05-10 6:49
e002282,U000818,login,/search,02/03/2023 04:51,,Chrome,Windows,581,FALSE,2023-02-03 4:51
E004326,U000097,ai_search,,,,Edge,Linux,1191,TRUE,2023-12-21 12:20
E002390,U002089,ai_search,,2024-09-25 21:48,,Safari,Windows,1553,1,2024-09-25 21:48
E004111,U000588,page_view,/help,12/05/2024 18:33,,Safari,macOS,,,2024-12-05 18:33
E004227,U001573,doc_create,,2025-02-11,desktop,Edge,,15,0,2025-02-11 22:53
E001099,U002542,login,/settings,2023-05-05 20:59,,Safari,macOS,,,2023-05-05 20:59
E003708,U001584,doc_delete,,07/10/2024 08:31,DESKTOP,Edge,iOS,648,,2024-07-10 8:31
E008979,U000872,export,,2024-03-02,,Brave,macOS,,0,2024-03-02 4:18
E008778,U000139,LOGOUT,/dashboard,2024-01-03,tablet,,macOS,unknown,TRUE,2024-01-03 9:02
E006235,U001666,integration_error,,2023-05-07 7:48,,Safari,Windows,,1,2023-05-07 7:48
E007769,u000043,page_view,/settings,01/31/2025 23:01,mobile,Firefox,Android,unknown,TRUE,2025-01-31 23:01
E002160,u001757,search,,2025-06-08,desktop,,,unknown,0,2025-06-08 15:37
E002945, USR-000626 ,logout,/dashboard,05/13/2025 05:06,,,,unknown,TRUE,2025-05-13 5:06
E008520,U002150,login,/docs,2024-09-05,mobile,Brave,iOS,unknown,TRUE,2024-09-05 14:15
E002393,U002194,integration_connect,,2023-03-25 4:45,tablet,Safari,Android,,,2023-03-25 4:45
E001274,U000646,search,,07/22/2024 07:42,DESKTOP,Brave,iOS,1528,,2024-07-22 7:42
E000757,U000527,doc_edit,,2023-04-02,tablet,Edge,,,FALSE,2023-04-02 18:26
E005359,U002241,integration_error,,2023-01-24,desktop,Safari,iOS,,0,2023-01-24 13:38
E008545,U000116,comment,,01/21/2023 14:07,,Firefox,,,,2023-01-21 14:07
E003755,U001657,login,/integrations,01/11/2025 21:42,DESKTOP,Edge,macOS,,1,2025-01-11 21:42
E006977,U001633,search,,2025-05-03,desktop,Chrome,,unknown,TRUE,2025-05-03 23:26
E003809,u002099,login,/integrations,2023-09-20,,,Android,unknown,TRUE,2023-09-20 23:34
E002037,U002050,integration_error,,03/25/2024 07:52,DESKTOP,Brave,,,1,2024-03-25 7:52
E004653,U002254,export,,0000-00-00 00:00:00,tablet,Edge,iOS,,FALSE,2023-01-31 11:38
E006021,U002297,logout,/billing,2023-11-12 23:25,,Chrome,iOS,,TRUE,2023-11-12 23:25
E008023,U000174,doc_create,,08/15/2023 05:59,mobile,,,,1,2023-08-15 5:59
E003320,U002557,EXPORT,,0000-00-00 00:00:00,tablet,Chrome,,,TRUE,2024-07-27 12:25
E001536,U000885,integration_connect,,07/22/2023 20:16,mobile,Edge,,,FALSE,2023-07-22 20:16
e004328,U001018,ai_search,,08/12/2024 10:37,DESKTOP,Safari,macOS,unknown,FALSE,2024-08-12 10:37
E002675, USR-001973 ,doc_edit,,2025-04-22,desktop,Edge,Android,212,TRUE,2025-04-22 19:46
E003771,U000834,integration_connect,,08/24/2024 20:05,,Firefox,Android,unknown,FALSE,2024-08-24 20:05
E003667,U001660,integration_connect,,2023-03-19,DESKTOP,,iOS,,TRUE,2023-03-19 0:47
E002647,U001878,integration_error,,2024-06-07 21:06,,Edge,Windows,unknown,FALSE,2024-06-07 21:06
E002551,U002469,comment,,2023-01-23,tablet,Edge,Linux,,TRUE,2023-01-23 16:22
E002060,U000688,doc_create,,,DESKTOP,Edge,,453,0,2023-02-01 3:18
E004635,U000149,doc_create,,2023-03-21 15:27,desktop,,iOS,,TRUE,2023-03-21 15:27
E001699,U000297,integration_error,,04/02/2024 09:20,DESKTOP,Firefox,Linux,,TRUE,2024-04-02 9:20
E005142,U001633,export,,11/17/2023 21:02,tablet,Firefox,Android,,,2023-11-17 21:02
E000987,U002580,export,,2023-01-31,mobile,Edge,Android,1000,,2023-01-31 17:49
E000905,U002585,ai_search,,2023-06-03 20:53,DESKTOP,,,1578,FALSE,2023-06-03 20:53
E005866,U000668,comment,,2023-01-13,,Chrome,Linux,1241,TRUE,2023-01-13 9:22
E000307,U001991,logout,/integrations,2024-06-16,desktop,,Android,,,2024-06-16 22:41
E002730,U002267,login,/integrations,2023-05-18,,,,251,1,2023-05-18 12:05
E001998,U002376,comment,,02/02/2024 15:57,DESKTOP,,macOS,1448,FALSE,2024-02-02 15:57
E006284,U000374,share,,01/26/2025 16:38,mobile,Brave,,1261,TRUE,2025-01-26 16:38
E002224,u002531,logout,/docs,0000-00-00 00:00:00,DESKTOP,Safari,Linux,unknown,TRUE,2024-12-17 17:19
E004845,U001898,export,,,,Firefox,Android,,,2024-06-15 17:59
 E007484,U001869,login,/billing,2025-04-07 20:42,desktop,Chrome,iOS,,FALSE,2025-04-07 20:42
E001193,U000977,search,,2024-01-15,,Safari,,683,0,2024-01-15 14:09
E004436,U002256,integration_error,,2023-07-15 8:08,mobile,,Linux,unknown,FALSE,2023-07-15 8:08
E005451,U000098,DOC_EDIT,,2024-11-07,,Firefox,,,,2024-11-07 23:25
E007099,U001032,doc_create,,,,,Linux,unknown,,2024-02-05 1:01
E004803,U000846,doc_edit,,2024-10-25,,Edge,,,TRUE,2024-10-25 16:03
E000394,U001428,DOC_DELETE,,2025-01-08,mobile,,,unknown,TRUE,2025-01-08 20:18
E005614,U001010,integration_error,,04/08/2023 21:10,tablet,,macOS,unknown,FALSE,2023-04-08 21:10
E005061,U002355,export,,2025-01-08 3:35,mobile,Firefox,,unknown,FALSE,2025-01-08 3:35
E005147,U002363,comment,,2024-05-29 4:43,desktop,Chrome,Android,363,TRUE,2024-05-29 4:43
e008181,U001720,doc_edit,,2025-02-04,,Edge,,unknown,TRUE,2025-02-04 13:24
E004988,U001075,integration_error,,2025-05-01 11:46,desktop,Safari,,unknown,,2025-05-01 11:46
E005566,U002335,integration_error,,2024-03-30,,Brave,macOS,,0,2024-03-30 5:22
E002992,U001259,doc_create,,2023-01-30 8:38,,Brave,,,FALSE,2023-01-30 8:38
E000328,U000201,integration_error,,2024-05-24 8:24,DESKTOP,Safari,Linux,1530,0,2024-05-24 8:24
E000623,U001085,integration_connect,,07/29/2024 02:55,,Firefox,,518,FALSE,2024-07-29 2:55
E008289,U001289,export,,01/03/2025 14:09,desktop,Firefox,iOS,449,1,2025-01-03 14:09
E004548,U002472,ai_search,,2025-06-03,desktop,Safari,,unknown,FALSE,2025-06-03 11:08
E007221,U000867,integration_connect,,2023-04-19 13:46,tablet,Safari,Linux,,,2023-04-19 13:46
E006301,U002007,share,,05/10/2025 09:10,mobile,Chrome,iOS,,0,2025-05-10 9:10
E005217,U001872,doc_delete,,12/05/2024 23:09,mobile,,Windows,,,2024-12-05 23:09
E006561,U000645,integration_error,,2024-09-09,mobile,,Android,unknown,TRUE,2024-09-09 22:38
E006533, U001729 ,export,,2023-12-02,mobile,Edge,Linux,349,1,2023-12-02 17:13
E000904,U000353,doc_delete,,2023-03-09,mobile,Edge,,,FALSE,2023-03-09 10:48
E003848,U001615,integration_connect,,,mobile,,Android,unknown,FALSE,2023-08-12 1:59
E003862,U000232,LOGOUT,/search,2024-01-02,tablet,Firefox,,,TRUE,2024-01-02 15:05
E000327,U001968,doc_create,,,tablet,Brave,macOS,,FALSE,2024-10-15 13:14
E000318,U001172,ai_search,,03/09/2023 03:40,DESKTOP,Firefox,Windows,unknown,FALSE,2023-03-09 3:40
E000860,USR-002274,doc_edit,,2023-05-17,tablet,Firefox,,unknown,,2023-05-17 2:09
E001546,U001597,doc_edit,,2023-04-18 4:25,,Brave,macOS,,FALSE,2023-04-18 4:25
E006653,U001020,doc_edit,,05/26/2025 21:41,,Edge,,,,2025-05-26 21:41
E003480,U001752,login,/billing,,desktop,Firefox,Windows,,TRUE,2023-10-24 11:45
E006404,U000131,search,,2025-06-14,desktop,Safari,Android,406,TRUE,2025-06-14 18:43
E007937,U001905,search,,,mobile,Edge,macOS,,,2023-04-02 23:56
E002729,U002463,doc_create,,08/12/2024 05:44,mobile,Chrome,Android,,TRUE,2024-08-12 5:44
E001921,U000222,search,,2023-08-11,mobile,Edge,iOS,,,2023-08-11 12:12
E002983,U000963,ai_search,,2025-01-06,tablet,Chrome,macOS,,0,2025-01-06 9:54
E003501,USR-001612,doc_edit,,04/03/2024 04:24,mobile,Firefox,,1569,,2024-04-03 4:24
E001531,U002533,doc_delete,,2024-06-29 10:39,tablet,Edge,macOS,,TRUE,2024-06-29 10:39
E003619, U000403 ,comment,,2023-01-30,desktop,,,unknown,,2023-01-30 13:57
E004515,U000775,share,,2024-05-02,,Chrome,Linux,,1,2024-05-02 9:23
E005439,U000715,integration_connect,,0000-00-00 00:00:00,mobile,Edge,,,FALSE,2024-09-17 7:35
e002046,U000062,search,,03/04/2023 23:29,mobile,Firefox,macOS,unknown,FALSE,2023-03-04 23:29
E003455,U000340,login,/dashboard,2023-10-27,,Safari,Windows,,FALSE,2023-10-27 16:22
E001602,U002420,login,/settings,02/20/2023 00:14,desktop,Chrome,macOS,1379,TRUE,2023-02-20 0:14
E002618,U000965,logout,/integrations,2024-02-19,DESKTOP,Brave,,,0,2024-02-19 16:29
E008068,U000388,export,,2025-04-22 8:28,DESKTOP,Edge,Linux,,TRUE,2025-04-22 8:28
E008796,U002543,integration_connect,,06/06/2024 23:01,,Edge,Windows,unknown,,2024-06-06 23:01
E007841,U000638,doc_edit,,2023-06-20 10:46,mobile,Brave,macOS,unknown,0,2023-06-20 10:46
E003529,U000883,integration_connect,,05/27/2024 23:08,DESKTOP,Safari,macOS,unknown,FALSE,2024-05-27 23:08
E005173,U001836,ai_search,,12/07/2024 23:02,DESKTOP,,Windows,,1,2024-12-07 23:02
E003402,U001235,page_view,/admin,2023-06-30,desktop,Brave,Linux,778,0,2023-06-30 20:27
E004343,U001812,login,/dashboard,03/25/2023 03:10,,Brave,Linux,,TRUE,2023-03-25 3:10
e008290,U002517,search,,2023-11-08,mobile,Safari,,99,1,2023-11-08 9:22
E005750,u002403,ai_search,,02/17/2024 07:28,mobile,Firefox,Windows,unknown,TRUE,2024-02-17 7:28
E007745,U001580,doc_create,,,DESKTOP,Firefox,macOS,,TRUE,2024-04-07 17:17
E006886,USR-001232,page_view,/settings,0000-00-00 00:00:00,,Chrome,Android,,0,2023-10-31 5:48
E005629,U000011,ai_search,,2023-01-30 1:31,DESKTOP,Brave,Windows,,TRUE,2023-01-30 1:31
E005654,U000519,export,,02/01/2024 22:34,mobile,Brave,Android,927,1,2024-02-01 22:34
e005781,U002346,integration_connect,,2023-11-16,,,Windows,779,TRUE,2023-11-16 12:53
E005967, U002063 ,ai_search,,2025-01-18,,,Linux,unknown,,2025-01-18 21:38
E002384,U001396,DOC_CREATE,,2024-08-30,DESKTOP,,,,TRUE,2024-08-30 5:53
E000199,U001598,export,,2023-02-18 7:00,,Safari,Android,372,FALSE,2023-02-18 7:00
E001556,U002099,search,,0000-00-00 00:00:00,,,iOS,727,0,2024-01-09 9:24
E001368,U000300,page_view,/billing,08/23/2023 02:47,desktop,Firefox,,,FALSE,2023-08-23 2:47
E003516,U001671,integration_connect,,2023-06-17,desktop,Brave,Android,,,2023-06-17 20:43
E003107,U000513,comment,,08/11/2024 10:08,desktop,Brave,Windows,,,2024-08-11 10:08
E002776,U001996,share,,2023-03-24,,Chrome,Android,unknown,0,2023-03-24 17:04
E000949,U000846,login,/integrations,2025-01-10 19:45,mobile,Safari,macOS,1117,FALSE,2025-01-10 19:45
E004602,U000570,share,,2024-03-21,,Brave,Android,,0,2024-03-21 19:40
E006404,U001816,share,,,,Brave,iOS,487,1,2024-05-06 15:36
e007073,U001911,page_view,/integrations,02/10/2024 20:20,DESKTOP,Brave,macOS,343,FALSE,2024-02-10 20:20
E007150,U000733,logout,/integrations,01/24/2024 22:53,mobile,,Linux,468,,2024-01-24 22:53
e003844,U000385,login,/help,03/24/2025 07:04,tablet,Brave,Linux,934,,2025-03-24 7:04
E001174,U001426,export,,01/04/2023 12:40,mobile,Firefox,,,1,2023-01-04 12:40
E004911,U001607,login,/docs,2024-10-31 21:32,desktop,,Android,unknown,,2024-10-31 21:32
E000465,u000450,doc_delete,,07/07/2023 23:24,tablet,Brave,Linux,,FALSE,2023-07-07 23:24
E007177,U001035,doc_create,,2025-03-06,desktop,Chrome,,,0,2025-03-06 18:39
E008578,U001197,share,,03/09/2025 09:24,tablet,Chrome,,,FALSE,2025-03-09 9:24
E003094,U001522,search,,05/19/2025 21:36,,,macOS,,FALSE,2025-05-19 21:36
E008778,U001646,share,,2024-03-20,tablet,,,,TRUE,2024-03-20 14:56
E001302,U000570,doc_delete,,11/17/2024 16:52,desktop,Chrome,Linux,,FALSE,2024-11-17 16:52
E002225,u000311,comment,,2025-02-11 11:13,DESKTOP,Edge,Linux,,TRUE,2025-02-11 11:13
E001116,U001036,search,,0000-00-00 00:00:00,,,,unknown,FALSE,2024-03-01 15:01
E007331,U002055,integration_error,,03/27/2024 22:18,,Edge,Linux,,FALSE,2024-03-27 22:18
E000735,U001646,doc_edit,,2025-02-12 21:13,DESKTOP,Chrome,Android,,,2025-02-12 21:13
E003758, U000255 ,comment,,10/19/2023 12:43,,,Windows,,TRUE,2023-10-19 12:43
 E004808,U000082,login,/billing,03/30/2025 18:56,,Edge,,1595,TRUE,2025-03-30 18:56
E000544,U000520,doc_delete,,2023-10-25 1:02,DESKTOP,,macOS,741,TRUE,2023-10-25 1:02
E003064,U000721,ai_search,,2024-09-22,DESKTOP,,,253,,2024-09-22 14:57
E001727,U001992,share,,,,Edge,Linux,1670,TRUE,2024-03-07 9:45
E008667,U002041,share,,2024-08-07 8:18,,Chrome,Android,,,2024-08-07 8:18
E003041,U001698,login,/settings,2024-09-21,mobile,Brave,iOS,unknown,,2024-09-21 15:14
E007965,U000329,comment,,0000-00-00 00:00:00,tablet,,Android,,TRUE,2024-03-13 10:47
E008358,U001399,logout,/settings,2024-01-22,tablet,Safari,,,1,2024-01-22 22:29
E003399,U002235,login,/integrations,2023-02-27 1:12,,Edge,iOS,,,2023-02-27 1:12
E007796,USR-002363,doc_create,,0000-00-00 00:00:00,,,Android,987,TRUE,2024-09-19 8:47
E006815,U001192,comment,,2024-04-03,tablet,Chrome,iOS,1715,1,2024-04-03 7:35
E002885,U002535,share,,11/25/2023 05:06,,Safari,,228,1,2023-11-25 5:06
E000695,U000364,integration_error,,11/01/2024 13:53,mobile,Edge,,,TRUE,2024-11-01 13:53
E000318,U002496,doc_delete,,01/21/2023 02:46,DESKTOP,Brave,,757,FALSE,2023-01-21 2:46
E008594,u000543,doc_create,,2024-02-05 12:02,,,iOS,,0,2024-02-05 12:02
e005124,U000328,logout,/docs,2025-03-11 10:06,tablet,,Windows,unknown,0,2025-03-11 10:06
E003066,U000291,integration_connect,,07/10/2024 21:37,,,macOS,1143,FALSE,2024-07-10 21:37
E006706,U001852,search,,2025-05-21,,Firefox,macOS,782,0,2025-05-21 8:46
E004026, U002029 ,search,,,,Firefox,,,1,2023-04-22 6:24
E005787,U001272,doc_create,,11/08/2024 11:54,tablet,Edge,,,TRUE,2024-11-08 11:54
E000082,U000236,page_view,/dashboard,07/24/2024 13:45,desktop,Safari,iOS,,,2024-07-24 13:45
E008548,U002057,logout,/search,2023-03-14 9:43,,Edge,,,FALSE,2023-03-14 9:43
E001899,U002497,integration_error,,12/14/2023 19:11,desktop,Chrome,Android,,FALSE,2023-12-14 19:11
 E005937,U000259,doc_edit,,,mobile,Edge,Linux,,FALSE,2024-07-28 21:13
E008597,U000665,logout,/settings,2024-11-16 19:08,,Safari,Windows,1793,,2024-11-16 19:08
E008090,U000165,search,,04/11/2024 17:16,,Safari,Windows,,0,2024-04-11 17:16
E004194,U002424,logout,/docs,2024-09-25 7:23,mobile,Chrome,iOS,,,2024-09-25 7:23
E003230,U000467,ai_search,,12/06/2024 23:43,,Edge,,unknown,,2024-12-06 23:43
E000693,U002114,page_view,/settings,2024-02-14 0:58,DESKTOP,Safari,,,TRUE,2024-02-14 0:58
E003325,U000299,comment,,2024-02-23 22:12,DESKTOP,Brave,macOS,unknown,,2024-02-23 22:12
E000989,U000551,integration_connect,,2023-02-20 13:45,,,,489,0,2023-02-20 13:45
E001990,U002390,integration_connect,,11/07/2023 14:29,,Edge,iOS,,1,2023-11-07 14:29
E002731,U002524,ai_search,,01/27/2025 15:21,,Edge,,,1,2025-01-27 15:21
E005643,U001686,integration_error,,07/29/2023 12:17,,Chrome,iOS,1780,TRUE,2023-07-29 12:17
E007786,U000852,login,/onboarding,05/25/2025 23:33,,Safari,,,1,2025-05-25 23:33
E008788,U001062,doc_create,,01/31/2025 11:51,DESKTOP,,Linux,unknown,,2025-01-31 11:51
E007145,U001857,search,,2024-10-11,DESKTOP,Edge,,,TRUE,2024-10-11 4:36
E006776,U000573,doc_create,,,DESKTOP,,macOS,,TRUE,2025-03-18 14:47
E001335,U002503,integration_connect,,2025-03-30,,,Windows,unknown,FALSE,2025-03-30 14:19
E005215,U000208,integration_connect,,12/22/2024 04:31,tablet,Edge,iOS,437,FALSE,2024-12-22 4:31
E007853,U000822,doc_edit,,11/28/2023 22:55,tablet,Brave,,157,,2023-11-28 22:55
E005425,U000549,doc_edit,,2025-05-25,desktop,Firefox,Windows,,0,2025-05-25 2:22
E008331,U002282,doc_create,,12/13/2023 15:47,tablet,Safari,Linux,unknown,TRUE,2023-12-13 15:47
E000467,U000745,doc_delete,,2023-03-03,mobile,Edge,Android,unknown,,2023-03-03 1:41
E000950,U001919,search,,2024-04-12 19:53,,Chrome,Linux,unknown,TRUE,2024-04-12 19:53
E007981,U001685,integration_connect,,2024-09-05,desktop,Edge,iOS,unknown,TRUE,2024-09-05 4:54
E001212,u001760,integration_connect,,02/26/2023 02:39,DESKTOP,Chrome,Windows,1753,,2023-02-26 2:39
E003841,U000957,doc_create,,2024-07-27 10:59,tablet,,macOS,,1,2024-07-27 10:59
E000381,U000167,ai_search,,05/30/2023 07:37,,Chrome,iOS,,TRUE,2023-05-30 7:37
E004758, U001624 ,doc_edit,,05/19/2024 08:23,tablet,,iOS,,TRUE,2024-05-19 8:23
E007352,U001862,doc_edit,,2024-06-18 2:27,desktop,Firefox,Android,,TRUE,2024-06-18 2:27
E005310,U001797,integration_connect,,03/29/2025 09:15,DESKTOP,,iOS,,FALSE,2025-03-29 9:15
E006858,U000964,integration_error,,03/27/2025 19:46,tablet,Chrome,,893,TRUE,2025-03-27 19:46
E006728,U000677,doc_edit,,0000-00-00 00:00:00,,,Linux,,TRUE,2024-02-04 10:53
E001458,U002246,doc_delete,,2023-06-11,desktop,Chrome,Android,10,0,2023-06-11 3:50
E000392,U000461,doc_delete,,2024-08-17,,,macOS,1020,FALSE,2024-08-17 12:27
E000188,U000054,integration_connect,,,DESKTOP,,,997,TRUE,2024-09-04 18:27
E002677,U002286,login,/search,2025-01-17 5:05,tablet,Safari,iOS,unknown,TRUE,2025-01-17 5:05
E008053,U002230,ai_search,,04/12/2025 05:12,desktop,Brave,macOS,,TRUE,2025-04-12 5:12
E000220, U000003 ,logout,/help,2023-01-04 14:25,desktop,Safari,macOS,934,,2023-01-04 14:25
E000377, U000627 ,login,/help,2023-05-16 23:29,,,,,,2023-05-16 23:29
E003407,U001455,integration_connect,,05/12/2023 21:15,mobile,Edge,,,,2023-05-12 21:15
E004886,U001016,page_view,/admin,2024-10-27 18:33,,Brave,macOS,unknown,0,2024-10-27 18:33
E001675,U000214,share,,2024-04-30 6:16,,,,unknown,FALSE,2024-04-30 6:16
E006216,U002273,login,/docs,10/14/2024 18:59,desktop,,macOS,,0,2024-10-14 18:59
e005517,U000524,doc_edit,,01/12/2024 11:34,DESKTOP,,Android,,FALSE,2024-01-12 11:34
E004160,U001389,doc_create,,2024-04-02,DESKTOP,Brave,iOS,unknown,TRUE,2024-04-02 7:53
E002238,U002420,export,,12/18/2024 11:33,desktop,Safari,iOS,,FALSE,2024-12-18 11:33
E007122,U000972,doc_create,,2024-04-19,tablet,Brave,Android,,FALSE,2024-04-19 21:13
E005555, U000601 ,integration_error,,2023-05-19 11:53,DESKTOP,,macOS,,1,2023-05-19 11:53
E002167,U000993,doc_edit,,02/04/2025 06:44,,Edge,iOS,unknown,,2025-02-04 6:44
E008558,U002295,integration_error,,09/21/2023 14:15,tablet,Firefox,Windows,1551,,2023-09-21 14:15
E006069,u000262,search,,2023-04-20 13:55,desktop,Brave,,unknown,0,2023-04-20 13:55
E000522,U002185,doc_edit,,2023-07-16 1:18,,Safari,Android,,0,2023-07-16 1:18
E007107,U002340,comment,,2023-02-16,,,,343,,2023-02-16 5:48
E008377,U002531,integration_error,,2024-03-09 20:44,,Brave,Windows,,TRUE,2024-03-09 20:44
E007641,U002055,comment,,01/16/2024 10:38,DESKTOP,,Windows,unknown,,2024-01-16 10:38
E004350,U000129,page_view,/admin,09/05/2024 18:45,tablet,Chrome,macOS,847,1,2024-09-05 18:45
E004110,U002548,share,,0000-00-00 00:00:00,tablet,Firefox,,unknown,1,2024-03-26 1:25
E003874,U002094,COMMENT,,06/25/2023 23:23,desktop,,,,1,2023-06-25 23:23
E001328, U000261 ,doc_edit,,0000-00-00 00:00:00,tablet,Firefox,,1275,FALSE,2024-05-04 12:58
E003487,U001372,comment,,07/13/2023 13:11,desktop,,,1693,TRUE,2023-07-13 13:11
E006086,U001179,doc_edit,,2024-05-27 17:03,,Safari,iOS,205,,2024-05-27 17:03
E005434,U000430,integration_connect,,2023-05-03 11:22,mobile,Safari,,164,1,2023-05-03 11:22
E006784,U001692,login,/search,04/11/2025 23:37,DESKTOP,,Windows,422,TRUE,2025-04-11 23:37
E001253,U001406,search,,2024-12-20 21:35,tablet,Safari,Linux,,,2024-12-20 21:35
E000283,U001482,share,,01/15/2025 05:08,mobile,,,801,TRUE,2025-01-15 5:08
E005068,u002199,INTEGRATION_CONNECT,,2023-08-21 11:07,,Chrome,iOS,,FALSE,2023-08-21 11:07
E003184,U002113,comment,,0000-00-00 00:00:00,DESKTOP,Firefox,,,1,2024-01-03 7:00
 E007176,U001401,search,,,,Chrome,macOS,,TRUE,2023-09-25 17:11
E008303,U002168,share,,2024-12-29 19:27,,Chrome,Android,unknown,TRUE,2024-12-29 19:27
E008174,U000631,page_view,/settings,01/13/2023 12:24,,,,113,FALSE,2023-01-13 12:24
E006113,U000822,search,,08/24/2024 15:38,,Edge,Windows,unknown,FALSE,2024-08-24 15:38
E000579,U000972,doc_delete,,2023-12-02 15:03,desktop,,Android,unknown,TRUE,2023-12-02 15:03
E003827,U000856,ai_search,,2023-07-30 16:56,,Chrome,,unknown,,2023-07-30 16:56
E000268,U002469,comment,,05/21/2024 10:51,desktop,,Android,604,1,2024-05-21 10:51
e007633,U000412,doc_create,,10/22/2023 14:08,,Firefox,macOS,,0,2023-10-22 14:08
E000558,U002272,doc_create,,2024-12-10,mobile,Brave,Linux,,1,2024-12-10 9:20
E008396,USR-000456,integration_connect,,2023-09-17,mobile,Chrome,iOS,357,1,2023-09-17 1:13
E007235,U001001,export,,09/25/2024 09:52,tablet,Firefox,,,TRUE,2024-09-25 9:52
E004087,U001616,login,/pricing,2024-04-03 10:54,tablet,Chrome,,,0,2024-04-03 10:54
E008798,U000779,doc_create,,10/08/2024 04:57,,Brave,macOS,171,FALSE,2024-10-08 4:57
e004214,U002359,page_view,/dashboard,2023-09-03,,Edge,,,FALSE,2023-09-03 5:22
E002791,U000449,export,,01/27/2025 08:33,,Brave,,unknown,TRUE,2025-01-27 8:33
E001066, U001749 ,comment,,10/30/2024 14:40,desktop,Brave,Android,,1,2024-10-30 14:40
E005089,U000709,doc_edit,,2024-09-07,desktop,Edge,iOS,,,2024-09-07 9:29
E000592,U002358,page_view,/help,06/20/2023 08:54,tablet,,Windows,449,FALSE,2023-06-20 8:54
E001218,U001644,comment,,08/12/2024 01:43,,,,141,TRUE,2024-08-12 1:43
E001900,U001050,share,,0000-00-00 00:00:00,mobile,Brave,Linux,unknown,,2025-02-05 12:11
E007150,U000253,integration_error,,01/24/2025 22:18,DESKTOP,Brave,,,FALSE,2025-01-24 22:18
E005507,U001294,doc_delete,,,,,Windows,unknown,0,2024-06-29 17:21
E002658,U001630,doc_delete,,,mobile,Chrome,Windows,,0,2023-12-20 21:59
E006408,U001719,integration_error,,07/03/2023 17:58,mobile,,Windows,unknown,TRUE,2023-07-03 17:58
E008895,U001627,logout,/help,2024-06-28 23:18,DESKTOP,Safari,macOS,,1,2024-06-28 23:18
E003938,U000553,doc_edit,,,desktop,Safari,Android,,0,2023-04-02 4:38
E007083,U000666,share,,2023-04-27,DESKTOP,Firefox,,,0,2023-04-27 1:16
E002837,USR-000807,login,/onboarding,2024-02-12,,,Linux,,0,2024-02-12 15:42
E007418,U001559,integration_connect,,2025-01-22 16:45,,Safari,Linux,unknown,FALSE,2025-01-22 16:45
E003444,u002529,doc_edit,,2023-10-24,,Chrome,iOS,unknown,0,2023-10-24 19:31
E008205,U001273,doc_create,,2024-11-12 13:43,tablet,Edge,iOS,112,FALSE,2024-11-12 13:43
E008989,U002198,doc_edit,,,desktop,Chrome,,unknown,FALSE,2023-09-02 17:31
E004617,U000400,login,/pricing,2024-11-15 12:40,,Brave,,,0,2024-11-15 12:40
E000990,U001386,LOGOUT,/pricing,02/09/2025 08:44,tablet,,,unknown,,2025-02-09 8:44
E006732,U001773,logout,/integrations,2023-12-13,desktop,,,unknown,1,2023-12-13 11:52
E008689,U000545,integration_error,,05/06/2024 14:17,mobile,,Windows,846,,2024-05-06 14:17
E005300,U000549,doc_edit,,0000-00-00 00:00:00,mobile,Firefox,Android,,1,2023-09-24 15:25
E001773,U001055,LOGIN,/admin,,tablet,Safari,iOS,,FALSE,2024-08-04 9:25
E008888,U000049,share,,,desktop,Chrome,,unknown,1,2024-07-07 1:05
E007925,U002326,comment,,,,Brave,,,,2024-09-09 9:41
E007152,U002578,ai_search,,,,Chrome,,unknown,TRUE,2024-06-23 23:07
E000759,U001805,comment,,06/05/2023 05:50,desktop,,Windows,unknown,TRUE,2023-06-05 5:50
E004805,U000419,export,,2023-04-16,desktop,,Android,772,TRUE,2023-04-16 9:11
E001023,U001618,ai_search,,09/07/2024 21:18,mobile,Brave,macOS,,TRUE,2024-09-07 21:18
E001007,U002445,EXPORT,,2025-01-07,tablet,Edge,iOS,unknown,,2025-01-07 11:06
E002863,U000913,ai_search,,2025-06-05,mobile,,Windows,,TRUE,2025-06-05 3:00
 E005565,U000089,login,/onboarding,2023-12-02 5:56,,Safari,iOS,unknown,TRUE,2023-12-02 5:56
E002528,U000329,login,/integrations,2024-02-13 18:38,DESKTOP,Firefox,,,TRUE,2024-02-13 18:38
E001585,USR-001501,share,,11/28/2023 09:48,DESKTOP,,iOS,unknown,FALSE,2023-11-28 9:48
E004087,U001616,login,/pricing,2024-04-03 10:54,tablet,Chrome,,,0,2024-04-03 10:54
E002921,U002298,export,,0000-00-00 00:00:00,,,Android,unknown,,2024-05-12 16:44
E008129,U001431,logout,/docs,04/11/2023 04:08,tablet,Safari,Windows,unknown,1,2023-04-11 4:08
E000542,U002078,integration_connect,,,,Firefox,Linux,unknown,FALSE,2024-11-08 18:01
E008528,U001350,logout,/help,2023-12-03 12:53,mobile,Firefox,,,FALSE,2023-12-03 12:53
E007114,U001172,page_view,/dashboard,08/02/2024 20:52,tablet,Firefox,Linux,,,2024-08-02 20:52
E007871,U001173,integration_error,,2023-03-27 4:30,desktop,Edge,macOS,1737,TRUE,2023-03-27 4:30
E006889,U001355,DOC_EDIT,,2025-01-06,,Safari,,,TRUE,2025-01-06 8:53
E006799,U000772,logout,/admin,2023-05-18 10:26,,,Windows,,,2023-05-18 10:26
E000639,U001964,comment,,2024-06-06 13:05,,Chrome,Windows,160,0,2024-06-06 13:05
E002523,U002415,PAGE_VIEW,/admin,0000-00-00 00:00:00,,Safari,Linux,unknown,1,2023-02-10 15:00
E007509,U001490,login,/onboarding,,DESKTOP,Edge,,,,2025-05-25 21:00
E003365,U000568,share,,03/14/2025 15:26,mobile,Safari,,1642,FALSE,2025-03-14 15:26
E006343,U000699,ai_search,,09/01/2023 02:42,tablet,,,unknown,TRUE,2023-09-01 2:42
E004509,U000851,integration_error,,2023-05-10 23:18,,,,,1,2023-05-10 23:18
E003437,USR-001793,export,,2023-04-19 18:18,,Edge,,,FALSE,2023-04-19 18:18
E008367,U001790,AI_SEARCH,,11/23/2023 03:58,DESKTOP,,,unknown,TRUE,2023-11-23 3:58
E001734,U000241,login,/pricing,07/31/2024 21:12,mobile,Safari,,,0,2024-07-31 21:12
E000879,u001248,doc_edit,,2024-04-02,,Brave,Android,unknown,,2024-04-02 13:37
E000622,U002083,doc_create,,09/28/2024 05:57,tablet,Edge,,1621,TRUE,2024-09-28 5:57
E005460,U001853,search,,2023-08-21 21:56,,Edge,Linux,unknown,TRUE,2023-08-21 21:56
E003605,U001079,doc_create,,10/14/2023 11:06,DESKTOP,,Android,unknown,FALSE,2023-10-14 11:06
E003512,U001155,export,,07/05/2023 22:42,mobile,,Linux,,1,2023-07-05 22:42
E000151,U001205,comment,,,mobile,Chrome,macOS,6,,2023-10-31 3:45
e001193,U001086,comment,,2025-06-02 20:08,tablet,Chrome,,940,0,2025-06-02 20:08
E003426,U002200,doc_delete,,2024-08-13,mobile,,,1354,0,2024-08-13 20:40
E000580,U000480,page_view,/help,2023-02-18 10:08,tablet,Firefox,Windows,1036,,2023-02-18 10:08
E000787,U000775,share,,2023-07-07,,Firefox,,unknown,FALSE,2023-07-07 1:53
E005635,U001313,doc_create,,2025-03-14,DESKTOP,,iOS,unknown,TRUE,2025-03-14 20:39
E000773,U000067,page_view,/docs,01/19/2025 13:21,tablet,Firefox,Windows,,,2025-01-19 13:21
E004483,U001548,doc_create,,07/26/2023 07:30,,Chrome,macOS,1525,TRUE,2023-07-26 7:30
E000700,U001735,integration_error,,2025-06-10 13:57,,Chrome,Linux,,FALSE,2025-06-10 13:57
E006455,USR-001174,doc_create,,09/23/2023 05:13,tablet,Edge,macOS,,FALSE,2023-09-23 5:13
E004414,u002072,export,,03/11/2023 23:21,mobile,,Android,unknown,0,2023-03-11 23:21
E007724,U002270,logout,/settings,06/15/2025 06:18,,Safari,,unknown,FALSE,2025-06-15 6:18
E001741,U002213,doc_edit,,2023-07-15 16:26,desktop,,Windows,,0,2023-07-15 16:26
E005644,U000780,export,,2023-02-01 1:31,desktop,,iOS,1728,0,2023-02-01 1:31
E003474,U001535,page_view,/admin,02/03/2024 10:56,tablet,Firefox,macOS,1199,1,2024-02-03 10:56
E007103,U002406,doc_create,,06/04/2025 07:57,,Chrome,,816,FALSE,2025-06-04 7:57
E003997,U000390,doc_delete,,01/28/2024 13:48,mobile,Edge,Android,983,FALSE,2024-01-28 13:48
E001793,U000446,doc_delete,,2024-10-29,mobile,Firefox,Windows,1298,TRUE,2024-10-29 18:32
E008934,u002585,integration_error,,04/24/2025 20:49,,Safari,iOS,unknown,FALSE,2025-04-24 20:49
E000021,U000499,doc_create,,02/26/2023 08:23,DESKTOP,Safari,Linux,842,,2023-02-26 8:23
E000712,u001843,comment,,2024-03-01,DESKTOP,,,unknown,TRUE,2024-03-01 9:20
E000356,U002127,login,/admin,2023-12-16 2:51,,Firefox,Linux,unknown,0,2023-12-16 2:51
e005772,U001801,page_view,/dashboard,2024-12-26 2:10,mobile,Safari,Windows,unknown,0,2024-12-26 2:10
E003224,U001614,ai_search,,2024-04-13,DESKTOP,Brave,Linux,,TRUE,2024-04-13 4:54
E000053,U002593,page_view,/billing,2024-10-05 22:55,DESKTOP,Brave,,unknown,1,2024-10-05 22:55
E006439,u000077,doc_edit,,2024-05-20 0:35,,,macOS,,FALSE,2024-05-20 0:35
E004606,U000053,logout,/integrations,2025-04-17,,Safari,Android,,TRUE,2025-04-17 8:20
E002628,U000258,search,,06/11/2024 14:25,,Firefox,iOS,,FALSE,2024-06-11 14:25
E003901,U000021,doc_create,,04/29/2025 06:54,mobile,Firefox,Android,,1,2025-04-29 6:54
E003017,U000185,share,,0000-00-00 00:00:00,tablet,Firefox,,1653,1,2023-12-11 15:33
E001919,U001304,export,,2024-12-16 6:38,,Firefox,macOS,,FALSE,2024-12-16 6:38
E006833,U001641,ai_search,,,,Firefox,iOS,,,2023-02-07 7:17
E003679,U000357,integration_error,,2023-02-09,mobile,Brave,Android,unknown,FALSE,2023-02-09 22:35
E007738,U002548,share,,0000-00-00 00:00:00,tablet,Edge,Android,,0,2024-07-24 6:11
E005545,U001387,comment,,2023-01-07 12:30,tablet,Brave,iOS,,TRUE,2023-01-07 12:30
E001379,U001114,comment,,,mobile,,Linux,unknown,,2023-05-24 19:02
E001482, U000007 ,login,/admin,2025-05-20 18:27,desktop,,,unknown,1,2025-05-20 18:27
E008584,U000962,doc_create,,09/11/2024 17:27,,,,,,2024-09-11 17:27
E002004,U000136,comment,,04/18/2025 19:20,tablet,,,,0,2025-04-18 19:20
E001979,U002278,login,/help,05/17/2024 07:36,tablet,Safari,Linux,,1,2024-05-17 7:36
E004564,U000611,doc_create,,2024-12-24 2:13,tablet,Edge,,,TRUE,2024-12-24 2:13
E006431,U001522,doc_delete,,02/28/2024 01:07,DESKTOP,Brave,Windows,,0,2024-02-28 1:07
E003101,u000944,export,,0000-00-00 00:00:00,,Safari,,,,2023-04-12 7:26
E004010,U000540,login,/onboarding,01/08/2023 22:13,desktop,,Android,,1,2023-01-08 22:13
E005500,U001274,share,,0000-00-00 00:00:00,desktop,,macOS,unknown,1,2024-09-26 21:08
E004779,U000157,login,/docs,10/27/2024 15:34,tablet,Brave,Windows,unknown,,2024-10-27 15:34
E007019,U001533,logout,/settings,2025-01-15,desktop,Edge,,unknown,TRUE,2025-01-15 3:39
E005377,USR-000078,doc_edit,,2023-07-20,desktop,,iOS,1222,FALSE,2023-07-20 16:07
E002031,U000451,integration_error,,2023-02-08,desktop,,Linux,,,2023-02-08 3:47
E008641,U002121,INTEGRATION_ERROR,,2023-10-31,DESKTOP,,,unknown,FALSE,2023-10-31 16:20
E000517,U000883,share,,02/25/2025 02:38,desktop,,,,TRUE,2025-02-25 2:38
E004054,U002591,doc_edit,,2023-12-19,,,,,FALSE,2023-12-19 17:12
E008468,U000805,export,,2023-12-27 7:12,mobile,Firefox,,850,,2023-12-27 7:12
E002483,U000633,search,,06/28/2024 12:47,,Edge,macOS,824,,2024-06-28 12:47
E004809,u002204,LOGOUT,/docs,2025-02-20 7:57,tablet,Edge,,,TRUE,2025-02-20 7:57
E004602,U001636,export,,03/24/2023 20:40,DESKTOP,,,394,FALSE,2023-03-24 20:40
E005783,U001350,page_view,/search,07/23/2024 03:32,desktop,Firefox,macOS,,0,2024-07-23 3:32
E000995,U002491,SEARCH,,2023-02-02,desktop,,,,,2023-02-02 6:26
E000379,U002067,share,,04/18/2025 23:23,,Edge,Windows,unknown,TRUE,2025-04-18 23:23
E006685,U000612,integration_connect,,,,,Linux,1199,TRUE,2023-04-24 10:32
E005132,U000726,export,,2023-05-11 6:12,tablet,Chrome,macOS,,FALSE,2023-05-11 6:12
 E004724,USR-002049,integration_connect,,2025-01-22 16:57,tablet,,Windows,unknown,FALSE,2025-01-22 16:57
E001094,U000243,doc_create,,,,,macOS,unknown,1,2024-11-08 13:36
E002161,U001749,page_view,/admin,,desktop,,,,TRUE,2023-02-22 0:32
E003874,U000803,page_view,/dashboard,2023-07-12,desktop,Chrome,Windows,,FALSE,2023-07-12 20:28
E006075,U002578,search,,2025-04-05,DESKTOP,Chrome,macOS,,,2025-04-05 21:18
E002793,U000165,export,,01/29/2025 04:07,desktop,Chrome,macOS,unknown,,2025-01-29 4:07
E004926,U000286,ai_search,,,mobile,Brave,Linux,,FALSE,2025-01-03 8:12
E006573,U001647,share,,,mobile,,,,,2024-07-15 6:10
E004506,U001470,login,/settings,2023-12-19 5:02,,Chrome,Windows,unknown,,2023-12-19 5:02
E003235,U001007,comment,,2025-06-19 3:45,,Firefox,,unknown,FALSE,2025-06-19 3:45
E002631,u000241,integration_error,,04/03/2024 05:34,desktop,,macOS,unknown,1,2024-04-03 5:34
E000028,U001484,doc_create,,03/05/2025 10:04,desktop,Edge,macOS,,FALSE,2025-03-05 10:04
E006464,U001769,logout,/docs,,,Chrome,,unknown,,2024-07-09 8:12
E000424,U002141,integration_error,,2024-12-21 22:33,DESKTOP,Chrome,,,,2024-12-21 22:33
E001141,U001927,comment,,05/13/2023 17:45,,Chrome,Android,1757,0,2023-05-13 17:45
E007323,U000598,integration_connect,,04/14/2023 03:03,tablet,,Android,unknown,0,2023-04-14 3:03
E003380,U001007,integration_error,,2025-04-11 22:03,DESKTOP,Safari,,,,2025-04-11 22:03
E000224,U000421,doc_create,,10/22/2024 03:51,desktop,Edge,iOS,unknown,TRUE,2024-10-22 3:51
E006255,U000626,integration_connect,,2024-09-05 5:09,tablet,,iOS,,0,2024-09-05 5:09
E008976,U000308,logout,/onboarding,,mobile,Edge,macOS,,FALSE,2023-11-19 10:29
E001117,u000701,doc_edit,,2024-12-23,DESKTOP,Firefox,Android,58,1,2024-12-23 17:04
E002829,U002364,integration_connect,,08/15/2023 06:15,DESKTOP,Chrome,Windows,unknown,FALSE,2023-08-15 6:15
E005158,U001345,doc_create,,2024-11-05,desktop,,macOS,unknown,,2024-11-05 13:12
E006424,U000245,doc_create,,2023-03-17 4:00,DESKTOP,,,,TRUE,2023-03-17 4:00
E000157, U002447 ,integration_connect,,04/10/2024 12:01,desktop,Chrome,,,FALSE,2024-04-10 12:01
E002940,U002562,doc_create,,,mobile,,Android,unknown,FALSE,2024-03-12 8:39
E001738,U000628,logout,/search,2023-02-02 5:11,DESKTOP,Brave,Linux,unknown,1,2023-02-02 5:11
E007885,U000778,share,,,,Chrome,Android,,,2024-01-04 23:24
E005229,U001221,share,,2023-04-21 17:44,DESKTOP,Edge,,,FALSE,2023-04-21 17:44
E006710,U000252,logout,/dashboard,2024-02-04,,,,,,2024-02-04 2:44
E001404,U000798,logout,/pricing,2023-05-10,DESKTOP,Firefox,Android,819,0,2023-05-10 4:51
E007487,u000092,integration_connect,,2023-12-13 16:08,,Firefox,,566,0,2023-12-13 16:08
E004273,U001289,share,,01/21/2023 18:14,,Edge,,,0,2023-01-21 18:14
E007582,U000346,integration_error,,09/15/2023 13:04,tablet,,Windows,,FALSE,2023-09-15 13:04
E006488,u002566,search,,2024-05-24,DESKTOP,Safari,Android,,,2024-05-24 5:29
E005893,U000755,ai_search,,2024-10-18 7:56,,Safari,Android,unknown,FALSE,2024-10-18 7:56
E003075,U002225,comment,,2025-03-01,desktop,Brave,Linux,302,FALSE,2025-03-01 2:00
E001843,U000306,share,,,DESKTOP,Edge,macOS,,FALSE,2025-02-04 12:26
E004417,U002050,share,,05/11/2024 09:12,mobile,Safari,Windows,425,TRUE,2024-05-11 9:12
E005443, U000851 ,share,,05/27/2024 02:44,,,iOS,,TRUE,2024-05-27 2:44
E005369,U001110,doc_create,,05/15/2023 05:59,,,Linux,unknown,TRUE,2023-05-15 5:59
E000994,U000827,export,,01/06/2024 22:32,,,Linux,1051,TRUE,2024-01-06 22:32
E000337,U001616,integration_error,,2025-01-13 2:36,tablet,Firefox,macOS,,TRUE,2025-01-13 2:36
E005675,U000768,share,,2024-01-17 17:26,desktop,Chrome,,,,2024-01-17 17:26
E003853,U002349,doc_edit,,0000-00-00 00:00:00,tablet,Safari,,,FALSE,2024-05-24 2:57
E003211,U001384,doc_delete,,,DESKTOP,Brave,,,TRUE,2023-12-06 8:55
E003971,U001474,doc_delete,,2025-01-25 7:53,desktop,,macOS,unknown,0,2025-01-25 7:53
E004554,U001586,doc_delete,,,DESKTOP,Brave,Linux,112,1,2023-12-13 12:11
E004749,U000122,ai_search,,2023-10-23,desktop,,,869,1,2023-10-23 6:42
 E002881,U000230,doc_create,,,,Brave,macOS,,FALSE,2023-11-26 7:01
E005492,U002092,integration_error,,2023-08-14,,Chrome,Linux,unknown,TRUE,2023-08-14 10:37
E007069,U002514,logout,/integrations,11/08/2023 13:10,mobile,Brave,iOS,366,TRUE,2023-11-08 13:10
E002781,U001081,search,,2024-08-08 6:10,,Brave,macOS,1705,FALSE,2024-08-08 6:10
E008777,U001710,export,,12/12/2024 21:00,,Safari,Windows,unknown,FALSE,2024-12-12 21:00
e001140,U001487,comment,,,,Safari,,,1,2023-07-19 2:34
E005978,U000913,share,,2023-02-20,mobile,Chrome,iOS,,FALSE,2023-02-20 21:04
E001312,U002436,INTEGRATION_ERROR,,2024-02-17,tablet,Safari,macOS,,FALSE,2024-02-17 16:55
E007561,U001427,integration_error,,2025-03-28 9:49,,,Linux,unknown,TRUE,2025-03-28 9:49
E008711,U000501,page_view,/help,04/29/2024 15:49,desktop,Brave,,unknown,TRUE,2024-04-29 15:49
E005764, U001224 ,search,,06/08/2023 00:19,desktop,Safari,Windows,unknown,FALSE,2023-06-08 0:19
E000659,U000994,ai_search,,2024-03-01 22:23,,Brave,Windows,unknown,,2024-03-01 22:23
E001659,U000080,share,,08/11/2023 07:45,desktop,Brave,,,1,2023-08-11 7:45
E003580,U001987,logout,/integrations,04/22/2025 22:29,,Edge,iOS,,TRUE,2025-04-22 22:29
E005375,U000291,integration_connect,,03/01/2023 08:04,,Chrome,Windows,,FALSE,2023-03-01 8:04
E000955,U001709,DOC_EDIT,,,DESKTOP,Firefox,,unknown,FALSE,2025-03-18 18:33
E004768,U001067,share,,2023-10-30,,,,,0,2023-10-30 16:50
E003001,USR-000771,comment,,07/08/2024 03:08,,,,,FALSE,2024-07-08 3:08
E003482,U000724,login,/billing,0000-00-00 00:00:00,,,,570,TRUE,2025-06-17 6:30
E005568,U001843,doc_delete,,04/10/2023 06:46,,Firefox,Linux,121,FALSE,2023-04-10 6:46
E002032,U002316,LOGIN,/pricing,2025-04-24 9:02,,Edge,,,TRUE,2025-04-24 9:02
E004746,U000265,doc_create,,12/23/2024 09:04,desktop,Brave,,,,2024-12-23 9:04
E008517,U001557,doc_create,,01/21/2025 19:38,,,Windows,1200,TRUE,2025-01-21 19:38
E006284,U002313,doc_edit,,02/14/2024 04:00,desktop,Edge,,1192,FALSE,2024-02-14 4:00
E007145,U001234,doc_delete,,2023-11-17 19:02,tablet,Brave,,754,FALSE,2023-11-17 19:02
 E004374,U000553,logout,/docs,2024-05-30,mobile,Edge,macOS,268,TRUE,2024-05-30 20:51
E002505,U001811,integration_error,,03/01/2024 10:07,desktop,,macOS,,,2024-03-01 10:07
E007198,U002184,doc_create,,2023-11-01 18:52,tablet,Chrome,Android,111,1,2023-11-01 18:52
E001162,U001850,login,/onboarding,2023-04-27 2:28,tablet,,iOS,1668,TRUE,2023-04-27 2:28
E001249,U001983,comment,,01/07/2024 10:09,,Safari,iOS,,TRUE,2024-01-07 10:09
E000457,U002536,login,/onboarding,2023-06-17 11:36,DESKTOP,,,1274,,2023-06-17 11:36
E000903,U001553,page_view,/search,2024-02-01 23:41,tablet,Chrome,iOS,unknown,FALSE,2024-02-01 23:41
E003579,U001890,login,/pricing,2025-02-27 3:38,tablet,Edge,,unknown,1,2025-02-27 3:38
e002398,U001121,doc_delete,,2025-03-09,,Firefox,,unknown,,2025-03-09 18:51
E005687,U000045,integration_connect,,,mobile,,Windows,,,2023-11-03 6:18
E001715,U000152,doc_create,,03/11/2023 05:26,DESKTOP,Safari,Linux,unknown,,2023-03-11 5:26
E000782,U002511,share,,2024-03-29,mobile,,Linux,unknown,,2024-03-29 21:27
E002987,U001930,share,,2025-05-02 15:17,desktop,Brave,iOS,unknown,1,2025-05-02 15:17
E001311,USR-000305,login,/dashboard,2025-05-03,mobile,Edge,macOS,,TRUE,2025-05-03 14:14
E008258,u001335,search,,10/24/2024 18:08,,Safari,Android,unknown,,2024-10-24 18:08
E006427, U001609 ,login,/docs,2024-12-01,tablet,Edge,Linux,1794,TRUE,2024-12-01 1:01
E006404,U000465,logout,/help,,tablet,Edge,Linux,,TRUE,2023-03-05 8:54
E008399,U000548,search,,,,Safari,Linux,,,2023-04-29 23:36
E003378,U001153,export,,0000-00-00 00:00:00,,,macOS,827,1,2023-06-04 21:37
E000911,U001629,export,,2024-08-18 10:57,mobile,Firefox,Linux,,1,2024-08-18 10:57
E007038,U000703,page_view,/billing,2024-09-26 14:37,,Safari,macOS,146,FALSE,2024-09-26 14:37
E007505,U000661,integration_error,,2024-10-22,desktop,Safari,macOS,unknown,TRUE,2024-10-22 10:54
E008968,U001632,doc_edit,,05/14/2023 18:45,tablet,Firefox,iOS,unknown,TRUE,2023-05-14 18:45
E005228,U001258,login,/dashboard,02/23/2023 18:52,,Safari,Linux,unknown,,2023-02-23 18:52
E001668,U000002,integration_connect,,03/08/2023 23:43,,Safari,,unknown,0,2023-03-08 23:43
E004602,U002309,login,/onboarding,05/19/2025 18:57,,,,462,1,2025-05-19 18:57
E008006,U001802,export,,08/31/2024 09:14,,Chrome,,1326,1,2024-08-31 9:14
E006225,U000609,comment,,0000-00-00 00:00:00,,Firefox,macOS,,0,2024-03-07 15:56
E004598,U000761,doc_create,,2024-01-28,tablet,,Linux,,FALSE,2024-01-28 21:46
E007820,U000739,doc_delete,,2023-09-30,desktop,,,346,TRUE,2023-09-30 10:01
E004499,U000204,integration_connect,,2024-07-14 19:22,tablet,,,,,2024-07-14 19:22
E002700,U001428,ai_search,,2023-06-23 3:59,DESKTOP,,Android,,TRUE,2023-06-23 3:59
E008685,U001638,page_view,/docs,2024-09-09 23:35,mobile,Brave,,unknown,TRUE,2024-09-09 23:35
E001265,U000265,comment,,04/08/2024 06:20,,,,,FALSE,2024-04-08 6:20
E008442,u002543,ai_search,,,mobile,,iOS,,,2024-11-29 11:30
E004858,U000633,doc_delete,,2024-01-11 23:13,,Brave,Android,116,0,2024-01-11 23:13
E000837,U001500,ai_search,,2023-03-20 8:08,DESKTOP,Firefox,,unknown,,2023-03-20 8:08
E001541,U001024,logout,/pricing,08/04/2023 01:33,desktop,Firefox,iOS,,TRUE,2023-08-04 1:33
E007176,U000222,doc_create,,,desktop,,Android,,,2024-09-30 7:38
E003614,USR-001716,share,,2025-05-22 14:45,,Chrome,Windows,1019,1,2025-05-22 14:45
e002632,U001835,comment,,,mobile,Chrome,Linux,,0,2023-02-07 14:22
E001601,U002478,ai_search,,0000-00-00 00:00:00,mobile,Brave,,739,TRUE,2024-08-31 5:13
E003710,U002407,share,,2023-04-29,DESKTOP,,,,TRUE,2023-04-29 2:25
E008121,U001335,integration_connect,,2024-08-07,tablet,,macOS,,1,2024-08-07 15:23
 E007099,U002047,search,,0000-00-00 00:00:00,mobile,Firefox,,,,2025-06-08 14:54
E002338,U000122,integration_error,,0000-00-00 00:00:00,mobile,,Linux,unknown,,2025-04-05 19:45
E003995,U001739,search,,10/21/2024 22:45,,Safari,Android,unknown,FALSE,2024-10-21 22:45
E004550,U002366,doc_delete,,2023-11-07,,,macOS,unknown,TRUE,2023-11-07 14:06
E001887,U001760,page_view,/help,01/26/2024 01:37,desktop,,Android,unknown,FALSE,2024-01-26 1:37
E000531, U000023 ,doc_edit,,0000-00-00 00:00:00,mobile,Chrome,,,FALSE,2024-05-23 20:20
E005470,U000959,share,,2023-01-26,mobile,Brave,iOS,,FALSE,2023-01-26 1:37
E007105,U000631,doc_create,,2023-01-21,,,Linux,unknown,,2023-01-21 11:56
E000636,U002198,ai_search,,2024-01-30 4:40,mobile,Brave,,unknown,1,2024-01-30 4:40
E002604,U001109,doc_delete,,,,Firefox,,693,,2023-09-26 14:10
E001276,U000195,search,,,mobile,Firefox,macOS,unknown,0,2024-08-05 19:08
E006896,u001754,integration_connect,,02/06/2025 07:39,mobile,Safari,,,TRUE,2025-02-06 7:39
E003300,U001533,export,,04/11/2025 16:35,mobile,,iOS,,0,2025-04-11 16:35
E003024,U002019,ai_search,,05/02/2024 16:40,mobile,Firefox,,1152,FALSE,2024-05-02 16:40
E007912,U000025,login,/dashboard,2023-01-20 3:19,desktop,Edge,,,1,2023-01-20 3:19
e001390,U000426,doc_create,,2024-07-26 23:44,DESKTOP,Brave,macOS,957,0,2024-07-26 23:44
 E007380,U002546,search,,09/14/2024 01:56,tablet,Firefox,iOS,unknown,,2024-09-14 1:56
E002024,U000279,export,,2024-03-08 15:08,tablet,Firefox,macOS,1425,TRUE,2024-03-08 15:08
E002095,U001208,LOGOUT,/settings,,tablet,Brave,macOS,unknown,1,2023-09-09 22:28
E001769,U002306,share,,01/19/2024 16:37,,Firefox,iOS,1361,TRUE,2024-01-19 16:37
E008620,U001041,share,,2024-07-20,desktop,Chrome,Linux,,1,2024-07-20 16:58
E008270,U001189,page_view,/admin,07/17/2024 01:05,DESKTOP,Safari,Linux,,TRUE,2024-07-17 1:05
E004152,U000552,share,,2024-09-11 18:10,,Safari,iOS,21,1,2024-09-11 18:10
E001298,U001599,comment,,06/08/2023 11:18,DESKTOP,Safari,Linux,unknown,0,2023-06-08 11:18
E002892,U001890,export,,08/28/2024 05:28,tablet,,Android,unknown,,2024-08-28 5:28
E002729,U002547,integration_connect,,07/22/2024 20:45,,,,unknown,TRUE,2024-07-22 20:45
E004403,U001848,doc_edit,,2023-10-25 7:10,,Brave,macOS,47,,2023-10-25 7:10
E006707,U000098,page_view,/billing,2023-11-27,mobile,,iOS,,TRUE,2023-11-27 6:04
E008293,U001000,integration_connect,,07/10/2023 01:15,mobile,,Linux,,,2023-07-10 1:15
E007278,U001646,ai_search,,08/25/2023 23:26,mobile,Edge,Linux,unknown,,2023-08-25 23:26
E004405,U000152,export,,0000-00-00 00:00:00,mobile,,Windows,,FALSE,2025-04-14 6:10
E003167,U000265,integration_connect,,03/04/2025 05:56,tablet,Chrome,Linux,unknown,1,2025-03-04 5:56
 E008627,U000785,comment,,07/10/2024 20:46,,,iOS,unknown,,2024-07-10 20:46
E002789,U000585,COMMENT,,2023-03-11,tablet,,Windows,782,TRUE,2023-03-11 0:29
E000386,u001762,ai_search,,2023-04-22,,Brave,,1773,0,2023-04-22 12:41
E006934,U000367,doc_create,,2025-03-26 20:00,mobile,Edge,iOS,,FALSE,2025-03-26 20:00
E005369,u000410,comment,,2025-06-17,mobile,Edge,,unknown,0,2025-06-17 18:45
E002848,U002223,logout,/docs,,DESKTOP,Brave,Windows,unknown,,2025-04-28 14:59
E000864,U001946,doc_create,,12/06/2024 21:43,DESKTOP,Safari,,507,,2024-12-06 21:43
E005886,U001113,page_view,/integrations,0000-00-00 00:00:00,mobile,Firefox,iOS,,,2023-11-19 21:56
E006903,U000817,search,,0000-00-00 00:00:00,tablet,,,,1,2023-02-28 15:56
E007185,U000823,logout,/search,0000-00-00 00:00:00,,,,,1,2023-01-10 21:38
E002384,U000296,login,/search,,,Chrome,Linux,,TRUE,2024-03-26 15:25
E005457,U000392,search,,03/29/2025 03:51,tablet,Chrome,iOS,,0,2025-03-29 3:51
E004979,U000541,search,,,mobile,Chrome,Linux,unknown,1,2024-10-01 9:30
E001539,U001554,integration_connect,,01/10/2023 07:07,,,,unknown,,2023-01-10 7:07
E007889,U000333,ai_search,,0000-00-00 00:00:00,,Edge,,unknown,FALSE,2023-03-19 9:58
E002142,U002356,integration_error,,09/12/2023 21:37,,Safari,Android,,,2023-09-12 21:37
E004445,U000435,page_view,/dashboard,2025-05-16 2:45,DESKTOP,Edge,Windows,22,,2025-05-16 2:45
E000678,U001905,comment,,06/24/2024 00:14,tablet,Brave,Windows,383,1,2024-06-24 0:14
E003358,U000252,logout,/onboarding,,DESKTOP,,,,TRUE,2025-02-27 10:42
E006850,U001238,share,,01/17/2023 10:31,desktop,Safari,macOS,unknown,1,2023-01-17 10:31
E008742,U001019,doc_create,,03/01/2023 15:06,DESKTOP,Chrome,Linux,752,,2023-03-01 15:06
E002756, U001565 ,login,/dashboard,2025-01-07,mobile,,,1552,0,2025-01-07 20:14
E008476,U000503,doc_edit,,2024-12-03,,Edge,Android,,TRUE,2024-12-03 8:55
E008868,U000258,login,/docs,2023-02-08 20:49,DESKTOP,,,1733,FALSE,2023-02-08 20:49
E008603,USR-SR-001232,doc_create,,2025-06-03 1:28,mobile,Brave,macOS,,0,2025-06-03 1:28
E003894,U000719,ai_search,,,DESKTOP,Firefox,Linux,558,,2024-07-16 13:47
E002841,U002189,doc_create,,2024-08-22,,Safari,Linux,,TRUE,2024-08-22 21:41
E004850,U001050,page_view,/pricing,2024-04-26 2:58,desktop,Chrome,Android,,,2024-04-26 2:58
E004631,U002018,integration_error,,2023-05-31,,,macOS,1686,,2023-05-31 1:53
E000622,U000905,comment,,,,,macOS,,0,2024-05-10 1:46
E006650,U002143,page_view,/admin,2023-10-03 4:34,DESKTOP,Firefox,Windows,,FALSE,2023-10-03 4:34
e000768,U000622,integration_error,,2024-10-29,tablet,Firefox,,unknown,TRUE,2024-10-29 18:44
E003084,u000210,integration_connect,,11/16/2024 23:58,desktop,Firefox,iOS,1555,FALSE,2024-11-16 23:58
E001492,U001962,doc_delete,,2023-11-06 4:01,mobile,Safari,,,FALSE,2023-11-06 4:01
E008280,U002536,integration_connect,,02/14/2023 04:25,,,iOS,983,FALSE,2023-02-14 4:25
E008631,U000187,comment,,03/11/2024 23:38,tablet,Firefox,,830,FALSE,2024-03-11 23:38
E001208,U002465,doc_create,,04/01/2023 10:15,,Brave,Android,,TRUE,2023-04-01 10:15
E006725,U001639,doc_delete,,2024-09-20 6:11,,,,,FALSE,2024-09-20 6:11
E000982,U001306,integration_connect,,2023-10-24 6:40,mobile,,iOS,,TRUE,2023-10-24 6:40
E005751,U000409,doc_create,,2024-01-21,desktop,,,unknown,TRUE,2024-01-21 3:14
E006328,U002079,comment,,,mobile,Brave,macOS,,FALSE,2024-07-12 9:15
E006118,U001939,page_view,/integrations,2024-01-07,,Edge,Windows,,TRUE,2024-01-07 8:09
E003598,U000444,integration_error,,,,Brave,macOS,,TRUE,2023-01-24 8:32
E006432,U001061,comment,,2023-11-06 7:07,,,Android,1396,FALSE,2023-11-06 7:07
E003642,U001376,search,,05/29/2023 21:33,,Chrome,,1349,0,2023-05-29 21:33
E004578,U001954,search,,2024-05-31,mobile,Chrome,Android,unknown,FALSE,2024-05-31 13:55
E002882,U002382,doc_create,,2025-02-17 2:45,mobile,Brave,Android,unknown,FALSE,2025-02-17 2:45
e003786,U000274,logout,/dashboard,2025-06-10,desktop,Edge,iOS,unknown,FALSE,2025-06-10 10:34
E000672,U000894,doc_delete,,11/29/2024 02:58,mobile,Safari,Linux,,,2024-11-29 2:58
E004335,U001934,doc_edit,,2023-07-28,DESKTOP,Chrome,macOS,unknown,TRUE,2023-07-28 18:58
E005327,U002173,export,,10/09/2023 14:08,mobile,,,1709,,2023-10-09 14:08
E004163,U000745,page_view,/search,05/19/2025 07:30,mobile,Firefox,,979,1,2025-05-19 7:30
E002966,U002562,integration_connect,,2025-06-16,,,Android,unknown,FALSE,2025-06-16 5:02
E002710,U000722,comment,,0000-00-00 00:00:00,mobile,Safari,,,1,2025-01-20 15:08
E005227,U002060,search,,,,Firefox,Windows,unknown,FALSE,2024-10-27 12:52
E003457,U002551,search,,09/30/2023 00:34,tablet,Chrome,,,FALSE,2023-09-30 0:34
E003075,U000257,login,/docs,,desktop,Firefox,Windows,1014,0,2023-04-30 23:26
E006547,U000868,integration_error,,,tablet,Edge,Linux,,FALSE,2024-04-29 4:37
E005383,U000937,doc_edit,,2025-03-02,,,iOS,,FALSE,2025-03-02 14:05
E003518,U001766,doc_delete,,2023-03-14,tablet,Safari,iOS,335,TRUE,2023-03-14 13:30
E000802,U000537,integration_connect,,05/16/2023 23:41,mobile,Safari,Windows,274,0,2023-05-16 23:41
E002568,U001144,search,,2023-12-10 13:36,desktop,Safari,Android,,FALSE,2023-12-10 13:36
E008219,U000827,share,,06/05/2024 00:32,desktop,Firefox,,109,TRUE,2024-06-05 0:32
E001048,U001334,logout,/pricing,2025-06-10 7:51,,,macOS,,0,2025-06-10 7:51
E002370,U000791,doc_edit,,05/03/2025 07:36,desktop,Brave,Linux,483,0,2025-05-03 7:36
E008419, U001745 ,login,/dashboard,2025-02-28 19:25,desktop,,Android,unknown,FALSE,2025-02-28 19:25
E001800,USR-002026,doc_delete,,2024-05-16,mobile,,,,,2024-05-16 13:14
E006955,U002144,integration_error,,03/24/2024 14:21,desktop,,Windows,,1,2024-03-24 14:21
E007920,U001565,search,,2024-04-22,,Brave,Windows,576,,2024-04-22 15:33
E006120,u000353,integration_connect,,02/13/2025 06:38,tablet,Firefox,,unknown,TRUE,2025-02-13 6:38
E004372,U001737,ai_search,,2024-07-13,tablet,Edge,macOS,574,FALSE,2024-07-13 17:16
E000542,U000316,login,/search,2025-01-10 8:02,,Chrome,Android,,FALSE,2025-01-10 8:02
E000449,U000414,page_view,/pricing,0000-00-00 00:00:00,tablet,Safari,iOS,950,FALSE,2024-01-05 17:22
E007398,U002456,export,,08/31/2023 10:51,tablet,Firefox,Android,1137,,2023-08-31 10:51
E004265,U002024,login,/pricing,10/26/2023 01:01,DESKTOP,Brave,Android,unknown,1,2023-10-26 1:01
E007017,U002035,ai_search,,2023-03-24,desktop,Safari,Linux,,FALSE,2023-03-24 6:03
E008857,u001557,share,,02/20/2025 13:01,tablet,Safari,macOS,166,TRUE,2025-02-20 13:01
E007039,U000129,doc_edit,,,desktop,,,1264,FALSE,2023-09-15 7:13
E005046,U000580,share,,2023-04-13,tablet,Safari,Windows,,0,2023-04-13 8:31
E006989,U000424,logout,/integrations,04/27/2025 22:41,DESKTOP,Firefox,iOS,,0,2025-04-27 22:41
E003537,U002277,comment,,2023-03-24,,Firefox,,1382,FALSE,2023-03-24 4:02
E000806,U000422,integration_error,,05/20/2024 07:27,mobile,Firefox,iOS,1469,0,2024-05-20 7:27
E008312,U000948,login,/integrations,02/04/2023 09:47,tablet,,,533,TRUE,2023-02-04 9:47
E005634,U002491,doc_edit,,0000-00-00 00:00:00,DESKTOP,Brave,Windows,unknown,TRUE,2025-04-07 9:37
E004236,U000769,doc_edit,,2023-07-10,,Chrome,Linux,unknown,TRUE,2023-07-10 22:09
E004548,U002465,ai_search,,2023-02-07 17:05,mobile,Chrome,Windows,223,1,2023-02-07 17:05
E003512,U001586,doc_delete,,2025-01-29,,Chrome,iOS,,TRUE,2025-01-29 15:57
E001284,U002177,doc_delete,,2023-11-02 7:22,tablet,Chrome,Windows,1120,,2023-11-02 7:22
E006402,U000787,AI_SEARCH,,2024-01-19 2:57,tablet,Brave,iOS,unknown,0,2024-01-19 2:57
E005950, U000078 ,DOC_DELETE,,0000-00-00 00:00:00,,Safari,Windows,278,1,2024-11-21 16:57
E005434,U001023,logout,/dashboard,05/03/2024 14:18,tablet,Edge,,395,FALSE,2024-05-03 14:18
E004902,U001936,doc_edit,,0000-00-00 00:00:00,DESKTOP,Brave,Android,unknown,,2025-04-07 22:34
E003028, U000271 ,ai_search,,08/23/2024 21:00,DESKTOP,Brave,Linux,unknown,,2024-08-23 21:00
E003614,U002341,logout,/billing,2025-06-08 2:31,,Brave,iOS,,,2025-06-08 2:31
E008955,U001228,integration_error,,2024-01-09,,,Linux,1396,FALSE,2024-01-09 21:39
e007834,U001837,export,,2023-02-19 7:45,,,,,,2023-02-19 7:45
E003170,U000451,ai_search,,01/08/2024 11:36,,,macOS,unknown,,2024-01-08 11:36
E000460,USR-002118,export,,2024-06-13 13:23,desktop,Brave,macOS,1153,,2024-06-13 13:23
E002687,U000246,ai_search,,09/30/2023 14:51,,,,,FALSE,2023-09-30 14:51
E002426,USR-000283,doc_edit,,02/12/2024 05:06,DESKTOP,Firefox,Linux,unknown,TRUE,2024-02-12 5:06
E006751,U002018,integration_connect,,03/27/2025 17:36,DESKTOP,Edge,macOS,,TRUE,2025-03-27 17:36
E000528,U000977,logout,/settings,,DESKTOP,,macOS,unknown,,2024-07-31 21:44
E002852,U000629,logout,/settings,2025-03-21 8:38,,Safari,,,FALSE,2025-03-21 8:38
E005224,U000730,logout,/onboarding,03/19/2025 12:36,tablet,Brave,iOS,unknown,,2025-03-19 12:36
e006182,U000719,integration_connect,,2023-12-10,mobile,,Linux,,0,2023-12-10 6:50
E006197,U000826,integration_error,,2024-01-23 17:43,,Firefox,iOS,,TRUE,2024-01-23 17:43
E001300,U000890,integration_error,,03/18/2025 18:56,,Edge,,42,FALSE,2025-03-18 18:56
E007799,U001436,export,,02/26/2025 15:59,desktop,Safari,Linux,,1,2025-02-26 15:59
E008564,U000282,doc_delete,,04/16/2024 19:37,DESKTOP,Safari,,1598,1,2024-04-16 19:37
E006911,U000866,integration_connect,,05/29/2023 08:50,mobile,,,1223,TRUE,2023-05-29 8:50
E001779,U000275,doc_create,,12/16/2024 09:54,,Chrome,macOS,unknown,FALSE,2024-12-16 9:54
E002676,U002398,integration_error,,2023-02-28 8:48,,Safari,Android,951,,2023-02-28 8:48
E007328,u002091,comment,,05/05/2025 22:52,,,macOS,unknown,1,2025-05-05 22:52
