invoice_id,subscription_id,issue_date,due_date,paid_date,invoice_amount,currency,payment_status,payment_method,tax_applied,created_at
I01553,S00593,03/19/2025,2025-04-18,,293.28,GBP,FAILED,paypal,TRUE,2025-03-19 0:00
I01629,S02547,11/15/2023,12/15/2023,12/11/2023,397.73,EUR,,,TRUE,2023-11-15 0:00
I00045,S03734,2025-02-13,0000-00-00,0000-00-00,218.97,,partial,wire,0,2025-02-13 0:00
I00559,S03854,07/25/2024,2024-08-24,2024-08-25,256.39,,,,,2024-07-25 0:00
I00780,S02326,0000-00-00,03/02/2023,2023-02-17,,CAD,PAID,paypal,,2023-01-31 0:00
I00494,S03568,0000-00-00,2024-12-02,,84.58,USD,FAILED,,0,2024-11-02 0:00
I00760,S00734,2025-02-27,2025-03-29,2025-04-02 0:00,382.28,EUR,refunded,invoice,FALSE,2025-02-27 0:00
I00203,S00375,0000-00-00,,2025-03-11,226.46,GBP,paid,paypal,,2025-02-07 0:00
I01144,S00623,2023-01-13,02/12/2023,,372.73,CAD,FAILED,invoice,FALSE,2023-01-13 0:00
I01274, S01346,0000-00-00,0000-00-00,2023-08-09 0:00,43.27,EUR,,CARD,FALSE,2023-08-02 0:00
I00030,S02720,2024-03-14,2024-04-13,2024-04-19,295.26,EUR,,,,2024-03-14 0:00
I00176,S03437,06/04/2023,07/04/2023,,103.15,USD,partial,invoice,FALSE,2023-06-04 0:00
I01553,S02930,05/12/2023,2023-06-11,,40.72,usd,refunded,,TRUE,2023-05-12 0:00
I00578,S01390,2024-02-28,03/29/2024,03/30/2024,475.09,usd,FAILED,,1,2024-02-28 0:00
I01619,s02797,,,,301.78,EUR,,CARD,,2024-11-22 0:00
I01189,S02004,07/27/2023,2023-08-26,2023-08-11,126.06,EUR,refunded,,TRUE,2023-07-27 0:00
 I00677,S00146,0000-00-00,07/14/2024,2024-06-23 0:00,183.16,EUR,FAILED,paypal,1,2024-06-14 0:00
I00859,S02460,,2024-10-08,,292.87,USD,,invoice,TRUE,2024-09-08 0:00
I00131,S02310,06/13/2024,,,229.36,USD,partial,card,FALSE,2024-06-13 0:00
I00825,S00141,2023-04-08,05/08/2023,2023-05-10,492.8,usd,FAILED,card,,2023-04-08 0:00
I00033,S03077,0000-00-00,08/02/2024,,17.03,USD,PAID,,,2024-07-03 0:00
I00605,s02002,0000-00-00,2023-12-31 0:00,2024-01-08,344.91,usd,paid,,TRUE,2023-12-01 0:00
 I01075,S00277,2023-08-01 0:00,0000-00-00,0000-00-00,246.78,USD,partial,,FALSE,2023-08-01 0:00
I01088,s00002,2023-05-09 0:00,2023-06-08,0000-00-00,171.68,USD,FAILED,,0,2023-05-09 0:00
I00901,s01876,10/07/2023,0000-00-00,11/10/2023,93.62,GBP,partial,,FALSE,2023-10-07 0:00
I01689, S00728,2025-01-28,02/27/2025,2025-02-09,268.74,EUR,refunded,wire,FALSE,2025-01-28 0:00
I00500,S01892,03/06/2024,04/05/2024,,451.12,usd,refunded,wire,,2024-03-06 0:00
I01344,s01699,2024-02-23,03/24/2024,2024-03-06 0:00,271.24,CAD,PAID,wire,,2024-02-23 0:00
I01644,S02802,2024-05-21 0:00,2024-06-20,05/30/2024,388.05,,,,0,2024-05-21 0:00
I00378,S00458,0000-00-00,2023-07-12 0:00,2023-07-14,205.39,,PAID,,0,2023-06-12 0:00
I00381,S03521,2023-07-25,08/24/2023,09/01/2023,226.75,EUR,refunded,wire,FALSE,2023-07-25 0:00
I01530,s03783,0000-00-00,0000-00-00,2024-09-14,,,FAILED,CARD,FALSE,2024-08-20 0:00
I01169,S02017,0000-00-00,2024-01-05,,111.38,usd,failed,wire,TRUE,2023-12-06 0:00
I00622,S03178,2025-01-07,2025-02-06,,418.5,usd,FAILED,wire,TRUE,2025-01-07 0:00
I00150,s00684,2024-03-24 0:00,04/23/2024,0000-00-00,498.38,,,,FALSE,2024-03-24 0:00
I01419,S01892,2024-06-21 0:00,0000-00-00,,449.85,CAD,refunded,,TRUE,2024-06-21 0:00
I00728,S02339,2024-11-09 0:00,2024-12-09,12/09/2024,318.85,GBP,failed,card,TRUE,2024-11-09 0:00
I00927,S03618,07/11/2024,08/10/2024,,291.02,CAD,paid,,0,2024-07-11 0:00
I00314,S04411,03/18/2024,2024-04-17,,71.01,CAD,paid,wire,0,2024-03-18 0:00
I00530,S02769,2024-03-28,2024-04-27 0:00,,,USD,paid,,FALSE,2024-03-28 0:00
I00584,S03393,05/27/2024,0000-00-00,2024-06-04 0:00,270.54,USD,paid,paypal,,2024-05-27 0:00
I01376,S02158,2025-05-04,06/03/2025,,349.22,usd,paid,invoice,TRUE,2025-05-04 0:00
I01101,S00701,03/01/2024,0000-00-00,0000-00-00,138.77,GBP,PAID,CARD,,2024-03-01 0:00
I00759,S02621,,2024-01-16 0:00,0000-00-00,487.73,CAD,FAILED,invoice,FALSE,2023-12-17 0:00
I00374,S00196,0000-00-00,01/11/2024,12/13/2023,411.27,,partial,invoice,,2023-12-12 0:00
I01279,S02508,05/06/2023,2023-06-05,,455.37,,FAILED,,0,2023-05-06 0:00
I01500,S03656,2024-12-12 0:00,2025-01-11 0:00,2024-12-18,,,paid,card,TRUE,2024-12-12 0:00
I01363,S01263,2024-05-24,2024-06-23 0:00,,443.76,GBP,FAILED,wire,,2024-05-24 0:00
I00476,s01146,2024-01-12,2024-02-11,,201.16,,partial,paypal,FALSE,2024-01-12 0:00
I01486,S02650,2024-08-12,09/11/2024,2024-09-09,192,CAD,partial,paypal,TRUE,2024-08-12 0:00
I00772,S00780,08/03/2024,2024-09-02,,,CAD,,invoice,1,2024-08-03 0:00
I00993, S03449,2024-12-17,2025-01-16,,90.44,CAD,,paypal,TRUE,2024-12-17 0:00
I00758,S01676,2025-01-06,2025-02-05,01/18/2025,381.7,,partial,wire,TRUE,2025-01-06 0:00
I01537,s00695,2025-03-06,2025-04-05 0:00,0000-00-00,480.54,CAD,refunded,wire,,2025-03-06 0:00
I01031,  S00732,0000-00-00,2024-05-14,04/16/2024,184.68,,,paypal,1,2024-04-14 0:00
I01601,S00415,04/05/2023,05/05/2023,2023-05-12,318.95,GBP,,,FALSE,2023-04-05 0:00
I00759,S00791,12/03/2023,2024-01-02 0:00,2023-12-05,463.64,GBP,,wire,TRUE,2023-12-03 0:00
I01406,S01372,,04/11/2025,2025-04-05,16.34,GBP,paid,wire,,2025-03-12 0:00
I00271,S02248,0000-00-00,,2025-06-24,85.04,,FAILED,,,2025-05-19 0:00
I01389,S01708,0000-00-00,,2023-10-16,134.24,usd,,card,FALSE,2023-09-30 0:00
I00952,S03898,0000-00-00,0000-00-00,0000-00-00,319.93,EUR,partial,paypal,TRUE,2023-06-14 0:00
I00164,S00146,2023-03-23 0:00,2023-04-22 0:00,2023-04-11,379.57,USD,PAID,invoice,TRUE,2023-03-23 0:00
I01090,S03649,02/12/2024,2024-03-13,0000-00-00,462.2,GBP,failed,CARD,1,2024-02-12 0:00
I00378,S01779,0000-00-00,2024-04-17,,271.47,USD,failed,wire,TRUE,2024-03-18 0:00
I00647,S03984,2023-04-13,2023-05-13,,201.99,usd,,paypal,,2023-04-13 0:00
I01403,S01240,02/11/2023,0000-00-00,03/21/2023,225.47,GBP,paid,,FALSE,2023-02-11 0:00
i01050,S02322,2024-05-31 0:00,2024-06-30 0:00,06/07/2024,414.5,usd,,card,TRUE,2024-05-31 0:00
I01439,S01139,0000-00-00,2024-07-06,2024-07-05 0:00,76.51,CAD,,paypal,TRUE,2024-06-06 0:00
I00010,S03861,2024-12-20,0000-00-00,,211.32,GBP,PAID,wire,,2024-12-20 0:00
 I01339,S03471,2023-01-01,2023-01-31,2023-01-03,354.36,GBP,FAILED,wire,0,2023-01-01 0:00
I00988,S04481,0000-00-00,2025-04-27 0:00,,257,,paid,,TRUE,2025-03-28 0:00
I01561,S02320,2023-01-07 0:00,02/06/2023,2023-01-08,410.8,CAD,FAILED,,TRUE,2023-01-07 0:00
I00615,S03297,2023-05-16 0:00,2023-06-15,,411.91,usd,,wire,,2023-05-16 0:00
I01394,S03013,2023-11-07 0:00,0000-00-00,2023-11-19 0:00,30.33,GBP,failed,wire,0,2023-11-07 0:00
I00203,s02308,07/16/2024,2024-08-15 0:00,,N/A,CAD,PAID,card,FALSE,2024-07-16 0:00
I00978,s00001,0000-00-00,2023-11-21,11/16/2023,,usd,failed,paypal,,2023-10-22 0:00
i00963,S00202,0000-00-00,2025-03-04,,102.49,EUR,PAID,invoice,,2025-02-02 0:00
I01493,S02657,04/25/2025,2025-05-25,2025-06-02,475.39,EUR,refunded,wire,,2025-04-25 0:00
I01606,S02096,,,2023-02-22,470.45,usd,partial,,TRUE,2023-01-24 0:00
I01468,S02836,0000-00-00,0000-00-00,,418.99,CAD,,CARD,FALSE,2023-09-24 0:00
I00482,S02755,08/24/2024,2024-09-23,2024-09-18,,usd,FAILED,invoice,FALSE,2024-08-24 0:00
I01531, s00326,2023-10-22,0000-00-00,11/21/2023,303.85,CAD,,card,0,2023-10-22 0:00
I00931,S02310,12/10/2024,2025-01-09,0000-00-00,394.22,CAD,partial,invoice,1,2024-12-10 0:00
I00800,S01937,08/29/2023,09/28/2023,2023-09-29,467.99,CAD,,CARD,TRUE,2023-08-29 0:00
I01712,s01798,2023-12-15 0:00,2024-01-14,0000-00-00,,GBP,FAILED,paypal,TRUE,2023-12-15 0:00
i01630,S00455,2024-08-18 0:00,2024-09-17,,130.19,,refunded,card,TRUE,2024-08-18 0:00
I00645,S02377,02/15/2023,2023-03-17 0:00,2023-03-22,296.81,,failed,CARD,TRUE,2023-02-15 0:00
I00918, s02565,2025-03-23,2025-04-22 0:00,,55.13,GBP,PAID,invoice,TRUE,2025-03-23 0:00
I00337,S01023,04/27/2025,2025-05-27 0:00,,,,failed,invoice,,2025-04-27 0:00
I00787,S04114,,0000-00-00,,143.69,,,wire,1,2023-10-05 0:00
I00901,s01211,0000-00-00,2023-05-28 0:00,2023-05-25,446.7,GBP,partial,invoice,TRUE,2023-04-28 0:00
I00227,S01216,2023-10-26 0:00,0000-00-00,,473.7,CAD,failed,invoice,,2023-10-26 0:00
I01405,S01393,2025-02-18 0:00,0000-00-00,,127.46,,,wire,0,2025-02-18 0:00
I01268,S01914,2023-05-21,06/20/2023,2023-06-15 0:00,482.34,,failed,CARD,1,2023-05-21 0:00
I00235, S01964,0000-00-00,2024-03-01,2024-02-14,398.77,,FAILED,paypal,TRUE,2024-01-31 0:00
I01474,S03811,0000-00-00,11/16/2024,,,USD,,CARD,TRUE,2024-10-17 0:00
I00004,S03311,2023-09-14 0:00,2023-10-14 0:00,,101.7,GBP,PAID,paypal,,2023-09-14 0:00
I00619,SUB-01499,0000-00-00,03/10/2023,2023-02-16,40.59,usd,refunded,invoice,TRUE,2023-02-08 0:00
I00153,S03859,2025-05-12,0000-00-00,0000-00-00,249.12,USD,partial,CARD,1,2025-05-12 0:00
I01065,S02510,2024-01-18,02/17/2024,0000-00-00,386.82,EUR,PAID,,0,2024-01-18 0:00
I00215,S01039,2024-08-12,2024-09-11 0:00,09/10/2024,103.7,,,,TRUE,2024-08-12 0:00
I01794,S01560,2023-07-08 0:00,0000-00-00,,404.99,,FAILED,invoice,0,2023-07-08 0:00
I01186, S00714,2025-01-29,2025-02-28,,115.59,EUR,,wire,TRUE,2025-01-29 0:00
I00263,S00405,2023-11-05,,0000-00-00,430.12,usd,,,,2023-11-05 0:00
I01474,S04371,,2023-04-10,04/06/2023,467.35,USD,partial,,,2023-03-11 0:00
I01717,S01435,2024-11-12,2024-12-12,,474.64,USD,refunded,,0,2024-11-12 0:00
I01500,S04226,04/25/2024,0000-00-00,2024-05-06,475.11,,refunded,,FALSE,2024-04-25 0:00
I01561,S02320,2023-01-07 0:00,02/06/2023,2023-01-08,410.8,CAD,FAILED,,TRUE,2023-01-07 0:00
I01184,S03649,,,,23.67,GBP,PAID,,FALSE,2024-08-23 0:00
I01477, S03351,09/18/2023,2023-10-18,0000-00-00,462.05,usd,PAID,,,2023-09-18 0:00
I01655,S02433,0000-00-00,0000-00-00,05/20/2025,227.66,EUR,FAILED,paypal,FALSE,2025-05-03 0:00
I01582,S03588,2025-05-14,2025-06-13 0:00,0000-00-00,191.54,USD,,wire,FALSE,2025-05-14 0:00
I01123,S01667,,,2023-07-10,,GBP,,,FALSE,2023-06-12 0:00
 I00076,S00387,2025-05-06 0:00,06/05/2025,,28.93,GBP,failed,paypal,1,2025-05-06 0:00
 I01339,SUB-01130,2023-10-05,2023-11-04 0:00,10/17/2023,,,partial,,TRUE,2023-10-05 0:00
I00241,S01617,2025-02-08,2025-03-10 0:00,,422.91,usd,paid,,FALSE,2025-02-08 0:00
I01504,S04343,2023-11-07 0:00,0000-00-00,0000-00-00,330.6,,paid,card,0,2023-11-07 0:00
I00933,S00869,2023-12-13,01/12/2024,,462.99,,refunded,paypal,FALSE,2023-12-13 0:00
I00090,s00293,,,2024-02-04,82.22,GBP,FAILED,card,0,2024-01-01 0:00
I00458,S02105,2024-01-14 0:00,02/13/2024,,328.98,,paid,,0,2024-01-14 0:00
I00100,S03738,03/02/2023,0000-00-00,,308.57,,refunded,paypal,TRUE,2023-03-02 0:00
I00521,S02748,2024-01-06,2024-02-05 0:00,2024-01-25,328.93,EUR,paid,CARD,FALSE,2024-01-06 0:00
I00180,S02401,2024-12-25 0:00,2025-01-24 0:00,0000-00-00,287.77,CAD,,CARD,TRUE,2024-12-25 0:00
I00318,s03053,2024-06-01,2024-07-01 0:00,2024-06-10 0:00,55.6,,,,0,2024-06-01 0:00
I01208, S03161,2024-01-13 0:00,2024-02-12 0:00,,431.51,USD,,,0,2024-01-13 0:00
I00211,S03151,0000-00-00,0000-00-00,2025-01-01 0:00,476.63,,,,TRUE,2025-01-01 0:00
I00753,S00929,09/20/2024,2024-10-20,09/29/2024,22.17,usd,refunded,invoice,TRUE,2024-09-20 0:00
I01531,S02401,0000-00-00,,,465.55,,PAID,invoice,TRUE,2024-02-05 0:00
I00145,S00780,,0000-00-00,,449.95,,partial,wire,,2023-05-22 0:00
I00429,S04157,2024-11-21 0:00,2024-12-21 0:00,0000-00-00,,EUR,failed,invoice,1,2024-11-21 0:00
I01320,S04060,2023-07-02,2023-08-01,,251.74,EUR,,invoice,0,2023-07-02 0:00
I00468,S03666,2023-03-03,0000-00-00,,78.52,USD,failed,,TRUE,2023-03-03 0:00
I00490,S01279,07/06/2024,,08/03/2024,66.42,,,card,,2024-07-06 0:00
I00789,S01273,2024-06-03 0:00,2024-07-03,,248.14,usd,PAID,card,TRUE,2024-06-03 0:00
I01453,S04328,0000-00-00,0000-00-00,,424.33,,,paypal,0,2023-10-29 0:00
I01182,S03400,2024-12-01,2024-12-31 0:00,2024-12-30,490.61,GBP,,CARD,TRUE,2024-12-01 0:00
I01646, S01061,2023-01-27 0:00,2023-02-26,,172.02,,refunded,,TRUE,2023-01-27 0:00
I01542,S02359,0000-00-00,0000-00-00,,82.65,usd,paid,,TRUE,2023-03-15 0:00
I01172,S02352,2025-01-24 0:00,02/23/2025,,367.53,,PAID,,1,2025-01-24 0:00
I01107,S02099,0000-00-00,2023-05-04 0:00,0000-00-00,467.07,EUR,FAILED,paypal,FALSE,2023-04-04 0:00
I00695,S03859,2023-12-19,0000-00-00,,371.89,usd,,invoice,TRUE,2023-12-19 0:00
I00117,S03551,06/23/2023,0000-00-00,2023-07-05,308.9,usd,failed,,,2023-06-23 0:00
I00621,S03866,0000-00-00,2023-11-21 0:00,11/02/2023,256.3,EUR,partial,card,,2023-10-22 0:00
I00749,S00514,06/27/2024,,2024-07-31 0:00,293.87,,refunded,wire,FALSE,2024-06-27 0:00
I01610,S03662,2024-01-20,2024-02-19,2024-02-20 0:00,312.44,USD,failed,CARD,,2024-01-20 0:00
I00708,S02257,2024-05-16,06/15/2024,0000-00-00,63.27,GBP,FAILED,,,2024-05-16 0:00
I00346,S02438,0000-00-00,0000-00-00,0000-00-00,320.2,EUR,paid,CARD,FALSE,2023-12-04 0:00
i00705,S04200,01/02/2024,0000-00-00,2024-02-02,35.49,GBP,,card,0,2024-01-02 0:00
I00117,S00711,0000-00-00,0000-00-00,,121.84,GBP,FAILED,CARD,TRUE,2023-06-09 0:00
I00121,S02823,2024-08-27 0:00,0000-00-00,09/19/2024,338.23,,paid,invoice,FALSE,2024-08-27 0:00
I01025,S01887,0000-00-00,03/20/2024,0000-00-00,298.66,EUR,failed,paypal,1,2024-02-19 0:00
I01611,S02751,2024-10-22,11/21/2024,2024-11-02,451.74,EUR,,,1,2024-10-22 0:00
I01479,SUB-04328,0000-00-00,0000-00-00,0000-00-00,278.11,,,,TRUE,2023-10-24 0:00
I01590,S01607,0000-00-00,2025-04-29,2025-04-20 0:00,328.68,GBP,PAID,paypal,FALSE,2025-03-30 0:00
I01759,S00561,02/21/2024,,2024-03-16,39.4,CAD,refunded,,,2024-02-21 0:00
I01366,s00093,04/23/2024,2024-05-23 0:00,2024-05-21,192.43,EUR,paid,wire,FALSE,2024-04-23 0:00
I00762,S04374,2023-10-26,,2023-10-29 0:00,59.57,USD,paid,invoice,,2023-10-26 0:00
I00362,S03350,2023-07-21,08/20/2023,,119.71,usd,,paypal,FALSE,2023-07-21 0:00
I01238,S02893,0000-00-00,2023-09-17,2023-09-19,416.26,GBP,partial,paypal,TRUE,2023-08-18 0:00
I01026,S00272,2025-03-21,0000-00-00,2025-03-28,135.11,,refunded,invoice,0,2025-03-21 0:00
I00907,S02215,2023-01-30,2023-03-01,,385.31,GBP,refunded,card,1,2023-01-30 0:00
I01124,SUB-00711,0000-00-00,06/08/2023,05/24/2023,106.16,,,card,FALSE,2023-05-09 0:00
i00807,S04248,2024-07-08,08/07/2024,0000-00-00,322.93,usd,FAILED,card,1,2024-07-08 0:00
I01056,S01257,,0000-00-00,,461.6,usd,,,0,2025-01-29 0:00
I00775,S02473,2023-05-20,06/19/2023,,375.06,USD,refunded,,FALSE,2023-05-20 0:00
I01551,S00429,07/24/2023,2023-08-23,2023-08-07 0:00,135.37,CAD,FAILED,paypal,1,2023-07-24 0:00
I00129,S00968,0000-00-00,2023-09-30 0:00,,459.94,CAD,failed,paypal,1,2023-08-31 0:00
I01373,S01342,0000-00-00,,2025-06-03,,USD,PAID,CARD,FALSE,2025-05-25 0:00
I00308,S00843,2023-08-11,0000-00-00,2023-08-18,430.39,CAD,paid,CARD,TRUE,2023-08-11 0:00
I00383,S00662,,2024-11-17,0000-00-00,,CAD,failed,card,TRUE,2024-10-18 0:00
I00996,S03838,2024-11-16,0000-00-00,11/17/2024,65.47,EUR,PAID,,TRUE,2024-11-16 0:00
I00724,S03332,2023-12-16,2024-01-15,,200.52,USD,partial,invoice,0,2023-12-16 0:00
I01188,S02951,0000-00-00,2023-04-17 0:00,,93.95,,FAILED,CARD,FALSE,2023-03-18 0:00
I00923,S02261,05/19/2025,2025-06-18,05/26/2025,233.5,EUR,refunded,paypal,FALSE,2025-05-19 0:00
I01669,S01234,2025-01-31,2025-03-02,,206.23,EUR,PAID,invoice,FALSE,2025-01-31 0:00
I00381,S02511,09/01/2024,2024-10-01,0000-00-00,N/A,usd,,invoice,,2024-09-01 0:00
I01418,S02008,,0000-00-00,,,EUR,FAILED,invoice,FALSE,2025-06-18 0:00
I01010,s00365,2023-03-08 0:00,04/07/2023,0000-00-00,432.32,EUR,partial,,TRUE,2023-03-08 0:00
I00124,S01837,0000-00-00,2025-04-18 0:00,0000-00-00,480.09,GBP,refunded,wire,1,2025-03-19 0:00
I00140,S01189,2024-06-15,07/15/2024,2024-06-23,312.81,EUR,PAID,card,TRUE,2024-06-15 0:00
I00090,S04114,2023-02-21,2023-03-23,,303.94,USD,paid,,FALSE,2023-02-21 0:00
I00239,S03327,2023-04-30,0000-00-00,0000-00-00,421.54,USD,,invoice,1,2023-04-30 0:00
I00833,S02928,2024-12-25 0:00,0000-00-00,2025-01-09,414.18,GBP,,,FALSE,2024-12-25 0:00
I00075,S01282,10/13/2023,0000-00-00,0000-00-00,459.55,EUR,FAILED,,FALSE,2023-10-13 0:00
I00920,S03730,0000-00-00,04/08/2024,2024-03-27,399.97,EUR,paid,invoice,FALSE,2024-03-09 0:00
I00878,S01701,2023-03-01,03/31/2023,03/01/2023,422.8,,failed,paypal,TRUE,2023-03-01 0:00
I01167,S03209,2024-07-14,0000-00-00,,416.94,,failed,card,TRUE,2024-07-14 0:00
I00082,S03449,,,10/19/2023,267.88,EUR,FAILED,card,FALSE,2023-09-14 0:00
I00251,S02049,0000-00-00,0000-00-00,,119.04,GBP,refunded,invoice,FALSE,2024-04-06 0:00
I00684,S00071,,0000-00-00,2024-11-26 0:00,N/A,GBP,,card,0,2024-11-20 0:00
I00471,S02343,0000-00-00,0000-00-00,2023-05-10,499.61,GBP,PAID,card,TRUE,2023-04-01 0:00
I00857,S01247,2023-12-02,2024-01-01,,118.51,USD,,,FALSE,2023-12-02 0:00
I01047,S01320,0000-00-00,2023-10-27 0:00,0000-00-00,471.25,USD,refunded,wire,TRUE,2023-09-27 0:00
I00058,SUB-02175,0000-00-00,2023-02-13,01/24/2023,66.5,,PAID,invoice,0,2023-01-14 0:00
I01697,S01613,2023-12-18,0000-00-00,2024-01-11,459.3,CAD,PAID,wire,0,2023-12-18 0:00
I01352,S02609,,2023-06-26,2023-07-04,351.54,,FAILED,card,TRUE,2023-05-27 0:00
I00812,S02153,2023-03-12,2023-04-11,,100.32,USD,partial,wire,FALSE,2023-03-12 0:00
I01668,S03666,2023-01-11,02/10/2023,0000-00-00,N/A,,PAID,,0,2023-01-11 0:00
I00987,S02478,2024-09-07 0:00,10/07/2024,2024-10-16,82.95,,,wire,TRUE,2024-09-07 0:00
I00599,S01526,,0000-00-00,,190.46,EUR,refunded,wire,FALSE,2024-09-04 0:00
I00705,S02277,04/25/2023,,,315.51,CAD,paid,,1,2023-04-25 0:00
I01216,S02870,0000-00-00,10/23/2023,,185.86,,PAID,wire,FALSE,2023-09-23 0:00
I01506,S01345,05/22/2023,,2023-06-27 0:00,198.57,USD,,card,TRUE,2023-05-22 0:00
I00052,S01526,0000-00-00,2023-10-27,11/04/2023,255.59,GBP,PAID,CARD,TRUE,2023-09-27 0:00
I01390,S02329,05/15/2024,06/14/2024,2024-05-31,167.78,usd,failed,,FALSE,2024-05-15 0:00
I00570,S01189,0000-00-00,0000-00-00,2024-03-13 0:00,253,USD,paid,,,2024-02-02 0:00
I01605,s03734,2023-07-20,0000-00-00,2023-07-28 0:00,341.92,CAD,failed,invoice,,2023-07-20 0:00
I00111,S02112,2025-02-17 0:00,0000-00-00,2025-03-15,106.35,CAD,FAILED,wire,0,2025-02-17 0:00
I01526,S02243,0000-00-00,2025-07-17,,181.42,,,invoice,TRUE,2025-06-17 0:00
I01178,S03164,2024-10-25,11/24/2024,2024-11-30,25.84,EUR,partial,invoice,FALSE,2024-10-25 0:00
I00958,S04430,0000-00-00,0000-00-00,,319.61,,failed,,TRUE,2023-07-26 0:00
I01202,S02027,2024-01-09 0:00,,2024-01-14 0:00,376.55,CAD,PAID,card,,2024-01-09 0:00
I00194,SUB-01189,0000-00-00,,0000-00-00,453.04,,partial,card,TRUE,2025-05-26 0:00
I01483,S03792,,12/24/2024,,104.2,usd,FAILED,invoice,,2024-11-24 0:00
I00097, S01403,02/12/2024,0000-00-00,03/22/2024,406.99,CAD,PAID,card,,2024-02-12 0:00
I00430,S00600,2024-09-08,2024-10-08,,316.02,,,card,1,2024-09-08 0:00
I00151,S04147,06/17/2025,2025-07-17,,444.89,,partial,paypal,1,2025-06-17 0:00
I00659,S03846,,0000-00-00,0000-00-00,96.25,USD,,wire,FALSE,2023-01-16 0:00
I01751,S01260,2025-04-18,2025-05-18 0:00,2025-05-10,455.77,,refunded,card,,2025-04-18 0:00
I00714,S04102,0000-00-00,06/26/2023,2023-06-30 0:00,338.43,USD,PAID,paypal,TRUE,2023-05-27 0:00
I01447,S01295,0000-00-00,2023-05-28,2023-05-14,273.4,,failed,invoice,1,2023-04-28 0:00
I01377,S04233,0000-00-00,2025-04-09,0000-00-00,447.26,EUR,,invoice,,2025-03-10 0:00
I00708, S03453,06/02/2025,07/02/2025,2025-06-30,284.6,usd,paid,paypal,,2025-06-02 0:00
I01261,S00852,2023-01-02 0:00,0000-00-00,2023-02-03,407.7,,,wire,1,2023-01-02 0:00
I01235,S02395,2024-12-22,2025-01-21 0:00,0000-00-00,429.56,,paid,,FALSE,2024-12-22 0:00
I00967, S00220,2024-03-08 0:00,,2024-03-21,207.29,USD,,,FALSE,2024-03-08 0:00
 I00241,S02904,0000-00-00,2024-09-11,0000-00-00,497.35,CAD,,wire,1,2024-08-12 0:00
I01245,S03402,12/29/2023,2024-01-28,0000-00-00,285.22,,PAID,paypal,TRUE,2023-12-29 0:00
I00561,S02447,01/08/2025,2025-02-07 0:00,2025-02-02 0:00,227.19,usd,,CARD,,2025-01-08 0:00
I01390,S02060,0000-00-00,2024-04-23 0:00,2024-03-29,232.65,EUR,failed,paypal,0,2024-03-24 0:00
I00139,S00105,0000-00-00,2025-02-28,,141.72,USD,,invoice,TRUE,2025-01-29 0:00
I00249,S04028,0000-00-00,,0000-00-00,166.16,USD,FAILED,invoice,TRUE,2023-07-22 0:00
I01671,S00472,04/16/2024,0000-00-00,0000-00-00,406.79,USD,PAID,,1,2024-04-16 0:00
I00654,S03121,0000-00-00,2023-04-05,2023-03-17,400.16,CAD,,invoice,FALSE,2023-03-06 0:00
I00311,S00096,2023-07-20,08/19/2023,2023-07-24,100.15,USD,FAILED,paypal,FALSE,2023-07-20 0:00
I00122,S00915,03/02/2023,2023-04-01 0:00,2023-03-31,256.99,,FAILED,CARD,FALSE,2023-03-02 0:00
I01708,S02181,2023-12-25 0:00,0000-00-00,,109.39,CAD,refunded,paypal,FALSE,2023-12-25 0:00
I00554,S00605,2023-05-11,0000-00-00,0000-00-00,17.4,,refunded,,TRUE,2023-05-11 0:00
I00051,S01025,0000-00-00,0000-00-00,2025-04-05 0:00,384.71,USD,PAID,,FALSE,2025-03-07 0:00
I01257,S00849,2025-05-06,,,91.09,GBP,partial,paypal,0,2025-05-06 0:00
I01424,S02392,2024-08-09,,2024-08-09,245.82,CAD,,invoice,0,2024-08-09 0:00
I00705,S02277,04/25/2023,,,315.51,CAD,paid,,1,2023-04-25 0:00
I01359,S02798,2023-04-29,2023-05-29,,66.45,USD,refunded,invoice,1,2023-04-29 0:00
I00348,S04196,2023-01-24 0:00,,,339.8,,,CARD,TRUE,2023-01-24 0:00
I00159,S03257,2024-10-16 0:00,11/15/2024,0000-00-00,70.79,,partial,CARD,TRUE,2024-10-16 0:00
I00956,S01795,0000-00-00,2024-01-18,,123.28,GBP,failed,paypal,FALSE,2023-12-19 0:00
I01632,S02624,01/26/2025,2025-02-25,03/06/2025,40.4,EUR,partial,CARD,,2025-01-26 0:00
I01492,S01431,2025-05-30,06/29/2025,2025-07-05,N/A,EUR,refunded,card,TRUE,2025-05-30 0:00
i00573,S03347,09/27/2023,0000-00-00,2023-10-08 0:00,392.04,USD,PAID,,TRUE,2023-09-27 0:00
I01423,S02461,0000-00-00,2024-08-16,,79.62,CAD,,invoice,TRUE,2024-07-17 0:00
I01172,S00680,2025-01-26,2025-02-25,,83.99,CAD,partial,paypal,,2025-01-26 0:00
I00225,S02310,2024-10-02,2024-11-01,10/27/2024,107.35,CAD,FAILED,CARD,0,2024-10-02 0:00
 I00971,S03643,2024-03-22,0000-00-00,2024-04-08,336.2,usd,partial,CARD,,2024-03-22 0:00
I01491,S03135,0000-00-00,04/24/2024,,70.78,,refunded,,,2024-03-25 0:00
I01269,S03229,2025-02-21,2025-03-23 0:00,2025-03-29 0:00,377.45,CAD,refunded,paypal,0,2025-02-21 0:00
I00867,S02024,0000-00-00,0000-00-00,,159.43,,PAID,,FALSE,2023-02-04 0:00
I01699,S03784,05/13/2025,2025-06-12 0:00,0000-00-00,355.46,USD,PAID,card,,2025-05-13 0:00
I01654, S03476,,0000-00-00,,56.14,,,,,2024-01-27 0:00
I00349,S00625,2024-05-02,2024-06-01 0:00,,223.45,usd,,,FALSE,2024-05-02 0:00
I01509,S00984,2023-09-16 0:00,2023-10-16 0:00,2023-10-20,,EUR,paid,,TRUE,2023-09-16 0:00
I01222,S02564,,0000-00-00,0000-00-00,452.51,EUR,failed,,TRUE,2023-10-16 0:00
I00917,S03196,01/19/2025,2025-02-18,2025-02-26,19.18,CAD,PAID,,FALSE,2025-01-19 0:00
I00802,S01049,,2024-10-05,2024-10-06,,USD,partial,invoice,,2024-09-05 0:00
I01549,s00126,0000-00-00,2025-05-21,05/15/2025,127.27,USD,PAID,invoice,TRUE,2025-04-21 0:00
I00560,s01348,2023-12-24,0000-00-00,2023-12-28 0:00,439.59,GBP,paid,invoice,FALSE,2023-12-24 0:00
I00336,S01669,12/27/2024,2025-01-26,0000-00-00,46.37,EUR,FAILED,invoice,TRUE,2024-12-27 0:00
I00877,S02142,01/12/2023,,0000-00-00,498.67,USD,failed,paypal,FALSE,2023-01-12 0:00
I01027,SUB-00438,2023-06-27,0000-00-00,2023-07-03 0:00,331.68,,failed,paypal,FALSE,2023-06-27 0:00
I00843,S02173,0000-00-00,2023-04-20,2023-04-09 0:00,48.56,CAD,partial,invoice,FALSE,2023-03-21 0:00
I00524,S03433,2024-01-11,,2024-02-20 0:00,90.42,CAD,,,TRUE,2024-01-11 0:00
I01046,S01208,10/17/2024,2024-11-16,,466.09,USD,,wire,FALSE,2024-10-17 0:00
I01585,S00192,,05/18/2023,2023-05-23,355.3,,,,TRUE,2023-04-18 0:00
I00683,S04260,2023-10-22,2023-11-21,,18.68,EUR,,wire,,2023-10-22 0:00
I00915,S01530,0000-00-00,10/27/2023,,277.12,CAD,failed,,TRUE,2023-09-27 0:00
I01070,S03256,2025-05-26 0:00,2025-06-25 0:00,06/11/2025,N/A,usd,,paypal,FALSE,2025-05-26 0:00
I00609,SUB-01564,0000-00-00,0000-00-00,2024-02-19,23.71,usd,PAID,CARD,TRUE,2024-02-15 0:00
I00555,S02679,2023-03-28,2023-04-27,,308.68,CAD,failed,invoice,1,2023-03-28 0:00
I00404,S04356,2024-06-25,2024-07-25,,270.55,,partial,card,TRUE,2024-06-25 0:00
I00420,S03054,01/13/2023,0000-00-00,,270.83,usd,,invoice,FALSE,2023-01-13 0:00
I00844,S02353,0000-00-00,,2024-05-24 0:00,482.09,USD,partial,card,,2024-04-26 0:00
I00320,S01548,0000-00-00,2024-03-03,2024-02-05 0:00,N/A,CAD,PAID,CARD,,2024-02-02 0:00
I00016,s03746,0000-00-00,2025-07-04,0000-00-00,437.22,,,CARD,FALSE,2025-06-04 0:00
I01461,S03150,07/10/2024,,2024-07-18 0:00,197.04,,,CARD,TRUE,2024-07-10 0:00
I00211,S02248,0000-00-00,,2023-08-29,439.71,CAD,PAID,invoice,TRUE,2023-07-27 0:00
I00732,S01273,2023-09-27,10/27/2023,,203.33,GBP,FAILED,card,TRUE,2023-09-27 0:00
I00691,S03019,0000-00-00,04/01/2025,04/04/2025,480.24,GBP,PAID,invoice,FALSE,2025-03-02 0:00
I00477,S01763,,2023-07-17,,214.82,USD,paid,paypal,TRUE,2023-06-17 0:00
I00148,S01756,0000-00-00,2025-01-17 0:00,2024-12-31,33.35,CAD,paid,CARD,FALSE,2024-12-18 0:00
I00580,S03746,0000-00-00,2024-01-23,2024-01-21 0:00,360.99,GBP,refunded,wire,TRUE,2023-12-24 0:00
I00497,S01705,2023-06-16,07/16/2023,,,,partial,paypal,TRUE,2023-06-16 0:00
I00559,S04447,2023-01-09,02/08/2023,0000-00-00,55.4,,,,,2023-01-09 0:00
I01238,S02702,2023-09-03 0:00,0000-00-00,09/18/2023,48.03,,failed,card,TRUE,2023-09-03 0:00
I01435,S03115,01/13/2023,2023-02-12 0:00,0000-00-00,472.1,,,wire,,2023-01-13 0:00
I01439,S01548,04/09/2025,2025-05-09 0:00,,341.47,,paid,,TRUE,2025-04-09 0:00
I01747,S03322,0000-00-00,10/05/2024,,243.57,,FAILED,paypal,FALSE,2024-09-05 0:00
i00163,S02009,,0000-00-00,,167.97,,,,,2024-05-29 0:00
I01405,S03006,2024-10-03 0:00,0000-00-00,10/28/2024,207.08,,failed,,,2024-10-03 0:00
I00111,S01176,,,2025-05-18 0:00,472.69,CAD,PAID,,1,2025-04-22 0:00
I00074,S03116,0000-00-00,03/01/2024,02/06/2024,13.87,USD,,card,FALSE,2024-01-31 0:00
i01058,S03737,2024-06-19,2024-07-19 0:00,,436.52,USD,partial,invoice,0,2024-06-19 0:00
I01507,S02376,2023-12-21,,,387.24,,PAID,wire,,2023-12-21 0:00
I00319,S00525,2025-02-15 0:00,03/17/2025,0000-00-00,366.95,EUR,paid,wire,0,2025-02-15 0:00
I00136,S03125,0000-00-00,2023-08-25,,342.96,CAD,,invoice,,2023-07-26 0:00
I01463,s01943,,2024-09-23 0:00,0000-00-00,55.18,usd,,CARD,0,2024-08-24 0:00
I01789,S01066,12/05/2024,,2025-01-09,,usd,failed,card,1,2024-12-05 0:00
I01658,S01387,2024-02-09,03/10/2024,0000-00-00,401.81,usd,refunded,wire,0,2024-02-09 0:00
I01521,S00194,,08/02/2024,2024-07-05,441.93,CAD,FAILED,paypal,1,2024-07-03 0:00
I01014,s01899,,2024-12-28,2024-12-28,N/A,,PAID,CARD,,2024-11-28 0:00
I01157,S04134,2023-02-07,03/09/2023,2023-03-09 0:00,457.93,GBP,PAID,,TRUE,2023-02-07 0:00
I01165,S01309,0000-00-00,2024-04-28,0000-00-00,99.96,usd,partial,card,0,2024-03-29 0:00
I01724,S02331,2023-07-05,2023-08-04,,312.02,,paid,,FALSE,2023-07-05 0:00
I01418, S02552,0000-00-00,0000-00-00,2025-03-31,318.6,GBP,refunded,wire,FALSE,2025-03-08 0:00
I00078,S03829,0000-00-00,03/22/2024,,172.98,USD,,wire,TRUE,2024-02-21 0:00
I01095,S00647,2024-05-22 0:00,2024-06-21 0:00,06/20/2024,N/A,,failed,invoice,,2024-05-22 0:00
I01774,S02075,2023-07-12,0000-00-00,08/04/2023,123.39,,paid,CARD,1,2023-07-12 0:00
I00042,S02265,2023-10-20,11/19/2023,2023-10-26 0:00,361.05,CAD,failed,wire,TRUE,2023-10-20 0:00
I01164,s03369,2023-11-16,2023-12-16 0:00,11/19/2023,171.94,,failed,wire,FALSE,2023-11-16 0:00
I01069,S03871,2024-03-14,2024-04-13,2024-03-16 0:00,283.19,USD,failed,card,FALSE,2024-03-14 0:00
I00954, s02680,2023-05-26,2023-06-25 0:00,,138.69,GBP,failed,CARD,,2023-05-26 0:00
I01471,S02515,0000-00-00,0000-00-00,2024-04-18,,GBP,FAILED,wire,TRUE,2024-04-04 0:00
I00170,S03977,,07/14/2023,0000-00-00,43.83,,paid,,1,2023-06-14 0:00
I00478,S00814,0000-00-00,06/04/2024,,146.72,,refunded,,TRUE,2024-05-05 0:00
I01479,S01937,2024-10-23,11/22/2024,,127.16,,paid,card,,2024-10-23 0:00
I01214,S00206,2024-06-27 0:00,07/27/2024,0000-00-00,72.3,,,card,,2024-06-27 0:00
I00921,S03955,0000-00-00,2024-11-19,11/20/2024,235.78,USD,FAILED,wire,,2024-10-20 0:00
I00444,S00656,0000-00-00,2023-07-12,06/12/2023,371.78,,PAID,card,TRUE,2023-06-12 0:00
I00999,S01583,2024-03-21,0000-00-00,0000-00-00,497.66,CAD,paid,wire,,2024-03-21 0:00
I00900,S03871,0000-00-00,2023-02-18,02/16/2023,332.03,USD,,CARD,FALSE,2023-01-19 0:00
I00276,S02888,0000-00-00,,2023-07-03,255,,,wire,FALSE,2023-05-25 0:00
I00235, S01328,0000-00-00,04/06/2023,,67.36,usd,failed,,TRUE,2023-03-07 0:00
I00583,S04166,0000-00-00,,,364.28,GBP,FAILED,,FALSE,2023-12-13 0:00
I00910,S03618,02/29/2024,03/30/2024,0000-00-00,167.37,USD,PAID,wire,,2024-02-29 0:00
I00904,S03258,2024-05-03,2024-06-02,,,GBP,,invoice,1,2024-05-03 0:00
I00595,S00667,10/13/2023,2023-11-12 0:00,11/04/2023,138.33,,failed,wire,TRUE,2023-10-13 0:00
I00970,S01002,0000-00-00,2024-07-14 0:00,2024-07-10,34.68,usd,failed,,TRUE,2024-06-14 0:00
I01019,s01775,0000-00-00,2023-02-03,,32.51,usd,,card,FALSE,2023-01-04 0:00
I01682,S04325,2024-06-10,0000-00-00,0000-00-00,389.65,USD,FAILED,,TRUE,2024-06-10 0:00
I01053,S00252,2024-07-22,2024-08-21,0000-00-00,429.73,,,paypal,,2024-07-22 0:00
I01624,S00490,0000-00-00,0000-00-00,02/07/2023,267.26,,refunded,CARD,1,2023-01-21 0:00
I00129,S01981,0000-00-00,01/06/2025,12/29/2024,59.93,EUR,paid,wire,,2024-12-07 0:00
I00109,S01903,0000-00-00,09/24/2023,2023-09-29,408.04,,refunded,wire,TRUE,2023-08-25 0:00
I01328,S00757,,2023-12-09 0:00,2023-12-13,377.45,CAD,partial,paypal,1,2023-11-09 0:00
I00548,S01431,03/06/2023,0000-00-00,2023-04-14,131.97,USD,paid,wire,,2023-03-06 0:00
I01567,S00237,0000-00-00,,2023-04-25 0:00,286.58,USD,refunded,card,FALSE,2023-04-07 0:00
I01144,S03237,10/10/2024,2024-11-09,0000-00-00,410.4,,partial,paypal,1,2024-10-10 0:00
I00980,S01526,2024-05-24 0:00,2024-06-23,06/20/2024,379.26,GBP,,,FALSE,2024-05-24 0:00
I01699,S00143,0000-00-00,2024-01-27 0:00,,21,CAD,PAID,CARD,FALSE,2023-12-28 0:00
I01620,SUB-02114,0000-00-00,2024-12-02,2024-12-07,206.73,USD,,,,2024-11-02 0:00
I01325,S03753,2023-07-10,0000-00-00,0000-00-00,16.45,CAD,partial,invoice,1,2023-07-10 0:00
I01775,S01390,04/21/2025,0000-00-00,,113.49,CAD,partial,,,2025-04-21 0:00
I01349,S01468,0000-00-00,0000-00-00,2023-03-29,162.05,EUR,,wire,FALSE,2023-02-19 0:00
I00589,s00326,2025-02-05,0000-00-00,2025-02-16,421.29,CAD,,,1,2025-02-05 0:00
I01259,S01309,,09/08/2024,,N/A,CAD,failed,card,1,2024-08-09 0:00
I00564,S02752,2025-01-05 0:00,0000-00-00,,298.59,,failed,paypal,TRUE,2025-01-05 0:00
I00292,s02271,01/13/2025,02/12/2025,,460.7,GBP,refunded,paypal,,2025-01-13 0:00
I00733,s01177,2023-10-29 0:00,2023-11-28,10/31/2023,91.33,USD,failed,paypal,FALSE,2023-10-29 0:00
I00937,S00777,,2025-06-26 0:00,2025-07-04,300.94,,PAID,CARD,,2025-05-27 0:00
I01230,S00877,2024-10-08 0:00,2024-11-07,,309.83,,FAILED,card,1,2024-10-08 0:00
i00757,S01903,2025-03-02,0000-00-00,,N/A,usd,FAILED,,0,2025-03-02 0:00
I01288,S00540,01/05/2023,0000-00-00,0000-00-00,439.73,USD,FAILED,paypal,FALSE,2023-01-05 0:00
I01317,S02977,10/08/2023,,,171.54,USD,failed,paypal,FALSE,2023-10-08 0:00
I00916,S01657,,2024-09-10,0000-00-00,246.75,USD,,,TRUE,2024-08-11 0:00
I00326,s01085,2023-05-13,0000-00-00,2023-05-14,319.54,CAD,,paypal,FALSE,2023-05-13 0:00
I00885,S01003,,2024-10-24 0:00,2024-09-27 0:00,420.72,CAD,PAID,CARD,0,2024-09-24 0:00
I01316,S00460,2023-06-16,2023-07-16,2023-06-18,91.34,GBP,failed,card,FALSE,2023-06-16 0:00
I00537,S03818,0000-00-00,2025-01-25 0:00,,474.48,,FAILED,paypal,,2024-12-26 0:00
I01051,S02534,2023-06-01,07/01/2023,2023-06-13 0:00,200.53,,,CARD,,2023-06-01 0:00
I01724,S04441,07/24/2024,08/23/2024,,427.53,USD,partial,,TRUE,2024-07-24 0:00
I01179,s03746,2023-04-15 0:00,05/15/2023,2023-05-04 0:00,325.45,GBP,PAID,card,FALSE,2023-04-15 0:00
I01771, S04480,2023-03-04,2023-04-03 0:00,2023-03-12,240.56,CAD,refunded,wire,TRUE,2023-03-04 0:00
I00310,S03768,01/25/2023,,0000-00-00,,,partial,card,,2023-01-25 0:00
I00392,S04382,2024-04-26,0000-00-00,,50.92,USD,partial,wire,FALSE,2024-04-26 0:00
I01516,S02723,2024-09-12,2024-10-12,,153.67,GBP,failed,card,FALSE,2024-09-12 0:00
I00639,S04111,2024-01-21,0000-00-00,,67.66,CAD,,paypal,TRUE,2024-01-21 0:00
I00295,S00735,2023-01-22 0:00,2023-02-21,03/03/2023,32.5,CAD,PAID,,0,2023-01-22 0:00
I00087,S00109,2023-07-07,2023-08-06,0000-00-00,210.65,USD,failed,paypal,FALSE,2023-07-07 0:00
I01631,S03420,,2023-09-21,09/12/2023,86.64,USD,PAID,invoice,FALSE,2023-08-22 0:00
I01792,S01772,0000-00-00,2024-02-06 0:00,01/20/2024,396.78,CAD,partial,wire,0,2024-01-07 0:00
I01016, S01526,2025-03-03,0000-00-00,,291.87,GBP,partial,,TRUE,2025-03-03 0:00
I00414,S03537,0000-00-00,0000-00-00,2025-01-29 0:00,258.05,,,wire,,2025-01-02 0:00
I00435,S03245,2024-10-10,11/09/2024,,198.58,EUR,PAID,card,0,2024-10-10 0:00
I00095,S01543,,0000-00-00,0000-00-00,114.25,CAD,refunded,card,,2024-02-29 0:00
I01559,s03749,2023-01-04,02/03/2023,2023-02-05 0:00,81.75,EUR,refunded,wire,FALSE,2023-01-04 0:00
I00771,S01393,0000-00-00,2024-08-13,,148.52,usd,,,FALSE,2024-07-14 0:00
I00787,S00593,2023-08-28,09/27/2023,09/01/2023,306.88,USD,,card,1,2023-08-28 0:00
I00828,S01683,0000-00-00,11/13/2024,2024-10-14 0:00,402.27,CAD,,,FALSE,2024-10-14 0:00
I01434,S04273,03/12/2024,0000-00-00,2024-04-17,158.75,usd,refunded,,TRUE,2024-03-12 0:00
I00332,S02019,2024-03-31,0000-00-00,2024-04-16,491.5,,failed,paypal,TRUE,2024-03-31 0:00
I01204,S01610,02/15/2025,2025-03-17 0:00,0000-00-00,14.66,USD,paid,wire,FALSE,2025-02-15 0:00
I00877,S00766,2024-07-06 0:00,2024-08-05,,467.95,CAD,,,TRUE,2024-07-06 0:00
I01713,S00288,,,,424.04,,FAILED,wire,TRUE,2024-06-18 0:00
I00971,s00002,2023-12-21,0000-00-00,2024-01-04 0:00,158.33,USD,,invoice,TRUE,2023-12-21 0:00
I01625,S01520,0000-00-00,0000-00-00,2023-05-25 0:00,230.51,CAD,paid,,FALSE,2023-05-19 0:00
I01633, S01530,02/27/2024,0000-00-00,,248.07,USD,refunded,card,1,2024-02-27 0:00
I00313, S01423,2025-05-02,06/01/2025,2025-05-04,24.18,USD,FAILED,CARD,1,2025-05-02 0:00
I00431,S03005,2024-11-01 0:00,2024-12-01,0000-00-00,358.13,,paid,invoice,TRUE,2024-11-01 0:00
I00542,S00324,0000-00-00,2024-10-30,,460.96,EUR,PAID,,TRUE,2024-09-30 0:00
i01031,S03580,0000-00-00,2025-03-15,,,CAD,partial,wire,FALSE,2025-02-13 0:00
I00491,S03110,0000-00-00,2025-05-31,2025-06-07,423.14,,paid,,,2025-05-01 0:00
I01000,S04038,2024-06-10,07/10/2024,2024-06-21,N/A,usd,refunded,CARD,FALSE,2024-06-10 0:00
I00371,S03559,02/03/2025,0000-00-00,2025-02-09,458.85,,FAILED,wire,,2025-02-03 0:00
I00041,s00002,2023-09-03,10/03/2023,2023-10-12,390.32,usd,partial,paypal,,2023-09-03 0:00
I00003,S00460,2024-07-27 0:00,2024-08-26,2024-09-02,100.67,CAD,refunded,paypal,0,2024-07-27 0:00
I01531,S04104,2024-02-02,03/03/2024,,392.11,,partial,wire,TRUE,2024-02-02 0:00
I00747,S00942,04/21/2024,2024-05-21,2024-05-13 0:00,21.34,,FAILED,,1,2024-04-21 0:00
I00213,S02462,2024-12-20,2025-01-19 0:00,2024-12-20,233.34,EUR,refunded,CARD,0,2024-12-20 0:00
I00097,S02326,2023-07-05,2023-08-04,2023-08-10,30.41,USD,partial,wire,TRUE,2023-07-05 0:00
I00207,S01189,2023-07-12,,2023-08-20,337.82,EUR,partial,invoice,TRUE,2023-07-12 0:00
I01289,S01564,0000-00-00,2023-03-25 0:00,0000-00-00,487.12,usd,refunded,,,2023-02-23 0:00
I01797,S03308,2023-09-02 0:00,10/02/2023,2023-10-03,377.27,GBP,failed,,0,2023-09-02 0:00
I00340,S03539,2024-10-01 0:00,2024-10-31,2024-10-19 0:00,92.57,,refunded,,1,2024-10-01 0:00
I00980,S02551,2024-04-17,0000-00-00,04/17/2024,490.62,,partial,wire,FALSE,2024-04-17 0:00
I01645,S01539,2025-01-23,0000-00-00,03/03/2025,100.98,,partial,card,,2025-01-23 0:00
I00627,S00131,,0000-00-00,,135.75,EUR,refunded,wire,TRUE,2023-07-13 0:00
I00266,S00439,,2025-01-12,0000-00-00,11.67,CAD,refunded,invoice,FALSE,2024-12-13 0:00
I01065,S02512,,2024-09-06 0:00,2024-08-24,409.1,EUR,refunded,paypal,TRUE,2024-08-07 0:00
I01442,S00643,,,2024-01-13,266.34,CAD,partial,,TRUE,2023-12-16 0:00
I00240, S01009,2025-05-27,2025-06-26 0:00,0000-00-00,N/A,CAD,,paypal,TRUE,2025-05-27 0:00
I00612,S00665,0000-00-00,03/13/2025,,320.19,,paid,wire,FALSE,2025-02-11 0:00
I00860,S04093,0000-00-00,2023-04-08 0:00,,238.78,,FAILED,invoice,1,2023-03-09 0:00
I00802,S03266,2023-01-08,2023-02-07 0:00,2023-01-31,24.2,,failed,,,2023-01-08 0:00
I00190,S02218,2024-04-07,2024-05-07 0:00,,287.98,,,,TRUE,2024-04-07 0:00
I00733,S02366,2023-01-23,0000-00-00,2023-02-10,15.71,CAD,refunded,,,2023-01-23 0:00
I00280,S01190,2025-03-24 0:00,2025-04-23,2025-04-21 0:00,123.76,GBP,refunded,,,2025-03-24 0:00
I01429,s01089,2023-11-12 0:00,2023-12-12,2023-11-30 0:00,334.98,usd,partial,,TRUE,2023-11-12 0:00
I01044,S03921,2024-12-02,01/01/2025,,149.77,EUR,,card,FALSE,2024-12-02 0:00
I00158,S00659,2024-04-14 0:00,05/14/2024,05/09/2024,491.31,usd,refunded,card,FALSE,2024-04-14 0:00
I00959,S01220,0000-00-00,0000-00-00,,64.11,,paid,,FALSE,2024-05-19 0:00
I00601,S01428,0000-00-00,2024-03-26 0:00,,383.51,,failed,paypal,TRUE,2024-02-25 0:00
I01660,S01552,0000-00-00,2024-03-30,,258.71,,FAILED,wire,FALSE,2024-02-29 0:00
I01410,S03942,2025-03-26,2025-04-25,,430.79,,FAILED,wire,TRUE,2025-03-26 0:00
i01405,S00704,08/05/2024,0000-00-00,0000-00-00,214.68,CAD,,invoice,0,2024-08-05 0:00
I00669,S04074,2023-10-02,2023-11-01,,175.84,EUR,paid,,TRUE,2023-10-02 0:00
I01113,S01431,2023-06-27 0:00,2023-07-27,,128.78,EUR,paid,invoice,0,2023-06-27 0:00
I00832,S03716,06/11/2025,0000-00-00,,121.53,USD,PAID,invoice,FALSE,2025-06-11 0:00
I01566,s02649,03/20/2024,0000-00-00,03/26/2024,269.38,,FAILED,invoice,1,2024-03-20 0:00
I00448,S00473,0000-00-00,2025-03-02,,442.03,usd,paid,card,0,2025-01-31 0:00
I01098,S04093,2025-01-10,0000-00-00,2025-01-22,346.51,USD,FAILED,,TRUE,2025-01-10 0:00
I01258,S00146,08/01/2024,0000-00-00,2024-08-06,,GBP,paid,CARD,FALSE,2024-08-01 0:00
I00653,S01167,0000-00-00,,2023-08-07 0:00,379.3,usd,,CARD,,2023-07-19 0:00
I00808,S00316,0000-00-00,2023-04-17,2023-04-16,377.11,EUR,FAILED,card,0,2023-03-18 0:00
I00882,S01826,2023-05-08,2023-06-07,,11.7,CAD,,CARD,FALSE,2023-05-08 0:00
I00835,S01417,0000-00-00,2023-12-18,2023-12-21 0:00,98.5,CAD,failed,CARD,TRUE,2023-11-18 0:00
I00152,S02130,0000-00-00,05/27/2024,,237.87,EUR,partial,paypal,1,2024-04-27 0:00
I01789, S00876,05/07/2024,06/06/2024,,43.64,CAD,FAILED,,FALSE,2024-05-07 0:00
I00236,S01039,2024-06-23,2024-07-23,,472.72,CAD,PAID,CARD,1,2024-06-23 0:00
I01350,S00400,2024-11-15,12/15/2024,,206.62,EUR,refunded,wire,FALSE,2024-11-15 0:00
I01707,s01687,0000-00-00,2025-01-28,2025-01-12 0:00,269.65,CAD,paid,paypal,TRUE,2024-12-29 0:00
I01721,S03954,0000-00-00,0000-00-00,2024-09-21,53.81,,,wire,FALSE,2024-09-06 0:00
I00467,S02295,2024-07-11 0:00,2024-08-10 0:00,0000-00-00,341.87,usd,partial,,0,2024-07-11 0:00
I01379,S00144,,0000-00-00,,171.54,,paid,CARD,TRUE,2023-04-28 0:00
I01290,S03571,2024-07-17 0:00,2024-08-16,2024-08-25 0:00,95.67,EUR,,,FALSE,2024-07-17 0:00
I00708,S02257,2024-05-16,06/15/2024,0000-00-00,63.27,GBP,FAILED,,,2024-05-16 0:00
I00545,S00002,0000-00-00,2025-06-28 0:00,,377,GBP,PAID,CARD,0,2025-05-29 0:00
I01362,S00593,10/11/2024,0000-00-00,,341.99,,failed,CARD,1,2024-10-11 0:00
I01556,S02899,0000-00-00,2023-10-16 0:00,2023-10-16,226.53,usd,paid,,TRUE,2023-09-16 0:00
I01411,S04146,2024-10-30,11/29/2024,2024-11-28,359.96,,paid,wire,0,2024-10-30 0:00
I01343,S02494,0000-00-00,2025-05-14,2025-05-02 0:00,418.29,USD,PAID,card,1,2025-04-14 0:00
I01296,S02919,10/24/2023,2023-11-23 0:00,,,USD,PAID,wire,,2023-10-24 0:00
I00338,S03670,0000-00-00,2025-02-20,2025-01-24 0:00,316.99,USD,failed,paypal,,2025-01-21 0:00
I00174,S03683,0000-00-00,,2025-06-24,,EUR,refunded,wire,FALSE,2025-05-19 0:00
I01637,S02440,0000-00-00,2023-02-10 0:00,,152.56,USD,PAID,wire,0,2023-01-11 0:00
I00093,S02970,03/11/2025,2025-04-10,,433.42,EUR,,,TRUE,2025-03-11 0:00
I00065,S01029,10/08/2024,0000-00-00,10/23/2024,N/A,,paid,card,,2024-10-08 0:00
I01545,S03220,0000-00-00,2024-10-14 0:00,,272.63,usd,,invoice,,2024-09-14 0:00
I01324,S01984,2024-01-23,2024-02-22,2024-02-02,241.48,,,CARD,FALSE,2024-01-23 0:00
I00634,S03240,2024-04-12,2024-05-12 0:00,2024-05-07,48.17,GBP,paid,CARD,FALSE,2024-04-12 0:00
I00274,S02769,2023-07-04,2023-08-03,0000-00-00,249.88,CAD,,card,FALSE,2023-07-04 0:00
I00557,S04470,0000-00-00,2024-06-12,0000-00-00,328.55,EUR,paid,CARD,,2024-05-13 0:00
I00861, SUB-00071,0000-00-00,07/11/2024,2024-07-17,33.59,usd,,CARD,,2024-06-11 0:00
I00710,S03846,10/10/2023,2023-11-09,2023-11-13,486.68,,,paypal,,2023-10-10 0:00
I00963,s01775,04/03/2025,2025-05-03,2025-05-12,34.49,GBP,refunded,,TRUE,2025-04-03 0:00
I00568,S04227,06/09/2024,07/09/2024,2024-06-24 0:00,,,failed,paypal,FALSE,2024-06-09 0:00
I00750,S02893,04/03/2025,05/03/2025,2025-04-28,42.4,usd,refunded,,TRUE,2025-04-03 0:00
 I00705,S03837,2023-06-05,2023-07-05 0:00,0000-00-00,311.63,,refunded,,FALSE,2023-06-05 0:00
I00788,S01270,2024-05-22 0:00,0000-00-00,2024-06-10,88.6,USD,,invoice,,2024-05-22 0:00
I00251,S00558,2023-12-16,01/15/2024,12/21/2023,404.12,CAD,,CARD,FALSE,2023-12-16 0:00
I00003,S00999,2024-10-11 0:00,2024-11-10,,25.86,GBP,failed,,TRUE,2024-10-11 0:00
I00585,S00877,0000-00-00,0000-00-00,2024-05-03,378.15,USD,paid,paypal,TRUE,2024-04-22 0:00
I00875, S01464,2024-10-12,2024-11-11 0:00,2024-10-12,251.19,,failed,wire,TRUE,2024-10-12 0:00
I00056,S03281,0000-00-00,2023-11-08,2023-10-25,93.34,GBP,PAID,,FALSE,2023-10-09 0:00
I01515,S01938,2023-09-24 0:00,2023-10-24,,440.69,usd,PAID,invoice,0,2023-09-24 0:00
I00139,S03177,03/20/2023,0000-00-00,2023-04-16 0:00,328.63,usd,FAILED,,,2023-03-20 0:00
I00413,SUB-03029,,2023-04-22,0000-00-00,370.04,CAD,,wire,0,2023-03-23 0:00
I01537,S00777,2023-11-25,12/25/2023,2023-12-18,207.59,EUR,,CARD,,2023-11-25 0:00
I00485,S01089,2023-02-27,0000-00-00,2023-03-15 0:00,157.29,,,,TRUE,2023-02-27 0:00
I00318,S01217,2025-03-23,2025-04-22,,83.45,USD,,invoice,,2025-03-23 0:00
I00655,S01699,0000-00-00,0000-00-00,,419.68,GBP,,,FALSE,2024-07-06 0:00
I00402,S00695,03/25/2025,04/24/2025,2025-05-03,473.32,,paid,wire,,2025-03-25 0:00
I01795,S03918,2023-03-06,0000-00-00,2023-04-02,452.66,CAD,PAID,CARD,,2023-03-06 0:00
I01727,S00387,0000-00-00,,0000-00-00,322.48,EUR,partial,wire,TRUE,2023-12-10 0:00
I01048,S03547,0000-00-00,0000-00-00,,57.93,USD,paid,wire,TRUE,2024-05-08 0:00
I00967,S03565,2024-07-14,2024-08-13,,490.21,USD,,invoice,1,2024-07-14 0:00
I01544,S01194,2023-03-07,04/06/2023,,399.21,USD,refunded,card,FALSE,2023-03-07 0:00
I01799,S01952,2024-07-13,08/12/2024,2024-08-01,268.42,,FAILED,invoice,0,2024-07-13 0:00
I01616,S02401,0000-00-00,03/01/2023,0000-00-00,248.31,USD,partial,paypal,TRUE,2023-01-30 0:00
I00358,S01943,0000-00-00,2023-12-09,,78.92,GBP,PAID,,TRUE,2023-11-09 0:00
I00027,S01954,2023-11-06 0:00,2023-12-06 0:00,,160.58,CAD,,wire,1,2023-11-06 0:00
I00284,S03444,2024-09-16,0000-00-00,,299.46,usd,partial,,1,2024-09-16 0:00
 I00484,S00491,0000-00-00,0000-00-00,,221.98,,,,0,2025-01-23 0:00
I01694,S03602,0000-00-00,2025-07-15 0:00,0000-00-00,241.69,,,paypal,FALSE,2025-06-15 0:00
I01241,S03959,0000-00-00,04/19/2023,2023-04-07 0:00,210.21,usd,,,FALSE,2023-03-20 0:00
I01043,S00631,0000-00-00,2025-04-27 0:00,0000-00-00,318.35,usd,,,,2025-03-28 0:00
I01113,S00605,,,,182.53,GBP,,wire,0,2023-05-29 0:00
I01647,S02064,11/07/2023,2023-12-07,2023-12-08 0:00,271.63,USD,refunded,wire,FALSE,2023-11-07 0:00
I00789,S00208,,2023-06-06,2023-05-07 0:00,266.22,,refunded,card,,2023-05-07 0:00
I01039,S02395,10/11/2023,2023-11-10 0:00,0000-00-00,427.67,GBP,,paypal,0,2023-10-11 0:00
I01791,S00655,01/28/2023,02/27/2023,2023-02-08,82.32,,paid,card,,2023-01-28 0:00
I01681,S00587,2025-01-31,2025-03-02,,390.69,,,paypal,,2025-01-31 0:00
I00467,S03104,2023-04-10,05/10/2023,0000-00-00,192.58,GBP,,CARD,FALSE,2023-04-10 0:00
i00606,S02970,,2024-08-27,,217.24,,,CARD,,2024-07-28 0:00
I00521,S04099,0000-00-00,2023-05-19,0000-00-00,N/A,EUR,failed,invoice,TRUE,2023-04-19 0:00
i00838,S02780,2023-03-05,04/04/2023,2023-04-04 0:00,328.64,EUR,failed,CARD,FALSE,2023-03-05 0:00
I01396,S00593,2024-12-07,2025-01-06 0:00,,423.2,GBP,failed,paypal,FALSE,2024-12-07 0:00
I00899,S01785,2024-12-13 0:00,01/12/2025,,368.29,USD,PAID,paypal,TRUE,2024-12-13 0:00
I01731,S02320,,2024-11-04,,254.9,GBP,paid,,,2024-10-05 0:00
I00933,S00869,2023-12-13,01/12/2024,,462.99,,refunded,paypal,FALSE,2023-12-13 0:00
I00178,S03627,08/10/2024,09/09/2024,,50.37,,paid,paypal,,2024-08-10 0:00
I01049,s00525,2025-06-12,0000-00-00,2025-07-08 0:00,159.19,EUR,partial,paypal,,2025-06-12 0:00
I01180,S04378,2025-02-15,2025-03-17,,385.38,GBP,,card,FALSE,2025-02-15 0:00
I01282,S01903,2025-06-02 0:00,,,459.98,usd,partial,card,,2025-06-02 0:00
I01083, S00170,2024-08-10 0:00,09/09/2024,2024-09-06 0:00,249.71,usd,PAID,invoice,,2024-08-10 0:00
I01291, S01964,2023-12-03 0:00,0000-00-00,01/04/2024,67.32,usd,PAID,CARD,TRUE,2023-12-03 0:00
I00527,S02718,0000-00-00,07/21/2023,,143.56,CAD,FAILED,,TRUE,2023-06-21 0:00
I00477,s01070,0000-00-00,0000-00-00,2023-12-22 0:00,287.82,CAD,paid,,,2023-12-14 0:00
I01211,S00405,0000-00-00,05/23/2025,,102.27,,failed,invoice,TRUE,2025-04-23 0:00
I01773,S02616,03/22/2025,2025-04-21,,152.04,,failed,,FALSE,2025-03-22 0:00
I00113,s03369,2023-03-21,2023-04-20,2023-03-29 0:00,359.61,usd,,,1,2023-03-21 0:00
I00673,S03139,2024-08-04,2024-09-03,2024-08-16,491.44,GBP,PAID,paypal,0,2024-08-04 0:00
I01355, S01644,2023-02-09,2023-03-11 0:00,,408.15,,partial,CARD,1,2023-02-09 0:00
I00958, S00818,2025-01-13,02/12/2025,2025-02-02,494.08,GBP,,,FALSE,2025-01-13 0:00
I00068,S04051,2023-07-02 0:00,2023-08-01,,259.11,USD,refunded,paypal,TRUE,2023-07-02 0:00
I00762,S00093,0000-00-00,0000-00-00,0000-00-00,42.02,CAD,refunded,card,,2024-10-18 0:00
I00076,S02664,0000-00-00,0000-00-00,2025-04-05,404.69,,paid,,,2025-03-09 0:00
I00459,S03379,0000-00-00,,2024-07-12 0:00,426.56,USD,partial,card,TRUE,2024-06-14 0:00
I00891,S03871,2025-03-16 0:00,2025-04-15,,80.01,,,,0,2025-03-16 0:00
I00525,S04282,0000-00-00,05/03/2024,04/22/2024,305.29,EUR,paid,,,2024-04-03 0:00
I00090,S03519,2024-05-28,2024-06-27,2024-05-30,391.58,usd,partial,invoice,FALSE,2024-05-28 0:00
I00120,S00252,2025-01-04 0:00,2025-02-03 0:00,2025-01-17 0:00,498.24,GBP,refunded,card,FALSE,2025-01-04 0:00
 I00855,S03321,2024-12-11,2025-01-10,,341.91,,FAILED,card,TRUE,2024-12-11 0:00
 I01403,S00508,2024-11-02 0:00,0000-00-00,,,,failed,,0,2024-11-02 0:00
i00587, S04143,2024-03-10,2024-04-09,2024-04-16 0:00,293.46,,paid,card,,2024-03-10 0:00
I01432,S02925,,2023-11-04,11/09/2023,11.58,CAD,PAID,CARD,,2023-10-05 0:00
I00062,S03293,10/22/2023,,2023-11-20,443.24,,failed,paypal,FALSE,2023-10-22 0:00
I00699,S03164,0000-00-00,0000-00-00,2023-03-07 0:00,,,paid,invoice,TRUE,2023-02-04 0:00
I00512,S02669,12/31/2024,,2025-01-04,342.54,,FAILED,paypal,0,2024-12-31 0:00
I01350,S01168,03/22/2025,2025-04-21 0:00,,397.9,,PAID,,TRUE,2025-03-22 0:00
I00251,S02834,02/02/2023,2023-03-04 0:00,,64.26,usd,failed,card,,2023-02-02 0:00
I00661,S04310,03/05/2025,0000-00-00,,182.22,USD,,,,2025-03-05 0:00
I00550,S01356,0000-00-00,2023-08-26,2023-08-08,,EUR,partial,card,0,2023-07-27 0:00
I01050,S02965,0000-00-00,0000-00-00,0000-00-00,179.1,EUR,,card,,2024-04-03 0:00
I00126,S02723,10/09/2024,11/08/2024,11/13/2024,143.98,GBP,,invoice,TRUE,2024-10-09 0:00
I00328,s00977,2024-03-09,04/08/2024,,432.47,,partial,card,0,2024-03-09 0:00
I00207,S03746,2024-01-12,2024-02-11,0000-00-00,93.03,USD,,wire,FALSE,2024-01-12 0:00
I01372,S03790,04/06/2025,2025-05-06 0:00,2025-04-10,497.65,EUR,partial,invoice,TRUE,2025-04-06 0:00
I01472,S00734,,06/25/2023,2023-05-26,329.2,,partial,paypal,FALSE,2023-05-26 0:00
I00226,S02829,10/15/2024,,,N/A,CAD,PAID,,,2024-10-15 0:00
I01256,S00850,0000-00-00,,0000-00-00,478.58,usd,,card,,2023-12-14 0:00
I01341,S00796,0000-00-00,2024-06-26,0000-00-00,439.82,,partial,paypal,,2024-05-27 0:00
I00394,s01353,11/19/2023,0000-00-00,,144.71,USD,,wire,,2023-11-19 0:00
I00301,S04178,2023-05-27 0:00,0000-00-00,,209.3,USD,failed,wire,TRUE,2023-05-27 0:00
I00652,S01406,,0000-00-00,2023-05-02,56.85,,failed,CARD,FALSE,2023-04-27 0:00
I00946,S03958,2024-05-17,06/16/2024,05/19/2024,268.02,usd,failed,CARD,,2024-05-17 0:00
I00326,S02297,,04/04/2024,0000-00-00,193.32,EUR,failed,CARD,TRUE,2024-03-05 0:00
I00312,S01382,,10/17/2024,2024-10-22,33.18,CAD,,,,2024-09-17 0:00
I01154,s03539,0000-00-00,0000-00-00,2023-04-20,425.27,usd,failed,CARD,0,2023-03-22 0:00
I00932,S02576,2025-05-09,06/08/2025,,,usd,,paypal,TRUE,2025-05-09 0:00
I01398,S03580,0000-00-00,,,412.58,USD,failed,paypal,FALSE,2023-01-30 0:00
i01264,S04325,2024-04-04,0000-00-00,04/15/2024,195.67,EUR,paid,,TRUE,2024-04-04 0:00
I01040,S00876,,2023-02-24,02/02/2023,278.95,GBP,failed,invoice,TRUE,2023-01-25 0:00
I00391,S00822,10/03/2023,2023-11-02 0:00,,,GBP,failed,paypal,FALSE,2023-10-03 0:00
I00661,S03670,10/19/2023,0000-00-00,2023-11-23 0:00,273.65,,,card,0,2023-10-19 0:00
I00683,S02400,2023-11-25,0000-00-00,0000-00-00,237.95,CAD,FAILED,,FALSE,2023-11-25 0:00
 I01222,S02582,2023-09-13,10/13/2023,,328.63,,refunded,invoice,,2023-09-13 0:00
I01216,S02457,2023-11-16,12/16/2023,2023-12-10,335.97,,partial,,0,2023-11-16 0:00
I00213,S02676,2023-06-23,07/23/2023,,N/A,usd,refunded,card,,2023-06-23 0:00
I01291,S02650,08/20/2023,,2023-08-26,378.26,,paid,wire,,2023-08-20 0:00
 I00528,S04285,2025-01-22,2025-02-21,,333.76,GBP,failed,,1,2025-01-22 0:00
I01387,s00023,06/08/2024,07/08/2024,0000-00-00,461.67,GBP,partial,invoice,0,2024-06-08 0:00
I01064,s04466,2025-04-07,2025-05-07,0000-00-00,372.15,usd,PAID,invoice,0,2025-04-07 0:00
I01269,S02629,0000-00-00,2023-11-29 0:00,2023-12-06,340.99,,refunded,,TRUE,2023-10-30 0:00
I01686,S02004,04/23/2024,2024-05-23 0:00,05/05/2024,315.5,USD,refunded,wire,,2024-04-23 0:00
I01569,S03808,2023-01-08,02/07/2023,2023-02-02,137.96,,FAILED,paypal,TRUE,2023-01-08 0:00
I01044,S00556,0000-00-00,0000-00-00,11/29/2023,193.02,usd,partial,,,2023-10-31 0:00
I01318,SUB-01526,11/24/2023,0000-00-00,0000-00-00,139.7,EUR,FAILED,,,2023-11-24 0:00
I01295,S03697,2023-02-20 0:00,0000-00-00,0000-00-00,313.26,CAD,paid,paypal,TRUE,2023-02-20 0:00
i00622,S04441,2023-04-09,0000-00-00,,263.87,CAD,partial,,FALSE,2023-04-09 0:00
I00786,S02181,2024-04-04 0:00,0000-00-00,2024-04-14,452.49,,refunded,paypal,0,2024-04-04 0:00
I00199,S01003,0000-00-00,0000-00-00,2024-02-24 0:00,280.58,usd,,paypal,,2024-01-20 0:00
I00091,S00348,2024-11-11,0000-00-00,2024-11-25 0:00,359.89,GBP,refunded,,1,2024-11-11 0:00
I00655,S01699,0000-00-00,0000-00-00,,419.68,GBP,,,FALSE,2024-07-06 0:00
I00419,S01969,2024-05-04,06/03/2024,2024-05-24,48.61,,,paypal,,2024-05-04 0:00
I00785,S04478,0000-00-00,0000-00-00,,159.25,CAD,partial,card,1,2024-10-12 0:00
I01013, s00953,08/14/2023,,,N/A,EUR,paid,,FALSE,2023-08-14 0:00
I00229,S02392,2024-09-26,2024-10-26,,16.18,CAD,PAID,paypal,FALSE,2024-09-26 0:00
I01220,S03768,0000-00-00,2024-12-07,,191.23,,paid,CARD,TRUE,2024-11-07 0:00
I01673,S01544,,0000-00-00,0000-00-00,338.57,GBP,failed,card,1,2024-08-05 0:00
I01101,S02545,2025-02-14,2025-03-16,,238.61,,failed,paypal,FALSE,2025-02-14 0:00
I01219,S03266,2024-04-21,,,53.04,CAD,,CARD,FALSE,2024-04-21 0:00
I01123,S02660,11/19/2024,,0000-00-00,309.09,usd,PAID,,FALSE,2024-11-19 0:00
I01135,S02022,,2023-07-01 0:00,2023-07-03,55.64,EUR,PAID,paypal,FALSE,2023-06-01 0:00
I00264,S00375,0000-00-00,2023-02-27,,269.2,CAD,failed,wire,,2023-01-28 0:00
I01702,S00411,2025-03-03,,,127.12,USD,PAID,,FALSE,2025-03-03 0:00
I01524,S00415,,2024-09-07 0:00,,318.91,,partial,,TRUE,2024-08-08 0:00
 I00194,S02310,,01/03/2025,,498.79,EUR,PAID,invoice,,2024-12-04 0:00
I01382,S01807,0000-00-00,2023-07-04,,212.47,GBP,failed,invoice,FALSE,2023-06-04 0:00
I01730,S03322,2023-08-01,2023-08-31,2023-08-07,159.45,CAD,,paypal,TRUE,2023-08-01 0:00
I00556,S03178,0000-00-00,2024-06-08 0:00,,440.32,GBP,FAILED,wire,0,2024-05-09 0:00
I01762,S02325,2024-10-26,0000-00-00,0000-00-00,461.51,CAD,paid,,0,2024-10-26 0:00
I01080,S00109,12/06/2023,01/05/2024,,298.54,USD,,,FALSE,2023-12-06 0:00
I00644,S02864,06/12/2024,2024-07-12 0:00,2024-06-17 0:00,412.14,,partial,CARD,,2024-06-12 0:00
I01309,S03958,,2024-07-10,0000-00-00,238.53,GBP,FAILED,,,2024-06-10 0:00
I01217,s01728,0000-00-00,2023-12-01 0:00,0000-00-00,133.25,,partial,,,2023-11-01 0:00
I00517,S00867,2023-05-21,0000-00-00,0000-00-00,307.88,EUR,FAILED,invoice,,2023-05-21 0:00
I00641,S03811,2025-02-26 0:00,0000-00-00,03/12/2025,246.57,GBP,,card,,2025-02-26 0:00
I00697,S00052,0000-00-00,01/07/2025,2025-01-07 0:00,N/A,CAD,FAILED,card,,2024-12-08 0:00
I00173,S03825,2023-03-01 0:00,0000-00-00,04/01/2023,461.33,EUR,,paypal,TRUE,2023-03-01 0:00
I00452,S04226,2023-02-04 0:00,2023-03-06,2023-02-07 0:00,105.86,usd,,invoice,FALSE,2023-02-04 0:00
I00201,S02579,0000-00-00,2023-09-20 0:00,,424.36,,PAID,,FALSE,2023-08-21 0:00
 I00534,S03386,0000-00-00,0000-00-00,,433.16,,failed,card,FALSE,2025-05-03 0:00
I00114,S02953,05/09/2024,0000-00-00,,62.22,EUR,,wire,,2024-05-09 0:00
I00101, S02239,04/11/2025,0000-00-00,2025-04-25,372.78,GBP,FAILED,,,2025-04-11 0:00
I00071,S01604,2023-06-01,07/01/2023,2023-06-03,498.8,USD,refunded,card,FALSE,2023-06-01 0:00
I01570,S03649,2024-05-04,0000-00-00,05/24/2024,404.86,usd,PAID,,1,2024-05-04 0:00
I00612,S03440,,2025-05-21 0:00,2025-05-12,N/A,CAD,,invoice,,2025-04-21 0:00
I00061,S04435,0000-00-00,2024-03-26,,268.34,GBP,paid,,,2024-02-25 0:00
I01118,S02028,,2025-03-07 0:00,02/11/2025,94.13,,PAID,wire,,2025-02-05 0:00
I00609,S03538,0000-00-00,0000-00-00,2024-09-05,281.19,GBP,failed,card,TRUE,2024-08-10 0:00
I01477, S00101,2023-01-23 0:00,0000-00-00,,209.3,CAD,partial,CARD,TRUE,2023-01-23 0:00
I01081,S00059,,2023-05-23,2023-05-22 0:00,137.41,USD,,,TRUE,2023-04-23 0:00
I01369,S00792,06/23/2023,2023-07-23,,289.41,USD,partial,card,,2023-06-23 0:00
I00920,S02347,0000-00-00,,2024-07-07 0:00,242.72,USD,,invoice,FALSE,2024-07-06 0:00
I01238,S02702,2023-09-03 0:00,0000-00-00,09/18/2023,48.03,,failed,card,TRUE,2023-09-03 0:00
I01471,S03741,04/29/2023,0000-00-00,05/17/2023,15.66,,PAID,paypal,0,2023-04-29 0:00
I00066,S02681,,2024-08-03 0:00,,,,,card,FALSE,2024-07-04 0:00
I00959,S00484,0000-00-00,12/21/2024,,480.22,usd,refunded,CARD,TRUE,2024-11-21 0:00
I01797,s00561,2024-09-09,2024-10-09,09/24/2024,202.84,USD,partial,wire,1,2024-09-09 0:00
I00692,s03342,2023-02-27,0000-00-00,2023-03-15,156.12,EUR,,paypal,,2023-02-27 0:00
I00177,S04178,2023-11-13,2023-12-13,,54.63,,,,FALSE,2023-11-13 0:00
I01603, S03023,0000-00-00,0000-00-00,12/28/2023,445.53,CAD,refunded,,0,2023-11-25 0:00
I01210,SUB-03433,2023-12-27,01/26/2024,01/18/2024,269.35,CAD,FAILED,,,2023-12-27 0:00
I00016,S01644,,2023-07-08,07/05/2023,349.87,,refunded,card,1,2023-06-08 0:00
I00850,S02938,2023-11-14 0:00,2023-12-14,0000-00-00,423.01,EUR,paid,invoice,,2023-11-14 0:00
I00841,S01699,,2024-04-22,,221.64,usd,partial,CARD,0,2024-03-23 0:00
I00159,S02359,2025-02-11 0:00,03/13/2025,2025-03-09,231.42,,,CARD,FALSE,2025-02-11 0:00
 I00868,S03460,0000-00-00,08/11/2023,,127.39,EUR,,CARD,FALSE,2023-07-12 0:00
I00052,S00384,0000-00-00,2024-08-29 0:00,,181.09,usd,failed,,TRUE,2024-07-30 0:00
I01363,S03046,2024-10-30,0000-00-00,,185.8,,partial,,0,2024-10-30 0:00
 I00684,S01002,0000-00-00,03/19/2023,2023-03-12 0:00,175.21,usd,PAID,wire,,2023-02-17 0:00
I01499, S02679,2024-02-08 0:00,2024-03-09,,,CAD,failed,,TRUE,2024-02-08 0:00
I01680,S00495,,2023-12-03 0:00,2023-12-12 0:00,78.49,GBP,refunded,card,,2023-11-03 0:00
I00025,S04062,10/05/2024,0000-00-00,,38.2,,failed,CARD,FALSE,2024-10-05 0:00
I01701,S04105,2024-04-09,2024-05-09,0000-00-00,466.14,CAD,FAILED,invoice,FALSE,2024-04-09 0:00
I01688,S02350,2024-01-23,0000-00-00,,69.29,CAD,PAID,CARD,FALSE,2024-01-23 0:00
I00774,s04441,2023-07-21,2023-08-20,2023-07-27,,,refunded,,0,2023-07-21 0:00
I01313,S03198,2025-03-11,,2025-04-19,108.54,CAD,failed,CARD,FALSE,2025-03-11 0:00
I00878,S00121,,11/03/2023,10/31/2023,317.22,USD,partial,wire,TRUE,2023-10-04 0:00
I00077,S02412,2023-08-24,09/23/2023,2023-08-25,252.37,GBP,partial,,1,2023-08-24 0:00
I01114,S03723,2024-11-28,2024-12-28,0000-00-00,125.35,usd,PAID,wire,FALSE,2024-11-28 0:00
I00366,S03542,2023-09-20 0:00,,,27.53,,refunded,invoice,0,2023-09-20 0:00
I01125,S04357,2023-09-11,0000-00-00,10/21/2023,147.7,EUR,PAID,CARD,TRUE,2023-09-11 0:00
I01318,S00780,2023-04-08 0:00,2023-05-08 0:00,2023-04-10 0:00,146.55,,,wire,TRUE,2023-04-08 0:00
I00180,S01441,,2023-12-20,0000-00-00,471.49,USD,,,,2023-11-20 0:00
I00470,S03928,11/16/2024,2024-12-16,,207.82,,,invoice,FALSE,2024-11-16 0:00
I00208,S02033,2023-11-19,2023-12-19 0:00,,150.12,USD,paid,,TRUE,2023-11-19 0:00
I00084,S03396,2024-01-18,2024-02-17,01/28/2024,,GBP,failed,CARD,FALSE,2024-01-18 0:00
I00042,S01120,0000-00-00,,2024-01-30,21.54,,failed,wire,1,2024-01-17 0:00
I01406,S03070,12/29/2024,2025-01-28 0:00,0000-00-00,27.46,CAD,FAILED,,,2024-12-29 0:00
I00793,S02829,0000-00-00,0000-00-00,2025-06-03,46.29,CAD,failed,CARD,0,2025-05-26 0:00
I00462,S02340,2023-10-13 0:00,2023-11-12,,215.05,usd,,CARD,1,2023-10-13 0:00
I00833,S04371,,0000-00-00,,129.29,CAD,paid,wire,,2023-10-29 0:00
I00530,S04466,10/13/2023,0000-00-00,,100.96,GBP,failed,,FALSE,2023-10-13 0:00
I00814,S00550,05/25/2023,2023-06-24,,296.83,USD,FAILED,invoice,TRUE,2023-05-25 0:00
I01699,S03250,01/18/2025,02/17/2025,2025-02-21,236.74,CAD,,wire,FALSE,2025-01-18 0:00
I00521,S04213,0000-00-00,03/15/2023,,99.43,CAD,partial,invoice,TRUE,2023-02-13 0:00
I00543,S00777,0000-00-00,2023-09-08,2023-08-12,379.23,usd,,card,,2023-08-09 0:00
I01746, S00621,2025-02-18,03/20/2025,0000-00-00,469.24,,refunded,,FALSE,2025-02-18 0:00
I00574,S02721,0000-00-00,2023-12-21 0:00,,465.54,CAD,PAID,paypal,FALSE,2023-11-21 0:00
I01622,S02593,0000-00-00,2025-06-30,2025-06-09 0:00,459.12,EUR,failed,,,2025-05-31 0:00
I01013,SUB-00744,04/01/2025,2025-05-01,0000-00-00,139.34,,,wire,,2025-04-01 0:00
I01748,S00920,2025-06-15,,0000-00-00,,,partial,wire,TRUE,2025-06-15 0:00
I00097,S02002,0000-00-00,,,299.58,CAD,failed,CARD,TRUE,2024-07-28 0:00
I00455,S01532,0000-00-00,2024-05-21,,25.47,CAD,,wire,TRUE,2024-04-21 0:00
I00392,S02697,2024-05-09,06/08/2024,,N/A,USD,refunded,card,FALSE,2024-05-09 0:00
I00788,S00744,,,,406.68,USD,partial,,0,2025-02-02 0:00
I00267,S00793,2024-04-06,2024-05-06,04/28/2024,250.45,,PAID,CARD,,2024-04-06 0:00
I00532,S03499,2023-08-11 0:00,09/10/2023,0000-00-00,32.19,USD,failed,,,2023-08-11 0:00
I01043,S03497,0000-00-00,2024-08-29,0000-00-00,323.38,,refunded,wire,FALSE,2024-07-30 0:00
I00744,S00283,2024-05-10,,06/09/2024,200.6,,,CARD,,2024-05-10 0:00
I01777,s03188,0000-00-00,,05/01/2025,495.68,USD,partial,invoice,0,2025-04-23 0:00
I00386,S03558,2023-05-26,2023-06-25 0:00,2023-06-12,348.64,,,card,TRUE,2023-05-26 0:00
I01500,S02343,09/01/2023,2023-10-01,,310.99,,failed,,TRUE,2023-09-01 0:00
I00090,S03716,09/27/2023,2023-10-27 0:00,,270.97,,failed,paypal,1,2023-09-27 0:00
I01744,S01920,2025-05-28,2025-06-27,0000-00-00,36.7,EUR,FAILED,CARD,TRUE,2025-05-28 0:00
I01419,S01641,2023-06-06 0:00,2023-07-06,,,USD,,,FALSE,2023-06-06 0:00
I00860,S00963,0000-00-00,0000-00-00,2023-05-18 0:00,43.9,CAD,paid,card,FALSE,2023-05-01 0:00
I01671,S03219,,0000-00-00,,85.46,GBP,partial,,1,2023-07-09 0:00
I01378,s04093,11/29/2023,,12/22/2023,360.37,EUR,PAID,,1,2023-11-29 0:00
I01685,S01708,0000-00-00,04/02/2025,,N/A,GBP,partial,card,1,2025-03-03 0:00
I00532,S03662,0000-00-00,2025-03-03,,324.34,,failed,card,FALSE,2025-02-01 0:00
I01787,S04466,0000-00-00,11/06/2023,2023-11-01,232.07,USD,FAILED,invoice,TRUE,2023-10-07 0:00
I01209,SUB-02159,04/06/2025,2025-05-06,04/23/2025,39.39,USD,failed,,,2025-04-06 0:00
I01325,S02261,2024-07-27,,,186.06,EUR,FAILED,,0,2024-07-27 0:00
I01764,S03449,0000-00-00,2024-12-25,,380.83,GBP,FAILED,,FALSE,2024-11-25 0:00
I00207,S04277,01/24/2024,02/23/2024,2024-02-29,23.49,USD,paid,paypal,FALSE,2024-01-24 0:00
I01616,S01303,2025-06-08,07/08/2025,0000-00-00,134.99,GBP,PAID,,1,2025-06-08 0:00
I00087,S02573,2023-10-10,2023-11-09,0000-00-00,389.49,GBP,refunded,invoice,,2023-10-10 0:00
I00684,S02819,0000-00-00,0000-00-00,2024-07-31,,EUR,refunded,wire,,2024-07-13 0:00
I01520,S01415,02/05/2025,2025-03-07,,298.93,USD,refunded,card,,2025-02-05 0:00
I00077,s02753,2023-11-30 0:00,2023-12-30 0:00,,84.94,EUR,refunded,,TRUE,2023-11-30 0:00
I01153,S01414,2023-09-17,,10/05/2023,472.78,USD,paid,,FALSE,2023-09-17 0:00
I00087,S01168,,0000-00-00,2023-03-11,342.25,GBP,,wire,FALSE,2023-02-20 0:00
I00480,S04062,04/16/2024,2024-05-16 0:00,2024-05-26 0:00,217.9,CAD,partial,paypal,0,2024-04-16 0:00
I01283,S01652,2023-12-21 0:00,2024-01-20 0:00,2023-12-22,450.55,CAD,failed,,1,2023-12-21 0:00
I00062,S03293,10/22/2023,,2023-11-20,443.24,,failed,paypal,FALSE,2023-10-22 0:00
I01461,S03150,07/10/2024,,2024-07-18 0:00,197.04,,,CARD,TRUE,2024-07-10 0:00
I00093,S03311,07/04/2024,0000-00-00,2024-07-13,285.96,EUR,paid,CARD,FALSE,2024-07-04 0:00
I00230,S02723,,2025-07-12 0:00,,157.87,usd,FAILED,invoice,FALSE,2025-06-12 0:00
 I00962,S03818,2023-10-11,11/10/2023,,480.69,USD,partial,CARD,FALSE,2023-10-11 0:00
I00919,S00798,0000-00-00,2025-02-18,02/19/2025,199.53,EUR,failed,CARD,FALSE,2025-01-19 0:00
I01180,S02234,2023-02-21,0000-00-00,,145.55,CAD,refunded,,FALSE,2023-02-21 0:00
I01529,S02434,2023-06-15,2023-07-15,,88.33,,refunded,wire,FALSE,2023-06-15 0:00
I00773,S02929,2023-08-10 0:00,,0000-00-00,485.75,,FAILED,wire,TRUE,2023-08-10 0:00
I01159,S00915,2023-02-10 0:00,0000-00-00,2023-02-12 0:00,129.79,CAD,,CARD,FALSE,2023-02-10 0:00
I01273,S02475,2025-06-16 0:00,0000-00-00,2025-07-16 0:00,10.55,GBP,FAILED,wire,,2025-06-16 0:00
I01396,S03225,,2024-03-23,,345.61,GBP,FAILED,invoice,FALSE,2024-02-22 0:00
I00609,S03621,0000-00-00,2024-07-28 0:00,07/05/2024,124.03,EUR,,card,FALSE,2024-06-28 0:00
I01190,S04022,2025-05-20 0:00,06/19/2025,06/14/2025,,usd,,,0,2025-05-20 0:00
I00566,S00049,0000-00-00,2025-02-21,0000-00-00,133.66,,FAILED,invoice,0,2025-01-22 0:00
I01445,S02428,2023-12-24 0:00,2024-01-23 0:00,0000-00-00,N/A,usd,partial,paypal,FALSE,2023-12-24 0:00
I01091,S00324,2023-07-31,2023-08-30,,44.17,,PAID,card,FALSE,2023-07-31 0:00
I01428,S00319,0000-00-00,,2024-01-17,400.91,,paid,card,1,2023-12-17 0:00
I01153,S01414,2023-09-17,,10/05/2023,472.78,USD,paid,,FALSE,2023-09-17 0:00
I01353,S02316,06/09/2025,,,256.96,GBP,,card,0,2025-06-09 0:00
I00037,S01699,0000-00-00,10/12/2024,,12.28,usd,,,0,2024-09-12 0:00
I00084,S01822,12/27/2024,,0000-00-00,273.21,,failed,card,TRUE,2024-12-27 0:00
i01346,S04211,,0000-00-00,,119.79,CAD,,CARD,,2025-05-14 0:00
I00525,S03848,,2024-10-28 0:00,,461.69,CAD,FAILED,card,TRUE,2024-09-28 0:00
I01708,S04478,,2023-04-04 0:00,2023-03-06,475.69,usd,failed,card,0,2023-03-05 0:00
I01060, S03816,05/29/2023,2023-06-28,06/04/2023,29.81,,refunded,wire,0,2023-05-29 0:00
I01244,S02588,2023-07-26,0000-00-00,0000-00-00,468.14,,refunded,,1,2023-07-26 0:00
I00588,S00096,2023-07-15 0:00,0000-00-00,,385.12,usd,,paypal,FALSE,2023-07-15 0:00
I00041,S00069,0000-00-00,2025-03-11,02/14/2025,11.07,usd,,wire,1,2025-02-09 0:00
I00700,S03708,0000-00-00,2024-01-21,0000-00-00,127.73,EUR,PAID,wire,0,2023-12-22 0:00
I00131,S01134,2024-02-01,2024-03-02,2024-02-14 0:00,410.87,CAD,FAILED,invoice,FALSE,2024-02-01 0:00
I01679,S02537,2024-11-15,,2024-11-25,93.47,GBP,,paypal,FALSE,2024-11-15 0:00
I00460,S02745,0000-00-00,0000-00-00,,180.91,CAD,FAILED,,TRUE,2025-05-28 0:00
I01778,S04191,2024-03-13,,2024-04-08,188.59,,paid,,0,2024-03-13 0:00
I00621,S02887,2025-02-16 0:00,2025-03-18 0:00,0000-00-00,107,usd,refunded,paypal,,2025-02-16 0:00
I01640,s01497,12/27/2024,2025-01-26 0:00,,13.69,EUR,,invoice,0,2024-12-27 0:00
I00815,S01667,,0000-00-00,2024-04-10,382.93,usd,,,1,2024-03-22 0:00
I00078,S00928,,,09/03/2024,282.3,CAD,FAILED,,0,2024-08-22 0:00
I01789,S04421,2025-03-05,04/04/2025,,97.81,,PAID,card,TRUE,2025-03-05 0:00
I00199,S01003,0000-00-00,0000-00-00,2024-02-24 0:00,280.58,usd,,paypal,,2024-01-20 0:00
I00311,S04046,03/28/2023,0000-00-00,0000-00-00,435.71,USD,paid,,1,2023-03-28 0:00
I01666,s00786,2025-05-06,2025-06-05 0:00,,32.84,usd,partial,paypal,,2025-05-06 0:00
I01798,S00467,0000-00-00,2024-08-14 0:00,0000-00-00,449.28,USD,,invoice,0,2024-07-15 0:00
I00200,S03623,05/19/2023,0000-00-00,2023-05-19,138.2,,,card,,2023-05-19 0:00
I01338,S03709,04/27/2025,2025-05-27,,N/A,,PAID,card,FALSE,2025-04-27 0:00
I00257,S03964,04/23/2024,2024-05-23 0:00,2024-04-26,431.34,usd,refunded,,0,2024-04-23 0:00
I01372,S00319,0000-00-00,2025-03-05,02/26/2025,106.6,USD,PAID,card,0,2025-02-03 0:00
I01688,S00915,01/17/2023,2023-02-16 0:00,02/15/2023,295.9,EUR,failed,,TRUE,2023-01-17 0:00
 I00813,S03470,2024-02-16,0000-00-00,2024-03-24,N/A,,failed,paypal,FALSE,2024-02-16 0:00
I00676,S02301,2024-07-26 0:00,0000-00-00,0000-00-00,37.84,usd,,,,2024-07-26 0:00
I01712,s01798,2023-12-15 0:00,2024-01-14,0000-00-00,,GBP,FAILED,paypal,TRUE,2023-12-15 0:00
i01530,S03304,,0000-00-00,10/07/2024,403.37,,PAID,wire,TRUE,2024-10-02 0:00
I00382,S00592,10/12/2024,,2024-11-10 0:00,115.62,EUR,,card,,2024-10-12 0:00
I00233,S00988,0000-00-00,2024-11-27 0:00,0000-00-00,468.83,EUR,PAID,paypal,1,2024-10-28 0:00
I00315,S00910,02/25/2024,0000-00-00,,418.33,,FAILED,card,FALSE,2024-02-25 0:00
I00386,S03998,2025-01-04 0:00,2025-02-03,,,CAD,refunded,paypal,0,2025-01-04 0:00
I01029,S02959,2023-09-10,0000-00-00,2023-10-11,278.98,CAD,PAID,paypal,FALSE,2023-09-10 0:00
I00145,S00288,0000-00-00,,0000-00-00,,CAD,refunded,CARD,1,2023-10-02 0:00
I01556,s03989,0000-00-00,0000-00-00,,95.32,,,invoice,TRUE,2023-08-07 0:00
I01381,S04289,2024-02-16,2024-03-17 0:00,0000-00-00,16.33,,,invoice,TRUE,2024-02-16 0:00
i01145, S01282,2023-08-18 0:00,2023-09-17,0000-00-00,340.77,USD,,,FALSE,2023-08-18 0:00
I00896,S04282,0000-00-00,,0000-00-00,175.62,GBP,partial,,,2024-05-07 0:00
I01464,S02248,2025-05-20,06/19/2025,06/13/2025,399.41,GBP,PAID,card,,2025-05-20 0:00
I01022,S00875,2023-08-06 0:00,2023-09-05,0000-00-00,396.88,,,,0,2023-08-06 0:00
I00896,S04409,2023-06-21,0000-00-00,07/15/2023,151.06,usd,failed,,FALSE,2023-06-21 0:00
I01594,S02215,0000-00-00,04/15/2025,04/18/2025,172.57,,FAILED,invoice,0,2025-03-16 0:00
I01036,S03192,2023-03-05 0:00,0000-00-00,2023-04-11,25.39,GBP,partial,,TRUE,2023-03-05 0:00
I01800,S04332,2025-01-08,2025-02-07,2025-01-19,40.75,usd,,invoice,,2025-01-08 0:00
I00816,S02248,0000-00-00,2025-03-07 0:00,03/14/2025,171.7,usd,,invoice,0,2025-02-05 0:00
I01367,S01796,2024-09-09,2024-10-09,2024-09-26,,,FAILED,paypal,TRUE,2024-09-09 0:00
I01363,S00081,0000-00-00,2023-03-12,2023-03-06,303.55,usd,partial,paypal,TRUE,2023-02-10 0:00
I01368,S00920,2023-01-25,2023-02-24,0000-00-00,340.74,CAD,failed,,,2023-01-25 0:00
I00488,S02349,03/15/2023,2023-04-14,2023-03-27,134,CAD,,invoice,1,2023-03-15 0:00
I00410,S03781,0000-00-00,05/04/2024,,271.72,CAD,PAID,paypal,0,2024-04-04 0:00
I00969,S00888,12/13/2024,0000-00-00,2024-12-28,100.2,usd,refunded,paypal,FALSE,2024-12-13 0:00
I01088,S02629,0000-00-00,06/03/2025,05/04/2025,291.19,,refunded,invoice,,2025-05-04 0:00
I01589,S00087,2023-05-03,2023-06-02,2023-05-05,293.9,,failed,CARD,FALSE,2023-05-03 0:00
I00143,S02814,2025-01-08,2025-02-07,2025-01-12,245.84,CAD,partial,paypal,FALSE,2025-01-08 0:00
I00849, S02122,,0000-00-00,0000-00-00,495.54,EUR,PAID,invoice,1,2023-06-25 0:00
I00364,S02479,06/29/2023,2023-07-29,,221.96,usd,,card,1,2023-06-29 0:00
I00390,S03257,2024-12-31 0:00,0000-00-00,,300.98,CAD,FAILED,wire,0,2024-12-31 0:00
I00618, S04343,0000-00-00,0000-00-00,0000-00-00,399.01,CAD,partial,CARD,FALSE,2025-06-06 0:00
I01721,S04398,,2023-08-14 0:00,07/29/2023,400.79,GBP,,invoice,0,2023-07-15 0:00
I01415,SUB-02598,2024-06-20,07/20/2024,,257.53,GBP,FAILED,paypal,1,2024-06-20 0:00
I00490,S03121,01/10/2024,2024-02-09,0000-00-00,211.72,CAD,,,TRUE,2024-01-10 0:00
I01340,S03621,2025-03-18,,2025-04-02,125.94,USD,PAID,CARD,,2025-03-18 0:00
I00377,SUB-02307,0000-00-00,2025-04-17 0:00,03/28/2025,256.02,usd,partial,invoice,,2025-03-18 0:00
I00721,S03866,0000-00-00,0000-00-00,,N/A,,paid,,FALSE,2023-02-11 0:00
I00134,S04282,2023-11-03,0000-00-00,2023-12-09,,,failed,wire,1,2023-11-03 0:00
I00811,S00754,0000-00-00,0000-00-00,,408.29,EUR,PAID,,TRUE,2024-08-21 0:00
I01705,S01588,0000-00-00,2025-07-16,,115.9,usd,,wire,TRUE,2025-06-16 0:00
I00220,S02138,2024-08-12 0:00,2024-09-11,2024-08-22,482.77,CAD,,card,,2024-08-12 0:00
I00484,S02054,2023-06-05,2023-07-05 0:00,0000-00-00,167.26,USD,paid,,TRUE,2023-06-05 0:00
I00958,S04430,0000-00-00,0000-00-00,,319.61,,failed,,TRUE,2023-07-26 0:00
I00213,S03585,2023-11-22 0:00,2023-12-22,0000-00-00,227.58,usd,,card,0,2023-11-22 0:00
I00278,S02894,2024-11-14,,2024-12-20 0:00,383.84,,partial,wire,FALSE,2024-11-14 0:00
I01716,S03172,0000-00-00,2024-06-11 0:00,0000-00-00,385.84,usd,paid,card,,2024-05-12 0:00
I00304,S03196,0000-00-00,0000-00-00,07/03/2024,89.94,,failed,CARD,,2024-05-24 0:00
I00326,S03748,0000-00-00,0000-00-00,,94.98,usd,paid,,FALSE,2024-01-10 0:00
I01699,S01330,0000-00-00,0000-00-00,2023-11-25,66.42,,,card,0,2023-11-04 0:00
I00423,S00854,,2025-02-13 0:00,0000-00-00,328.36,EUR,FAILED,paypal,FALSE,2025-01-14 0:00
I01092,s04272,,2023-02-04,0000-00-00,,USD,partial,,FALSE,2023-01-05 0:00
I00960,S01170,0000-00-00,,,227.02,,refunded,card,TRUE,2025-06-07 0:00
I00498,S04312,2025-01-27 0:00,0000-00-00,2025-02-13,303.18,,,,FALSE,2025-01-27 0:00
I00478,S00419,2024-03-09,2024-04-08,0000-00-00,384.72,,PAID,paypal,0,2024-03-09 0:00
I00848,S02871,0000-00-00,0000-00-00,02/17/2025,95.73,GBP,failed,paypal,TRUE,2025-01-28 0:00
I01481,S00775,0000-00-00,01/01/2024,,377.13,,,invoice,,2023-12-02 0:00
I01418,S02008,,0000-00-00,,,EUR,FAILED,invoice,FALSE,2025-06-18 0:00
I00169,s01085,2025-03-26,2025-04-25,2025-04-14,137.38,CAD,refunded,wire,1,2025-03-26 0:00
I01056,S04024,2024-12-14,0000-00-00,,378.53,,PAID,,TRUE,2024-12-14 0:00
I00238,s02782,2024-03-31 0:00,2024-04-30,,,GBP,PAID,,TRUE,2024-03-31 0:00
I01135,S04202,2023-08-18,09/17/2023,,274.13,USD,,,TRUE,2023-08-18 0:00
I00170,S02956,05/25/2023,,05/29/2023,122.39,,paid,CARD,TRUE,2023-05-25 0:00
I01428,S03967,2025-04-05,0000-00-00,,144.59,CAD,PAID,invoice,TRUE,2025-04-05 0:00
I01223,S02977,0000-00-00,2024-04-15 0:00,,45.71,CAD,PAID,paypal,1,2024-03-16 0:00
I00573,S03318,2023-12-18,2024-01-17,01/16/2024,,usd,,CARD,,2023-12-18 0:00
I01345,S00236,,0000-00-00,2025-06-06 0:00,498.85,usd,failed,card,TRUE,2025-05-28 0:00
I01055,S03643,2025-02-26,03/28/2025,,369.24,CAD,,CARD,1,2025-02-26 0:00
I00431,S02511,2023-11-20,12/20/2023,0000-00-00,23.83,,PAID,invoice,TRUE,2023-11-20 0:00
I00394,S04124,2024-09-05 0:00,2024-10-05,,482.3,usd,,wire,TRUE,2024-09-05 0:00
I00720,S00212,2023-04-02 0:00,2023-05-02 0:00,0000-00-00,413.21,EUR,FAILED,CARD,FALSE,2023-04-02 0:00
I00153,S02646,05/15/2024,2024-06-14,,,GBP,,CARD,0,2024-05-15 0:00
 I00076,S00387,2025-05-06 0:00,06/05/2025,,28.93,GBP,failed,paypal,1,2025-05-06 0:00
I01653,S01030,,2023-12-31 0:00,2023-12-26 0:00,11.09,,PAID,CARD,,2023-12-01 0:00
I01506,S00875,0000-00-00,0000-00-00,,347.1,,FAILED,paypal,1,2023-01-19 0:00
I01634,S02953,07/06/2023,08/05/2023,2023-07-06,421.08,,refunded,CARD,1,2023-07-06 0:00
 I01107,S02637,2023-01-11,2023-02-10,2023-01-31,83.04,USD,FAILED,,,2023-01-11 0:00
I01199,S04481,03/12/2024,04/11/2024,,395.7,GBP,refunded,card,,2024-03-12 0:00
I01117,S04448,2025-01-02 0:00,2025-02-01,,67.2,usd,failed,paypal,,2025-01-02 0:00
I01353,S00491,0000-00-00,0000-00-00,03/04/2024,172.08,USD,FAILED,paypal,0,2024-02-08 0:00
I00253,S03577,,2023-07-02 0:00,06/10/2023,46.33,CAD,refunded,CARD,TRUE,2023-06-02 0:00
I01218,S03811,2023-06-30 0:00,0000-00-00,,134.25,USD,,,FALSE,2023-06-30 0:00
I01430,S00817,2025-03-17 0:00,2025-04-16 0:00,0000-00-00,183.02,,partial,,,2025-03-17 0:00
I01213,S02112,2025-02-07 0:00,0000-00-00,2025-02-11,391.6,USD,FAILED,,FALSE,2025-02-07 0:00
I00823,S02033,2023-10-03,0000-00-00,,94.76,CAD,,paypal,FALSE,2023-10-03 0:00
I01398,S03720,2024-02-25,2024-03-26,03/25/2024,N/A,GBP,,,,2024-02-25 0:00
I01693,s03887,2025-03-10,04/09/2025,0000-00-00,94.79,USD,failed,card,,2025-03-10 0:00
I01701,S03753,2023-05-12 0:00,2023-06-11,2023-06-01,209.73,CAD,,,TRUE,2023-05-12 0:00
I00806,S00717,0000-00-00,2024-07-14,,442.71,,PAID,wire,FALSE,2024-06-14 0:00
I00104,S00692,12/08/2023,01/07/2024,,49.4,,,invoice,FALSE,2023-12-08 0:00
I01773,SUB-01301,09/20/2023,0000-00-00,10/11/2023,,,,invoice,TRUE,2023-09-20 0:00
I00174,S00868,2023-01-21 0:00,02/20/2023,02/11/2023,130.58,usd,paid,,1,2023-01-21 0:00
I00277,S03090,2024-06-25,2024-07-25 0:00,07/05/2024,319.82,,,wire,0,2024-06-25 0:00
I01449,S04382,0000-00-00,2023-07-19 0:00,2023-06-26 0:00,129.33,GBP,FAILED,card,1,2023-06-19 0:00
I00097,S02002,0000-00-00,,,299.58,CAD,failed,CARD,TRUE,2024-07-28 0:00
I01515,S00087,05/07/2023,0000-00-00,0000-00-00,301.87,CAD,partial,card,,2023-05-07 0:00
I01413,S04249,02/15/2025,2025-03-17 0:00,,41.09,usd,,,,2025-02-15 0:00
I01035,S01634,03/26/2024,0000-00-00,2024-03-31,373.2,usd,FAILED,paypal,TRUE,2024-03-26 0:00
I00547,S03333,0000-00-00,0000-00-00,,318.74,CAD,refunded,card,0,2024-04-26 0:00
I01677,S02755,0000-00-00,0000-00-00,0000-00-00,211.66,USD,paid,,,2023-08-23 0:00
I01424,S00689,01/27/2024,2024-02-26,2024-02-14 0:00,88.93,USD,FAILED,card,TRUE,2024-01-27 0:00
I01743,S00438,2023-01-02,2023-02-01 0:00,,,CAD,PAID,invoice,,2023-01-02 0:00
I00689,S03178,2024-12-29,2025-01-28 0:00,0000-00-00,223.99,CAD,partial,card,,2024-12-29 0:00
I00742,S00339,2024-01-13,02/12/2024,0000-00-00,208.38,,,paypal,TRUE,2024-01-13 0:00
I00910,S02225,2024-02-09,,03/16/2024,320.19,USD,FAILED,paypal,FALSE,2024-02-09 0:00
I01261,S01550,,,2024-05-03 0:00,,USD,refunded,invoice,FALSE,2024-03-26 0:00
I00538,s00596,0000-00-00,0000-00-00,2023-05-13 0:00,77.12,GBP,,CARD,0,2023-05-12 0:00
I01181,S02151,0000-00-00,2024-11-12,2024-11-05,488.3,USD,refunded,wire,FALSE,2024-10-13 0:00
I01603,S00036,09/29/2024,0000-00-00,2024-11-07,353.59,,,CARD,FALSE,2024-09-29 0:00
I00529,S01218,,,,337.36,GBP,FAILED,,0,2024-10-25 0:00
I01214,S02057,0000-00-00,2024-04-12 0:00,2024-03-26 0:00,471.14,USD,,invoice,FALSE,2024-03-13 0:00
I00955,SUB-01168,0000-00-00,,2025-06-09 0:00,42.79,,refunded,,FALSE,2025-05-09 0:00
I00535,S03178,07/05/2023,2023-08-04,0000-00-00,338.63,EUR,partial,wire,,2023-07-05 0:00
I01042,S02327,0000-00-00,2024-01-16,,,,paid,paypal,0,2023-12-17 0:00
I00858,S01107,2024-12-16,01/15/2025,0000-00-00,132.56,,refunded,paypal,TRUE,2024-12-16 0:00
I00548,S00703,0000-00-00,2024-08-04 0:00,0000-00-00,,GBP,,CARD,0,2024-07-05 0:00
I00127,S00099,,2024-12-21,0000-00-00,284.83,USD,paid,CARD,FALSE,2024-11-21 0:00
I00667,S01899,2024-12-03,2025-01-02,,250.74,CAD,FAILED,wire,TRUE,2024-12-03 0:00
I01189,S00469,05/21/2024,06/20/2024,2024-06-18,89.38,EUR,refunded,CARD,,2024-05-21 0:00
I01050,S04127,0000-00-00,0000-00-00,08/27/2023,84.45,GBP,partial,invoice,TRUE,2023-08-20 0:00
I01687,s01795,0000-00-00,2023-08-30,2023-08-14 0:00,266.28,,partial,,,2023-07-31 0:00
I00887,S04405,03/30/2025,2025-04-29,04/08/2025,214.27,EUR,PAID,invoice,1,2025-03-30 0:00
I00930,S00192,2023-02-02,0000-00-00,,150.63,,FAILED,CARD,FALSE,2023-02-02 0:00
I00129,S00868,2024-07-04,2024-08-03,2024-07-31,170.9,,paid,CARD,0,2024-07-04 0:00
I01242,S02281,2023-08-18,2023-09-17,2023-09-01,N/A,EUR,paid,invoice,,2023-08-18 0:00
I01447,S01984,2024-08-08,2024-09-07 0:00,0000-00-00,398.4,GBP,refunded,wire,FALSE,2024-08-08 0:00
I01368,S00735,0000-00-00,0000-00-00,,126.14,USD,,card,TRUE,2023-03-06 0:00
I00200,S02098,07/04/2024,,,,,,CARD,TRUE,2024-07-04 0:00
I00622,S00926,2024-04-13 0:00,0000-00-00,2024-04-13,278.39,usd,PAID,,FALSE,2024-04-13 0:00
I00476,S03417,,2025-03-12,2025-03-02 0:00,393.52,USD,PAID,paypal,FALSE,2025-02-10 0:00
I01381,S03077,0000-00-00,0000-00-00,,491.75,usd,paid,wire,0,2025-04-20 0:00
I00419,s01211,2024-01-07,0000-00-00,01/10/2024,492.83,EUR,paid,CARD,1,2024-01-07 0:00
I01493,S02657,04/25/2025,2025-05-25,2025-06-02,475.39,EUR,refunded,wire,,2025-04-25 0:00
I00856,S04062,2025-06-18,,,358.35,USD,,CARD,1,2025-06-18 0:00
i00505,S01330,2023-11-29 0:00,12/29/2023,0000-00-00,460.12,,refunded,CARD,FALSE,2023-11-29 0:00
I00016,S02459,08/16/2023,2023-09-15,2023-09-15,382.53,CAD,,wire,0,2023-08-16 0:00
I01742,S04093,,0000-00-00,2024-04-08,198.02,USD,PAID,,,2024-03-07 0:00
I00594,S03471,09/09/2024,2024-10-09,0000-00-00,184.02,USD,paid,wire,0,2024-09-09 0:00
I01772,S03738,2023-08-30 0:00,0000-00-00,,14.86,EUR,FAILED,,TRUE,2023-08-30 0:00
I00949,S02364,0000-00-00,2024-04-13,,341.5,,PAID,paypal,,2024-03-14 0:00
I00309,S00202,0000-00-00,2024-02-03,,487.98,GBP,partial,CARD,FALSE,2024-01-04 0:00
I01769,S00400,2025-03-14,0000-00-00,2025-04-19,28.42,,FAILED,,,2025-03-14 0:00
i00697,S01470,0000-00-00,07/30/2023,2023-08-06,12.78,,partial,CARD,,2023-06-30 0:00
I00503,S01746,2023-05-16 0:00,2023-06-15,,175.65,GBP,,card,TRUE,2023-05-16 0:00
I01640,S01816,0000-00-00,,2023-06-24,265.39,,PAID,paypal,0,2023-05-21 0:00
I01139,S00843,0000-00-00,2024-12-28,,320.25,USD,PAID,invoice,,2024-11-28 0:00
I00708,S04141,2024-12-10,2025-01-09,,19.98,CAD,failed,,FALSE,2024-12-10 0:00
I00979,S03694,2023-12-06 0:00,0000-00-00,,66.82,CAD,PAID,,TRUE,2023-12-06 0:00
I01436,S02473,2023-05-29,2023-06-28,2023-06-14 0:00,,CAD,,,,2023-05-29 0:00
I00544,S00195,0000-00-00,2024-09-03,,246.64,EUR,,card,1,2024-08-04 0:00
I00677,S02714,0000-00-00,0000-00-00,0000-00-00,443.66,usd,,CARD,1,2023-03-16 0:00
I00289,S03006,2024-06-08,07/08/2024,07/09/2024,276.84,usd,paid,CARD,,2024-06-08 0:00
I00334,S02501,12/17/2023,01/16/2024,2024-01-17,308,USD,,CARD,FALSE,2023-12-17 0:00
I01068,S04282,12/23/2024,0000-00-00,,105.47,GBP,PAID,wire,TRUE,2024-12-23 0:00
I00444,S04104,2023-06-26,2023-07-26 0:00,07/16/2023,479.33,,PAID,wire,,2023-06-26 0:00
I01771,S02451,2023-02-18 0:00,0000-00-00,,376.22,EUR,paid,CARD,TRUE,2023-02-18 0:00
I01364,S04202,2025-04-05,2025-05-05 0:00,,488.7,EUR,PAID,,,2025-04-05 0:00
I00913,S03793,2023-06-24 0:00,2023-07-24,0000-00-00,86.95,usd,,,TRUE,2023-06-24 0:00
I01316,S02977,2024-01-03,2024-02-02,,195.68,,refunded,wire,TRUE,2024-01-03 0:00
I00403,S04394,0000-00-00,2023-06-28,2023-06-24,392.96,EUR,partial,,TRUE,2023-05-29 0:00
I00571, S03497,2023-03-26,04/25/2023,2023-04-27 0:00,334.15,EUR,FAILED,,0,2023-03-26 0:00
I00434,S02928,2023-08-02,0000-00-00,,482.25,GBP,FAILED,,FALSE,2023-08-02 0:00
I01167,s02499,2024-12-31,0000-00-00,2025-01-23,469.38,USD,,card,1,2024-12-31 0:00
I01623,S03580,2024-08-14,,,422.93,USD,,,,2024-08-14 0:00
I00365,S02251,2023-03-24,04/23/2023,,,,failed,,TRUE,2023-03-24 0:00
I01526,S02324,07/19/2023,2023-08-18 0:00,2023-08-05,219.99,CAD,,,,2023-07-19 0:00
I00194,S02545,2024-05-19,0000-00-00,06/12/2024,328.03,CAD,,,FALSE,2024-05-19 0:00
I00647,S00332,2023-03-23,0000-00-00,,485.67,usd,FAILED,card,,2023-03-23 0:00
I00295,S00475,0000-00-00,03/15/2025,0000-00-00,135.83,,FAILED,card,1,2025-02-13 0:00
I00605,S02227,2024-02-10,,0000-00-00,90.27,GBP,partial,card,1,2024-02-10 0:00
I01457,S03095,2025-06-07,0000-00-00,0000-00-00,358.51,EUR,,wire,0,2025-06-07 0:00
I01497,S00697,,2023-03-12,2023-02-27 0:00,23.36,usd,FAILED,wire,,2023-02-10 0:00
I01320,S02677,2024-04-01 0:00,,0000-00-00,275.69,usd,,wire,TRUE,2024-04-01 0:00
I00622,S01809,12/25/2023,0000-00-00,0000-00-00,87.46,GBP,partial,CARD,,2023-12-25 0:00
I00645,S03537,2023-03-09,2023-04-08 0:00,,51.98,CAD,PAID,invoice,FALSE,2023-03-09 0:00
I01197,S00370,09/06/2024,,,386.91,,partial,,1,2024-09-06 0:00
I01277,s02565,,2023-12-08 0:00,,34.4,,,card,0,2023-11-08 0:00
I00472,S03417,2025-02-05,0000-00-00,,337.31,USD,FAILED,,,2025-02-05 0:00
I00580,S03726,0000-00-00,2023-05-30,,119.3,,,,TRUE,2023-04-30 0:00
I00976,S00491,2024-05-19,2024-06-18,,N/A,CAD,PAID,CARD,,2024-05-19 0:00
I01369,S00707,0000-00-00,2024-02-17 0:00,,197.42,,,CARD,TRUE,2024-01-18 0:00
I00935,S04158,,0000-00-00,06/29/2023,267.41,CAD,,invoice,FALSE,2023-05-27 0:00
I01189,S03237,,2024-01-25,,195.54,,paid,,0,2023-12-26 0:00
I00727,S01260,0000-00-00,0000-00-00,2025-05-16 0:00,382.97,EUR,refunded,card,TRUE,2025-05-12 0:00
 I00953,S04070,05/04/2025,0000-00-00,,496.91,,,invoice,FALSE,2025-05-04 0:00
I01257,S01892,12/17/2024,01/16/2025,,169.69,CAD,,card,FALSE,2024-12-17 0:00
i00874, S03962,,09/12/2024,0000-00-00,443.49,USD,paid,card,TRUE,2024-08-13 0:00
i00676,S04108,03/07/2023,2023-04-06 0:00,2023-04-01 0:00,,,FAILED,invoice,FALSE,2023-03-07 0:00
I01264,S01121,0000-00-00,0000-00-00,,495.24,USD,refunded,invoice,TRUE,2024-03-26 0:00
I01525,S00014,2023-05-03,2023-06-02,,359.87,CAD,paid,,TRUE,2023-05-03 0:00
I00638,S00680,2023-03-14,2023-04-13 0:00,,N/A,,partial,invoice,0,2023-03-14 0:00
I01210,S02169,,0000-00-00,,257.59,USD,partial,,,2023-12-15 0:00
I00247,SUB-01209,,,03/29/2024,,GBP,failed,,,2024-02-18 0:00
I00670,S02752,10/08/2023,0000-00-00,,136.06,USD,paid,invoice,1,2023-10-08 0:00
I01045,S01606,08/12/2024,0000-00-00,0000-00-00,129.74,EUR,partial,paypal,FALSE,2024-08-12 0:00
I00070,S02547,2024-05-16,2024-06-15,0000-00-00,135.27,EUR,,wire,,2024-05-16 0:00
I01043,S04285,0000-00-00,2024-01-26,,244.42,CAD,refunded,paypal,,2023-12-27 0:00
I01694,S01597,07/08/2023,08/07/2023,,462.94,usd,PAID,card,0,2023-07-08 0:00
I00391,s03006,,,0000-00-00,469.34,,paid,wire,0,2024-11-11 0:00
I00766,S03333,0000-00-00,,09/03/2024,255.1,EUR,failed,,,2024-08-11 0:00
I00648,S00557,2023-09-16,2023-10-16,2023-09-21 0:00,,usd,PAID,,TRUE,2023-09-16 0:00
I01652,S04463,2024-03-16 0:00,0000-00-00,,35.56,CAD,failed,invoice,,2024-03-16 0:00
I01655,S03351,2024-05-20,2024-06-19 0:00,2024-06-24,451.7,,failed,invoice,FALSE,2024-05-20 0:00
I00810,s00926,0000-00-00,2024-08-27,2024-08-18,55.39,usd,refunded,,,2024-07-28 0:00
I01174,S01639,2024-05-14,2024-06-13,06/15/2024,340.66,EUR,refunded,invoice,TRUE,2024-05-14 0:00
I00971,s00002,2023-12-21,0000-00-00,2024-01-04 0:00,158.33,USD,,invoice,TRUE,2023-12-21 0:00
I01539,s03255,2024-07-03,,0000-00-00,314.51,GBP,refunded,invoice,FALSE,2024-07-03 0:00
I00927,S04411,2025-06-03 0:00,0000-00-00,0000-00-00,157.64,,PAID,,FALSE,2025-06-03 0:00
I00260,S02473,0000-00-00,2024-04-03,2024-04-13 0:00,201.88,EUR,partial,card,TRUE,2024-03-04 0:00
I00183,S00721,2023-12-31,0000-00-00,0000-00-00,,USD,paid,card,,2023-12-31 0:00
I01091, S03322,,2024-01-15 0:00,2023-12-21 0:00,47.16,GBP,FAILED,paypal,TRUE,2023-12-16 0:00
I01148,S02098,2023-01-11 0:00,2023-02-10,,440.24,EUR,refunded,wire,TRUE,2023-01-11 0:00
I01726,S03539,2025-02-24 0:00,2025-03-26,,189.05,USD,failed,paypal,,2025-02-24 0:00
I00765,S00784,2025-01-30,2025-03-01 0:00,2025-02-25,299.21,usd,paid,wire,FALSE,2025-01-30 0:00
I00856,S02624,02/04/2025,2025-03-06 0:00,2025-02-24,499.27,GBP,,wire,0,2025-02-04 0:00
I00433,S01387,,04/15/2023,2023-04-09,443.42,GBP,partial,paypal,FALSE,2023-03-16 0:00
I01060,S00598,2024-01-17 0:00,02/16/2024,,457.77,EUR,partial,paypal,FALSE,2024-01-17 0:00
I01741,S03498,,0000-00-00,,177.45,,PAID,paypal,1,2023-04-01 0:00
I00019,S02938,0000-00-00,12/12/2023,2023-12-10,185.98,USD,refunded,paypal,0,2023-11-12 0:00
i01699,S03859,07/08/2023,08/07/2023,2023-07-20,72.66,USD,failed,wire,1,2023-07-08 0:00
I00713,S00020,2023-05-22,2023-06-21,2023-06-20,483,usd,,wire,FALSE,2023-05-22 0:00
I01184,S02167,2023-08-25,09/24/2023,,393.27,USD,failed,card,TRUE,2023-08-25 0:00
I00672,S02981,01/12/2023,0000-00-00,2023-02-02,N/A,CAD,failed,paypal,TRUE,2023-01-12 0:00
I00490,S02276,2023-05-09,0000-00-00,0000-00-00,69.68,,FAILED,card,0,2023-05-09 0:00
I01394,S00327,2023-02-01,2023-03-03,03/01/2023,160.81,USD,failed,,TRUE,2023-02-01 0:00
I00699,S03846,,2025-07-06 0:00,,381.74,usd,refunded,CARD,FALSE,2025-06-06 0:00
I00846,S00993,2025-06-15,07/15/2025,,232.9,,paid,CARD,TRUE,2025-06-15 0:00
I01054,S00704,03/20/2025,0000-00-00,,477.23,,,wire,TRUE,2025-03-20 0:00
I00215,S01209,2024-01-14,02/13/2024,2024-01-30,N/A,USD,,,FALSE,2024-01-14 0:00
I00005,S03473,10/01/2024,2024-10-31,0000-00-00,190.39,CAD,,invoice,,2024-10-01 0:00
I01474,S03523,2024-06-03,2024-07-03 0:00,2024-06-04,35.72,,FAILED,invoice,0,2024-06-03 0:00
I00617,S02092,0000-00-00,2023-04-05,04/14/2023,12.24,USD,partial,,,2023-03-06 0:00
I00605,S01436,2023-08-17,09/16/2023,2023-08-23,93.89,USD,refunded,wire,FALSE,2023-08-17 0:00
I00482,S01390,0000-00-00,,2025-06-02,271.86,,paid,paypal,,2025-05-25 0:00
I00467,S03706,,0000-00-00,,N/A,,FAILED,,1,2024-11-17 0:00
I00575,S04310,2024-06-05,0000-00-00,2024-06-11 0:00,416.54,,,,0,2024-06-05 0:00
I01177,S03387,2023-11-25,2023-12-25,11/25/2023,204.48,usd,,wire,FALSE,2023-11-25 0:00
I01008,S01209,2023-10-21,2023-11-20 0:00,,243.97,USD,,invoice,0,2023-10-21 0:00
I01760, S03643,0000-00-00,2023-08-01,2023-08-09 0:00,396.97,EUR,partial,wire,FALSE,2023-07-02 0:00
 I01414,S02275,0000-00-00,08/20/2023,2023-08-28,367.82,USD,paid,,TRUE,2023-07-21 0:00
i00138,S00423,03/30/2023,0000-00-00,,232.95,,FAILED,CARD,1,2023-03-30 0:00
I01295,s01028,0000-00-00,0000-00-00,,263.54,,partial,paypal,TRUE,2023-12-31 0:00
I01183,S04478,12/03/2024,0000-00-00,0000-00-00,106.32,,,paypal,TRUE,2024-12-03 0:00
I00623,S03328,12/17/2024,0000-00-00,,381.32,,,CARD,,2024-12-17 0:00
I00234,S03986,,05/01/2024,0000-00-00,247.8,,FAILED,paypal,TRUE,2024-04-01 0:00
I00132,S00033,2024-12-15 0:00,2025-01-14,,90.08,usd,PAID,CARD,0,2024-12-15 0:00
I00104,S03420,2024-04-21,2024-05-21,2024-05-01 0:00,465.53,CAD,failed,paypal,0,2024-04-21 0:00
I00676,S03715,2025-05-01 0:00,2025-05-31 0:00,2025-05-26 0:00,430.89,,,paypal,,2025-05-01 0:00
I00202,S02819,0000-00-00,,,236.48,,,paypal,,2025-03-04 0:00
I00315,S02019,0000-00-00,0000-00-00,,247.02,GBP,,card,FALSE,2025-01-02 0:00
 I01378,S02723,07/05/2024,,2024-07-23 0:00,67.19,usd,failed,invoice,,2024-07-05 0:00
I01767,S00691,2024-01-02,2024-02-01,,358.12,,PAID,invoice,FALSE,2024-01-02 0:00
I01046,S02364,0000-00-00,08/22/2023,0000-00-00,70.75,EUR,FAILED,CARD,TRUE,2023-07-23 0:00
I00463,S00225,2024-02-20,2024-03-21,0000-00-00,N/A,,refunded,,TRUE,2024-02-20 0:00
I00493,S02152,0000-00-00,2025-05-10 0:00,,372.55,,partial,paypal,FALSE,2025-04-10 0:00
I01679,SUB-00777,2023-10-23 0:00,,10/23/2023,,usd,failed,,TRUE,2023-10-23 0:00
I00300,S04028,0000-00-00,0000-00-00,0000-00-00,263.18,GBP,partial,paypal,FALSE,2023-02-27 0:00
i00052,S02467,11/10/2023,0000-00-00,,100.11,CAD,partial,CARD,,2023-11-10 0:00
I00921,S03974,2025-01-04,2025-02-03 0:00,0000-00-00,124.64,USD,PAID,,TRUE,2025-01-04 0:00
I01668,S00708,2023-05-11 0:00,06/10/2023,,114.1,usd,refunded,wire,TRUE,2023-05-11 0:00
I01692,S00423,2024-02-15,03/16/2024,03/07/2024,,EUR,,,TRUE,2024-02-15 0:00
I00130,S03691,2024-02-18 0:00,2024-03-19,2024-03-24,286.83,,FAILED,CARD,,2024-02-18 0:00
I01320,s02797,2025-01-17,,0000-00-00,91.18,EUR,FAILED,paypal,1,2025-01-17 0:00
I00901,S03505,2025-04-22,05/22/2025,,N/A,GBP,partial,,TRUE,2025-04-22 0:00
I01153,s03485,2024-11-06 0:00,12/06/2024,2024-12-08,228.69,,paid,,TRUE,2024-11-06 0:00
I00341,S02871,2024-08-06,0000-00-00,,423.4,usd,refunded,,FALSE,2024-08-06 0:00
I01181,S03491,,09/08/2023,,131.24,EUR,paid,,,2023-08-09 0:00
I01231,S02004,03/23/2024,04/22/2024,2024-04-10,291.17,,FAILED,CARD,TRUE,2024-03-23 0:00
I00057,S03051,11/06/2023,12/06/2023,,317.89,EUR,PAID,card,,2023-11-06 0:00
I00886,S01193,2023-03-23,04/22/2023,0000-00-00,,USD,failed,card,TRUE,2023-03-23 0:00
I01003,s01620,2024-04-06,2024-05-06 0:00,0000-00-00,380.64,,refunded,card,0,2024-04-06 0:00
I00428,S01480,0000-00-00,2023-10-06,,120.45,EUR,refunded,CARD,0,2023-09-06 0:00
I01657,S02325,2023-06-02,2023-07-02,2023-06-21 0:00,301.12,USD,,,TRUE,2023-06-02 0:00
I00170,S01509,2023-04-21,2023-05-21,2023-05-11,136.77,USD,refunded,CARD,0,2023-04-21 0:00
 I01403,S00508,2024-11-02 0:00,0000-00-00,,,,failed,,0,2024-11-02 0:00
I00196,S00848,2024-08-17,2024-09-16,09/10/2024,357.55,,PAID,paypal,FALSE,2024-08-17 0:00
I00562,S03998,02/15/2023,0000-00-00,,125.27,CAD,failed,,0,2023-02-15 0:00
I00021,S00108,2025-05-03 0:00,2025-06-02,,205.54,usd,FAILED,invoice,FALSE,2025-05-03 0:00
I00830,S00185,0000-00-00,2024-10-29 0:00,,186.66,EUR,PAID,paypal,TRUE,2024-09-29 0:00
I00621,S01263,0000-00-00,07/26/2023,0000-00-00,142.13,GBP,,CARD,,2023-06-26 0:00
I00163,S02527,,2024-02-18,02/09/2024,402.61,CAD,partial,,,2024-01-19 0:00
I01681,S00071,2024-02-29,2024-03-30,,472.69,CAD,PAID,invoice,,2024-02-29 0:00
I00269,S00063,,06/22/2024,,310.84,usd,FAILED,wire,FALSE,2024-05-23 0:00
I01234,S00208,2025-04-02,0000-00-00,,344.26,USD,PAID,,TRUE,2025-04-02 0:00
I01051,S02986,,2024-04-09 0:00,2024-03-13,460.98,CAD,PAID,,1,2024-03-10 0:00
I01291,S02237,2024-05-14,2024-06-13 0:00,2024-05-16,191.27,EUR,,CARD,1,2024-05-14 0:00
I00588,S00661,,12/23/2024,,266.65,GBP,FAILED,wire,TRUE,2024-11-23 0:00
I00122,S02071,2023-06-29 0:00,0000-00-00,,478.65,USD,failed,CARD,,2023-06-29 0:00
I00435,S01896,2023-11-05 0:00,2023-12-05,2023-12-03 0:00,454.77,CAD,,,1,2023-11-05 0:00
I01571,S02440,2023-09-17,2023-10-17,0000-00-00,377.15,usd,refunded,CARD,1,2023-09-17 0:00
I00399,S04463,0000-00-00,2024-02-06,02/08/2024,376.6,,,,,2024-01-07 0:00
I00749,S04326,2024-10-23,2024-11-22 0:00,0000-00-00,147.02,EUR,partial,card,,2024-10-23 0:00
I00723,S04440,2025-03-17,2025-04-16,,,usd,failed,card,,2025-03-17 0:00
I00393,S01567,,,05/01/2025,60.21,USD,paid,,FALSE,2025-04-13 0:00
I01294,S01309,07/27/2024,2024-08-26,2024-08-22 0:00,300.42,,,card,,2024-07-27 0:00
I00403,S03401,0000-00-00,2024-09-06,2024-09-13 0:00,195.04,usd,refunded,wire,,2024-08-07 0:00
I01146,S01422,,2024-12-09,,56,USD,FAILED,wire,,2024-11-09 0:00
I00629,S01189,2025-01-03 0:00,2025-02-02 0:00,,168.49,GBP,refunded,,TRUE,2025-01-03 0:00
I00441,s00919,2024-11-03,2024-12-03,0000-00-00,322.4,GBP,failed,,1,2024-11-03 0:00
I00750,S04238,2023-12-24,01/23/2024,2024-01-13,98.93,,,,FALSE,2023-12-24 0:00
I00537,S02892,2024-05-27 0:00,06/26/2024,2024-06-16,49.9,,refunded,,,2024-05-27 0:00
I00616,S00922,2023-04-07,0000-00-00,2023-04-25,235.28,,,invoice,TRUE,2023-04-07 0:00
I00153,S02639,11/15/2024,2024-12-15 0:00,,326.94,EUR,paid,,1,2024-11-15 0:00
I00407,S03222,2023-09-13 0:00,,2023-10-05,231.36,,failed,card,,2023-09-13 0:00
I01163,S01150,2024-01-19,0000-00-00,,183.19,,paid,paypal,FALSE,2024-01-19 0:00
I00470,S02944,2024-06-08,0000-00-00,,149.72,EUR,failed,card,FALSE,2024-06-08 0:00
I00448, s02307,09/21/2023,0000-00-00,2023-10-20 0:00,414.1,,,,TRUE,2023-09-21 0:00
I00012,s04127,2023-10-23 0:00,0000-00-00,2023-11-03,264.02,,,,FALSE,2023-10-23 0:00
I00765, S00850,03/07/2024,2024-04-06 0:00,2024-03-12,493.93,USD,partial,,0,2024-03-07 0:00
I00222,S03393,2023-04-04,,04/14/2023,357.46,,,paypal,0,2023-04-04 0:00
i00806,S03746,2023-01-19,2023-02-18,2023-01-28,464.02,CAD,FAILED,card,TRUE,2023-01-19 0:00
I00922,S01423,01/30/2025,2025-03-01,02/19/2025,298.26,EUR,FAILED,card,,2025-01-30 0:00
i01288,S02096,2023-06-26 0:00,07/26/2023,,350.24,,PAID,CARD,1,2023-06-26 0:00
I00763,S02194,2024-04-04,2024-05-04,,145.75,usd,paid,CARD,,2024-04-04 0:00
 I01478,s00002,06/02/2024,0000-00-00,2024-07-02 0:00,499.34,,,invoice,1,2024-06-02 0:00
I01521,S01525,2023-09-24,2023-10-24,,301.6,,PAID,CARD,,2023-09-24 0:00
I01478,S02430,06/25/2024,0000-00-00,06/27/2024,308.83,USD,partial,paypal,TRUE,2024-06-25 0:00
I01623,S04202,0000-00-00,0000-00-00,,427.93,usd,failed,invoice,0,2023-07-08 0:00
I00614,S02749,2023-12-11,01/10/2024,0000-00-00,,USD,paid,,1,2023-12-11 0:00
I00151, S01043,12/01/2024,2024-12-31,,291.72,,partial,card,TRUE,2024-12-01 0:00
I01229,s02455,2024-11-14,0000-00-00,2024-11-25,436.26,usd,refunded,,0,2024-11-14 0:00
I01538,S02428,2024-11-14 0:00,0000-00-00,0000-00-00,341.27,usd,,wire,,2024-11-14 0:00
I00923,S00530,12/11/2023,,12/13/2023,495.69,USD,refunded,,0,2023-12-11 0:00
 I00212,S02313,0000-00-00,0000-00-00,,463.03,CAD,,card,1,2023-05-30 0:00
I00667,S00297,2024-10-05,0000-00-00,2024-10-21,270.78,,,paypal,TRUE,2024-10-05 0:00
I01349,S02456,2025-03-16 0:00,2025-04-15,0000-00-00,318.87,GBP,paid,wire,FALSE,2025-03-16 0:00
I00775, S01401,0000-00-00,0000-00-00,,231.87,EUR,partial,,TRUE,2024-11-10 0:00
I00740,S02823,2023-04-16,2023-05-16,2023-05-13,479.48,usd,,,TRUE,2023-04-16 0:00
I01188,S03709,2025-04-02,2025-05-02 0:00,2025-04-10 0:00,441.92,GBP,,card,TRUE,2025-04-02 0:00
I00343,S03859,2025-05-29,06/28/2025,0000-00-00,329.64,usd,,invoice,,2025-05-29 0:00
I01730,S02288,06/07/2025,2025-07-07,,475.07,CAD,failed,,FALSE,2025-06-07 0:00
I01119, S01924,2024-10-16 0:00,2024-11-15 0:00,,189.58,usd,,invoice,FALSE,2024-10-16 0:00
I00532,S03822,0000-00-00,05/18/2025,,210.87,usd,PAID,,FALSE,2025-04-18 0:00
I01279,S02586,2025-01-30,2025-03-01,,473.14,GBP,PAID,paypal,FALSE,2025-01-30 0:00
I00217,S00116,,01/15/2024,2024-01-13,56.82,USD,,,TRUE,2023-12-16 0:00
I00991, S01943,0000-00-00,2023-10-30 0:00,0000-00-00,39.35,CAD,PAID,CARD,FALSE,2023-09-30 0:00
I00947,S01034,06/01/2025,2025-07-01,2025-06-06 0:00,232.05,EUR,paid,,,2025-06-01 0:00
I01479,s04074,2023-12-20,0000-00-00,2023-12-31,340.61,EUR,paid,wire,TRUE,2023-12-20 0:00
I00314,S01209,2023-10-25,2023-11-24 0:00,,454.8,,,invoice,1,2023-10-25 0:00
I00731,S02327,12/07/2024,2025-01-06 0:00,,265.85,,PAID,wire,TRUE,2024-12-07 0:00
I01320,S00626,0000-00-00,07/07/2024,0000-00-00,358.24,GBP,PAID,invoice,FALSE,2024-06-07 0:00
I00691,S00170,2024-08-12,0000-00-00,08/15/2024,204.96,usd,,card,TRUE,2024-08-12 0:00
I00478,S01789,2024-10-03 0:00,0000-00-00,,430.73,EUR,FAILED,wire,TRUE,2024-10-03 0:00
I00798,S00036,,0000-00-00,0000-00-00,151.08,usd,,wire,,2023-08-02 0:00
I01518,s02872,,2024-05-07,,320.17,GBP,FAILED,card,1,2024-04-07 0:00
I01251,S02522,06/26/2024,07/26/2024,2024-07-24,274.49,GBP,refunded,card,,2024-06-26 0:00
I00051, S04227,2023-04-26,2023-05-26,,118.95,usd,PAID,card,FALSE,2023-04-26 0:00
I00234,SUB-03234,0000-00-00,2025-07-02,0000-00-00,83.56,,refunded,,FALSE,2025-06-02 0:00
I01596,S04038,2025-02-27 0:00,0000-00-00,2025-03-26,N/A,EUR,failed,,,2025-02-27 0:00
I00306, S02777,01/30/2025,0000-00-00,2025-02-06,306.1,,,,FALSE,2025-01-30 0:00
I00130,S00452,2023-05-08,0000-00-00,2023-05-21,315.67,,refunded,card,,2023-05-08 0:00
I01468,S01194,2023-05-07,06/06/2023,2023-05-14,360.55,EUR,,paypal,TRUE,2023-05-07 0:00
I00208,S03942,2023-03-30,,2023-04-29,412.7,usd,,CARD,FALSE,2023-03-30 0:00
I00014,S01465,2023-08-20,2023-09-19,,164.28,EUR,PAID,card,TRUE,2023-08-20 0:00
I01163,S01639,02/06/2024,2024-03-07 0:00,2024-02-27,308.25,EUR,,paypal,,2024-02-06 0:00
 I01064,S00843,2024-04-11,05/11/2024,,,USD,paid,wire,FALSE,2024-04-11 0:00
I01005,s02478,0000-00-00,2025-01-03,,65.95,,PAID,invoice,,2024-12-04 0:00
I01739,S01435,2023-01-08,2023-02-07,2023-01-15,11.02,,failed,,FALSE,2023-01-08 0:00
I00343,S02869,05/18/2025,0000-00-00,06/05/2025,312.2,,,CARD,TRUE,2025-05-18 0:00
I00007,S00533,06/06/2025,07/06/2025,,478.24,usd,,,,2025-06-06 0:00
I01593, SUB-02970,0000-00-00,2024-09-06,0000-00-00,65.76,,PAID,CARD,,2024-08-07 0:00
I00739,S00472,0000-00-00,0000-00-00,2024-05-27 0:00,459.86,EUR,,card,TRUE,2024-05-09 0:00
I01537,S02704,2023-06-08 0:00,2023-07-08 0:00,0000-00-00,303.08,EUR,refunded,,TRUE,2023-06-08 0:00
I01628,S02871,0000-00-00,2023-06-04 0:00,2023-06-07,477.74,EUR,PAID,wire,TRUE,2023-05-05 0:00
I00335,s03324,2025-02-25 0:00,0000-00-00,2025-03-02,254.42,USD,paid,,TRUE,2025-02-25 0:00
I00241,S00810,2023-04-12,,0000-00-00,341.6,EUR,PAID,invoice,TRUE,2023-04-12 0:00
I01607,S02304,,,,436.32,CAD,FAILED,,1,2024-04-03 0:00
I00520,S04114,0000-00-00,2023-09-22 0:00,09/25/2023,405.2,EUR,,,,2023-08-23 0:00
I01405,S02124,09/02/2024,2024-10-02 0:00,,223.25,usd,PAID,,,2024-09-02 0:00
I01140,s03861,08/14/2024,09/13/2024,,N/A,,,CARD,,2024-08-14 0:00
I01186,S02248,,10/10/2024,0000-00-00,416.53,,partial,card,,2024-09-10 0:00
I01072,S00143,2023-05-27,0000-00-00,,192.01,usd,refunded,paypal,,2023-05-27 0:00
I01306,S00098,2024-05-01,2024-05-31 0:00,2024-05-10 0:00,157.06,,,card,TRUE,2024-05-01 0:00
I01784, S01984,0000-00-00,0000-00-00,,408.14,usd,FAILED,CARD,TRUE,2024-06-05 0:00
I01496,S00513,,,,,USD,partial,wire,,2023-09-01 0:00
I00141,S01339,0000-00-00,04/24/2024,,343.78,GBP,,card,0,2024-03-25 0:00
I01019,S01725,,2025-01-07,2024-12-26,251.13,EUR,,wire,,2024-12-08 0:00
I00184,S02142,0000-00-00,0000-00-00,2023-06-04 0:00,,,FAILED,wire,1,2023-05-21 0:00
I01303,S03402,0000-00-00,0000-00-00,2024-12-16 0:00,402.43,,failed,card,TRUE,2024-12-15 0:00
I00763,S01683,08/06/2024,2024-09-05,2024-09-14 0:00,111.65,,PAID,invoice,TRUE,2024-08-06 0:00
I00935,SUB-02894,12/27/2024,0000-00-00,01/13/2025,464.26,USD,PAID,,TRUE,2024-12-27 0:00
I01181,S01255,2023-06-07,,,429.83,CAD,partial,,,2023-06-07 0:00
I00476,S02094,2024-10-16,2024-11-15 0:00,,480.7,GBP,paid,invoice,FALSE,2024-10-16 0:00
I00671,S04096,2024-08-24,2024-09-23 0:00,2024-09-06,202.26,GBP,refunded,CARD,1,2024-08-24 0:00
I01031,S02300,2024-03-09,2024-04-08 0:00,0000-00-00,139.81,GBP,failed,paypal,TRUE,2024-03-09 0:00
I00893,S00187,02/06/2023,0000-00-00,0000-00-00,,GBP,PAID,paypal,TRUE,2023-02-06 0:00
I01553,SUB-01278,2023-06-29,07/29/2023,,245.43,CAD,refunded,,1,2023-06-29 0:00
I01201,S00782,,0000-00-00,2024-02-02,265.94,USD,refunded,wire,1,2024-01-01 0:00
I00857,S02203,07/31/2024,2024-08-30 0:00,,125.3,USD,,wire,,2024-07-31 0:00
I01612,S01847,02/05/2023,2023-03-07,,496.66,,,,FALSE,2023-02-05 0:00
I00296,S03527,03/02/2023,2023-04-01,0000-00-00,53.66,USD,refunded,,TRUE,2023-03-02 0:00
I00180,S03838,0000-00-00,2025-07-19 0:00,,480.56,usd,FAILED,,FALSE,2025-06-19 0:00
I00633,S00861,0000-00-00,2023-08-12,2023-08-05 0:00,321.66,CAD,FAILED,CARD,,2023-07-13 0:00
I00669,S04062,0000-00-00,0000-00-00,03/18/2025,198.5,,,,,2025-03-14 0:00
I00961,S04395,0000-00-00,2023-08-22,,251.85,usd,PAID,card,0,2023-07-23 0:00
I01313, S03476,0000-00-00,0000-00-00,0000-00-00,495.24,,failed,CARD,TRUE,2025-02-17 0:00
I00093,S01641,0000-00-00,04/18/2024,2024-03-31,488.83,EUR,refunded,wire,0,2024-03-19 0:00
I00740,S00087,2024-11-12 0:00,12/12/2024,12/04/2024,37.56,,refunded,paypal,0,2024-11-12 0:00
I00897,S03523,0000-00-00,0000-00-00,,369.32,USD,failed,wire,FALSE,2023-05-08 0:00
I00083,s00634,2025-03-09,2025-04-08,2025-04-14,93.13,CAD,PAID,card,,2025-03-09 0:00
I00731,S00899,2025-05-17,2025-06-16,0000-00-00,120.96,CAD,paid,CARD,FALSE,2025-05-17 0:00
I00364,S03486,0000-00-00,0000-00-00,2025-04-03,397.49,usd,refunded,,FALSE,2025-03-21 0:00
I01459,S02319,2023-12-09,2024-01-08,2024-01-09,347.01,,FAILED,invoice,FALSE,2023-12-09 0:00
I00698, S04143,2023-07-01,,,418.33,USD,,invoice,,2023-07-01 0:00
I01242,s03369,0000-00-00,2023-03-11,,452.24,,PAID,,,2023-02-09 0:00
I00736,S03047,0000-00-00,2023-11-09,,296.26,CAD,PAID,paypal,FALSE,2023-10-10 0:00
I01267,S01189,0000-00-00,2023-12-18 0:00,0000-00-00,299.88,,,card,TRUE,2023-11-18 0:00
I00371,S04171,0000-00-00,0000-00-00,,66.62,usd,FAILED,paypal,FALSE,2025-05-30 0:00
I00568,S00716,12/28/2023,2024-01-27 0:00,2024-01-18,356.38,CAD,FAILED,,FALSE,2023-12-28 0:00
I00615,S00396,2024-08-10 0:00,0000-00-00,,327.1,usd,paid,,,2024-08-10 0:00
I01752,S00634,,0000-00-00,0000-00-00,,CAD,FAILED,card,TRUE,2025-02-21 0:00
I00572,S03508,2023-11-20,2023-12-20,12/03/2023,430.42,EUR,refunded,,,2023-11-20 0:00
I01120,S04108,2025-01-18,2025-02-17 0:00,,225.91,usd,,card,0,2025-01-18 0:00
I00761,S02675,2024-10-03,2024-11-02 0:00,10/20/2024,65.71,EUR,PAID,card,FALSE,2024-10-03 0:00
I00982,S00284,0000-00-00,0000-00-00,,202.02,usd,,wire,0,2024-10-04 0:00
i01226,S04132,2023-08-30 0:00,2023-09-29 0:00,2023-09-01,474.12,usd,failed,CARD,TRUE,2023-08-30 0:00
I01082,S03941,0000-00-00,0000-00-00,,281.58,,partial,,,2025-01-04 0:00
I01264,S03623,2023-11-03 0:00,12/03/2023,,82.2,usd,failed,,,2023-11-03 0:00
I00787,S00593,2023-08-28,09/27/2023,09/01/2023,306.88,USD,,card,1,2023-08-28 0:00
I01237,S01030,0000-00-00,0000-00-00,09/30/2024,191.24,EUR,,invoice,TRUE,2024-09-27 0:00
I00795,S01788,2023-10-06 0:00,2023-11-05,2023-11-06,155.23,EUR,PAID,card,FALSE,2023-10-06 0:00
I01410,S02579,0000-00-00,2024-10-09 0:00,09/27/2024,412.22,EUR,,wire,1,2024-09-09 0:00
I01705,S02120,2024-11-14,2024-12-14,,424.74,,,,TRUE,2024-11-14 0:00
I00855,S02923,05/05/2025,2025-06-04 0:00,0000-00-00,299.18,USD,paid,card,FALSE,2025-05-05 0:00
I00018,S01451,,0000-00-00,2024-05-10,N/A,,PAID,paypal,TRUE,2024-03-31 0:00
I00881,SUB-03583,2025-05-05 0:00,2025-06-04 0:00,0000-00-00,381.13,CAD,,wire,,2025-05-05 0:00
I01779,S00031,,,0000-00-00,172.49,,paid,wire,,2024-12-05 0:00
I01096,S01959,2023-12-01 0:00,0000-00-00,,370.88,,partial,CARD,TRUE,2023-12-01 0:00
I01684,S00268,2023-12-14,2024-01-13,0000-00-00,347.19,usd,refunded,CARD,0,2023-12-14 0:00
I01596,SUB-01788,01/15/2023,2023-02-14,2023-02-18,24.07,usd,FAILED,wire,FALSE,2023-01-15 0:00
I00964,S01969,2025-04-10 0:00,0000-00-00,,245.62,,paid,paypal,FALSE,2025-04-10 0:00
I00306, S01133,0000-00-00,2024-03-10 0:00,0000-00-00,25.17,,refunded,,,2024-02-09 0:00
I00278,S00868,2024-01-01 0:00,2024-01-31,2024-02-02,341.98,,PAID,paypal,,2024-01-01 0:00
I00742,S00875,02/11/2024,2024-03-12,2024-03-16 0:00,95.69,,FAILED,paypal,1,2024-02-11 0:00
I01500,S00635,2023-04-09 0:00,0000-00-00,,N/A,,FAILED,paypal,FALSE,2023-04-09 0:00
I01751,S02791,0000-00-00,04/13/2025,04/02/2025,146.16,,,wire,TRUE,2025-03-14 0:00
 I00542,S02890,05/12/2024,,,163.69,EUR,failed,wire,,2024-05-12 0:00
i01266,S00457,0000-00-00,0000-00-00,,365.2,CAD,PAID,,1,2023-02-02 0:00
I01169,S01775,2025-06-18 0:00,0000-00-00,2025-06-28,78.76,usd,partial,CARD,,2025-06-18 0:00
I00068,s00511,0000-00-00,0000-00-00,2025-02-11,298.73,usd,,paypal,TRUE,2025-01-15 0:00
I00527,S02928,,2024-09-09 0:00,,N/A,GBP,partial,,TRUE,2024-08-10 0:00
I00299,S02537,2025-02-07,2025-03-09,2025-03-05,424.72,,FAILED,CARD,,2025-02-07 0:00
I00702,S04100,08/12/2024,09/11/2024,,131.43,GBP,,card,,2024-08-12 0:00
I01060,S00221,,2025-06-20,,109.44,usd,,,FALSE,2025-05-21 0:00
I00589,s00513,0000-00-00,0000-00-00,2024-06-30,205.2,,partial,CARD,FALSE,2024-06-26 0:00
I01294,S01464,0000-00-00,0000-00-00,0000-00-00,488.98,usd,,paypal,,2024-02-08 0:00
I01185,s01311,04/16/2024,05/16/2024,,363.47,usd,PAID,CARD,0,2024-04-16 0:00
 I01747,S03705,06/13/2024,2024-07-13,2024-06-18,56.24,usd,paid,invoice,,2024-06-13 0:00
I01226,S03011,0000-00-00,0000-00-00,2023-10-28,485.91,,PAID,,1,2023-10-14 0:00
I00965,S01034,2023-08-23 0:00,09/22/2023,2023-09-15,227.91,usd,paid,card,TRUE,2023-08-23 0:00
i00874, S03962,,09/12/2024,0000-00-00,443.49,USD,paid,card,TRUE,2024-08-13 0:00
I01051,S01886,2024-11-21,,0000-00-00,376.99,usd,FAILED,CARD,FALSE,2024-11-21 0:00
I00840,S03207,2025-05-22,,05/28/2025,381.4,,,wire,FALSE,2025-05-22 0:00
I01358,S03768,0000-00-00,,12/26/2024,69.39,GBP,failed,,,2024-11-20 0:00
I01447,S03170,2023-01-02,2023-02-01 0:00,,,,partial,card,0,2023-01-02 0:00
I01524,S02745,0000-00-00,2024-03-13 0:00,,193.94,GBP,FAILED,wire,TRUE,2024-02-12 0:00
